Setting random seed to 0
DEBUG: proc shape: (1000,), agents: 6, resources: 4, n: 1000

======================================================================
VRP-RPD SOLVER
======================================================================
Problem: 999 customers, 6 agents, k=4
Heuristic: None
Genetic Programming: Yes
Warm Start: No
Gene Injection: Yes
Workers: 1 GPU + 0 CPU
Generations: 5000
======================================================================


[GP] Starting GP collection loop (timeout: 750s)...

*** [GPU 0] NEW GLOBAL BEST: 439071743.00 at gen 0 ***
    Saved to best_solution.json

[GPU 0] Gen     0 | Best: 439071743.00 | 0.5s
[GP] gpu_0 first intermediate: 439071743.00 at gen 0

*** [GPU 0] NEW GLOBAL BEST: 313278427.00 at gen 100 ***
    Saved to best_solution.json

[GPU 0] Gen   100 | Best: 313278427.00 | 13.1s
[GP] gpu_0 intermediate update: 313278427.00 at gen 100
[GP] gpu_0 intermediate update: 286511390.00 at gen 200

*** [GPU 0] NEW GLOBAL BEST: 286511390.00 at gen 200 ***
    Saved to best_solution.json

[GPU 0] Gen   200 | Best: 286511390.00 | 25.6s

*** [GPU 0] NEW GLOBAL BEST: 278362512.00 at gen 300 ***
    Saved to best_solution.json

[GPU 0] Gen   300 | Best: 278362512.00 | 38.1s
[GP] gpu_0 intermediate update: 278362512.00 at gen 300
[GP] gpu_0 intermediate update: 269850964.00 at gen 400

==================================================
GP ANALYSIS - Cycle 1
  Collected 40 solutions
==================================================

[GP] ========== GENETIC PROGRAMMING ANALYSIS STARTED ==========
[GP] Cycle: 0
[GP] Input: 40 solutions received for analysis
[GP] Fitness range: best=269850976.00, worst=286683712.00
[GP] Analysis config: blocks=True, fft=False, similarity=False
[GP] Starting analysis...
[GP] Phase 1: Extracting building blocks...

*** [GPU 0] NEW GLOBAL BEST: 269850964.00 at gen 400 ***
    Saved to best_solution.json

[GPU 0] Gen   400 | Best: 269850964.00 | 50.5s
[GP] Phase 1 complete: Found 30 building blocks
[GP] Phase 2: FFT analysis DISABLED
[GP] Phase 3: Similarity analysis DISABLED
[GP] ========== GP ANALYSIS COMPLETE ==========


[GP] ========== CANDIDATE GENERATION STARTED ==========
[GP] Generating 20 new candidate solutions
[GP] Available data: 40 top solutions, 30 building blocks, 0 FFT patterns, 0 similarity patterns
[GP] Generation strategy: 6 block-based, 6 interpolated, 8 mutated
[GP] Strategy 1: Creating 6 candidates via building block combination...
[GP] Strategy 1 complete: 6 block-based candidates created
[GP] Strategy 2: Creating 6 candidates via solution interpolation...
[GP] Strategy 2 complete: 6 interpolated candidates created
[GP] Strategy 3: Creating 8 candidates via guided mutation...
[GP] Strategy 3 complete: 8 mutated candidates created
[GP] Total candidates generated: 20
[GP] Strategy breakdown: Block=6, Interp=6, Mut=8
[GP] ========== CANDIDATE GENERATION COMPLETE ==========


*** [GPU 0] NEW GLOBAL BEST: 265260155.00 at gen 500 ***
    Saved to best_solution.json

[GPU 0] Gen   500 | Best: 265260155.00 | 62.6s
[GPU 0] Gene injection: 20 candidates injected at gen 600 (total so far: 20)

*** [GPU 0] NEW GLOBAL BEST: 261350425.00 at gen 600 ***
    Saved to best_solution.json

[GPU 0] Gen   600 | Best: 261350425.00 | 75.0s
  -> 20 candidates sent to 1/1 workers
[GP] gpu_0 intermediate update: 265260155.00 at gen 500
[GP] gpu_0 intermediate update: 261350425.00 at gen 600

*** [GPU 0] NEW GLOBAL BEST: 257080363.00 at gen 700 ***
    Saved to best_solution.json

[GPU 0] Gen   700 | Best: 257080363.00 | 87.4s
[GP] gpu_0 intermediate update: 257080363.00 at gen 700
[GP] gpu_0 intermediate update: 251950432.00 at gen 800

==================================================
GP ANALYSIS - Cycle 2
  Collected 40 solutions
==================================================

[GP] ========== GENETIC PROGRAMMING ANALYSIS STARTED ==========
[GP] Cycle: 1
[GP] Input: 40 solutions received for analysis
[GP] Fitness range: best=251945024.00, worst=261350432.00
[GP] Analysis config: blocks=True, fft=False, similarity=False
[GP] Starting analysis...
[GP] Phase 1: Extracting building blocks...

*** [GPU 0] NEW GLOBAL BEST: 251945027.00 at gen 800 ***
    Saved to best_solution.json

[GPU 0] Gen   800 | Best: 251945027.00 | 99.7s
[GP] Phase 1 complete: Found 30 building blocks
[GP] Phase 2: FFT analysis DISABLED
[GP] Phase 3: Similarity analysis DISABLED
[GP] ========== GP ANALYSIS COMPLETE ==========


[GP] ========== CANDIDATE GENERATION STARTED ==========
[GP] Generating 20 new candidate solutions
[GP] Available data: 40 top solutions, 30 building blocks, 0 FFT patterns, 0 similarity patterns
[GP] Generation strategy: 6 block-based, 6 interpolated, 8 mutated
[GP] Strategy 1: Creating 6 candidates via building block combination...
[GP] Strategy 1 complete: 6 block-based candidates created
[GP] Strategy 2: Creating 6 candidates via solution interpolation...
[GP] Strategy 2 complete: 6 interpolated candidates created
[GP] Strategy 3: Creating 8 candidates via guided mutation...
[GP] Strategy 3 complete: 8 mutated candidates created
[GP] Total candidates generated: 20
[GP] Strategy breakdown: Block=12, Interp=12, Mut=16
[GP] ========== CANDIDATE GENERATION COMPLETE ==========


*** [GPU 0] NEW GLOBAL BEST: 247927581.00 at gen 900 ***
    Saved to best_solution.json

[GPU 0] Gen   900 | Best: 247927581.00 | 112.0s
[GPU 0] Gene injection: 20 candidates injected at gen 1000 (total so far: 40)

*** [GPU 0] NEW GLOBAL BEST: 245445110.00 at gen 1000 ***
    Saved to best_solution.json

[GPU 0] Gen  1000 | Best: 245445110.00 | 124.4s
  -> 20 candidates sent to 1/1 workers
[GP] gpu_0 intermediate update: 251945027.00 at gen 800
[GP] gpu_0 intermediate update: 247927581.00 at gen 900
[GP] gpu_0 intermediate update: 245484873.00 at gen 1000
    [Checkpoint] Saved to ./results/cold_start/blocks_only/dsj1000/1R10/job_times_7_seed0_1000.json
[GP] gpu_0 intermediate update: 245445110.00 at gen 1000

*** [GPU 0] NEW GLOBAL BEST: 243967020.00 at gen 1100 ***
    Saved to best_solution.json

[GPU 0] Gen  1100 | Best: 243967020.00 | 136.6s
[GP] gpu_0 intermediate update: 243967020.00 at gen 1100
[GP] gpu_0 intermediate update: 242319769.00 at gen 1200

==================================================
GP ANALYSIS - Cycle 3
  Collected 40 solutions
==================================================

[GP] ========== GENETIC PROGRAMMING ANALYSIS STARTED ==========
[GP] Cycle: 2
[GP] Input: 40 solutions received for analysis
[GP] Fitness range: best=242201696.00, worst=245484880.00
[GP] Analysis config: blocks=True, fft=False, similarity=False
[GP] Starting analysis...
[GP] Phase 1: Extracting building blocks...

*** [GPU 0] NEW GLOBAL BEST: 242201704.00 at gen 1200 ***
    Saved to best_solution.json

[GPU 0] Gen  1200 | Best: 242201704.00 | 149.2s
[GP] Phase 1 complete: Found 30 building blocks
[GP] Phase 2: FFT analysis DISABLED
[GP] Phase 3: Similarity analysis DISABLED
[GP] ========== GP ANALYSIS COMPLETE ==========


[GP] ========== CANDIDATE GENERATION STARTED ==========
[GP] Generating 20 new candidate solutions
[GP] Available data: 40 top solutions, 30 building blocks, 0 FFT patterns, 0 similarity patterns
[GP] Generation strategy: 6 block-based, 6 interpolated, 8 mutated
[GP] Strategy 1: Creating 6 candidates via building block combination...
[GP] Strategy 1 complete: 6 block-based candidates created
[GP] Strategy 2: Creating 6 candidates via solution interpolation...
[GP] Strategy 2 complete: 6 interpolated candidates created
[GP] Strategy 3: Creating 8 candidates via guided mutation...
[GP] Strategy 3 complete: 8 mutated candidates created
[GP] Total candidates generated: 20
[GP] Strategy breakdown: Block=18, Interp=18, Mut=24
[GP] ========== CANDIDATE GENERATION COMPLETE ==========


*** [GPU 0] NEW GLOBAL BEST: 240146877.00 at gen 1300 ***
    Saved to best_solution.json

[GPU 0] Gen  1300 | Best: 240146877.00 | 161.6s
[GPU 0] Gene injection: 20 candidates injected at gen 1400 (total so far: 60)

*** [GPU 0] NEW GLOBAL BEST: 238704165.00 at gen 1400 ***
    Saved to best_solution.json

[GPU 0] Gen  1400 | Best: 238704165.00 | 174.0s
  -> 20 candidates sent to 1/1 workers
[GP] gpu_0 intermediate update: 242201704.00 at gen 1200
[GP] gpu_0 intermediate update: 240146877.00 at gen 1300
[GP] gpu_0 intermediate update: 238704165.00 at gen 1400

*** [GPU 0] NEW GLOBAL BEST: 237300193.00 at gen 1500 ***
    Saved to best_solution.json

[GPU 0] Gen  1500 | Best: 237300193.00 | 185.9s
[GP] gpu_0 intermediate update: 237300193.00 at gen 1500
[GP] gpu_0 intermediate update: 235665419.00 at gen 1600

==================================================
GP ANALYSIS - Cycle 4
  Collected 40 solutions
==================================================

[GP] ========== GENETIC PROGRAMMING ANALYSIS STARTED ==========
[GP] Cycle: 3
[GP] Input: 40 solutions received for analysis
[GP] Fitness range: best=235663184.00, worst=238704160.00
[GP] Analysis config: blocks=True, fft=False, similarity=False
[GP] Starting analysis...
[GP] Phase 1: Extracting building blocks...

*** [GPU 0] NEW GLOBAL BEST: 235663189.00 at gen 1600 ***
    Saved to best_solution.json

[GPU 0] Gen  1600 | Best: 235663189.00 | 198.2s
[GP] Phase 1 complete: Found 30 building blocks
[GP] Phase 2: FFT analysis DISABLED
[GP] Phase 3: Similarity analysis DISABLED
[GP] ========== GP ANALYSIS COMPLETE ==========


[GP] ========== CANDIDATE GENERATION STARTED ==========
[GP] Generating 20 new candidate solutions
[GP] Available data: 40 top solutions, 30 building blocks, 0 FFT patterns, 0 similarity patterns
[GP] Generation strategy: 6 block-based, 6 interpolated, 8 mutated
[GP] Strategy 1: Creating 6 candidates via building block combination...
[GP] Strategy 1 complete: 6 block-based candidates created
[GP] Strategy 2: Creating 6 candidates via solution interpolation...
[GP] Strategy 2 complete: 6 interpolated candidates created
[GP] Strategy 3: Creating 8 candidates via guided mutation...
[GP] Strategy 3 complete: 8 mutated candidates created
[GP] Total candidates generated: 20
[GP] Strategy breakdown: Block=24, Interp=24, Mut=32
[GP] ========== CANDIDATE GENERATION COMPLETE ==========


*** [GPU 0] NEW GLOBAL BEST: 234720516.00 at gen 1700 ***
    Saved to best_solution.json

[GPU 0] Gen  1700 | Best: 234720516.00 | 210.6s
[GPU 0] Gene injection: 20 candidates injected at gen 1800 (total so far: 80)

*** [GPU 0] NEW GLOBAL BEST: 233928073.00 at gen 1800 ***
  -> 20 candidates sent to 1/1 workers
[GP] gpu_0 intermediate update: 235663189.00 at gen 1600
[GP] gpu_0 intermediate update: 234720516.00 at gen 1700
[GP] gpu_0 intermediate update: 233930922.00 at gen 1800
    Saved to best_solution.json

[GPU 0] Gen  1800 | Best: 233928073.00 | 222.9s
[GP] gpu_0 intermediate update: 233928073.00 at gen 1800

*** [GPU 0] NEW GLOBAL BEST: 233175181.00 at gen 1900 ***
    Saved to best_solution.json

[GPU 0] Gen  1900 | Best: 233175181.00 | 235.4s
[GP] gpu_0 intermediate update: 233175181.00 at gen 1900
[GP] gpu_0 intermediate update: 232180948.00 at gen 2000

==================================================
GP ANALYSIS - Cycle 5
  Collected 40 solutions
==================================================

[GP] ========== GENETIC PROGRAMMING ANALYSIS STARTED ==========
[GP] Cycle: 4
[GP] Input: 40 solutions received for analysis
[GP] Fitness range: best=232180944.00, worst=233930928.00
[GP] Analysis config: blocks=True, fft=False, similarity=False
[GP] Starting analysis...
[GP] Phase 1: Extracting building blocks...

*** [GPU 0] NEW GLOBAL BEST: 232180948.00 at gen 2000 ***
    Saved to best_solution.json

[GPU 0] Gen  2000 | Best: 232180948.00 | 247.6s
[GP] Phase 1 complete: Found 30 building blocks
[GP] Phase 2: FFT analysis DISABLED
[GP] Phase 3: Similarity analysis DISABLED
[GP] ========== GP ANALYSIS COMPLETE ==========


[GP] ========== CANDIDATE GENERATION STARTED ==========
[GP] Generating 20 new candidate solutions
[GP] Available data: 40 top solutions, 30 building blocks, 0 FFT patterns, 0 similarity patterns
[GP] Generation strategy: 6 block-based, 6 interpolated, 8 mutated
[GP] Strategy 1: Creating 6 candidates via building block combination...
[GP] Strategy 1 complete: 6 block-based candidates created
[GP] Strategy 2: Creating 6 candidates via solution interpolation...
[GP] Strategy 2 complete: 6 interpolated candidates created
[GP] Strategy 3: Creating 8 candidates via guided mutation...
[GP] Strategy 3 complete: 8 mutated candidates created
[GP] Total candidates generated: 20
[GP] Strategy breakdown: Block=30, Interp=30, Mut=40
[GP] ========== CANDIDATE GENERATION COMPLETE ==========

    [Checkpoint] Saved to ./results/cold_start/blocks_only/dsj1000/1R10/job_times_7_seed0_2000.json

*** [GPU 0] NEW GLOBAL BEST: 231578669.00 at gen 2100 ***
    Saved to best_solution.json

[GPU 0] Gen  2100 | Best: 231578669.00 | 259.8s
[GPU 0] Gene injection: 20 candidates injected at gen 2200 (total so far: 100)
  -> 20 candidates sent to 1/1 workers

[CHECKPOINT] Saved A.json at gen 1000 (makespan: 232180948.00)

*** [GPU 0] NEW GLOBAL BEST: 230431455.00 at gen 2200 ***
    Saved to best_solution.json

[GPU 0] Gen  2200 | Best: 230431455.00 | 272.3s
[GP] gpu_0 intermediate update: 231578669.00 at gen 2100
[GP] gpu_0 intermediate update: 230431455.00 at gen 2200

*** [GPU 0] NEW GLOBAL BEST: 229775558.00 at gen 2300 ***
    Saved to best_solution.json

[GPU 0] Gen  2300 | Best: 229775558.00 | 284.4s
[GP] gpu_0 intermediate update: 229775558.00 at gen 2300
[GP] gpu_0 intermediate update: 228618132.00 at gen 2400

==================================================
GP ANALYSIS - Cycle 6
  Collected 40 solutions
==================================================

[GP] ========== GENETIC PROGRAMMING ANALYSIS STARTED ==========
[GP] Cycle: 5
[GP] Input: 40 solutions received for analysis
[GP] Fitness range: best=228618128.00, worst=230667232.00
[GP] Analysis config: blocks=True, fft=False, similarity=False
[GP] Starting analysis...
[GP] Phase 1: Extracting building blocks...

*** [GPU 0] NEW GLOBAL BEST: 228618132.00 at gen 2400 ***
    Saved to best_solution.json

[GPU 0] Gen  2400 | Best: 228618132.00 | 296.8s
[GP] Phase 1 complete: Found 30 building blocks
[GP] Phase 2: FFT analysis DISABLED
[GP] Phase 3: Similarity analysis DISABLED
[GP] ========== GP ANALYSIS COMPLETE ==========


[GP] ========== CANDIDATE GENERATION STARTED ==========
[GP] Generating 20 new candidate solutions
[GP] Available data: 40 top solutions, 30 building blocks, 0 FFT patterns, 0 similarity patterns
[GP] Generation strategy: 6 block-based, 6 interpolated, 8 mutated
[GP] Strategy 1: Creating 6 candidates via building block combination...
[GP] Strategy 1 complete: 6 block-based candidates created
[GP] Strategy 2: Creating 6 candidates via solution interpolation...
[GP] Strategy 2 complete: 6 interpolated candidates created
[GP] Strategy 3: Creating 8 candidates via guided mutation...
[GP] Strategy 3 complete: 8 mutated candidates created
[GP] Total candidates generated: 20
[GP] Strategy breakdown: Block=36, Interp=36, Mut=48
[GP] ========== CANDIDATE GENERATION COMPLETE ==========


*** [GPU 0] NEW GLOBAL BEST: 228103273.00 at gen 2500 ***
    Saved to best_solution.json

[GPU 0] Gen  2500 | Best: 228103273.00 | 309.3s
[GPU 0] Gene injection: 20 candidates injected at gen 2600 (total so far: 120)

*** [GPU 0] NEW GLOBAL BEST: 227894105.00 at gen 2600 ***
    Saved to best_solution.json

[GPU 0] Gen  2600 | Best: 227894105.00 | 321.6s
  -> 20 candidates sent to 1/1 workers
[GP] gpu_0 intermediate update: 228103273.00 at gen 2500
[GP] gpu_0 intermediate update: 227894105.00 at gen 2600

*** [GPU 0] NEW GLOBAL BEST: 227388924.00 at gen 2700 ***
    Saved to best_solution.json

[GPU 0] Gen  2700 | Best: 227388924.00 | 333.7s
[GP] gpu_0 intermediate update: 227388924.00 at gen 2700
[GP] gpu_0 intermediate update: 226803251.00 at gen 2800

==================================================
GP ANALYSIS - Cycle 7
  Collected 40 solutions
==================================================

[GP] ========== GENETIC PROGRAMMING ANALYSIS STARTED ==========
[GP] Cycle: 6
[GP] Input: 40 solutions received for analysis
[GP] Fitness range: best=226803248.00, worst=227894112.00
[GP] Analysis config: blocks=True, fft=False, similarity=False
[GP] Starting analysis...
[GP] Phase 1: Extracting building blocks...

*** [GPU 0] NEW GLOBAL BEST: 226803251.00 at gen 2800 ***
    Saved to best_solution.json

[GPU 0] Gen  2800 | Best: 226803251.00 | 346.3s
[GP] Phase 1 complete: Found 30 building blocks
[GP] Phase 2: FFT analysis DISABLED
[GP] Phase 3: Similarity analysis DISABLED
[GP] ========== GP ANALYSIS COMPLETE ==========


[GP] ========== CANDIDATE GENERATION STARTED ==========
[GP] Generating 20 new candidate solutions
[GP] Available data: 40 top solutions, 30 building blocks, 0 FFT patterns, 0 similarity patterns
[GP] Generation strategy: 6 block-based, 6 interpolated, 8 mutated
[GP] Strategy 1: Creating 6 candidates via building block combination...
[GP] Strategy 1 complete: 6 block-based candidates created
[GP] Strategy 2: Creating 6 candidates via solution interpolation...
[GP] Strategy 2 complete: 6 interpolated candidates created
[GP] Strategy 3: Creating 8 candidates via guided mutation...
[GP] Strategy 3 complete: 8 mutated candidates created
[GP] Total candidates generated: 20
[GP] Strategy breakdown: Block=42, Interp=42, Mut=56
[GP] ========== CANDIDATE GENERATION COMPLETE ==========


*** [GPU 0] NEW GLOBAL BEST: 226298398.00 at gen 2900 ***
    Saved to best_solution.json

[GPU 0] Gen  2900 | Best: 226298398.00 | 358.4s
[GPU 0] Gene injection: 20 candidates injected at gen 3000 (total so far: 140)

*** [GPU 0] NEW GLOBAL BEST: 225992722.00 at gen 3000 ***
    Saved to best_solution.json

[GPU 0] Gen  3000 | Best: 225992722.00 | 370.8s
  -> 20 candidates sent to 1/1 workers
[GP] gpu_0 intermediate update: 226298398.00 at gen 2900
[GP] gpu_0 intermediate update: 225992722.00 at gen 3000
    [Checkpoint] Saved to ./results/cold_start/blocks_only/dsj1000/1R10/job_times_7_seed0_3000.json

*** [GPU 0] NEW GLOBAL BEST: 225413859.00 at gen 3100 ***
    Saved to best_solution.json

[GPU 0] Gen  3100 | Best: 225413859.00 | 383.3s
[GP] gpu_0 intermediate update: 225413859.00 at gen 3100
[GP] gpu_0 intermediate update: 225044673.00 at gen 3200

==================================================
GP ANALYSIS - Cycle 8
  Collected 40 solutions
==================================================

[GP] ========== GENETIC PROGRAMMING ANALYSIS STARTED ==========
[GP] Cycle: 7
[GP] Input: 40 solutions received for analysis
[GP] Fitness range: best=225044672.00, worst=225992720.00
[GP] Analysis config: blocks=True, fft=False, similarity=False
[GP] Starting analysis...
[GP] Phase 1: Extracting building blocks...

*** [GPU 0] NEW GLOBAL BEST: 225044673.00 at gen 3200 ***
    Saved to best_solution.json

[GPU 0] Gen  3200 | Best: 225044673.00 | 395.6s
[GP] Phase 1 complete: Found 30 building blocks
[GP] Phase 2: FFT analysis DISABLED
[GP] Phase 3: Similarity analysis DISABLED
[GP] ========== GP ANALYSIS COMPLETE ==========


[GP] ========== CANDIDATE GENERATION STARTED ==========
[GP] Generating 20 new candidate solutions
[GP] Available data: 40 top solutions, 30 building blocks, 0 FFT patterns, 0 similarity patterns
[GP] Generation strategy: 6 block-based, 6 interpolated, 8 mutated
[GP] Strategy 1: Creating 6 candidates via building block combination...
[GP] Strategy 1 complete: 6 block-based candidates created
[GP] Strategy 2: Creating 6 candidates via solution interpolation...
[GP] Strategy 2 complete: 6 interpolated candidates created
[GP] Strategy 3: Creating 8 candidates via guided mutation...
[GP] Strategy 3 complete: 8 mutated candidates created
[GP] Total candidates generated: 20
[GP] Strategy breakdown: Block=48, Interp=48, Mut=64
[GP] ========== CANDIDATE GENERATION COMPLETE ==========


*** [GPU 0] NEW GLOBAL BEST: 224244994.00 at gen 3300 ***
    Saved to best_solution.json

[GPU 0] Gen  3300 | Best: 224244994.00 | 407.7s
[GPU 0] Gene injection: 20 candidates injected at gen 3400 (total so far: 160)
  -> 20 candidates sent to 1/1 workers
[GP] gpu_0 intermediate update: 224244994.00 at gen 3300
[GP] gpu_0 intermediate update: 223805269.00 at gen 3400

*** [GPU 0] NEW GLOBAL BEST: 223805269.00 at gen 3400 ***
    Saved to best_solution.json

[GPU 0] Gen  3400 | Best: 223805269.00 | 420.0s

*** [GPU 0] NEW GLOBAL BEST: 223193366.00 at gen 3500 ***
    Saved to best_solution.json

[GPU 0] Gen  3500 | Best: 223193366.00 | 431.9s
[GP] gpu_0 intermediate update: 223193366.00 at gen 3500
[GP] gpu_0 intermediate update: 222942739.00 at gen 3600

==================================================
GP ANALYSIS - Cycle 9
  Collected 40 solutions
==================================================

[GP] ========== GENETIC PROGRAMMING ANALYSIS STARTED ==========
[GP] Cycle: 8
[GP] Input: 40 solutions received for analysis
[GP] Fitness range: best=222942736.00, worst=223805264.00
[GP] Analysis config: blocks=True, fft=False, similarity=False
[GP] Starting analysis...
[GP] Phase 1: Extracting building blocks...

*** [GPU 0] NEW GLOBAL BEST: 222942739.00 at gen 3600 ***
    Saved to best_solution.json

[GPU 0] Gen  3600 | Best: 222942739.00 | 444.2s
[GP] Phase 1 complete: Found 30 building blocks
[GP] Phase 2: FFT analysis DISABLED
[GP] Phase 3: Similarity analysis DISABLED
[GP] ========== GP ANALYSIS COMPLETE ==========


[GP] ========== CANDIDATE GENERATION STARTED ==========
[GP] Generating 20 new candidate solutions
[GP] Available data: 40 top solutions, 30 building blocks, 0 FFT patterns, 0 similarity patterns
[GP] Generation strategy: 6 block-based, 6 interpolated, 8 mutated
[GP] Strategy 1: Creating 6 candidates via building block combination...
[GP] Strategy 1 complete: 6 block-based candidates created
[GP] Strategy 2: Creating 6 candidates via solution interpolation...
[GP] Strategy 2 complete: 6 interpolated candidates created
[GP] Strategy 3: Creating 8 candidates via guided mutation...
[GP] Strategy 3 complete: 8 mutated candidates created
[GP] Total candidates generated: 20
[GP] Strategy breakdown: Block=54, Interp=54, Mut=72
[GP] ========== CANDIDATE GENERATION COMPLETE ==========


*** [GPU 0] NEW GLOBAL BEST: 222696111.00 at gen 3700 ***
    Saved to best_solution.json

[GPU 0] Gen  3700 | Best: 222696111.00 | 456.0s
[GPU 0] Gene injection: 20 candidates injected at gen 3800 (total so far: 180)

*** [GPU 0] NEW GLOBAL BEST: 222301626.00 at gen 3800 ***
  -> 20 candidates sent to 1/1 workers
[GP] gpu_0 intermediate update: 222696111.00 at gen 3700
[GP] gpu_0 intermediate update: 222302023.00 at gen 3800
    Saved to best_solution.json

[GPU 0] Gen  3800 | Best: 222301626.00 | 468.1s
[GP] gpu_0 intermediate update: 222301626.00 at gen 3800

*** [GPU 0] NEW GLOBAL BEST: 222078259.00 at gen 3900 ***
    Saved to best_solution.json

[GPU 0] Gen  3900 | Best: 222078259.00 | 480.2s
[GP] gpu_0 intermediate update: 222078259.00 at gen 3900
[GP] gpu_0 intermediate update: 221901888.00 at gen 4000

==================================================
GP ANALYSIS - Cycle 10
  Collected 40 solutions
==================================================

[GP] ========== GENETIC PROGRAMMING ANALYSIS STARTED ==========
[GP] Cycle: 9
[GP] Input: 40 solutions received for analysis
[GP] Fitness range: best=221901888.00, worst=222351328.00
[GP] Analysis config: blocks=True, fft=False, similarity=False
[GP] Starting analysis...
[GP] Phase 1: Extracting building blocks...

*** [GPU 0] NEW GLOBAL BEST: 221901888.00 at gen 4000 ***
    Saved to best_solution.json

[GPU 0] Gen  4000 | Best: 221901888.00 | 492.4s
    [Checkpoint] Saved to ./results/cold_start/blocks_only/dsj1000/1R10/job_times_7_seed0_4000.json
[GP] Phase 1 complete: Found 30 building blocks
[GP] Phase 2: FFT analysis DISABLED
[GP] Phase 3: Similarity analysis DISABLED
[GP] ========== GP ANALYSIS COMPLETE ==========


[GP] ========== CANDIDATE GENERATION STARTED ==========
[GP] Generating 20 new candidate solutions
[GP] Available data: 40 top solutions, 30 building blocks, 0 FFT patterns, 0 similarity patterns
[GP] Generation strategy: 6 block-based, 6 interpolated, 8 mutated
[GP] Strategy 1: Creating 6 candidates via building block combination...
[GP] Strategy 1 complete: 6 block-based candidates created
[GP] Strategy 2: Creating 6 candidates via solution interpolation...
[GP] Strategy 2 complete: 6 interpolated candidates created
[GP] Strategy 3: Creating 8 candidates via guided mutation...
[GP] Strategy 3 complete: 8 mutated candidates created
[GP] Total candidates generated: 20
[GP] Strategy breakdown: Block=60, Interp=60, Mut=80
[GP] ========== CANDIDATE GENERATION COMPLETE ==========


*** [GPU 0] NEW GLOBAL BEST: 221652277.00 at gen 4100 ***
    Saved to best_solution.json

[GPU 0] Gen  4100 | Best: 221652277.00 | 504.7s
[GPU 0] Gene injection: 20 candidates injected at gen 4200 (total so far: 200)
  -> 20 candidates sent to 1/1 workers

[CHECKPOINT] Saved B.json at gen 2000 (makespan: 221901888.00)

*** [GPU 0] NEW GLOBAL BEST: 221305519.00 at gen 4200 ***
    Saved to best_solution.json

[GPU 0] Gen  4200 | Best: 221305519.00 | 516.8s
[GP] gpu_0 intermediate update: 221652277.00 at gen 4100
[GP] gpu_0 intermediate update: 221305519.00 at gen 4200

*** [GPU 0] NEW GLOBAL BEST: 221170582.00 at gen 4300 ***
    Saved to best_solution.json

[GPU 0] Gen  4300 | Best: 221170582.00 | 529.0s
[GP] gpu_0 intermediate update: 221170582.00 at gen 4300
[GP] gpu_0 intermediate update: 220756363.00 at gen 4400

==================================================
GP ANALYSIS - Cycle 11
  Collected 40 solutions
==================================================

[GP] ========== GENETIC PROGRAMMING ANALYSIS STARTED ==========
[GP] Cycle: 10
[GP] Input: 40 solutions received for analysis
[GP] Fitness range: best=220756368.00, worst=221305520.00
[GP] Analysis config: blocks=True, fft=False, similarity=False
[GP] Starting analysis...
[GP] Phase 1: Extracting building blocks...

*** [GPU 0] NEW GLOBAL BEST: 220756363.00 at gen 4400 ***
    Saved to best_solution.json

[GPU 0] Gen  4400 | Best: 220756363.00 | 541.2s
[GP] Phase 1 complete: Found 30 building blocks
[GP] Phase 2: FFT analysis DISABLED
[GP] Phase 3: Similarity analysis DISABLED
[GP] ========== GP ANALYSIS COMPLETE ==========


[GP] ========== CANDIDATE GENERATION STARTED ==========
[GP] Generating 20 new candidate solutions
[GP] Available data: 40 top solutions, 30 building blocks, 0 FFT patterns, 0 similarity patterns
[GP] Generation strategy: 6 block-based, 6 interpolated, 8 mutated
[GP] Strategy 1: Creating 6 candidates via building block combination...
[GP] Strategy 1 complete: 6 block-based candidates created
[GP] Strategy 2: Creating 6 candidates via solution interpolation...
[GP] Strategy 2 complete: 6 interpolated candidates created
[GP] Strategy 3: Creating 8 candidates via guided mutation...
[GP] Strategy 3 complete: 8 mutated candidates created
[GP] Total candidates generated: 20
[GP] Strategy breakdown: Block=66, Interp=66, Mut=88
[GP] ========== CANDIDATE GENERATION COMPLETE ==========


*** [GPU 0] NEW GLOBAL BEST: 220462832.00 at gen 4500 ***
    Saved to best_solution.json

[GPU 0] Gen  4500 | Best: 220462832.00 | 553.3s
[GPU 0] Gene injection: 20 candidates injected at gen 4600 (total so far: 220)

*** [GPU 0] NEW GLOBAL BEST: 220344436.00 at gen 4600 ***
    Saved to best_solution.json

[GPU 0] Gen  4600 | Best: 220344436.00 | 565.4s
  -> 20 candidates sent to 1/1 workers
[GP] gpu_0 intermediate update: 220462832.00 at gen 4500
[GP] gpu_0 intermediate update: 220344436.00 at gen 4600

*** [GPU 0] NEW GLOBAL BEST: 220277795.00 at gen 4700 ***
    Saved to best_solution.json

[GPU 0] Gen  4700 | Best: 220277795.00 | 577.3s
[GP] gpu_0 intermediate update: 220277795.00 at gen 4700
[GP] gpu_0 intermediate update: 220231161.00 at gen 4800

==================================================
GP ANALYSIS - Cycle 12
  Collected 40 solutions
==================================================

[GP] ========== GENETIC PROGRAMMING ANALYSIS STARTED ==========
[GP] Cycle: 11
[GP] Input: 40 solutions received for analysis
[GP] Fitness range: best=220231168.00, worst=220344432.00
[GP] Analysis config: blocks=True, fft=False, similarity=False
[GP] Starting analysis...
[GP] Phase 1: Extracting building blocks...

*** [GPU 0] NEW GLOBAL BEST: 220231161.00 at gen 4800 ***
    Saved to best_solution.json

[GPU 0] Gen  4800 | Best: 220231161.00 | 589.5s
[GP] Phase 1 complete: Found 30 building blocks
[GP] Phase 2: FFT analysis DISABLED
[GP] Phase 3: Similarity analysis DISABLED
[GP] ========== GP ANALYSIS COMPLETE ==========


[GP] ========== CANDIDATE GENERATION STARTED ==========
[GP] Generating 20 new candidate solutions
[GP] Available data: 40 top solutions, 30 building blocks, 0 FFT patterns, 0 similarity patterns
[GP] Generation strategy: 6 block-based, 6 interpolated, 8 mutated
[GP] Strategy 1: Creating 6 candidates via building block combination...
[GP] Strategy 1 complete: 6 block-based candidates created
[GP] Strategy 2: Creating 6 candidates via solution interpolation...
[GP] Strategy 2 complete: 6 interpolated candidates created
[GP] Strategy 3: Creating 8 candidates via guided mutation...
[GP] Strategy 3 complete: 8 mutated candidates created
[GP] Total candidates generated: 20
[GP] Strategy breakdown: Block=72, Interp=72, Mut=96
[GP] ========== CANDIDATE GENERATION COMPLETE ==========


*** [GPU 0] NEW GLOBAL BEST: 219970845.00 at gen 4900 ***
    Saved to best_solution.json

[GPU 0] Gen  4900 | Best: 219970845.00 | 601.6s
[GPU 0] Gene injection: 20 candidates injected at gen 5000 (total so far: 240)
[GPU 0] Evolution complete. Sending final results...
  -> 20 candidates sent to 1/1 workers
[GP] gpu_0 intermediate update: 219970845.00 at gen 4900
[GP] gpu_0 intermediate update: 219649567.00 at gen 5000
[GP] Worker finished: gpu_0 (best=219649567.00)

[GP] All workers finished. Total GP cycles: 12

[Final Collection] Have 1/1 workers. Waiting up to 120s for remaining...

[Critical] Attempting final result collection before terminating workers...

[Results Summary] Collected 1 results:
  gpu_0: fitness=219649567.00, intermediate=False, gen=final

======================================================================
COMPLETE
======================================================================
Best: 219649567.00 from gpu_0
Time: 616.3s
Total candidates injected: 240

Solution JSON saved to ./results/cold_start/blocks_only/dsj1000/1R10/job_times_7_seed0.json
HTML Gantt chart saved to: ./results/cold_start/blocks_only/dsj1000/1R10/job_times_7_seed0.html
