Setting random seed to 0
DEBUG: proc shape: (1000,), agents: 6, resources: 4, n: 1000

======================================================================
LOADING INITIAL SOLUTION FROM JSON
======================================================================
Loaded heuristic solution: Savings with makespan 1050791460.00
File: ./results/heuristics_only/dsj1000/1R20/job_times_3_heuristics.json
Makespan: 1050791460.00
Status: SUCCESS - Will use as warm start
======================================================================


======================================================================
VRP-RPD SOLVER
======================================================================
Problem: 999 customers, 6 agents, k=4
Heuristic: None
Genetic Programming: Yes
Warm Start: Yes
Gene Injection: Yes
Workers: 1 GPU + 0 CPU
Generations: 5000
======================================================================

Using solution from JSON file as warm start...
  JSON solution: 1050791460.00
Skipping heuristic re-computation (using JSON solution + perturbations)

Generated 6 warm start chromosomes from JSON

[GP] Starting GP collection loop (timeout: 12975s)...
[GPU 0] Warm start: 6 chromosomes

*** [GPU 0] NEW GLOBAL BEST: 777762649.00 at gen 0 ***
    Saved to best_solution.json

[GPU 0] Gen     0 | Best: 777762649.00 | 0.5s
[GP] gpu_0 first intermediate: 777762649.00 at gen 0

*** [GPU 0] NEW GLOBAL BEST: 546005141.00 at gen 100 ***
    Saved to best_solution.json

[GPU 0] Gen   100 | Best: 546005141.00 | 15.7s
[GP] gpu_0 intermediate update: 546005141.00 at gen 100
[GP] gpu_0 intermediate update: 518730561.00 at gen 200

*** [GPU 0] NEW GLOBAL BEST: 518497810.00 at gen 200 ***
    Saved to best_solution.json

[GPU 0] Gen   200 | Best: 518497810.00 | 30.8s
[GP] gpu_0 intermediate update: 518497810.00 at gen 200

*** [GPU 0] NEW GLOBAL BEST: 501339982.00 at gen 300 ***
    Saved to best_solution.json

[GPU 0] Gen   300 | Best: 501339982.00 | 46.1s
[GP] gpu_0 intermediate update: 501339982.00 at gen 300
[GP] gpu_0 intermediate update: 487504913.00 at gen 400

==================================================
GP ANALYSIS - Cycle 1
  Collected 40 solutions
==================================================

[GP] ========== GENETIC PROGRAMMING ANALYSIS STARTED ==========
[GP] Cycle: 0
[GP] Input: 40 solutions received for analysis
[GP] Fitness range: best=487499840.00, worst=518971936.00
[GP] Analysis config: blocks=True, fft=False, similarity=False
[GP] Starting analysis...
[GP] Phase 1: Extracting building blocks...

*** [GPU 0] NEW GLOBAL BEST: 487499838.00 at gen 400 ***
    Saved to best_solution.json

[GPU 0] Gen   400 | Best: 487499838.00 | 61.3s
[GP] Phase 1 complete: Found 30 building blocks
[GP] Phase 2: FFT analysis DISABLED
[GP] Phase 3: Similarity analysis DISABLED
[GP] ========== GP ANALYSIS COMPLETE ==========


[GP] ========== CANDIDATE GENERATION STARTED ==========
[GP] Generating 20 new candidate solutions
[GP] Available data: 40 top solutions, 30 building blocks, 0 FFT patterns, 0 similarity patterns
[GP] Generation strategy: 6 block-based, 6 interpolated, 8 mutated
[GP] Strategy 1: Creating 6 candidates via building block combination...
[GP] Strategy 1 complete: 6 block-based candidates created
[GP] Strategy 2: Creating 6 candidates via solution interpolation...
[GP] Strategy 2 complete: 6 interpolated candidates created
[GP] Strategy 3: Creating 8 candidates via guided mutation...
[GP] Strategy 3 complete: 8 mutated candidates created
[GP] Total candidates generated: 20
[GP] Strategy breakdown: Block=6, Interp=6, Mut=8
[GP] ========== CANDIDATE GENERATION COMPLETE ==========


*** [GPU 0] NEW GLOBAL BEST: 477433049.00 at gen 500 ***
    Saved to best_solution.json

[GPU 0] Gen   500 | Best: 477433049.00 | 76.4s
[GPU 0] Gene injection: 20 candidates injected at gen 600 (total so far: 20)
  -> 20 candidates sent to 1/1 workers
[GP] gpu_0 intermediate update: 487499838.00 at gen 400
[GP] gpu_0 intermediate update: 477433049.00 at gen 500
[GP] gpu_0 intermediate update: 466217636.00 at gen 600

*** [GPU 0] NEW GLOBAL BEST: 466073959.00 at gen 600 ***
    Saved to best_solution.json

[GPU 0] Gen   600 | Best: 466073959.00 | 91.6s
[GP] gpu_0 intermediate update: 466073959.00 at gen 600

*** [GPU 0] NEW GLOBAL BEST: 460651865.00 at gen 700 ***
    Saved to best_solution.json

[GPU 0] Gen   700 | Best: 460651865.00 | 106.6s
[GP] gpu_0 intermediate update: 460651865.00 at gen 700
[GP] gpu_0 intermediate update: 456033419.00 at gen 800

==================================================
GP ANALYSIS - Cycle 2
  Collected 40 solutions
==================================================

[GP] ========== GENETIC PROGRAMMING ANALYSIS STARTED ==========
[GP] Cycle: 1
[GP] Input: 40 solutions received for analysis
[GP] Fitness range: best=455948160.00, worst=466334304.00
[GP] Analysis config: blocks=True, fft=False, similarity=False
[GP] Starting analysis...
[GP] Phase 1: Extracting building blocks...

*** [GPU 0] NEW GLOBAL BEST: 455948164.00 at gen 800 ***
    Saved to best_solution.json

[GPU 0] Gen   800 | Best: 455948164.00 | 121.7s
[GP] Phase 1 complete: Found 30 building blocks
[GP] Phase 2: FFT analysis DISABLED
[GP] Phase 3: Similarity analysis DISABLED
[GP] ========== GP ANALYSIS COMPLETE ==========


[GP] ========== CANDIDATE GENERATION STARTED ==========
[GP] Generating 20 new candidate solutions
[GP] Available data: 40 top solutions, 30 building blocks, 0 FFT patterns, 0 similarity patterns
[GP] Generation strategy: 6 block-based, 6 interpolated, 8 mutated
[GP] Strategy 1: Creating 6 candidates via building block combination...
[GP] Strategy 1 complete: 6 block-based candidates created
[GP] Strategy 2: Creating 6 candidates via solution interpolation...
[GP] Strategy 2 complete: 6 interpolated candidates created
[GP] Strategy 3: Creating 8 candidates via guided mutation...
[GP] Strategy 3 complete: 8 mutated candidates created
[GP] Total candidates generated: 20
[GP] Strategy breakdown: Block=12, Interp=12, Mut=16
[GP] ========== CANDIDATE GENERATION COMPLETE ==========


*** [GPU 0] NEW GLOBAL BEST: 450181128.00 at gen 900 ***
    Saved to best_solution.json

[GPU 0] Gen   900 | Best: 450181128.00 | 136.9s
[GPU 0] Gene injection: 20 candidates injected at gen 1000 (total so far: 40)
  -> 20 candidates sent to 1/1 workers
[GP] gpu_0 intermediate update: 455948164.00 at gen 800
[GP] gpu_0 intermediate update: 450181128.00 at gen 900
[GP] gpu_0 intermediate update: 444852155.00 at gen 1000

*** [GPU 0] NEW GLOBAL BEST: 444770840.00 at gen 1000 ***
    Saved to best_solution.json

[GPU 0] Gen  1000 | Best: 444770840.00 | 152.1s
    [Checkpoint] Saved to ./results/warm_start/blocks_only/dsj1000/1R20/job_times_3_seed0_1000.json
[GP] gpu_0 intermediate update: 444770840.00 at gen 1000

*** [GPU 0] NEW GLOBAL BEST: 438340055.00 at gen 1100 ***
    Saved to best_solution.json

[GPU 0] Gen  1100 | Best: 438340055.00 | 167.0s
[GP] gpu_0 intermediate update: 438340055.00 at gen 1100
[GP] gpu_0 intermediate update: 434778226.00 at gen 1200

==================================================
GP ANALYSIS - Cycle 3
  Collected 40 solutions
==================================================

[GP] ========== GENETIC PROGRAMMING ANALYSIS STARTED ==========
[GP] Cycle: 2
[GP] Input: 40 solutions received for analysis
[GP] Fitness range: best=434778240.00, worst=445004736.00
[GP] Analysis config: blocks=True, fft=False, similarity=False
[GP] Starting analysis...
[GP] Phase 1: Extracting building blocks...

*** [GPU 0] NEW GLOBAL BEST: 434778226.00 at gen 1200 ***
    Saved to best_solution.json

[GPU 0] Gen  1200 | Best: 434778226.00 | 181.8s
[GP] Phase 1 complete: Found 30 building blocks
[GP] Phase 2: FFT analysis DISABLED
[GP] Phase 3: Similarity analysis DISABLED
[GP] ========== GP ANALYSIS COMPLETE ==========


[GP] ========== CANDIDATE GENERATION STARTED ==========
[GP] Generating 20 new candidate solutions
[GP] Available data: 40 top solutions, 30 building blocks, 0 FFT patterns, 0 similarity patterns
[GP] Generation strategy: 6 block-based, 6 interpolated, 8 mutated
[GP] Strategy 1: Creating 6 candidates via building block combination...
[GP] Strategy 1 complete: 6 block-based candidates created
[GP] Strategy 2: Creating 6 candidates via solution interpolation...
[GP] Strategy 2 complete: 6 interpolated candidates created
[GP] Strategy 3: Creating 8 candidates via guided mutation...
[GP] Strategy 3 complete: 8 mutated candidates created
[GP] Total candidates generated: 20
[GP] Strategy breakdown: Block=18, Interp=18, Mut=24
[GP] ========== CANDIDATE GENERATION COMPLETE ==========


*** [GPU 0] NEW GLOBAL BEST: 431693277.00 at gen 1300 ***
    Saved to best_solution.json

[GPU 0] Gen  1300 | Best: 431693277.00 | 196.0s
[GPU 0] Gene injection: 20 candidates injected at gen 1400 (total so far: 60)
  -> 20 candidates sent to 1/1 workers
[GP] gpu_0 intermediate update: 431693277.00 at gen 1300
[GP] gpu_0 intermediate update: 428125592.00 at gen 1400

*** [GPU 0] NEW GLOBAL BEST: 428125592.00 at gen 1400 ***
    Saved to best_solution.json

[GPU 0] Gen  1400 | Best: 428125592.00 | 210.8s

*** [GPU 0] NEW GLOBAL BEST: 423956536.00 at gen 1500 ***
    Saved to best_solution.json

[GPU 0] Gen  1500 | Best: 423956536.00 | 225.4s
[GP] gpu_0 intermediate update: 423956536.00 at gen 1500
[GP] gpu_0 intermediate update: 421952707.00 at gen 1600

==================================================
GP ANALYSIS - Cycle 4
  Collected 40 solutions
==================================================

[GP] ========== GENETIC PROGRAMMING ANALYSIS STARTED ==========
[GP] Cycle: 3
[GP] Input: 40 solutions received for analysis
[GP] Fitness range: best=421952704.00, worst=428125600.00
[GP] Analysis config: blocks=True, fft=False, similarity=False
[GP] Starting analysis...
[GP] Phase 1: Extracting building blocks...

*** [GPU 0] NEW GLOBAL BEST: 421952707.00 at gen 1600 ***
    Saved to best_solution.json

[GPU 0] Gen  1600 | Best: 421952707.00 | 240.2s
[GP] Phase 1 complete: Found 30 building blocks
[GP] Phase 2: FFT analysis DISABLED
[GP] Phase 3: Similarity analysis DISABLED
[GP] ========== GP ANALYSIS COMPLETE ==========


[GP] ========== CANDIDATE GENERATION STARTED ==========
[GP] Generating 20 new candidate solutions
[GP] Available data: 40 top solutions, 30 building blocks, 0 FFT patterns, 0 similarity patterns
[GP] Generation strategy: 6 block-based, 6 interpolated, 8 mutated
[GP] Strategy 1: Creating 6 candidates via building block combination...
[GP] Strategy 1 complete: 6 block-based candidates created
[GP] Strategy 2: Creating 6 candidates via solution interpolation...
[GP] Strategy 2 complete: 6 interpolated candidates created
[GP] Strategy 3: Creating 8 candidates via guided mutation...
[GP] Strategy 3 complete: 8 mutated candidates created
[GP] Total candidates generated: 20
[GP] Strategy breakdown: Block=24, Interp=24, Mut=32
[GP] ========== CANDIDATE GENERATION COMPLETE ==========


*** [GPU 0] NEW GLOBAL BEST: 419050145.00 at gen 1700 ***
    Saved to best_solution.json

[GPU 0] Gen  1700 | Best: 419050145.00 | 254.7s
[GPU 0] Gene injection: 20 candidates injected at gen 1800 (total so far: 80)
  -> 20 candidates sent to 1/1 workers
[GP] gpu_0 intermediate update: 419050145.00 at gen 1700
[GP] gpu_0 intermediate update: 416996811.00 at gen 1800

*** [GPU 0] NEW GLOBAL BEST: 416996811.00 at gen 1800 ***
    Saved to best_solution.json

[GPU 0] Gen  1800 | Best: 416996811.00 | 269.4s

*** [GPU 0] NEW GLOBAL BEST: 415705175.00 at gen 1900 ***
    Saved to best_solution.json

[GPU 0] Gen  1900 | Best: 415705175.00 | 284.1s
[GP] gpu_0 intermediate update: 415705175.00 at gen 1900
[GP] gpu_0 intermediate update: 414414236.00 at gen 2000

==================================================
GP ANALYSIS - Cycle 5
  Collected 40 solutions
==================================================

[GP] ========== GENETIC PROGRAMMING ANALYSIS STARTED ==========
[GP] Cycle: 4
[GP] Input: 40 solutions received for analysis
[GP] Fitness range: best=414414240.00, worst=417052096.00
[GP] Analysis config: blocks=True, fft=False, similarity=False
[GP] Starting analysis...
[GP] Phase 1: Extracting building blocks...

*** [GPU 0] NEW GLOBAL BEST: 414414236.00 at gen 2000 ***
    Saved to best_solution.json

[GPU 0] Gen  2000 | Best: 414414236.00 | 298.9s
    [Checkpoint] Saved to ./results/warm_start/blocks_only/dsj1000/1R20/job_times_3_seed0_2000.json
[GP] Phase 1 complete: Found 30 building blocks
[GP] Phase 2: FFT analysis DISABLED
[GP] Phase 3: Similarity analysis DISABLED
[GP] ========== GP ANALYSIS COMPLETE ==========


[GP] ========== CANDIDATE GENERATION STARTED ==========
[GP] Generating 20 new candidate solutions
[GP] Available data: 40 top solutions, 30 building blocks, 0 FFT patterns, 0 similarity patterns
[GP] Generation strategy: 6 block-based, 6 interpolated, 8 mutated
[GP] Strategy 1: Creating 6 candidates via building block combination...
[GP] Strategy 1 complete: 6 block-based candidates created
[GP] Strategy 2: Creating 6 candidates via solution interpolation...
[GP] Strategy 2 complete: 6 interpolated candidates created
[GP] Strategy 3: Creating 8 candidates via guided mutation...
[GP] Strategy 3 complete: 8 mutated candidates created
[GP] Total candidates generated: 20
[GP] Strategy breakdown: Block=30, Interp=30, Mut=40
[GP] ========== CANDIDATE GENERATION COMPLETE ==========


*** [GPU 0] NEW GLOBAL BEST: 412897063.00 at gen 2100 ***
    Saved to best_solution.json

[GPU 0] Gen  2100 | Best: 412897063.00 | 314.0s
[GPU 0] Gene injection: 20 candidates injected at gen 2200 (total so far: 100)

*** [GPU 0] NEW GLOBAL BEST: 411604020.00 at gen 2200 ***
    Saved to best_solution.json

[GPU 0] Gen  2200 | Best: 411604020.00 | 329.1s
  -> 20 candidates sent to 1/1 workers

[CHECKPOINT] Saved A.json at gen 1000 (makespan: 414414236.00)
[GP] gpu_0 intermediate update: 412897063.00 at gen 2100
[GP] gpu_0 intermediate update: 411614494.00 at gen 2200
[GP] gpu_0 intermediate update: 411604020.00 at gen 2200

*** [GPU 0] NEW GLOBAL BEST: 410264006.00 at gen 2300 ***
    Saved to best_solution.json

[GPU 0] Gen  2300 | Best: 410264006.00 | 343.2s
[GP] gpu_0 intermediate update: 410264006.00 at gen 2300
[GP] gpu_0 intermediate update: 408655934.00 at gen 2400

==================================================
GP ANALYSIS - Cycle 6
  Collected 40 solutions
==================================================

[GP] ========== GENETIC PROGRAMMING ANALYSIS STARTED ==========
[GP] Cycle: 5
[GP] Input: 40 solutions received for analysis
[GP] Fitness range: best=408655936.00, worst=411637888.00
[GP] Analysis config: blocks=True, fft=False, similarity=False
[GP] Starting analysis...
[GP] Phase 1: Extracting building blocks...

*** [GPU 0] NEW GLOBAL BEST: 408655934.00 at gen 2400 ***
    Saved to best_solution.json

[GPU 0] Gen  2400 | Best: 408655934.00 | 357.9s
[GP] Phase 1 complete: Found 30 building blocks
[GP] Phase 2: FFT analysis DISABLED
[GP] Phase 3: Similarity analysis DISABLED
[GP] ========== GP ANALYSIS COMPLETE ==========


[GP] ========== CANDIDATE GENERATION STARTED ==========
[GP] Generating 20 new candidate solutions
[GP] Available data: 40 top solutions, 30 building blocks, 0 FFT patterns, 0 similarity patterns
[GP] Generation strategy: 6 block-based, 6 interpolated, 8 mutated
[GP] Strategy 1: Creating 6 candidates via building block combination...
[GP] Strategy 1 complete: 6 block-based candidates created
[GP] Strategy 2: Creating 6 candidates via solution interpolation...
[GP] Strategy 2 complete: 6 interpolated candidates created
[GP] Strategy 3: Creating 8 candidates via guided mutation...
[GP] Strategy 3 complete: 8 mutated candidates created
[GP] Total candidates generated: 20
[GP] Strategy breakdown: Block=36, Interp=36, Mut=48
[GP] ========== CANDIDATE GENERATION COMPLETE ==========


*** [GPU 0] NEW GLOBAL BEST: 407822327.00 at gen 2500 ***
    Saved to best_solution.json

[GPU 0] Gen  2500 | Best: 407822327.00 | 372.5s
[GPU 0] Gene injection: 20 candidates injected at gen 2600 (total so far: 120)

*** [GPU 0] NEW GLOBAL BEST: 406365486.00 at gen 2600 ***
  -> 20 candidates sent to 1/1 workers
[GP] gpu_0 intermediate update: 407822327.00 at gen 2500
[GP] gpu_0 intermediate update: 406365486.00 at gen 2600
    Saved to best_solution.json

[GPU 0] Gen  2600 | Best: 406365486.00 | 387.2s

*** [GPU 0] NEW GLOBAL BEST: 404489416.00 at gen 2700 ***
    Saved to best_solution.json

[GPU 0] Gen  2700 | Best: 404489416.00 | 401.6s
[GP] gpu_0 intermediate update: 404489416.00 at gen 2700
[GP] gpu_0 intermediate update: 403205523.00 at gen 2800

==================================================
GP ANALYSIS - Cycle 7
  Collected 40 solutions
==================================================

[GP] ========== GENETIC PROGRAMMING ANALYSIS STARTED ==========
[GP] Cycle: 6
[GP] Input: 40 solutions received for analysis
[GP] Fitness range: best=403205536.00, worst=406365472.00
[GP] Analysis config: blocks=True, fft=False, similarity=False
[GP] Starting analysis...
[GP] Phase 1: Extracting building blocks...

*** [GPU 0] NEW GLOBAL BEST: 403205523.00 at gen 2800 ***
    Saved to best_solution.json

[GPU 0] Gen  2800 | Best: 403205523.00 | 416.4s
[GP] Phase 1 complete: Found 30 building blocks
[GP] Phase 2: FFT analysis DISABLED
[GP] Phase 3: Similarity analysis DISABLED
[GP] ========== GP ANALYSIS COMPLETE ==========


[GP] ========== CANDIDATE GENERATION STARTED ==========
[GP] Generating 20 new candidate solutions
[GP] Available data: 40 top solutions, 30 building blocks, 0 FFT patterns, 0 similarity patterns
[GP] Generation strategy: 6 block-based, 6 interpolated, 8 mutated
[GP] Strategy 1: Creating 6 candidates via building block combination...
[GP] Strategy 1 complete: 6 block-based candidates created
[GP] Strategy 2: Creating 6 candidates via solution interpolation...
[GP] Strategy 2 complete: 6 interpolated candidates created
[GP] Strategy 3: Creating 8 candidates via guided mutation...
[GP] Strategy 3 complete: 8 mutated candidates created
[GP] Total candidates generated: 20
[GP] Strategy breakdown: Block=42, Interp=42, Mut=56
[GP] ========== CANDIDATE GENERATION COMPLETE ==========


*** [GPU 0] NEW GLOBAL BEST: 401702532.00 at gen 2900 ***
    Saved to best_solution.json

[GPU 0] Gen  2900 | Best: 401702532.00 | 430.8s
[GPU 0] Gene injection: 20 candidates injected at gen 3000 (total so far: 140)
  -> 20 candidates sent to 1/1 workers
[GP] gpu_0 intermediate update: 401702532.00 at gen 2900
[GP] gpu_0 intermediate update: 400404580.00 at gen 3000

*** [GPU 0] NEW GLOBAL BEST: 400404580.00 at gen 3000 ***
    Saved to best_solution.json

[GPU 0] Gen  3000 | Best: 400404580.00 | 445.4s
    [Checkpoint] Saved to ./results/warm_start/blocks_only/dsj1000/1R20/job_times_3_seed0_3000.json

*** [GPU 0] NEW GLOBAL BEST: 399132986.00 at gen 3100 ***
    Saved to best_solution.json

[GPU 0] Gen  3100 | Best: 399132986.00 | 460.4s
[GP] gpu_0 intermediate update: 399132986.00 at gen 3100
[GP] gpu_0 intermediate update: 398316979.00 at gen 3200

==================================================
GP ANALYSIS - Cycle 8
  Collected 40 solutions
==================================================

[GP] ========== GENETIC PROGRAMMING ANALYSIS STARTED ==========
[GP] Cycle: 7
[GP] Input: 40 solutions received for analysis
[GP] Fitness range: best=398316992.00, worst=400457856.00
[GP] Analysis config: blocks=True, fft=False, similarity=False
[GP] Starting analysis...
[GP] Phase 1: Extracting building blocks...

*** [GPU 0] NEW GLOBAL BEST: 398316979.00 at gen 3200 ***
    Saved to best_solution.json

[GPU 0] Gen  3200 | Best: 398316979.00 | 475.3s
[GP] Phase 1 complete: Found 30 building blocks
[GP] Phase 2: FFT analysis DISABLED
[GP] Phase 3: Similarity analysis DISABLED
[GP] ========== GP ANALYSIS COMPLETE ==========


[GP] ========== CANDIDATE GENERATION STARTED ==========
[GP] Generating 20 new candidate solutions
[GP] Available data: 40 top solutions, 30 building blocks, 0 FFT patterns, 0 similarity patterns
[GP] Generation strategy: 6 block-based, 6 interpolated, 8 mutated
[GP] Strategy 1: Creating 6 candidates via building block combination...
[GP] Strategy 1 complete: 6 block-based candidates created
[GP] Strategy 2: Creating 6 candidates via solution interpolation...
[GP] Strategy 2 complete: 6 interpolated candidates created
[GP] Strategy 3: Creating 8 candidates via guided mutation...
[GP] Strategy 3 complete: 8 mutated candidates created
[GP] Total candidates generated: 20
[GP] Strategy breakdown: Block=48, Interp=48, Mut=64
[GP] ========== CANDIDATE GENERATION COMPLETE ==========


*** [GPU 0] NEW GLOBAL BEST: 397141471.00 at gen 3300 ***
    Saved to best_solution.json

[GPU 0] Gen  3300 | Best: 397141471.00 | 491.1s
[GPU 0] Gene injection: 20 candidates injected at gen 3400 (total so far: 160)
  -> 20 candidates sent to 1/1 workers
[GP] gpu_0 intermediate update: 397141471.00 at gen 3300
[GP] gpu_0 intermediate update: 396519116.00 at gen 3400

*** [GPU 0] NEW GLOBAL BEST: 396519116.00 at gen 3400 ***
    Saved to best_solution.json

[GPU 0] Gen  3400 | Best: 396519116.00 | 506.8s

*** [GPU 0] NEW GLOBAL BEST: 395149304.00 at gen 3500 ***
    Saved to best_solution.json

[GPU 0] Gen  3500 | Best: 395149304.00 | 522.7s
[GP] gpu_0 intermediate update: 395149304.00 at gen 3500
[GP] gpu_0 intermediate update: 393675168.00 at gen 3600

==================================================
GP ANALYSIS - Cycle 9
  Collected 40 solutions
==================================================

[GP] ========== GENETIC PROGRAMMING ANALYSIS STARTED ==========
[GP] Cycle: 8
[GP] Input: 40 solutions received for analysis
[GP] Fitness range: best=393675168.00, worst=396519104.00
[GP] Analysis config: blocks=True, fft=False, similarity=False
[GP] Starting analysis...
[GP] Phase 1: Extracting building blocks...

*** [GPU 0] NEW GLOBAL BEST: 393675168.00 at gen 3600 ***
    Saved to best_solution.json

[GPU 0] Gen  3600 | Best: 393675168.00 | 538.4s
[GP] Phase 1 complete: Found 30 building blocks
[GP] Phase 2: FFT analysis DISABLED
[GP] Phase 3: Similarity analysis DISABLED
[GP] ========== GP ANALYSIS COMPLETE ==========


[GP] ========== CANDIDATE GENERATION STARTED ==========
[GP] Generating 20 new candidate solutions
[GP] Available data: 40 top solutions, 30 building blocks, 0 FFT patterns, 0 similarity patterns
[GP] Generation strategy: 6 block-based, 6 interpolated, 8 mutated
[GP] Strategy 1: Creating 6 candidates via building block combination...
[GP] Strategy 1 complete: 6 block-based candidates created
[GP] Strategy 2: Creating 6 candidates via solution interpolation...
[GP] Strategy 2 complete: 6 interpolated candidates created
[GP] Strategy 3: Creating 8 candidates via guided mutation...
[GP] Strategy 3 complete: 8 mutated candidates created
[GP] Total candidates generated: 20
[GP] Strategy breakdown: Block=54, Interp=54, Mut=72
[GP] ========== CANDIDATE GENERATION COMPLETE ==========


*** [GPU 0] NEW GLOBAL BEST: 392385790.00 at gen 3700 ***
    Saved to best_solution.json

[GPU 0] Gen  3700 | Best: 392385790.00 | 554.2s
[GPU 0] Gene injection: 20 candidates injected at gen 3800 (total so far: 180)
  -> 20 candidates sent to 1/1 workers
[GP] gpu_0 intermediate update: 392385790.00 at gen 3700
[GP] gpu_0 intermediate update: 391397612.00 at gen 3800

*** [GPU 0] NEW GLOBAL BEST: 391295391.00 at gen 3800 ***
    Saved to best_solution.json

[GPU 0] Gen  3800 | Best: 391295391.00 | 570.2s
[GP] gpu_0 intermediate update: 391295391.00 at gen 3800

*** [GPU 0] NEW GLOBAL BEST: 390694134.00 at gen 3900 ***
    Saved to best_solution.json

[GPU 0] Gen  3900 | Best: 390694134.00 | 585.8s
[GP] gpu_0 intermediate update: 390694134.00 at gen 3900
[GP] gpu_0 intermediate update: 390349805.00 at gen 4000

==================================================
GP ANALYSIS - Cycle 10
  Collected 40 solutions
==================================================

[GP] ========== GENETIC PROGRAMMING ANALYSIS STARTED ==========
[GP] Cycle: 9
[GP] Input: 40 solutions received for analysis
[GP] Fitness range: best=390349792.00, worst=391397600.00
[GP] Analysis config: blocks=True, fft=False, similarity=False
[GP] Starting analysis...
[GP] Phase 1: Extracting building blocks...

*** [GPU 0] NEW GLOBAL BEST: 390349805.00 at gen 4000 ***
    Saved to best_solution.json

[GPU 0] Gen  4000 | Best: 390349805.00 | 601.9s
[GP] Phase 1 complete: Found 30 building blocks
[GP] Phase 2: FFT analysis DISABLED
[GP] Phase 3: Similarity analysis DISABLED
[GP] ========== GP ANALYSIS COMPLETE ==========


[GP] ========== CANDIDATE GENERATION STARTED ==========
[GP] Generating 20 new candidate solutions
[GP] Available data: 40 top solutions, 30 building blocks, 0 FFT patterns, 0 similarity patterns
[GP] Generation strategy: 6 block-based, 6 interpolated, 8 mutated
[GP] Strategy 1: Creating 6 candidates via building block combination...
[GP] Strategy 1 complete: 6 block-based candidates created
[GP] Strategy 2: Creating 6 candidates via solution interpolation...
[GP] Strategy 2 complete: 6 interpolated candidates created
[GP] Strategy 3: Creating 8 candidates via guided mutation...
[GP] Strategy 3 complete: 8 mutated candidates created
[GP] Total candidates generated: 20
[GP] Strategy breakdown: Block=60, Interp=60, Mut=80
[GP] ========== CANDIDATE GENERATION COMPLETE ==========

    [Checkpoint] Saved to ./results/warm_start/blocks_only/dsj1000/1R20/job_times_3_seed0_4000.json

*** [GPU 0] NEW GLOBAL BEST: 389276771.00 at gen 4100 ***
    Saved to best_solution.json

[GPU 0] Gen  4100 | Best: 389276771.00 | 618.0s
[GPU 0] Gene injection: 20 candidates injected at gen 4200 (total so far: 200)

*** [GPU 0] NEW GLOBAL BEST: 388291362.00 at gen 4200 ***
    Saved to best_solution.json

[GPU 0] Gen  4200 | Best: 388291362.00 | 633.6s
  -> 20 candidates sent to 1/1 workers

[CHECKPOINT] Saved B.json at gen 2000 (makespan: 390349805.00)
[GP] gpu_0 intermediate update: 389276771.00 at gen 4100
[GP] gpu_0 intermediate update: 388291362.00 at gen 4200

*** [GPU 0] NEW GLOBAL BEST: 387601181.00 at gen 4300 ***
    Saved to best_solution.json

[GPU 0] Gen  4300 | Best: 387601181.00 | 649.5s
[GP] gpu_0 intermediate update: 387601181.00 at gen 4300
[GP] gpu_0 intermediate update: 386889557.00 at gen 4400

==================================================
GP ANALYSIS - Cycle 11
  Collected 40 solutions
==================================================

[GP] ========== GENETIC PROGRAMMING ANALYSIS STARTED ==========
[GP] Cycle: 10
[GP] Input: 40 solutions received for analysis
[GP] Fitness range: best=386889568.00, worst=388366432.00
[GP] Analysis config: blocks=True, fft=False, similarity=False
[GP] Starting analysis...
[GP] Phase 1: Extracting building blocks...

*** [GPU 0] NEW GLOBAL BEST: 386889557.00 at gen 4400 ***
    Saved to best_solution.json

[GPU 0] Gen  4400 | Best: 386889557.00 | 665.7s
[GP] Phase 1 complete: Found 30 building blocks
[GP] Phase 2: FFT analysis DISABLED
[GP] Phase 3: Similarity analysis DISABLED
[GP] ========== GP ANALYSIS COMPLETE ==========


[GP] ========== CANDIDATE GENERATION STARTED ==========
[GP] Generating 20 new candidate solutions
[GP] Available data: 40 top solutions, 30 building blocks, 0 FFT patterns, 0 similarity patterns
[GP] Generation strategy: 6 block-based, 6 interpolated, 8 mutated
[GP] Strategy 1: Creating 6 candidates via building block combination...
[GP] Strategy 1 complete: 6 block-based candidates created
[GP] Strategy 2: Creating 6 candidates via solution interpolation...
[GP] Strategy 2 complete: 6 interpolated candidates created
[GP] Strategy 3: Creating 8 candidates via guided mutation...
[GP] Strategy 3 complete: 8 mutated candidates created
[GP] Total candidates generated: 20
[GP] Strategy breakdown: Block=66, Interp=66, Mut=88
[GP] ========== CANDIDATE GENERATION COMPLETE ==========


*** [GPU 0] NEW GLOBAL BEST: 385981409.00 at gen 4500 ***
    Saved to best_solution.json

[GPU 0] Gen  4500 | Best: 385981409.00 | 681.3s
[GPU 0] Gene injection: 20 candidates injected at gen 4600 (total so far: 220)
  -> 20 candidates sent to 1/1 workers
[GP] gpu_0 intermediate update: 385981409.00 at gen 4500
[GP] gpu_0 intermediate update: 385198824.00 at gen 4600

*** [GPU 0] NEW GLOBAL BEST: 385198824.00 at gen 4600 ***
    Saved to best_solution.json

[GPU 0] Gen  4600 | Best: 385198824.00 | 696.7s

*** [GPU 0] NEW GLOBAL BEST: 384583434.00 at gen 4700 ***
    Saved to best_solution.json

[GPU 0] Gen  4700 | Best: 384583434.00 | 712.6s
[GP] gpu_0 intermediate update: 384583434.00 at gen 4700
[GP] gpu_0 intermediate update: 383109083.00 at gen 4800

==================================================
GP ANALYSIS - Cycle 12
  Collected 40 solutions
==================================================

[GP] ========== GENETIC PROGRAMMING ANALYSIS STARTED ==========
[GP] Cycle: 11
[GP] Input: 40 solutions received for analysis
[GP] Fitness range: best=383109088.00, worst=385198816.00
[GP] Analysis config: blocks=True, fft=False, similarity=False
[GP] Starting analysis...
[GP] Phase 1: Extracting building blocks...

*** [GPU 0] NEW GLOBAL BEST: 383109083.00 at gen 4800 ***
    Saved to best_solution.json

[GPU 0] Gen  4800 | Best: 383109083.00 | 728.2s
[GP] Phase 1 complete: Found 30 building blocks
[GP] Phase 2: FFT analysis DISABLED
[GP] Phase 3: Similarity analysis DISABLED
[GP] ========== GP ANALYSIS COMPLETE ==========


[GP] ========== CANDIDATE GENERATION STARTED ==========
[GP] Generating 20 new candidate solutions
[GP] Available data: 40 top solutions, 30 building blocks, 0 FFT patterns, 0 similarity patterns
[GP] Generation strategy: 6 block-based, 6 interpolated, 8 mutated
[GP] Strategy 1: Creating 6 candidates via building block combination...
[GP] Strategy 1 complete: 6 block-based candidates created
[GP] Strategy 2: Creating 6 candidates via solution interpolation...
[GP] Strategy 2 complete: 6 interpolated candidates created
[GP] Strategy 3: Creating 8 candidates via guided mutation...
[GP] Strategy 3 complete: 8 mutated candidates created
[GP] Total candidates generated: 20
[GP] Strategy breakdown: Block=72, Interp=72, Mut=96
[GP] ========== CANDIDATE GENERATION COMPLETE ==========


*** [GPU 0] NEW GLOBAL BEST: 382344894.00 at gen 4900 ***
    Saved to best_solution.json

[GPU 0] Gen  4900 | Best: 382344894.00 | 743.5s
[GPU 0] Gene injection: 20 candidates injected at gen 5000 (total so far: 240)
[GPU 0] Evolution complete. Sending final results...
  -> 20 candidates sent to 1/1 workers
[GP] gpu_0 intermediate update: 382344894.00 at gen 4900
[GP] gpu_0 intermediate update: 381572012.00 at gen 5000
[GP] Worker finished: gpu_0 (best=381572012.00)

[GP] All workers finished. Total GP cycles: 12

[Final Collection] Have 1/1 workers. Waiting up to 120s for remaining...

[Critical] Attempting final result collection before terminating workers...

[Results Summary] Collected 1 results:
  gpu_0: fitness=381572012.00, intermediate=False, gen=final

======================================================================
COMPLETE
======================================================================
Best: 381572012.00 from gpu_0
  (Improved 63.7% over heuristic 1050791460.00)
Time: 762.4s
Total candidates injected: 240

Solution JSON saved to ./results/warm_start/blocks_only/dsj1000/1R20/job_times_3_seed0.json
HTML Gantt chart saved to: ./results/warm_start/blocks_only/dsj1000/1R20/job_times_3_seed0.html
