Setting random seed to 0
DEBUG: proc shape: (1000,), agents: 6, resources: 4, n: 1000

======================================================================
LOADING INITIAL SOLUTION FROM JSON
======================================================================
Loaded heuristic solution: Savings with makespan 1042585439.00
File: ./results/heuristics_only/dsj1000/1R20/job_times_8_heuristics.json
Makespan: 1042585439.00
Status: SUCCESS - Will use as warm start
======================================================================


======================================================================
VRP-RPD SOLVER
======================================================================
Problem: 999 customers, 6 agents, k=4
Heuristic: None
Genetic Programming: Yes
Warm Start: Yes
Gene Injection: Yes
Workers: 1 GPU + 0 CPU
Generations: 5000
======================================================================

Using solution from JSON file as warm start...
  JSON solution: 1042585439.00
Skipping heuristic re-computation (using JSON solution + perturbations)

Generated 6 warm start chromosomes from JSON

[GP] Starting GP collection loop (timeout: 12975s)...
[GPU 0] Warm start: 6 chromosomes

*** [GPU 0] NEW GLOBAL BEST: 802044631.00 at gen 0 ***
    Saved to best_solution.json

[GPU 0] Gen     0 | Best: 802044631.00 | 0.4s
[GP] gpu_0 first intermediate: 802044631.00 at gen 0

*** [GPU 0] NEW GLOBAL BEST: 575313073.00 at gen 100 ***
    Saved to best_solution.json

[GPU 0] Gen   100 | Best: 575313073.00 | 11.9s
[GP] gpu_0 intermediate update: 575313073.00 at gen 100
[GP] gpu_0 intermediate update: 551161914.00 at gen 200

*** [GPU 0] NEW GLOBAL BEST: 551161914.00 at gen 200 ***
    Saved to best_solution.json

[GPU 0] Gen   200 | Best: 551161914.00 | 23.5s

*** [GPU 0] NEW GLOBAL BEST: 534531903.00 at gen 300 ***
    Saved to best_solution.json

[GPU 0] Gen   300 | Best: 534531903.00 | 35.0s
[GP] gpu_0 intermediate update: 534531903.00 at gen 300
[GP] gpu_0 intermediate update: 518949244.00 at gen 400

==================================================
GP ANALYSIS - Cycle 1
  Collected 40 solutions
==================================================

[GP] ========== GENETIC PROGRAMMING ANALYSIS STARTED ==========
[GP] Cycle: 0
[GP] Input: 40 solutions received for analysis
[GP] Fitness range: best=518949248.00, worst=551697536.00
[GP] Analysis config: blocks=True, fft=False, similarity=False
[GP] Starting analysis...
[GP] Phase 1: Extracting building blocks...

*** [GPU 0] NEW GLOBAL BEST: 518949244.00 at gen 400 ***
    Saved to best_solution.json

[GPU 0] Gen   400 | Best: 518949244.00 | 46.7s
[GP] Phase 1 complete: Found 30 building blocks
[GP] Phase 2: FFT analysis DISABLED
[GP] Phase 3: Similarity analysis DISABLED
[GP] ========== GP ANALYSIS COMPLETE ==========


[GP] ========== CANDIDATE GENERATION STARTED ==========
[GP] Generating 20 new candidate solutions
[GP] Available data: 40 top solutions, 30 building blocks, 0 FFT patterns, 0 similarity patterns
[GP] Generation strategy: 6 block-based, 6 interpolated, 8 mutated
[GP] Strategy 1: Creating 6 candidates via building block combination...
[GP] Strategy 1 complete: 6 block-based candidates created
[GP] Strategy 2: Creating 6 candidates via solution interpolation...
[GP] Strategy 2 complete: 6 interpolated candidates created
[GP] Strategy 3: Creating 8 candidates via guided mutation...
[GP] Strategy 3 complete: 8 mutated candidates created
[GP] Total candidates generated: 20
[GP] Strategy breakdown: Block=6, Interp=6, Mut=8
[GP] ========== CANDIDATE GENERATION COMPLETE ==========


*** [GPU 0] NEW GLOBAL BEST: 506978925.00 at gen 500 ***
    Saved to best_solution.json

[GPU 0] Gen   500 | Best: 506978925.00 | 58.1s
[GPU 0] Gene injection: 20 candidates injected at gen 600 (total so far: 20)
  -> 20 candidates sent to 1/1 workers
[GP] gpu_0 intermediate update: 506978925.00 at gen 500
[GP] gpu_0 intermediate update: 497641724.00 at gen 600

*** [GPU 0] NEW GLOBAL BEST: 497641724.00 at gen 600 ***
    Saved to best_solution.json

[GPU 0] Gen   600 | Best: 497641724.00 | 69.7s

*** [GPU 0] NEW GLOBAL BEST: 489507783.00 at gen 700 ***
    Saved to best_solution.json

[GPU 0] Gen   700 | Best: 489507783.00 | 81.2s
[GP] gpu_0 intermediate update: 489507783.00 at gen 700
[GP] gpu_0 intermediate update: 484411041.00 at gen 800

==================================================
GP ANALYSIS - Cycle 2
  Collected 40 solutions
==================================================

[GP] ========== GENETIC PROGRAMMING ANALYSIS STARTED ==========
[GP] Cycle: 1
[GP] Input: 40 solutions received for analysis
[GP] Fitness range: best=484411040.00, worst=498387424.00
[GP] Analysis config: blocks=True, fft=False, similarity=False
[GP] Starting analysis...
[GP] Phase 1: Extracting building blocks...

*** [GPU 0] NEW GLOBAL BEST: 484411041.00 at gen 800 ***
    Saved to best_solution.json

[GPU 0] Gen   800 | Best: 484411041.00 | 93.0s
[GP] Phase 1 complete: Found 30 building blocks
[GP] Phase 2: FFT analysis DISABLED
[GP] Phase 3: Similarity analysis DISABLED
[GP] ========== GP ANALYSIS COMPLETE ==========


[GP] ========== CANDIDATE GENERATION STARTED ==========
[GP] Generating 20 new candidate solutions
[GP] Available data: 40 top solutions, 30 building blocks, 0 FFT patterns, 0 similarity patterns
[GP] Generation strategy: 6 block-based, 6 interpolated, 8 mutated
[GP] Strategy 1: Creating 6 candidates via building block combination...
[GP] Strategy 1 complete: 6 block-based candidates created
[GP] Strategy 2: Creating 6 candidates via solution interpolation...
[GP] Strategy 2 complete: 6 interpolated candidates created
[GP] Strategy 3: Creating 8 candidates via guided mutation...
[GP] Strategy 3 complete: 8 mutated candidates created
[GP] Total candidates generated: 20
[GP] Strategy breakdown: Block=12, Interp=12, Mut=16
[GP] ========== CANDIDATE GENERATION COMPLETE ==========


*** [GPU 0] NEW GLOBAL BEST: 477627387.00 at gen 900 ***
    Saved to best_solution.json

[GPU 0] Gen   900 | Best: 477627387.00 | 104.5s
[GPU 0] Gene injection: 20 candidates injected at gen 1000 (total so far: 40)

*** [GPU 0] NEW GLOBAL BEST: 471189764.00 at gen 1000 ***
    Saved to best_solution.json

[GPU 0] Gen  1000 | Best: 471189764.00 | 115.7s
  -> 20 candidates sent to 1/1 workers
[GP] gpu_0 intermediate update: 477627387.00 at gen 900
[GP] gpu_0 intermediate update: 471938689.00 at gen 1000
    [Checkpoint] Saved to ./results/warm_start/blocks_only/dsj1000/1R20/job_times_8_seed0_1000.json
[GP] gpu_0 intermediate update: 471189764.00 at gen 1000

*** [GPU 0] NEW GLOBAL BEST: 465636406.00 at gen 1100 ***
    Saved to best_solution.json

[GPU 0] Gen  1100 | Best: 465636406.00 | 127.4s
[GP] gpu_0 intermediate update: 465636406.00 at gen 1100
[GP] gpu_0 intermediate update: 459855474.00 at gen 1200

==================================================
GP ANALYSIS - Cycle 3
  Collected 40 solutions
==================================================

[GP] ========== GENETIC PROGRAMMING ANALYSIS STARTED ==========
[GP] Cycle: 2
[GP] Input: 40 solutions received for analysis
[GP] Fitness range: best=459855488.00, worst=472020896.00
[GP] Analysis config: blocks=True, fft=False, similarity=False
[GP] Starting analysis...
[GP] Phase 1: Extracting building blocks...

*** [GPU 0] NEW GLOBAL BEST: 459855474.00 at gen 1200 ***
    Saved to best_solution.json

[GPU 0] Gen  1200 | Best: 459855474.00 | 138.7s
[GP] Phase 1 complete: Found 30 building blocks
[GP] Phase 2: FFT analysis DISABLED
[GP] Phase 3: Similarity analysis DISABLED
[GP] ========== GP ANALYSIS COMPLETE ==========


[GP] ========== CANDIDATE GENERATION STARTED ==========
[GP] Generating 20 new candidate solutions
[GP] Available data: 40 top solutions, 30 building blocks, 0 FFT patterns, 0 similarity patterns
[GP] Generation strategy: 6 block-based, 6 interpolated, 8 mutated
[GP] Strategy 1: Creating 6 candidates via building block combination...
[GP] Strategy 1 complete: 6 block-based candidates created
[GP] Strategy 2: Creating 6 candidates via solution interpolation...
[GP] Strategy 2 complete: 6 interpolated candidates created
[GP] Strategy 3: Creating 8 candidates via guided mutation...
[GP] Strategy 3 complete: 8 mutated candidates created
[GP] Total candidates generated: 20
[GP] Strategy breakdown: Block=18, Interp=18, Mut=24
[GP] ========== CANDIDATE GENERATION COMPLETE ==========


*** [GPU 0] NEW GLOBAL BEST: 455567850.00 at gen 1300 ***
    Saved to best_solution.json

[GPU 0] Gen  1300 | Best: 455567850.00 | 150.0s
[GPU 0] Gene injection: 20 candidates injected at gen 1400 (total so far: 60)

*** [GPU 0] NEW GLOBAL BEST: 452987566.00 at gen 1400 ***
  -> 20 candidates sent to 1/1 workers
[GP] gpu_0 intermediate update: 455567850.00 at gen 1300
[GP] gpu_0 intermediate update: 452987566.00 at gen 1400
    Saved to best_solution.json

[GPU 0] Gen  1400 | Best: 452987566.00 | 161.3s

*** [GPU 0] NEW GLOBAL BEST: 449692621.00 at gen 1500 ***
    Saved to best_solution.json

[GPU 0] Gen  1500 | Best: 449692621.00 | 172.7s
[GP] gpu_0 intermediate update: 449692621.00 at gen 1500
[GP] gpu_0 intermediate update: 446453049.00 at gen 1600

==================================================
GP ANALYSIS - Cycle 4
  Collected 40 solutions
==================================================

[GP] ========== GENETIC PROGRAMMING ANALYSIS STARTED ==========
[GP] Cycle: 3
[GP] Input: 40 solutions received for analysis
[GP] Fitness range: best=446320544.00, worst=452987552.00
[GP] Analysis config: blocks=True, fft=False, similarity=False
[GP] Starting analysis...
[GP] Phase 1: Extracting building blocks...

*** [GPU 0] NEW GLOBAL BEST: 446320548.00 at gen 1600 ***
    Saved to best_solution.json

[GPU 0] Gen  1600 | Best: 446320548.00 | 184.4s
[GP] Phase 1 complete: Found 30 building blocks
[GP] Phase 2: FFT analysis DISABLED
[GP] Phase 3: Similarity analysis DISABLED
[GP] ========== GP ANALYSIS COMPLETE ==========


[GP] ========== CANDIDATE GENERATION STARTED ==========
[GP] Generating 20 new candidate solutions
[GP] Available data: 40 top solutions, 30 building blocks, 0 FFT patterns, 0 similarity patterns
[GP] Generation strategy: 6 block-based, 6 interpolated, 8 mutated
[GP] Strategy 1: Creating 6 candidates via building block combination...
[GP] Strategy 1 complete: 6 block-based candidates created
[GP] Strategy 2: Creating 6 candidates via solution interpolation...
[GP] Strategy 2 complete: 6 interpolated candidates created
[GP] Strategy 3: Creating 8 candidates via guided mutation...
[GP] Strategy 3 complete: 8 mutated candidates created
[GP] Total candidates generated: 20
[GP] Strategy breakdown: Block=24, Interp=24, Mut=32
[GP] ========== CANDIDATE GENERATION COMPLETE ==========


*** [GPU 0] NEW GLOBAL BEST: 443561586.00 at gen 1700 ***
    Saved to best_solution.json

[GPU 0] Gen  1700 | Best: 443561586.00 | 194.8s
[GPU 0] Gene injection: 20 candidates injected at gen 1800 (total so far: 80)

*** [GPU 0] NEW GLOBAL BEST: 441339702.00 at gen 1800 ***
    Saved to best_solution.json

[GPU 0] Gen  1800 | Best: 441339702.00 | 205.2s
  -> 20 candidates sent to 1/1 workers
[GP] gpu_0 intermediate update: 446320548.00 at gen 1600
[GP] gpu_0 intermediate update: 443561586.00 at gen 1700
[GP] gpu_0 intermediate update: 441401661.00 at gen 1800
[GP] gpu_0 intermediate update: 441339702.00 at gen 1800

*** [GPU 0] NEW GLOBAL BEST: 438230754.00 at gen 1900 ***
    Saved to best_solution.json

[GPU 0] Gen  1900 | Best: 438230754.00 | 215.6s
[GP] gpu_0 intermediate update: 438230754.00 at gen 1900
[GP] gpu_0 intermediate update: 435248926.00 at gen 2000

==================================================
GP ANALYSIS - Cycle 5
  Collected 40 solutions
==================================================

[GP] ========== GENETIC PROGRAMMING ANALYSIS STARTED ==========
[GP] Cycle: 4
[GP] Input: 40 solutions received for analysis
[GP] Fitness range: best=435248928.00, worst=441521024.00
[GP] Analysis config: blocks=True, fft=False, similarity=False
[GP] Starting analysis...
[GP] Phase 1: Extracting building blocks...

*** [GPU 0] NEW GLOBAL BEST: 435248926.00 at gen 2000 ***
    Saved to best_solution.json

[GPU 0] Gen  2000 | Best: 435248926.00 | 226.2s
    [Checkpoint] Saved to ./results/warm_start/blocks_only/dsj1000/1R20/job_times_8_seed0_2000.json
[GP] Phase 1 complete: Found 30 building blocks
[GP] Phase 2: FFT analysis DISABLED
[GP] Phase 3: Similarity analysis DISABLED
[GP] ========== GP ANALYSIS COMPLETE ==========


[GP] ========== CANDIDATE GENERATION STARTED ==========
[GP] Generating 20 new candidate solutions
[GP] Available data: 40 top solutions, 30 building blocks, 0 FFT patterns, 0 similarity patterns
[GP] Generation strategy: 6 block-based, 6 interpolated, 8 mutated
[GP] Strategy 1: Creating 6 candidates via building block combination...
[GP] Strategy 1 complete: 6 block-based candidates created
[GP] Strategy 2: Creating 6 candidates via solution interpolation...
[GP] Strategy 2 complete: 6 interpolated candidates created
[GP] Strategy 3: Creating 8 candidates via guided mutation...
[GP] Strategy 3 complete: 8 mutated candidates created
[GP] Total candidates generated: 20
[GP] Strategy breakdown: Block=30, Interp=30, Mut=40
[GP] ========== CANDIDATE GENERATION COMPLETE ==========


*** [GPU 0] NEW GLOBAL BEST: 432378334.00 at gen 2100 ***
    Saved to best_solution.json

[GPU 0] Gen  2100 | Best: 432378334.00 | 236.7s
[GPU 0] Gene injection: 20 candidates injected at gen 2200 (total so far: 100)

*** [GPU 0] NEW GLOBAL BEST: 429429604.00 at gen 2200 ***
  -> 20 candidates sent to 1/1 workers

[CHECKPOINT] Saved A.json at gen 1000 (makespan: 435248926.00)
    Saved to best_solution.json

[GPU 0] Gen  2200 | Best: 429429604.00 | 247.2s
[GP] gpu_0 intermediate update: 432378334.00 at gen 2100
[GP] gpu_0 intermediate update: 429429604.00 at gen 2200

*** [GPU 0] NEW GLOBAL BEST: 427849606.00 at gen 2300 ***
    Saved to best_solution.json

[GPU 0] Gen  2300 | Best: 427849606.00 | 257.7s
[GP] gpu_0 intermediate update: 427849606.00 at gen 2300
[GP] gpu_0 intermediate update: 425806833.00 at gen 2400

==================================================
GP ANALYSIS - Cycle 6
  Collected 40 solutions
==================================================

[GP] ========== GENETIC PROGRAMMING ANALYSIS STARTED ==========
[GP] Cycle: 5
[GP] Input: 40 solutions received for analysis
[GP] Fitness range: best=425806848.00, worst=429446208.00
[GP] Analysis config: blocks=True, fft=False, similarity=False
[GP] Starting analysis...
[GP] Phase 1: Extracting building blocks...

*** [GPU 0] NEW GLOBAL BEST: 425806833.00 at gen 2400 ***
    Saved to best_solution.json

[GPU 0] Gen  2400 | Best: 425806833.00 | 268.5s
[GP] Phase 1 complete: Found 30 building blocks
[GP] Phase 2: FFT analysis DISABLED
[GP] Phase 3: Similarity analysis DISABLED
[GP] ========== GP ANALYSIS COMPLETE ==========


[GP] ========== CANDIDATE GENERATION STARTED ==========
[GP] Generating 20 new candidate solutions
[GP] Available data: 40 top solutions, 30 building blocks, 0 FFT patterns, 0 similarity patterns
[GP] Generation strategy: 6 block-based, 6 interpolated, 8 mutated
[GP] Strategy 1: Creating 6 candidates via building block combination...
[GP] Strategy 1 complete: 6 block-based candidates created
[GP] Strategy 2: Creating 6 candidates via solution interpolation...
[GP] Strategy 2 complete: 6 interpolated candidates created
[GP] Strategy 3: Creating 8 candidates via guided mutation...
[GP] Strategy 3 complete: 8 mutated candidates created
[GP] Total candidates generated: 20
[GP] Strategy breakdown: Block=36, Interp=36, Mut=48
[GP] ========== CANDIDATE GENERATION COMPLETE ==========


*** [GPU 0] NEW GLOBAL BEST: 424527395.00 at gen 2500 ***
    Saved to best_solution.json

[GPU 0] Gen  2500 | Best: 424527395.00 | 279.2s
[GPU 0] Gene injection: 20 candidates injected at gen 2600 (total so far: 120)

*** [GPU 0] NEW GLOBAL BEST: 422756251.00 at gen 2600 ***
    Saved to best_solution.json

[GPU 0] Gen  2600 | Best: 422756251.00 | 289.7s
  -> 20 candidates sent to 1/1 workers
[GP] gpu_0 intermediate update: 424527395.00 at gen 2500
[GP] gpu_0 intermediate update: 422756251.00 at gen 2600

*** [GPU 0] NEW GLOBAL BEST: 421289618.00 at gen 2700 ***
    Saved to best_solution.json

[GPU 0] Gen  2700 | Best: 421289618.00 | 300.1s
[GP] gpu_0 intermediate update: 421289618.00 at gen 2700
[GP] gpu_0 intermediate update: 420651523.00 at gen 2800

==================================================
GP ANALYSIS - Cycle 7
  Collected 40 solutions
==================================================

[GP] ========== GENETIC PROGRAMMING ANALYSIS STARTED ==========
[GP] Cycle: 6
[GP] Input: 40 solutions received for analysis
[GP] Fitness range: best=420651520.00, worst=422756256.00
[GP] Analysis config: blocks=True, fft=False, similarity=False
[GP] Starting analysis...
[GP] Phase 1: Extracting building blocks...

*** [GPU 0] NEW GLOBAL BEST: 420651523.00 at gen 2800 ***
    Saved to best_solution.json

[GPU 0] Gen  2800 | Best: 420651523.00 | 310.6s
[GP] Phase 1 complete: Found 30 building blocks
[GP] Phase 2: FFT analysis DISABLED
[GP] Phase 3: Similarity analysis DISABLED
[GP] ========== GP ANALYSIS COMPLETE ==========


[GP] ========== CANDIDATE GENERATION STARTED ==========
[GP] Generating 20 new candidate solutions
[GP] Available data: 40 top solutions, 30 building blocks, 0 FFT patterns, 0 similarity patterns
[GP] Generation strategy: 6 block-based, 6 interpolated, 8 mutated
[GP] Strategy 1: Creating 6 candidates via building block combination...
[GP] Strategy 1 complete: 6 block-based candidates created
[GP] Strategy 2: Creating 6 candidates via solution interpolation...
[GP] Strategy 2 complete: 6 interpolated candidates created
[GP] Strategy 3: Creating 8 candidates via guided mutation...
[GP] Strategy 3 complete: 8 mutated candidates created
[GP] Total candidates generated: 20
[GP] Strategy breakdown: Block=42, Interp=42, Mut=56
[GP] ========== CANDIDATE GENERATION COMPLETE ==========


*** [GPU 0] NEW GLOBAL BEST: 419292609.00 at gen 2900 ***
    Saved to best_solution.json

[GPU 0] Gen  2900 | Best: 419292609.00 | 321.0s
[GPU 0] Gene injection: 20 candidates injected at gen 3000 (total so far: 140)

*** [GPU 0] NEW GLOBAL BEST: 418342374.00 at gen 3000 ***
    Saved to best_solution.json

[GPU 0] Gen  3000 | Best: 418342374.00 | 331.5s
  -> 20 candidates sent to 1/1 workers
[GP] gpu_0 intermediate update: 419292609.00 at gen 2900
[GP] gpu_0 intermediate update: 418342374.00 at gen 3000
    [Checkpoint] Saved to ./results/warm_start/blocks_only/dsj1000/1R20/job_times_8_seed0_3000.json

*** [GPU 0] NEW GLOBAL BEST: 417816243.00 at gen 3100 ***
    Saved to best_solution.json

[GPU 0] Gen  3100 | Best: 417816243.00 | 342.0s
[GP] gpu_0 intermediate update: 417816243.00 at gen 3100
[GP] gpu_0 intermediate update: 416881948.00 at gen 3200

==================================================
GP ANALYSIS - Cycle 8
  Collected 40 solutions
==================================================

[GP] ========== GENETIC PROGRAMMING ANALYSIS STARTED ==========
[GP] Cycle: 7
[GP] Input: 40 solutions received for analysis
[GP] Fitness range: best=416881952.00, worst=418342368.00
[GP] Analysis config: blocks=True, fft=False, similarity=False
[GP] Starting analysis...
[GP] Phase 1: Extracting building blocks...

*** [GPU 0] NEW GLOBAL BEST: 416881948.00 at gen 3200 ***
    Saved to best_solution.json

[GPU 0] Gen  3200 | Best: 416881948.00 | 352.5s
[GP] Phase 1 complete: Found 30 building blocks
[GP] Phase 2: FFT analysis DISABLED
[GP] Phase 3: Similarity analysis DISABLED
[GP] ========== GP ANALYSIS COMPLETE ==========


[GP] ========== CANDIDATE GENERATION STARTED ==========
[GP] Generating 20 new candidate solutions
[GP] Available data: 40 top solutions, 30 building blocks, 0 FFT patterns, 0 similarity patterns
[GP] Generation strategy: 6 block-based, 6 interpolated, 8 mutated
[GP] Strategy 1: Creating 6 candidates via building block combination...
[GP] Strategy 1 complete: 6 block-based candidates created
[GP] Strategy 2: Creating 6 candidates via solution interpolation...
[GP] Strategy 2 complete: 6 interpolated candidates created
[GP] Strategy 3: Creating 8 candidates via guided mutation...
[GP] Strategy 3 complete: 8 mutated candidates created
[GP] Total candidates generated: 20
[GP] Strategy breakdown: Block=48, Interp=48, Mut=64
[GP] ========== CANDIDATE GENERATION COMPLETE ==========


*** [GPU 0] NEW GLOBAL BEST: 415148871.00 at gen 3300 ***
    Saved to best_solution.json

[GPU 0] Gen  3300 | Best: 415148871.00 | 362.9s
[GPU 0] Gene injection: 20 candidates injected at gen 3400 (total so far: 160)

*** [GPU 0] NEW GLOBAL BEST: 414279635.00 at gen 3400 ***
    Saved to best_solution.json

[GPU 0] Gen  3400 | Best: 414279635.00 | 373.4s
  -> 20 candidates sent to 1/1 workers
[GP] gpu_0 intermediate update: 415148871.00 at gen 3300
[GP] gpu_0 intermediate update: 414279635.00 at gen 3400

*** [GPU 0] NEW GLOBAL BEST: 412665132.00 at gen 3500 ***
    Saved to best_solution.json

[GPU 0] Gen  3500 | Best: 412665132.00 | 383.8s
[GP] gpu_0 intermediate update: 412665132.00 at gen 3500
[GP] gpu_0 intermediate update: 411201226.00 at gen 3600

==================================================
GP ANALYSIS - Cycle 9
  Collected 40 solutions
==================================================

[GP] ========== GENETIC PROGRAMMING ANALYSIS STARTED ==========
[GP] Cycle: 8
[GP] Input: 40 solutions received for analysis
[GP] Fitness range: best=411201216.00, worst=414279648.00
[GP] Analysis config: blocks=True, fft=False, similarity=False
[GP] Starting analysis...
[GP] Phase 1: Extracting building blocks...

*** [GPU 0] NEW GLOBAL BEST: 411201226.00 at gen 3600 ***
    Saved to best_solution.json

[GPU 0] Gen  3600 | Best: 411201226.00 | 394.4s
[GP] Phase 1 complete: Found 30 building blocks
[GP] Phase 2: FFT analysis DISABLED
[GP] Phase 3: Similarity analysis DISABLED
[GP] ========== GP ANALYSIS COMPLETE ==========


[GP] ========== CANDIDATE GENERATION STARTED ==========
[GP] Generating 20 new candidate solutions
[GP] Available data: 40 top solutions, 30 building blocks, 0 FFT patterns, 0 similarity patterns
[GP] Generation strategy: 6 block-based, 6 interpolated, 8 mutated
[GP] Strategy 1: Creating 6 candidates via building block combination...
[GP] Strategy 1 complete: 6 block-based candidates created
[GP] Strategy 2: Creating 6 candidates via solution interpolation...
[GP] Strategy 2 complete: 6 interpolated candidates created
[GP] Strategy 3: Creating 8 candidates via guided mutation...
[GP] Strategy 3 complete: 8 mutated candidates created
[GP] Total candidates generated: 20
[GP] Strategy breakdown: Block=54, Interp=54, Mut=72
[GP] ========== CANDIDATE GENERATION COMPLETE ==========


*** [GPU 0] NEW GLOBAL BEST: 410863479.00 at gen 3700 ***
    Saved to best_solution.json

[GPU 0] Gen  3700 | Best: 410863479.00 | 405.0s
[GPU 0] Gene injection: 20 candidates injected at gen 3800 (total so far: 180)

*** [GPU 0] NEW GLOBAL BEST: 410134310.00 at gen 3800 ***
    Saved to best_solution.json

[GPU 0] Gen  3800 | Best: 410134310.00 | 416.1s
  -> 20 candidates sent to 1/1 workers
[GP] gpu_0 intermediate update: 410863479.00 at gen 3700
[GP] gpu_0 intermediate update: 410134310.00 at gen 3800

*** [GPU 0] NEW GLOBAL BEST: 409037291.00 at gen 3900 ***
    Saved to best_solution.json

[GPU 0] Gen  3900 | Best: 409037291.00 | 427.2s
[GP] gpu_0 intermediate update: 409037291.00 at gen 3900
[GP] gpu_0 intermediate update: 407827698.00 at gen 4000

==================================================
GP ANALYSIS - Cycle 10
  Collected 40 solutions
==================================================

[GP] ========== GENETIC PROGRAMMING ANALYSIS STARTED ==========
[GP] Cycle: 9
[GP] Input: 40 solutions received for analysis
[GP] Fitness range: best=407826304.00, worst=410145024.00
[GP] Analysis config: blocks=True, fft=False, similarity=False
[GP] Starting analysis...
[GP] Phase 1: Extracting building blocks...

*** [GPU 0] NEW GLOBAL BEST: 407826298.00 at gen 4000 ***
    Saved to best_solution.json

[GPU 0] Gen  4000 | Best: 407826298.00 | 438.4s
    [Checkpoint] Saved to ./results/warm_start/blocks_only/dsj1000/1R20/job_times_8_seed0_4000.json
[GP] Phase 1 complete: Found 30 building blocks
[GP] Phase 2: FFT analysis DISABLED
[GP] Phase 3: Similarity analysis DISABLED
[GP] ========== GP ANALYSIS COMPLETE ==========


[GP] ========== CANDIDATE GENERATION STARTED ==========
[GP] Generating 20 new candidate solutions
[GP] Available data: 40 top solutions, 30 building blocks, 0 FFT patterns, 0 similarity patterns
[GP] Generation strategy: 6 block-based, 6 interpolated, 8 mutated
[GP] Strategy 1: Creating 6 candidates via building block combination...
[GP] Strategy 1 complete: 6 block-based candidates created
[GP] Strategy 2: Creating 6 candidates via solution interpolation...
[GP] Strategy 2 complete: 6 interpolated candidates created
[GP] Strategy 3: Creating 8 candidates via guided mutation...
[GP] Strategy 3 complete: 8 mutated candidates created
[GP] Total candidates generated: 20
[GP] Strategy breakdown: Block=60, Interp=60, Mut=80
[GP] ========== CANDIDATE GENERATION COMPLETE ==========


*** [GPU 0] NEW GLOBAL BEST: 406922471.00 at gen 4100 ***
    Saved to best_solution.json

[GPU 0] Gen  4100 | Best: 406922471.00 | 449.5s
[GPU 0] Gene injection: 20 candidates injected at gen 4200 (total so far: 200)
  -> 20 candidates sent to 1/1 workers

[CHECKPOINT] Saved B.json at gen 2000 (makespan: 407826298.00)

*** [GPU 0] NEW GLOBAL BEST: 405903531.00 at gen 4200 ***
    Saved to best_solution.json

[GPU 0] Gen  4200 | Best: 405903531.00 | 460.4s
[GP] gpu_0 intermediate update: 407826298.00 at gen 4000
[GP] gpu_0 intermediate update: 406922471.00 at gen 4100
[GP] gpu_0 intermediate update: 405903531.00 at gen 4200

*** [GPU 0] NEW GLOBAL BEST: 404151641.00 at gen 4300 ***
    Saved to best_solution.json

[GPU 0] Gen  4300 | Best: 404151641.00 | 471.3s
[GP] gpu_0 intermediate update: 404151641.00 at gen 4300
[GP] gpu_0 intermediate update: 403632093.00 at gen 4400

==================================================
GP ANALYSIS - Cycle 11
  Collected 40 solutions
==================================================

[GP] ========== GENETIC PROGRAMMING ANALYSIS STARTED ==========
[GP] Cycle: 10
[GP] Input: 40 solutions received for analysis
[GP] Fitness range: best=403632096.00, worst=405903520.00
[GP] Analysis config: blocks=True, fft=False, similarity=False
[GP] Starting analysis...
[GP] Phase 1: Extracting building blocks...

*** [GPU 0] NEW GLOBAL BEST: 403632093.00 at gen 4400 ***
    Saved to best_solution.json

[GPU 0] Gen  4400 | Best: 403632093.00 | 482.4s
[GP] Phase 1 complete: Found 30 building blocks
[GP] Phase 2: FFT analysis DISABLED
[GP] Phase 3: Similarity analysis DISABLED
[GP] ========== GP ANALYSIS COMPLETE ==========


[GP] ========== CANDIDATE GENERATION STARTED ==========
[GP] Generating 20 new candidate solutions
[GP] Available data: 40 top solutions, 30 building blocks, 0 FFT patterns, 0 similarity patterns
[GP] Generation strategy: 6 block-based, 6 interpolated, 8 mutated
[GP] Strategy 1: Creating 6 candidates via building block combination...
[GP] Strategy 1 complete: 6 block-based candidates created
[GP] Strategy 2: Creating 6 candidates via solution interpolation...
[GP] Strategy 2 complete: 6 interpolated candidates created
[GP] Strategy 3: Creating 8 candidates via guided mutation...
[GP] Strategy 3 complete: 8 mutated candidates created
[GP] Total candidates generated: 20
[GP] Strategy breakdown: Block=66, Interp=66, Mut=88
[GP] ========== CANDIDATE GENERATION COMPLETE ==========


*** [GPU 0] NEW GLOBAL BEST: 402749685.00 at gen 4500 ***
    Saved to best_solution.json

[GPU 0] Gen  4500 | Best: 402749685.00 | 493.4s
[GPU 0] Gene injection: 20 candidates injected at gen 4600 (total so far: 220)

*** [GPU 0] NEW GLOBAL BEST: 402503117.00 at gen 4600 ***
    Saved to best_solution.json

[GPU 0] Gen  4600 | Best: 402503117.00 | 504.4s
  -> 20 candidates sent to 1/1 workers
[GP] gpu_0 intermediate update: 402749685.00 at gen 4500
[GP] gpu_0 intermediate update: 402525543.00 at gen 4600
[GP] gpu_0 intermediate update: 402503117.00 at gen 4600

*** [GPU 0] NEW GLOBAL BEST: 402213383.00 at gen 4700 ***
    Saved to best_solution.json

[GPU 0] Gen  4700 | Best: 402213383.00 | 515.4s
[GP] gpu_0 intermediate update: 402213383.00 at gen 4700
[GP] gpu_0 intermediate update: 401415819.00 at gen 4800

==================================================
GP ANALYSIS - Cycle 12
  Collected 40 solutions
==================================================

[GP] ========== GENETIC PROGRAMMING ANALYSIS STARTED ==========
[GP] Cycle: 11
[GP] Input: 40 solutions received for analysis
[GP] Fitness range: best=401415808.00, worst=402562656.00
[GP] Analysis config: blocks=True, fft=False, similarity=False
[GP] Starting analysis...
[GP] Phase 1: Extracting building blocks...

*** [GPU 0] NEW GLOBAL BEST: 401415819.00 at gen 4800 ***
    Saved to best_solution.json

[GPU 0] Gen  4800 | Best: 401415819.00 | 526.5s
[GP] Phase 1 complete: Found 30 building blocks
[GP] Phase 2: FFT analysis DISABLED
[GP] Phase 3: Similarity analysis DISABLED
[GP] ========== GP ANALYSIS COMPLETE ==========


[GP] ========== CANDIDATE GENERATION STARTED ==========
[GP] Generating 20 new candidate solutions
[GP] Available data: 40 top solutions, 30 building blocks, 0 FFT patterns, 0 similarity patterns
[GP] Generation strategy: 6 block-based, 6 interpolated, 8 mutated
[GP] Strategy 1: Creating 6 candidates via building block combination...
[GP] Strategy 1 complete: 6 block-based candidates created
[GP] Strategy 2: Creating 6 candidates via solution interpolation...
[GP] Strategy 2 complete: 6 interpolated candidates created
[GP] Strategy 3: Creating 8 candidates via guided mutation...
[GP] Strategy 3 complete: 8 mutated candidates created
[GP] Total candidates generated: 20
[GP] Strategy breakdown: Block=72, Interp=72, Mut=96
[GP] ========== CANDIDATE GENERATION COMPLETE ==========


*** [GPU 0] NEW GLOBAL BEST: 400345990.00 at gen 4900 ***
    Saved to best_solution.json

[GPU 0] Gen  4900 | Best: 400345990.00 | 537.4s
[GPU 0] Gene injection: 20 candidates injected at gen 5000 (total so far: 240)
[GPU 0] Evolution complete. Sending final results...
  -> 20 candidates sent to 1/1 workers
[GP] gpu_0 intermediate update: 400345990.00 at gen 4900
[GP] gpu_0 intermediate update: 399225967.00 at gen 5000
[GP] Worker finished: gpu_0 (best=399225967.00)

[GP] All workers finished. Total GP cycles: 12

[Final Collection] Have 1/1 workers. Waiting up to 120s for remaining...

[Critical] Attempting final result collection before terminating workers...

[Results Summary] Collected 1 results:
  gpu_0: fitness=399225967.00, intermediate=False, gen=final

======================================================================
COMPLETE
======================================================================
Best: 399225967.00 from gpu_0
  (Improved 61.7% over heuristic 1042585439.00)
Time: 550.9s
Total candidates injected: 240

Solution JSON saved to ./results/warm_start/blocks_only/dsj1000/1R20/job_times_8_seed0.json
HTML Gantt chart saved to: ./results/warm_start/blocks_only/dsj1000/1R20/job_times_8_seed0.html
