Setting random seed to 0
DEBUG: proc shape: (1000,), agents: 6, resources: 4, n: 1000

======================================================================
LOADING INITIAL SOLUTION FROM JSON
======================================================================
Loaded heuristic solution: Savings with makespan 1045020584.00
File: ./results/heuristics_only/dsj1000/1R20/job_times_6_heuristics.json
Makespan: 1045020584.00
Status: SUCCESS - Will use as warm start
======================================================================


======================================================================
VRP-RPD SOLVER
======================================================================
Problem: 999 customers, 6 agents, k=4
Heuristic: None
Genetic Programming: Yes
Warm Start: Yes
Gene Injection: Yes
Workers: 1 GPU + 0 CPU
Generations: 5000
======================================================================

Using solution from JSON file as warm start...
  JSON solution: 1045020584.00
Skipping heuristic re-computation (using JSON solution + perturbations)

Generated 6 warm start chromosomes from JSON

[GP] Starting GP collection loop (timeout: 12975s)...
[GPU 0] Warm start: 6 chromosomes

*** [GPU 0] NEW GLOBAL BEST: 789910444.00 at gen 0 ***
    Saved to best_solution.json

[GPU 0] Gen     0 | Best: 789910444.00 | 0.4s
[GP] gpu_0 first intermediate: 789910444.00 at gen 0

*** [GPU 0] NEW GLOBAL BEST: 595854453.00 at gen 100 ***
    Saved to best_solution.json

[GPU 0] Gen   100 | Best: 595854453.00 | 12.2s
[GP] gpu_0 intermediate update: 595854453.00 at gen 100
[GP] gpu_0 intermediate update: 575236393.00 at gen 200

*** [GPU 0] NEW GLOBAL BEST: 575070652.00 at gen 200 ***
    Saved to best_solution.json

[GPU 0] Gen   200 | Best: 575070652.00 | 24.1s
[GP] gpu_0 intermediate update: 575070652.00 at gen 200

*** [GPU 0] NEW GLOBAL BEST: 561415799.00 at gen 300 ***
    Saved to best_solution.json

[GPU 0] Gen   300 | Best: 561415799.00 | 36.0s
[GP] gpu_0 intermediate update: 561415799.00 at gen 300
[GP] gpu_0 intermediate update: 550248797.00 at gen 400

==================================================
GP ANALYSIS - Cycle 1
  Collected 40 solutions
==================================================

[GP] ========== GENETIC PROGRAMMING ANALYSIS STARTED ==========
[GP] Cycle: 0
[GP] Input: 40 solutions received for analysis
[GP] Fitness range: best=550248768.00, worst=575236416.00
[GP] Analysis config: blocks=True, fft=False, similarity=False
[GP] Starting analysis...
[GP] Phase 1: Extracting building blocks...

*** [GPU 0] NEW GLOBAL BEST: 550248797.00 at gen 400 ***
    Saved to best_solution.json

[GPU 0] Gen   400 | Best: 550248797.00 | 48.0s
[GP] Phase 1 complete: Found 30 building blocks
[GP] Phase 2: FFT analysis DISABLED
[GP] Phase 3: Similarity analysis DISABLED
[GP] ========== GP ANALYSIS COMPLETE ==========


[GP] ========== CANDIDATE GENERATION STARTED ==========
[GP] Generating 20 new candidate solutions
[GP] Available data: 40 top solutions, 30 building blocks, 0 FFT patterns, 0 similarity patterns
[GP] Generation strategy: 6 block-based, 6 interpolated, 8 mutated
[GP] Strategy 1: Creating 6 candidates via building block combination...
[GP] Strategy 1 complete: 6 block-based candidates created
[GP] Strategy 2: Creating 6 candidates via solution interpolation...
[GP] Strategy 2 complete: 6 interpolated candidates created
[GP] Strategy 3: Creating 8 candidates via guided mutation...
[GP] Strategy 3 complete: 8 mutated candidates created
[GP] Total candidates generated: 20
[GP] Strategy breakdown: Block=6, Interp=6, Mut=8
[GP] ========== CANDIDATE GENERATION COMPLETE ==========


*** [GPU 0] NEW GLOBAL BEST: 535283945.00 at gen 500 ***
    Saved to best_solution.json

[GPU 0] Gen   500 | Best: 535283945.00 | 60.1s
[GPU 0] Gene injection: 20 candidates injected at gen 600 (total so far: 20)

*** [GPU 0] NEW GLOBAL BEST: 518476641.00 at gen 600 ***
    Saved to best_solution.json

[GPU 0] Gen   600 | Best: 518476641.00 | 72.1s
  -> 20 candidates sent to 1/1 workers
[GP] gpu_0 intermediate update: 535283945.00 at gen 500
[GP] gpu_0 intermediate update: 518955932.00 at gen 600
[GP] gpu_0 intermediate update: 518476641.00 at gen 600

*** [GPU 0] NEW GLOBAL BEST: 512558048.00 at gen 700 ***
    Saved to best_solution.json

[GPU 0] Gen   700 | Best: 512558048.00 | 84.1s
[GP] gpu_0 intermediate update: 512558048.00 at gen 700
[GP] gpu_0 intermediate update: 503075753.00 at gen 800

==================================================
GP ANALYSIS - Cycle 2
  Collected 40 solutions
==================================================

[GP] ========== GENETIC PROGRAMMING ANALYSIS STARTED ==========
[GP] Cycle: 1
[GP] Input: 40 solutions received for analysis
[GP] Fitness range: best=503075744.00, worst=518974976.00
[GP] Analysis config: blocks=True, fft=False, similarity=False
[GP] Starting analysis...
[GP] Phase 1: Extracting building blocks...

*** [GPU 0] NEW GLOBAL BEST: 503075753.00 at gen 800 ***
    Saved to best_solution.json

[GPU 0] Gen   800 | Best: 503075753.00 | 96.2s
[GP] Phase 1 complete: Found 30 building blocks
[GP] Phase 2: FFT analysis DISABLED
[GP] Phase 3: Similarity analysis DISABLED
[GP] ========== GP ANALYSIS COMPLETE ==========


[GP] ========== CANDIDATE GENERATION STARTED ==========
[GP] Generating 20 new candidate solutions
[GP] Available data: 40 top solutions, 30 building blocks, 0 FFT patterns, 0 similarity patterns
[GP] Generation strategy: 6 block-based, 6 interpolated, 8 mutated
[GP] Strategy 1: Creating 6 candidates via building block combination...
[GP] Strategy 1 complete: 6 block-based candidates created
[GP] Strategy 2: Creating 6 candidates via solution interpolation...
[GP] Strategy 2 complete: 6 interpolated candidates created
[GP] Strategy 3: Creating 8 candidates via guided mutation...
[GP] Strategy 3 complete: 8 mutated candidates created
[GP] Total candidates generated: 20
[GP] Strategy breakdown: Block=12, Interp=12, Mut=16
[GP] ========== CANDIDATE GENERATION COMPLETE ==========


*** [GPU 0] NEW GLOBAL BEST: 496168516.00 at gen 900 ***
    Saved to best_solution.json

[GPU 0] Gen   900 | Best: 496168516.00 | 108.2s
[GPU 0] Gene injection: 20 candidates injected at gen 1000 (total so far: 40)
  -> 20 candidates sent to 1/1 workers
[GP] gpu_0 intermediate update: 496168516.00 at gen 900
[GP] gpu_0 intermediate update: 489380647.00 at gen 1000

*** [GPU 0] NEW GLOBAL BEST: 489371714.00 at gen 1000 ***
    Saved to best_solution.json

[GPU 0] Gen  1000 | Best: 489371714.00 | 120.1s
    [Checkpoint] Saved to ./results/warm_start/blocks_only/dsj1000/1R20/job_times_6_seed0_1000.json
[GP] gpu_0 intermediate update: 489371714.00 at gen 1000

*** [GPU 0] NEW GLOBAL BEST: 483097836.00 at gen 1100 ***
    Saved to best_solution.json

[GPU 0] Gen  1100 | Best: 483097836.00 | 132.2s
[GP] gpu_0 intermediate update: 483097836.00 at gen 1100
[GP] gpu_0 intermediate update: 476520548.00 at gen 1200

==================================================
GP ANALYSIS - Cycle 3
  Collected 40 solutions
==================================================

[GP] ========== GENETIC PROGRAMMING ANALYSIS STARTED ==========
[GP] Cycle: 2
[GP] Input: 40 solutions received for analysis
[GP] Fitness range: best=476520544.00, worst=489631872.00
[GP] Analysis config: blocks=True, fft=False, similarity=False
[GP] Starting analysis...
[GP] Phase 1: Extracting building blocks...

*** [GPU 0] NEW GLOBAL BEST: 476520548.00 at gen 1200 ***
    Saved to best_solution.json

[GPU 0] Gen  1200 | Best: 476520548.00 | 144.4s
[GP] Phase 1 complete: Found 30 building blocks
[GP] Phase 2: FFT analysis DISABLED
[GP] Phase 3: Similarity analysis DISABLED
[GP] ========== GP ANALYSIS COMPLETE ==========


[GP] ========== CANDIDATE GENERATION STARTED ==========
[GP] Generating 20 new candidate solutions
[GP] Available data: 40 top solutions, 30 building blocks, 0 FFT patterns, 0 similarity patterns
[GP] Generation strategy: 6 block-based, 6 interpolated, 8 mutated
[GP] Strategy 1: Creating 6 candidates via building block combination...
[GP] Strategy 1 complete: 6 block-based candidates created
[GP] Strategy 2: Creating 6 candidates via solution interpolation...
[GP] Strategy 2 complete: 6 interpolated candidates created
[GP] Strategy 3: Creating 8 candidates via guided mutation...
[GP] Strategy 3 complete: 8 mutated candidates created
[GP] Total candidates generated: 20
[GP] Strategy breakdown: Block=18, Interp=18, Mut=24
[GP] ========== CANDIDATE GENERATION COMPLETE ==========


*** [GPU 0] NEW GLOBAL BEST: 471342724.00 at gen 1300 ***
    Saved to best_solution.json

[GPU 0] Gen  1300 | Best: 471342724.00 | 156.3s
[GPU 0] Gene injection: 20 candidates injected at gen 1400 (total so far: 60)

*** [GPU 0] NEW GLOBAL BEST: 466400936.00 at gen 1400 ***
  -> 20 candidates sent to 1/1 workers
[GP] gpu_0 intermediate update: 471342724.00 at gen 1300
[GP] gpu_0 intermediate update: 466400936.00 at gen 1400
    Saved to best_solution.json

[GPU 0] Gen  1400 | Best: 466400936.00 | 168.3s

*** [GPU 0] NEW GLOBAL BEST: 463608846.00 at gen 1500 ***
    Saved to best_solution.json

[GPU 0] Gen  1500 | Best: 463608846.00 | 180.2s
[GP] gpu_0 intermediate update: 463608846.00 at gen 1500
[GP] gpu_0 intermediate update: 458650176.00 at gen 1600

==================================================
GP ANALYSIS - Cycle 4
  Collected 40 solutions
==================================================

[GP] ========== GENETIC PROGRAMMING ANALYSIS STARTED ==========
[GP] Cycle: 3
[GP] Input: 40 solutions received for analysis
[GP] Fitness range: best=458650176.00, worst=466473376.00
[GP] Analysis config: blocks=True, fft=False, similarity=False
[GP] Starting analysis...
[GP] Phase 1: Extracting building blocks...

*** [GPU 0] NEW GLOBAL BEST: 458650176.00 at gen 1600 ***
    Saved to best_solution.json

[GPU 0] Gen  1600 | Best: 458650176.00 | 192.1s
[GP] Phase 1 complete: Found 30 building blocks
[GP] Phase 2: FFT analysis DISABLED
[GP] Phase 3: Similarity analysis DISABLED
[GP] ========== GP ANALYSIS COMPLETE ==========


[GP] ========== CANDIDATE GENERATION STARTED ==========
[GP] Generating 20 new candidate solutions
[GP] Available data: 40 top solutions, 30 building blocks, 0 FFT patterns, 0 similarity patterns
[GP] Generation strategy: 6 block-based, 6 interpolated, 8 mutated
[GP] Strategy 1: Creating 6 candidates via building block combination...
[GP] Strategy 1 complete: 6 block-based candidates created
[GP] Strategy 2: Creating 6 candidates via solution interpolation...
[GP] Strategy 2 complete: 6 interpolated candidates created
[GP] Strategy 3: Creating 8 candidates via guided mutation...
[GP] Strategy 3 complete: 8 mutated candidates created
[GP] Total candidates generated: 20
[GP] Strategy breakdown: Block=24, Interp=24, Mut=32
[GP] ========== CANDIDATE GENERATION COMPLETE ==========


*** [GPU 0] NEW GLOBAL BEST: 454894832.00 at gen 1700 ***
    Saved to best_solution.json

[GPU 0] Gen  1700 | Best: 454894832.00 | 203.9s
[GPU 0] Gene injection: 20 candidates injected at gen 1800 (total so far: 80)
  -> 20 candidates sent to 1/1 workers
[GP] gpu_0 intermediate update: 454894832.00 at gen 1700
[GP] gpu_0 intermediate update: 450869694.00 at gen 1800

*** [GPU 0] NEW GLOBAL BEST: 450869694.00 at gen 1800 ***
    Saved to best_solution.json

[GPU 0] Gen  1800 | Best: 450869694.00 | 215.4s

*** [GPU 0] NEW GLOBAL BEST: 447581734.00 at gen 1900 ***
    Saved to best_solution.json

[GPU 0] Gen  1900 | Best: 447581734.00 | 227.1s
[GP] gpu_0 intermediate update: 447581734.00 at gen 1900
[GP] gpu_0 intermediate update: 444219584.00 at gen 2000

==================================================
GP ANALYSIS - Cycle 5
  Collected 40 solutions
==================================================

[GP] ========== GENETIC PROGRAMMING ANALYSIS STARTED ==========
[GP] Cycle: 4
[GP] Input: 40 solutions received for analysis
[GP] Fitness range: best=444219584.00, worst=450869696.00
[GP] Analysis config: blocks=True, fft=False, similarity=False
[GP] Starting analysis...
[GP] Phase 1: Extracting building blocks...

*** [GPU 0] NEW GLOBAL BEST: 444219584.00 at gen 2000 ***
    Saved to best_solution.json

[GPU 0] Gen  2000 | Best: 444219584.00 | 238.8s
    [Checkpoint] Saved to ./results/warm_start/blocks_only/dsj1000/1R20/job_times_6_seed0_2000.json
[GP] Phase 1 complete: Found 30 building blocks
[GP] Phase 2: FFT analysis DISABLED
[GP] Phase 3: Similarity analysis DISABLED
[GP] ========== GP ANALYSIS COMPLETE ==========


[GP] ========== CANDIDATE GENERATION STARTED ==========
[GP] Generating 20 new candidate solutions
[GP] Available data: 40 top solutions, 30 building blocks, 0 FFT patterns, 0 similarity patterns
[GP] Generation strategy: 6 block-based, 6 interpolated, 8 mutated
[GP] Strategy 1: Creating 6 candidates via building block combination...
[GP] Strategy 1 complete: 6 block-based candidates created
[GP] Strategy 2: Creating 6 candidates via solution interpolation...
[GP] Strategy 2 complete: 6 interpolated candidates created
[GP] Strategy 3: Creating 8 candidates via guided mutation...
[GP] Strategy 3 complete: 8 mutated candidates created
[GP] Total candidates generated: 20
[GP] Strategy breakdown: Block=30, Interp=30, Mut=40
[GP] ========== CANDIDATE GENERATION COMPLETE ==========


*** [GPU 0] NEW GLOBAL BEST: 440628294.00 at gen 2100 ***
    Saved to best_solution.json

[GPU 0] Gen  2100 | Best: 440628294.00 | 250.8s
[GPU 0] Gene injection: 20 candidates injected at gen 2200 (total so far: 100)

*** [GPU 0] NEW GLOBAL BEST: 437671785.00 at gen 2200 ***
  -> 20 candidates sent to 1/1 workers

[CHECKPOINT] Saved A.json at gen 1000 (makespan: 444219584.00)
    Saved to best_solution.json

[GPU 0] Gen  2200 | Best: 437671785.00 | 262.9s
[GP] gpu_0 intermediate update: 440628294.00 at gen 2100
[GP] gpu_0 intermediate update: 437690426.00 at gen 2200
[GP] gpu_0 intermediate update: 437671785.00 at gen 2200

*** [GPU 0] NEW GLOBAL BEST: 435843919.00 at gen 2300 ***
    Saved to best_solution.json

[GPU 0] Gen  2300 | Best: 435843919.00 | 274.8s
[GP] gpu_0 intermediate update: 435843919.00 at gen 2300
[GP] gpu_0 intermediate update: 434107457.00 at gen 2400

==================================================
GP ANALYSIS - Cycle 6
  Collected 40 solutions
==================================================

[GP] ========== GENETIC PROGRAMMING ANALYSIS STARTED ==========
[GP] Cycle: 5
[GP] Input: 40 solutions received for analysis
[GP] Fitness range: best=434107456.00, worst=437690432.00
[GP] Analysis config: blocks=True, fft=False, similarity=False
[GP] Starting analysis...
[GP] Phase 1: Extracting building blocks...

*** [GPU 0] NEW GLOBAL BEST: 434107457.00 at gen 2400 ***
    Saved to best_solution.json

[GPU 0] Gen  2400 | Best: 434107457.00 | 286.6s
[GP] Phase 1 complete: Found 30 building blocks
[GP] Phase 2: FFT analysis DISABLED
[GP] Phase 3: Similarity analysis DISABLED
[GP] ========== GP ANALYSIS COMPLETE ==========


[GP] ========== CANDIDATE GENERATION STARTED ==========
[GP] Generating 20 new candidate solutions
[GP] Available data: 40 top solutions, 30 building blocks, 0 FFT patterns, 0 similarity patterns
[GP] Generation strategy: 6 block-based, 6 interpolated, 8 mutated
[GP] Strategy 1: Creating 6 candidates via building block combination...
[GP] Strategy 1 complete: 6 block-based candidates created
[GP] Strategy 2: Creating 6 candidates via solution interpolation...
[GP] Strategy 2 complete: 6 interpolated candidates created
[GP] Strategy 3: Creating 8 candidates via guided mutation...
[GP] Strategy 3 complete: 8 mutated candidates created
[GP] Total candidates generated: 20
[GP] Strategy breakdown: Block=36, Interp=36, Mut=48
[GP] ========== CANDIDATE GENERATION COMPLETE ==========


*** [GPU 0] NEW GLOBAL BEST: 432049588.00 at gen 2500 ***
    Saved to best_solution.json

[GPU 0] Gen  2500 | Best: 432049588.00 | 298.5s
[GPU 0] Gene injection: 20 candidates injected at gen 2600 (total so far: 120)

*** [GPU 0] NEW GLOBAL BEST: 430654231.00 at gen 2600 ***
    Saved to best_solution.json

[GPU 0] Gen  2600 | Best: 430654231.00 | 310.3s
  -> 20 candidates sent to 1/1 workers
[GP] gpu_0 intermediate update: 432049588.00 at gen 2500
[GP] gpu_0 intermediate update: 430654231.00 at gen 2600

*** [GPU 0] NEW GLOBAL BEST: 427774970.00 at gen 2700 ***
    Saved to best_solution.json

[GPU 0] Gen  2700 | Best: 427774970.00 | 322.3s
[GP] gpu_0 intermediate update: 427774970.00 at gen 2700
[GP] gpu_0 intermediate update: 425688074.00 at gen 2800

==================================================
GP ANALYSIS - Cycle 7
  Collected 40 solutions
==================================================

[GP] ========== GENETIC PROGRAMMING ANALYSIS STARTED ==========
[GP] Cycle: 6
[GP] Input: 40 solutions received for analysis
[GP] Fitness range: best=425460448.00, worst=430654240.00
[GP] Analysis config: blocks=True, fft=False, similarity=False
[GP] Starting analysis...
[GP] Phase 1: Extracting building blocks...

*** [GPU 0] NEW GLOBAL BEST: 425460436.00 at gen 2800 ***
    Saved to best_solution.json

[GPU 0] Gen  2800 | Best: 425460436.00 | 334.1s
[GP] Phase 1 complete: Found 30 building blocks
[GP] Phase 2: FFT analysis DISABLED
[GP] Phase 3: Similarity analysis DISABLED
[GP] ========== GP ANALYSIS COMPLETE ==========


[GP] ========== CANDIDATE GENERATION STARTED ==========
[GP] Generating 20 new candidate solutions
[GP] Available data: 40 top solutions, 30 building blocks, 0 FFT patterns, 0 similarity patterns
[GP] Generation strategy: 6 block-based, 6 interpolated, 8 mutated
[GP] Strategy 1: Creating 6 candidates via building block combination...
[GP] Strategy 1 complete: 6 block-based candidates created
[GP] Strategy 2: Creating 6 candidates via solution interpolation...
[GP] Strategy 2 complete: 6 interpolated candidates created
[GP] Strategy 3: Creating 8 candidates via guided mutation...
[GP] Strategy 3 complete: 8 mutated candidates created
[GP] Total candidates generated: 20
[GP] Strategy breakdown: Block=42, Interp=42, Mut=56
[GP] ========== CANDIDATE GENERATION COMPLETE ==========


*** [GPU 0] NEW GLOBAL BEST: 423780535.00 at gen 2900 ***
    Saved to best_solution.json

[GPU 0] Gen  2900 | Best: 423780535.00 | 345.9s
[GPU 0] Gene injection: 20 candidates injected at gen 3000 (total so far: 140)

*** [GPU 0] NEW GLOBAL BEST: 422540059.00 at gen 3000 ***
    Saved to best_solution.json

[GPU 0] Gen  3000 | Best: 422540059.00 | 357.7s
  -> 20 candidates sent to 1/1 workers
[GP] gpu_0 intermediate update: 425460436.00 at gen 2800
[GP] gpu_0 intermediate update: 423780535.00 at gen 2900
[GP] gpu_0 intermediate update: 422540059.00 at gen 3000
    [Checkpoint] Saved to ./results/warm_start/blocks_only/dsj1000/1R20/job_times_6_seed0_3000.json

*** [GPU 0] NEW GLOBAL BEST: 421068387.00 at gen 3100 ***
    Saved to best_solution.json

[GPU 0] Gen  3100 | Best: 421068387.00 | 369.7s
[GP] gpu_0 intermediate update: 421068387.00 at gen 3100
[GP] gpu_0 intermediate update: 419272701.00 at gen 3200

==================================================
GP ANALYSIS - Cycle 8
  Collected 40 solutions
==================================================

[GP] ========== GENETIC PROGRAMMING ANALYSIS STARTED ==========
[GP] Cycle: 7
[GP] Input: 40 solutions received for analysis
[GP] Fitness range: best=419246752.00, worst=422605888.00
[GP] Analysis config: blocks=True, fft=False, similarity=False
[GP] Starting analysis...
[GP] Phase 1: Extracting building blocks...

*** [GPU 0] NEW GLOBAL BEST: 419246744.00 at gen 3200 ***
    Saved to best_solution.json

[GPU 0] Gen  3200 | Best: 419246744.00 | 381.7s
[GP] Phase 1 complete: Found 30 building blocks
[GP] Phase 2: FFT analysis DISABLED
[GP] Phase 3: Similarity analysis DISABLED
[GP] ========== GP ANALYSIS COMPLETE ==========


[GP] ========== CANDIDATE GENERATION STARTED ==========
[GP] Generating 20 new candidate solutions
[GP] Available data: 40 top solutions, 30 building blocks, 0 FFT patterns, 0 similarity patterns
[GP] Generation strategy: 6 block-based, 6 interpolated, 8 mutated
[GP] Strategy 1: Creating 6 candidates via building block combination...
[GP] Strategy 1 complete: 6 block-based candidates created
[GP] Strategy 2: Creating 6 candidates via solution interpolation...
[GP] Strategy 2 complete: 6 interpolated candidates created
[GP] Strategy 3: Creating 8 candidates via guided mutation...
[GP] Strategy 3 complete: 8 mutated candidates created
[GP] Total candidates generated: 20
[GP] Strategy breakdown: Block=48, Interp=48, Mut=64
[GP] ========== CANDIDATE GENERATION COMPLETE ==========


*** [GPU 0] NEW GLOBAL BEST: 417581551.00 at gen 3300 ***
    Saved to best_solution.json

[GPU 0] Gen  3300 | Best: 417581551.00 | 393.6s
[GPU 0] Gene injection: 20 candidates injected at gen 3400 (total so far: 160)

*** [GPU 0] NEW GLOBAL BEST: 416292114.00 at gen 3400 ***
    Saved to best_solution.json

[GPU 0] Gen  3400 | Best: 416292114.00 | 405.5s
  -> 20 candidates sent to 1/1 workers
[GP] gpu_0 intermediate update: 419246744.00 at gen 3200
[GP] gpu_0 intermediate update: 417581551.00 at gen 3300
[GP] gpu_0 intermediate update: 416292114.00 at gen 3400

*** [GPU 0] NEW GLOBAL BEST: 414958739.00 at gen 3500 ***
    Saved to best_solution.json

[GPU 0] Gen  3500 | Best: 414958739.00 | 417.3s
[GP] gpu_0 intermediate update: 414958739.00 at gen 3500
[GP] gpu_0 intermediate update: 414073729.00 at gen 3600

==================================================
GP ANALYSIS - Cycle 9
  Collected 40 solutions
==================================================

[GP] ========== GENETIC PROGRAMMING ANALYSIS STARTED ==========
[GP] Cycle: 8
[GP] Input: 40 solutions received for analysis
[GP] Fitness range: best=414073728.00, worst=416384000.00
[GP] Analysis config: blocks=True, fft=False, similarity=False
[GP] Starting analysis...
[GP] Phase 1: Extracting building blocks...

*** [GPU 0] NEW GLOBAL BEST: 414073729.00 at gen 3600 ***
    Saved to best_solution.json

[GPU 0] Gen  3600 | Best: 414073729.00 | 429.2s
[GP] Phase 1 complete: Found 30 building blocks
[GP] Phase 2: FFT analysis DISABLED
[GP] Phase 3: Similarity analysis DISABLED
[GP] ========== GP ANALYSIS COMPLETE ==========


[GP] ========== CANDIDATE GENERATION STARTED ==========
[GP] Generating 20 new candidate solutions
[GP] Available data: 40 top solutions, 30 building blocks, 0 FFT patterns, 0 similarity patterns
[GP] Generation strategy: 6 block-based, 6 interpolated, 8 mutated
[GP] Strategy 1: Creating 6 candidates via building block combination...
[GP] Strategy 1 complete: 6 block-based candidates created
[GP] Strategy 2: Creating 6 candidates via solution interpolation...
[GP] Strategy 2 complete: 6 interpolated candidates created
[GP] Strategy 3: Creating 8 candidates via guided mutation...
[GP] Strategy 3 complete: 8 mutated candidates created
[GP] Total candidates generated: 20
[GP] Strategy breakdown: Block=54, Interp=54, Mut=72
[GP] ========== CANDIDATE GENERATION COMPLETE ==========


*** [GPU 0] NEW GLOBAL BEST: 412682548.00 at gen 3700 ***
    Saved to best_solution.json

[GPU 0] Gen  3700 | Best: 412682548.00 | 441.2s
[GPU 0] Gene injection: 20 candidates injected at gen 3800 (total so far: 180)
  -> 20 candidates sent to 1/1 workers
[GP] gpu_0 intermediate update: 412682548.00 at gen 3700
[GP] gpu_0 intermediate update: 411158770.00 at gen 3800

*** [GPU 0] NEW GLOBAL BEST: 411158770.00 at gen 3800 ***
    Saved to best_solution.json

[GPU 0] Gen  3800 | Best: 411158770.00 | 453.1s

*** [GPU 0] NEW GLOBAL BEST: 410010968.00 at gen 3900 ***
    Saved to best_solution.json

[GPU 0] Gen  3900 | Best: 410010968.00 | 465.1s
[GP] gpu_0 intermediate update: 410010968.00 at gen 3900
[GP] gpu_0 intermediate update: 409064292.00 at gen 4000

==================================================
GP ANALYSIS - Cycle 10
  Collected 40 solutions
==================================================

[GP] ========== GENETIC PROGRAMMING ANALYSIS STARTED ==========
[GP] Cycle: 9
[GP] Input: 40 solutions received for analysis
[GP] Fitness range: best=409064288.00, worst=411158784.00
[GP] Analysis config: blocks=True, fft=False, similarity=False
[GP] Starting analysis...
[GP] Phase 1: Extracting building blocks...

*** [GPU 0] NEW GLOBAL BEST: 409064292.00 at gen 4000 ***
    Saved to best_solution.json

[GPU 0] Gen  4000 | Best: 409064292.00 | 476.9s
    [Checkpoint] Saved to ./results/warm_start/blocks_only/dsj1000/1R20/job_times_6_seed0_4000.json
[GP] Phase 1 complete: Found 30 building blocks
[GP] Phase 2: FFT analysis DISABLED
[GP] Phase 3: Similarity analysis DISABLED
[GP] ========== GP ANALYSIS COMPLETE ==========


[GP] ========== CANDIDATE GENERATION STARTED ==========
[GP] Generating 20 new candidate solutions
[GP] Available data: 40 top solutions, 30 building blocks, 0 FFT patterns, 0 similarity patterns
[GP] Generation strategy: 6 block-based, 6 interpolated, 8 mutated
[GP] Strategy 1: Creating 6 candidates via building block combination...
[GP] Strategy 1 complete: 6 block-based candidates created
[GP] Strategy 2: Creating 6 candidates via solution interpolation...
[GP] Strategy 2 complete: 6 interpolated candidates created
[GP] Strategy 3: Creating 8 candidates via guided mutation...
[GP] Strategy 3 complete: 8 mutated candidates created
[GP] Total candidates generated: 20
[GP] Strategy breakdown: Block=60, Interp=60, Mut=80
[GP] ========== CANDIDATE GENERATION COMPLETE ==========


*** [GPU 0] NEW GLOBAL BEST: 407951709.00 at gen 4100 ***
    Saved to best_solution.json

[GPU 0] Gen  4100 | Best: 407951709.00 | 488.9s
[GPU 0] Gene injection: 20 candidates injected at gen 4200 (total so far: 200)
  -> 20 candidates sent to 1/1 workers

[CHECKPOINT] Saved B.json at gen 2000 (makespan: 409064292.00)

*** [GPU 0] NEW GLOBAL BEST: 406961061.00 at gen 4200 ***
    Saved to best_solution.json

[GPU 0] Gen  4200 | Best: 406961061.00 | 500.8s
[GP] gpu_0 intermediate update: 407951709.00 at gen 4100
[GP] gpu_0 intermediate update: 406961061.00 at gen 4200

*** [GPU 0] NEW GLOBAL BEST: 405990902.00 at gen 4300 ***
    Saved to best_solution.json

[GPU 0] Gen  4300 | Best: 405990902.00 | 512.7s
[GP] gpu_0 intermediate update: 405990902.00 at gen 4300
[GP] gpu_0 intermediate update: 404108597.00 at gen 4400

==================================================
GP ANALYSIS - Cycle 11
  Collected 40 solutions
==================================================

[GP] ========== GENETIC PROGRAMMING ANALYSIS STARTED ==========
[GP] Cycle: 10
[GP] Input: 40 solutions received for analysis
[GP] Fitness range: best=404108608.00, worst=406961056.00
[GP] Analysis config: blocks=True, fft=False, similarity=False
[GP] Starting analysis...
[GP] Phase 1: Extracting building blocks...

*** [GPU 0] NEW GLOBAL BEST: 404108597.00 at gen 4400 ***
    Saved to best_solution.json

[GPU 0] Gen  4400 | Best: 404108597.00 | 524.8s
[GP] Phase 1 complete: Found 30 building blocks
[GP] Phase 2: FFT analysis DISABLED
[GP] Phase 3: Similarity analysis DISABLED
[GP] ========== GP ANALYSIS COMPLETE ==========


[GP] ========== CANDIDATE GENERATION STARTED ==========
[GP] Generating 20 new candidate solutions
[GP] Available data: 40 top solutions, 30 building blocks, 0 FFT patterns, 0 similarity patterns
[GP] Generation strategy: 6 block-based, 6 interpolated, 8 mutated
[GP] Strategy 1: Creating 6 candidates via building block combination...
[GP] Strategy 1 complete: 6 block-based candidates created
[GP] Strategy 2: Creating 6 candidates via solution interpolation...
[GP] Strategy 2 complete: 6 interpolated candidates created
[GP] Strategy 3: Creating 8 candidates via guided mutation...
[GP] Strategy 3 complete: 8 mutated candidates created
[GP] Total candidates generated: 20
[GP] Strategy breakdown: Block=66, Interp=66, Mut=88
[GP] ========== CANDIDATE GENERATION COMPLETE ==========


*** [GPU 0] NEW GLOBAL BEST: 402600537.00 at gen 4500 ***
    Saved to best_solution.json

[GPU 0] Gen  4500 | Best: 402600537.00 | 536.8s
[GPU 0] Gene injection: 20 candidates injected at gen 4600 (total so far: 220)

*** [GPU 0] NEW GLOBAL BEST: 401452126.00 at gen 4600 ***
  -> 20 candidates sent to 1/1 workers
[GP] gpu_0 intermediate update: 402600537.00 at gen 4500
[GP] gpu_0 intermediate update: 401452126.00 at gen 4600
    Saved to best_solution.json

[GPU 0] Gen  4600 | Best: 401452126.00 | 549.1s

*** [GPU 0] NEW GLOBAL BEST: 400236461.00 at gen 4700 ***
    Saved to best_solution.json

[GPU 0] Gen  4700 | Best: 400236461.00 | 561.0s
[GP] gpu_0 intermediate update: 400236461.00 at gen 4700
[GP] gpu_0 intermediate update: 398790935.00 at gen 4800

==================================================
GP ANALYSIS - Cycle 12
  Collected 40 solutions
==================================================

[GP] ========== GENETIC PROGRAMMING ANALYSIS STARTED ==========
[GP] Cycle: 11
[GP] Input: 40 solutions received for analysis
[GP] Fitness range: best=398685568.00, worst=401452128.00
[GP] Analysis config: blocks=True, fft=False, similarity=False
[GP] Starting analysis...
[GP] Phase 1: Extracting building blocks...

*** [GPU 0] NEW GLOBAL BEST: 398685578.00 at gen 4800 ***
    Saved to best_solution.json

[GPU 0] Gen  4800 | Best: 398685578.00 | 573.1s
[GP] Phase 1 complete: Found 30 building blocks
[GP] Phase 2: FFT analysis DISABLED
[GP] Phase 3: Similarity analysis DISABLED
[GP] ========== GP ANALYSIS COMPLETE ==========


[GP] ========== CANDIDATE GENERATION STARTED ==========
[GP] Generating 20 new candidate solutions
[GP] Available data: 40 top solutions, 30 building blocks, 0 FFT patterns, 0 similarity patterns
[GP] Generation strategy: 6 block-based, 6 interpolated, 8 mutated
[GP] Strategy 1: Creating 6 candidates via building block combination...
[GP] Strategy 1 complete: 6 block-based candidates created
[GP] Strategy 2: Creating 6 candidates via solution interpolation...
[GP] Strategy 2 complete: 6 interpolated candidates created
[GP] Strategy 3: Creating 8 candidates via guided mutation...
[GP] Strategy 3 complete: 8 mutated candidates created
[GP] Total candidates generated: 20
[GP] Strategy breakdown: Block=72, Interp=72, Mut=96
[GP] ========== CANDIDATE GENERATION COMPLETE ==========


*** [GPU 0] NEW GLOBAL BEST: 397247832.00 at gen 4900 ***
    Saved to best_solution.json

[GPU 0] Gen  4900 | Best: 397247832.00 | 585.1s
[GPU 0] Gene injection: 20 candidates injected at gen 5000 (total so far: 240)
[GPU 0] Evolution complete. Sending final results...
  -> 20 candidates sent to 1/1 workers
[GP] gpu_0 intermediate update: 398685578.00 at gen 4800
[GP] gpu_0 intermediate update: 397247832.00 at gen 4900
[GP] gpu_0 intermediate update: 396084764.00 at gen 5000
[GP] Worker finished: gpu_0 (best=396084764.00)

[GP] All workers finished. Total GP cycles: 12

[Final Collection] Have 1/1 workers. Waiting up to 120s for remaining...

[Critical] Attempting final result collection before terminating workers...

[Results Summary] Collected 1 results:
  gpu_0: fitness=396084764.00, intermediate=False, gen=final

======================================================================
COMPLETE
======================================================================
Best: 396084764.00 from gpu_0
  (Improved 62.1% over heuristic 1045020584.00)
Time: 599.4s
Total candidates injected: 240

Solution JSON saved to ./results/warm_start/blocks_only/dsj1000/1R20/job_times_6_seed0.json
HTML Gantt chart saved to: ./results/warm_start/blocks_only/dsj1000/1R20/job_times_6_seed0.html
