Setting random seed to 0
DEBUG: proc shape: (431,), agents: 6, resources: 4, n: 431

======================================================================
LOADING INITIAL SOLUTION FROM JSON
======================================================================
Loaded heuristic solution: Savings with makespan 3330665.00
File: ./results/heuristics_only/gr431/1R10/job_times_9_heuristics.json
Makespan: 3330665.00
Status: SUCCESS - Will use as warm start
======================================================================


======================================================================
VRP-RPD SOLVER
======================================================================
Problem: 430 customers, 6 agents, k=4
Heuristic: None
Genetic Programming: Yes
Warm Start: Yes
Gene Injection: Yes
Workers: 1 GPU + 0 CPU
Generations: 5000
======================================================================

Using solution from JSON file as warm start...
  JSON solution: 3330665.00
Skipping heuristic re-computation (using JSON solution + perturbations)

Generated 6 warm start chromosomes from JSON

[GP] Starting GP collection loop (timeout: 750s)...
[GPU 0] Warm start: 6 chromosomes

*** [GPU 0] NEW GLOBAL BEST: 2298481.00 at gen 0 ***
    Saved to best_solution.json

[GPU 0] Gen     0 | Best: 2298481.00 | 0.4s
[GP] gpu_0 first intermediate: 2298481.00 at gen 0

*** [GPU 0] NEW GLOBAL BEST: 1681179.00 at gen 100 ***
    Saved to best_solution.json

[GPU 0] Gen   100 | Best: 1681179.00 | 10.7s
[GP] gpu_0 intermediate update: 1681179.00 at gen 100
[GP] gpu_0 intermediate update: 1581565.00 at gen 200

==================================================
GP ANALYSIS - Cycle 1
  Collected 100 solutions
==================================================

[GP] ========== GENETIC PROGRAMMING ANALYSIS STARTED ==========
[GP] Cycle: 0
[GP] Input: 100 solutions received for analysis
[GP] Fitness range: best=1578698.00, worst=1582777.00
[GP] Analysis config: blocks=True, fft=False, similarity=False
[GP] Starting analysis...
[GP] Phase 1: Extracting building blocks...
[GP] Phase 1 complete: Found 30 building blocks
[GP] Phase 2: FFT analysis DISABLED
[GP] Phase 3: Similarity analysis DISABLED
[GP] ========== GP ANALYSIS COMPLETE ==========


[GP] ========== CANDIDATE GENERATION STARTED ==========
[GP] Generating 20 new candidate solutions
[GP] Available data: 100 top solutions, 30 building blocks, 0 FFT patterns, 0 similarity patterns
[GP] Generation strategy: 6 block-based, 6 interpolated, 8 mutated
[GP] Strategy 1: Creating 6 candidates via building block combination...
[GP] Strategy 1 complete: 6 block-based candidates created
[GP] Strategy 2: Creating 6 candidates via solution interpolation...
[GP] Strategy 2 complete: 6 interpolated candidates created
[GP] Strategy 3: Creating 8 candidates via guided mutation...
[GP] Strategy 3 complete: 8 mutated candidates created
[GP] Total candidates generated: 20
[GP] Strategy breakdown: Block=6, Interp=6, Mut=8
[GP] ========== CANDIDATE GENERATION COMPLETE ==========


*** [GPU 0] NEW GLOBAL BEST: 1578698.00 at gen 200 ***
    Saved to best_solution.json

[GPU 0] Gen   200 | Best: 1578698.00 | 20.9s
  -> 20 candidates sent to 1/1 workers
[GP] gpu_0 intermediate update: 1578698.00 at gen 200

*** [GPU 0] NEW GLOBAL BEST: 1532880.00 at gen 300 ***
    Saved to best_solution.json

[GPU 0] Gen   300 | Best: 1532880.00 | 30.9s
[GP] gpu_0 intermediate update: 1532880.00 at gen 300
[GPU 0] Gene injection: 20 candidates injected at gen 400 (total so far: 20)
[GP] gpu_0 intermediate update: 1501348.00 at gen 400

==================================================
GP ANALYSIS - Cycle 2
  Collected 100 solutions
==================================================

[GP] ========== GENETIC PROGRAMMING ANALYSIS STARTED ==========
[GP] Cycle: 1
[GP] Input: 100 solutions received for analysis
[GP] Fitness range: best=1498238.00, worst=1501354.00
[GP] Analysis config: blocks=True, fft=False, similarity=False
[GP] Starting analysis...
[GP] Phase 1: Extracting building blocks...

*** [GPU 0] NEW GLOBAL BEST: 1498238.00 at gen 400 ***
    Saved to best_solution.json

[GPU 0] Gen   400 | Best: 1498238.00 | 41.4s
[GP] Phase 1 complete: Found 19 building blocks
[GP] Phase 2: FFT analysis DISABLED
[GP] Phase 3: Similarity analysis DISABLED
[GP] ========== GP ANALYSIS COMPLETE ==========


[GP] ========== CANDIDATE GENERATION STARTED ==========
[GP] Generating 20 new candidate solutions
[GP] Available data: 100 top solutions, 19 building blocks, 0 FFT patterns, 0 similarity patterns
[GP] Generation strategy: 6 block-based, 6 interpolated, 8 mutated
[GP] Strategy 1: Creating 6 candidates via building block combination...
[GP] Strategy 1 complete: 6 block-based candidates created
[GP] Strategy 2: Creating 6 candidates via solution interpolation...
[GP] Strategy 2 complete: 6 interpolated candidates created
[GP] Strategy 3: Creating 8 candidates via guided mutation...
[GP] Strategy 3 complete: 8 mutated candidates created
[GP] Total candidates generated: 20
[GP] Strategy breakdown: Block=12, Interp=12, Mut=16
[GP] ========== CANDIDATE GENERATION COMPLETE ==========

  -> 20 candidates sent to 1/1 workers
[GP] gpu_0 intermediate update: 1498238.00 at gen 400

*** [GPU 0] NEW GLOBAL BEST: 1461823.00 at gen 500 ***
    Saved to best_solution.json

[GPU 0] Gen   500 | Best: 1461823.00 | 51.9s
[GP] gpu_0 intermediate update: 1461823.00 at gen 500
[GPU 0] Gene injection: 20 candidates injected at gen 600 (total so far: 40)
[GP] gpu_0 intermediate update: 1439067.00 at gen 600

==================================================
GP ANALYSIS - Cycle 3
  Collected 100 solutions
==================================================

[GP] ========== GENETIC PROGRAMMING ANALYSIS STARTED ==========
[GP] Cycle: 2
[GP] Input: 100 solutions received for analysis
[GP] Fitness range: best=1438286.00, worst=1440293.00
[GP] Analysis config: blocks=True, fft=False, similarity=False
[GP] Starting analysis...
[GP] Phase 1: Extracting building blocks...

*** [GPU 0] NEW GLOBAL BEST: 1438286.00 at gen 600 ***
    Saved to best_solution.json

[GPU 0] Gen   600 | Best: 1438286.00 | 62.2s
[GP] Phase 1 complete: Found 0 building blocks
[GP] Phase 2: FFT analysis DISABLED
[GP] Phase 3: Similarity analysis DISABLED
[GP] ========== GP ANALYSIS COMPLETE ==========


[GP] ========== CANDIDATE GENERATION STARTED ==========
[GP] Generating 20 new candidate solutions
[GP] Available data: 100 top solutions, 0 building blocks, 0 FFT patterns, 0 similarity patterns
[GP] Generation strategy: 6 block-based, 6 interpolated, 8 mutated
[GP] Strategy 1: Creating 6 candidates via building block combination...
[GP] Strategy 1 complete: 6 block-based candidates created
[GP] Strategy 2: Creating 6 candidates via solution interpolation...
[GP] Strategy 2 complete: 6 interpolated candidates created
[GP] Strategy 3: Creating 8 candidates via guided mutation...
[GP] Strategy 3 complete: 8 mutated candidates created
[GP] Total candidates generated: 20
[GP] Strategy breakdown: Block=18, Interp=18, Mut=24
[GP] ========== CANDIDATE GENERATION COMPLETE ==========

  -> 20 candidates sent to 1/1 workers
[GP] gpu_0 intermediate update: 1438286.00 at gen 600

*** [GPU 0] NEW GLOBAL BEST: 1409398.00 at gen 700 ***
    Saved to best_solution.json

[GPU 0] Gen   700 | Best: 1409398.00 | 72.5s
[GP] gpu_0 intermediate update: 1409398.00 at gen 700
[GP] gpu_0 intermediate update: 1404489.00 at gen 800
[GPU 0] Gene injection: 20 candidates injected at gen 800 (total so far: 60)

==================================================
GP ANALYSIS - Cycle 4
  Collected 100 solutions
==================================================

[GP] ========== GENETIC PROGRAMMING ANALYSIS STARTED ==========
[GP] Cycle: 3
[GP] Input: 100 solutions received for analysis
[GP] Fitness range: best=1404386.00, worst=1404489.00
[GP] Analysis config: blocks=True, fft=False, similarity=False
[GP] Starting analysis...
[GP] Phase 1: Extracting building blocks...

*** [GPU 0] NEW GLOBAL BEST: 1404386.00 at gen 800 ***
    Saved to best_solution.json

[GPU 0] Gen   800 | Best: 1404386.00 | 82.9s
[GP] Phase 1 complete: Found 0 building blocks
[GP] Phase 2: FFT analysis DISABLED
[GP] Phase 3: Similarity analysis DISABLED
[GP] ========== GP ANALYSIS COMPLETE ==========


[GP] ========== CANDIDATE GENERATION STARTED ==========
[GP] Generating 20 new candidate solutions
[GP] Available data: 100 top solutions, 0 building blocks, 0 FFT patterns, 0 similarity patterns
[GP] Generation strategy: 6 block-based, 6 interpolated, 8 mutated
[GP] Strategy 1: Creating 6 candidates via building block combination...
[GP] Strategy 1 complete: 6 block-based candidates created
[GP] Strategy 2: Creating 6 candidates via solution interpolation...
[GP] Strategy 2 complete: 6 interpolated candidates created
[GP] Strategy 3: Creating 8 candidates via guided mutation...
[GP] Strategy 3 complete: 8 mutated candidates created
[GP] Total candidates generated: 20
[GP] Strategy breakdown: Block=24, Interp=24, Mut=32
[GP] ========== CANDIDATE GENERATION COMPLETE ==========

  -> 20 candidates sent to 1/1 workers
[GP] gpu_0 intermediate update: 1404386.00 at gen 800

*** [GPU 0] NEW GLOBAL BEST: 1393308.00 at gen 900 ***
    Saved to best_solution.json

[GPU 0] Gen   900 | Best: 1393308.00 | 93.0s
[GP] gpu_0 intermediate update: 1393308.00 at gen 900
[GPU 0] Gene injection: 20 candidates injected at gen 1000 (total so far: 80)
[GP] gpu_0 intermediate update: 1385266.00 at gen 1000

==================================================
GP ANALYSIS - Cycle 5
  Collected 100 solutions
==================================================

[GP] ========== GENETIC PROGRAMMING ANALYSIS STARTED ==========
[GP] Cycle: 4
[GP] Input: 100 solutions received for analysis
[GP] Fitness range: best=1384046.00, worst=1386485.00
[GP] Analysis config: blocks=True, fft=False, similarity=False
[GP] Starting analysis...
[GP] Phase 1: Extracting building blocks...

*** [GPU 0] NEW GLOBAL BEST: 1384046.00 at gen 1000 ***
    Saved to best_solution.json

[GPU 0] Gen  1000 | Best: 1384046.00 | 103.4s
    [Checkpoint] Saved to ./results/warm_start/blocks_only/gr431/1R10/job_times_9_seed0_1000.json
[GP] Phase 1 complete: Found 26 building blocks
[GP] Phase 2: FFT analysis DISABLED
[GP] Phase 3: Similarity analysis DISABLED
[GP] ========== GP ANALYSIS COMPLETE ==========


[GP] ========== CANDIDATE GENERATION STARTED ==========
[GP] Generating 20 new candidate solutions
[GP] Available data: 100 top solutions, 26 building blocks, 0 FFT patterns, 0 similarity patterns
[GP] Generation strategy: 6 block-based, 6 interpolated, 8 mutated
[GP] Strategy 1: Creating 6 candidates via building block combination...
[GP] Strategy 1 complete: 6 block-based candidates created
[GP] Strategy 2: Creating 6 candidates via solution interpolation...
[GP] Strategy 2 complete: 6 interpolated candidates created
[GP] Strategy 3: Creating 8 candidates via guided mutation...
[GP] Strategy 3 complete: 8 mutated candidates created
[GP] Total candidates generated: 20
[GP] Strategy breakdown: Block=30, Interp=30, Mut=40
[GP] ========== CANDIDATE GENERATION COMPLETE ==========

  -> 20 candidates sent to 1/1 workers

[CHECKPOINT] Saved A.json at gen 1000 (makespan: 1384046.00)
[GP] gpu_0 intermediate update: 1384046.00 at gen 1000

*** [GPU 0] NEW GLOBAL BEST: 1373740.00 at gen 1100 ***
    Saved to best_solution.json

[GPU 0] Gen  1100 | Best: 1373740.00 | 113.8s
[GP] gpu_0 intermediate update: 1373740.00 at gen 1100
[GP] gpu_0 intermediate update: 1367835.00 at gen 1200
[GPU 0] Gene injection: 20 candidates injected at gen 1200 (total so far: 100)

==================================================
GP ANALYSIS - Cycle 6
  Collected 100 solutions
==================================================

[GP] ========== GENETIC PROGRAMMING ANALYSIS STARTED ==========
[GP] Cycle: 5
[GP] Input: 100 solutions received for analysis
[GP] Fitness range: best=1367835.00, worst=1367835.00
[GP] Analysis config: blocks=True, fft=False, similarity=False
[GP] Starting analysis...
[GP] Phase 1: Extracting building blocks...

*** [GPU 0] NEW GLOBAL BEST: 1367835.00 at gen 1200 ***
    Saved to best_solution.json

[GPU 0] Gen  1200 | Best: 1367835.00 | 124.0s
[GP] Phase 1 complete: Found 25 building blocks
[GP] Phase 2: FFT analysis DISABLED
[GP] Phase 3: Similarity analysis DISABLED
[GP] ========== GP ANALYSIS COMPLETE ==========


[GP] ========== CANDIDATE GENERATION STARTED ==========
[GP] Generating 20 new candidate solutions
[GP] Available data: 100 top solutions, 25 building blocks, 0 FFT patterns, 0 similarity patterns
[GP] Generation strategy: 6 block-based, 6 interpolated, 8 mutated
[GP] Strategy 1: Creating 6 candidates via building block combination...
[GP] Strategy 1 complete: 6 block-based candidates created
[GP] Strategy 2: Creating 6 candidates via solution interpolation...
[GP] Strategy 2 complete: 6 interpolated candidates created
[GP] Strategy 3: Creating 8 candidates via guided mutation...
[GP] Strategy 3 complete: 8 mutated candidates created
[GP] Total candidates generated: 20
[GP] Strategy breakdown: Block=36, Interp=36, Mut=48
[GP] ========== CANDIDATE GENERATION COMPLETE ==========


*** [GPU 0] NEW GLOBAL BEST: 1360816.00 at gen 1300 ***
    Saved to best_solution.json

[GPU 0] Gen  1300 | Best: 1360816.00 | 134.3s
  -> 20 candidates sent to 1/1 workers
[GP] gpu_0 intermediate update: 1360816.00 at gen 1300
[GP] gpu_0 intermediate update: 1355858.00 at gen 1400
[GPU 0] Gene injection: 20 candidates injected at gen 1400 (total so far: 120)

*** [GPU 0] NEW GLOBAL BEST: 1355858.00 at gen 1400 ***
    Saved to best_solution.json

[GPU 0] Gen  1400 | Best: 1355858.00 | 144.7s

==================================================
GP ANALYSIS - Cycle 7
  Collected 100 solutions
==================================================

[GP] ========== GENETIC PROGRAMMING ANALYSIS STARTED ==========
[GP] Cycle: 6
[GP] Input: 100 solutions received for analysis
[GP] Fitness range: best=1355858.00, worst=1355858.00
[GP] Analysis config: blocks=True, fft=False, similarity=False
[GP] Starting analysis...
[GP] Phase 1: Extracting building blocks...
[GP] Phase 1 complete: Found 0 building blocks
[GP] Phase 2: FFT analysis DISABLED
[GP] Phase 3: Similarity analysis DISABLED
[GP] ========== GP ANALYSIS COMPLETE ==========


[GP] ========== CANDIDATE GENERATION STARTED ==========
[GP] Generating 20 new candidate solutions
[GP] Available data: 100 top solutions, 0 building blocks, 0 FFT patterns, 0 similarity patterns
[GP] Generation strategy: 6 block-based, 6 interpolated, 8 mutated
[GP] Strategy 1: Creating 6 candidates via building block combination...
[GP] Strategy 1 complete: 6 block-based candidates created
[GP] Strategy 2: Creating 6 candidates via solution interpolation...
[GP] Strategy 2 complete: 6 interpolated candidates created
[GP] Strategy 3: Creating 8 candidates via guided mutation...
[GP] Strategy 3 complete: 8 mutated candidates created
[GP] Total candidates generated: 20
[GP] Strategy breakdown: Block=42, Interp=42, Mut=56
[GP] ========== CANDIDATE GENERATION COMPLETE ==========


*** [GPU 0] NEW GLOBAL BEST: 1351738.00 at gen 1500 ***
    Saved to best_solution.json

[GPU 0] Gen  1500 | Best: 1351738.00 | 154.7s
  -> 20 candidates sent to 1/1 workers
[GP] gpu_0 intermediate update: 1351738.00 at gen 1500
[GPU 0] Gene injection: 20 candidates injected at gen 1600 (total so far: 140)
[GP] gpu_0 intermediate update: 1344372.00 at gen 1600

==================================================
GP ANALYSIS - Cycle 8
  Collected 100 solutions
==================================================

[GP] ========== GENETIC PROGRAMMING ANALYSIS STARTED ==========
[GP] Cycle: 7
[GP] Input: 100 solutions received for analysis
[GP] Fitness range: best=1344372.00, worst=1344813.00
[GP] Analysis config: blocks=True, fft=False, similarity=False
[GP] Starting analysis...
[GP] Phase 1: Extracting building blocks...

*** [GPU 0] NEW GLOBAL BEST: 1344372.00 at gen 1600 ***
    Saved to best_solution.json

[GPU 0] Gen  1600 | Best: 1344372.00 | 165.1s
[GP] Phase 1 complete: Found 0 building blocks
[GP] Phase 2: FFT analysis DISABLED
[GP] Phase 3: Similarity analysis DISABLED
[GP] ========== GP ANALYSIS COMPLETE ==========


[GP] ========== CANDIDATE GENERATION STARTED ==========
[GP] Generating 20 new candidate solutions
[GP] Available data: 100 top solutions, 0 building blocks, 0 FFT patterns, 0 similarity patterns
[GP] Generation strategy: 6 block-based, 6 interpolated, 8 mutated
[GP] Strategy 1: Creating 6 candidates via building block combination...
[GP] Strategy 1 complete: 6 block-based candidates created
[GP] Strategy 2: Creating 6 candidates via solution interpolation...
[GP] Strategy 2 complete: 6 interpolated candidates created
[GP] Strategy 3: Creating 8 candidates via guided mutation...
[GP] Strategy 3 complete: 8 mutated candidates created
[GP] Total candidates generated: 20
[GP] Strategy breakdown: Block=48, Interp=48, Mut=64
[GP] ========== CANDIDATE GENERATION COMPLETE ==========


*** [GPU 0] NEW GLOBAL BEST: 1343859.00 at gen 1700 ***
    Saved to best_solution.json

[GPU 0] Gen  1700 | Best: 1343859.00 | 175.6s
  -> 20 candidates sent to 1/1 workers
[GP] gpu_0 intermediate update: 1343859.00 at gen 1700
[GPU 0] Gene injection: 20 candidates injected at gen 1800 (total so far: 160)

==================================================
GP ANALYSIS - Cycle 9
  Collected 100 solutions
==================================================

[GP] ========== GENETIC PROGRAMMING ANALYSIS STARTED ==========
[GP] Cycle: 8
[GP] Input: 100 solutions received for analysis
[GP] Fitness range: best=1343859.00, worst=1343859.00
[GP] Analysis config: blocks=True, fft=False, similarity=False
[GP] Starting analysis...
[GP] Phase 1: Extracting building blocks...
[GPU 0] Gen  1800 | Best: 1343859.00 | 186.0s
[GP] Phase 1 complete: Found 0 building blocks
[GP] Phase 2: FFT analysis DISABLED
[GP] Phase 3: Similarity analysis DISABLED
[GP] ========== GP ANALYSIS COMPLETE ==========


[GP] ========== CANDIDATE GENERATION STARTED ==========
[GP] Generating 20 new candidate solutions
[GP] Available data: 100 top solutions, 0 building blocks, 0 FFT patterns, 0 similarity patterns
[GP] Generation strategy: 6 block-based, 6 interpolated, 8 mutated
[GP] Strategy 1: Creating 6 candidates via building block combination...
[GP] Strategy 1 complete: 6 block-based candidates created
[GP] Strategy 2: Creating 6 candidates via solution interpolation...
[GP] Strategy 2 complete: 6 interpolated candidates created
[GP] Strategy 3: Creating 8 candidates via guided mutation...
[GP] Strategy 3 complete: 8 mutated candidates created
[GP] Total candidates generated: 20
[GP] Strategy breakdown: Block=54, Interp=54, Mut=72
[GP] ========== CANDIDATE GENERATION COMPLETE ==========


*** [GPU 0] NEW GLOBAL BEST: 1340803.00 at gen 1900 ***
    Saved to best_solution.json

[GPU 0] Gen  1900 | Best: 1340803.00 | 196.1s
  -> 20 candidates sent to 1/1 workers
[GP] gpu_0 intermediate update: 1340803.00 at gen 1900
[GP] gpu_0 intermediate update: 1337609.00 at gen 2000
[GPU 0] Gene injection: 20 candidates injected at gen 2000 (total so far: 180)

==================================================
GP ANALYSIS - Cycle 10
  Collected 100 solutions
==================================================

[GP] ========== GENETIC PROGRAMMING ANALYSIS STARTED ==========
[GP] Cycle: 9
[GP] Input: 100 solutions received for analysis
[GP] Fitness range: best=1337609.00, worst=1337609.00
[GP] Analysis config: blocks=True, fft=False, similarity=False
[GP] Starting analysis...
[GP] Phase 1: Extracting building blocks...

*** [GPU 0] NEW GLOBAL BEST: 1337609.00 at gen 2000 ***
    Saved to best_solution.json

[GPU 0] Gen  2000 | Best: 1337609.00 | 206.3s
    [Checkpoint] Saved to ./results/warm_start/blocks_only/gr431/1R10/job_times_9_seed0_2000.json
[GP] Phase 1 complete: Found 10 building blocks
[GP] Phase 2: FFT analysis DISABLED
[GP] Phase 3: Similarity analysis DISABLED
[GP] ========== GP ANALYSIS COMPLETE ==========


[GP] ========== CANDIDATE GENERATION STARTED ==========
[GP] Generating 20 new candidate solutions
[GP] Available data: 100 top solutions, 10 building blocks, 0 FFT patterns, 0 similarity patterns
[GP] Generation strategy: 6 block-based, 6 interpolated, 8 mutated
[GP] Strategy 1: Creating 6 candidates via building block combination...
[GP] Strategy 1 complete: 6 block-based candidates created
[GP] Strategy 2: Creating 6 candidates via solution interpolation...
[GP] Strategy 2 complete: 6 interpolated candidates created
[GP] Strategy 3: Creating 8 candidates via guided mutation...
[GP] Strategy 3 complete: 8 mutated candidates created
[GP] Total candidates generated: 20
[GP] Strategy breakdown: Block=60, Interp=60, Mut=80
[GP] ========== CANDIDATE GENERATION COMPLETE ==========

  -> 20 candidates sent to 1/1 workers

[CHECKPOINT] Saved B.json at gen 2000 (makespan: 1337609.00)

*** [GPU 0] NEW GLOBAL BEST: 1329905.00 at gen 2100 ***
    Saved to best_solution.json

[GPU 0] Gen  2100 | Best: 1329905.00 | 216.6s
[GP] gpu_0 intermediate update: 1329905.00 at gen 2100
[GPU 0] Gene injection: 20 candidates injected at gen 2200 (total so far: 200)
[GP] gpu_0 intermediate update: 1325415.00 at gen 2200

==================================================
GP ANALYSIS - Cycle 11
  Collected 100 solutions
==================================================

[GP] ========== GENETIC PROGRAMMING ANALYSIS STARTED ==========
[GP] Cycle: 10
[GP] Input: 100 solutions received for analysis
[GP] Fitness range: best=1325415.00, worst=1325415.00
[GP] Analysis config: blocks=True, fft=False, similarity=False
[GP] Starting analysis...
[GP] Phase 1: Extracting building blocks...

*** [GPU 0] NEW GLOBAL BEST: 1325415.00 at gen 2200 ***
    Saved to best_solution.json

[GPU 0] Gen  2200 | Best: 1325415.00 | 226.9s
[GP] Phase 1 complete: Found 9 building blocks
[GP] Phase 2: FFT analysis DISABLED
[GP] Phase 3: Similarity analysis DISABLED
[GP] ========== GP ANALYSIS COMPLETE ==========


[GP] ========== CANDIDATE GENERATION STARTED ==========
[GP] Generating 20 new candidate solutions
[GP] Available data: 100 top solutions, 9 building blocks, 0 FFT patterns, 0 similarity patterns
[GP] Generation strategy: 6 block-based, 6 interpolated, 8 mutated
[GP] Strategy 1: Creating 6 candidates via building block combination...
[GP] Strategy 1 complete: 6 block-based candidates created
[GP] Strategy 2: Creating 6 candidates via solution interpolation...
[GP] Strategy 2 complete: 6 interpolated candidates created
[GP] Strategy 3: Creating 8 candidates via guided mutation...
[GP] Strategy 3 complete: 8 mutated candidates created
[GP] Total candidates generated: 20
[GP] Strategy breakdown: Block=66, Interp=66, Mut=88
[GP] ========== CANDIDATE GENERATION COMPLETE ==========


*** [GPU 0] NEW GLOBAL BEST: 1317693.00 at gen 2300 ***
    Saved to best_solution.json

[GPU 0] Gen  2300 | Best: 1317693.00 | 237.3s
  -> 20 candidates sent to 1/1 workers
[GP] gpu_0 intermediate update: 1317693.00 at gen 2300
[GPU 0] Gene injection: 20 candidates injected at gen 2400 (total so far: 220)
[GP] gpu_0 intermediate update: 1311389.00 at gen 2400

==================================================
GP ANALYSIS - Cycle 12
  Collected 100 solutions
==================================================

[GP] ========== GENETIC PROGRAMMING ANALYSIS STARTED ==========
[GP] Cycle: 11
[GP] Input: 100 solutions received for analysis
[GP] Fitness range: best=1311389.00, worst=1312859.00
[GP] Analysis config: blocks=True, fft=False, similarity=False
[GP] Starting analysis...
[GP] Phase 1: Extracting building blocks...

*** [GPU 0] NEW GLOBAL BEST: 1311389.00 at gen 2400 ***
    Saved to best_solution.json

[GPU 0] Gen  2400 | Best: 1311389.00 | 247.8s
[GP] Phase 1 complete: Found 1 building blocks
[GP] Phase 2: FFT analysis DISABLED
[GP] Phase 3: Similarity analysis DISABLED
[GP] ========== GP ANALYSIS COMPLETE ==========


[GP] ========== CANDIDATE GENERATION STARTED ==========
[GP] Generating 20 new candidate solutions
[GP] Available data: 100 top solutions, 1 building blocks, 0 FFT patterns, 0 similarity patterns
[GP] Generation strategy: 6 block-based, 6 interpolated, 8 mutated
[GP] Strategy 1: Creating 6 candidates via building block combination...
[GP] Strategy 1 complete: 6 block-based candidates created
[GP] Strategy 2: Creating 6 candidates via solution interpolation...
[GP] Strategy 2 complete: 6 interpolated candidates created
[GP] Strategy 3: Creating 8 candidates via guided mutation...
[GP] Strategy 3 complete: 8 mutated candidates created
[GP] Total candidates generated: 20
[GP] Strategy breakdown: Block=72, Interp=72, Mut=96
[GP] ========== CANDIDATE GENERATION COMPLETE ==========


*** [GPU 0] NEW GLOBAL BEST: 1302199.00 at gen 2500 ***
    Saved to best_solution.json

[GPU 0] Gen  2500 | Best: 1302199.00 | 258.0s
  -> 20 candidates sent to 1/1 workers
[GP] gpu_0 intermediate update: 1302199.00 at gen 2500
[GPU 0] Gene injection: 20 candidates injected at gen 2600 (total so far: 240)
[GP] gpu_0 intermediate update: 1299377.00 at gen 2600

==================================================
GP ANALYSIS - Cycle 13
  Collected 100 solutions
==================================================

[GP] ========== GENETIC PROGRAMMING ANALYSIS STARTED ==========
[GP] Cycle: 12
[GP] Input: 100 solutions received for analysis
[GP] Fitness range: best=1299377.00, worst=1299377.00
[GP] Analysis config: blocks=True, fft=False, similarity=False
[GP] Starting analysis...
[GP] Phase 1: Extracting building blocks...

*** [GPU 0] NEW GLOBAL BEST: 1299377.00 at gen 2600 ***
    Saved to best_solution.json

[GPU 0] Gen  2600 | Best: 1299377.00 | 268.3s
[GP] Phase 1 complete: Found 0 building blocks
[GP] Phase 2: FFT analysis DISABLED
[GP] Phase 3: Similarity analysis DISABLED
[GP] ========== GP ANALYSIS COMPLETE ==========


[GP] ========== CANDIDATE GENERATION STARTED ==========
[GP] Generating 20 new candidate solutions
[GP] Available data: 100 top solutions, 0 building blocks, 0 FFT patterns, 0 similarity patterns
[GP] Generation strategy: 6 block-based, 6 interpolated, 8 mutated
[GP] Strategy 1: Creating 6 candidates via building block combination...
[GP] Strategy 1 complete: 6 block-based candidates created
[GP] Strategy 2: Creating 6 candidates via solution interpolation...
[GP] Strategy 2 complete: 6 interpolated candidates created
[GP] Strategy 3: Creating 8 candidates via guided mutation...
[GP] Strategy 3 complete: 8 mutated candidates created
[GP] Total candidates generated: 20
[GP] Strategy breakdown: Block=78, Interp=78, Mut=104
[GP] ========== CANDIDATE GENERATION COMPLETE ==========

[GPU 0] Gen  2700 | Best: 1299377.00 | 278.4s
  -> 20 candidates sent to 1/1 workers
[GP] gpu_0 intermediate update: 1294411.00 at gen 2800
[GPU 0] Gene injection: 20 candidates injected at gen 2800 (total so far: 260)

==================================================
GP ANALYSIS - Cycle 14
  Collected 100 solutions
==================================================

[GP] ========== GENETIC PROGRAMMING ANALYSIS STARTED ==========
[GP] Cycle: 13
[GP] Input: 100 solutions received for analysis
[GP] Fitness range: best=1294411.00, worst=1294803.00
[GP] Analysis config: blocks=True, fft=False, similarity=False
[GP] Starting analysis...
[GP] Phase 1: Extracting building blocks...

*** [GPU 0] NEW GLOBAL BEST: 1294411.00 at gen 2800 ***
    Saved to best_solution.json

[GPU 0] Gen  2800 | Best: 1294411.00 | 288.5s
[GP] Phase 1 complete: Found 0 building blocks
[GP] Phase 2: FFT analysis DISABLED
[GP] Phase 3: Similarity analysis DISABLED
[GP] ========== GP ANALYSIS COMPLETE ==========


[GP] ========== CANDIDATE GENERATION STARTED ==========
[GP] Generating 20 new candidate solutions
[GP] Available data: 100 top solutions, 0 building blocks, 0 FFT patterns, 0 similarity patterns
[GP] Generation strategy: 6 block-based, 6 interpolated, 8 mutated
[GP] Strategy 1: Creating 6 candidates via building block combination...
[GP] Strategy 1 complete: 6 block-based candidates created
[GP] Strategy 2: Creating 6 candidates via solution interpolation...
[GP] Strategy 2 complete: 6 interpolated candidates created
[GP] Strategy 3: Creating 8 candidates via guided mutation...
[GP] Strategy 3 complete: 8 mutated candidates created
[GP] Total candidates generated: 20
[GP] Strategy breakdown: Block=84, Interp=84, Mut=112
[GP] ========== CANDIDATE GENERATION COMPLETE ==========


*** [GPU 0] NEW GLOBAL BEST: 1293055.00 at gen 2900 ***
    Saved to best_solution.json

[GPU 0] Gen  2900 | Best: 1293055.00 | 299.0s
  -> 20 candidates sent to 1/1 workers
[GP] gpu_0 intermediate update: 1293055.00 at gen 2900
[GPU 0] Gene injection: 20 candidates injected at gen 3000 (total so far: 280)
[GP] gpu_0 intermediate update: 1289072.00 at gen 3000

==================================================
GP ANALYSIS - Cycle 15
  Collected 100 solutions
==================================================

[GP] ========== GENETIC PROGRAMMING ANALYSIS STARTED ==========
[GP] Cycle: 14
[GP] Input: 100 solutions received for analysis
[GP] Fitness range: best=1288914.00, worst=1289072.00
[GP] Analysis config: blocks=True, fft=False, similarity=False
[GP] Starting analysis...
[GP] Phase 1: Extracting building blocks...

*** [GPU 0] NEW GLOBAL BEST: 1288914.00 at gen 3000 ***
    Saved to best_solution.json

[GPU 0] Gen  3000 | Best: 1288914.00 | 309.3s
    [Checkpoint] Saved to ./results/warm_start/blocks_only/gr431/1R10/job_times_9_seed0_3000.json
[GP] Phase 1 complete: Found 19 building blocks
[GP] Phase 2: FFT analysis DISABLED
[GP] Phase 3: Similarity analysis DISABLED
[GP] ========== GP ANALYSIS COMPLETE ==========


[GP] ========== CANDIDATE GENERATION STARTED ==========
[GP] Generating 20 new candidate solutions
[GP] Available data: 100 top solutions, 19 building blocks, 0 FFT patterns, 0 similarity patterns
[GP] Generation strategy: 6 block-based, 6 interpolated, 8 mutated
[GP] Strategy 1: Creating 6 candidates via building block combination...
[GP] Strategy 1 complete: 6 block-based candidates created
[GP] Strategy 2: Creating 6 candidates via solution interpolation...
[GP] Strategy 2 complete: 6 interpolated candidates created
[GP] Strategy 3: Creating 8 candidates via guided mutation...
[GP] Strategy 3 complete: 8 mutated candidates created
[GP] Total candidates generated: 20
[GP] Strategy breakdown: Block=90, Interp=90, Mut=120
[GP] ========== CANDIDATE GENERATION COMPLETE ==========

  -> 20 candidates sent to 1/1 workers

[CHECKPOINT] Saved C.json at gen 3000 (makespan: 1288914.00)
[GP] gpu_0 intermediate update: 1288914.00 at gen 3000

*** [GPU 0] NEW GLOBAL BEST: 1281818.00 at gen 3100 ***
    Saved to best_solution.json

[GPU 0] Gen  3100 | Best: 1281818.00 | 319.7s
[GP] gpu_0 intermediate update: 1281818.00 at gen 3100
[GPU 0] Gene injection: 20 candidates injected at gen 3200 (total so far: 300)
[GP] gpu_0 intermediate update: 1278435.00 at gen 3200

==================================================
GP ANALYSIS - Cycle 16
  Collected 100 solutions
==================================================

[GP] ========== GENETIC PROGRAMMING ANALYSIS STARTED ==========
[GP] Cycle: 15
[GP] Input: 100 solutions received for analysis
[GP] Fitness range: best=1278435.00, worst=1278435.00
[GP] Analysis config: blocks=True, fft=False, similarity=False
[GP] Starting analysis...
[GP] Phase 1: Extracting building blocks...

*** [GPU 0] NEW GLOBAL BEST: 1278435.00 at gen 3200 ***
    Saved to best_solution.json

[GPU 0] Gen  3200 | Best: 1278435.00 | 330.0s
[GP] Phase 1 complete: Found 3 building blocks
[GP] Phase 2: FFT analysis DISABLED
[GP] Phase 3: Similarity analysis DISABLED
[GP] ========== GP ANALYSIS COMPLETE ==========


[GP] ========== CANDIDATE GENERATION STARTED ==========
[GP] Generating 20 new candidate solutions
[GP] Available data: 100 top solutions, 3 building blocks, 0 FFT patterns, 0 similarity patterns
[GP] Generation strategy: 6 block-based, 6 interpolated, 8 mutated
[GP] Strategy 1: Creating 6 candidates via building block combination...
[GP] Strategy 1 complete: 6 block-based candidates created
[GP] Strategy 2: Creating 6 candidates via solution interpolation...
[GP] Strategy 2 complete: 6 interpolated candidates created
[GP] Strategy 3: Creating 8 candidates via guided mutation...
[GP] Strategy 3 complete: 8 mutated candidates created
[GP] Total candidates generated: 20
[GP] Strategy breakdown: Block=96, Interp=96, Mut=128
[GP] ========== CANDIDATE GENERATION COMPLETE ==========


*** [GPU 0] NEW GLOBAL BEST: 1273091.00 at gen 3300 ***
    Saved to best_solution.json

[GPU 0] Gen  3300 | Best: 1273091.00 | 340.4s
  -> 20 candidates sent to 1/1 workers
[GP] gpu_0 intermediate update: 1273091.00 at gen 3300
[GPU 0] Gene injection: 20 candidates injected at gen 3400 (total so far: 320)
[GP] gpu_0 intermediate update: 1268886.00 at gen 3400

==================================================
GP ANALYSIS - Cycle 17
  Collected 100 solutions
==================================================

[GP] ========== GENETIC PROGRAMMING ANALYSIS STARTED ==========
[GP] Cycle: 16
[GP] Input: 100 solutions received for analysis
[GP] Fitness range: best=1268886.00, worst=1268886.00
[GP] Analysis config: blocks=True, fft=False, similarity=False
[GP] Starting analysis...
[GP] Phase 1: Extracting building blocks...

*** [GPU 0] NEW GLOBAL BEST: 1268886.00 at gen 3400 ***
    Saved to best_solution.json

[GPU 0] Gen  3400 | Best: 1268886.00 | 350.7s
[GP] Phase 1 complete: Found 0 building blocks
[GP] Phase 2: FFT analysis DISABLED
[GP] Phase 3: Similarity analysis DISABLED
[GP] ========== GP ANALYSIS COMPLETE ==========


[GP] ========== CANDIDATE GENERATION STARTED ==========
[GP] Generating 20 new candidate solutions
[GP] Available data: 100 top solutions, 0 building blocks, 0 FFT patterns, 0 similarity patterns
[GP] Generation strategy: 6 block-based, 6 interpolated, 8 mutated
[GP] Strategy 1: Creating 6 candidates via building block combination...
[GP] Strategy 1 complete: 6 block-based candidates created
[GP] Strategy 2: Creating 6 candidates via solution interpolation...
[GP] Strategy 2 complete: 6 interpolated candidates created
[GP] Strategy 3: Creating 8 candidates via guided mutation...
[GP] Strategy 3 complete: 8 mutated candidates created
[GP] Total candidates generated: 20
[GP] Strategy breakdown: Block=102, Interp=102, Mut=136
[GP] ========== CANDIDATE GENERATION COMPLETE ==========


*** [GPU 0] NEW GLOBAL BEST: 1264610.00 at gen 3500 ***
    Saved to best_solution.json

[GPU 0] Gen  3500 | Best: 1264610.00 | 360.9s
  -> 20 candidates sent to 1/1 workers
[GP] gpu_0 intermediate update: 1264610.00 at gen 3500
[GP] gpu_0 intermediate update: 1263544.00 at gen 3600
[GPU 0] Gene injection: 20 candidates injected at gen 3600 (total so far: 340)

==================================================
GP ANALYSIS - Cycle 18
  Collected 100 solutions
==================================================

[GP] ========== GENETIC PROGRAMMING ANALYSIS STARTED ==========
[GP] Cycle: 17
[GP] Input: 100 solutions received for analysis
[GP] Fitness range: best=1263485.00, worst=1263544.00
[GP] Analysis config: blocks=True, fft=False, similarity=False
[GP] Starting analysis...
[GP] Phase 1: Extracting building blocks...

*** [GPU 0] NEW GLOBAL BEST: 1263485.00 at gen 3600 ***
    Saved to best_solution.json

[GPU 0] Gen  3600 | Best: 1263485.00 | 371.3s
[GP] Phase 1 complete: Found 7 building blocks
[GP] Phase 2: FFT analysis DISABLED
[GP] Phase 3: Similarity analysis DISABLED
[GP] ========== GP ANALYSIS COMPLETE ==========


[GP] ========== CANDIDATE GENERATION STARTED ==========
[GP] Generating 20 new candidate solutions
[GP] Available data: 100 top solutions, 7 building blocks, 0 FFT patterns, 0 similarity patterns
[GP] Generation strategy: 6 block-based, 6 interpolated, 8 mutated
[GP] Strategy 1: Creating 6 candidates via building block combination...
[GP] Strategy 1 complete: 6 block-based candidates created
[GP] Strategy 2: Creating 6 candidates via solution interpolation...
[GP] Strategy 2 complete: 6 interpolated candidates created
[GP] Strategy 3: Creating 8 candidates via guided mutation...
[GP] Strategy 3 complete: 8 mutated candidates created
[GP] Total candidates generated: 20
[GP] Strategy breakdown: Block=108, Interp=108, Mut=144
[GP] ========== CANDIDATE GENERATION COMPLETE ==========

  -> 20 candidates sent to 1/1 workers
[GP] gpu_0 intermediate update: 1263485.00 at gen 3600

*** [GPU 0] NEW GLOBAL BEST: 1262220.00 at gen 3700 ***
    Saved to best_solution.json

[GPU 0] Gen  3700 | Best: 1262220.00 | 381.5s
[GP] gpu_0 intermediate update: 1262220.00 at gen 3700
[GP] gpu_0 intermediate update: 1261369.00 at gen 3800
[GPU 0] Gene injection: 20 candidates injected at gen 3800 (total so far: 360)

*** [GPU 0] NEW GLOBAL BEST: 1261369.00 at gen 3800 ***
    Saved to best_solution.json

[GPU 0] Gen  3800 | Best: 1261369.00 | 391.8s

==================================================
GP ANALYSIS - Cycle 19
  Collected 100 solutions
==================================================

[GP] ========== GENETIC PROGRAMMING ANALYSIS STARTED ==========
[GP] Cycle: 18
[GP] Input: 100 solutions received for analysis
[GP] Fitness range: best=1261369.00, worst=1261369.00
[GP] Analysis config: blocks=True, fft=False, similarity=False
[GP] Starting analysis...
[GP] Phase 1: Extracting building blocks...
[GP] Phase 1 complete: Found 7 building blocks
[GP] Phase 2: FFT analysis DISABLED
[GP] Phase 3: Similarity analysis DISABLED
[GP] ========== GP ANALYSIS COMPLETE ==========


[GP] ========== CANDIDATE GENERATION STARTED ==========
[GP] Generating 20 new candidate solutions
[GP] Available data: 100 top solutions, 7 building blocks, 0 FFT patterns, 0 similarity patterns
[GP] Generation strategy: 6 block-based, 6 interpolated, 8 mutated
[GP] Strategy 1: Creating 6 candidates via building block combination...
[GP] Strategy 1 complete: 6 block-based candidates created
[GP] Strategy 2: Creating 6 candidates via solution interpolation...
[GP] Strategy 2 complete: 6 interpolated candidates created
[GP] Strategy 3: Creating 8 candidates via guided mutation...
[GP] Strategy 3 complete: 8 mutated candidates created
[GP] Total candidates generated: 20
[GP] Strategy breakdown: Block=114, Interp=114, Mut=152
[GP] ========== CANDIDATE GENERATION COMPLETE ==========


*** [GPU 0] NEW GLOBAL BEST: 1260845.00 at gen 3900 ***
    Saved to best_solution.json

[GPU 0] Gen  3900 | Best: 1260845.00 | 401.9s
  -> 20 candidates sent to 1/1 workers
[GP] gpu_0 intermediate update: 1260845.00 at gen 3900
[GPU 0] Gene injection: 20 candidates injected at gen 4000 (total so far: 380)

==================================================
GP ANALYSIS - Cycle 20
  Collected 100 solutions
==================================================

[GP] ========== GENETIC PROGRAMMING ANALYSIS STARTED ==========
[GP] Cycle: 19
[GP] Input: 100 solutions received for analysis
[GP] Fitness range: best=1260845.00, worst=1260845.00
[GP] Analysis config: blocks=True, fft=False, similarity=False
[GP] Starting analysis...
[GP] Phase 1: Extracting building blocks...
[GPU 0] Gen  4000 | Best: 1260845.00 | 412.1s
    [Checkpoint] Saved to ./results/warm_start/blocks_only/gr431/1R10/job_times_9_seed0_4000.json
[GP] Phase 1 complete: Found 10 building blocks
[GP] Phase 2: FFT analysis DISABLED
[GP] Phase 3: Similarity analysis DISABLED
[GP] ========== GP ANALYSIS COMPLETE ==========


[GP] ========== CANDIDATE GENERATION STARTED ==========
[GP] Generating 20 new candidate solutions
[GP] Available data: 100 top solutions, 10 building blocks, 0 FFT patterns, 0 similarity patterns
[GP] Generation strategy: 6 block-based, 6 interpolated, 8 mutated
[GP] Strategy 1: Creating 6 candidates via building block combination...
[GP] Strategy 1 complete: 6 block-based candidates created
[GP] Strategy 2: Creating 6 candidates via solution interpolation...
[GP] Strategy 2 complete: 6 interpolated candidates created
[GP] Strategy 3: Creating 8 candidates via guided mutation...
[GP] Strategy 3 complete: 8 mutated candidates created
[GP] Total candidates generated: 20
[GP] Strategy breakdown: Block=120, Interp=120, Mut=160
[GP] ========== CANDIDATE GENERATION COMPLETE ==========

  -> 20 candidates sent to 1/1 workers

[CHECKPOINT] Saved D.json at gen 4000 (makespan: 1260845.00)
[GPU 0] Gen  4100 | Best: 1260845.00 | 422.2s
[GPU 0] Gene injection: 20 candidates injected at gen 4200 (total so far: 400)
[GP] gpu_0 intermediate update: 1260268.00 at gen 4200

==================================================
GP ANALYSIS - Cycle 21
  Collected 100 solutions
==================================================

[GP] ========== GENETIC PROGRAMMING ANALYSIS STARTED ==========
[GP] Cycle: 20
[GP] Input: 100 solutions received for analysis
[GP] Fitness range: best=1260268.00, worst=1260268.00
[GP] Analysis config: blocks=True, fft=False, similarity=False
[GP] Starting analysis...
[GP] Phase 1: Extracting building blocks...

*** [GPU 0] NEW GLOBAL BEST: 1260268.00 at gen 4200 ***
    Saved to best_solution.json

[GPU 0] Gen  4200 | Best: 1260268.00 | 432.7s
[GP] Phase 1 complete: Found 1 building blocks
[GP] Phase 2: FFT analysis DISABLED
[GP] Phase 3: Similarity analysis DISABLED
[GP] ========== GP ANALYSIS COMPLETE ==========


[GP] ========== CANDIDATE GENERATION STARTED ==========
[GP] Generating 20 new candidate solutions
[GP] Available data: 100 top solutions, 1 building blocks, 0 FFT patterns, 0 similarity patterns
[GP] Generation strategy: 6 block-based, 6 interpolated, 8 mutated
[GP] Strategy 1: Creating 6 candidates via building block combination...
[GP] Strategy 1 complete: 6 block-based candidates created
[GP] Strategy 2: Creating 6 candidates via solution interpolation...
[GP] Strategy 2 complete: 6 interpolated candidates created
[GP] Strategy 3: Creating 8 candidates via guided mutation...
[GP] Strategy 3 complete: 8 mutated candidates created
[GP] Total candidates generated: 20
[GP] Strategy breakdown: Block=126, Interp=126, Mut=168
[GP] ========== CANDIDATE GENERATION COMPLETE ==========


*** [GPU 0] NEW GLOBAL BEST: 1259737.00 at gen 4300 ***
    Saved to best_solution.json

[GPU 0] Gen  4300 | Best: 1259737.00 | 443.2s
  -> 20 candidates sent to 1/1 workers
[GP] gpu_0 intermediate update: 1259737.00 at gen 4300
[GPU 0] Gene injection: 20 candidates injected at gen 4400 (total so far: 420)

==================================================
GP ANALYSIS - Cycle 22
  Collected 100 solutions
==================================================

[GP] ========== GENETIC PROGRAMMING ANALYSIS STARTED ==========
[GP] Cycle: 21
[GP] Input: 100 solutions received for analysis
[GP] Fitness range: best=1259737.00, worst=1259737.00
[GP] Analysis config: blocks=True, fft=False, similarity=False
[GP] Starting analysis...
[GP] Phase 1: Extracting building blocks...
[GPU 0] Gen  4400 | Best: 1259737.00 | 453.6s
[GP] Phase 1 complete: Found 19 building blocks
[GP] Phase 2: FFT analysis DISABLED
[GP] Phase 3: Similarity analysis DISABLED
[GP] ========== GP ANALYSIS COMPLETE ==========


[GP] ========== CANDIDATE GENERATION STARTED ==========
[GP] Generating 20 new candidate solutions
[GP] Available data: 100 top solutions, 19 building blocks, 0 FFT patterns, 0 similarity patterns
[GP] Generation strategy: 6 block-based, 6 interpolated, 8 mutated
[GP] Strategy 1: Creating 6 candidates via building block combination...
[GP] Strategy 1 complete: 6 block-based candidates created
[GP] Strategy 2: Creating 6 candidates via solution interpolation...
[GP] Strategy 2 complete: 6 interpolated candidates created
[GP] Strategy 3: Creating 8 candidates via guided mutation...
[GP] Strategy 3 complete: 8 mutated candidates created
[GP] Total candidates generated: 20
[GP] Strategy breakdown: Block=132, Interp=132, Mut=176
[GP] ========== CANDIDATE GENERATION COMPLETE ==========


*** [GPU 0] NEW GLOBAL BEST: 1259158.00 at gen 4500 ***
    Saved to best_solution.json

[GPU 0] Gen  4500 | Best: 1259158.00 | 463.9s
  -> 20 candidates sent to 1/1 workers
[GP] gpu_0 intermediate update: 1259158.00 at gen 4500
[GP] gpu_0 intermediate update: 1257672.00 at gen 4600
[GPU 0] Gene injection: 20 candidates injected at gen 4600 (total so far: 440)

*** [GPU 0] NEW GLOBAL BEST: 1257672.00 at gen 4600 ***
    Saved to best_solution.json

[GPU 0] Gen  4600 | Best: 1257672.00 | 473.9s

==================================================
GP ANALYSIS - Cycle 23
  Collected 100 solutions
==================================================

[GP] ========== GENETIC PROGRAMMING ANALYSIS STARTED ==========
[GP] Cycle: 22
[GP] Input: 100 solutions received for analysis
[GP] Fitness range: best=1257672.00, worst=1257672.00
[GP] Analysis config: blocks=True, fft=False, similarity=False
[GP] Starting analysis...
[GP] Phase 1: Extracting building blocks...
[GP] Phase 1 complete: Found 2 building blocks
[GP] Phase 2: FFT analysis DISABLED
[GP] Phase 3: Similarity analysis DISABLED
[GP] ========== GP ANALYSIS COMPLETE ==========


[GP] ========== CANDIDATE GENERATION STARTED ==========
[GP] Generating 20 new candidate solutions
[GP] Available data: 100 top solutions, 2 building blocks, 0 FFT patterns, 0 similarity patterns
[GP] Generation strategy: 6 block-based, 6 interpolated, 8 mutated
[GP] Strategy 1: Creating 6 candidates via building block combination...
[GP] Strategy 1 complete: 6 block-based candidates created
[GP] Strategy 2: Creating 6 candidates via solution interpolation...
[GP] Strategy 2 complete: 6 interpolated candidates created
[GP] Strategy 3: Creating 8 candidates via guided mutation...
[GP] Strategy 3 complete: 8 mutated candidates created
[GP] Total candidates generated: 20
[GP] Strategy breakdown: Block=138, Interp=138, Mut=184
[GP] ========== CANDIDATE GENERATION COMPLETE ==========

[GPU 0] Gen  4700 | Best: 1257672.00 | 484.0s
[GPU 0] Gene injection: 20 candidates injected at gen 4800 (total so far: 460)
  -> 20 candidates sent to 1/1 workers

==================================================
GP ANALYSIS - Cycle 24
  Collected 100 solutions
==================================================

[GP] ========== GENETIC PROGRAMMING ANALYSIS STARTED ==========
[GP] Cycle: 23
[GP] Input: 100 solutions received for analysis
[GP] Fitness range: best=1257672.00, worst=1257672.00
[GP] Analysis config: blocks=True, fft=False, similarity=False
[GP] Starting analysis...
[GP] Phase 1: Extracting building blocks...
[GPU 0] Gen  4800 | Best: 1257672.00 | 494.4s
[GP] Phase 1 complete: Found 9 building blocks
[GP] Phase 2: FFT analysis DISABLED
[GP] Phase 3: Similarity analysis DISABLED
[GP] ========== GP ANALYSIS COMPLETE ==========


[GP] ========== CANDIDATE GENERATION STARTED ==========
[GP] Generating 20 new candidate solutions
[GP] Available data: 100 top solutions, 9 building blocks, 0 FFT patterns, 0 similarity patterns
[GP] Generation strategy: 6 block-based, 6 interpolated, 8 mutated
[GP] Strategy 1: Creating 6 candidates via building block combination...
[GP] Strategy 1 complete: 6 block-based candidates created
[GP] Strategy 2: Creating 6 candidates via solution interpolation...
[GP] Strategy 2 complete: 6 interpolated candidates created
[GP] Strategy 3: Creating 8 candidates via guided mutation...
[GP] Strategy 3 complete: 8 mutated candidates created
[GP] Total candidates generated: 20
[GP] Strategy breakdown: Block=144, Interp=144, Mut=192
[GP] ========== CANDIDATE GENERATION COMPLETE ==========

[GPU 0] Gen  4900 | Best: 1257672.00 | 504.7s
[GPU 0] Gene injection: 20 candidates injected at gen 5000 (total so far: 480)
[GPU 0] Evolution complete. Sending final results...
  -> 20 candidates sent to 1/1 workers
[GP] Worker finished: gpu_0 (best=1257672.00)

==================================================
GP ANALYSIS - Cycle 25
  Collected 100 solutions
==================================================

[GP] ========== GENETIC PROGRAMMING ANALYSIS STARTED ==========
[GP] Cycle: 24
[GP] Input: 100 solutions received for analysis
[GP] Fitness range: best=1257672.00, worst=1257672.00
[GP] Analysis config: blocks=True, fft=False, similarity=False
[GP] Starting analysis...
[GP] Phase 1: Extracting building blocks...
[GP] Phase 1 complete: Found 10 building blocks
[GP] Phase 2: FFT analysis DISABLED
[GP] Phase 3: Similarity analysis DISABLED
[GP] ========== GP ANALYSIS COMPLETE ==========


[GP] ========== CANDIDATE GENERATION STARTED ==========
[GP] Generating 20 new candidate solutions
[GP] Available data: 100 top solutions, 10 building blocks, 0 FFT patterns, 0 similarity patterns
[GP] Generation strategy: 6 block-based, 6 interpolated, 8 mutated
[GP] Strategy 1: Creating 6 candidates via building block combination...
[GP] Strategy 1 complete: 6 block-based candidates created
[GP] Strategy 2: Creating 6 candidates via solution interpolation...
[GP] Strategy 2 complete: 6 interpolated candidates created
[GP] Strategy 3: Creating 8 candidates via guided mutation...
[GP] Strategy 3 complete: 8 mutated candidates created
[GP] Total candidates generated: 20
[GP] Strategy breakdown: Block=150, Interp=150, Mut=200
[GP] ========== CANDIDATE GENERATION COMPLETE ==========

  -> 20 candidates sent to 1/1 workers

[CHECKPOINT] Saved E.json at gen 5000 (makespan: 1257672.00)

[GP] All workers finished. Total GP cycles: 25

[Final Collection] Have 1/1 workers. Waiting up to 120s for remaining...

[Critical] Attempting final result collection before terminating workers...

[Results Summary] Collected 1 results:
  gpu_0: fitness=1257672.00, intermediate=False, gen=final

======================================================================
COMPLETE
======================================================================
Best: 1257672.00 from gpu_0
  (Improved 62.2% over heuristic 3330665.00)
Time: 517.1s
Total candidates injected: 480

Solution JSON saved to ./results/warm_start/blocks_only/gr431/1R10/job_times_9_seed0.json
HTML Gantt chart saved to: ./results/warm_start/blocks_only/gr431/1R10/job_times_9_seed0.html
