Setting random seed to 0
DEBUG: proc shape: (1000,), agents: 6, resources: 4, n: 1000

======================================================================
LOADING INITIAL SOLUTION FROM JSON
======================================================================
Loaded heuristic solution: Savings with makespan 1028197741.00
File: ./results/heuristics_only/dsj1000/1R20/job_times_7_heuristics.json
Makespan: 1028197741.00
Status: SUCCESS - Will use as warm start
======================================================================


======================================================================
VRP-RPD SOLVER
======================================================================
Problem: 999 customers, 6 agents, k=4
Heuristic: None
Genetic Programming: Yes
Warm Start: Yes
Gene Injection: Yes
Workers: 1 GPU + 0 CPU
Generations: 5000
======================================================================

Using solution from JSON file as warm start...
  JSON solution: 1028197741.00
Skipping heuristic re-computation (using JSON solution + perturbations)

Generated 6 warm start chromosomes from JSON

[GP] Starting GP collection loop (timeout: 12975s)...
[GPU 0] Warm start: 6 chromosomes

*** [GPU 0] NEW GLOBAL BEST: 786516737.00 at gen 0 ***
    Saved to best_solution.json

[GPU 0] Gen     0 | Best: 786516737.00 | 0.4s
[GP] gpu_0 first intermediate: 786516737.00 at gen 0

*** [GPU 0] NEW GLOBAL BEST: 521185201.00 at gen 100 ***
    Saved to best_solution.json

[GPU 0] Gen   100 | Best: 521185201.00 | 12.2s
[GP] gpu_0 intermediate update: 521185201.00 at gen 100
[GP] gpu_0 intermediate update: 490603396.00 at gen 200

*** [GPU 0] NEW GLOBAL BEST: 490603396.00 at gen 200 ***
    Saved to best_solution.json

[GPU 0] Gen   200 | Best: 490603396.00 | 24.2s

*** [GPU 0] NEW GLOBAL BEST: 473968935.00 at gen 300 ***
    Saved to best_solution.json

[GPU 0] Gen   300 | Best: 473968935.00 | 35.9s
[GP] gpu_0 intermediate update: 473968935.00 at gen 300
[GP] gpu_0 intermediate update: 462442124.00 at gen 400

==================================================
GP ANALYSIS - Cycle 1
  Collected 40 solutions
==================================================

[GP] ========== GENETIC PROGRAMMING ANALYSIS STARTED ==========
[GP] Cycle: 0
[GP] Input: 40 solutions received for analysis
[GP] Fitness range: best=462442112.00, worst=490912928.00
[GP] Analysis config: blocks=True, fft=False, similarity=False
[GP] Starting analysis...
[GP] Phase 1: Extracting building blocks...

*** [GPU 0] NEW GLOBAL BEST: 462442124.00 at gen 400 ***
    Saved to best_solution.json

[GPU 0] Gen   400 | Best: 462442124.00 | 47.9s
[GP] Phase 1 complete: Found 30 building blocks
[GP] Phase 2: FFT analysis DISABLED
[GP] Phase 3: Similarity analysis DISABLED
[GP] ========== GP ANALYSIS COMPLETE ==========


[GP] ========== CANDIDATE GENERATION STARTED ==========
[GP] Generating 20 new candidate solutions
[GP] Available data: 40 top solutions, 30 building blocks, 0 FFT patterns, 0 similarity patterns
[GP] Generation strategy: 6 block-based, 6 interpolated, 8 mutated
[GP] Strategy 1: Creating 6 candidates via building block combination...
[GP] Strategy 1 complete: 6 block-based candidates created
[GP] Strategy 2: Creating 6 candidates via solution interpolation...
[GP] Strategy 2 complete: 6 interpolated candidates created
[GP] Strategy 3: Creating 8 candidates via guided mutation...
[GP] Strategy 3 complete: 8 mutated candidates created
[GP] Total candidates generated: 20
[GP] Strategy breakdown: Block=6, Interp=6, Mut=8
[GP] ========== CANDIDATE GENERATION COMPLETE ==========


*** [GPU 0] NEW GLOBAL BEST: 452367426.00 at gen 500 ***
    Saved to best_solution.json

[GPU 0] Gen   500 | Best: 452367426.00 | 59.4s
[GPU 0] Gene injection: 20 candidates injected at gen 600 (total so far: 20)

*** [GPU 0] NEW GLOBAL BEST: 442730327.00 at gen 600 ***
    Saved to best_solution.json

[GPU 0] Gen   600 | Best: 442730327.00 | 71.0s
  -> 20 candidates sent to 1/1 workers
[GP] gpu_0 intermediate update: 452367426.00 at gen 500
[GP] gpu_0 intermediate update: 442936528.00 at gen 600
[GP] gpu_0 intermediate update: 442730327.00 at gen 600

*** [GPU 0] NEW GLOBAL BEST: 437626122.00 at gen 700 ***
    Saved to best_solution.json

[GPU 0] Gen   700 | Best: 437626122.00 | 82.5s
[GP] gpu_0 intermediate update: 437626122.00 at gen 700
[GP] gpu_0 intermediate update: 433047083.00 at gen 800

==================================================
GP ANALYSIS - Cycle 2
  Collected 40 solutions
==================================================

[GP] ========== GENETIC PROGRAMMING ANALYSIS STARTED ==========
[GP] Cycle: 1
[GP] Input: 40 solutions received for analysis
[GP] Fitness range: best=433047072.00, worst=443038848.00
[GP] Analysis config: blocks=True, fft=False, similarity=False
[GP] Starting analysis...
[GP] Phase 1: Extracting building blocks...

*** [GPU 0] NEW GLOBAL BEST: 433047083.00 at gen 800 ***
    Saved to best_solution.json

[GPU 0] Gen   800 | Best: 433047083.00 | 94.2s
[GP] Phase 1 complete: Found 30 building blocks
[GP] Phase 2: FFT analysis DISABLED
[GP] Phase 3: Similarity analysis DISABLED
[GP] ========== GP ANALYSIS COMPLETE ==========


[GP] ========== CANDIDATE GENERATION STARTED ==========
[GP] Generating 20 new candidate solutions
[GP] Available data: 40 top solutions, 30 building blocks, 0 FFT patterns, 0 similarity patterns
[GP] Generation strategy: 6 block-based, 6 interpolated, 8 mutated
[GP] Strategy 1: Creating 6 candidates via building block combination...
[GP] Strategy 1 complete: 6 block-based candidates created
[GP] Strategy 2: Creating 6 candidates via solution interpolation...
[GP] Strategy 2 complete: 6 interpolated candidates created
[GP] Strategy 3: Creating 8 candidates via guided mutation...
[GP] Strategy 3 complete: 8 mutated candidates created
[GP] Total candidates generated: 20
[GP] Strategy breakdown: Block=12, Interp=12, Mut=16
[GP] ========== CANDIDATE GENERATION COMPLETE ==========


*** [GPU 0] NEW GLOBAL BEST: 428935018.00 at gen 900 ***
    Saved to best_solution.json

[GPU 0] Gen   900 | Best: 428935018.00 | 105.9s
[GPU 0] Gene injection: 20 candidates injected at gen 1000 (total so far: 40)

*** [GPU 0] NEW GLOBAL BEST: 424796296.00 at gen 1000 ***
    Saved to best_solution.json

[GPU 0] Gen  1000 | Best: 424796296.00 | 117.5s
  -> 20 candidates sent to 1/1 workers
[GP] gpu_0 intermediate update: 428935018.00 at gen 900
[GP] gpu_0 intermediate update: 424797090.00 at gen 1000
    [Checkpoint] Saved to ./results/warm_start/blocks_only/dsj1000/1R20/job_times_7_seed0_1000.json
[GP] gpu_0 intermediate update: 424796296.00 at gen 1000

*** [GPU 0] NEW GLOBAL BEST: 420612972.00 at gen 1100 ***
    Saved to best_solution.json

[GPU 0] Gen  1100 | Best: 420612972.00 | 129.2s
[GP] gpu_0 intermediate update: 420612972.00 at gen 1100
[GP] gpu_0 intermediate update: 415654966.00 at gen 1200

==================================================
GP ANALYSIS - Cycle 3
  Collected 40 solutions
==================================================

[GP] ========== GENETIC PROGRAMMING ANALYSIS STARTED ==========
[GP] Cycle: 2
[GP] Input: 40 solutions received for analysis
[GP] Fitness range: best=415606880.00, worst=424812096.00
[GP] Analysis config: blocks=True, fft=False, similarity=False
[GP] Starting analysis...
[GP] Phase 1: Extracting building blocks...

*** [GPU 0] NEW GLOBAL BEST: 415606885.00 at gen 1200 ***
    Saved to best_solution.json

[GPU 0] Gen  1200 | Best: 415606885.00 | 140.9s
[GP] Phase 1 complete: Found 30 building blocks
[GP] Phase 2: FFT analysis DISABLED
[GP] Phase 3: Similarity analysis DISABLED
[GP] ========== GP ANALYSIS COMPLETE ==========


[GP] ========== CANDIDATE GENERATION STARTED ==========
[GP] Generating 20 new candidate solutions
[GP] Available data: 40 top solutions, 30 building blocks, 0 FFT patterns, 0 similarity patterns
[GP] Generation strategy: 6 block-based, 6 interpolated, 8 mutated
[GP] Strategy 1: Creating 6 candidates via building block combination...
[GP] Strategy 1 complete: 6 block-based candidates created
[GP] Strategy 2: Creating 6 candidates via solution interpolation...
[GP] Strategy 2 complete: 6 interpolated candidates created
[GP] Strategy 3: Creating 8 candidates via guided mutation...
[GP] Strategy 3 complete: 8 mutated candidates created
[GP] Total candidates generated: 20
[GP] Strategy breakdown: Block=18, Interp=18, Mut=24
[GP] ========== CANDIDATE GENERATION COMPLETE ==========


*** [GPU 0] NEW GLOBAL BEST: 412504852.00 at gen 1300 ***
    Saved to best_solution.json

[GPU 0] Gen  1300 | Best: 412504852.00 | 152.9s
[GPU 0] Gene injection: 20 candidates injected at gen 1400 (total so far: 60)

*** [GPU 0] NEW GLOBAL BEST: 410232335.00 at gen 1400 ***
    Saved to best_solution.json

[GPU 0] Gen  1400 | Best: 410232335.00 | 164.6s
  -> 20 candidates sent to 1/1 workers
[GP] gpu_0 intermediate update: 415606885.00 at gen 1200
[GP] gpu_0 intermediate update: 412504852.00 at gen 1300
[GP] gpu_0 intermediate update: 410265630.00 at gen 1400
[GP] gpu_0 intermediate update: 410232335.00 at gen 1400

*** [GPU 0] NEW GLOBAL BEST: 406878902.00 at gen 1500 ***
    Saved to best_solution.json

[GPU 0] Gen  1500 | Best: 406878902.00 | 176.2s
[GP] gpu_0 intermediate update: 406878902.00 at gen 1500
[GP] gpu_0 intermediate update: 405473208.00 at gen 1600

==================================================
GP ANALYSIS - Cycle 4
  Collected 40 solutions
==================================================

[GP] ========== GENETIC PROGRAMMING ANALYSIS STARTED ==========
[GP] Cycle: 3
[GP] Input: 40 solutions received for analysis
[GP] Fitness range: best=405473216.00, worst=410265632.00
[GP] Analysis config: blocks=True, fft=False, similarity=False
[GP] Starting analysis...
[GP] Phase 1: Extracting building blocks...

*** [GPU 0] NEW GLOBAL BEST: 405473208.00 at gen 1600 ***
    Saved to best_solution.json

[GPU 0] Gen  1600 | Best: 405473208.00 | 188.2s
[GP] Phase 1 complete: Found 30 building blocks
[GP] Phase 2: FFT analysis DISABLED
[GP] Phase 3: Similarity analysis DISABLED
[GP] ========== GP ANALYSIS COMPLETE ==========


[GP] ========== CANDIDATE GENERATION STARTED ==========
[GP] Generating 20 new candidate solutions
[GP] Available data: 40 top solutions, 30 building blocks, 0 FFT patterns, 0 similarity patterns
[GP] Generation strategy: 6 block-based, 6 interpolated, 8 mutated
[GP] Strategy 1: Creating 6 candidates via building block combination...
[GP] Strategy 1 complete: 6 block-based candidates created
[GP] Strategy 2: Creating 6 candidates via solution interpolation...
[GP] Strategy 2 complete: 6 interpolated candidates created
[GP] Strategy 3: Creating 8 candidates via guided mutation...
[GP] Strategy 3 complete: 8 mutated candidates created
[GP] Total candidates generated: 20
[GP] Strategy breakdown: Block=24, Interp=24, Mut=32
[GP] ========== CANDIDATE GENERATION COMPLETE ==========


*** [GPU 0] NEW GLOBAL BEST: 402291134.00 at gen 1700 ***
    Saved to best_solution.json

[GPU 0] Gen  1700 | Best: 402291134.00 | 199.8s
[GPU 0] Gene injection: 20 candidates injected at gen 1800 (total so far: 80)

*** [GPU 0] NEW GLOBAL BEST: 399494089.00 at gen 1800 ***
  -> 20 candidates sent to 1/1 workers
[GP] gpu_0 intermediate update: 402291134.00 at gen 1700
[GP] gpu_0 intermediate update: 399494089.00 at gen 1800
    Saved to best_solution.json

[GPU 0] Gen  1800 | Best: 399494089.00 | 211.3s

*** [GPU 0] NEW GLOBAL BEST: 397768213.00 at gen 1900 ***
    Saved to best_solution.json

[GPU 0] Gen  1900 | Best: 397768213.00 | 222.6s
[GP] gpu_0 intermediate update: 397768213.00 at gen 1900
[GP] gpu_0 intermediate update: 395276363.00 at gen 2000

==================================================
GP ANALYSIS - Cycle 5
  Collected 40 solutions
==================================================

[GP] ========== GENETIC PROGRAMMING ANALYSIS STARTED ==========
[GP] Cycle: 4
[GP] Input: 40 solutions received for analysis
[GP] Fitness range: best=395276352.00, worst=399494080.00
[GP] Analysis config: blocks=True, fft=False, similarity=False
[GP] Starting analysis...
[GP] Phase 1: Extracting building blocks...

*** [GPU 0] NEW GLOBAL BEST: 395276363.00 at gen 2000 ***
    Saved to best_solution.json

[GPU 0] Gen  2000 | Best: 395276363.00 | 235.0s
    [Checkpoint] Saved to ./results/warm_start/blocks_only/dsj1000/1R20/job_times_7_seed0_2000.json
[GP] Phase 1 complete: Found 30 building blocks
[GP] Phase 2: FFT analysis DISABLED
[GP] Phase 3: Similarity analysis DISABLED
[GP] ========== GP ANALYSIS COMPLETE ==========


[GP] ========== CANDIDATE GENERATION STARTED ==========
[GP] Generating 20 new candidate solutions
[GP] Available data: 40 top solutions, 30 building blocks, 0 FFT patterns, 0 similarity patterns
[GP] Generation strategy: 6 block-based, 6 interpolated, 8 mutated
[GP] Strategy 1: Creating 6 candidates via building block combination...
[GP] Strategy 1 complete: 6 block-based candidates created
[GP] Strategy 2: Creating 6 candidates via solution interpolation...
[GP] Strategy 2 complete: 6 interpolated candidates created
[GP] Strategy 3: Creating 8 candidates via guided mutation...
[GP] Strategy 3 complete: 8 mutated candidates created
[GP] Total candidates generated: 20
[GP] Strategy breakdown: Block=30, Interp=30, Mut=40
[GP] ========== CANDIDATE GENERATION COMPLETE ==========


*** [GPU 0] NEW GLOBAL BEST: 393228128.00 at gen 2100 ***
    Saved to best_solution.json

[GPU 0] Gen  2100 | Best: 393228128.00 | 247.3s
[GPU 0] Gene injection: 20 candidates injected at gen 2200 (total so far: 100)
  -> 20 candidates sent to 1/1 workers

[CHECKPOINT] Saved A.json at gen 1000 (makespan: 395276363.00)

*** [GPU 0] NEW GLOBAL BEST: 391367044.00 at gen 2200 ***
    Saved to best_solution.json

[GPU 0] Gen  2200 | Best: 391367044.00 | 259.3s
[GP] gpu_0 intermediate update: 393228128.00 at gen 2100
[GP] gpu_0 intermediate update: 391367044.00 at gen 2200

*** [GPU 0] NEW GLOBAL BEST: 389700612.00 at gen 2300 ***
    Saved to best_solution.json

[GPU 0] Gen  2300 | Best: 389700612.00 | 271.4s
[GP] gpu_0 intermediate update: 389700612.00 at gen 2300
[GP] gpu_0 intermediate update: 388906551.00 at gen 2400

==================================================
GP ANALYSIS - Cycle 6
  Collected 40 solutions
==================================================

[GP] ========== GENETIC PROGRAMMING ANALYSIS STARTED ==========
[GP] Cycle: 5
[GP] Input: 40 solutions received for analysis
[GP] Fitness range: best=388906560.00, worst=391367040.00
[GP] Analysis config: blocks=True, fft=False, similarity=False
[GP] Starting analysis...
[GP] Phase 1: Extracting building blocks...

*** [GPU 0] NEW GLOBAL BEST: 388906551.00 at gen 2400 ***
    Saved to best_solution.json

[GPU 0] Gen  2400 | Best: 388906551.00 | 283.4s
[GP] Phase 1 complete: Found 30 building blocks
[GP] Phase 2: FFT analysis DISABLED
[GP] Phase 3: Similarity analysis DISABLED
[GP] ========== GP ANALYSIS COMPLETE ==========


[GP] ========== CANDIDATE GENERATION STARTED ==========
[GP] Generating 20 new candidate solutions
[GP] Available data: 40 top solutions, 30 building blocks, 0 FFT patterns, 0 similarity patterns
[GP] Generation strategy: 6 block-based, 6 interpolated, 8 mutated
[GP] Strategy 1: Creating 6 candidates via building block combination...
[GP] Strategy 1 complete: 6 block-based candidates created
[GP] Strategy 2: Creating 6 candidates via solution interpolation...
[GP] Strategy 2 complete: 6 interpolated candidates created
[GP] Strategy 3: Creating 8 candidates via guided mutation...
[GP] Strategy 3 complete: 8 mutated candidates created
[GP] Total candidates generated: 20
[GP] Strategy breakdown: Block=36, Interp=36, Mut=48
[GP] ========== CANDIDATE GENERATION COMPLETE ==========


*** [GPU 0] NEW GLOBAL BEST: 387363757.00 at gen 2500 ***
    Saved to best_solution.json

[GPU 0] Gen  2500 | Best: 387363757.00 | 295.2s
[GPU 0] Gene injection: 20 candidates injected at gen 2600 (total so far: 120)

*** [GPU 0] NEW GLOBAL BEST: 386466730.00 at gen 2600 ***
    Saved to best_solution.json

[GPU 0] Gen  2600 | Best: 386466730.00 | 307.4s
  -> 20 candidates sent to 1/1 workers
[GP] gpu_0 intermediate update: 387363757.00 at gen 2500
[GP] gpu_0 intermediate update: 386466730.00 at gen 2600

*** [GPU 0] NEW GLOBAL BEST: 384660297.00 at gen 2700 ***
    Saved to best_solution.json

[GPU 0] Gen  2700 | Best: 384660297.00 | 319.4s
[GP] gpu_0 intermediate update: 384660297.00 at gen 2700
[GP] gpu_0 intermediate update: 383365034.00 at gen 2800

==================================================
GP ANALYSIS - Cycle 7
  Collected 40 solutions
==================================================

[GP] ========== GENETIC PROGRAMMING ANALYSIS STARTED ==========
[GP] Cycle: 6
[GP] Input: 40 solutions received for analysis
[GP] Fitness range: best=383265088.00, worst=386466720.00
[GP] Analysis config: blocks=True, fft=False, similarity=False
[GP] Starting analysis...
[GP] Phase 1: Extracting building blocks...

*** [GPU 0] NEW GLOBAL BEST: 383265081.00 at gen 2800 ***
    Saved to best_solution.json

[GPU 0] Gen  2800 | Best: 383265081.00 | 331.6s
[GP] Phase 1 complete: Found 30 building blocks
[GP] Phase 2: FFT analysis DISABLED
[GP] Phase 3: Similarity analysis DISABLED
[GP] ========== GP ANALYSIS COMPLETE ==========


[GP] ========== CANDIDATE GENERATION STARTED ==========
[GP] Generating 20 new candidate solutions
[GP] Available data: 40 top solutions, 30 building blocks, 0 FFT patterns, 0 similarity patterns
[GP] Generation strategy: 6 block-based, 6 interpolated, 8 mutated
[GP] Strategy 1: Creating 6 candidates via building block combination...
[GP] Strategy 1 complete: 6 block-based candidates created
[GP] Strategy 2: Creating 6 candidates via solution interpolation...
[GP] Strategy 2 complete: 6 interpolated candidates created
[GP] Strategy 3: Creating 8 candidates via guided mutation...
[GP] Strategy 3 complete: 8 mutated candidates created
[GP] Total candidates generated: 20
[GP] Strategy breakdown: Block=42, Interp=42, Mut=56
[GP] ========== CANDIDATE GENERATION COMPLETE ==========


*** [GPU 0] NEW GLOBAL BEST: 381113310.00 at gen 2900 ***
    Saved to best_solution.json

[GPU 0] Gen  2900 | Best: 381113310.00 | 343.7s
[GPU 0] Gene injection: 20 candidates injected at gen 3000 (total so far: 140)

*** [GPU 0] NEW GLOBAL BEST: 380245366.00 at gen 3000 ***
  -> 20 candidates sent to 1/1 workers
[GP] gpu_0 intermediate update: 383265081.00 at gen 2800
[GP] gpu_0 intermediate update: 381113310.00 at gen 2900
[GP] gpu_0 intermediate update: 380245366.00 at gen 3000
    Saved to best_solution.json

[GPU 0] Gen  3000 | Best: 380245366.00 | 356.0s
    [Checkpoint] Saved to ./results/warm_start/blocks_only/dsj1000/1R20/job_times_7_seed0_3000.json

*** [GPU 0] NEW GLOBAL BEST: 379423871.00 at gen 3100 ***
    Saved to best_solution.json

[GPU 0] Gen  3100 | Best: 379423871.00 | 368.1s
[GP] gpu_0 intermediate update: 379423871.00 at gen 3100
[GP] gpu_0 intermediate update: 378466470.00 at gen 3200

==================================================
GP ANALYSIS - Cycle 8
  Collected 40 solutions
==================================================

[GP] ========== GENETIC PROGRAMMING ANALYSIS STARTED ==========
[GP] Cycle: 7
[GP] Input: 40 solutions received for analysis
[GP] Fitness range: best=378466464.00, worst=380245376.00
[GP] Analysis config: blocks=True, fft=False, similarity=False
[GP] Starting analysis...
[GP] Phase 1: Extracting building blocks...

*** [GPU 0] NEW GLOBAL BEST: 378466470.00 at gen 3200 ***
    Saved to best_solution.json

[GPU 0] Gen  3200 | Best: 378466470.00 | 380.5s
[GP] Phase 1 complete: Found 30 building blocks
[GP] Phase 2: FFT analysis DISABLED
[GP] Phase 3: Similarity analysis DISABLED
[GP] ========== GP ANALYSIS COMPLETE ==========


[GP] ========== CANDIDATE GENERATION STARTED ==========
[GP] Generating 20 new candidate solutions
[GP] Available data: 40 top solutions, 30 building blocks, 0 FFT patterns, 0 similarity patterns
[GP] Generation strategy: 6 block-based, 6 interpolated, 8 mutated
[GP] Strategy 1: Creating 6 candidates via building block combination...
[GP] Strategy 1 complete: 6 block-based candidates created
[GP] Strategy 2: Creating 6 candidates via solution interpolation...
[GP] Strategy 2 complete: 6 interpolated candidates created
[GP] Strategy 3: Creating 8 candidates via guided mutation...
[GP] Strategy 3 complete: 8 mutated candidates created
[GP] Total candidates generated: 20
[GP] Strategy breakdown: Block=48, Interp=48, Mut=64
[GP] ========== CANDIDATE GENERATION COMPLETE ==========


*** [GPU 0] NEW GLOBAL BEST: 378013674.00 at gen 3300 ***
    Saved to best_solution.json

[GPU 0] Gen  3300 | Best: 378013674.00 | 392.7s
[GPU 0] Gene injection: 20 candidates injected at gen 3400 (total so far: 160)

*** [GPU 0] NEW GLOBAL BEST: 377255178.00 at gen 3400 ***
    Saved to best_solution.json

[GPU 0] Gen  3400 | Best: 377255178.00 | 404.9s
  -> 20 candidates sent to 1/1 workers
[GP] gpu_0 intermediate update: 378013674.00 at gen 3300
[GP] gpu_0 intermediate update: 377255178.00 at gen 3400

*** [GPU 0] NEW GLOBAL BEST: 376874698.00 at gen 3500 ***
    Saved to best_solution.json

[GPU 0] Gen  3500 | Best: 376874698.00 | 416.7s
[GP] gpu_0 intermediate update: 376874698.00 at gen 3500
[GP] gpu_0 intermediate update: 376056741.00 at gen 3600

==================================================
GP ANALYSIS - Cycle 9
  Collected 40 solutions
==================================================

[GP] ========== GENETIC PROGRAMMING ANALYSIS STARTED ==========
[GP] Cycle: 8
[GP] Input: 40 solutions received for analysis
[GP] Fitness range: best=376056736.00, worst=377255168.00
[GP] Analysis config: blocks=True, fft=False, similarity=False
[GP] Starting analysis...
[GP] Phase 1: Extracting building blocks...

*** [GPU 0] NEW GLOBAL BEST: 376056741.00 at gen 3600 ***
    Saved to best_solution.json

[GPU 0] Gen  3600 | Best: 376056741.00 | 429.1s
[GP] Phase 1 complete: Found 30 building blocks
[GP] Phase 2: FFT analysis DISABLED
[GP] Phase 3: Similarity analysis DISABLED
[GP] ========== GP ANALYSIS COMPLETE ==========


[GP] ========== CANDIDATE GENERATION STARTED ==========
[GP] Generating 20 new candidate solutions
[GP] Available data: 40 top solutions, 30 building blocks, 0 FFT patterns, 0 similarity patterns
[GP] Generation strategy: 6 block-based, 6 interpolated, 8 mutated
[GP] Strategy 1: Creating 6 candidates via building block combination...
[GP] Strategy 1 complete: 6 block-based candidates created
[GP] Strategy 2: Creating 6 candidates via solution interpolation...
[GP] Strategy 2 complete: 6 interpolated candidates created
[GP] Strategy 3: Creating 8 candidates via guided mutation...
[GP] Strategy 3 complete: 8 mutated candidates created
[GP] Total candidates generated: 20
[GP] Strategy breakdown: Block=54, Interp=54, Mut=72
[GP] ========== CANDIDATE GENERATION COMPLETE ==========


*** [GPU 0] NEW GLOBAL BEST: 375018777.00 at gen 3700 ***
    Saved to best_solution.json

[GPU 0] Gen  3700 | Best: 375018777.00 | 441.2s
[GPU 0] Gene injection: 20 candidates injected at gen 3800 (total so far: 180)

*** [GPU 0] NEW GLOBAL BEST: 374641705.00 at gen 3800 ***
    Saved to best_solution.json

[GPU 0] Gen  3800 | Best: 374641705.00 | 453.7s
  -> 20 candidates sent to 1/1 workers
[GP] gpu_0 intermediate update: 375018777.00 at gen 3700
[GP] gpu_0 intermediate update: 374641705.00 at gen 3800

*** [GPU 0] NEW GLOBAL BEST: 373970627.00 at gen 3900 ***
    Saved to best_solution.json

[GPU 0] Gen  3900 | Best: 373970627.00 | 466.2s
[GP] gpu_0 intermediate update: 373970627.00 at gen 3900
[GP] gpu_0 intermediate update: 373334182.00 at gen 4000

==================================================
GP ANALYSIS - Cycle 10
  Collected 40 solutions
==================================================

[GP] ========== GENETIC PROGRAMMING ANALYSIS STARTED ==========
[GP] Cycle: 9
[GP] Input: 40 solutions received for analysis
[GP] Fitness range: best=373334176.00, worst=374655168.00
[GP] Analysis config: blocks=True, fft=False, similarity=False
[GP] Starting analysis...
[GP] Phase 1: Extracting building blocks...

*** [GPU 0] NEW GLOBAL BEST: 373334182.00 at gen 4000 ***
    Saved to best_solution.json

[GPU 0] Gen  4000 | Best: 373334182.00 | 478.6s
[GP] Phase 1 complete: Found 30 building blocks
[GP] Phase 2: FFT analysis DISABLED
[GP] Phase 3: Similarity analysis DISABLED
[GP] ========== GP ANALYSIS COMPLETE ==========


[GP] ========== CANDIDATE GENERATION STARTED ==========
[GP] Generating 20 new candidate solutions
[GP] Available data: 40 top solutions, 30 building blocks, 0 FFT patterns, 0 similarity patterns
[GP] Generation strategy: 6 block-based, 6 interpolated, 8 mutated
[GP] Strategy 1: Creating 6 candidates via building block combination...
[GP] Strategy 1 complete: 6 block-based candidates created
[GP] Strategy 2: Creating 6 candidates via solution interpolation...
    [Checkpoint] Saved to ./results/warm_start/blocks_only/dsj1000/1R20/job_times_7_seed0_4000.json
[GP] Strategy 2 complete: 6 interpolated candidates created
[GP] Strategy 3: Creating 8 candidates via guided mutation...
[GP] Strategy 3 complete: 8 mutated candidates created
[GP] Total candidates generated: 20
[GP] Strategy breakdown: Block=60, Interp=60, Mut=80
[GP] ========== CANDIDATE GENERATION COMPLETE ==========


*** [GPU 0] NEW GLOBAL BEST: 372222971.00 at gen 4100 ***
    Saved to best_solution.json

[GPU 0] Gen  4100 | Best: 372222971.00 | 491.3s
[GPU 0] Gene injection: 20 candidates injected at gen 4200 (total so far: 200)

*** [GPU 0] NEW GLOBAL BEST: 371455881.00 at gen 4200 ***
    Saved to best_solution.json

[GPU 0] Gen  4200 | Best: 371455881.00 | 503.6s
  -> 20 candidates sent to 1/1 workers

[CHECKPOINT] Saved B.json at gen 2000 (makespan: 373334182.00)
[GP] gpu_0 intermediate update: 372222971.00 at gen 4100
[GP] gpu_0 intermediate update: 371455881.00 at gen 4200

*** [GPU 0] NEW GLOBAL BEST: 371132068.00 at gen 4300 ***
    Saved to best_solution.json

[GPU 0] Gen  4300 | Best: 371132068.00 | 515.7s
[GP] gpu_0 intermediate update: 371132068.00 at gen 4300
[GP] gpu_0 intermediate update: 370627481.00 at gen 4400

==================================================
GP ANALYSIS - Cycle 11
  Collected 40 solutions
==================================================

[GP] ========== GENETIC PROGRAMMING ANALYSIS STARTED ==========
[GP] Cycle: 10
[GP] Input: 40 solutions received for analysis
[GP] Fitness range: best=370627488.00, worst=371551808.00
[GP] Analysis config: blocks=True, fft=False, similarity=False
[GP] Starting analysis...
[GP] Phase 1: Extracting building blocks...

*** [GPU 0] NEW GLOBAL BEST: 370627481.00 at gen 4400 ***
    Saved to best_solution.json

[GPU 0] Gen  4400 | Best: 370627481.00 | 527.7s
[GP] Phase 1 complete: Found 30 building blocks
[GP] Phase 2: FFT analysis DISABLED
[GP] Phase 3: Similarity analysis DISABLED
[GP] ========== GP ANALYSIS COMPLETE ==========


[GP] ========== CANDIDATE GENERATION STARTED ==========
[GP] Generating 20 new candidate solutions
[GP] Available data: 40 top solutions, 30 building blocks, 0 FFT patterns, 0 similarity patterns
[GP] Generation strategy: 6 block-based, 6 interpolated, 8 mutated
[GP] Strategy 1: Creating 6 candidates via building block combination...
[GP] Strategy 1 complete: 6 block-based candidates created
[GP] Strategy 2: Creating 6 candidates via solution interpolation...
[GP] Strategy 2 complete: 6 interpolated candidates created
[GP] Strategy 3: Creating 8 candidates via guided mutation...
[GP] Strategy 3 complete: 8 mutated candidates created
[GP] Total candidates generated: 20
[GP] Strategy breakdown: Block=66, Interp=66, Mut=88
[GP] ========== CANDIDATE GENERATION COMPLETE ==========


*** [GPU 0] NEW GLOBAL BEST: 370313069.00 at gen 4500 ***
    Saved to best_solution.json

[GPU 0] Gen  4500 | Best: 370313069.00 | 539.6s
[GPU 0] Gene injection: 20 candidates injected at gen 4600 (total so far: 220)
  -> 20 candidates sent to 1/1 workers
[GP] gpu_0 intermediate update: 370313069.00 at gen 4500
[GP] gpu_0 intermediate update: 370053203.00 at gen 4600

*** [GPU 0] NEW GLOBAL BEST: 370053203.00 at gen 4600 ***
    Saved to best_solution.json

[GPU 0] Gen  4600 | Best: 370053203.00 | 551.2s

*** [GPU 0] NEW GLOBAL BEST: 369815145.00 at gen 4700 ***
    Saved to best_solution.json

[GPU 0] Gen  4700 | Best: 369815145.00 | 563.0s
[GP] gpu_0 intermediate update: 369815145.00 at gen 4700
[GP] gpu_0 intermediate update: 369362723.00 at gen 4800

==================================================
GP ANALYSIS - Cycle 12
  Collected 40 solutions
==================================================

[GP] ========== GENETIC PROGRAMMING ANALYSIS STARTED ==========
[GP] Cycle: 11
[GP] Input: 40 solutions received for analysis
[GP] Fitness range: best=369348352.00, worst=370053216.00
[GP] Analysis config: blocks=True, fft=False, similarity=False
[GP] Starting analysis...
[GP] Phase 1: Extracting building blocks...

*** [GPU 0] NEW GLOBAL BEST: 369348352.00 at gen 4800 ***
    Saved to best_solution.json

[GPU 0] Gen  4800 | Best: 369348352.00 | 574.8s
[GP] Phase 1 complete: Found 30 building blocks
[GP] Phase 2: FFT analysis DISABLED
[GP] Phase 3: Similarity analysis DISABLED
[GP] ========== GP ANALYSIS COMPLETE ==========


[GP] ========== CANDIDATE GENERATION STARTED ==========
[GP] Generating 20 new candidate solutions
[GP] Available data: 40 top solutions, 30 building blocks, 0 FFT patterns, 0 similarity patterns
[GP] Generation strategy: 6 block-based, 6 interpolated, 8 mutated
[GP] Strategy 1: Creating 6 candidates via building block combination...
[GP] Strategy 1 complete: 6 block-based candidates created
[GP] Strategy 2: Creating 6 candidates via solution interpolation...
[GP] Strategy 2 complete: 6 interpolated candidates created
[GP] Strategy 3: Creating 8 candidates via guided mutation...
[GP] Strategy 3 complete: 8 mutated candidates created
[GP] Total candidates generated: 20
[GP] Strategy breakdown: Block=72, Interp=72, Mut=96
[GP] ========== CANDIDATE GENERATION COMPLETE ==========


*** [GPU 0] NEW GLOBAL BEST: 369121895.00 at gen 4900 ***
    Saved to best_solution.json

[GPU 0] Gen  4900 | Best: 369121895.00 | 586.7s
[GPU 0] Gene injection: 20 candidates injected at gen 5000 (total so far: 240)
[GPU 0] Evolution complete. Sending final results...
  -> 20 candidates sent to 1/1 workers
[GP] gpu_0 intermediate update: 369348352.00 at gen 4800
[GP] gpu_0 intermediate update: 369121895.00 at gen 4900
[GP] gpu_0 intermediate update: 368894555.00 at gen 5000
[GP] Worker finished: gpu_0 (best=368894555.00)

[GP] All workers finished. Total GP cycles: 12

[Final Collection] Have 1/1 workers. Waiting up to 120s for remaining...

[Critical] Attempting final result collection before terminating workers...

[Results Summary] Collected 1 results:
  gpu_0: fitness=368894555.00, intermediate=False, gen=final

======================================================================
COMPLETE
======================================================================
Best: 368894555.00 from gpu_0
  (Improved 64.1% over heuristic 1028197741.00)
Time: 601.1s
Total candidates injected: 240

Solution JSON saved to ./results/warm_start/blocks_only/dsj1000/1R20/job_times_7_seed0.json
HTML Gantt chart saved to: ./results/warm_start/blocks_only/dsj1000/1R20/job_times_7_seed0.html
