Setting random seed to 0
DEBUG: proc shape: (1000,), agents: 6, resources: 4, n: 1000

======================================================================
LOADING INITIAL SOLUTION FROM JSON
======================================================================
Loaded heuristic solution: Savings with makespan 1057305902.00
File: ./results/heuristics_only/dsj1000/1R20/job_times_1_heuristics.json
Makespan: 1057305902.00
Status: SUCCESS - Will use as warm start
======================================================================


======================================================================
VRP-RPD SOLVER
======================================================================
Problem: 999 customers, 6 agents, k=4
Heuristic: None
Genetic Programming: Yes
Warm Start: Yes
Gene Injection: Yes
Workers: 1 GPU + 0 CPU
Generations: 5000
======================================================================

Using solution from JSON file as warm start...
  JSON solution: 1057305902.00
Skipping heuristic re-computation (using JSON solution + perturbations)

Generated 6 warm start chromosomes from JSON

[GP] Starting GP collection loop (timeout: 12975s)...
[GPU 0] Warm start: 6 chromosomes

*** [GPU 0] NEW GLOBAL BEST: 762462854.00 at gen 0 ***
    Saved to best_solution.json

[GPU 0] Gen     0 | Best: 762462854.00 | 0.7s
[GP] gpu_0 first intermediate: 762462854.00 at gen 0

*** [GPU 0] NEW GLOBAL BEST: 540931257.00 at gen 100 ***
    Saved to best_solution.json

[GPU 0] Gen   100 | Best: 540931257.00 | 17.7s
[GP] gpu_0 intermediate update: 540931257.00 at gen 100
[GP] gpu_0 intermediate update: 514368714.00 at gen 200

*** [GPU 0] NEW GLOBAL BEST: 514286349.00 at gen 200 ***
    Saved to best_solution.json

[GPU 0] Gen   200 | Best: 514286349.00 | 34.2s
[GP] gpu_0 intermediate update: 514286349.00 at gen 200

*** [GPU 0] NEW GLOBAL BEST: 499738318.00 at gen 300 ***
    Saved to best_solution.json

[GPU 0] Gen   300 | Best: 499738318.00 | 51.2s
[GP] gpu_0 intermediate update: 499738318.00 at gen 300
[GP] gpu_0 intermediate update: 490650301.00 at gen 400

==================================================
GP ANALYSIS - Cycle 1
  Collected 40 solutions
==================================================

[GP] ========== GENETIC PROGRAMMING ANALYSIS STARTED ==========
[GP] Cycle: 0
[GP] Input: 40 solutions received for analysis
[GP] Fitness range: best=490650304.00, worst=515009440.00
[GP] Analysis config: blocks=True, fft=False, similarity=False
[GP] Starting analysis...
[GP] Phase 1: Extracting building blocks...

*** [GPU 0] NEW GLOBAL BEST: 490650301.00 at gen 400 ***
    Saved to best_solution.json

[GPU 0] Gen   400 | Best: 490650301.00 | 68.1s
[GP] Phase 1 complete: Found 30 building blocks
[GP] Phase 2: FFT analysis DISABLED
[GP] Phase 3: Similarity analysis DISABLED
[GP] ========== GP ANALYSIS COMPLETE ==========


[GP] ========== CANDIDATE GENERATION STARTED ==========
[GP] Generating 20 new candidate solutions
[GP] Available data: 40 top solutions, 30 building blocks, 0 FFT patterns, 0 similarity patterns
[GP] Generation strategy: 6 block-based, 6 interpolated, 8 mutated
[GP] Strategy 1: Creating 6 candidates via building block combination...
[GP] Strategy 1 complete: 6 block-based candidates created
[GP] Strategy 2: Creating 6 candidates via solution interpolation...
[GP] Strategy 2 complete: 6 interpolated candidates created
[GP] Strategy 3: Creating 8 candidates via guided mutation...
[GP] Strategy 3 complete: 8 mutated candidates created
[GP] Total candidates generated: 20
[GP] Strategy breakdown: Block=6, Interp=6, Mut=8
[GP] ========== CANDIDATE GENERATION COMPLETE ==========


*** [GPU 0] NEW GLOBAL BEST: 475981626.00 at gen 500 ***
    Saved to best_solution.json

[GPU 0] Gen   500 | Best: 475981626.00 | 85.2s
[GPU 0] Gene injection: 20 candidates injected at gen 600 (total so far: 20)
  -> 20 candidates sent to 1/1 workers
[GP] gpu_0 intermediate update: 475981626.00 at gen 500
[GP] gpu_0 intermediate update: 467345825.00 at gen 600

*** [GPU 0] NEW GLOBAL BEST: 467345825.00 at gen 600 ***
    Saved to best_solution.json

[GPU 0] Gen   600 | Best: 467345825.00 | 102.0s

*** [GPU 0] NEW GLOBAL BEST: 459706276.00 at gen 700 ***
    Saved to best_solution.json

[GPU 0] Gen   700 | Best: 459706276.00 | 118.5s
[GP] gpu_0 intermediate update: 459706276.00 at gen 700
[GP] gpu_0 intermediate update: 452955934.00 at gen 800

==================================================
GP ANALYSIS - Cycle 2
  Collected 40 solutions
==================================================

[GP] ========== GENETIC PROGRAMMING ANALYSIS STARTED ==========
[GP] Cycle: 1
[GP] Input: 40 solutions received for analysis
[GP] Fitness range: best=452759264.00, worst=467710848.00
[GP] Analysis config: blocks=True, fft=False, similarity=False
[GP] Starting analysis...
[GP] Phase 1: Extracting building blocks...

*** [GPU 0] NEW GLOBAL BEST: 452759257.00 at gen 800 ***
    Saved to best_solution.json

[GPU 0] Gen   800 | Best: 452759257.00 | 135.4s
[GP] Phase 1 complete: Found 30 building blocks
[GP] Phase 2: FFT analysis DISABLED
[GP] Phase 3: Similarity analysis DISABLED
[GP] ========== GP ANALYSIS COMPLETE ==========


[GP] ========== CANDIDATE GENERATION STARTED ==========
[GP] Generating 20 new candidate solutions
[GP] Available data: 40 top solutions, 30 building blocks, 0 FFT patterns, 0 similarity patterns
[GP] Generation strategy: 6 block-based, 6 interpolated, 8 mutated
[GP] Strategy 1: Creating 6 candidates via building block combination...
[GP] Strategy 1 complete: 6 block-based candidates created
[GP] Strategy 2: Creating 6 candidates via solution interpolation...
[GP] Strategy 2 complete: 6 interpolated candidates created
[GP] Strategy 3: Creating 8 candidates via guided mutation...
[GP] Strategy 3 complete: 8 mutated candidates created
[GP] Total candidates generated: 20
[GP] Strategy breakdown: Block=12, Interp=12, Mut=16
[GP] ========== CANDIDATE GENERATION COMPLETE ==========


*** [GPU 0] NEW GLOBAL BEST: 448633094.00 at gen 900 ***
    Saved to best_solution.json

[GPU 0] Gen   900 | Best: 448633094.00 | 152.1s
[GPU 0] Gene injection: 20 candidates injected at gen 1000 (total so far: 40)
  -> 20 candidates sent to 1/1 workers
[GP] gpu_0 intermediate update: 452759257.00 at gen 800
[GP] gpu_0 intermediate update: 448633094.00 at gen 900
[GP] gpu_0 intermediate update: 444060414.00 at gen 1000

*** [GPU 0] NEW GLOBAL BEST: 444060414.00 at gen 1000 ***
    Saved to best_solution.json

[GPU 0] Gen  1000 | Best: 444060414.00 | 168.5s
    [Checkpoint] Saved to ./results/warm_start/blocks_only/dsj1000/1R20/job_times_1_seed0_1000.json

*** [GPU 0] NEW GLOBAL BEST: 439793326.00 at gen 1100 ***
    Saved to best_solution.json

[GPU 0] Gen  1100 | Best: 439793326.00 | 185.4s
[GP] gpu_0 intermediate update: 439793326.00 at gen 1100
[GP] gpu_0 intermediate update: 434837043.00 at gen 1200

==================================================
GP ANALYSIS - Cycle 3
  Collected 40 solutions
==================================================

[GP] ========== GENETIC PROGRAMMING ANALYSIS STARTED ==========
[GP] Cycle: 2
[GP] Input: 40 solutions received for analysis
[GP] Fitness range: best=434837056.00, worst=444285184.00
[GP] Analysis config: blocks=True, fft=False, similarity=False
[GP] Starting analysis...
[GP] Phase 1: Extracting building blocks...

*** [GPU 0] NEW GLOBAL BEST: 434837043.00 at gen 1200 ***
    Saved to best_solution.json

[GPU 0] Gen  1200 | Best: 434837043.00 | 202.4s
[GP] Phase 1 complete: Found 30 building blocks
[GP] Phase 2: FFT analysis DISABLED
[GP] Phase 3: Similarity analysis DISABLED
[GP] ========== GP ANALYSIS COMPLETE ==========


[GP] ========== CANDIDATE GENERATION STARTED ==========
[GP] Generating 20 new candidate solutions
[GP] Available data: 40 top solutions, 30 building blocks, 0 FFT patterns, 0 similarity patterns
[GP] Generation strategy: 6 block-based, 6 interpolated, 8 mutated
[GP] Strategy 1: Creating 6 candidates via building block combination...
[GP] Strategy 1 complete: 6 block-based candidates created
[GP] Strategy 2: Creating 6 candidates via solution interpolation...
[GP] Strategy 2 complete: 6 interpolated candidates created
[GP] Strategy 3: Creating 8 candidates via guided mutation...
[GP] Strategy 3 complete: 8 mutated candidates created
[GP] Total candidates generated: 20
[GP] Strategy breakdown: Block=18, Interp=18, Mut=24
[GP] ========== CANDIDATE GENERATION COMPLETE ==========


*** [GPU 0] NEW GLOBAL BEST: 430296445.00 at gen 1300 ***
    Saved to best_solution.json

[GPU 0] Gen  1300 | Best: 430296445.00 | 218.9s
[GPU 0] Gene injection: 20 candidates injected at gen 1400 (total so far: 60)
  -> 20 candidates sent to 1/1 workers
[GP] gpu_0 intermediate update: 430296445.00 at gen 1300
[GP] gpu_0 intermediate update: 426935590.00 at gen 1400

*** [GPU 0] NEW GLOBAL BEST: 426935590.00 at gen 1400 ***
    Saved to best_solution.json

[GPU 0] Gen  1400 | Best: 426935590.00 | 235.7s

*** [GPU 0] NEW GLOBAL BEST: 422888325.00 at gen 1500 ***
    Saved to best_solution.json

[GPU 0] Gen  1500 | Best: 422888325.00 | 252.2s
[GP] gpu_0 intermediate update: 422888325.00 at gen 1500
[GP] gpu_0 intermediate update: 420697935.00 at gen 1600

==================================================
GP ANALYSIS - Cycle 4
  Collected 40 solutions
==================================================

[GP] ========== GENETIC PROGRAMMING ANALYSIS STARTED ==========
[GP] Cycle: 3
[GP] Input: 40 solutions received for analysis
[GP] Fitness range: best=420697920.00, worst=426935584.00
[GP] Analysis config: blocks=True, fft=False, similarity=False
[GP] Starting analysis...
[GP] Phase 1: Extracting building blocks...

*** [GPU 0] NEW GLOBAL BEST: 420697935.00 at gen 1600 ***
    Saved to best_solution.json

[GPU 0] Gen  1600 | Best: 420697935.00 | 268.9s
[GP] Phase 1 complete: Found 30 building blocks
[GP] Phase 2: FFT analysis DISABLED
[GP] Phase 3: Similarity analysis DISABLED
[GP] ========== GP ANALYSIS COMPLETE ==========


[GP] ========== CANDIDATE GENERATION STARTED ==========
[GP] Generating 20 new candidate solutions
[GP] Available data: 40 top solutions, 30 building blocks, 0 FFT patterns, 0 similarity patterns
[GP] Generation strategy: 6 block-based, 6 interpolated, 8 mutated
[GP] Strategy 1: Creating 6 candidates via building block combination...
[GP] Strategy 1 complete: 6 block-based candidates created
[GP] Strategy 2: Creating 6 candidates via solution interpolation...
[GP] Strategy 2 complete: 6 interpolated candidates created
[GP] Strategy 3: Creating 8 candidates via guided mutation...
[GP] Strategy 3 complete: 8 mutated candidates created
[GP] Total candidates generated: 20
[GP] Strategy breakdown: Block=24, Interp=24, Mut=32
[GP] ========== CANDIDATE GENERATION COMPLETE ==========


*** [GPU 0] NEW GLOBAL BEST: 417807746.00 at gen 1700 ***
    Saved to best_solution.json

[GPU 0] Gen  1700 | Best: 417807746.00 | 285.6s
[GPU 0] Gene injection: 20 candidates injected at gen 1800 (total so far: 80)
  -> 20 candidates sent to 1/1 workers
[GP] gpu_0 intermediate update: 417807746.00 at gen 1700
[GP] gpu_0 intermediate update: 415911922.00 at gen 1800

*** [GPU 0] NEW GLOBAL BEST: 415911922.00 at gen 1800 ***
    Saved to best_solution.json

[GPU 0] Gen  1800 | Best: 415911922.00 | 302.3s

*** [GPU 0] NEW GLOBAL BEST: 413748602.00 at gen 1900 ***
    Saved to best_solution.json

[GPU 0] Gen  1900 | Best: 413748602.00 | 318.2s
[GP] gpu_0 intermediate update: 413748602.00 at gen 1900
[GP] gpu_0 intermediate update: 411071554.00 at gen 2000

==================================================
GP ANALYSIS - Cycle 5
  Collected 40 solutions
==================================================

[GP] ========== GENETIC PROGRAMMING ANALYSIS STARTED ==========
[GP] Cycle: 4
[GP] Input: 40 solutions received for analysis
[GP] Fitness range: best=411071552.00, worst=415911936.00
[GP] Analysis config: blocks=True, fft=False, similarity=False
[GP] Starting analysis...
[GP] Phase 1: Extracting building blocks...

*** [GPU 0] NEW GLOBAL BEST: 411071554.00 at gen 2000 ***
    Saved to best_solution.json

[GPU 0] Gen  2000 | Best: 411071554.00 | 335.1s
    [Checkpoint] Saved to ./results/warm_start/blocks_only/dsj1000/1R20/job_times_1_seed0_2000.json
[GP] Phase 1 complete: Found 30 building blocks
[GP] Phase 2: FFT analysis DISABLED
[GP] Phase 3: Similarity analysis DISABLED
[GP] ========== GP ANALYSIS COMPLETE ==========


[GP] ========== CANDIDATE GENERATION STARTED ==========
[GP] Generating 20 new candidate solutions
[GP] Available data: 40 top solutions, 30 building blocks, 0 FFT patterns, 0 similarity patterns
[GP] Generation strategy: 6 block-based, 6 interpolated, 8 mutated
[GP] Strategy 1: Creating 6 candidates via building block combination...
[GP] Strategy 1 complete: 6 block-based candidates created
[GP] Strategy 2: Creating 6 candidates via solution interpolation...
[GP] Strategy 2 complete: 6 interpolated candidates created
[GP] Strategy 3: Creating 8 candidates via guided mutation...
[GP] Strategy 3 complete: 8 mutated candidates created
[GP] Total candidates generated: 20
[GP] Strategy breakdown: Block=30, Interp=30, Mut=40
[GP] ========== CANDIDATE GENERATION COMPLETE ==========


*** [GPU 0] NEW GLOBAL BEST: 409203988.00 at gen 2100 ***
    Saved to best_solution.json

[GPU 0] Gen  2100 | Best: 409203988.00 | 352.2s
[GPU 0] Gene injection: 20 candidates injected at gen 2200 (total so far: 100)

*** [GPU 0] NEW GLOBAL BEST: 407932372.00 at gen 2200 ***
  -> 20 candidates sent to 1/1 workers

[CHECKPOINT] Saved A.json at gen 1000 (makespan: 411071554.00)
    Saved to best_solution.json

[GPU 0] Gen  2200 | Best: 407932372.00 | 368.4s
[GP] gpu_0 intermediate update: 409203988.00 at gen 2100
[GP] gpu_0 intermediate update: 407932372.00 at gen 2200

*** [GPU 0] NEW GLOBAL BEST: 406566288.00 at gen 2300 ***
    Saved to best_solution.json

[GPU 0] Gen  2300 | Best: 406566288.00 | 385.4s
[GP] gpu_0 intermediate update: 406566288.00 at gen 2300
[GP] gpu_0 intermediate update: 405539144.00 at gen 2400

==================================================
GP ANALYSIS - Cycle 6
  Collected 40 solutions
==================================================

[GP] ========== GENETIC PROGRAMMING ANALYSIS STARTED ==========
[GP] Cycle: 5
[GP] Input: 40 solutions received for analysis
[GP] Fitness range: best=405473696.00, worst=407952832.00
[GP] Analysis config: blocks=True, fft=False, similarity=False
[GP] Starting analysis...
[GP] Phase 1: Extracting building blocks...

*** [GPU 0] NEW GLOBAL BEST: 405473695.00 at gen 2400 ***
    Saved to best_solution.json

[GPU 0] Gen  2400 | Best: 405473695.00 | 402.7s
[GP] Phase 1 complete: Found 30 building blocks
[GP] Phase 2: FFT analysis DISABLED
[GP] Phase 3: Similarity analysis DISABLED
[GP] ========== GP ANALYSIS COMPLETE ==========


[GP] ========== CANDIDATE GENERATION STARTED ==========
[GP] Generating 20 new candidate solutions
[GP] Available data: 40 top solutions, 30 building blocks, 0 FFT patterns, 0 similarity patterns
[GP] Generation strategy: 6 block-based, 6 interpolated, 8 mutated
[GP] Strategy 1: Creating 6 candidates via building block combination...
[GP] Strategy 1 complete: 6 block-based candidates created
[GP] Strategy 2: Creating 6 candidates via solution interpolation...
[GP] Strategy 2 complete: 6 interpolated candidates created
[GP] Strategy 3: Creating 8 candidates via guided mutation...
[GP] Strategy 3 complete: 8 mutated candidates created
[GP] Total candidates generated: 20
[GP] Strategy breakdown: Block=36, Interp=36, Mut=48
[GP] ========== CANDIDATE GENERATION COMPLETE ==========


*** [GPU 0] NEW GLOBAL BEST: 403296927.00 at gen 2500 ***
    Saved to best_solution.json

[GPU 0] Gen  2500 | Best: 403296927.00 | 419.5s
[GPU 0] Gene injection: 20 candidates injected at gen 2600 (total so far: 120)
  -> 20 candidates sent to 1/1 workers
[GP] gpu_0 intermediate update: 405473695.00 at gen 2400
[GP] gpu_0 intermediate update: 403296927.00 at gen 2500
[GP] gpu_0 intermediate update: 401437859.00 at gen 2600

*** [GPU 0] NEW GLOBAL BEST: 401434851.00 at gen 2600 ***
    Saved to best_solution.json

[GPU 0] Gen  2600 | Best: 401434851.00 | 436.1s
[GP] gpu_0 intermediate update: 401434851.00 at gen 2600

*** [GPU 0] NEW GLOBAL BEST: 399416341.00 at gen 2700 ***
    Saved to best_solution.json

[GPU 0] Gen  2700 | Best: 399416341.00 | 452.6s
[GP] gpu_0 intermediate update: 399416341.00 at gen 2700
[GP] gpu_0 intermediate update: 397757605.00 at gen 2800

==================================================
GP ANALYSIS - Cycle 7
  Collected 40 solutions
==================================================

[GP] ========== GENETIC PROGRAMMING ANALYSIS STARTED ==========
[GP] Cycle: 6
[GP] Input: 40 solutions received for analysis
[GP] Fitness range: best=397718400.00, worst=401437856.00
[GP] Analysis config: blocks=True, fft=False, similarity=False
[GP] Starting analysis...
[GP] Phase 1: Extracting building blocks...

*** [GPU 0] NEW GLOBAL BEST: 397718398.00 at gen 2800 ***
    Saved to best_solution.json

[GPU 0] Gen  2800 | Best: 397718398.00 | 469.3s
[GP] Phase 1 complete: Found 30 building blocks
[GP] Phase 2: FFT analysis DISABLED
[GP] Phase 3: Similarity analysis DISABLED
[GP] ========== GP ANALYSIS COMPLETE ==========


[GP] ========== CANDIDATE GENERATION STARTED ==========
[GP] Generating 20 new candidate solutions
[GP] Available data: 40 top solutions, 30 building blocks, 0 FFT patterns, 0 similarity patterns
[GP] Generation strategy: 6 block-based, 6 interpolated, 8 mutated
[GP] Strategy 1: Creating 6 candidates via building block combination...
[GP] Strategy 1 complete: 6 block-based candidates created
[GP] Strategy 2: Creating 6 candidates via solution interpolation...
[GP] Strategy 2 complete: 6 interpolated candidates created
[GP] Strategy 3: Creating 8 candidates via guided mutation...
[GP] Strategy 3 complete: 8 mutated candidates created
[GP] Total candidates generated: 20
[GP] Strategy breakdown: Block=42, Interp=42, Mut=56
[GP] ========== CANDIDATE GENERATION COMPLETE ==========


*** [GPU 0] NEW GLOBAL BEST: 397265645.00 at gen 2900 ***
    Saved to best_solution.json

[GPU 0] Gen  2900 | Best: 397265645.00 | 485.9s
[GPU 0] Gene injection: 20 candidates injected at gen 3000 (total so far: 140)
  -> 20 candidates sent to 1/1 workers
[GP] gpu_0 intermediate update: 397718398.00 at gen 2800
[GP] gpu_0 intermediate update: 397265645.00 at gen 2900
[GP] gpu_0 intermediate update: 395773163.00 at gen 3000

*** [GPU 0] NEW GLOBAL BEST: 395751647.00 at gen 3000 ***
    Saved to best_solution.json

[GPU 0] Gen  3000 | Best: 395751647.00 | 502.7s
    [Checkpoint] Saved to ./results/warm_start/blocks_only/dsj1000/1R20/job_times_1_seed0_3000.json
[GP] gpu_0 intermediate update: 395751647.00 at gen 3000

*** [GPU 0] NEW GLOBAL BEST: 394533497.00 at gen 3100 ***
    Saved to best_solution.json

[GPU 0] Gen  3100 | Best: 394533497.00 | 519.8s
[GP] gpu_0 intermediate update: 394533497.00 at gen 3100
[GP] gpu_0 intermediate update: 394175848.00 at gen 3200

==================================================
GP ANALYSIS - Cycle 8
  Collected 40 solutions
==================================================

[GP] ========== GENETIC PROGRAMMING ANALYSIS STARTED ==========
[GP] Cycle: 7
[GP] Input: 40 solutions received for analysis
[GP] Fitness range: best=394175840.00, worst=395776576.00
[GP] Analysis config: blocks=True, fft=False, similarity=False
[GP] Starting analysis...
[GP] Phase 1: Extracting building blocks...

*** [GPU 0] NEW GLOBAL BEST: 394175848.00 at gen 3200 ***
    Saved to best_solution.json

[GPU 0] Gen  3200 | Best: 394175848.00 | 536.7s
[GP] Phase 1 complete: Found 30 building blocks
[GP] Phase 2: FFT analysis DISABLED
[GP] Phase 3: Similarity analysis DISABLED
[GP] ========== GP ANALYSIS COMPLETE ==========


[GP] ========== CANDIDATE GENERATION STARTED ==========
[GP] Generating 20 new candidate solutions
[GP] Available data: 40 top solutions, 30 building blocks, 0 FFT patterns, 0 similarity patterns
[GP] Generation strategy: 6 block-based, 6 interpolated, 8 mutated
[GP] Strategy 1: Creating 6 candidates via building block combination...
[GP] Strategy 1 complete: 6 block-based candidates created
[GP] Strategy 2: Creating 6 candidates via solution interpolation...
[GP] Strategy 2 complete: 6 interpolated candidates created
[GP] Strategy 3: Creating 8 candidates via guided mutation...
[GP] Strategy 3 complete: 8 mutated candidates created
[GP] Total candidates generated: 20
[GP] Strategy breakdown: Block=48, Interp=48, Mut=64
[GP] ========== CANDIDATE GENERATION COMPLETE ==========


*** [GPU 0] NEW GLOBAL BEST: 393366568.00 at gen 3300 ***
    Saved to best_solution.json

[GPU 0] Gen  3300 | Best: 393366568.00 | 552.7s
[GPU 0] Gene injection: 20 candidates injected at gen 3400 (total so far: 160)
  -> 20 candidates sent to 1/1 workers
[GP] gpu_0 intermediate update: 393366568.00 at gen 3300
[GP] gpu_0 intermediate update: 392129630.00 at gen 3400

*** [GPU 0] NEW GLOBAL BEST: 391894208.00 at gen 3400 ***
    Saved to best_solution.json

[GPU 0] Gen  3400 | Best: 391894208.00 | 569.3s
[GP] gpu_0 intermediate update: 391894208.00 at gen 3400

*** [GPU 0] NEW GLOBAL BEST: 391223314.00 at gen 3500 ***
    Saved to best_solution.json

[GPU 0] Gen  3500 | Best: 391223314.00 | 586.2s
[GP] gpu_0 intermediate update: 391223314.00 at gen 3500
[GP] gpu_0 intermediate update: 389971416.00 at gen 3600

==================================================
GP ANALYSIS - Cycle 9
  Collected 40 solutions
==================================================

[GP] ========== GENETIC PROGRAMMING ANALYSIS STARTED ==========
[GP] Cycle: 8
[GP] Input: 40 solutions received for analysis
[GP] Fitness range: best=389971424.00, worst=392129632.00
[GP] Analysis config: blocks=True, fft=False, similarity=False
[GP] Starting analysis...
[GP] Phase 1: Extracting building blocks...

*** [GPU 0] NEW GLOBAL BEST: 389971416.00 at gen 3600 ***
    Saved to best_solution.json

[GPU 0] Gen  3600 | Best: 389971416.00 | 603.5s
[GP] Phase 1 complete: Found 30 building blocks
[GP] Phase 2: FFT analysis DISABLED
[GP] Phase 3: Similarity analysis DISABLED
[GP] ========== GP ANALYSIS COMPLETE ==========


[GP] ========== CANDIDATE GENERATION STARTED ==========
[GP] Generating 20 new candidate solutions
[GP] Available data: 40 top solutions, 30 building blocks, 0 FFT patterns, 0 similarity patterns
[GP] Generation strategy: 6 block-based, 6 interpolated, 8 mutated
[GP] Strategy 1: Creating 6 candidates via building block combination...
[GP] Strategy 1 complete: 6 block-based candidates created
[GP] Strategy 2: Creating 6 candidates via solution interpolation...
[GP] Strategy 2 complete: 6 interpolated candidates created
[GP] Strategy 3: Creating 8 candidates via guided mutation...
[GP] Strategy 3 complete: 8 mutated candidates created
[GP] Total candidates generated: 20
[GP] Strategy breakdown: Block=54, Interp=54, Mut=72
[GP] ========== CANDIDATE GENERATION COMPLETE ==========


*** [GPU 0] NEW GLOBAL BEST: 388807886.00 at gen 3700 ***
    Saved to best_solution.json

[GPU 0] Gen  3700 | Best: 388807886.00 | 620.8s
[GPU 0] Gene injection: 20 candidates injected at gen 3800 (total so far: 180)
  -> 20 candidates sent to 1/1 workers
[GP] gpu_0 intermediate update: 388807886.00 at gen 3700
[GP] gpu_0 intermediate update: 387874587.00 at gen 3800

*** [GPU 0] NEW GLOBAL BEST: 387874587.00 at gen 3800 ***
    Saved to best_solution.json

[GPU 0] Gen  3800 | Best: 387874587.00 | 637.9s

*** [GPU 0] NEW GLOBAL BEST: 386669408.00 at gen 3900 ***
    Saved to best_solution.json

[GPU 0] Gen  3900 | Best: 386669408.00 | 655.0s
[GP] gpu_0 intermediate update: 386669408.00 at gen 3900
[GP] gpu_0 intermediate update: 386496877.00 at gen 4000

==================================================
GP ANALYSIS - Cycle 10
  Collected 40 solutions
==================================================

[GP] ========== GENETIC PROGRAMMING ANALYSIS STARTED ==========
[GP] Cycle: 9
[GP] Input: 40 solutions received for analysis
[GP] Fitness range: best=386496864.00, worst=387874592.00
[GP] Analysis config: blocks=True, fft=False, similarity=False
[GP] Starting analysis...
[GP] Phase 1: Extracting building blocks...

*** [GPU 0] NEW GLOBAL BEST: 386496877.00 at gen 4000 ***
    Saved to best_solution.json

[GPU 0] Gen  4000 | Best: 386496877.00 | 672.2s
[GP] Phase 1 complete: Found 30 building blocks
[GP] Phase 2: FFT analysis DISABLED
[GP] Phase 3: Similarity analysis DISABLED
[GP] ========== GP ANALYSIS COMPLETE ==========


[GP] ========== CANDIDATE GENERATION STARTED ==========
[GP] Generating 20 new candidate solutions
[GP] Available data: 40 top solutions, 30 building blocks, 0 FFT patterns, 0 similarity patterns
[GP] Generation strategy: 6 block-based, 6 interpolated, 8 mutated
[GP] Strategy 1: Creating 6 candidates via building block combination...
[GP] Strategy 1 complete: 6 block-based candidates created
[GP] Strategy 2: Creating 6 candidates via solution interpolation...
[GP] Strategy 2 complete: 6 interpolated candidates created
[GP] Strategy 3: Creating 8 candidates via guided mutation...
[GP] Strategy 3 complete: 8 mutated candidates created
[GP] Total candidates generated: 20
[GP] Strategy breakdown: Block=60, Interp=60, Mut=80
[GP] ========== CANDIDATE GENERATION COMPLETE ==========

    [Checkpoint] Saved to ./results/warm_start/blocks_only/dsj1000/1R20/job_times_1_seed0_4000.json

*** [GPU 0] NEW GLOBAL BEST: 385864698.00 at gen 4100 ***
    Saved to best_solution.json

[GPU 0] Gen  4100 | Best: 385864698.00 | 689.6s
[GPU 0] Gene injection: 20 candidates injected at gen 4200 (total so far: 200)

*** [GPU 0] NEW GLOBAL BEST: 385369609.00 at gen 4200 ***
    Saved to best_solution.json

[GPU 0] Gen  4200 | Best: 385369609.00 | 707.2s
  -> 20 candidates sent to 1/1 workers

[CHECKPOINT] Saved B.json at gen 2000 (makespan: 386496877.00)
[GP] gpu_0 intermediate update: 385864698.00 at gen 4100
[GP] gpu_0 intermediate update: 385488473.00 at gen 4200
[GP] gpu_0 intermediate update: 385369609.00 at gen 4200

*** [GPU 0] NEW GLOBAL BEST: 384832508.00 at gen 4300 ***
    Saved to best_solution.json

[GPU 0] Gen  4300 | Best: 384832508.00 | 724.2s
[GP] gpu_0 intermediate update: 384832508.00 at gen 4300
[GP] gpu_0 intermediate update: 384154839.00 at gen 4400

==================================================
GP ANALYSIS - Cycle 11
  Collected 40 solutions
==================================================

[GP] ========== GENETIC PROGRAMMING ANALYSIS STARTED ==========
[GP] Cycle: 10
[GP] Input: 40 solutions received for analysis
[GP] Fitness range: best=384154848.00, worst=385488480.00
[GP] Analysis config: blocks=True, fft=False, similarity=False
[GP] Starting analysis...
[GP] Phase 1: Extracting building blocks...

*** [GPU 0] NEW GLOBAL BEST: 384154839.00 at gen 4400 ***
    Saved to best_solution.json

[GPU 0] Gen  4400 | Best: 384154839.00 | 741.5s
[GP] Phase 1 complete: Found 30 building blocks
[GP] Phase 2: FFT analysis DISABLED
[GP] Phase 3: Similarity analysis DISABLED
[GP] ========== GP ANALYSIS COMPLETE ==========


[GP] ========== CANDIDATE GENERATION STARTED ==========
[GP] Generating 20 new candidate solutions
[GP] Available data: 40 top solutions, 30 building blocks, 0 FFT patterns, 0 similarity patterns
[GP] Generation strategy: 6 block-based, 6 interpolated, 8 mutated
[GP] Strategy 1: Creating 6 candidates via building block combination...
[GP] Strategy 1 complete: 6 block-based candidates created
[GP] Strategy 2: Creating 6 candidates via solution interpolation...
[GP] Strategy 2 complete: 6 interpolated candidates created
[GP] Strategy 3: Creating 8 candidates via guided mutation...
[GP] Strategy 3 complete: 8 mutated candidates created
[GP] Total candidates generated: 20
[GP] Strategy breakdown: Block=66, Interp=66, Mut=88
[GP] ========== CANDIDATE GENERATION COMPLETE ==========


*** [GPU 0] NEW GLOBAL BEST: 383367176.00 at gen 4500 ***
    Saved to best_solution.json

[GPU 0] Gen  4500 | Best: 383367176.00 | 756.8s
[GPU 0] Gene injection: 20 candidates injected at gen 4600 (total so far: 220)
  -> 20 candidates sent to 1/1 workers
[GP] gpu_0 intermediate update: 383367176.00 at gen 4500
[GP] gpu_0 intermediate update: 382580501.00 at gen 4600

*** [GPU 0] NEW GLOBAL BEST: 382580501.00 at gen 4600 ***
    Saved to best_solution.json

[GPU 0] Gen  4600 | Best: 382580501.00 | 773.6s

*** [GPU 0] NEW GLOBAL BEST: 381623052.00 at gen 4700 ***
    Saved to best_solution.json

[GPU 0] Gen  4700 | Best: 381623052.00 | 790.7s
[GP] gpu_0 intermediate update: 381623052.00 at gen 4700
[GP] gpu_0 intermediate update: 380688747.00 at gen 4800

==================================================
GP ANALYSIS - Cycle 12
  Collected 40 solutions
==================================================

[GP] ========== GENETIC PROGRAMMING ANALYSIS STARTED ==========
[GP] Cycle: 11
[GP] Input: 40 solutions received for analysis
[GP] Fitness range: best=380688736.00, worst=382580512.00
[GP] Analysis config: blocks=True, fft=False, similarity=False
[GP] Starting analysis...
[GP] Phase 1: Extracting building blocks...

*** [GPU 0] NEW GLOBAL BEST: 380688747.00 at gen 4800 ***
    Saved to best_solution.json

[GPU 0] Gen  4800 | Best: 380688747.00 | 807.5s
[GP] Phase 1 complete: Found 30 building blocks
[GP] Phase 2: FFT analysis DISABLED
[GP] Phase 3: Similarity analysis DISABLED
[GP] ========== GP ANALYSIS COMPLETE ==========


[GP] ========== CANDIDATE GENERATION STARTED ==========
[GP] Generating 20 new candidate solutions
[GP] Available data: 40 top solutions, 30 building blocks, 0 FFT patterns, 0 similarity patterns
[GP] Generation strategy: 6 block-based, 6 interpolated, 8 mutated
[GP] Strategy 1: Creating 6 candidates via building block combination...
[GP] Strategy 1 complete: 6 block-based candidates created
[GP] Strategy 2: Creating 6 candidates via solution interpolation...
[GP] Strategy 2 complete: 6 interpolated candidates created
[GP] Strategy 3: Creating 8 candidates via guided mutation...
[GP] Strategy 3 complete: 8 mutated candidates created
[GP] Total candidates generated: 20
[GP] Strategy breakdown: Block=72, Interp=72, Mut=96
[GP] ========== CANDIDATE GENERATION COMPLETE ==========


*** [GPU 0] NEW GLOBAL BEST: 379715628.00 at gen 4900 ***
    Saved to best_solution.json

[GPU 0] Gen  4900 | Best: 379715628.00 | 824.1s
[GPU 0] Gene injection: 20 candidates injected at gen 5000 (total so far: 240)
[GPU 0] Evolution complete. Sending final results...
  -> 20 candidates sent to 1/1 workers
[GP] gpu_0 intermediate update: 379715628.00 at gen 4900
[GP] gpu_0 intermediate update: 378949751.00 at gen 5000
[GP] Worker finished: gpu_0 (best=378949751.00)

[GP] All workers finished. Total GP cycles: 12

[Final Collection] Have 1/1 workers. Waiting up to 120s for remaining...

[Critical] Attempting final result collection before terminating workers...

[Results Summary] Collected 1 results:
  gpu_0: fitness=378949751.00, intermediate=False, gen=final

======================================================================
COMPLETE
======================================================================
Best: 378949751.00 from gpu_0
  (Improved 64.2% over heuristic 1057305902.00)
Time: 844.6s
Total candidates injected: 240

Solution JSON saved to ./results/warm_start/blocks_only/dsj1000/1R20/job_times_1_seed0.json
HTML Gantt chart saved to: ./results/warm_start/blocks_only/dsj1000/1R20/job_times_1_seed0.html
