Setting random seed to 0
DEBUG: proc shape: (1000,), agents: 6, resources: 4, n: 1000

======================================================================
LOADING INITIAL SOLUTION FROM JSON
======================================================================
Loaded heuristic solution: Savings with makespan 531538918.00
File: ./results/heuristics_only/dsj1000/1R10/job_times_6_heuristics.json
Makespan: 531538918.00
Status: SUCCESS - Will use as warm start
======================================================================


======================================================================
VRP-RPD SOLVER
======================================================================
Problem: 999 customers, 6 agents, k=4
Heuristic: None
Genetic Programming: Yes
Warm Start: Yes
Gene Injection: Yes
Workers: 1 GPU + 0 CPU
Generations: 5000
======================================================================

Using solution from JSON file as warm start...
  JSON solution: 531538918.00
Skipping heuristic re-computation (using JSON solution + perturbations)

Generated 6 warm start chromosomes from JSON

[GP] Starting GP collection loop (timeout: 12975s)...
[GPU 0] Warm start: 6 chromosomes

*** [GPU 0] NEW GLOBAL BEST: 456678642.00 at gen 0 ***
    Saved to best_solution.json

[GPU 0] Gen     0 | Best: 456678642.00 | 0.5s
[GP] gpu_0 first intermediate: 456678642.00 at gen 0

*** [GPU 0] NEW GLOBAL BEST: 325705266.00 at gen 100 ***
    Saved to best_solution.json

[GPU 0] Gen   100 | Best: 325705266.00 | 14.2s
[GP] gpu_0 intermediate update: 325705266.00 at gen 100
[GP] gpu_0 intermediate update: 302990630.00 at gen 200

*** [GPU 0] NEW GLOBAL BEST: 302990630.00 at gen 200 ***
    Saved to best_solution.json

[GPU 0] Gen   200 | Best: 302990630.00 | 28.0s

*** [GPU 0] NEW GLOBAL BEST: 292781300.00 at gen 300 ***
    Saved to best_solution.json

[GPU 0] Gen   300 | Best: 292781300.00 | 41.7s
[GP] gpu_0 intermediate update: 292781300.00 at gen 300
[GP] gpu_0 intermediate update: 285883779.00 at gen 400

==================================================
GP ANALYSIS - Cycle 1
  Collected 40 solutions
==================================================

[GP] ========== GENETIC PROGRAMMING ANALYSIS STARTED ==========
[GP] Cycle: 0
[GP] Input: 40 solutions received for analysis
[GP] Fitness range: best=285883776.00, worst=303201024.00
[GP] Analysis config: blocks=True, fft=False, similarity=False
[GP] Starting analysis...
[GP] Phase 1: Extracting building blocks...

*** [GPU 0] NEW GLOBAL BEST: 285883779.00 at gen 400 ***
    Saved to best_solution.json

[GPU 0] Gen   400 | Best: 285883779.00 | 55.5s
[GP] Phase 1 complete: Found 30 building blocks
[GP] Phase 2: FFT analysis DISABLED
[GP] Phase 3: Similarity analysis DISABLED
[GP] ========== GP ANALYSIS COMPLETE ==========


[GP] ========== CANDIDATE GENERATION STARTED ==========
[GP] Generating 20 new candidate solutions
[GP] Available data: 40 top solutions, 30 building blocks, 0 FFT patterns, 0 similarity patterns
[GP] Generation strategy: 6 block-based, 6 interpolated, 8 mutated
[GP] Strategy 1: Creating 6 candidates via building block combination...
[GP] Strategy 1 complete: 6 block-based candidates created
[GP] Strategy 2: Creating 6 candidates via solution interpolation...
[GP] Strategy 2 complete: 6 interpolated candidates created
[GP] Strategy 3: Creating 8 candidates via guided mutation...
[GP] Strategy 3 complete: 8 mutated candidates created
[GP] Total candidates generated: 20
[GP] Strategy breakdown: Block=6, Interp=6, Mut=8
[GP] ========== CANDIDATE GENERATION COMPLETE ==========


*** [GPU 0] NEW GLOBAL BEST: 279824142.00 at gen 500 ***
    Saved to best_solution.json

[GPU 0] Gen   500 | Best: 279824142.00 | 69.0s
[GPU 0] Gene injection: 20 candidates injected at gen 600 (total so far: 20)
  -> 20 candidates sent to 1/1 workers
[GP] gpu_0 intermediate update: 279824142.00 at gen 500
[GP] gpu_0 intermediate update: 274948708.00 at gen 600

*** [GPU 0] NEW GLOBAL BEST: 274948708.00 at gen 600 ***
    Saved to best_solution.json

[GPU 0] Gen   600 | Best: 274948708.00 | 82.7s

*** [GPU 0] NEW GLOBAL BEST: 271563587.00 at gen 700 ***
    Saved to best_solution.json

[GPU 0] Gen   700 | Best: 271563587.00 | 96.3s
[GP] gpu_0 intermediate update: 271563587.00 at gen 700
[GP] gpu_0 intermediate update: 268467394.00 at gen 800

==================================================
GP ANALYSIS - Cycle 2
  Collected 40 solutions
==================================================

[GP] ========== GENETIC PROGRAMMING ANALYSIS STARTED ==========
[GP] Cycle: 1
[GP] Input: 40 solutions received for analysis
[GP] Fitness range: best=268409856.00, worst=274948704.00
[GP] Analysis config: blocks=True, fft=False, similarity=False
[GP] Starting analysis...
[GP] Phase 1: Extracting building blocks...

*** [GPU 0] NEW GLOBAL BEST: 268409856.00 at gen 800 ***
    Saved to best_solution.json

[GPU 0] Gen   800 | Best: 268409856.00 | 110.2s
[GP] Phase 1 complete: Found 30 building blocks
[GP] Phase 2: FFT analysis DISABLED
[GP] Phase 3: Similarity analysis DISABLED
[GP] ========== GP ANALYSIS COMPLETE ==========


[GP] ========== CANDIDATE GENERATION STARTED ==========
[GP] Generating 20 new candidate solutions
[GP] Available data: 40 top solutions, 30 building blocks, 0 FFT patterns, 0 similarity patterns
[GP] Generation strategy: 6 block-based, 6 interpolated, 8 mutated
[GP] Strategy 1: Creating 6 candidates via building block combination...
[GP] Strategy 1 complete: 6 block-based candidates created
[GP] Strategy 2: Creating 6 candidates via solution interpolation...
[GP] Strategy 2 complete: 6 interpolated candidates created
[GP] Strategy 3: Creating 8 candidates via guided mutation...
[GP] Strategy 3 complete: 8 mutated candidates created
[GP] Total candidates generated: 20
[GP] Strategy breakdown: Block=12, Interp=12, Mut=16
[GP] ========== CANDIDATE GENERATION COMPLETE ==========


*** [GPU 0] NEW GLOBAL BEST: 265983573.00 at gen 900 ***
    Saved to best_solution.json

[GPU 0] Gen   900 | Best: 265983573.00 | 124.0s
[GPU 0] Gene injection: 20 candidates injected at gen 1000 (total so far: 40)
  -> 20 candidates sent to 1/1 workers
[GP] gpu_0 intermediate update: 268409856.00 at gen 800
[GP] gpu_0 intermediate update: 265983573.00 at gen 900
[GP] gpu_0 intermediate update: 263421164.00 at gen 1000

*** [GPU 0] NEW GLOBAL BEST: 263421164.00 at gen 1000 ***
    Saved to best_solution.json

[GPU 0] Gen  1000 | Best: 263421164.00 | 137.9s
    [Checkpoint] Saved to ./results/warm_start/blocks_only/dsj1000/1R10/job_times_6_seed0_1000.json

*** [GPU 0] NEW GLOBAL BEST: 260610932.00 at gen 1100 ***
    Saved to best_solution.json

[GPU 0] Gen  1100 | Best: 260610932.00 | 151.8s
[GP] gpu_0 intermediate update: 260610932.00 at gen 1100
[GP] gpu_0 intermediate update: 259049132.00 at gen 1200

==================================================
GP ANALYSIS - Cycle 3
  Collected 40 solutions
==================================================

[GP] ========== GENETIC PROGRAMMING ANALYSIS STARTED ==========
[GP] Cycle: 2
[GP] Input: 40 solutions received for analysis
[GP] Fitness range: best=259049136.00, worst=263421168.00
[GP] Analysis config: blocks=True, fft=False, similarity=False
[GP] Starting analysis...
[GP] Phase 1: Extracting building blocks...

*** [GPU 0] NEW GLOBAL BEST: 259049132.00 at gen 1200 ***
    Saved to best_solution.json

[GPU 0] Gen  1200 | Best: 259049132.00 | 165.5s
[GP] Phase 1 complete: Found 30 building blocks
[GP] Phase 2: FFT analysis DISABLED
[GP] Phase 3: Similarity analysis DISABLED
[GP] ========== GP ANALYSIS COMPLETE ==========


[GP] ========== CANDIDATE GENERATION STARTED ==========
[GP] Generating 20 new candidate solutions
[GP] Available data: 40 top solutions, 30 building blocks, 0 FFT patterns, 0 similarity patterns
[GP] Generation strategy: 6 block-based, 6 interpolated, 8 mutated
[GP] Strategy 1: Creating 6 candidates via building block combination...
[GP] Strategy 1 complete: 6 block-based candidates created
[GP] Strategy 2: Creating 6 candidates via solution interpolation...
[GP] Strategy 2 complete: 6 interpolated candidates created
[GP] Strategy 3: Creating 8 candidates via guided mutation...
[GP] Strategy 3 complete: 8 mutated candidates created
[GP] Total candidates generated: 20
[GP] Strategy breakdown: Block=18, Interp=18, Mut=24
[GP] ========== CANDIDATE GENERATION COMPLETE ==========


*** [GPU 0] NEW GLOBAL BEST: 257077852.00 at gen 1300 ***
    Saved to best_solution.json

[GPU 0] Gen  1300 | Best: 257077852.00 | 179.1s
[GPU 0] Gene injection: 20 candidates injected at gen 1400 (total so far: 60)

*** [GPU 0] NEW GLOBAL BEST: 254915732.00 at gen 1400 ***
  -> 20 candidates sent to 1/1 workers
[GP] gpu_0 intermediate update: 257077852.00 at gen 1300
[GP] gpu_0 intermediate update: 254915732.00 at gen 1400
    Saved to best_solution.json

[GPU 0] Gen  1400 | Best: 254915732.00 | 192.7s

*** [GPU 0] NEW GLOBAL BEST: 252064960.00 at gen 1500 ***
    Saved to best_solution.json

[GPU 0] Gen  1500 | Best: 252064960.00 | 206.5s
[GP] gpu_0 intermediate update: 252064960.00 at gen 1500
[GP] gpu_0 intermediate update: 250761064.00 at gen 1600

==================================================
GP ANALYSIS - Cycle 4
  Collected 40 solutions
==================================================

[GP] ========== GENETIC PROGRAMMING ANALYSIS STARTED ==========
[GP] Cycle: 3
[GP] Input: 40 solutions received for analysis
[GP] Fitness range: best=250761056.00, worst=254935312.00
[GP] Analysis config: blocks=True, fft=False, similarity=False
[GP] Starting analysis...
[GP] Phase 1: Extracting building blocks...

*** [GPU 0] NEW GLOBAL BEST: 250761064.00 at gen 1600 ***
    Saved to best_solution.json

[GPU 0] Gen  1600 | Best: 250761064.00 | 220.8s
[GP] Phase 1 complete: Found 30 building blocks
[GP] Phase 2: FFT analysis DISABLED
[GP] Phase 3: Similarity analysis DISABLED
[GP] ========== GP ANALYSIS COMPLETE ==========


[GP] ========== CANDIDATE GENERATION STARTED ==========
[GP] Generating 20 new candidate solutions
[GP] Available data: 40 top solutions, 30 building blocks, 0 FFT patterns, 0 similarity patterns
[GP] Generation strategy: 6 block-based, 6 interpolated, 8 mutated
[GP] Strategy 1: Creating 6 candidates via building block combination...
[GP] Strategy 1 complete: 6 block-based candidates created
[GP] Strategy 2: Creating 6 candidates via solution interpolation...
[GP] Strategy 2 complete: 6 interpolated candidates created
[GP] Strategy 3: Creating 8 candidates via guided mutation...
[GP] Strategy 3 complete: 8 mutated candidates created
[GP] Total candidates generated: 20
[GP] Strategy breakdown: Block=24, Interp=24, Mut=32
[GP] ========== CANDIDATE GENERATION COMPLETE ==========


*** [GPU 0] NEW GLOBAL BEST: 249842748.00 at gen 1700 ***
    Saved to best_solution.json

[GPU 0] Gen  1700 | Best: 249842748.00 | 234.4s
[GPU 0] Gene injection: 20 candidates injected at gen 1800 (total so far: 80)

*** [GPU 0] NEW GLOBAL BEST: 248285196.00 at gen 1800 ***
    Saved to best_solution.json

[GPU 0] Gen  1800 | Best: 248285196.00 | 247.7s
  -> 20 candidates sent to 1/1 workers
[GP] gpu_0 intermediate update: 249842748.00 at gen 1700
[GP] gpu_0 intermediate update: 248285196.00 at gen 1800

*** [GPU 0] NEW GLOBAL BEST: 246306977.00 at gen 1900 ***
    Saved to best_solution.json

[GPU 0] Gen  1900 | Best: 246306977.00 | 261.4s
[GP] gpu_0 intermediate update: 246306977.00 at gen 1900
[GP] gpu_0 intermediate update: 244781703.00 at gen 2000

==================================================
GP ANALYSIS - Cycle 5
  Collected 40 solutions
==================================================

[GP] ========== GENETIC PROGRAMMING ANALYSIS STARTED ==========
[GP] Cycle: 4
[GP] Input: 40 solutions received for analysis
[GP] Fitness range: best=244781696.00, worst=248285200.00
[GP] Analysis config: blocks=True, fft=False, similarity=False
[GP] Starting analysis...
[GP] Phase 1: Extracting building blocks...

*** [GPU 0] NEW GLOBAL BEST: 244781703.00 at gen 2000 ***
    Saved to best_solution.json

[GPU 0] Gen  2000 | Best: 244781703.00 | 275.4s
[GP] Phase 1 complete: Found 30 building blocks
[GP] Phase 2: FFT analysis DISABLED
[GP] Phase 3: Similarity analysis DISABLED
[GP] ========== GP ANALYSIS COMPLETE ==========


[GP] ========== CANDIDATE GENERATION STARTED ==========
[GP] Generating 20 new candidate solutions
[GP] Available data: 40 top solutions, 30 building blocks, 0 FFT patterns, 0 similarity patterns
[GP] Generation strategy: 6 block-based, 6 interpolated, 8 mutated
[GP] Strategy 1: Creating 6 candidates via building block combination...
[GP] Strategy 1 complete: 6 block-based candidates created
[GP] Strategy 2: Creating 6 candidates via solution interpolation...
[GP] Strategy 2 complete: 6 interpolated candidates created
[GP] Strategy 3: Creating 8 candidates via guided mutation...
[GP] Strategy 3 complete: 8 mutated candidates created
[GP] Total candidates generated: 20
[GP] Strategy breakdown: Block=30, Interp=30, Mut=40
[GP] ========== CANDIDATE GENERATION COMPLETE ==========

    [Checkpoint] Saved to ./results/warm_start/blocks_only/dsj1000/1R10/job_times_6_seed0_2000.json

*** [GPU 0] NEW GLOBAL BEST: 243175946.00 at gen 2100 ***
    Saved to best_solution.json

[GPU 0] Gen  2100 | Best: 243175946.00 | 289.3s
[GPU 0] Gene injection: 20 candidates injected at gen 2200 (total so far: 100)

*** [GPU 0] NEW GLOBAL BEST: 242280147.00 at gen 2200 ***
  -> 20 candidates sent to 1/1 workers

[CHECKPOINT] Saved A.json at gen 1000 (makespan: 244781703.00)
    Saved to best_solution.json

[GPU 0] Gen  2200 | Best: 242280147.00 | 302.7s
[GP] gpu_0 intermediate update: 243175946.00 at gen 2100
[GP] gpu_0 intermediate update: 242281090.00 at gen 2200
[GP] gpu_0 intermediate update: 242280147.00 at gen 2200

*** [GPU 0] NEW GLOBAL BEST: 241189215.00 at gen 2300 ***
    Saved to best_solution.json

[GPU 0] Gen  2300 | Best: 241189215.00 | 316.0s
[GP] gpu_0 intermediate update: 241189215.00 at gen 2300
[GP] gpu_0 intermediate update: 239933312.00 at gen 2400

==================================================
GP ANALYSIS - Cycle 6
  Collected 40 solutions
==================================================

[GP] ========== GENETIC PROGRAMMING ANALYSIS STARTED ==========
[GP] Cycle: 5
[GP] Input: 40 solutions received for analysis
[GP] Fitness range: best=239896960.00, worst=242380480.00
[GP] Analysis config: blocks=True, fft=False, similarity=False
[GP] Starting analysis...
[GP] Phase 1: Extracting building blocks...

*** [GPU 0] NEW GLOBAL BEST: 239896962.00 at gen 2400 ***
    Saved to best_solution.json

[GPU 0] Gen  2400 | Best: 239896962.00 | 330.5s
[GP] Phase 1 complete: Found 30 building blocks
[GP] Phase 2: FFT analysis DISABLED
[GP] Phase 3: Similarity analysis DISABLED
[GP] ========== GP ANALYSIS COMPLETE ==========


[GP] ========== CANDIDATE GENERATION STARTED ==========
[GP] Generating 20 new candidate solutions
[GP] Available data: 40 top solutions, 30 building blocks, 0 FFT patterns, 0 similarity patterns
[GP] Generation strategy: 6 block-based, 6 interpolated, 8 mutated
[GP] Strategy 1: Creating 6 candidates via building block combination...
[GP] Strategy 1 complete: 6 block-based candidates created
[GP] Strategy 2: Creating 6 candidates via solution interpolation...
[GP] Strategy 2 complete: 6 interpolated candidates created
[GP] Strategy 3: Creating 8 candidates via guided mutation...
[GP] Strategy 3 complete: 8 mutated candidates created
[GP] Total candidates generated: 20
[GP] Strategy breakdown: Block=36, Interp=36, Mut=48
[GP] ========== CANDIDATE GENERATION COMPLETE ==========


*** [GPU 0] NEW GLOBAL BEST: 238986191.00 at gen 2500 ***
    Saved to best_solution.json

[GPU 0] Gen  2500 | Best: 238986191.00 | 345.0s
[GPU 0] Gene injection: 20 candidates injected at gen 2600 (total so far: 120)

*** [GPU 0] NEW GLOBAL BEST: 237961825.00 at gen 2600 ***
    Saved to best_solution.json

[GPU 0] Gen  2600 | Best: 237961825.00 | 359.3s
  -> 20 candidates sent to 1/1 workers
[GP] gpu_0 intermediate update: 239896962.00 at gen 2400
[GP] gpu_0 intermediate update: 238986191.00 at gen 2500
[GP] gpu_0 intermediate update: 237961825.00 at gen 2600

*** [GPU 0] NEW GLOBAL BEST: 237338253.00 at gen 2700 ***
    Saved to best_solution.json

[GPU 0] Gen  2700 | Best: 237338253.00 | 373.4s
[GP] gpu_0 intermediate update: 237338253.00 at gen 2700
[GP] gpu_0 intermediate update: 236734559.00 at gen 2800

==================================================
GP ANALYSIS - Cycle 7
  Collected 40 solutions
==================================================

[GP] ========== GENETIC PROGRAMMING ANALYSIS STARTED ==========
[GP] Cycle: 6
[GP] Input: 40 solutions received for analysis
[GP] Fitness range: best=236724352.00, worst=237961824.00
[GP] Analysis config: blocks=True, fft=False, similarity=False
[GP] Starting analysis...
[GP] Phase 1: Extracting building blocks...

*** [GPU 0] NEW GLOBAL BEST: 236724349.00 at gen 2800 ***
    Saved to best_solution.json

[GPU 0] Gen  2800 | Best: 236724349.00 | 387.6s
[GP] Phase 1 complete: Found 30 building blocks
[GP] Phase 2: FFT analysis DISABLED
[GP] Phase 3: Similarity analysis DISABLED
[GP] ========== GP ANALYSIS COMPLETE ==========


[GP] ========== CANDIDATE GENERATION STARTED ==========
[GP] Generating 20 new candidate solutions
[GP] Available data: 40 top solutions, 30 building blocks, 0 FFT patterns, 0 similarity patterns
[GP] Generation strategy: 6 block-based, 6 interpolated, 8 mutated
[GP] Strategy 1: Creating 6 candidates via building block combination...
[GP] Strategy 1 complete: 6 block-based candidates created
[GP] Strategy 2: Creating 6 candidates via solution interpolation...
[GP] Strategy 2 complete: 6 interpolated candidates created
[GP] Strategy 3: Creating 8 candidates via guided mutation...
[GP] Strategy 3 complete: 8 mutated candidates created
[GP] Total candidates generated: 20
[GP] Strategy breakdown: Block=42, Interp=42, Mut=56
[GP] ========== CANDIDATE GENERATION COMPLETE ==========


*** [GPU 0] NEW GLOBAL BEST: 235930045.00 at gen 2900 ***
    Saved to best_solution.json

[GPU 0] Gen  2900 | Best: 235930045.00 | 401.5s
[GPU 0] Gene injection: 20 candidates injected at gen 3000 (total so far: 140)

*** [GPU 0] NEW GLOBAL BEST: 235214079.00 at gen 3000 ***
  -> 20 candidates sent to 1/1 workers
[GP] gpu_0 intermediate update: 236724349.00 at gen 2800
[GP] gpu_0 intermediate update: 235930045.00 at gen 2900
[GP] gpu_0 intermediate update: 235214079.00 at gen 3000
    Saved to best_solution.json

[GPU 0] Gen  3000 | Best: 235214079.00 | 415.7s
    [Checkpoint] Saved to ./results/warm_start/blocks_only/dsj1000/1R10/job_times_6_seed0_3000.json

*** [GPU 0] NEW GLOBAL BEST: 234298746.00 at gen 3100 ***
    Saved to best_solution.json

[GPU 0] Gen  3100 | Best: 234298746.00 | 429.5s
[GP] gpu_0 intermediate update: 234298746.00 at gen 3100
[GP] gpu_0 intermediate update: 233389172.00 at gen 3200

==================================================
GP ANALYSIS - Cycle 8
  Collected 40 solutions
==================================================

[GP] ========== GENETIC PROGRAMMING ANALYSIS STARTED ==========
[GP] Cycle: 7
[GP] Input: 40 solutions received for analysis
[GP] Fitness range: best=233389168.00, worst=235289104.00
[GP] Analysis config: blocks=True, fft=False, similarity=False
[GP] Starting analysis...
[GP] Phase 1: Extracting building blocks...

*** [GPU 0] NEW GLOBAL BEST: 233389172.00 at gen 3200 ***
    Saved to best_solution.json

[GPU 0] Gen  3200 | Best: 233389172.00 | 443.4s
[GP] Phase 1 complete: Found 30 building blocks
[GP] Phase 2: FFT analysis DISABLED
[GP] Phase 3: Similarity analysis DISABLED
[GP] ========== GP ANALYSIS COMPLETE ==========


[GP] ========== CANDIDATE GENERATION STARTED ==========
[GP] Generating 20 new candidate solutions
[GP] Available data: 40 top solutions, 30 building blocks, 0 FFT patterns, 0 similarity patterns
[GP] Generation strategy: 6 block-based, 6 interpolated, 8 mutated
[GP] Strategy 1: Creating 6 candidates via building block combination...
[GP] Strategy 1 complete: 6 block-based candidates created
[GP] Strategy 2: Creating 6 candidates via solution interpolation...
[GP] Strategy 2 complete: 6 interpolated candidates created
[GP] Strategy 3: Creating 8 candidates via guided mutation...
[GP] Strategy 3 complete: 8 mutated candidates created
[GP] Total candidates generated: 20
[GP] Strategy breakdown: Block=48, Interp=48, Mut=64
[GP] ========== CANDIDATE GENERATION COMPLETE ==========


*** [GPU 0] NEW GLOBAL BEST: 233012213.00 at gen 3300 ***
    Saved to best_solution.json

[GPU 0] Gen  3300 | Best: 233012213.00 | 457.3s
[GPU 0] Gene injection: 20 candidates injected at gen 3400 (total so far: 160)

*** [GPU 0] NEW GLOBAL BEST: 232076989.00 at gen 3400 ***
    Saved to best_solution.json

[GPU 0] Gen  3400 | Best: 232076989.00 | 471.5s
  -> 20 candidates sent to 1/1 workers
[GP] gpu_0 intermediate update: 233012213.00 at gen 3300
[GP] gpu_0 intermediate update: 232415381.00 at gen 3400
[GP] gpu_0 intermediate update: 232076989.00 at gen 3400

*** [GPU 0] NEW GLOBAL BEST: 231685401.00 at gen 3500 ***
    Saved to best_solution.json

[GPU 0] Gen  3500 | Best: 231685401.00 | 485.6s
[GP] gpu_0 intermediate update: 231685401.00 at gen 3500
[GP] gpu_0 intermediate update: 231223671.00 at gen 3600

==================================================
GP ANALYSIS - Cycle 9
  Collected 40 solutions
==================================================

[GP] ========== GENETIC PROGRAMMING ANALYSIS STARTED ==========
[GP] Cycle: 8
[GP] Input: 40 solutions received for analysis
[GP] Fitness range: best=231223664.00, worst=232415376.00
[GP] Analysis config: blocks=True, fft=False, similarity=False
[GP] Starting analysis...
[GP] Phase 1: Extracting building blocks...

*** [GPU 0] NEW GLOBAL BEST: 231223671.00 at gen 3600 ***
    Saved to best_solution.json

[GPU 0] Gen  3600 | Best: 231223671.00 | 499.7s
[GP] Phase 1 complete: Found 30 building blocks
[GP] Phase 2: FFT analysis DISABLED
[GP] Phase 3: Similarity analysis DISABLED
[GP] ========== GP ANALYSIS COMPLETE ==========


[GP] ========== CANDIDATE GENERATION STARTED ==========
[GP] Generating 20 new candidate solutions
[GP] Available data: 40 top solutions, 30 building blocks, 0 FFT patterns, 0 similarity patterns
[GP] Generation strategy: 6 block-based, 6 interpolated, 8 mutated
[GP] Strategy 1: Creating 6 candidates via building block combination...
[GP] Strategy 1 complete: 6 block-based candidates created
[GP] Strategy 2: Creating 6 candidates via solution interpolation...
[GP] Strategy 2 complete: 6 interpolated candidates created
[GP] Strategy 3: Creating 8 candidates via guided mutation...
[GP] Strategy 3 complete: 8 mutated candidates created
[GP] Total candidates generated: 20
[GP] Strategy breakdown: Block=54, Interp=54, Mut=72
[GP] ========== CANDIDATE GENERATION COMPLETE ==========


*** [GPU 0] NEW GLOBAL BEST: 230662766.00 at gen 3700 ***
    Saved to best_solution.json

[GPU 0] Gen  3700 | Best: 230662766.00 | 513.9s
[GPU 0] Gene injection: 20 candidates injected at gen 3800 (total so far: 180)
  -> 20 candidates sent to 1/1 workers
[GP] gpu_0 intermediate update: 230662766.00 at gen 3700
[GP] gpu_0 intermediate update: 230171846.00 at gen 3800

*** [GPU 0] NEW GLOBAL BEST: 230171846.00 at gen 3800 ***
    Saved to best_solution.json

[GPU 0] Gen  3800 | Best: 230171846.00 | 528.1s

*** [GPU 0] NEW GLOBAL BEST: 229421895.00 at gen 3900 ***
    Saved to best_solution.json

[GPU 0] Gen  3900 | Best: 229421895.00 | 542.4s
[GP] gpu_0 intermediate update: 229421895.00 at gen 3900
[GP] gpu_0 intermediate update: 228960721.00 at gen 4000

==================================================
GP ANALYSIS - Cycle 10
  Collected 40 solutions
==================================================

[GP] ========== GENETIC PROGRAMMING ANALYSIS STARTED ==========
[GP] Cycle: 9
[GP] Input: 40 solutions received for analysis
[GP] Fitness range: best=228909920.00, worst=230171840.00
[GP] Analysis config: blocks=True, fft=False, similarity=False
[GP] Starting analysis...
[GP] Phase 1: Extracting building blocks...

*** [GPU 0] NEW GLOBAL BEST: 228909913.00 at gen 4000 ***
    Saved to best_solution.json

[GPU 0] Gen  4000 | Best: 228909913.00 | 556.6s
    [Checkpoint] Saved to ./results/warm_start/blocks_only/dsj1000/1R10/job_times_6_seed0_4000.json
[GP] Phase 1 complete: Found 30 building blocks
[GP] Phase 2: FFT analysis DISABLED
[GP] Phase 3: Similarity analysis DISABLED
[GP] ========== GP ANALYSIS COMPLETE ==========


[GP] ========== CANDIDATE GENERATION STARTED ==========
[GP] Generating 20 new candidate solutions
[GP] Available data: 40 top solutions, 30 building blocks, 0 FFT patterns, 0 similarity patterns
[GP] Generation strategy: 6 block-based, 6 interpolated, 8 mutated
[GP] Strategy 1: Creating 6 candidates via building block combination...
[GP] Strategy 1 complete: 6 block-based candidates created
[GP] Strategy 2: Creating 6 candidates via solution interpolation...
[GP] Strategy 2 complete: 6 interpolated candidates created
[GP] Strategy 3: Creating 8 candidates via guided mutation...
[GP] Strategy 3 complete: 8 mutated candidates created
[GP] Total candidates generated: 20
[GP] Strategy breakdown: Block=60, Interp=60, Mut=80
[GP] ========== CANDIDATE GENERATION COMPLETE ==========


*** [GPU 0] NEW GLOBAL BEST: 228497677.00 at gen 4100 ***
    Saved to best_solution.json

[GPU 0] Gen  4100 | Best: 228497677.00 | 571.0s
[GPU 0] Gene injection: 20 candidates injected at gen 4200 (total so far: 200)
  -> 20 candidates sent to 1/1 workers

[CHECKPOINT] Saved B.json at gen 2000 (makespan: 228909913.00)

*** [GPU 0] NEW GLOBAL BEST: 227925930.00 at gen 4200 ***
    Saved to best_solution.json

[GPU 0] Gen  4200 | Best: 227925930.00 | 585.3s
[GP] gpu_0 intermediate update: 228909913.00 at gen 4000
[GP] gpu_0 intermediate update: 228497677.00 at gen 4100
[GP] gpu_0 intermediate update: 227925930.00 at gen 4200

*** [GPU 0] NEW GLOBAL BEST: 227795369.00 at gen 4300 ***
    Saved to best_solution.json

[GPU 0] Gen  4300 | Best: 227795369.00 | 599.6s
[GP] gpu_0 intermediate update: 227795369.00 at gen 4300
[GP] gpu_0 intermediate update: 227410713.00 at gen 4400

==================================================
GP ANALYSIS - Cycle 11
  Collected 40 solutions
==================================================

[GP] ========== GENETIC PROGRAMMING ANALYSIS STARTED ==========
[GP] Cycle: 10
[GP] Input: 40 solutions received for analysis
[GP] Fitness range: best=227378416.00, worst=227925936.00
[GP] Analysis config: blocks=True, fft=False, similarity=False
[GP] Starting analysis...
[GP] Phase 1: Extracting building blocks...

*** [GPU 0] NEW GLOBAL BEST: 227378412.00 at gen 4400 ***
    Saved to best_solution.json

[GPU 0] Gen  4400 | Best: 227378412.00 | 614.3s
[GP] Phase 1 complete: Found 30 building blocks
[GP] Phase 2: FFT analysis DISABLED
[GP] Phase 3: Similarity analysis DISABLED
[GP] ========== GP ANALYSIS COMPLETE ==========


[GP] ========== CANDIDATE GENERATION STARTED ==========
[GP] Generating 20 new candidate solutions
[GP] Available data: 40 top solutions, 30 building blocks, 0 FFT patterns, 0 similarity patterns
[GP] Generation strategy: 6 block-based, 6 interpolated, 8 mutated
[GP] Strategy 1: Creating 6 candidates via building block combination...
[GP] Strategy 1 complete: 6 block-based candidates created
[GP] Strategy 2: Creating 6 candidates via solution interpolation...
[GP] Strategy 2 complete: 6 interpolated candidates created
[GP] Strategy 3: Creating 8 candidates via guided mutation...
[GP] Strategy 3 complete: 8 mutated candidates created
[GP] Total candidates generated: 20
[GP] Strategy breakdown: Block=66, Interp=66, Mut=88
[GP] ========== CANDIDATE GENERATION COMPLETE ==========


*** [GPU 0] NEW GLOBAL BEST: 227091962.00 at gen 4500 ***
    Saved to best_solution.json

[GPU 0] Gen  4500 | Best: 227091962.00 | 628.7s
[GPU 0] Gene injection: 20 candidates injected at gen 4600 (total so far: 220)
  -> 20 candidates sent to 1/1 workers
[GP] gpu_0 intermediate update: 227378412.00 at gen 4400
[GP] gpu_0 intermediate update: 227091962.00 at gen 4500
[GP] gpu_0 intermediate update: 226773876.00 at gen 4600

*** [GPU 0] NEW GLOBAL BEST: 226773876.00 at gen 4600 ***
    Saved to best_solution.json

[GPU 0] Gen  4600 | Best: 226773876.00 | 643.0s

*** [GPU 0] NEW GLOBAL BEST: 226605319.00 at gen 4700 ***
    Saved to best_solution.json

[GPU 0] Gen  4700 | Best: 226605319.00 | 657.1s
[GP] gpu_0 intermediate update: 226605319.00 at gen 4700
[GP] gpu_0 intermediate update: 226331919.00 at gen 4800

==================================================
GP ANALYSIS - Cycle 12
  Collected 40 solutions
==================================================

[GP] ========== GENETIC PROGRAMMING ANALYSIS STARTED ==========
[GP] Cycle: 11
[GP] Input: 40 solutions received for analysis
[GP] Fitness range: best=226331920.00, worst=226773872.00
[GP] Analysis config: blocks=True, fft=False, similarity=False
[GP] Starting analysis...
[GP] Phase 1: Extracting building blocks...

*** [GPU 0] NEW GLOBAL BEST: 226331919.00 at gen 4800 ***
    Saved to best_solution.json

[GPU 0] Gen  4800 | Best: 226331919.00 | 671.5s
[GP] Phase 1 complete: Found 30 building blocks
[GP] Phase 2: FFT analysis DISABLED
[GP] Phase 3: Similarity analysis DISABLED
[GP] ========== GP ANALYSIS COMPLETE ==========


[GP] ========== CANDIDATE GENERATION STARTED ==========
[GP] Generating 20 new candidate solutions
[GP] Available data: 40 top solutions, 30 building blocks, 0 FFT patterns, 0 similarity patterns
[GP] Generation strategy: 6 block-based, 6 interpolated, 8 mutated
[GP] Strategy 1: Creating 6 candidates via building block combination...
[GP] Strategy 1 complete: 6 block-based candidates created
[GP] Strategy 2: Creating 6 candidates via solution interpolation...
[GP] Strategy 2 complete: 6 interpolated candidates created
[GP] Strategy 3: Creating 8 candidates via guided mutation...
[GP] Strategy 3 complete: 8 mutated candidates created
[GP] Total candidates generated: 20
[GP] Strategy breakdown: Block=72, Interp=72, Mut=96
[GP] ========== CANDIDATE GENERATION COMPLETE ==========


*** [GPU 0] NEW GLOBAL BEST: 226221463.00 at gen 4900 ***
    Saved to best_solution.json

[GPU 0] Gen  4900 | Best: 226221463.00 | 685.3s
[GPU 0] Gene injection: 20 candidates injected at gen 5000 (total so far: 240)
[GPU 0] Evolution complete. Sending final results...
  -> 20 candidates sent to 1/1 workers
[GP] gpu_0 intermediate update: 226221463.00 at gen 4900
[GP] gpu_0 intermediate update: 226068633.00 at gen 5000
[GP] Worker finished: gpu_0 (best=226068633.00)

[GP] All workers finished. Total GP cycles: 12

[Final Collection] Have 1/1 workers. Waiting up to 120s for remaining...

[Critical] Attempting final result collection before terminating workers...

[Results Summary] Collected 1 results:
  gpu_0: fitness=226068633.00, intermediate=False, gen=final

======================================================================
COMPLETE
======================================================================
Best: 226068633.00 from gpu_0
  (Improved 57.5% over heuristic 531538918.00)
Time: 702.2s
Total candidates injected: 240

Solution JSON saved to ./results/warm_start/blocks_only/dsj1000/1R10/job_times_6_seed0.json
HTML Gantt chart saved to: ./results/warm_start/blocks_only/dsj1000/1R10/job_times_6_seed0.html
