Setting random seed to 0
DEBUG: proc shape: (431,), agents: 6, resources: 4, n: 431

======================================================================
LOADING INITIAL SOLUTION FROM JSON
======================================================================
Loaded heuristic solution: Savings with makespan 3722367.00
File: ./results/heuristics_only/gr431/1R10/job_times_3_heuristics.json
Makespan: 3722367.00
Status: SUCCESS - Will use as warm start
======================================================================


======================================================================
VRP-RPD SOLVER
======================================================================
Problem: 430 customers, 6 agents, k=4
Heuristic: None
Genetic Programming: Yes
Warm Start: Yes
Gene Injection: Yes
Workers: 1 GPU + 0 CPU
Generations: 5000
======================================================================

Using solution from JSON file as warm start...
  JSON solution: 3722367.00
Skipping heuristic re-computation (using JSON solution + perturbations)

Generated 6 warm start chromosomes from JSON

[GP] Starting GP collection loop (timeout: 750s)...
[GPU 0] Warm start: 6 chromosomes

*** [GPU 0] NEW GLOBAL BEST: 2336311.00 at gen 0 ***
    Saved to best_solution.json

[GPU 0] Gen     0 | Best: 2336311.00 | 0.4s
[GP] gpu_0 first intermediate: 2336311.00 at gen 0

*** [GPU 0] NEW GLOBAL BEST: 1623929.00 at gen 100 ***
    Saved to best_solution.json

[GPU 0] Gen   100 | Best: 1623929.00 | 10.6s
[GP] gpu_0 intermediate update: 1623929.00 at gen 100
[GP] gpu_0 intermediate update: 1557070.00 at gen 200

==================================================
GP ANALYSIS - Cycle 1
  Collected 100 solutions
==================================================

[GP] ========== GENETIC PROGRAMMING ANALYSIS STARTED ==========
[GP] Cycle: 0
[GP] Input: 100 solutions received for analysis
[GP] Fitness range: best=1557070.00, worst=1558520.00
[GP] Analysis config: blocks=True, fft=False, similarity=False
[GP] Starting analysis...
[GP] Phase 1: Extracting building blocks...
[GP] Phase 1 complete: Found 10 building blocks
[GP] Phase 2: FFT analysis DISABLED
[GP] Phase 3: Similarity analysis DISABLED
[GP] ========== GP ANALYSIS COMPLETE ==========


[GP] ========== CANDIDATE GENERATION STARTED ==========
[GP] Generating 20 new candidate solutions
[GP] Available data: 100 top solutions, 10 building blocks, 0 FFT patterns, 0 similarity patterns
[GP] Generation strategy: 6 block-based, 6 interpolated, 8 mutated
[GP] Strategy 1: Creating 6 candidates via building block combination...
[GP] Strategy 1 complete: 6 block-based candidates created
[GP] Strategy 2: Creating 6 candidates via solution interpolation...
[GP] Strategy 2 complete: 6 interpolated candidates created
[GP] Strategy 3: Creating 8 candidates via guided mutation...
[GP] Strategy 3 complete: 8 mutated candidates created
[GP] Total candidates generated: 20
[GP] Strategy breakdown: Block=6, Interp=6, Mut=8
[GP] ========== CANDIDATE GENERATION COMPLETE ==========


*** [GPU 0] NEW GLOBAL BEST: 1557070.00 at gen 200 ***
    Saved to best_solution.json

[GPU 0] Gen   200 | Best: 1557070.00 | 20.9s

*** [GPU 0] NEW GLOBAL BEST: 1495425.00 at gen 300 ***
    Saved to best_solution.json

[GPU 0] Gen   300 | Best: 1495425.00 | 31.1s
  -> 20 candidates sent to 1/1 workers
[GP] gpu_0 intermediate update: 1495425.00 at gen 300
[GPU 0] Gene injection: 20 candidates injected at gen 400 (total so far: 20)
[GP] gpu_0 intermediate update: 1462453.00 at gen 400

==================================================
GP ANALYSIS - Cycle 2
  Collected 100 solutions
==================================================

[GP] ========== GENETIC PROGRAMMING ANALYSIS STARTED ==========
[GP] Cycle: 1
[GP] Input: 100 solutions received for analysis
[GP] Fitness range: best=1462453.00, worst=1464482.00
[GP] Analysis config: blocks=True, fft=False, similarity=False
[GP] Starting analysis...
[GP] Phase 1: Extracting building blocks...

*** [GPU 0] NEW GLOBAL BEST: 1462453.00 at gen 400 ***
    Saved to best_solution.json

[GPU 0] Gen   400 | Best: 1462453.00 | 41.1s
[GP] Phase 1 complete: Found 3 building blocks
[GP] Phase 2: FFT analysis DISABLED
[GP] Phase 3: Similarity analysis DISABLED
[GP] ========== GP ANALYSIS COMPLETE ==========


[GP] ========== CANDIDATE GENERATION STARTED ==========
[GP] Generating 20 new candidate solutions
[GP] Available data: 100 top solutions, 3 building blocks, 0 FFT patterns, 0 similarity patterns
[GP] Generation strategy: 6 block-based, 6 interpolated, 8 mutated
[GP] Strategy 1: Creating 6 candidates via building block combination...
[GP] Strategy 1 complete: 6 block-based candidates created
[GP] Strategy 2: Creating 6 candidates via solution interpolation...
[GP] Strategy 2 complete: 6 interpolated candidates created
[GP] Strategy 3: Creating 8 candidates via guided mutation...
[GP] Strategy 3 complete: 8 mutated candidates created
[GP] Total candidates generated: 20
[GP] Strategy breakdown: Block=12, Interp=12, Mut=16
[GP] ========== CANDIDATE GENERATION COMPLETE ==========


*** [GPU 0] NEW GLOBAL BEST: 1429416.00 at gen 500 ***
    Saved to best_solution.json

[GPU 0] Gen   500 | Best: 1429416.00 | 51.0s
  -> 20 candidates sent to 1/1 workers
[GP] gpu_0 intermediate update: 1429416.00 at gen 500
[GP] gpu_0 intermediate update: 1425465.00 at gen 600
[GPU 0] Gene injection: 20 candidates injected at gen 600 (total so far: 40)

==================================================
GP ANALYSIS - Cycle 3
  Collected 100 solutions
==================================================

[GP] ========== GENETIC PROGRAMMING ANALYSIS STARTED ==========
[GP] Cycle: 2
[GP] Input: 100 solutions received for analysis
[GP] Fitness range: best=1425465.00, worst=1425465.00
[GP] Analysis config: blocks=True, fft=False, similarity=False
[GP] Starting analysis...
[GP] Phase 1: Extracting building blocks...

*** [GPU 0] NEW GLOBAL BEST: 1425465.00 at gen 600 ***
    Saved to best_solution.json

[GPU 0] Gen   600 | Best: 1425465.00 | 61.2s
[GP] Phase 1 complete: Found 8 building blocks
[GP] Phase 2: FFT analysis DISABLED
[GP] Phase 3: Similarity analysis DISABLED
[GP] ========== GP ANALYSIS COMPLETE ==========


[GP] ========== CANDIDATE GENERATION STARTED ==========
[GP] Generating 20 new candidate solutions
[GP] Available data: 100 top solutions, 8 building blocks, 0 FFT patterns, 0 similarity patterns
[GP] Generation strategy: 6 block-based, 6 interpolated, 8 mutated
[GP] Strategy 1: Creating 6 candidates via building block combination...
[GP] Strategy 1 complete: 6 block-based candidates created
[GP] Strategy 2: Creating 6 candidates via solution interpolation...
[GP] Strategy 2 complete: 6 interpolated candidates created
[GP] Strategy 3: Creating 8 candidates via guided mutation...
[GP] Strategy 3 complete: 8 mutated candidates created
[GP] Total candidates generated: 20
[GP] Strategy breakdown: Block=18, Interp=18, Mut=24
[GP] ========== CANDIDATE GENERATION COMPLETE ==========


*** [GPU 0] NEW GLOBAL BEST: 1416148.00 at gen 700 ***
    Saved to best_solution.json

[GPU 0] Gen   700 | Best: 1416148.00 | 71.3s
  -> 20 candidates sent to 1/1 workers
[GP] gpu_0 intermediate update: 1416148.00 at gen 700
[GPU 0] Gene injection: 20 candidates injected at gen 800 (total so far: 60)
[GP] gpu_0 intermediate update: 1397144.00 at gen 800

==================================================
GP ANALYSIS - Cycle 4
  Collected 100 solutions
==================================================

[GP] ========== GENETIC PROGRAMMING ANALYSIS STARTED ==========
[GP] Cycle: 3
[GP] Input: 100 solutions received for analysis
[GP] Fitness range: best=1397144.00, worst=1397782.00
[GP] Analysis config: blocks=True, fft=False, similarity=False
[GP] Starting analysis...
[GP] Phase 1: Extracting building blocks...

*** [GPU 0] NEW GLOBAL BEST: 1397144.00 at gen 800 ***
    Saved to best_solution.json

[GPU 0] Gen   800 | Best: 1397144.00 | 81.5s
[GP] Phase 1 complete: Found 16 building blocks
[GP] Phase 2: FFT analysis DISABLED
[GP] Phase 3: Similarity analysis DISABLED
[GP] ========== GP ANALYSIS COMPLETE ==========


[GP] ========== CANDIDATE GENERATION STARTED ==========
[GP] Generating 20 new candidate solutions
[GP] Available data: 100 top solutions, 16 building blocks, 0 FFT patterns, 0 similarity patterns
[GP] Generation strategy: 6 block-based, 6 interpolated, 8 mutated
[GP] Strategy 1: Creating 6 candidates via building block combination...
[GP] Strategy 1 complete: 6 block-based candidates created
[GP] Strategy 2: Creating 6 candidates via solution interpolation...
[GP] Strategy 2 complete: 6 interpolated candidates created
[GP] Strategy 3: Creating 8 candidates via guided mutation...
[GP] Strategy 3 complete: 8 mutated candidates created
[GP] Total candidates generated: 20
[GP] Strategy breakdown: Block=24, Interp=24, Mut=32
[GP] ========== CANDIDATE GENERATION COMPLETE ==========


*** [GPU 0] NEW GLOBAL BEST: 1385642.00 at gen 900 ***
    Saved to best_solution.json

[GPU 0] Gen   900 | Best: 1385642.00 | 91.9s
  -> 20 candidates sent to 1/1 workers
[GP] gpu_0 intermediate update: 1385642.00 at gen 900
[GPU 0] Gene injection: 20 candidates injected at gen 1000 (total so far: 80)
[GP] gpu_0 intermediate update: 1375078.00 at gen 1000

==================================================
GP ANALYSIS - Cycle 5
  Collected 100 solutions
==================================================

[GP] ========== GENETIC PROGRAMMING ANALYSIS STARTED ==========
[GP] Cycle: 4
[GP] Input: 100 solutions received for analysis
[GP] Fitness range: best=1375078.00, worst=1375078.00
[GP] Analysis config: blocks=True, fft=False, similarity=False
[GP] Starting analysis...
[GP] Phase 1: Extracting building blocks...

*** [GPU 0] NEW GLOBAL BEST: 1375078.00 at gen 1000 ***
    Saved to best_solution.json

[GPU 0] Gen  1000 | Best: 1375078.00 | 102.0s
[GP] Phase 1 complete: Found 0 building blocks
[GP] Phase 2: FFT analysis DISABLED
[GP] Phase 3: Similarity analysis DISABLED
[GP] ========== GP ANALYSIS COMPLETE ==========


[GP] ========== CANDIDATE GENERATION STARTED ==========
[GP] Generating 20 new candidate solutions
[GP] Available data: 100 top solutions, 0 building blocks, 0 FFT patterns, 0 similarity patterns
[GP] Generation strategy: 6 block-based, 6 interpolated, 8 mutated
[GP] Strategy 1: Creating 6 candidates via building block combination...
[GP] Strategy 1 complete: 6 block-based candidates created
[GP] Strategy 2: Creating 6 candidates via solution interpolation...
[GP] Strategy 2 complete: 6 interpolated candidates created
[GP] Strategy 3: Creating 8 candidates via guided mutation...
[GP] Strategy 3 complete: 8 mutated candidates created
[GP] Total candidates generated: 20
[GP] Strategy breakdown: Block=30, Interp=30, Mut=40
[GP] ========== CANDIDATE GENERATION COMPLETE ==========

    [Checkpoint] Saved to ./results/warm_start/blocks_only/gr431/1R10/job_times_3_seed0_1000.json
  -> 20 candidates sent to 1/1 workers

[CHECKPOINT] Saved A.json at gen 1000 (makespan: 1375078.00)

*** [GPU 0] NEW GLOBAL BEST: 1371509.00 at gen 1100 ***
    Saved to best_solution.json

[GPU 0] Gen  1100 | Best: 1371509.00 | 112.1s
[GP] gpu_0 intermediate update: 1371509.00 at gen 1100
[GP] gpu_0 intermediate update: 1357970.00 at gen 1200
[GPU 0] Gene injection: 20 candidates injected at gen 1200 (total so far: 100)

==================================================
GP ANALYSIS - Cycle 6
  Collected 100 solutions
==================================================

[GP] ========== GENETIC PROGRAMMING ANALYSIS STARTED ==========
[GP] Cycle: 5
[GP] Input: 100 solutions received for analysis
[GP] Fitness range: best=1357970.00, worst=1358792.00
[GP] Analysis config: blocks=True, fft=False, similarity=False
[GP] Starting analysis...
[GP] Phase 1: Extracting building blocks...

*** [GPU 0] NEW GLOBAL BEST: 1357970.00 at gen 1200 ***
    Saved to best_solution.json

[GPU 0] Gen  1200 | Best: 1357970.00 | 122.6s
[GP] Phase 1 complete: Found 7 building blocks
[GP] Phase 2: FFT analysis DISABLED
[GP] Phase 3: Similarity analysis DISABLED
[GP] ========== GP ANALYSIS COMPLETE ==========


[GP] ========== CANDIDATE GENERATION STARTED ==========
[GP] Generating 20 new candidate solutions
[GP] Available data: 100 top solutions, 7 building blocks, 0 FFT patterns, 0 similarity patterns
[GP] Generation strategy: 6 block-based, 6 interpolated, 8 mutated
[GP] Strategy 1: Creating 6 candidates via building block combination...
[GP] Strategy 1 complete: 6 block-based candidates created
[GP] Strategy 2: Creating 6 candidates via solution interpolation...
[GP] Strategy 2 complete: 6 interpolated candidates created
[GP] Strategy 3: Creating 8 candidates via guided mutation...
[GP] Strategy 3 complete: 8 mutated candidates created
[GP] Total candidates generated: 20
[GP] Strategy breakdown: Block=36, Interp=36, Mut=48
[GP] ========== CANDIDATE GENERATION COMPLETE ==========


*** [GPU 0] NEW GLOBAL BEST: 1350951.00 at gen 1300 ***
    Saved to best_solution.json

[GPU 0] Gen  1300 | Best: 1350951.00 | 132.6s
  -> 20 candidates sent to 1/1 workers
[GP] gpu_0 intermediate update: 1350951.00 at gen 1300
[GPU 0] Gene injection: 20 candidates injected at gen 1400 (total so far: 120)
[GP] gpu_0 intermediate update: 1343345.00 at gen 1400

==================================================
GP ANALYSIS - Cycle 7
  Collected 100 solutions
==================================================

[GP] ========== GENETIC PROGRAMMING ANALYSIS STARTED ==========
[GP] Cycle: 6
[GP] Input: 100 solutions received for analysis
[GP] Fitness range: best=1343345.00, worst=1343686.00
[GP] Analysis config: blocks=True, fft=False, similarity=False
[GP] Starting analysis...
[GP] Phase 1: Extracting building blocks...

*** [GPU 0] NEW GLOBAL BEST: 1343345.00 at gen 1400 ***
    Saved to best_solution.json

[GPU 0] Gen  1400 | Best: 1343345.00 | 142.4s
[GP] Phase 1 complete: Found 18 building blocks
[GP] Phase 2: FFT analysis DISABLED
[GP] Phase 3: Similarity analysis DISABLED
[GP] ========== GP ANALYSIS COMPLETE ==========


[GP] ========== CANDIDATE GENERATION STARTED ==========
[GP] Generating 20 new candidate solutions
[GP] Available data: 100 top solutions, 18 building blocks, 0 FFT patterns, 0 similarity patterns
[GP] Generation strategy: 6 block-based, 6 interpolated, 8 mutated
[GP] Strategy 1: Creating 6 candidates via building block combination...
[GP] Strategy 1 complete: 6 block-based candidates created
[GP] Strategy 2: Creating 6 candidates via solution interpolation...
[GP] Strategy 2 complete: 6 interpolated candidates created
[GP] Strategy 3: Creating 8 candidates via guided mutation...
[GP] Strategy 3 complete: 8 mutated candidates created
[GP] Total candidates generated: 20
[GP] Strategy breakdown: Block=42, Interp=42, Mut=56
[GP] ========== CANDIDATE GENERATION COMPLETE ==========


*** [GPU 0] NEW GLOBAL BEST: 1337687.00 at gen 1500 ***
    Saved to best_solution.json

[GPU 0] Gen  1500 | Best: 1337687.00 | 152.5s
  -> 20 candidates sent to 1/1 workers
[GP] gpu_0 intermediate update: 1337687.00 at gen 1500
[GPU 0] Gene injection: 20 candidates injected at gen 1600 (total so far: 140)
[GP] gpu_0 intermediate update: 1328648.00 at gen 1600

==================================================
GP ANALYSIS - Cycle 8
  Collected 100 solutions
==================================================

[GP] ========== GENETIC PROGRAMMING ANALYSIS STARTED ==========
[GP] Cycle: 7
[GP] Input: 100 solutions received for analysis
[GP] Fitness range: best=1328648.00, worst=1329123.00
[GP] Analysis config: blocks=True, fft=False, similarity=False
[GP] Starting analysis...
[GP] Phase 1: Extracting building blocks...

*** [GPU 0] NEW GLOBAL BEST: 1328648.00 at gen 1600 ***
    Saved to best_solution.json

[GPU 0] Gen  1600 | Best: 1328648.00 | 162.6s
[GP] Phase 1 complete: Found 30 building blocks
[GP] Phase 2: FFT analysis DISABLED
[GP] Phase 3: Similarity analysis DISABLED
[GP] ========== GP ANALYSIS COMPLETE ==========


[GP] ========== CANDIDATE GENERATION STARTED ==========
[GP] Generating 20 new candidate solutions
[GP] Available data: 100 top solutions, 30 building blocks, 0 FFT patterns, 0 similarity patterns
[GP] Generation strategy: 6 block-based, 6 interpolated, 8 mutated
[GP] Strategy 1: Creating 6 candidates via building block combination...
[GP] Strategy 1 complete: 6 block-based candidates created
[GP] Strategy 2: Creating 6 candidates via solution interpolation...
[GP] Strategy 2 complete: 6 interpolated candidates created
[GP] Strategy 3: Creating 8 candidates via guided mutation...
[GP] Strategy 3 complete: 8 mutated candidates created
[GP] Total candidates generated: 20
[GP] Strategy breakdown: Block=48, Interp=48, Mut=64
[GP] ========== CANDIDATE GENERATION COMPLETE ==========


*** [GPU 0] NEW GLOBAL BEST: 1324305.00 at gen 1700 ***
    Saved to best_solution.json

[GPU 0] Gen  1700 | Best: 1324305.00 | 172.5s
  -> 20 candidates sent to 1/1 workers
[GP] gpu_0 intermediate update: 1324305.00 at gen 1700
[GP] gpu_0 intermediate update: 1323815.00 at gen 1800
[GPU 0] Gene injection: 20 candidates injected at gen 1800 (total so far: 160)

==================================================
GP ANALYSIS - Cycle 9
  Collected 100 solutions
==================================================

[GP] ========== GENETIC PROGRAMMING ANALYSIS STARTED ==========
[GP] Cycle: 8
[GP] Input: 100 solutions received for analysis
[GP] Fitness range: best=1323796.00, worst=1323847.00
[GP] Analysis config: blocks=True, fft=False, similarity=False
[GP] Starting analysis...
[GP] Phase 1: Extracting building blocks...

*** [GPU 0] NEW GLOBAL BEST: 1323796.00 at gen 1800 ***
    Saved to best_solution.json

[GPU 0] Gen  1800 | Best: 1323796.00 | 182.6s
[GP] Phase 1 complete: Found 9 building blocks
[GP] Phase 2: FFT analysis DISABLED
[GP] Phase 3: Similarity analysis DISABLED
[GP] ========== GP ANALYSIS COMPLETE ==========


[GP] ========== CANDIDATE GENERATION STARTED ==========
[GP] Generating 20 new candidate solutions
[GP] Available data: 100 top solutions, 9 building blocks, 0 FFT patterns, 0 similarity patterns
[GP] Generation strategy: 6 block-based, 6 interpolated, 8 mutated
[GP] Strategy 1: Creating 6 candidates via building block combination...
[GP] Strategy 1 complete: 6 block-based candidates created
[GP] Strategy 2: Creating 6 candidates via solution interpolation...
[GP] Strategy 2 complete: 6 interpolated candidates created
[GP] Strategy 3: Creating 8 candidates via guided mutation...
[GP] Strategy 3 complete: 8 mutated candidates created
[GP] Total candidates generated: 20
[GP] Strategy breakdown: Block=54, Interp=54, Mut=72
[GP] ========== CANDIDATE GENERATION COMPLETE ==========

  -> 20 candidates sent to 1/1 workers
[GP] gpu_0 intermediate update: 1323796.00 at gen 1800

*** [GPU 0] NEW GLOBAL BEST: 1318881.00 at gen 1900 ***
    Saved to best_solution.json

[GPU 0] Gen  1900 | Best: 1318881.00 | 192.7s
[GP] gpu_0 intermediate update: 1318881.00 at gen 1900
[GP] gpu_0 intermediate update: 1316558.00 at gen 2000
[GPU 0] Gene injection: 20 candidates injected at gen 2000 (total so far: 180)

==================================================
GP ANALYSIS - Cycle 10
  Collected 100 solutions
==================================================

[GP] ========== GENETIC PROGRAMMING ANALYSIS STARTED ==========
[GP] Cycle: 9
[GP] Input: 100 solutions received for analysis
[GP] Fitness range: best=1316558.00, worst=1316558.00
[GP] Analysis config: blocks=True, fft=False, similarity=False
[GP] Starting analysis...
[GP] Phase 1: Extracting building blocks...

*** [GPU 0] NEW GLOBAL BEST: 1316558.00 at gen 2000 ***
    Saved to best_solution.json

[GPU 0] Gen  2000 | Best: 1316558.00 | 202.7s
    [Checkpoint] Saved to ./results/warm_start/blocks_only/gr431/1R10/job_times_3_seed0_2000.json
[GP] Phase 1 complete: Found 2 building blocks
[GP] Phase 2: FFT analysis DISABLED
[GP] Phase 3: Similarity analysis DISABLED
[GP] ========== GP ANALYSIS COMPLETE ==========


[GP] ========== CANDIDATE GENERATION STARTED ==========
[GP] Generating 20 new candidate solutions
[GP] Available data: 100 top solutions, 2 building blocks, 0 FFT patterns, 0 similarity patterns
[GP] Generation strategy: 6 block-based, 6 interpolated, 8 mutated
[GP] Strategy 1: Creating 6 candidates via building block combination...
[GP] Strategy 1 complete: 6 block-based candidates created
[GP] Strategy 2: Creating 6 candidates via solution interpolation...
[GP] Strategy 2 complete: 6 interpolated candidates created
[GP] Strategy 3: Creating 8 candidates via guided mutation...
[GP] Strategy 3 complete: 8 mutated candidates created
[GP] Total candidates generated: 20
[GP] Strategy breakdown: Block=60, Interp=60, Mut=80
[GP] ========== CANDIDATE GENERATION COMPLETE ==========

  -> 20 candidates sent to 1/1 workers

[CHECKPOINT] Saved B.json at gen 2000 (makespan: 1316558.00)
[GPU 0] Gen  2100 | Best: 1316558.00 | 212.6s
[GPU 0] Gene injection: 20 candidates injected at gen 2200 (total so far: 200)

==================================================
GP ANALYSIS - Cycle 11
  Collected 100 solutions
==================================================

[GP] ========== GENETIC PROGRAMMING ANALYSIS STARTED ==========
[GP] Cycle: 10
[GP] Input: 100 solutions received for analysis
[GP] Fitness range: best=1316558.00, worst=1316558.00
[GP] Analysis config: blocks=True, fft=False, similarity=False
[GP] Starting analysis...
[GP] Phase 1: Extracting building blocks...
[GPU 0] Gen  2200 | Best: 1316558.00 | 222.7s
[GP] Phase 1 complete: Found 30 building blocks
[GP] Phase 2: FFT analysis DISABLED
[GP] Phase 3: Similarity analysis DISABLED
[GP] ========== GP ANALYSIS COMPLETE ==========


[GP] ========== CANDIDATE GENERATION STARTED ==========
[GP] Generating 20 new candidate solutions
[GP] Available data: 100 top solutions, 30 building blocks, 0 FFT patterns, 0 similarity patterns
[GP] Generation strategy: 6 block-based, 6 interpolated, 8 mutated
[GP] Strategy 1: Creating 6 candidates via building block combination...
[GP] Strategy 1 complete: 6 block-based candidates created
[GP] Strategy 2: Creating 6 candidates via solution interpolation...
[GP] Strategy 2 complete: 6 interpolated candidates created
[GP] Strategy 3: Creating 8 candidates via guided mutation...
[GP] Strategy 3 complete: 8 mutated candidates created
[GP] Total candidates generated: 20
[GP] Strategy breakdown: Block=66, Interp=66, Mut=88
[GP] ========== CANDIDATE GENERATION COMPLETE ==========


*** [GPU 0] NEW GLOBAL BEST: 1311789.00 at gen 2300 ***
    Saved to best_solution.json

[GPU 0] Gen  2300 | Best: 1311789.00 | 232.8s
  -> 20 candidates sent to 1/1 workers
[GP] gpu_0 intermediate update: 1311789.00 at gen 2300
[GP] gpu_0 intermediate update: 1306210.00 at gen 2400
[GPU 0] Gene injection: 20 candidates injected at gen 2400 (total so far: 220)

==================================================
GP ANALYSIS - Cycle 12
  Collected 100 solutions
==================================================

[GP] ========== GENETIC PROGRAMMING ANALYSIS STARTED ==========
[GP] Cycle: 11
[GP] Input: 100 solutions received for analysis
[GP] Fitness range: best=1306210.00, worst=1307081.00
[GP] Analysis config: blocks=True, fft=False, similarity=False
[GP] Starting analysis...
[GP] Phase 1: Extracting building blocks...

*** [GPU 0] NEW GLOBAL BEST: 1306210.00 at gen 2400 ***
    Saved to best_solution.json

[GPU 0] Gen  2400 | Best: 1306210.00 | 242.9s
[GP] Phase 1 complete: Found 16 building blocks
[GP] Phase 2: FFT analysis DISABLED
[GP] Phase 3: Similarity analysis DISABLED
[GP] ========== GP ANALYSIS COMPLETE ==========


[GP] ========== CANDIDATE GENERATION STARTED ==========
[GP] Generating 20 new candidate solutions
[GP] Available data: 100 top solutions, 16 building blocks, 0 FFT patterns, 0 similarity patterns
[GP] Generation strategy: 6 block-based, 6 interpolated, 8 mutated
[GP] Strategy 1: Creating 6 candidates via building block combination...
[GP] Strategy 1 complete: 6 block-based candidates created
[GP] Strategy 2: Creating 6 candidates via solution interpolation...
[GP] Strategy 2 complete: 6 interpolated candidates created
[GP] Strategy 3: Creating 8 candidates via guided mutation...
[GP] Strategy 3 complete: 8 mutated candidates created
[GP] Total candidates generated: 20
[GP] Strategy breakdown: Block=72, Interp=72, Mut=96
[GP] ========== CANDIDATE GENERATION COMPLETE ==========


*** [GPU 0] NEW GLOBAL BEST: 1303891.00 at gen 2500 ***
    Saved to best_solution.json

[GPU 0] Gen  2500 | Best: 1303891.00 | 252.6s
  -> 20 candidates sent to 1/1 workers
[GP] gpu_0 intermediate update: 1303891.00 at gen 2500
[GP] gpu_0 intermediate update: 1300601.00 at gen 2600
[GPU 0] Gene injection: 20 candidates injected at gen 2600 (total so far: 240)

==================================================
GP ANALYSIS - Cycle 13
  Collected 100 solutions
==================================================

[GP] ========== GENETIC PROGRAMMING ANALYSIS STARTED ==========
[GP] Cycle: 12
[GP] Input: 100 solutions received for analysis
[GP] Fitness range: best=1300601.00, worst=1300601.00
[GP] Analysis config: blocks=True, fft=False, similarity=False
[GP] Starting analysis...
[GP] Phase 1: Extracting building blocks...

*** [GPU 0] NEW GLOBAL BEST: 1300601.00 at gen 2600 ***
    Saved to best_solution.json

[GPU 0] Gen  2600 | Best: 1300601.00 | 262.4s
[GP] Phase 1 complete: Found 13 building blocks
[GP] Phase 2: FFT analysis DISABLED
[GP] Phase 3: Similarity analysis DISABLED
[GP] ========== GP ANALYSIS COMPLETE ==========


[GP] ========== CANDIDATE GENERATION STARTED ==========
[GP] Generating 20 new candidate solutions
[GP] Available data: 100 top solutions, 13 building blocks, 0 FFT patterns, 0 similarity patterns
[GP] Generation strategy: 6 block-based, 6 interpolated, 8 mutated
[GP] Strategy 1: Creating 6 candidates via building block combination...
[GP] Strategy 1 complete: 6 block-based candidates created
[GP] Strategy 2: Creating 6 candidates via solution interpolation...
[GP] Strategy 2 complete: 6 interpolated candidates created
[GP] Strategy 3: Creating 8 candidates via guided mutation...
[GP] Strategy 3 complete: 8 mutated candidates created
[GP] Total candidates generated: 20
[GP] Strategy breakdown: Block=78, Interp=78, Mut=104
[GP] ========== CANDIDATE GENERATION COMPLETE ==========


*** [GPU 0] NEW GLOBAL BEST: 1299757.00 at gen 2700 ***
    Saved to best_solution.json

[GPU 0] Gen  2700 | Best: 1299757.00 | 272.6s
  -> 20 candidates sent to 1/1 workers
[GP] gpu_0 intermediate update: 1299757.00 at gen 2700
[GPU 0] Gene injection: 20 candidates injected at gen 2800 (total so far: 260)
[GP] gpu_0 intermediate update: 1298652.00 at gen 2800

==================================================
GP ANALYSIS - Cycle 14
  Collected 100 solutions
==================================================

[GP] ========== GENETIC PROGRAMMING ANALYSIS STARTED ==========
[GP] Cycle: 13
[GP] Input: 100 solutions received for analysis
[GP] Fitness range: best=1298652.00, worst=1298652.00
[GP] Analysis config: blocks=True, fft=False, similarity=False
[GP] Starting analysis...
[GP] Phase 1: Extracting building blocks...

*** [GPU 0] NEW GLOBAL BEST: 1298652.00 at gen 2800 ***
    Saved to best_solution.json

[GPU 0] Gen  2800 | Best: 1298652.00 | 282.6s
[GP] Phase 1 complete: Found 0 building blocks
[GP] Phase 2: FFT analysis DISABLED
[GP] Phase 3: Similarity analysis DISABLED
[GP] ========== GP ANALYSIS COMPLETE ==========


[GP] ========== CANDIDATE GENERATION STARTED ==========
[GP] Generating 20 new candidate solutions
[GP] Available data: 100 top solutions, 0 building blocks, 0 FFT patterns, 0 similarity patterns
[GP] Generation strategy: 6 block-based, 6 interpolated, 8 mutated
[GP] Strategy 1: Creating 6 candidates via building block combination...
[GP] Strategy 1 complete: 6 block-based candidates created
[GP] Strategy 2: Creating 6 candidates via solution interpolation...
[GP] Strategy 2 complete: 6 interpolated candidates created
[GP] Strategy 3: Creating 8 candidates via guided mutation...
[GP] Strategy 3 complete: 8 mutated candidates created
[GP] Total candidates generated: 20
[GP] Strategy breakdown: Block=84, Interp=84, Mut=112
[GP] ========== CANDIDATE GENERATION COMPLETE ==========


*** [GPU 0] NEW GLOBAL BEST: 1297200.00 at gen 2900 ***
    Saved to best_solution.json

[GPU 0] Gen  2900 | Best: 1297200.00 | 292.5s
  -> 20 candidates sent to 1/1 workers
[GP] gpu_0 intermediate update: 1297200.00 at gen 2900
[GPU 0] Gene injection: 20 candidates injected at gen 3000 (total so far: 280)

==================================================
GP ANALYSIS - Cycle 15
  Collected 100 solutions
==================================================

[GP] ========== GENETIC PROGRAMMING ANALYSIS STARTED ==========
[GP] Cycle: 14
[GP] Input: 100 solutions received for analysis
[GP] Fitness range: best=1297200.00, worst=1297200.00
[GP] Analysis config: blocks=True, fft=False, similarity=False
[GP] Starting analysis...
[GP] Phase 1: Extracting building blocks...
[GPU 0] Gen  3000 | Best: 1297200.00 | 302.5s
    [Checkpoint] Saved to ./results/warm_start/blocks_only/gr431/1R10/job_times_3_seed0_3000.json
[GP] Phase 1 complete: Found 0 building blocks
[GP] Phase 2: FFT analysis DISABLED
[GP] Phase 3: Similarity analysis DISABLED
[GP] ========== GP ANALYSIS COMPLETE ==========


[GP] ========== CANDIDATE GENERATION STARTED ==========
[GP] Generating 20 new candidate solutions
[GP] Available data: 100 top solutions, 0 building blocks, 0 FFT patterns, 0 similarity patterns
[GP] Generation strategy: 6 block-based, 6 interpolated, 8 mutated
[GP] Strategy 1: Creating 6 candidates via building block combination...
[GP] Strategy 1 complete: 6 block-based candidates created
[GP] Strategy 2: Creating 6 candidates via solution interpolation...
[GP] Strategy 2 complete: 6 interpolated candidates created
[GP] Strategy 3: Creating 8 candidates via guided mutation...
[GP] Strategy 3 complete: 8 mutated candidates created
[GP] Total candidates generated: 20
[GP] Strategy breakdown: Block=90, Interp=90, Mut=120
[GP] ========== CANDIDATE GENERATION COMPLETE ==========

  -> 20 candidates sent to 1/1 workers

[CHECKPOINT] Saved C.json at gen 3000 (makespan: 1297200.00)
[GPU 0] Gen  3100 | Best: 1297200.00 | 312.5s
[GPU 0] Gene injection: 20 candidates injected at gen 3200 (total so far: 300)

==================================================
GP ANALYSIS - Cycle 16
  Collected 100 solutions
==================================================

[GP] ========== GENETIC PROGRAMMING ANALYSIS STARTED ==========
[GP] Cycle: 15
[GP] Input: 100 solutions received for analysis
[GP] Fitness range: best=1297200.00, worst=1297200.00
[GP] Analysis config: blocks=True, fft=False, similarity=False
[GP] Starting analysis...
[GP] Phase 1: Extracting building blocks...
[GPU 0] Gen  3200 | Best: 1297200.00 | 322.8s
[GP] Phase 1 complete: Found 22 building blocks
[GP] Phase 2: FFT analysis DISABLED
[GP] Phase 3: Similarity analysis DISABLED
[GP] ========== GP ANALYSIS COMPLETE ==========


[GP] ========== CANDIDATE GENERATION STARTED ==========
[GP] Generating 20 new candidate solutions
[GP] Available data: 100 top solutions, 22 building blocks, 0 FFT patterns, 0 similarity patterns
[GP] Generation strategy: 6 block-based, 6 interpolated, 8 mutated
[GP] Strategy 1: Creating 6 candidates via building block combination...
[GP] Strategy 1 complete: 6 block-based candidates created
[GP] Strategy 2: Creating 6 candidates via solution interpolation...
[GP] Strategy 2 complete: 6 interpolated candidates created
[GP] Strategy 3: Creating 8 candidates via guided mutation...
[GP] Strategy 3 complete: 8 mutated candidates created
[GP] Total candidates generated: 20
[GP] Strategy breakdown: Block=96, Interp=96, Mut=128
[GP] ========== CANDIDATE GENERATION COMPLETE ==========

[GPU 0] Gen  3300 | Best: 1297200.00 | 333.0s
[GPU 0] Gene injection: 20 candidates injected at gen 3400 (total so far: 320)
  -> 20 candidates sent to 1/1 workers

==================================================
GP ANALYSIS - Cycle 17
  Collected 100 solutions
==================================================

[GP] ========== GENETIC PROGRAMMING ANALYSIS STARTED ==========
[GP] Cycle: 16
[GP] Input: 100 solutions received for analysis
[GP] Fitness range: best=1297200.00, worst=1297200.00
[GP] Analysis config: blocks=True, fft=False, similarity=False
[GP] Starting analysis...
[GP] Phase 1: Extracting building blocks...
[GPU 0] Gen  3400 | Best: 1297200.00 | 343.2s
[GP] Phase 1 complete: Found 2 building blocks
[GP] Phase 2: FFT analysis DISABLED
[GP] Phase 3: Similarity analysis DISABLED
[GP] ========== GP ANALYSIS COMPLETE ==========


[GP] ========== CANDIDATE GENERATION STARTED ==========
[GP] Generating 20 new candidate solutions
[GP] Available data: 100 top solutions, 2 building blocks, 0 FFT patterns, 0 similarity patterns
[GP] Generation strategy: 6 block-based, 6 interpolated, 8 mutated
[GP] Strategy 1: Creating 6 candidates via building block combination...
[GP] Strategy 1 complete: 6 block-based candidates created
[GP] Strategy 2: Creating 6 candidates via solution interpolation...
[GP] Strategy 2 complete: 6 interpolated candidates created
[GP] Strategy 3: Creating 8 candidates via guided mutation...
[GP] Strategy 3 complete: 8 mutated candidates created
[GP] Total candidates generated: 20
[GP] Strategy breakdown: Block=102, Interp=102, Mut=136
[GP] ========== CANDIDATE GENERATION COMPLETE ==========

[GPU 0] Gen  3500 | Best: 1297200.00 | 353.7s
[GPU 0] Gene injection: 20 candidates injected at gen 3600 (total so far: 340)
  -> 20 candidates sent to 1/1 workers

==================================================
GP ANALYSIS - Cycle 18
  Collected 100 solutions
==================================================

[GP] ========== GENETIC PROGRAMMING ANALYSIS STARTED ==========
[GP] Cycle: 17
[GP] Input: 100 solutions received for analysis
[GP] Fitness range: best=1297200.00, worst=1297200.00
[GP] Analysis config: blocks=True, fft=False, similarity=False
[GP] Starting analysis...
[GP] Phase 1: Extracting building blocks...
[GPU 0] Gen  3600 | Best: 1297200.00 | 364.0s
[GP] Phase 1 complete: Found 10 building blocks
[GP] Phase 2: FFT analysis DISABLED
[GP] Phase 3: Similarity analysis DISABLED
[GP] ========== GP ANALYSIS COMPLETE ==========


[GP] ========== CANDIDATE GENERATION STARTED ==========
[GP] Generating 20 new candidate solutions
[GP] Available data: 100 top solutions, 10 building blocks, 0 FFT patterns, 0 similarity patterns
[GP] Generation strategy: 6 block-based, 6 interpolated, 8 mutated
[GP] Strategy 1: Creating 6 candidates via building block combination...
[GP] Strategy 1 complete: 6 block-based candidates created
[GP] Strategy 2: Creating 6 candidates via solution interpolation...
[GP] Strategy 2 complete: 6 interpolated candidates created
[GP] Strategy 3: Creating 8 candidates via guided mutation...
[GP] Strategy 3 complete: 8 mutated candidates created
[GP] Total candidates generated: 20
[GP] Strategy breakdown: Block=108, Interp=108, Mut=144
[GP] ========== CANDIDATE GENERATION COMPLETE ==========

[GPU 0] Gen  3700 | Best: 1297200.00 | 374.2s
[GPU 0] Gene injection: 20 candidates injected at gen 3800 (total so far: 360)
  -> 20 candidates sent to 1/1 workers

==================================================
GP ANALYSIS - Cycle 19
  Collected 100 solutions
==================================================

[GP] ========== GENETIC PROGRAMMING ANALYSIS STARTED ==========
[GP] Cycle: 18
[GP] Input: 100 solutions received for analysis
[GP] Fitness range: best=1297200.00, worst=1297200.00
[GP] Analysis config: blocks=True, fft=False, similarity=False
[GP] Starting analysis...
[GP] Phase 1: Extracting building blocks...
[GPU 0] Gen  3800 | Best: 1297200.00 | 384.3s
[GP] Phase 1 complete: Found 1 building blocks
[GP] Phase 2: FFT analysis DISABLED
[GP] Phase 3: Similarity analysis DISABLED
[GP] ========== GP ANALYSIS COMPLETE ==========


[GP] ========== CANDIDATE GENERATION STARTED ==========
[GP] Generating 20 new candidate solutions
[GP] Available data: 100 top solutions, 1 building blocks, 0 FFT patterns, 0 similarity patterns
[GP] Generation strategy: 6 block-based, 6 interpolated, 8 mutated
[GP] Strategy 1: Creating 6 candidates via building block combination...
[GP] Strategy 1 complete: 6 block-based candidates created
[GP] Strategy 2: Creating 6 candidates via solution interpolation...
[GP] Strategy 2 complete: 6 interpolated candidates created
[GP] Strategy 3: Creating 8 candidates via guided mutation...
[GP] Strategy 3 complete: 8 mutated candidates created
[GP] Total candidates generated: 20
[GP] Strategy breakdown: Block=114, Interp=114, Mut=152
[GP] ========== CANDIDATE GENERATION COMPLETE ==========

[GPU 0] Gen  3900 | Best: 1297200.00 | 394.3s
  -> 20 candidates sent to 1/1 workers
[GP] gpu_0 intermediate update: 1296481.00 at gen 4000
[GPU 0] Gene injection: 20 candidates injected at gen 4000 (total so far: 380)

==================================================
GP ANALYSIS - Cycle 20
  Collected 100 solutions
==================================================

[GP] ========== GENETIC PROGRAMMING ANALYSIS STARTED ==========
[GP] Cycle: 19
[GP] Input: 100 solutions received for analysis
[GP] Fitness range: best=1296481.00, worst=1296481.00
[GP] Analysis config: blocks=True, fft=False, similarity=False
[GP] Starting analysis...
[GP] Phase 1: Extracting building blocks...

*** [GPU 0] NEW GLOBAL BEST: 1296481.00 at gen 4000 ***
    Saved to best_solution.json

[GPU 0] Gen  4000 | Best: 1296481.00 | 404.4s
    [Checkpoint] Saved to ./results/warm_start/blocks_only/gr431/1R10/job_times_3_seed0_4000.json
[GP] Phase 1 complete: Found 5 building blocks
[GP] Phase 2: FFT analysis DISABLED
[GP] Phase 3: Similarity analysis DISABLED
[GP] ========== GP ANALYSIS COMPLETE ==========


[GP] ========== CANDIDATE GENERATION STARTED ==========
[GP] Generating 20 new candidate solutions
[GP] Available data: 100 top solutions, 5 building blocks, 0 FFT patterns, 0 similarity patterns
[GP] Generation strategy: 6 block-based, 6 interpolated, 8 mutated
[GP] Strategy 1: Creating 6 candidates via building block combination...
[GP] Strategy 1 complete: 6 block-based candidates created
[GP] Strategy 2: Creating 6 candidates via solution interpolation...
[GP] Strategy 2 complete: 6 interpolated candidates created
[GP] Strategy 3: Creating 8 candidates via guided mutation...
[GP] Strategy 3 complete: 8 mutated candidates created
[GP] Total candidates generated: 20
[GP] Strategy breakdown: Block=120, Interp=120, Mut=160
[GP] ========== CANDIDATE GENERATION COMPLETE ==========

  -> 20 candidates sent to 1/1 workers

[CHECKPOINT] Saved D.json at gen 4000 (makespan: 1296481.00)

*** [GPU 0] NEW GLOBAL BEST: 1294044.00 at gen 4100 ***
    Saved to best_solution.json

[GPU 0] Gen  4100 | Best: 1294044.00 | 414.6s
[GP] gpu_0 intermediate update: 1294044.00 at gen 4100
[GP] gpu_0 intermediate update: 1290718.00 at gen 4200
[GPU 0] Gene injection: 20 candidates injected at gen 4200 (total so far: 400)

==================================================
GP ANALYSIS - Cycle 21
  Collected 100 solutions
==================================================

[GP] ========== GENETIC PROGRAMMING ANALYSIS STARTED ==========
[GP] Cycle: 20
[GP] Input: 100 solutions received for analysis
[GP] Fitness range: best=1290718.00, worst=1290718.00
[GP] Analysis config: blocks=True, fft=False, similarity=False
[GP] Starting analysis...
[GP] Phase 1: Extracting building blocks...

*** [GPU 0] NEW GLOBAL BEST: 1290718.00 at gen 4200 ***
    Saved to best_solution.json

[GPU 0] Gen  4200 | Best: 1290718.00 | 424.8s
[GP] Phase 1 complete: Found 11 building blocks
[GP] Phase 2: FFT analysis DISABLED
[GP] Phase 3: Similarity analysis DISABLED
[GP] ========== GP ANALYSIS COMPLETE ==========


[GP] ========== CANDIDATE GENERATION STARTED ==========
[GP] Generating 20 new candidate solutions
[GP] Available data: 100 top solutions, 11 building blocks, 0 FFT patterns, 0 similarity patterns
[GP] Generation strategy: 6 block-based, 6 interpolated, 8 mutated
[GP] Strategy 1: Creating 6 candidates via building block combination...
[GP] Strategy 1 complete: 6 block-based candidates created
[GP] Strategy 2: Creating 6 candidates via solution interpolation...
[GP] Strategy 2 complete: 6 interpolated candidates created
[GP] Strategy 3: Creating 8 candidates via guided mutation...
[GP] Strategy 3 complete: 8 mutated candidates created
[GP] Total candidates generated: 20
[GP] Strategy breakdown: Block=126, Interp=126, Mut=168
[GP] ========== CANDIDATE GENERATION COMPLETE ==========


*** [GPU 0] NEW GLOBAL BEST: 1290347.00 at gen 4300 ***
    Saved to best_solution.json

[GPU 0] Gen  4300 | Best: 1290347.00 | 434.8s
  -> 20 candidates sent to 1/1 workers
[GP] gpu_0 intermediate update: 1290347.00 at gen 4300
[GPU 0] Gene injection: 20 candidates injected at gen 4400 (total so far: 420)
[GPU 0] Gen  4400 | Best: 1290347.00 | 444.9s

==================================================
GP ANALYSIS - Cycle 22
  Collected 100 solutions
==================================================

[GP] ========== GENETIC PROGRAMMING ANALYSIS STARTED ==========
[GP] Cycle: 21
[GP] Input: 100 solutions received for analysis
[GP] Fitness range: best=1290347.00, worst=1290347.00
[GP] Analysis config: blocks=True, fft=False, similarity=False
[GP] Starting analysis...
[GP] Phase 1: Extracting building blocks...
[GP] Phase 1 complete: Found 9 building blocks
[GP] Phase 2: FFT analysis DISABLED
[GP] Phase 3: Similarity analysis DISABLED
[GP] ========== GP ANALYSIS COMPLETE ==========


[GP] ========== CANDIDATE GENERATION STARTED ==========
[GP] Generating 20 new candidate solutions
[GP] Available data: 100 top solutions, 9 building blocks, 0 FFT patterns, 0 similarity patterns
[GP] Generation strategy: 6 block-based, 6 interpolated, 8 mutated
[GP] Strategy 1: Creating 6 candidates via building block combination...
[GP] Strategy 1 complete: 6 block-based candidates created
[GP] Strategy 2: Creating 6 candidates via solution interpolation...
[GP] Strategy 2 complete: 6 interpolated candidates created
[GP] Strategy 3: Creating 8 candidates via guided mutation...
[GP] Strategy 3 complete: 8 mutated candidates created
[GP] Total candidates generated: 20
[GP] Strategy breakdown: Block=132, Interp=132, Mut=176
[GP] ========== CANDIDATE GENERATION COMPLETE ==========

[GPU 0] Gen  4500 | Best: 1290347.00 | 455.0s
  -> 20 candidates sent to 1/1 workers
[GP] gpu_0 intermediate update: 1290009.00 at gen 4600
[GPU 0] Gene injection: 20 candidates injected at gen 4600 (total so far: 440)

==================================================
GP ANALYSIS - Cycle 23
  Collected 100 solutions
==================================================

[GP] ========== GENETIC PROGRAMMING ANALYSIS STARTED ==========
[GP] Cycle: 22
[GP] Input: 100 solutions received for analysis
[GP] Fitness range: best=1290009.00, worst=1290009.00
[GP] Analysis config: blocks=True, fft=False, similarity=False
[GP] Starting analysis...
[GP] Phase 1: Extracting building blocks...

*** [GPU 0] NEW GLOBAL BEST: 1290009.00 at gen 4600 ***
    Saved to best_solution.json

[GPU 0] Gen  4600 | Best: 1290009.00 | 465.2s
[GP] Phase 1 complete: Found 10 building blocks
[GP] Phase 2: FFT analysis DISABLED
[GP] Phase 3: Similarity analysis DISABLED
[GP] ========== GP ANALYSIS COMPLETE ==========


[GP] ========== CANDIDATE GENERATION STARTED ==========
[GP] Generating 20 new candidate solutions
[GP] Available data: 100 top solutions, 10 building blocks, 0 FFT patterns, 0 similarity patterns
[GP] Generation strategy: 6 block-based, 6 interpolated, 8 mutated
[GP] Strategy 1: Creating 6 candidates via building block combination...
[GP] Strategy 1 complete: 6 block-based candidates created
[GP] Strategy 2: Creating 6 candidates via solution interpolation...
[GP] Strategy 2 complete: 6 interpolated candidates created
[GP] Strategy 3: Creating 8 candidates via guided mutation...
[GP] Strategy 3 complete: 8 mutated candidates created
[GP] Total candidates generated: 20
[GP] Strategy breakdown: Block=138, Interp=138, Mut=184
[GP] ========== CANDIDATE GENERATION COMPLETE ==========

[GPU 0] Gen  4700 | Best: 1290009.00 | 475.2s
[GPU 0] Gene injection: 20 candidates injected at gen 4800 (total so far: 460)
  -> 20 candidates sent to 1/1 workers
[GP] gpu_0 intermediate update: 1289289.00 at gen 4800

*** [GPU 0] NEW GLOBAL BEST: 1289289.00 at gen 4800 ***
    Saved to best_solution.json

[GPU 0] Gen  4800 | Best: 1289289.00 | 485.3s

==================================================
GP ANALYSIS - Cycle 24
  Collected 100 solutions
==================================================

[GP] ========== GENETIC PROGRAMMING ANALYSIS STARTED ==========
[GP] Cycle: 23
[GP] Input: 100 solutions received for analysis
[GP] Fitness range: best=1289289.00, worst=1289289.00
[GP] Analysis config: blocks=True, fft=False, similarity=False
[GP] Starting analysis...
[GP] Phase 1: Extracting building blocks...
[GP] Phase 1 complete: Found 9 building blocks
[GP] Phase 2: FFT analysis DISABLED
[GP] Phase 3: Similarity analysis DISABLED
[GP] ========== GP ANALYSIS COMPLETE ==========


[GP] ========== CANDIDATE GENERATION STARTED ==========
[GP] Generating 20 new candidate solutions
[GP] Available data: 100 top solutions, 9 building blocks, 0 FFT patterns, 0 similarity patterns
[GP] Generation strategy: 6 block-based, 6 interpolated, 8 mutated
[GP] Strategy 1: Creating 6 candidates via building block combination...
[GP] Strategy 1 complete: 6 block-based candidates created
[GP] Strategy 2: Creating 6 candidates via solution interpolation...
[GP] Strategy 2 complete: 6 interpolated candidates created
[GP] Strategy 3: Creating 8 candidates via guided mutation...
[GP] Strategy 3 complete: 8 mutated candidates created
[GP] Total candidates generated: 20
[GP] Strategy breakdown: Block=144, Interp=144, Mut=192
[GP] ========== CANDIDATE GENERATION COMPLETE ==========


*** [GPU 0] NEW GLOBAL BEST: 1286321.00 at gen 4900 ***
    Saved to best_solution.json

[GPU 0] Gen  4900 | Best: 1286321.00 | 495.4s
  -> 20 candidates sent to 1/1 workers
[GP] gpu_0 intermediate update: 1286321.00 at gen 4900
[GPU 0] Gene injection: 20 candidates injected at gen 5000 (total so far: 480)
[GPU 0] Evolution complete. Sending final results...
[GP] gpu_0 intermediate update: 1283600.00 at gen 5000
[GP] Worker finished: gpu_0 (best=1283600.00)

==================================================
GP ANALYSIS - Cycle 25
  Collected 100 solutions
==================================================

[GP] ========== GENETIC PROGRAMMING ANALYSIS STARTED ==========
[GP] Cycle: 24
[GP] Input: 100 solutions received for analysis
[GP] Fitness range: best=1283600.00, worst=1283600.00
[GP] Analysis config: blocks=True, fft=False, similarity=False
[GP] Starting analysis...
[GP] Phase 1: Extracting building blocks...
[GP] Phase 1 complete: Found 0 building blocks
[GP] Phase 2: FFT analysis DISABLED
[GP] Phase 3: Similarity analysis DISABLED
[GP] ========== GP ANALYSIS COMPLETE ==========


[GP] ========== CANDIDATE GENERATION STARTED ==========
[GP] Generating 20 new candidate solutions
[GP] Available data: 100 top solutions, 0 building blocks, 0 FFT patterns, 0 similarity patterns
[GP] Generation strategy: 6 block-based, 6 interpolated, 8 mutated
[GP] Strategy 1: Creating 6 candidates via building block combination...
[GP] Strategy 1 complete: 6 block-based candidates created
[GP] Strategy 2: Creating 6 candidates via solution interpolation...
[GP] Strategy 2 complete: 6 interpolated candidates created
[GP] Strategy 3: Creating 8 candidates via guided mutation...
[GP] Strategy 3 complete: 8 mutated candidates created
[GP] Total candidates generated: 20
[GP] Strategy breakdown: Block=150, Interp=150, Mut=200
[GP] ========== CANDIDATE GENERATION COMPLETE ==========

  -> 20 candidates sent to 1/1 workers

[CHECKPOINT] Saved E.json at gen 5000 (makespan: 1283600.00)

[GP] All workers finished. Total GP cycles: 25

[Final Collection] Have 1/1 workers. Waiting up to 120s for remaining...

[Critical] Attempting final result collection before terminating workers...

[Results Summary] Collected 1 results:
  gpu_0: fitness=1283600.00, intermediate=False, gen=final

======================================================================
COMPLETE
======================================================================
Best: 1283600.00 from gpu_0
  (Improved 65.5% over heuristic 3722367.00)
Time: 507.7s
Total candidates injected: 480

Solution JSON saved to ./results/warm_start/blocks_only/gr431/1R10/job_times_3_seed0.json
HTML Gantt chart saved to: ./results/warm_start/blocks_only/gr431/1R10/job_times_3_seed0.html
