Setting random seed to 0
DEBUG: proc shape: (1000,), agents: 6, resources: 4, n: 1000

======================================================================
VRP-RPD SOLVER
======================================================================
Problem: 999 customers, 6 agents, k=4
Heuristic: None
Genetic Programming: Yes
Warm Start: No
Gene Injection: Yes
Workers: 1 GPU + 0 CPU
Generations: 5000
======================================================================


[GP] Starting GP collection loop (timeout: 750s)...

*** [GPU 0] NEW GLOBAL BEST: 466624498.00 at gen 0 ***
    Saved to best_solution.json

[GPU 0] Gen     0 | Best: 466624498.00 | 0.5s
[GP] gpu_0 first intermediate: 466624498.00 at gen 0

*** [GPU 0] NEW GLOBAL BEST: 321082394.00 at gen 100 ***
    Saved to best_solution.json

[GPU 0] Gen   100 | Best: 321082394.00 | 12.8s
[GP] gpu_0 intermediate update: 321082394.00 at gen 100
[GP] gpu_0 intermediate update: 292420724.00 at gen 200

*** [GPU 0] NEW GLOBAL BEST: 292413388.00 at gen 200 ***
    Saved to best_solution.json

[GPU 0] Gen   200 | Best: 292413388.00 | 25.3s
[GP] gpu_0 intermediate update: 292413388.00 at gen 200

*** [GPU 0] NEW GLOBAL BEST: 282656235.00 at gen 300 ***
    Saved to best_solution.json

[GPU 0] Gen   300 | Best: 282656235.00 | 37.6s
[GP] gpu_0 intermediate update: 282656235.00 at gen 300
[GP] gpu_0 intermediate update: 275527042.00 at gen 400

==================================================
GP ANALYSIS - Cycle 1
  Collected 40 solutions
==================================================

[GP] ========== GENETIC PROGRAMMING ANALYSIS STARTED ==========
[GP] Cycle: 0
[GP] Input: 40 solutions received for analysis
[GP] Fitness range: best=275387392.00, worst=293051296.00
[GP] Analysis config: blocks=True, fft=False, similarity=False
[GP] Starting analysis...
[GP] Phase 1: Extracting building blocks...

*** [GPU 0] NEW GLOBAL BEST: 275387401.00 at gen 400 ***
    Saved to best_solution.json

[GPU 0] Gen   400 | Best: 275387401.00 | 50.1s
[GP] Phase 1 complete: Found 30 building blocks
[GP] Phase 2: FFT analysis DISABLED
[GP] Phase 3: Similarity analysis DISABLED
[GP] ========== GP ANALYSIS COMPLETE ==========


[GP] ========== CANDIDATE GENERATION STARTED ==========
[GP] Generating 20 new candidate solutions
[GP] Available data: 40 top solutions, 30 building blocks, 0 FFT patterns, 0 similarity patterns
[GP] Generation strategy: 6 block-based, 6 interpolated, 8 mutated
[GP] Strategy 1: Creating 6 candidates via building block combination...
[GP] Strategy 1 complete: 6 block-based candidates created
[GP] Strategy 2: Creating 6 candidates via solution interpolation...
[GP] Strategy 2 complete: 6 interpolated candidates created
[GP] Strategy 3: Creating 8 candidates via guided mutation...
[GP] Strategy 3 complete: 8 mutated candidates created
[GP] Total candidates generated: 20
[GP] Strategy breakdown: Block=6, Interp=6, Mut=8
[GP] ========== CANDIDATE GENERATION COMPLETE ==========


*** [GPU 0] NEW GLOBAL BEST: 269504183.00 at gen 500 ***
    Saved to best_solution.json

[GPU 0] Gen   500 | Best: 269504183.00 | 62.4s
[GPU 0] Gene injection: 20 candidates injected at gen 600 (total so far: 20)

*** [GPU 0] NEW GLOBAL BEST: 264049421.00 at gen 600 ***
    Saved to best_solution.json

[GPU 0] Gen   600 | Best: 264049421.00 | 74.7s
  -> 20 candidates sent to 1/1 workers
[GP] gpu_0 intermediate update: 275387401.00 at gen 400
[GP] gpu_0 intermediate update: 269504183.00 at gen 500
[GP] gpu_0 intermediate update: 264049421.00 at gen 600

*** [GPU 0] NEW GLOBAL BEST: 259560585.00 at gen 700 ***
    Saved to best_solution.json

[GPU 0] Gen   700 | Best: 259560585.00 | 86.4s
[GP] gpu_0 intermediate update: 259560585.00 at gen 700
[GP] gpu_0 intermediate update: 257105521.00 at gen 800

==================================================
GP ANALYSIS - Cycle 2
  Collected 40 solutions
==================================================

[GP] ========== GENETIC PROGRAMMING ANALYSIS STARTED ==========
[GP] Cycle: 1
[GP] Input: 40 solutions received for analysis
[GP] Fitness range: best=256975216.00, worst=264186432.00
[GP] Analysis config: blocks=True, fft=False, similarity=False
[GP] Starting analysis...
[GP] Phase 1: Extracting building blocks...

*** [GPU 0] NEW GLOBAL BEST: 256975215.00 at gen 800 ***
    Saved to best_solution.json

[GPU 0] Gen   800 | Best: 256975215.00 | 98.7s
[GP] Phase 1 complete: Found 30 building blocks
[GP] Phase 2: FFT analysis DISABLED
[GP] Phase 3: Similarity analysis DISABLED
[GP] ========== GP ANALYSIS COMPLETE ==========


[GP] ========== CANDIDATE GENERATION STARTED ==========
[GP] Generating 20 new candidate solutions
[GP] Available data: 40 top solutions, 30 building blocks, 0 FFT patterns, 0 similarity patterns
[GP] Generation strategy: 6 block-based, 6 interpolated, 8 mutated
[GP] Strategy 1: Creating 6 candidates via building block combination...
[GP] Strategy 1 complete: 6 block-based candidates created
[GP] Strategy 2: Creating 6 candidates via solution interpolation...
[GP] Strategy 2 complete: 6 interpolated candidates created
[GP] Strategy 3: Creating 8 candidates via guided mutation...
[GP] Strategy 3 complete: 8 mutated candidates created
[GP] Total candidates generated: 20
[GP] Strategy breakdown: Block=12, Interp=12, Mut=16
[GP] ========== CANDIDATE GENERATION COMPLETE ==========


*** [GPU 0] NEW GLOBAL BEST: 255138906.00 at gen 900 ***
    Saved to best_solution.json

[GPU 0] Gen   900 | Best: 255138906.00 | 111.1s
[GPU 0] Gene injection: 20 candidates injected at gen 1000 (total so far: 40)

*** [GPU 0] NEW GLOBAL BEST: 252604492.00 at gen 1000 ***
  -> 20 candidates sent to 1/1 workers
[GP] gpu_0 intermediate update: 256975215.00 at gen 800
[GP] gpu_0 intermediate update: 255138906.00 at gen 900
[GP] gpu_0 intermediate update: 252820187.00 at gen 1000
    Saved to best_solution.json

[GPU 0] Gen  1000 | Best: 252604492.00 | 123.3s
    [Checkpoint] Saved to ./results/cold_start/blocks_only/dsj1000/1R10/job_times_8_seed0_1000.json
[GP] gpu_0 intermediate update: 252604492.00 at gen 1000

*** [GPU 0] NEW GLOBAL BEST: 250815787.00 at gen 1100 ***
    Saved to best_solution.json

[GPU 0] Gen  1100 | Best: 250815787.00 | 135.5s
[GP] gpu_0 intermediate update: 250815787.00 at gen 1100
[GP] gpu_0 intermediate update: 247209683.00 at gen 1200

==================================================
GP ANALYSIS - Cycle 3
  Collected 40 solutions
==================================================

[GP] ========== GENETIC PROGRAMMING ANALYSIS STARTED ==========
[GP] Cycle: 2
[GP] Input: 40 solutions received for analysis
[GP] Fitness range: best=247209680.00, worst=252820192.00
[GP] Analysis config: blocks=True, fft=False, similarity=False
[GP] Starting analysis...
[GP] Phase 1: Extracting building blocks...

*** [GPU 0] NEW GLOBAL BEST: 247209683.00 at gen 1200 ***
    Saved to best_solution.json

[GPU 0] Gen  1200 | Best: 247209683.00 | 147.9s
[GP] Phase 1 complete: Found 30 building blocks
[GP] Phase 2: FFT analysis DISABLED
[GP] Phase 3: Similarity analysis DISABLED
[GP] ========== GP ANALYSIS COMPLETE ==========


[GP] ========== CANDIDATE GENERATION STARTED ==========
[GP] Generating 20 new candidate solutions
[GP] Available data: 40 top solutions, 30 building blocks, 0 FFT patterns, 0 similarity patterns
[GP] Generation strategy: 6 block-based, 6 interpolated, 8 mutated
[GP] Strategy 1: Creating 6 candidates via building block combination...
[GP] Strategy 1 complete: 6 block-based candidates created
[GP] Strategy 2: Creating 6 candidates via solution interpolation...
[GP] Strategy 2 complete: 6 interpolated candidates created
[GP] Strategy 3: Creating 8 candidates via guided mutation...
[GP] Strategy 3 complete: 8 mutated candidates created
[GP] Total candidates generated: 20
[GP] Strategy breakdown: Block=18, Interp=18, Mut=24
[GP] ========== CANDIDATE GENERATION COMPLETE ==========


*** [GPU 0] NEW GLOBAL BEST: 245348933.00 at gen 1300 ***
    Saved to best_solution.json

[GPU 0] Gen  1300 | Best: 245348933.00 | 159.8s
[GPU 0] Gene injection: 20 candidates injected at gen 1400 (total so far: 60)

*** [GPU 0] NEW GLOBAL BEST: 243765772.00 at gen 1400 ***
    Saved to best_solution.json

[GPU 0] Gen  1400 | Best: 243765772.00 | 171.8s
  -> 20 candidates sent to 1/1 workers
[GP] gpu_0 intermediate update: 245348933.00 at gen 1300
[GP] gpu_0 intermediate update: 243765772.00 at gen 1400

*** [GPU 0] NEW GLOBAL BEST: 242405198.00 at gen 1500 ***
    Saved to best_solution.json

[GPU 0] Gen  1500 | Best: 242405198.00 | 183.8s
[GP] gpu_0 intermediate update: 242405198.00 at gen 1500
[GP] gpu_0 intermediate update: 241499207.00 at gen 1600

==================================================
GP ANALYSIS - Cycle 4
  Collected 40 solutions
==================================================

[GP] ========== GENETIC PROGRAMMING ANALYSIS STARTED ==========
[GP] Cycle: 3
[GP] Input: 40 solutions received for analysis
[GP] Fitness range: best=241499200.00, worst=243770432.00
[GP] Analysis config: blocks=True, fft=False, similarity=False
[GP] Starting analysis...
[GP] Phase 1: Extracting building blocks...

*** [GPU 0] NEW GLOBAL BEST: 241499207.00 at gen 1600 ***
    Saved to best_solution.json

[GPU 0] Gen  1600 | Best: 241499207.00 | 196.1s
[GP] Phase 1 complete: Found 30 building blocks
[GP] Phase 2: FFT analysis DISABLED
[GP] Phase 3: Similarity analysis DISABLED
[GP] ========== GP ANALYSIS COMPLETE ==========


[GP] ========== CANDIDATE GENERATION STARTED ==========
[GP] Generating 20 new candidate solutions
[GP] Available data: 40 top solutions, 30 building blocks, 0 FFT patterns, 0 similarity patterns
[GP] Generation strategy: 6 block-based, 6 interpolated, 8 mutated
[GP] Strategy 1: Creating 6 candidates via building block combination...
[GP] Strategy 1 complete: 6 block-based candidates created
[GP] Strategy 2: Creating 6 candidates via solution interpolation...
[GP] Strategy 2 complete: 6 interpolated candidates created
[GP] Strategy 3: Creating 8 candidates via guided mutation...
[GP] Strategy 3 complete: 8 mutated candidates created
[GP] Total candidates generated: 20
[GP] Strategy breakdown: Block=24, Interp=24, Mut=32
[GP] ========== CANDIDATE GENERATION COMPLETE ==========


*** [GPU 0] NEW GLOBAL BEST: 239843073.00 at gen 1700 ***
    Saved to best_solution.json

[GPU 0] Gen  1700 | Best: 239843073.00 | 208.3s
[GPU 0] Gene injection: 20 candidates injected at gen 1800 (total so far: 80)

*** [GPU 0] NEW GLOBAL BEST: 238700905.00 at gen 1800 ***
    Saved to best_solution.json

[GPU 0] Gen  1800 | Best: 238700905.00 | 220.3s
  -> 20 candidates sent to 1/1 workers
[GP] gpu_0 intermediate update: 239843073.00 at gen 1700
[GP] gpu_0 intermediate update: 238700905.00 at gen 1800

*** [GPU 0] NEW GLOBAL BEST: 237416009.00 at gen 1900 ***
    Saved to best_solution.json

[GPU 0] Gen  1900 | Best: 237416009.00 | 232.3s
[GP] gpu_0 intermediate update: 237416009.00 at gen 1900
[GP] gpu_0 intermediate update: 236067433.00 at gen 2000

==================================================
GP ANALYSIS - Cycle 5
  Collected 40 solutions
==================================================

[GP] ========== GENETIC PROGRAMMING ANALYSIS STARTED ==========
[GP] Cycle: 4
[GP] Input: 40 solutions received for analysis
[GP] Fitness range: best=236067440.00, worst=238700912.00
[GP] Analysis config: blocks=True, fft=False, similarity=False
[GP] Starting analysis...
[GP] Phase 1: Extracting building blocks...

*** [GPU 0] NEW GLOBAL BEST: 236067433.00 at gen 2000 ***
    Saved to best_solution.json

[GPU 0] Gen  2000 | Best: 236067433.00 | 244.5s
    [Checkpoint] Saved to ./results/cold_start/blocks_only/dsj1000/1R10/job_times_8_seed0_2000.json
[GP] Phase 1 complete: Found 30 building blocks
[GP] Phase 2: FFT analysis DISABLED
[GP] Phase 3: Similarity analysis DISABLED
[GP] ========== GP ANALYSIS COMPLETE ==========


[GP] ========== CANDIDATE GENERATION STARTED ==========
[GP] Generating 20 new candidate solutions
[GP] Available data: 40 top solutions, 30 building blocks, 0 FFT patterns, 0 similarity patterns
[GP] Generation strategy: 6 block-based, 6 interpolated, 8 mutated
[GP] Strategy 1: Creating 6 candidates via building block combination...
[GP] Strategy 1 complete: 6 block-based candidates created
[GP] Strategy 2: Creating 6 candidates via solution interpolation...
[GP] Strategy 2 complete: 6 interpolated candidates created
[GP] Strategy 3: Creating 8 candidates via guided mutation...
[GP] Strategy 3 complete: 8 mutated candidates created
[GP] Total candidates generated: 20
[GP] Strategy breakdown: Block=30, Interp=30, Mut=40
[GP] ========== CANDIDATE GENERATION COMPLETE ==========


*** [GPU 0] NEW GLOBAL BEST: 235186859.00 at gen 2100 ***
    Saved to best_solution.json

[GPU 0] Gen  2100 | Best: 235186859.00 | 256.4s
[GPU 0] Gene injection: 20 candidates injected at gen 2200 (total so far: 100)

*** [GPU 0] NEW GLOBAL BEST: 234155042.00 at gen 2200 ***
    Saved to best_solution.json

[GPU 0] Gen  2200 | Best: 234155042.00 | 268.6s
  -> 20 candidates sent to 1/1 workers

[CHECKPOINT] Saved A.json at gen 1000 (makespan: 236067433.00)
[GP] gpu_0 intermediate update: 235186859.00 at gen 2100
[GP] gpu_0 intermediate update: 234228508.00 at gen 2200
[GP] gpu_0 intermediate update: 234155042.00 at gen 2200

*** [GPU 0] NEW GLOBAL BEST: 233574422.00 at gen 2300 ***
    Saved to best_solution.json

[GPU 0] Gen  2300 | Best: 233574422.00 | 280.7s
[GP] gpu_0 intermediate update: 233574422.00 at gen 2300
[GP] gpu_0 intermediate update: 232316087.00 at gen 2400

==================================================
GP ANALYSIS - Cycle 6
  Collected 40 solutions
==================================================

[GP] ========== GENETIC PROGRAMMING ANALYSIS STARTED ==========
[GP] Cycle: 5
[GP] Input: 40 solutions received for analysis
[GP] Fitness range: best=232316080.00, worst=234228848.00
[GP] Analysis config: blocks=True, fft=False, similarity=False
[GP] Starting analysis...
[GP] Phase 1: Extracting building blocks...

*** [GPU 0] NEW GLOBAL BEST: 232316087.00 at gen 2400 ***
    Saved to best_solution.json

[GPU 0] Gen  2400 | Best: 232316087.00 | 292.9s
[GP] Phase 1 complete: Found 30 building blocks
[GP] Phase 2: FFT analysis DISABLED
[GP] Phase 3: Similarity analysis DISABLED
[GP] ========== GP ANALYSIS COMPLETE ==========


[GP] ========== CANDIDATE GENERATION STARTED ==========
[GP] Generating 20 new candidate solutions
[GP] Available data: 40 top solutions, 30 building blocks, 0 FFT patterns, 0 similarity patterns
[GP] Generation strategy: 6 block-based, 6 interpolated, 8 mutated
[GP] Strategy 1: Creating 6 candidates via building block combination...
[GP] Strategy 1 complete: 6 block-based candidates created
[GP] Strategy 2: Creating 6 candidates via solution interpolation...
[GP] Strategy 2 complete: 6 interpolated candidates created
[GP] Strategy 3: Creating 8 candidates via guided mutation...
[GP] Strategy 3 complete: 8 mutated candidates created
[GP] Total candidates generated: 20
[GP] Strategy breakdown: Block=36, Interp=36, Mut=48
[GP] ========== CANDIDATE GENERATION COMPLETE ==========


*** [GPU 0] NEW GLOBAL BEST: 231764969.00 at gen 2500 ***
    Saved to best_solution.json

[GPU 0] Gen  2500 | Best: 231764969.00 | 304.9s
[GPU 0] Gene injection: 20 candidates injected at gen 2600 (total so far: 120)
  -> 20 candidates sent to 1/1 workers
[GP] gpu_0 intermediate update: 231764969.00 at gen 2500
[GP] gpu_0 intermediate update: 231020588.00 at gen 2600

*** [GPU 0] NEW GLOBAL BEST: 231020588.00 at gen 2600 ***
    Saved to best_solution.json

[GPU 0] Gen  2600 | Best: 231020588.00 | 317.1s

*** [GPU 0] NEW GLOBAL BEST: 230517023.00 at gen 2700 ***
    Saved to best_solution.json

[GPU 0] Gen  2700 | Best: 230517023.00 | 329.0s
[GP] gpu_0 intermediate update: 230517023.00 at gen 2700
[GP] gpu_0 intermediate update: 230180083.00 at gen 2800

==================================================
GP ANALYSIS - Cycle 7
  Collected 40 solutions
==================================================

[GP] ========== GENETIC PROGRAMMING ANALYSIS STARTED ==========
[GP] Cycle: 6
[GP] Input: 40 solutions received for analysis
[GP] Fitness range: best=230180080.00, worst=231020592.00
[GP] Analysis config: blocks=True, fft=False, similarity=False
[GP] Starting analysis...
[GP] Phase 1: Extracting building blocks...

*** [GPU 0] NEW GLOBAL BEST: 230180083.00 at gen 2800 ***
    Saved to best_solution.json

[GPU 0] Gen  2800 | Best: 230180083.00 | 341.2s
[GP] Phase 1 complete: Found 30 building blocks
[GP] Phase 2: FFT analysis DISABLED
[GP] Phase 3: Similarity analysis DISABLED
[GP] ========== GP ANALYSIS COMPLETE ==========


[GP] ========== CANDIDATE GENERATION STARTED ==========
[GP] Generating 20 new candidate solutions
[GP] Available data: 40 top solutions, 30 building blocks, 0 FFT patterns, 0 similarity patterns
[GP] Generation strategy: 6 block-based, 6 interpolated, 8 mutated
[GP] Strategy 1: Creating 6 candidates via building block combination...
[GP] Strategy 1 complete: 6 block-based candidates created
[GP] Strategy 2: Creating 6 candidates via solution interpolation...
[GP] Strategy 2 complete: 6 interpolated candidates created
[GP] Strategy 3: Creating 8 candidates via guided mutation...
[GP] Strategy 3 complete: 8 mutated candidates created
[GP] Total candidates generated: 20
[GP] Strategy breakdown: Block=42, Interp=42, Mut=56
[GP] ========== CANDIDATE GENERATION COMPLETE ==========


*** [GPU 0] NEW GLOBAL BEST: 229405337.00 at gen 2900 ***
    Saved to best_solution.json

[GPU 0] Gen  2900 | Best: 229405337.00 | 353.2s
[GPU 0] Gene injection: 20 candidates injected at gen 3000 (total so far: 140)

*** [GPU 0] NEW GLOBAL BEST: 228776497.00 at gen 3000 ***
    Saved to best_solution.json

[GPU 0] Gen  3000 | Best: 228776497.00 | 365.3s
  -> 20 candidates sent to 1/1 workers
[GP] gpu_0 intermediate update: 229405337.00 at gen 2900
[GP] gpu_0 intermediate update: 228776497.00 at gen 3000
    [Checkpoint] Saved to ./results/cold_start/blocks_only/dsj1000/1R10/job_times_8_seed0_3000.json

*** [GPU 0] NEW GLOBAL BEST: 228441103.00 at gen 3100 ***
    Saved to best_solution.json

[GPU 0] Gen  3100 | Best: 228441103.00 | 377.5s
[GP] gpu_0 intermediate update: 228441103.00 at gen 3100
[GP] gpu_0 intermediate update: 228184816.00 at gen 3200

==================================================
GP ANALYSIS - Cycle 8
  Collected 40 solutions
==================================================

[GP] ========== GENETIC PROGRAMMING ANALYSIS STARTED ==========
[GP] Cycle: 7
[GP] Input: 40 solutions received for analysis
[GP] Fitness range: best=228184816.00, worst=228797424.00
[GP] Analysis config: blocks=True, fft=False, similarity=False
[GP] Starting analysis...
[GP] Phase 1: Extracting building blocks...

*** [GPU 0] NEW GLOBAL BEST: 228184816.00 at gen 3200 ***
    Saved to best_solution.json

[GPU 0] Gen  3200 | Best: 228184816.00 | 389.6s
[GP] Phase 1 complete: Found 30 building blocks
[GP] Phase 2: FFT analysis DISABLED
[GP] Phase 3: Similarity analysis DISABLED
[GP] ========== GP ANALYSIS COMPLETE ==========


[GP] ========== CANDIDATE GENERATION STARTED ==========
[GP] Generating 20 new candidate solutions
[GP] Available data: 40 top solutions, 30 building blocks, 0 FFT patterns, 0 similarity patterns
[GP] Generation strategy: 6 block-based, 6 interpolated, 8 mutated
[GP] Strategy 1: Creating 6 candidates via building block combination...
[GP] Strategy 1 complete: 6 block-based candidates created
[GP] Strategy 2: Creating 6 candidates via solution interpolation...
[GP] Strategy 2 complete: 6 interpolated candidates created
[GP] Strategy 3: Creating 8 candidates via guided mutation...
[GP] Strategy 3 complete: 8 mutated candidates created
[GP] Total candidates generated: 20
[GP] Strategy breakdown: Block=48, Interp=48, Mut=64
[GP] ========== CANDIDATE GENERATION COMPLETE ==========


*** [GPU 0] NEW GLOBAL BEST: 227356812.00 at gen 3300 ***
    Saved to best_solution.json

[GPU 0] Gen  3300 | Best: 227356812.00 | 401.6s
[GPU 0] Gene injection: 20 candidates injected at gen 3400 (total so far: 160)

*** [GPU 0] NEW GLOBAL BEST: 226869298.00 at gen 3400 ***
    Saved to best_solution.json

[GPU 0] Gen  3400 | Best: 226869298.00 | 413.7s
  -> 20 candidates sent to 1/1 workers
[GP] gpu_0 intermediate update: 227356812.00 at gen 3300
[GP] gpu_0 intermediate update: 226869298.00 at gen 3400

*** [GPU 0] NEW GLOBAL BEST: 226261123.00 at gen 3500 ***
    Saved to best_solution.json

[GPU 0] Gen  3500 | Best: 226261123.00 | 425.7s
[GP] gpu_0 intermediate update: 226261123.00 at gen 3500
[GP] gpu_0 intermediate update: 225502583.00 at gen 3600

==================================================
GP ANALYSIS - Cycle 9
  Collected 40 solutions
==================================================

[GP] ========== GENETIC PROGRAMMING ANALYSIS STARTED ==========
[GP] Cycle: 8
[GP] Input: 40 solutions received for analysis
[GP] Fitness range: best=225502576.00, worst=226869296.00
[GP] Analysis config: blocks=True, fft=False, similarity=False
[GP] Starting analysis...
[GP] Phase 1: Extracting building blocks...

*** [GPU 0] NEW GLOBAL BEST: 225502583.00 at gen 3600 ***
    Saved to best_solution.json

[GPU 0] Gen  3600 | Best: 225502583.00 | 437.9s
[GP] Phase 1 complete: Found 30 building blocks
[GP] Phase 2: FFT analysis DISABLED
[GP] Phase 3: Similarity analysis DISABLED
[GP] ========== GP ANALYSIS COMPLETE ==========


[GP] ========== CANDIDATE GENERATION STARTED ==========
[GP] Generating 20 new candidate solutions
[GP] Available data: 40 top solutions, 30 building blocks, 0 FFT patterns, 0 similarity patterns
[GP] Generation strategy: 6 block-based, 6 interpolated, 8 mutated
[GP] Strategy 1: Creating 6 candidates via building block combination...
[GP] Strategy 1 complete: 6 block-based candidates created
[GP] Strategy 2: Creating 6 candidates via solution interpolation...
[GP] Strategy 2 complete: 6 interpolated candidates created
[GP] Strategy 3: Creating 8 candidates via guided mutation...
[GP] Strategy 3 complete: 8 mutated candidates created
[GP] Total candidates generated: 20
[GP] Strategy breakdown: Block=54, Interp=54, Mut=72
[GP] ========== CANDIDATE GENERATION COMPLETE ==========


*** [GPU 0] NEW GLOBAL BEST: 224838431.00 at gen 3700 ***
    Saved to best_solution.json

[GPU 0] Gen  3700 | Best: 224838431.00 | 450.0s
[GPU 0] Gene injection: 20 candidates injected at gen 3800 (total so far: 180)
  -> 20 candidates sent to 1/1 workers
[GP] gpu_0 intermediate update: 224838431.00 at gen 3700
[GP] gpu_0 intermediate update: 223842956.00 at gen 3800

*** [GPU 0] NEW GLOBAL BEST: 223842956.00 at gen 3800 ***
    Saved to best_solution.json

[GPU 0] Gen  3800 | Best: 223842956.00 | 462.1s

*** [GPU 0] NEW GLOBAL BEST: 223597040.00 at gen 3900 ***
    Saved to best_solution.json

[GPU 0] Gen  3900 | Best: 223597040.00 | 474.1s
[GP] gpu_0 intermediate update: 223597040.00 at gen 3900
[GP] gpu_0 intermediate update: 223272111.00 at gen 4000

==================================================
GP ANALYSIS - Cycle 10
  Collected 40 solutions
==================================================

[GP] ========== GENETIC PROGRAMMING ANALYSIS STARTED ==========
[GP] Cycle: 9
[GP] Input: 40 solutions received for analysis
[GP] Fitness range: best=223272112.00, worst=223842960.00
[GP] Analysis config: blocks=True, fft=False, similarity=False
[GP] Starting analysis...
[GP] Phase 1: Extracting building blocks...

*** [GPU 0] NEW GLOBAL BEST: 223272111.00 at gen 4000 ***
    Saved to best_solution.json

[GPU 0] Gen  4000 | Best: 223272111.00 | 486.4s
[GP] Phase 1 complete: Found 30 building blocks
[GP] Phase 2: FFT analysis DISABLED
[GP] Phase 3: Similarity analysis DISABLED
[GP] ========== GP ANALYSIS COMPLETE ==========


[GP] ========== CANDIDATE GENERATION STARTED ==========
[GP] Generating 20 new candidate solutions
[GP] Available data: 40 top solutions, 30 building blocks, 0 FFT patterns, 0 similarity patterns
[GP] Generation strategy: 6 block-based, 6 interpolated, 8 mutated
[GP] Strategy 1: Creating 6 candidates via building block combination...
[GP] Strategy 1 complete: 6 block-based candidates created
[GP] Strategy 2: Creating 6 candidates via solution interpolation...
[GP] Strategy 2 complete: 6 interpolated candidates created
[GP] Strategy 3: Creating 8 candidates via guided mutation...
[GP] Strategy 3 complete: 8 mutated candidates created
[GP] Total candidates generated: 20
[GP] Strategy breakdown: Block=60, Interp=60, Mut=80
[GP] ========== CANDIDATE GENERATION COMPLETE ==========

    [Checkpoint] Saved to ./results/cold_start/blocks_only/dsj1000/1R10/job_times_8_seed0_4000.json

*** [GPU 0] NEW GLOBAL BEST: 222805854.00 at gen 4100 ***
    Saved to best_solution.json

[GPU 0] Gen  4100 | Best: 222805854.00 | 498.6s
[GPU 0] Gene injection: 20 candidates injected at gen 4200 (total so far: 200)

*** [GPU 0] NEW GLOBAL BEST: 222237742.00 at gen 4200 ***
    Saved to best_solution.json

[GPU 0] Gen  4200 | Best: 222237742.00 | 510.8s
  -> 20 candidates sent to 1/1 workers

[CHECKPOINT] Saved B.json at gen 2000 (makespan: 223272111.00)
[GP] gpu_0 intermediate update: 222805854.00 at gen 4100
[GP] gpu_0 intermediate update: 222237742.00 at gen 4200

*** [GPU 0] NEW GLOBAL BEST: 222040872.00 at gen 4300 ***
    Saved to best_solution.json

[GPU 0] Gen  4300 | Best: 222040872.00 | 522.8s
[GP] gpu_0 intermediate update: 222040872.00 at gen 4300
[GP] gpu_0 intermediate update: 221511000.00 at gen 4400

==================================================
GP ANALYSIS - Cycle 11
  Collected 40 solutions
==================================================

[GP] ========== GENETIC PROGRAMMING ANALYSIS STARTED ==========
[GP] Cycle: 10
[GP] Input: 40 solutions received for analysis
[GP] Fitness range: best=221511008.00, worst=222237744.00
[GP] Analysis config: blocks=True, fft=False, similarity=False
[GP] Starting analysis...
[GP] Phase 1: Extracting building blocks...

*** [GPU 0] NEW GLOBAL BEST: 221511000.00 at gen 4400 ***
    Saved to best_solution.json

[GPU 0] Gen  4400 | Best: 221511000.00 | 535.1s
[GP] Phase 1 complete: Found 30 building blocks
[GP] Phase 2: FFT analysis DISABLED
[GP] Phase 3: Similarity analysis DISABLED
[GP] ========== GP ANALYSIS COMPLETE ==========


[GP] ========== CANDIDATE GENERATION STARTED ==========
[GP] Generating 20 new candidate solutions
[GP] Available data: 40 top solutions, 30 building blocks, 0 FFT patterns, 0 similarity patterns
[GP] Generation strategy: 6 block-based, 6 interpolated, 8 mutated
[GP] Strategy 1: Creating 6 candidates via building block combination...
[GP] Strategy 1 complete: 6 block-based candidates created
[GP] Strategy 2: Creating 6 candidates via solution interpolation...
[GP] Strategy 2 complete: 6 interpolated candidates created
[GP] Strategy 3: Creating 8 candidates via guided mutation...
[GP] Strategy 3 complete: 8 mutated candidates created
[GP] Total candidates generated: 20
[GP] Strategy breakdown: Block=66, Interp=66, Mut=88
[GP] ========== CANDIDATE GENERATION COMPLETE ==========


*** [GPU 0] NEW GLOBAL BEST: 220969464.00 at gen 4500 ***
    Saved to best_solution.json

[GPU 0] Gen  4500 | Best: 220969464.00 | 547.3s
[GPU 0] Gene injection: 20 candidates injected at gen 4600 (total so far: 220)

*** [GPU 0] NEW GLOBAL BEST: 220650005.00 at gen 4600 ***
  -> 20 candidates sent to 1/1 workers
[GP] gpu_0 intermediate update: 220969464.00 at gen 4500
[GP] gpu_0 intermediate update: 220650005.00 at gen 4600
    Saved to best_solution.json

[GPU 0] Gen  4600 | Best: 220650005.00 | 559.5s

*** [GPU 0] NEW GLOBAL BEST: 219926847.00 at gen 4700 ***
    Saved to best_solution.json

[GPU 0] Gen  4700 | Best: 219926847.00 | 571.6s
[GP] gpu_0 intermediate update: 219926847.00 at gen 4700
[GP] gpu_0 intermediate update: 219866657.00 at gen 4800

==================================================
GP ANALYSIS - Cycle 12
  Collected 40 solutions
==================================================

[GP] ========== GENETIC PROGRAMMING ANALYSIS STARTED ==========
[GP] Cycle: 11
[GP] Input: 40 solutions received for analysis
[GP] Fitness range: best=219866656.00, worst=220650000.00
[GP] Analysis config: blocks=True, fft=False, similarity=False
[GP] Starting analysis...
[GP] Phase 1: Extracting building blocks...

*** [GPU 0] NEW GLOBAL BEST: 219866657.00 at gen 4800 ***
    Saved to best_solution.json

[GPU 0] Gen  4800 | Best: 219866657.00 | 583.6s
[GP] Phase 1 complete: Found 30 building blocks
[GP] Phase 2: FFT analysis DISABLED
[GP] Phase 3: Similarity analysis DISABLED
[GP] ========== GP ANALYSIS COMPLETE ==========


[GP] ========== CANDIDATE GENERATION STARTED ==========
[GP] Generating 20 new candidate solutions
[GP] Available data: 40 top solutions, 30 building blocks, 0 FFT patterns, 0 similarity patterns
[GP] Generation strategy: 6 block-based, 6 interpolated, 8 mutated
[GP] Strategy 1: Creating 6 candidates via building block combination...
[GP] Strategy 1 complete: 6 block-based candidates created
[GP] Strategy 2: Creating 6 candidates via solution interpolation...
[GP] Strategy 2 complete: 6 interpolated candidates created
[GP] Strategy 3: Creating 8 candidates via guided mutation...
[GP] Strategy 3 complete: 8 mutated candidates created
[GP] Total candidates generated: 20
[GP] Strategy breakdown: Block=72, Interp=72, Mut=96
[GP] ========== CANDIDATE GENERATION COMPLETE ==========


*** [GPU 0] NEW GLOBAL BEST: 219751796.00 at gen 4900 ***
    Saved to best_solution.json

[GPU 0] Gen  4900 | Best: 219751796.00 | 595.3s
[GPU 0] Gene injection: 20 candidates injected at gen 5000 (total so far: 240)
[GPU 0] Evolution complete. Sending final results...
  -> 20 candidates sent to 1/1 workers
[GP] gpu_0 intermediate update: 219751796.00 at gen 4900
[GP] gpu_0 intermediate update: 219380282.00 at gen 5000
[GP] Worker finished: gpu_0 (best=219380282.00)

[GP] All workers finished. Total GP cycles: 12

[Final Collection] Have 1/1 workers. Waiting up to 120s for remaining...

[Critical] Attempting final result collection before terminating workers...

[Results Summary] Collected 1 results:
  gpu_0: fitness=219380282.00, intermediate=False, gen=final

======================================================================
COMPLETE
======================================================================
Best: 219380282.00 from gpu_0
Time: 609.8s
Total candidates injected: 240

Solution JSON saved to ./results/cold_start/blocks_only/dsj1000/1R10/job_times_8_seed0.json
HTML Gantt chart saved to: ./results/cold_start/blocks_only/dsj1000/1R10/job_times_8_seed0.html
