Setting random seed to 0
DEBUG: proc shape: (783,), agents: 6, resources: 4, n: 783

======================================================================
VRP-RPD SOLVER
======================================================================
Problem: 782 customers, 6 agents, k=4
Heuristic: None
Genetic Programming: Yes
Warm Start: No
Gene Injection: Yes
Workers: 1 GPU + 0 CPU
Generations: 5000
======================================================================


[GP] Starting GP collection loop (timeout: 750s)...

*** [GPU 0] NEW GLOBAL BEST: 142285.00 at gen 0 ***
    Saved to best_solution.json

[GPU 0] Gen     0 | Best: 142285.00 | 0.5s
[GP] gpu_0 first intermediate: 142285.00 at gen 0

*** [GPU 0] NEW GLOBAL BEST: 100425.00 at gen 100 ***
    Saved to best_solution.json

[GPU 0] Gen   100 | Best: 100425.00 | 12.3s
[GP] gpu_0 intermediate update: 100425.00 at gen 100
[GP] gpu_0 intermediate update: 93490.00 at gen 200

*** [GPU 0] NEW GLOBAL BEST: 93490.00 at gen 200 ***
    Saved to best_solution.json

[GPU 0] Gen   200 | Best: 93490.00 | 24.0s

*** [GPU 0] NEW GLOBAL BEST: 90280.00 at gen 300 ***
    Saved to best_solution.json

[GPU 0] Gen   300 | Best: 90280.00 | 35.6s
[GP] gpu_0 intermediate update: 90280.00 at gen 300
[GP] gpu_0 intermediate update: 88186.00 at gen 400

==================================================
GP ANALYSIS - Cycle 1
  Collected 40 solutions
==================================================

[GP] ========== GENETIC PROGRAMMING ANALYSIS STARTED ==========
[GP] Cycle: 0
[GP] Input: 40 solutions received for analysis
[GP] Fitness range: best=88186.00, worst=93490.00
[GP] Analysis config: blocks=True, fft=False, similarity=False
[GP] Starting analysis...
[GP] Phase 1: Extracting building blocks...

*** [GPU 0] NEW GLOBAL BEST: 88186.00 at gen 400 ***
    Saved to best_solution.json

[GPU 0] Gen   400 | Best: 88186.00 | 47.3s
[GP] Phase 1 complete: Found 30 building blocks
[GP] Phase 2: FFT analysis DISABLED
[GP] Phase 3: Similarity analysis DISABLED
[GP] ========== GP ANALYSIS COMPLETE ==========


[GP] ========== CANDIDATE GENERATION STARTED ==========
[GP] Generating 20 new candidate solutions
[GP] Available data: 40 top solutions, 30 building blocks, 0 FFT patterns, 0 similarity patterns
[GP] Generation strategy: 6 block-based, 6 interpolated, 8 mutated
[GP] Strategy 1: Creating 6 candidates via building block combination...
[GP] Strategy 1 complete: 6 block-based candidates created
[GP] Strategy 2: Creating 6 candidates via solution interpolation...
[GP] Strategy 2 complete: 6 interpolated candidates created
[GP] Strategy 3: Creating 8 candidates via guided mutation...
[GP] Strategy 3 complete: 8 mutated candidates created
[GP] Total candidates generated: 20
[GP] Strategy breakdown: Block=6, Interp=6, Mut=8
[GP] ========== CANDIDATE GENERATION COMPLETE ==========


*** [GPU 0] NEW GLOBAL BEST: 86904.00 at gen 500 ***
    Saved to best_solution.json

[GPU 0] Gen   500 | Best: 86904.00 | 58.6s
[GPU 0] Gene injection: 20 candidates injected at gen 600 (total so far: 20)
  -> 20 candidates sent to 1/1 workers
[GP] gpu_0 intermediate update: 86904.00 at gen 500
[GP] gpu_0 intermediate update: 85733.00 at gen 600

*** [GPU 0] NEW GLOBAL BEST: 85733.00 at gen 600 ***
    Saved to best_solution.json

[GPU 0] Gen   600 | Best: 85733.00 | 70.3s

*** [GPU 0] NEW GLOBAL BEST: 84559.00 at gen 700 ***
    Saved to best_solution.json

[GPU 0] Gen   700 | Best: 84559.00 | 81.7s
[GP] gpu_0 intermediate update: 84559.00 at gen 700
[GP] gpu_0 intermediate update: 83549.00 at gen 800

==================================================
GP ANALYSIS - Cycle 2
  Collected 40 solutions
==================================================

[GP] ========== GENETIC PROGRAMMING ANALYSIS STARTED ==========
[GP] Cycle: 1
[GP] Input: 40 solutions received for analysis
[GP] Fitness range: best=83549.00, worst=85752.00
[GP] Analysis config: blocks=True, fft=False, similarity=False
[GP] Starting analysis...
[GP] Phase 1: Extracting building blocks...

*** [GPU 0] NEW GLOBAL BEST: 83549.00 at gen 800 ***
    Saved to best_solution.json

[GPU 0] Gen   800 | Best: 83549.00 | 93.4s
[GP] Phase 1 complete: Found 30 building blocks
[GP] Phase 2: FFT analysis DISABLED
[GP] Phase 3: Similarity analysis DISABLED
[GP] ========== GP ANALYSIS COMPLETE ==========


[GP] ========== CANDIDATE GENERATION STARTED ==========
[GP] Generating 20 new candidate solutions
[GP] Available data: 40 top solutions, 30 building blocks, 0 FFT patterns, 0 similarity patterns
[GP] Generation strategy: 6 block-based, 6 interpolated, 8 mutated
[GP] Strategy 1: Creating 6 candidates via building block combination...
[GP] Strategy 1 complete: 6 block-based candidates created
[GP] Strategy 2: Creating 6 candidates via solution interpolation...
[GP] Strategy 2 complete: 6 interpolated candidates created
[GP] Strategy 3: Creating 8 candidates via guided mutation...
[GP] Strategy 3 complete: 8 mutated candidates created
[GP] Total candidates generated: 20
[GP] Strategy breakdown: Block=12, Interp=12, Mut=16
[GP] ========== CANDIDATE GENERATION COMPLETE ==========


*** [GPU 0] NEW GLOBAL BEST: 82552.00 at gen 900 ***
    Saved to best_solution.json

[GPU 0] Gen   900 | Best: 82552.00 | 105.2s
[GPU 0] Gene injection: 20 candidates injected at gen 1000 (total so far: 40)
  -> 20 candidates sent to 1/1 workers
[GP] gpu_0 intermediate update: 82552.00 at gen 900
[GP] gpu_0 intermediate update: 81875.00 at gen 1000

*** [GPU 0] NEW GLOBAL BEST: 81869.00 at gen 1000 ***
    Saved to best_solution.json

[GPU 0] Gen  1000 | Best: 81869.00 | 116.9s
    [Checkpoint] Saved to ./results/cold_start/blocks_only/rat783/1R10/job_times_6_seed0_1000.json
[GP] gpu_0 intermediate update: 81869.00 at gen 1000

*** [GPU 0] NEW GLOBAL BEST: 81151.00 at gen 1100 ***
    Saved to best_solution.json

[GPU 0] Gen  1100 | Best: 81151.00 | 128.6s
[GP] gpu_0 intermediate update: 81151.00 at gen 1100
[GP] gpu_0 intermediate update: 80378.00 at gen 1200

==================================================
GP ANALYSIS - Cycle 3
  Collected 40 solutions
==================================================

[GP] ========== GENETIC PROGRAMMING ANALYSIS STARTED ==========
[GP] Cycle: 2
[GP] Input: 40 solutions received for analysis
[GP] Fitness range: best=80378.00, worst=81875.00
[GP] Analysis config: blocks=True, fft=False, similarity=False
[GP] Starting analysis...
[GP] Phase 1: Extracting building blocks...

*** [GPU 0] NEW GLOBAL BEST: 80378.00 at gen 1200 ***
    Saved to best_solution.json

[GPU 0] Gen  1200 | Best: 80378.00 | 140.8s
[GP] Phase 1 complete: Found 30 building blocks
[GP] Phase 2: FFT analysis DISABLED
[GP] Phase 3: Similarity analysis DISABLED
[GP] ========== GP ANALYSIS COMPLETE ==========


[GP] ========== CANDIDATE GENERATION STARTED ==========
[GP] Generating 20 new candidate solutions
[GP] Available data: 40 top solutions, 30 building blocks, 0 FFT patterns, 0 similarity patterns
[GP] Generation strategy: 6 block-based, 6 interpolated, 8 mutated
[GP] Strategy 1: Creating 6 candidates via building block combination...
[GP] Strategy 1 complete: 6 block-based candidates created
[GP] Strategy 2: Creating 6 candidates via solution interpolation...
[GP] Strategy 2 complete: 6 interpolated candidates created
[GP] Strategy 3: Creating 8 candidates via guided mutation...
[GP] Strategy 3 complete: 8 mutated candidates created
[GP] Total candidates generated: 20
[GP] Strategy breakdown: Block=18, Interp=18, Mut=24
[GP] ========== CANDIDATE GENERATION COMPLETE ==========


*** [GPU 0] NEW GLOBAL BEST: 79570.00 at gen 1300 ***
    Saved to best_solution.json

[GPU 0] Gen  1300 | Best: 79570.00 | 152.4s
[GPU 0] Gene injection: 20 candidates injected at gen 1400 (total so far: 60)

*** [GPU 0] NEW GLOBAL BEST: 78960.00 at gen 1400 ***
    Saved to best_solution.json

[GPU 0] Gen  1400 | Best: 78960.00 | 164.0s
  -> 20 candidates sent to 1/1 workers
[GP] gpu_0 intermediate update: 79570.00 at gen 1300
[GP] gpu_0 intermediate update: 78985.00 at gen 1400
[GP] gpu_0 intermediate update: 78960.00 at gen 1400

*** [GPU 0] NEW GLOBAL BEST: 78361.00 at gen 1500 ***
    Saved to best_solution.json

[GPU 0] Gen  1500 | Best: 78361.00 | 175.7s
[GP] gpu_0 intermediate update: 78361.00 at gen 1500
[GP] gpu_0 intermediate update: 78078.00 at gen 1600

==================================================
GP ANALYSIS - Cycle 4
  Collected 40 solutions
==================================================

[GP] ========== GENETIC PROGRAMMING ANALYSIS STARTED ==========
[GP] Cycle: 3
[GP] Input: 40 solutions received for analysis
[GP] Fitness range: best=78078.00, worst=78998.00
[GP] Analysis config: blocks=True, fft=False, similarity=False
[GP] Starting analysis...
[GP] Phase 1: Extracting building blocks...

*** [GPU 0] NEW GLOBAL BEST: 78078.00 at gen 1600 ***
    Saved to best_solution.json

[GPU 0] Gen  1600 | Best: 78078.00 | 187.4s
[GP] Phase 1 complete: Found 30 building blocks
[GP] Phase 2: FFT analysis DISABLED
[GP] Phase 3: Similarity analysis DISABLED
[GP] ========== GP ANALYSIS COMPLETE ==========


[GP] ========== CANDIDATE GENERATION STARTED ==========
[GP] Generating 20 new candidate solutions
[GP] Available data: 40 top solutions, 30 building blocks, 0 FFT patterns, 0 similarity patterns
[GP] Generation strategy: 6 block-based, 6 interpolated, 8 mutated
[GP] Strategy 1: Creating 6 candidates via building block combination...
[GP] Strategy 1 complete: 6 block-based candidates created
[GP] Strategy 2: Creating 6 candidates via solution interpolation...
[GP] Strategy 2 complete: 6 interpolated candidates created
[GP] Strategy 3: Creating 8 candidates via guided mutation...
[GP] Strategy 3 complete: 8 mutated candidates created
[GP] Total candidates generated: 20
[GP] Strategy breakdown: Block=24, Interp=24, Mut=32
[GP] ========== CANDIDATE GENERATION COMPLETE ==========


*** [GPU 0] NEW GLOBAL BEST: 77534.00 at gen 1700 ***
    Saved to best_solution.json

[GPU 0] Gen  1700 | Best: 77534.00 | 198.9s
[GPU 0] Gene injection: 20 candidates injected at gen 1800 (total so far: 80)

*** [GPU 0] NEW GLOBAL BEST: 76997.00 at gen 1800 ***
  -> 20 candidates sent to 1/1 workers
[GP] gpu_0 intermediate update: 77534.00 at gen 1700
[GP] gpu_0 intermediate update: 77007.00 at gen 1800
    Saved to best_solution.json

[GPU 0] Gen  1800 | Best: 76997.00 | 210.6s
[GP] gpu_0 intermediate update: 76997.00 at gen 1800

*** [GPU 0] NEW GLOBAL BEST: 76681.00 at gen 1900 ***
    Saved to best_solution.json

[GPU 0] Gen  1900 | Best: 76681.00 | 221.9s
[GP] gpu_0 intermediate update: 76681.00 at gen 1900
[GP] gpu_0 intermediate update: 76386.00 at gen 2000

==================================================
GP ANALYSIS - Cycle 5
  Collected 40 solutions
==================================================

[GP] ========== GENETIC PROGRAMMING ANALYSIS STARTED ==========
[GP] Cycle: 4
[GP] Input: 40 solutions received for analysis
[GP] Fitness range: best=76386.00, worst=77028.00
[GP] Analysis config: blocks=True, fft=False, similarity=False
[GP] Starting analysis...
[GP] Phase 1: Extracting building blocks...

*** [GPU 0] NEW GLOBAL BEST: 76386.00 at gen 2000 ***
    Saved to best_solution.json

[GPU 0] Gen  2000 | Best: 76386.00 | 233.4s
[GP] Phase 1 complete: Found 30 building blocks
[GP] Phase 2: FFT analysis DISABLED
[GP] Phase 3: Similarity analysis DISABLED
[GP] ========== GP ANALYSIS COMPLETE ==========


[GP] ========== CANDIDATE GENERATION STARTED ==========
[GP] Generating 20 new candidate solutions
[GP] Available data: 40 top solutions, 30 building blocks, 0 FFT patterns, 0 similarity patterns
[GP] Generation strategy: 6 block-based, 6 interpolated, 8 mutated
[GP] Strategy 1: Creating 6 candidates via building block combination...
[GP] Strategy 1 complete: 6 block-based candidates created
[GP] Strategy 2: Creating 6 candidates via solution interpolation...
[GP] Strategy 2 complete: 6 interpolated candidates created
[GP] Strategy 3: Creating 8 candidates via guided mutation...
[GP] Strategy 3 complete: 8 mutated candidates created
[GP] Total candidates generated: 20
[GP] Strategy breakdown: Block=30, Interp=30, Mut=40
[GP] ========== CANDIDATE GENERATION COMPLETE ==========

    [Checkpoint] Saved to ./results/cold_start/blocks_only/rat783/1R10/job_times_6_seed0_2000.json

*** [GPU 0] NEW GLOBAL BEST: 75953.00 at gen 2100 ***
    Saved to best_solution.json

[GPU 0] Gen  2100 | Best: 75953.00 | 245.0s
[GPU 0] Gene injection: 20 candidates injected at gen 2200 (total so far: 100)
  -> 20 candidates sent to 1/1 workers

[CHECKPOINT] Saved A.json at gen 1000 (makespan: 76386.00)

*** [GPU 0] NEW GLOBAL BEST: 75771.00 at gen 2200 ***
    Saved to best_solution.json

[GPU 0] Gen  2200 | Best: 75771.00 | 256.5s
[GP] gpu_0 intermediate update: 75953.00 at gen 2100
[GP] gpu_0 intermediate update: 75771.00 at gen 2200

*** [GPU 0] NEW GLOBAL BEST: 75533.00 at gen 2300 ***
    Saved to best_solution.json

[GPU 0] Gen  2300 | Best: 75533.00 | 268.0s
[GP] gpu_0 intermediate update: 75533.00 at gen 2300
[GP] gpu_0 intermediate update: 75230.00 at gen 2400

==================================================
GP ANALYSIS - Cycle 6
  Collected 40 solutions
==================================================

[GP] ========== GENETIC PROGRAMMING ANALYSIS STARTED ==========
[GP] Cycle: 5
[GP] Input: 40 solutions received for analysis
[GP] Fitness range: best=75230.00, worst=75771.00
[GP] Analysis config: blocks=True, fft=False, similarity=False
[GP] Starting analysis...
[GP] Phase 1: Extracting building blocks...

*** [GPU 0] NEW GLOBAL BEST: 75230.00 at gen 2400 ***
    Saved to best_solution.json

[GPU 0] Gen  2400 | Best: 75230.00 | 280.2s
[GP] Phase 1 complete: Found 30 building blocks
[GP] Phase 2: FFT analysis DISABLED
[GP] Phase 3: Similarity analysis DISABLED
[GP] ========== GP ANALYSIS COMPLETE ==========


[GP] ========== CANDIDATE GENERATION STARTED ==========
[GP] Generating 20 new candidate solutions
[GP] Available data: 40 top solutions, 30 building blocks, 0 FFT patterns, 0 similarity patterns
[GP] Generation strategy: 6 block-based, 6 interpolated, 8 mutated
[GP] Strategy 1: Creating 6 candidates via building block combination...
[GP] Strategy 1 complete: 6 block-based candidates created
[GP] Strategy 2: Creating 6 candidates via solution interpolation...
[GP] Strategy 2 complete: 6 interpolated candidates created
[GP] Strategy 3: Creating 8 candidates via guided mutation...
[GP] Strategy 3 complete: 8 mutated candidates created
[GP] Total candidates generated: 20
[GP] Strategy breakdown: Block=36, Interp=36, Mut=48
[GP] ========== CANDIDATE GENERATION COMPLETE ==========


*** [GPU 0] NEW GLOBAL BEST: 74898.00 at gen 2500 ***
    Saved to best_solution.json

[GPU 0] Gen  2500 | Best: 74898.00 | 292.0s
[GPU 0] Gene injection: 20 candidates injected at gen 2600 (total so far: 120)
  -> 20 candidates sent to 1/1 workers
[GP] gpu_0 intermediate update: 74898.00 at gen 2500
[GP] gpu_0 intermediate update: 74640.00 at gen 2600

*** [GPU 0] NEW GLOBAL BEST: 74640.00 at gen 2600 ***
    Saved to best_solution.json

[GPU 0] Gen  2600 | Best: 74640.00 | 303.9s

*** [GPU 0] NEW GLOBAL BEST: 74271.00 at gen 2700 ***
    Saved to best_solution.json

[GPU 0] Gen  2700 | Best: 74271.00 | 315.4s
[GP] gpu_0 intermediate update: 74271.00 at gen 2700
[GP] gpu_0 intermediate update: 74085.00 at gen 2800

==================================================
GP ANALYSIS - Cycle 7
  Collected 40 solutions
==================================================

[GP] ========== GENETIC PROGRAMMING ANALYSIS STARTED ==========
[GP] Cycle: 6
[GP] Input: 40 solutions received for analysis
[GP] Fitness range: best=74085.00, worst=74640.00
[GP] Analysis config: blocks=True, fft=False, similarity=False
[GP] Starting analysis...
[GP] Phase 1: Extracting building blocks...

*** [GPU 0] NEW GLOBAL BEST: 74085.00 at gen 2800 ***
    Saved to best_solution.json

[GPU 0] Gen  2800 | Best: 74085.00 | 327.5s
[GP] Phase 1 complete: Found 30 building blocks
[GP] Phase 2: FFT analysis DISABLED
[GP] Phase 3: Similarity analysis DISABLED
[GP] ========== GP ANALYSIS COMPLETE ==========


[GP] ========== CANDIDATE GENERATION STARTED ==========
[GP] Generating 20 new candidate solutions
[GP] Available data: 40 top solutions, 30 building blocks, 0 FFT patterns, 0 similarity patterns
[GP] Generation strategy: 6 block-based, 6 interpolated, 8 mutated
[GP] Strategy 1: Creating 6 candidates via building block combination...
[GP] Strategy 1 complete: 6 block-based candidates created
[GP] Strategy 2: Creating 6 candidates via solution interpolation...
[GP] Strategy 2 complete: 6 interpolated candidates created
[GP] Strategy 3: Creating 8 candidates via guided mutation...
[GP] Strategy 3 complete: 8 mutated candidates created
[GP] Total candidates generated: 20
[GP] Strategy breakdown: Block=42, Interp=42, Mut=56
[GP] ========== CANDIDATE GENERATION COMPLETE ==========


*** [GPU 0] NEW GLOBAL BEST: 74025.00 at gen 2900 ***
    Saved to best_solution.json

[GPU 0] Gen  2900 | Best: 74025.00 | 339.4s
[GPU 0] Gene injection: 20 candidates injected at gen 3000 (total so far: 140)
  -> 20 candidates sent to 1/1 workers
[GP] gpu_0 intermediate update: 74025.00 at gen 2900
[GP] gpu_0 intermediate update: 74002.00 at gen 3000

*** [GPU 0] NEW GLOBAL BEST: 74002.00 at gen 3000 ***
    Saved to best_solution.json

[GPU 0] Gen  3000 | Best: 74002.00 | 351.0s
    [Checkpoint] Saved to ./results/cold_start/blocks_only/rat783/1R10/job_times_6_seed0_3000.json

*** [GPU 0] NEW GLOBAL BEST: 73947.00 at gen 3100 ***
    Saved to best_solution.json

[GPU 0] Gen  3100 | Best: 73947.00 | 363.1s
[GP] gpu_0 intermediate update: 73947.00 at gen 3100
[GP] gpu_0 intermediate update: 73899.00 at gen 3200

==================================================
GP ANALYSIS - Cycle 8
  Collected 40 solutions
==================================================

[GP] ========== GENETIC PROGRAMMING ANALYSIS STARTED ==========
[GP] Cycle: 7
[GP] Input: 40 solutions received for analysis
[GP] Fitness range: best=73899.00, worst=74002.00
[GP] Analysis config: blocks=True, fft=False, similarity=False
[GP] Starting analysis...
[GP] Phase 1: Extracting building blocks...

*** [GPU 0] NEW GLOBAL BEST: 73899.00 at gen 3200 ***
    Saved to best_solution.json

[GPU 0] Gen  3200 | Best: 73899.00 | 375.1s
[GP] Phase 1 complete: Found 30 building blocks
[GP] Phase 2: FFT analysis DISABLED
[GP] Phase 3: Similarity analysis DISABLED
[GP] ========== GP ANALYSIS COMPLETE ==========


[GP] ========== CANDIDATE GENERATION STARTED ==========
[GP] Generating 20 new candidate solutions
[GP] Available data: 40 top solutions, 30 building blocks, 0 FFT patterns, 0 similarity patterns
[GP] Generation strategy: 6 block-based, 6 interpolated, 8 mutated
[GP] Strategy 1: Creating 6 candidates via building block combination...
[GP] Strategy 1 complete: 6 block-based candidates created
[GP] Strategy 2: Creating 6 candidates via solution interpolation...
[GP] Strategy 2 complete: 6 interpolated candidates created
[GP] Strategy 3: Creating 8 candidates via guided mutation...
[GP] Strategy 3 complete: 8 mutated candidates created
[GP] Total candidates generated: 20
[GP] Strategy breakdown: Block=48, Interp=48, Mut=64
[GP] ========== CANDIDATE GENERATION COMPLETE ==========


*** [GPU 0] NEW GLOBAL BEST: 73693.00 at gen 3300 ***
    Saved to best_solution.json

[GPU 0] Gen  3300 | Best: 73693.00 | 387.1s
[GPU 0] Gene injection: 20 candidates injected at gen 3400 (total so far: 160)

*** [GPU 0] NEW GLOBAL BEST: 73372.00 at gen 3400 ***
    Saved to best_solution.json

[GPU 0] Gen  3400 | Best: 73372.00 | 398.8s
  -> 20 candidates sent to 1/1 workers
[GP] gpu_0 intermediate update: 73693.00 at gen 3300
[GP] gpu_0 intermediate update: 73372.00 at gen 3400
[GPU 0] Gen  3500 | Best: 73372.00 | 410.5s

==================================================
GP ANALYSIS - Cycle 9
  Collected 40 solutions
==================================================

[GP] ========== GENETIC PROGRAMMING ANALYSIS STARTED ==========
[GP] Cycle: 8
[GP] Input: 40 solutions received for analysis
[GP] Fitness range: best=73372.00, worst=73372.00
[GP] Analysis config: blocks=True, fft=False, similarity=False
[GP] Starting analysis...
[GP] Phase 1: Extracting building blocks...
[GPU 0] Gen  3600 | Best: 73372.00 | 422.2s
[GP] Phase 1 complete: Found 0 building blocks
[GP] Phase 2: FFT analysis DISABLED
[GP] Phase 3: Similarity analysis DISABLED
[GP] ========== GP ANALYSIS COMPLETE ==========


[GP] ========== CANDIDATE GENERATION STARTED ==========
[GP] Generating 20 new candidate solutions
[GP] Available data: 40 top solutions, 0 building blocks, 0 FFT patterns, 0 similarity patterns
[GP] Generation strategy: 6 block-based, 6 interpolated, 8 mutated
[GP] Strategy 1: Creating 6 candidates via building block combination...
[GP] Strategy 1 complete: 6 block-based candidates created
[GP] Strategy 2: Creating 6 candidates via solution interpolation...
[GP] Strategy 2 complete: 6 interpolated candidates created
[GP] Strategy 3: Creating 8 candidates via guided mutation...
[GP] Strategy 3 complete: 8 mutated candidates created
[GP] Total candidates generated: 20
[GP] Strategy breakdown: Block=54, Interp=54, Mut=72
[GP] ========== CANDIDATE GENERATION COMPLETE ==========

[GPU 0] Gen  3700 | Best: 73372.00 | 434.0s
[GPU 0] Gene injection: 20 candidates injected at gen 3800 (total so far: 180)
[GPU 0] Gen  3800 | Best: 73372.00 | 445.6s
[GPU 0] Gen  3900 | Best: 73372.00 | 457.2s
  -> 20 candidates sent to 1/1 workers

==================================================
GP ANALYSIS - Cycle 10
  Collected 40 solutions
==================================================

[GP] ========== GENETIC PROGRAMMING ANALYSIS STARTED ==========
[GP] Cycle: 9
[GP] Input: 40 solutions received for analysis
[GP] Fitness range: best=73372.00, worst=73372.00
[GP] Analysis config: blocks=True, fft=False, similarity=False
[GP] Starting analysis...
[GP] Phase 1: Extracting building blocks...
[GPU 0] Gen  4000 | Best: 73372.00 | 468.9s
[GP] Phase 1 complete: Found 0 building blocks
[GP] Phase 2: FFT analysis DISABLED
[GP] Phase 3: Similarity analysis DISABLED
[GP] ========== GP ANALYSIS COMPLETE ==========


[GP] ========== CANDIDATE GENERATION STARTED ==========
[GP] Generating 20 new candidate solutions
[GP] Available data: 40 top solutions, 0 building blocks, 0 FFT patterns, 0 similarity patterns
[GP] Generation strategy: 6 block-based, 6 interpolated, 8 mutated
[GP] Strategy 1: Creating 6 candidates via building block combination...
[GP] Strategy 1 complete: 6 block-based candidates created
[GP] Strategy 2: Creating 6 candidates via solution interpolation...
[GP] Strategy 2 complete: 6 interpolated candidates created
[GP] Strategy 3: Creating 8 candidates via guided mutation...
[GP] Strategy 3 complete: 8 mutated candidates created
[GP] Total candidates generated: 20
[GP] Strategy breakdown: Block=60, Interp=60, Mut=80
[GP] ========== CANDIDATE GENERATION COMPLETE ==========

    [Checkpoint] Saved to ./results/cold_start/blocks_only/rat783/1R10/job_times_6_seed0_4000.json
[GPU 0] Gen  4100 | Best: 73372.00 | 480.6s
[GPU 0] Gene injection: 20 candidates injected at gen 4200 (total so far: 200)
  -> 20 candidates sent to 1/1 workers

[CHECKPOINT] Saved B.json at gen 2000 (makespan: 73372.00)
[GPU 0] Gen  4200 | Best: 73372.00 | 492.3s
[GPU 0] Gen  4300 | Best: 73372.00 | 504.0s
[GP] gpu_0 intermediate update: 73264.00 at gen 4400

==================================================
GP ANALYSIS - Cycle 11
  Collected 40 solutions
==================================================

[GP] ========== GENETIC PROGRAMMING ANALYSIS STARTED ==========
[GP] Cycle: 10
[GP] Input: 40 solutions received for analysis
[GP] Fitness range: best=73264.00, worst=73372.00
[GP] Analysis config: blocks=True, fft=False, similarity=False
[GP] Starting analysis...
[GP] Phase 1: Extracting building blocks...

*** [GPU 0] NEW GLOBAL BEST: 73264.00 at gen 4400 ***
    Saved to best_solution.json

[GPU 0] Gen  4400 | Best: 73264.00 | 515.7s
[GP] Phase 1 complete: Found 30 building blocks
[GP] Phase 2: FFT analysis DISABLED
[GP] Phase 3: Similarity analysis DISABLED
[GP] ========== GP ANALYSIS COMPLETE ==========


[GP] ========== CANDIDATE GENERATION STARTED ==========
[GP] Generating 20 new candidate solutions
[GP] Available data: 40 top solutions, 30 building blocks, 0 FFT patterns, 0 similarity patterns
[GP] Generation strategy: 6 block-based, 6 interpolated, 8 mutated
[GP] Strategy 1: Creating 6 candidates via building block combination...
[GP] Strategy 1 complete: 6 block-based candidates created
[GP] Strategy 2: Creating 6 candidates via solution interpolation...
[GP] Strategy 2 complete: 6 interpolated candidates created
[GP] Strategy 3: Creating 8 candidates via guided mutation...
[GP] Strategy 3 complete: 8 mutated candidates created
[GP] Total candidates generated: 20
[GP] Strategy breakdown: Block=66, Interp=66, Mut=88
[GP] ========== CANDIDATE GENERATION COMPLETE ==========


*** [GPU 0] NEW GLOBAL BEST: 73150.00 at gen 4500 ***
    Saved to best_solution.json

[GPU 0] Gen  4500 | Best: 73150.00 | 527.4s
[GPU 0] Gene injection: 20 candidates injected at gen 4600 (total so far: 220)
  -> 20 candidates sent to 1/1 workers
[GP] gpu_0 intermediate update: 73150.00 at gen 4500
[GP] gpu_0 intermediate update: 73069.00 at gen 4600

*** [GPU 0] NEW GLOBAL BEST: 73069.00 at gen 4600 ***
    Saved to best_solution.json

[GPU 0] Gen  4600 | Best: 73069.00 | 539.4s

*** [GPU 0] NEW GLOBAL BEST: 72872.00 at gen 4700 ***
    Saved to best_solution.json

[GPU 0] Gen  4700 | Best: 72872.00 | 551.0s
[GP] gpu_0 intermediate update: 72872.00 at gen 4700
[GP] gpu_0 intermediate update: 72797.00 at gen 4800

==================================================
GP ANALYSIS - Cycle 12
  Collected 40 solutions
==================================================

[GP] ========== GENETIC PROGRAMMING ANALYSIS STARTED ==========
[GP] Cycle: 11
[GP] Input: 40 solutions received for analysis
[GP] Fitness range: best=72797.00, worst=73069.00
[GP] Analysis config: blocks=True, fft=False, similarity=False
[GP] Starting analysis...
[GP] Phase 1: Extracting building blocks...

*** [GPU 0] NEW GLOBAL BEST: 72797.00 at gen 4800 ***
    Saved to best_solution.json

[GPU 0] Gen  4800 | Best: 72797.00 | 562.6s
[GP] Phase 1 complete: Found 30 building blocks
[GP] Phase 2: FFT analysis DISABLED
[GP] Phase 3: Similarity analysis DISABLED
[GP] ========== GP ANALYSIS COMPLETE ==========


[GP] ========== CANDIDATE GENERATION STARTED ==========
[GP] Generating 20 new candidate solutions
[GP] Available data: 40 top solutions, 30 building blocks, 0 FFT patterns, 0 similarity patterns
[GP] Generation strategy: 6 block-based, 6 interpolated, 8 mutated
[GP] Strategy 1: Creating 6 candidates via building block combination...
[GP] Strategy 1 complete: 6 block-based candidates created
[GP] Strategy 2: Creating 6 candidates via solution interpolation...
[GP] Strategy 2 complete: 6 interpolated candidates created
[GP] Strategy 3: Creating 8 candidates via guided mutation...
[GP] Strategy 3 complete: 8 mutated candidates created
[GP] Total candidates generated: 20
[GP] Strategy breakdown: Block=72, Interp=72, Mut=96
[GP] ========== CANDIDATE GENERATION COMPLETE ==========


*** [GPU 0] NEW GLOBAL BEST: 72620.00 at gen 4900 ***
    Saved to best_solution.json

[GPU 0] Gen  4900 | Best: 72620.00 | 573.8s
[GPU 0] Gene injection: 20 candidates injected at gen 5000 (total so far: 240)
[GPU 0] Evolution complete. Sending final results...
  -> 20 candidates sent to 1/1 workers
[GP] gpu_0 intermediate update: 72620.00 at gen 4900
[GP] Worker finished: gpu_0 (best=72620.00)

[GP] All workers finished. Total GP cycles: 12

[Final Collection] Have 1/1 workers. Waiting up to 120s for remaining...

[Critical] Attempting final result collection before terminating workers...

[Results Summary] Collected 1 results:
  gpu_0: fitness=72620.00, intermediate=False, gen=final

======================================================================
COMPLETE
======================================================================
Best: 72620.00 from gpu_0
Time: 587.8s
Total candidates injected: 240

Solution JSON saved to ./results/cold_start/blocks_only/rat783/1R10/job_times_6_seed0.json
HTML Gantt chart saved to: ./results/cold_start/blocks_only/rat783/1R10/job_times_6_seed0.html
