Setting random seed to 0
DEBUG: proc shape: (783,), agents: 6, resources: 4, n: 783

======================================================================
VRP-RPD SOLVER
======================================================================
Problem: 782 customers, 6 agents, k=4
Heuristic: None
Genetic Programming: Yes
Warm Start: No
Gene Injection: Yes
Workers: 1 GPU + 0 CPU
Generations: 5000
======================================================================


[GP] Starting GP collection loop (timeout: 750s)...

*** [GPU 0] NEW GLOBAL BEST: 144769.00 at gen 0 ***
    Saved to best_solution.json

[GPU 0] Gen     0 | Best: 144769.00 | 0.5s
[GP] gpu_0 first intermediate: 144769.00 at gen 0

*** [GPU 0] NEW GLOBAL BEST: 98961.00 at gen 100 ***
    Saved to best_solution.json

[GPU 0] Gen   100 | Best: 98961.00 | 11.7s
[GP] gpu_0 intermediate update: 98961.00 at gen 100
[GP] gpu_0 intermediate update: 92027.00 at gen 200

*** [GPU 0] NEW GLOBAL BEST: 92015.00 at gen 200 ***
    Saved to best_solution.json

[GPU 0] Gen   200 | Best: 92015.00 | 23.1s
[GP] gpu_0 intermediate update: 92015.00 at gen 200

*** [GPU 0] NEW GLOBAL BEST: 88214.00 at gen 300 ***
    Saved to best_solution.json

[GPU 0] Gen   300 | Best: 88214.00 | 34.2s
[GP] gpu_0 intermediate update: 88214.00 at gen 300
[GP] gpu_0 intermediate update: 86673.00 at gen 400

==================================================
GP ANALYSIS - Cycle 1
  Collected 40 solutions
==================================================

[GP] ========== GENETIC PROGRAMMING ANALYSIS STARTED ==========
[GP] Cycle: 0
[GP] Input: 40 solutions received for analysis
[GP] Fitness range: best=86585.00, worst=92068.00
[GP] Analysis config: blocks=True, fft=False, similarity=False
[GP] Starting analysis...
[GP] Phase 1: Extracting building blocks...

*** [GPU 0] NEW GLOBAL BEST: 86585.00 at gen 400 ***
    Saved to best_solution.json

[GPU 0] Gen   400 | Best: 86585.00 | 45.6s
[GP] Phase 1 complete: Found 30 building blocks
[GP] Phase 2: FFT analysis DISABLED
[GP] Phase 3: Similarity analysis DISABLED
[GP] ========== GP ANALYSIS COMPLETE ==========


[GP] ========== CANDIDATE GENERATION STARTED ==========
[GP] Generating 20 new candidate solutions
[GP] Available data: 40 top solutions, 30 building blocks, 0 FFT patterns, 0 similarity patterns
[GP] Generation strategy: 6 block-based, 6 interpolated, 8 mutated
[GP] Strategy 1: Creating 6 candidates via building block combination...
[GP] Strategy 1 complete: 6 block-based candidates created
[GP] Strategy 2: Creating 6 candidates via solution interpolation...
[GP] Strategy 2 complete: 6 interpolated candidates created
[GP] Strategy 3: Creating 8 candidates via guided mutation...
[GP] Strategy 3 complete: 8 mutated candidates created
[GP] Total candidates generated: 20
[GP] Strategy breakdown: Block=6, Interp=6, Mut=8
[GP] ========== CANDIDATE GENERATION COMPLETE ==========


*** [GPU 0] NEW GLOBAL BEST: 84400.00 at gen 500 ***
    Saved to best_solution.json

[GPU 0] Gen   500 | Best: 84400.00 | 57.0s
[GPU 0] Gene injection: 20 candidates injected at gen 600 (total so far: 20)

*** [GPU 0] NEW GLOBAL BEST: 83366.00 at gen 600 ***
    Saved to best_solution.json

[GPU 0] Gen   600 | Best: 83366.00 | 68.5s
  -> 20 candidates sent to 1/1 workers
[GP] gpu_0 intermediate update: 86585.00 at gen 400
[GP] gpu_0 intermediate update: 84400.00 at gen 500
[GP] gpu_0 intermediate update: 83430.00 at gen 600
[GP] gpu_0 intermediate update: 83366.00 at gen 600

*** [GPU 0] NEW GLOBAL BEST: 82389.00 at gen 700 ***
    Saved to best_solution.json

[GPU 0] Gen   700 | Best: 82389.00 | 79.8s
[GP] gpu_0 intermediate update: 82389.00 at gen 700
[GP] gpu_0 intermediate update: 81462.00 at gen 800

==================================================
GP ANALYSIS - Cycle 2
  Collected 40 solutions
==================================================

[GP] ========== GENETIC PROGRAMMING ANALYSIS STARTED ==========
[GP] Cycle: 1
[GP] Input: 40 solutions received for analysis
[GP] Fitness range: best=81462.00, worst=83469.00
[GP] Analysis config: blocks=True, fft=False, similarity=False
[GP] Starting analysis...
[GP] Phase 1: Extracting building blocks...

*** [GPU 0] NEW GLOBAL BEST: 81462.00 at gen 800 ***
    Saved to best_solution.json

[GPU 0] Gen   800 | Best: 81462.00 | 91.3s
[GP] Phase 1 complete: Found 30 building blocks
[GP] Phase 2: FFT analysis DISABLED
[GP] Phase 3: Similarity analysis DISABLED
[GP] ========== GP ANALYSIS COMPLETE ==========


[GP] ========== CANDIDATE GENERATION STARTED ==========
[GP] Generating 20 new candidate solutions
[GP] Available data: 40 top solutions, 30 building blocks, 0 FFT patterns, 0 similarity patterns
[GP] Generation strategy: 6 block-based, 6 interpolated, 8 mutated
[GP] Strategy 1: Creating 6 candidates via building block combination...
[GP] Strategy 1 complete: 6 block-based candidates created
[GP] Strategy 2: Creating 6 candidates via solution interpolation...
[GP] Strategy 2 complete: 6 interpolated candidates created
[GP] Strategy 3: Creating 8 candidates via guided mutation...
[GP] Strategy 3 complete: 8 mutated candidates created
[GP] Total candidates generated: 20
[GP] Strategy breakdown: Block=12, Interp=12, Mut=16
[GP] ========== CANDIDATE GENERATION COMPLETE ==========


*** [GPU 0] NEW GLOBAL BEST: 80588.00 at gen 900 ***
    Saved to best_solution.json

[GPU 0] Gen   900 | Best: 80588.00 | 102.7s
[GPU 0] Gene injection: 20 candidates injected at gen 1000 (total so far: 40)
  -> 20 candidates sent to 1/1 workers
[GP] gpu_0 intermediate update: 80588.00 at gen 900
[GP] gpu_0 intermediate update: 79876.00 at gen 1000

*** [GPU 0] NEW GLOBAL BEST: 79876.00 at gen 1000 ***
    Saved to best_solution.json

[GPU 0] Gen  1000 | Best: 79876.00 | 114.0s
    [Checkpoint] Saved to ./results/cold_start/blocks_only/rat783/1R10/job_times_7_seed0_1000.json

*** [GPU 0] NEW GLOBAL BEST: 79123.00 at gen 1100 ***
    Saved to best_solution.json

[GPU 0] Gen  1100 | Best: 79123.00 | 125.3s
[GP] gpu_0 intermediate update: 79123.00 at gen 1100
[GP] gpu_0 intermediate update: 78190.00 at gen 1200

==================================================
GP ANALYSIS - Cycle 3
  Collected 40 solutions
==================================================

[GP] ========== GENETIC PROGRAMMING ANALYSIS STARTED ==========
[GP] Cycle: 2
[GP] Input: 40 solutions received for analysis
[GP] Fitness range: best=78190.00, worst=79892.00
[GP] Analysis config: blocks=True, fft=False, similarity=False
[GP] Starting analysis...
[GP] Phase 1: Extracting building blocks...

*** [GPU 0] NEW GLOBAL BEST: 78190.00 at gen 1200 ***
    Saved to best_solution.json

[GPU 0] Gen  1200 | Best: 78190.00 | 136.9s
[GP] Phase 1 complete: Found 30 building blocks
[GP] Phase 2: FFT analysis DISABLED
[GP] Phase 3: Similarity analysis DISABLED
[GP] ========== GP ANALYSIS COMPLETE ==========


[GP] ========== CANDIDATE GENERATION STARTED ==========
[GP] Generating 20 new candidate solutions
[GP] Available data: 40 top solutions, 30 building blocks, 0 FFT patterns, 0 similarity patterns
[GP] Generation strategy: 6 block-based, 6 interpolated, 8 mutated
[GP] Strategy 1: Creating 6 candidates via building block combination...
[GP] Strategy 1 complete: 6 block-based candidates created
[GP] Strategy 2: Creating 6 candidates via solution interpolation...
[GP] Strategy 2 complete: 6 interpolated candidates created
[GP] Strategy 3: Creating 8 candidates via guided mutation...
[GP] Strategy 3 complete: 8 mutated candidates created
[GP] Total candidates generated: 20
[GP] Strategy breakdown: Block=18, Interp=18, Mut=24
[GP] ========== CANDIDATE GENERATION COMPLETE ==========


*** [GPU 0] NEW GLOBAL BEST: 77769.00 at gen 1300 ***
    Saved to best_solution.json

[GPU 0] Gen  1300 | Best: 77769.00 | 148.5s
[GPU 0] Gene injection: 20 candidates injected at gen 1400 (total so far: 60)
  -> 20 candidates sent to 1/1 workers
[GP] gpu_0 intermediate update: 77769.00 at gen 1300
[GP] gpu_0 intermediate update: 77311.00 at gen 1400

*** [GPU 0] NEW GLOBAL BEST: 77311.00 at gen 1400 ***
    Saved to best_solution.json

[GPU 0] Gen  1400 | Best: 77311.00 | 160.3s

*** [GPU 0] NEW GLOBAL BEST: 76944.00 at gen 1500 ***
    Saved to best_solution.json

[GPU 0] Gen  1500 | Best: 76944.00 | 172.1s
[GP] gpu_0 intermediate update: 76944.00 at gen 1500
[GP] gpu_0 intermediate update: 76494.00 at gen 1600

==================================================
GP ANALYSIS - Cycle 4
  Collected 40 solutions
==================================================

[GP] ========== GENETIC PROGRAMMING ANALYSIS STARTED ==========
[GP] Cycle: 3
[GP] Input: 40 solutions received for analysis
[GP] Fitness range: best=76494.00, worst=77311.00
[GP] Analysis config: blocks=True, fft=False, similarity=False
[GP] Starting analysis...
[GP] Phase 1: Extracting building blocks...

*** [GPU 0] NEW GLOBAL BEST: 76494.00 at gen 1600 ***
    Saved to best_solution.json

[GPU 0] Gen  1600 | Best: 76494.00 | 184.2s
[GP] Phase 1 complete: Found 30 building blocks
[GP] Phase 2: FFT analysis DISABLED
[GP] Phase 3: Similarity analysis DISABLED
[GP] ========== GP ANALYSIS COMPLETE ==========


[GP] ========== CANDIDATE GENERATION STARTED ==========
[GP] Generating 20 new candidate solutions
[GP] Available data: 40 top solutions, 30 building blocks, 0 FFT patterns, 0 similarity patterns
[GP] Generation strategy: 6 block-based, 6 interpolated, 8 mutated
[GP] Strategy 1: Creating 6 candidates via building block combination...
[GP] Strategy 1 complete: 6 block-based candidates created
[GP] Strategy 2: Creating 6 candidates via solution interpolation...
[GP] Strategy 2 complete: 6 interpolated candidates created
[GP] Strategy 3: Creating 8 candidates via guided mutation...
[GP] Strategy 3 complete: 8 mutated candidates created
[GP] Total candidates generated: 20
[GP] Strategy breakdown: Block=24, Interp=24, Mut=32
[GP] ========== CANDIDATE GENERATION COMPLETE ==========


*** [GPU 0] NEW GLOBAL BEST: 76087.00 at gen 1700 ***
    Saved to best_solution.json

[GPU 0] Gen  1700 | Best: 76087.00 | 195.8s
[GPU 0] Gene injection: 20 candidates injected at gen 1800 (total so far: 80)

*** [GPU 0] NEW GLOBAL BEST: 75801.00 at gen 1800 ***
    Saved to best_solution.json

[GPU 0] Gen  1800 | Best: 75801.00 | 207.7s
  -> 20 candidates sent to 1/1 workers
[GP] gpu_0 intermediate update: 76087.00 at gen 1700
[GP] gpu_0 intermediate update: 75801.00 at gen 1800

*** [GPU 0] NEW GLOBAL BEST: 75677.00 at gen 1900 ***
    Saved to best_solution.json

[GPU 0] Gen  1900 | Best: 75677.00 | 219.8s
[GP] gpu_0 intermediate update: 75677.00 at gen 1900
[GP] gpu_0 intermediate update: 75522.00 at gen 2000

==================================================
GP ANALYSIS - Cycle 5
  Collected 40 solutions
==================================================

[GP] ========== GENETIC PROGRAMMING ANALYSIS STARTED ==========
[GP] Cycle: 4
[GP] Input: 40 solutions received for analysis
[GP] Fitness range: best=75522.00, worst=75807.00
[GP] Analysis config: blocks=True, fft=False, similarity=False
[GP] Starting analysis...
[GP] Phase 1: Extracting building blocks...

*** [GPU 0] NEW GLOBAL BEST: 75522.00 at gen 2000 ***
    Saved to best_solution.json

[GPU 0] Gen  2000 | Best: 75522.00 | 231.4s
[GP] Phase 1 complete: Found 30 building blocks
[GP] Phase 2: FFT analysis DISABLED
[GP] Phase 3: Similarity analysis DISABLED
[GP] ========== GP ANALYSIS COMPLETE ==========


[GP] ========== CANDIDATE GENERATION STARTED ==========
[GP] Generating 20 new candidate solutions
[GP] Available data: 40 top solutions, 30 building blocks, 0 FFT patterns, 0 similarity patterns
[GP] Generation strategy: 6 block-based, 6 interpolated, 8 mutated
[GP] Strategy 1: Creating 6 candidates via building block combination...
[GP] Strategy 1 complete: 6 block-based candidates created
[GP] Strategy 2: Creating 6 candidates via solution interpolation...
[GP] Strategy 2 complete: 6 interpolated candidates created
[GP] Strategy 3: Creating 8 candidates via guided mutation...
    [Checkpoint] Saved to ./results/cold_start/blocks_only/rat783/1R10/job_times_7_seed0_2000.json
[GP] Strategy 3 complete: 8 mutated candidates created
[GP] Total candidates generated: 20
[GP] Strategy breakdown: Block=30, Interp=30, Mut=40
[GP] ========== CANDIDATE GENERATION COMPLETE ==========


*** [GPU 0] NEW GLOBAL BEST: 75497.00 at gen 2100 ***
    Saved to best_solution.json

[GPU 0] Gen  2100 | Best: 75497.00 | 243.1s
[GPU 0] Gene injection: 20 candidates injected at gen 2200 (total so far: 100)
  -> 20 candidates sent to 1/1 workers

[CHECKPOINT] Saved A.json at gen 1000 (makespan: 75522.00)

*** [GPU 0] NEW GLOBAL BEST: 75278.00 at gen 2200 ***
    Saved to best_solution.json

[GPU 0] Gen  2200 | Best: 75278.00 | 254.8s
[GP] gpu_0 intermediate update: 75497.00 at gen 2100
[GP] gpu_0 intermediate update: 75315.00 at gen 2200
[GP] gpu_0 intermediate update: 75278.00 at gen 2200

*** [GPU 0] NEW GLOBAL BEST: 75028.00 at gen 2300 ***
    Saved to best_solution.json

[GPU 0] Gen  2300 | Best: 75028.00 | 266.4s
[GP] gpu_0 intermediate update: 75028.00 at gen 2300
[GP] gpu_0 intermediate update: 74798.00 at gen 2400

==================================================
GP ANALYSIS - Cycle 6
  Collected 40 solutions
==================================================

[GP] ========== GENETIC PROGRAMMING ANALYSIS STARTED ==========
[GP] Cycle: 5
[GP] Input: 40 solutions received for analysis
[GP] Fitness range: best=74798.00, worst=75315.00
[GP] Analysis config: blocks=True, fft=False, similarity=False
[GP] Starting analysis...
[GP] Phase 1: Extracting building blocks...

*** [GPU 0] NEW GLOBAL BEST: 74798.00 at gen 2400 ***
    Saved to best_solution.json

[GPU 0] Gen  2400 | Best: 74798.00 | 278.1s
[GP] Phase 1 complete: Found 30 building blocks
[GP] Phase 2: FFT analysis DISABLED
[GP] Phase 3: Similarity analysis DISABLED
[GP] ========== GP ANALYSIS COMPLETE ==========


[GP] ========== CANDIDATE GENERATION STARTED ==========
[GP] Generating 20 new candidate solutions
[GP] Available data: 40 top solutions, 30 building blocks, 0 FFT patterns, 0 similarity patterns
[GP] Generation strategy: 6 block-based, 6 interpolated, 8 mutated
[GP] Strategy 1: Creating 6 candidates via building block combination...
[GP] Strategy 1 complete: 6 block-based candidates created
[GP] Strategy 2: Creating 6 candidates via solution interpolation...
[GP] Strategy 2 complete: 6 interpolated candidates created
[GP] Strategy 3: Creating 8 candidates via guided mutation...
[GP] Strategy 3 complete: 8 mutated candidates created
[GP] Total candidates generated: 20
[GP] Strategy breakdown: Block=36, Interp=36, Mut=48
[GP] ========== CANDIDATE GENERATION COMPLETE ==========


*** [GPU 0] NEW GLOBAL BEST: 74642.00 at gen 2500 ***
    Saved to best_solution.json

[GPU 0] Gen  2500 | Best: 74642.00 | 289.6s
[GPU 0] Gene injection: 20 candidates injected at gen 2600 (total so far: 120)

*** [GPU 0] NEW GLOBAL BEST: 74417.00 at gen 2600 ***
  -> 20 candidates sent to 1/1 workers
[GP] gpu_0 intermediate update: 74642.00 at gen 2500
[GP] gpu_0 intermediate update: 74417.00 at gen 2600
    Saved to best_solution.json

[GPU 0] Gen  2600 | Best: 74417.00 | 301.4s

*** [GPU 0] NEW GLOBAL BEST: 74145.00 at gen 2700 ***
    Saved to best_solution.json

[GPU 0] Gen  2700 | Best: 74145.00 | 312.7s
[GP] gpu_0 intermediate update: 74145.00 at gen 2700
[GP] gpu_0 intermediate update: 73958.00 at gen 2800

==================================================
GP ANALYSIS - Cycle 7
  Collected 40 solutions
==================================================

[GP] ========== GENETIC PROGRAMMING ANALYSIS STARTED ==========
[GP] Cycle: 6
[GP] Input: 40 solutions received for analysis
[GP] Fitness range: best=73958.00, worst=74417.00
[GP] Analysis config: blocks=True, fft=False, similarity=False
[GP] Starting analysis...
[GP] Phase 1: Extracting building blocks...

*** [GPU 0] NEW GLOBAL BEST: 73958.00 at gen 2800 ***
    Saved to best_solution.json

[GPU 0] Gen  2800 | Best: 73958.00 | 324.3s
[GP] Phase 1 complete: Found 30 building blocks
[GP] Phase 2: FFT analysis DISABLED
[GP] Phase 3: Similarity analysis DISABLED
[GP] ========== GP ANALYSIS COMPLETE ==========


[GP] ========== CANDIDATE GENERATION STARTED ==========
[GP] Generating 20 new candidate solutions
[GP] Available data: 40 top solutions, 30 building blocks, 0 FFT patterns, 0 similarity patterns
[GP] Generation strategy: 6 block-based, 6 interpolated, 8 mutated
[GP] Strategy 1: Creating 6 candidates via building block combination...
[GP] Strategy 1 complete: 6 block-based candidates created
[GP] Strategy 2: Creating 6 candidates via solution interpolation...
[GP] Strategy 2 complete: 6 interpolated candidates created
[GP] Strategy 3: Creating 8 candidates via guided mutation...
[GP] Strategy 3 complete: 8 mutated candidates created
[GP] Total candidates generated: 20
[GP] Strategy breakdown: Block=42, Interp=42, Mut=56
[GP] ========== CANDIDATE GENERATION COMPLETE ==========


*** [GPU 0] NEW GLOBAL BEST: 73860.00 at gen 2900 ***
    Saved to best_solution.json

[GPU 0] Gen  2900 | Best: 73860.00 | 335.7s
[GPU 0] Gene injection: 20 candidates injected at gen 3000 (total so far: 140)
[GPU 0] Gen  3000 | Best: 73860.00 | 347.2s
  -> 20 candidates sent to 1/1 workers
[GP] gpu_0 intermediate update: 73860.00 at gen 2900
    [Checkpoint] Saved to ./results/cold_start/blocks_only/rat783/1R10/job_times_7_seed0_3000.json

*** [GPU 0] NEW GLOBAL BEST: 73717.00 at gen 3100 ***
    Saved to best_solution.json

[GPU 0] Gen  3100 | Best: 73717.00 | 359.1s
[GP] gpu_0 intermediate update: 73717.00 at gen 3100
[GP] gpu_0 intermediate update: 73548.00 at gen 3200

==================================================
GP ANALYSIS - Cycle 8
  Collected 40 solutions
==================================================

[GP] ========== GENETIC PROGRAMMING ANALYSIS STARTED ==========
[GP] Cycle: 7
[GP] Input: 40 solutions received for analysis
[GP] Fitness range: best=73548.00, worst=73860.00
[GP] Analysis config: blocks=True, fft=False, similarity=False
[GP] Starting analysis...
[GP] Phase 1: Extracting building blocks...

*** [GPU 0] NEW GLOBAL BEST: 73548.00 at gen 3200 ***
    Saved to best_solution.json

[GPU 0] Gen  3200 | Best: 73548.00 | 370.5s
[GP] Phase 1 complete: Found 30 building blocks
[GP] Phase 2: FFT analysis DISABLED
[GP] Phase 3: Similarity analysis DISABLED
[GP] ========== GP ANALYSIS COMPLETE ==========


[GP] ========== CANDIDATE GENERATION STARTED ==========
[GP] Generating 20 new candidate solutions
[GP] Available data: 40 top solutions, 30 building blocks, 0 FFT patterns, 0 similarity patterns
[GP] Generation strategy: 6 block-based, 6 interpolated, 8 mutated
[GP] Strategy 1: Creating 6 candidates via building block combination...
[GP] Strategy 1 complete: 6 block-based candidates created
[GP] Strategy 2: Creating 6 candidates via solution interpolation...
[GP] Strategy 2 complete: 6 interpolated candidates created
[GP] Strategy 3: Creating 8 candidates via guided mutation...
[GP] Strategy 3 complete: 8 mutated candidates created
[GP] Total candidates generated: 20
[GP] Strategy breakdown: Block=48, Interp=48, Mut=64
[GP] ========== CANDIDATE GENERATION COMPLETE ==========


*** [GPU 0] NEW GLOBAL BEST: 73418.00 at gen 3300 ***
    Saved to best_solution.json

[GPU 0] Gen  3300 | Best: 73418.00 | 381.7s
[GPU 0] Gene injection: 20 candidates injected at gen 3400 (total so far: 160)

*** [GPU 0] NEW GLOBAL BEST: 73409.00 at gen 3400 ***
    Saved to best_solution.json

[GPU 0] Gen  3400 | Best: 73409.00 | 393.2s
  -> 20 candidates sent to 1/1 workers
[GP] gpu_0 intermediate update: 73418.00 at gen 3300
[GP] gpu_0 intermediate update: 73409.00 at gen 3400

*** [GPU 0] NEW GLOBAL BEST: 73312.00 at gen 3500 ***
    Saved to best_solution.json

[GPU 0] Gen  3500 | Best: 73312.00 | 404.6s
[GP] gpu_0 intermediate update: 73312.00 at gen 3500
[GP] gpu_0 intermediate update: 73205.00 at gen 3600

==================================================
GP ANALYSIS - Cycle 9
  Collected 40 solutions
==================================================

[GP] ========== GENETIC PROGRAMMING ANALYSIS STARTED ==========
[GP] Cycle: 8
[GP] Input: 40 solutions received for analysis
[GP] Fitness range: best=73205.00, worst=73409.00
[GP] Analysis config: blocks=True, fft=False, similarity=False
[GP] Starting analysis...
[GP] Phase 1: Extracting building blocks...

*** [GPU 0] NEW GLOBAL BEST: 73205.00 at gen 3600 ***
    Saved to best_solution.json

[GPU 0] Gen  3600 | Best: 73205.00 | 416.4s
[GP] Phase 1 complete: Found 30 building blocks
[GP] Phase 2: FFT analysis DISABLED
[GP] Phase 3: Similarity analysis DISABLED
[GP] ========== GP ANALYSIS COMPLETE ==========


[GP] ========== CANDIDATE GENERATION STARTED ==========
[GP] Generating 20 new candidate solutions
[GP] Available data: 40 top solutions, 30 building blocks, 0 FFT patterns, 0 similarity patterns
[GP] Generation strategy: 6 block-based, 6 interpolated, 8 mutated
[GP] Strategy 1: Creating 6 candidates via building block combination...
[GP] Strategy 1 complete: 6 block-based candidates created
[GP] Strategy 2: Creating 6 candidates via solution interpolation...
[GP] Strategy 2 complete: 6 interpolated candidates created
[GP] Strategy 3: Creating 8 candidates via guided mutation...
[GP] Strategy 3 complete: 8 mutated candidates created
[GP] Total candidates generated: 20
[GP] Strategy breakdown: Block=54, Interp=54, Mut=72
[GP] ========== CANDIDATE GENERATION COMPLETE ==========


*** [GPU 0] NEW GLOBAL BEST: 73089.00 at gen 3700 ***
    Saved to best_solution.json

[GPU 0] Gen  3700 | Best: 73089.00 | 427.9s
[GPU 0] Gene injection: 20 candidates injected at gen 3800 (total so far: 180)
  -> 20 candidates sent to 1/1 workers
[GP] gpu_0 intermediate update: 73089.00 at gen 3700
[GP] gpu_0 intermediate update: 72993.00 at gen 3800

*** [GPU 0] NEW GLOBAL BEST: 72993.00 at gen 3800 ***
    Saved to best_solution.json

[GPU 0] Gen  3800 | Best: 72993.00 | 439.4s

*** [GPU 0] NEW GLOBAL BEST: 72860.00 at gen 3900 ***
    Saved to best_solution.json

[GPU 0] Gen  3900 | Best: 72860.00 | 450.6s
[GP] gpu_0 intermediate update: 72860.00 at gen 3900
[GP] gpu_0 intermediate update: 72673.00 at gen 4000

==================================================
GP ANALYSIS - Cycle 10
  Collected 40 solutions
==================================================

[GP] ========== GENETIC PROGRAMMING ANALYSIS STARTED ==========
[GP] Cycle: 9
[GP] Input: 40 solutions received for analysis
[GP] Fitness range: best=72673.00, worst=72993.00
[GP] Analysis config: blocks=True, fft=False, similarity=False
[GP] Starting analysis...
[GP] Phase 1: Extracting building blocks...

*** [GPU 0] NEW GLOBAL BEST: 72673.00 at gen 4000 ***
    Saved to best_solution.json

[GPU 0] Gen  4000 | Best: 72673.00 | 462.1s
[GP] Phase 1 complete: Found 30 building blocks
[GP] Phase 2: FFT analysis DISABLED
[GP] Phase 3: Similarity analysis DISABLED
[GP] ========== GP ANALYSIS COMPLETE ==========


[GP] ========== CANDIDATE GENERATION STARTED ==========
[GP] Generating 20 new candidate solutions
[GP] Available data: 40 top solutions, 30 building blocks, 0 FFT patterns, 0 similarity patterns
[GP] Generation strategy: 6 block-based, 6 interpolated, 8 mutated
[GP] Strategy 1: Creating 6 candidates via building block combination...
[GP] Strategy 1 complete: 6 block-based candidates created
[GP] Strategy 2: Creating 6 candidates via solution interpolation...
[GP] Strategy 2 complete: 6 interpolated candidates created
[GP] Strategy 3: Creating 8 candidates via guided mutation...
[GP] Strategy 3 complete: 8 mutated candidates created
[GP] Total candidates generated: 20
[GP] Strategy breakdown: Block=60, Interp=60, Mut=80
[GP] ========== CANDIDATE GENERATION COMPLETE ==========

    [Checkpoint] Saved to ./results/cold_start/blocks_only/rat783/1R10/job_times_7_seed0_4000.json

*** [GPU 0] NEW GLOBAL BEST: 72513.00 at gen 4100 ***
    Saved to best_solution.json

[GPU 0] Gen  4100 | Best: 72513.00 | 473.3s
[GPU 0] Gene injection: 20 candidates injected at gen 4200 (total so far: 200)
  -> 20 candidates sent to 1/1 workers

[CHECKPOINT] Saved B.json at gen 2000 (makespan: 72673.00)

*** [GPU 0] NEW GLOBAL BEST: 72436.00 at gen 4200 ***
    Saved to best_solution.json

[GPU 0] Gen  4200 | Best: 72436.00 | 484.7s
[GP] gpu_0 intermediate update: 72513.00 at gen 4100
[GP] gpu_0 intermediate update: 72436.00 at gen 4200

*** [GPU 0] NEW GLOBAL BEST: 72339.00 at gen 4300 ***
    Saved to best_solution.json

[GPU 0] Gen  4300 | Best: 72339.00 | 496.0s
[GP] gpu_0 intermediate update: 72339.00 at gen 4300
[GP] gpu_0 intermediate update: 72230.00 at gen 4400

==================================================
GP ANALYSIS - Cycle 11
  Collected 40 solutions
==================================================

[GP] ========== GENETIC PROGRAMMING ANALYSIS STARTED ==========
[GP] Cycle: 10
[GP] Input: 40 solutions received for analysis
[GP] Fitness range: best=72230.00, worst=72436.00
[GP] Analysis config: blocks=True, fft=False, similarity=False
[GP] Starting analysis...
[GP] Phase 1: Extracting building blocks...

*** [GPU 0] NEW GLOBAL BEST: 72230.00 at gen 4400 ***
    Saved to best_solution.json

[GPU 0] Gen  4400 | Best: 72230.00 | 507.6s
[GP] Phase 1 complete: Found 30 building blocks
[GP] Phase 2: FFT analysis DISABLED
[GP] Phase 3: Similarity analysis DISABLED
[GP] ========== GP ANALYSIS COMPLETE ==========


[GP] ========== CANDIDATE GENERATION STARTED ==========
[GP] Generating 20 new candidate solutions
[GP] Available data: 40 top solutions, 30 building blocks, 0 FFT patterns, 0 similarity patterns
[GP] Generation strategy: 6 block-based, 6 interpolated, 8 mutated
[GP] Strategy 1: Creating 6 candidates via building block combination...
[GP] Strategy 1 complete: 6 block-based candidates created
[GP] Strategy 2: Creating 6 candidates via solution interpolation...
[GP] Strategy 2 complete: 6 interpolated candidates created
[GP] Strategy 3: Creating 8 candidates via guided mutation...
[GP] Strategy 3 complete: 8 mutated candidates created
[GP] Total candidates generated: 20
[GP] Strategy breakdown: Block=66, Interp=66, Mut=88
[GP] ========== CANDIDATE GENERATION COMPLETE ==========


*** [GPU 0] NEW GLOBAL BEST: 72217.00 at gen 4500 ***
    Saved to best_solution.json

[GPU 0] Gen  4500 | Best: 72217.00 | 519.0s
[GPU 0] Gene injection: 20 candidates injected at gen 4600 (total so far: 220)

*** [GPU 0] NEW GLOBAL BEST: 72176.00 at gen 4600 ***
    Saved to best_solution.json

[GPU 0] Gen  4600 | Best: 72176.00 | 530.4s
  -> 20 candidates sent to 1/1 workers
[GP] gpu_0 intermediate update: 72217.00 at gen 4500
[GP] gpu_0 intermediate update: 72176.00 at gen 4600

*** [GPU 0] NEW GLOBAL BEST: 72145.00 at gen 4700 ***
    Saved to best_solution.json

[GPU 0] Gen  4700 | Best: 72145.00 | 541.8s
[GP] gpu_0 intermediate update: 72145.00 at gen 4700
[GP] gpu_0 intermediate update: 72080.00 at gen 4800

==================================================
GP ANALYSIS - Cycle 12
  Collected 40 solutions
==================================================

[GP] ========== GENETIC PROGRAMMING ANALYSIS STARTED ==========
[GP] Cycle: 11
[GP] Input: 40 solutions received for analysis
[GP] Fitness range: best=72080.00, worst=72176.00
[GP] Analysis config: blocks=True, fft=False, similarity=False
[GP] Starting analysis...
[GP] Phase 1: Extracting building blocks...

*** [GPU 0] NEW GLOBAL BEST: 72080.00 at gen 4800 ***
    Saved to best_solution.json

[GPU 0] Gen  4800 | Best: 72080.00 | 553.1s
[GP] Phase 1 complete: Found 30 building blocks
[GP] Phase 2: FFT analysis DISABLED
[GP] Phase 3: Similarity analysis DISABLED
[GP] ========== GP ANALYSIS COMPLETE ==========


[GP] ========== CANDIDATE GENERATION STARTED ==========
[GP] Generating 20 new candidate solutions
[GP] Available data: 40 top solutions, 30 building blocks, 0 FFT patterns, 0 similarity patterns
[GP] Generation strategy: 6 block-based, 6 interpolated, 8 mutated
[GP] Strategy 1: Creating 6 candidates via building block combination...
[GP] Strategy 1 complete: 6 block-based candidates created
[GP] Strategy 2: Creating 6 candidates via solution interpolation...
[GP] Strategy 2 complete: 6 interpolated candidates created
[GP] Strategy 3: Creating 8 candidates via guided mutation...
[GP] Strategy 3 complete: 8 mutated candidates created
[GP] Total candidates generated: 20
[GP] Strategy breakdown: Block=72, Interp=72, Mut=96
[GP] ========== CANDIDATE GENERATION COMPLETE ==========


*** [GPU 0] NEW GLOBAL BEST: 72057.00 at gen 4900 ***
    Saved to best_solution.json

[GPU 0] Gen  4900 | Best: 72057.00 | 564.5s
[GPU 0] Gene injection: 20 candidates injected at gen 5000 (total so far: 240)
[GPU 0] Evolution complete. Sending final results...
  -> 20 candidates sent to 1/1 workers
[GP] gpu_0 intermediate update: 72057.00 at gen 4900
[GP] Worker finished: gpu_0 (best=72057.00)

[GP] All workers finished. Total GP cycles: 12

[Final Collection] Have 1/1 workers. Waiting up to 120s for remaining...

[Critical] Attempting final result collection before terminating workers...

[Results Summary] Collected 1 results:
  gpu_0: fitness=72057.00, intermediate=False, gen=final

======================================================================
COMPLETE
======================================================================
Best: 72057.00 from gpu_0
Time: 578.3s
Total candidates injected: 240

Solution JSON saved to ./results/cold_start/blocks_only/rat783/1R10/job_times_7_seed0.json
HTML Gantt chart saved to: ./results/cold_start/blocks_only/rat783/1R10/job_times_7_seed0.html
