Setting random seed to 0
DEBUG: proc shape: (431,), agents: 6, resources: 4, n: 431

======================================================================
VRP-RPD SOLVER
======================================================================
Problem: 430 customers, 6 agents, k=4
Heuristic: None
Genetic Programming: Yes
Warm Start: No
Gene Injection: Yes
Workers: 1 GPU + 0 CPU
Generations: 5000
======================================================================


[GP] Starting GP collection loop (timeout: 12975s)...

*** [GPU 0] NEW GLOBAL BEST: 3958698.00 at gen 0 ***
    Saved to best_solution.json

[GPU 0] Gen     0 | Best: 3958698.00 | 0.4s
[GP] gpu_0 first intermediate: 3958698.00 at gen 0

*** [GPU 0] NEW GLOBAL BEST: 2970244.00 at gen 100 ***
    Saved to best_solution.json

[GPU 0] Gen   100 | Best: 2970244.00 | 9.8s
[GP] gpu_0 intermediate update: 2970244.00 at gen 100
[GP] gpu_0 intermediate update: 2830825.00 at gen 200

==================================================
GP ANALYSIS - Cycle 1
  Collected 100 solutions
==================================================

[GP] ========== GENETIC PROGRAMMING ANALYSIS STARTED ==========
[GP] Cycle: 0
[GP] Input: 100 solutions received for analysis
[GP] Fitness range: best=2830825.00, worst=2847734.00
[GP] Analysis config: blocks=True, fft=False, similarity=False
[GP] Starting analysis...
[GP] Phase 1: Extracting building blocks...

*** [GPU 0] NEW GLOBAL BEST: 2830825.00 at gen 200 ***
    Saved to best_solution.json

[GPU 0] Gen   200 | Best: 2830825.00 | 19.3s
[GP] Phase 1 complete: Found 13 building blocks
[GP] Phase 2: FFT analysis DISABLED
[GP] Phase 3: Similarity analysis DISABLED
[GP] ========== GP ANALYSIS COMPLETE ==========


[GP] ========== CANDIDATE GENERATION STARTED ==========
[GP] Generating 20 new candidate solutions
[GP] Available data: 100 top solutions, 13 building blocks, 0 FFT patterns, 0 similarity patterns
[GP] Generation strategy: 6 block-based, 6 interpolated, 8 mutated
[GP] Strategy 1: Creating 6 candidates via building block combination...
[GP] Strategy 1 complete: 6 block-based candidates created
[GP] Strategy 2: Creating 6 candidates via solution interpolation...
[GP] Strategy 2 complete: 6 interpolated candidates created
[GP] Strategy 3: Creating 8 candidates via guided mutation...
[GP] Strategy 3 complete: 8 mutated candidates created
[GP] Total candidates generated: 20
[GP] Strategy breakdown: Block=6, Interp=6, Mut=8
[GP] ========== CANDIDATE GENERATION COMPLETE ==========


*** [GPU 0] NEW GLOBAL BEST: 2753990.00 at gen 300 ***
    Saved to best_solution.json

[GPU 0] Gen   300 | Best: 2753990.00 | 28.6s
  -> 20 candidates sent to 1/1 workers
[GP] gpu_0 intermediate update: 2753990.00 at gen 300
[GPU 0] Gene injection: 20 candidates injected at gen 400 (total so far: 20)
[GP] gpu_0 intermediate update: 2668608.00 at gen 400

==================================================
GP ANALYSIS - Cycle 2
  Collected 100 solutions
==================================================

[GP] ========== GENETIC PROGRAMMING ANALYSIS STARTED ==========
[GP] Cycle: 1
[GP] Input: 100 solutions received for analysis
[GP] Fitness range: best=2667280.00, worst=2671834.00
[GP] Analysis config: blocks=True, fft=False, similarity=False
[GP] Starting analysis...
[GP] Phase 1: Extracting building blocks...

*** [GPU 0] NEW GLOBAL BEST: 2667280.00 at gen 400 ***
    Saved to best_solution.json

[GPU 0] Gen   400 | Best: 2667280.00 | 37.9s
[GP] Phase 1 complete: Found 11 building blocks
[GP] Phase 2: FFT analysis DISABLED
[GP] Phase 3: Similarity analysis DISABLED
[GP] ========== GP ANALYSIS COMPLETE ==========


[GP] ========== CANDIDATE GENERATION STARTED ==========
[GP] Generating 20 new candidate solutions
[GP] Available data: 100 top solutions, 11 building blocks, 0 FFT patterns, 0 similarity patterns
[GP] Generation strategy: 6 block-based, 6 interpolated, 8 mutated
[GP] Strategy 1: Creating 6 candidates via building block combination...
[GP] Strategy 1 complete: 6 block-based candidates created
[GP] Strategy 2: Creating 6 candidates via solution interpolation...
[GP] Strategy 2 complete: 6 interpolated candidates created
[GP] Strategy 3: Creating 8 candidates via guided mutation...
[GP] Strategy 3 complete: 8 mutated candidates created
[GP] Total candidates generated: 20
[GP] Strategy breakdown: Block=12, Interp=12, Mut=16
[GP] ========== CANDIDATE GENERATION COMPLETE ==========

  -> 20 candidates sent to 1/1 workers
[GP] gpu_0 intermediate update: 2667280.00 at gen 400

*** [GPU 0] NEW GLOBAL BEST: 2586703.00 at gen 500 ***
    Saved to best_solution.json

[GPU 0] Gen   500 | Best: 2586703.00 | 47.2s
[GP] gpu_0 intermediate update: 2586703.00 at gen 500
[GP] gpu_0 intermediate update: 2538341.00 at gen 600
[GPU 0] Gene injection: 20 candidates injected at gen 600 (total so far: 40)

*** [GPU 0] NEW GLOBAL BEST: 2538341.00 at gen 600 ***
    Saved to best_solution.json

[GPU 0] Gen   600 | Best: 2538341.00 | 56.5s

==================================================
GP ANALYSIS - Cycle 3
  Collected 100 solutions
==================================================

[GP] ========== GENETIC PROGRAMMING ANALYSIS STARTED ==========
[GP] Cycle: 2
[GP] Input: 100 solutions received for analysis
[GP] Fitness range: best=2538341.00, worst=2539292.00
[GP] Analysis config: blocks=True, fft=False, similarity=False
[GP] Starting analysis...
[GP] Phase 1: Extracting building blocks...
[GP] Phase 1 complete: Found 12 building blocks
[GP] Phase 2: FFT analysis DISABLED
[GP] Phase 3: Similarity analysis DISABLED
[GP] ========== GP ANALYSIS COMPLETE ==========


[GP] ========== CANDIDATE GENERATION STARTED ==========
[GP] Generating 20 new candidate solutions
[GP] Available data: 100 top solutions, 12 building blocks, 0 FFT patterns, 0 similarity patterns
[GP] Generation strategy: 6 block-based, 6 interpolated, 8 mutated
[GP] Strategy 1: Creating 6 candidates via building block combination...
[GP] Strategy 1 complete: 6 block-based candidates created
[GP] Strategy 2: Creating 6 candidates via solution interpolation...
[GP] Strategy 2 complete: 6 interpolated candidates created
[GP] Strategy 3: Creating 8 candidates via guided mutation...
[GP] Strategy 3 complete: 8 mutated candidates created
[GP] Total candidates generated: 20
[GP] Strategy breakdown: Block=18, Interp=18, Mut=24
[GP] ========== CANDIDATE GENERATION COMPLETE ==========


*** [GPU 0] NEW GLOBAL BEST: 2522441.00 at gen 700 ***
    Saved to best_solution.json

[GPU 0] Gen   700 | Best: 2522441.00 | 65.8s
  -> 20 candidates sent to 1/1 workers
[GP] gpu_0 intermediate update: 2522441.00 at gen 700
[GPU 0] Gene injection: 20 candidates injected at gen 800 (total so far: 60)
[GP] gpu_0 intermediate update: 2485596.00 at gen 800

==================================================
GP ANALYSIS - Cycle 4
  Collected 100 solutions
==================================================

[GP] ========== GENETIC PROGRAMMING ANALYSIS STARTED ==========
[GP] Cycle: 3
[GP] Input: 100 solutions received for analysis
[GP] Fitness range: best=2484458.00, worst=2486211.00
[GP] Analysis config: blocks=True, fft=False, similarity=False
[GP] Starting analysis...
[GP] Phase 1: Extracting building blocks...

*** [GPU 0] NEW GLOBAL BEST: 2484458.00 at gen 800 ***
    Saved to best_solution.json

[GPU 0] Gen   800 | Best: 2484458.00 | 75.3s
[GP] Phase 1 complete: Found 0 building blocks
[GP] Phase 2: FFT analysis DISABLED
[GP] Phase 3: Similarity analysis DISABLED
[GP] ========== GP ANALYSIS COMPLETE ==========


[GP] ========== CANDIDATE GENERATION STARTED ==========
[GP] Generating 20 new candidate solutions
[GP] Available data: 100 top solutions, 0 building blocks, 0 FFT patterns, 0 similarity patterns
[GP] Generation strategy: 6 block-based, 6 interpolated, 8 mutated
[GP] Strategy 1: Creating 6 candidates via building block combination...
[GP] Strategy 1 complete: 6 block-based candidates created
[GP] Strategy 2: Creating 6 candidates via solution interpolation...
[GP] Strategy 2 complete: 6 interpolated candidates created
[GP] Strategy 3: Creating 8 candidates via guided mutation...
[GP] Strategy 3 complete: 8 mutated candidates created
[GP] Total candidates generated: 20
[GP] Strategy breakdown: Block=24, Interp=24, Mut=32
[GP] ========== CANDIDATE GENERATION COMPLETE ==========

  -> 20 candidates sent to 1/1 workers
[GP] gpu_0 intermediate update: 2484458.00 at gen 800

*** [GPU 0] NEW GLOBAL BEST: 2466643.00 at gen 900 ***
    Saved to best_solution.json

[GPU 0] Gen   900 | Best: 2466643.00 | 84.6s
[GP] gpu_0 intermediate update: 2466643.00 at gen 900
[GPU 0] Gene injection: 20 candidates injected at gen 1000 (total so far: 80)
[GP] gpu_0 intermediate update: 2444024.00 at gen 1000

==================================================
GP ANALYSIS - Cycle 5
  Collected 100 solutions
==================================================

[GP] ========== GENETIC PROGRAMMING ANALYSIS STARTED ==========
[GP] Cycle: 4
[GP] Input: 100 solutions received for analysis
[GP] Fitness range: best=2444024.00, worst=2444024.00
[GP] Analysis config: blocks=True, fft=False, similarity=False
[GP] Starting analysis...
[GP] Phase 1: Extracting building blocks...

*** [GPU 0] NEW GLOBAL BEST: 2444024.00 at gen 1000 ***
    Saved to best_solution.json

[GPU 0] Gen  1000 | Best: 2444024.00 | 93.9s
    [Checkpoint] Saved to ./results/cold_start/blocks_only/gr431/1R20/job_times_9_seed0_1000.json
[GP] Phase 1 complete: Found 1 building blocks
[GP] Phase 2: FFT analysis DISABLED
[GP] Phase 3: Similarity analysis DISABLED
[GP] ========== GP ANALYSIS COMPLETE ==========


[GP] ========== CANDIDATE GENERATION STARTED ==========
[GP] Generating 20 new candidate solutions
[GP] Available data: 100 top solutions, 1 building blocks, 0 FFT patterns, 0 similarity patterns
[GP] Generation strategy: 6 block-based, 6 interpolated, 8 mutated
[GP] Strategy 1: Creating 6 candidates via building block combination...
[GP] Strategy 1 complete: 6 block-based candidates created
[GP] Strategy 2: Creating 6 candidates via solution interpolation...
[GP] Strategy 2 complete: 6 interpolated candidates created
[GP] Strategy 3: Creating 8 candidates via guided mutation...
[GP] Strategy 3 complete: 8 mutated candidates created
[GP] Total candidates generated: 20
[GP] Strategy breakdown: Block=30, Interp=30, Mut=40
[GP] ========== CANDIDATE GENERATION COMPLETE ==========

  -> 20 candidates sent to 1/1 workers

[CHECKPOINT] Saved A.json at gen 1000 (makespan: 2444024.00)

*** [GPU 0] NEW GLOBAL BEST: 2422740.00 at gen 1100 ***
    Saved to best_solution.json

[GPU 0] Gen  1100 | Best: 2422740.00 | 103.1s
[GP] gpu_0 intermediate update: 2422740.00 at gen 1100
[GPU 0] Gene injection: 20 candidates injected at gen 1200 (total so far: 100)
[GP] gpu_0 intermediate update: 2410394.00 at gen 1200

==================================================
GP ANALYSIS - Cycle 6
  Collected 100 solutions
==================================================

[GP] ========== GENETIC PROGRAMMING ANALYSIS STARTED ==========
[GP] Cycle: 5
[GP] Input: 100 solutions received for analysis
[GP] Fitness range: best=2410394.00, worst=2411800.00
[GP] Analysis config: blocks=True, fft=False, similarity=False
[GP] Starting analysis...
[GP] Phase 1: Extracting building blocks...

*** [GPU 0] NEW GLOBAL BEST: 2410394.00 at gen 1200 ***
    Saved to best_solution.json

[GPU 0] Gen  1200 | Best: 2410394.00 | 112.4s
[GP] Phase 1 complete: Found 5 building blocks
[GP] Phase 2: FFT analysis DISABLED
[GP] Phase 3: Similarity analysis DISABLED
[GP] ========== GP ANALYSIS COMPLETE ==========


[GP] ========== CANDIDATE GENERATION STARTED ==========
[GP] Generating 20 new candidate solutions
[GP] Available data: 100 top solutions, 5 building blocks, 0 FFT patterns, 0 similarity patterns
[GP] Generation strategy: 6 block-based, 6 interpolated, 8 mutated
[GP] Strategy 1: Creating 6 candidates via building block combination...
[GP] Strategy 1 complete: 6 block-based candidates created
[GP] Strategy 2: Creating 6 candidates via solution interpolation...
[GP] Strategy 2 complete: 6 interpolated candidates created
[GP] Strategy 3: Creating 8 candidates via guided mutation...
[GP] Strategy 3 complete: 8 mutated candidates created
[GP] Total candidates generated: 20
[GP] Strategy breakdown: Block=36, Interp=36, Mut=48
[GP] ========== CANDIDATE GENERATION COMPLETE ==========


*** [GPU 0] NEW GLOBAL BEST: 2402528.00 at gen 1300 ***
    Saved to best_solution.json

[GPU 0] Gen  1300 | Best: 2402528.00 | 121.7s
  -> 20 candidates sent to 1/1 workers
[GP] gpu_0 intermediate update: 2402528.00 at gen 1300
[GP] gpu_0 intermediate update: 2398587.00 at gen 1400
[GPU 0] Gene injection: 20 candidates injected at gen 1400 (total so far: 120)

==================================================
GP ANALYSIS - Cycle 7
  Collected 100 solutions
==================================================

[GP] ========== GENETIC PROGRAMMING ANALYSIS STARTED ==========
[GP] Cycle: 6
[GP] Input: 100 solutions received for analysis
[GP] Fitness range: best=2398587.00, worst=2398587.00
[GP] Analysis config: blocks=True, fft=False, similarity=False
[GP] Starting analysis...
[GP] Phase 1: Extracting building blocks...

*** [GPU 0] NEW GLOBAL BEST: 2398587.00 at gen 1400 ***
    Saved to best_solution.json

[GPU 0] Gen  1400 | Best: 2398587.00 | 131.1s
[GP] Phase 1 complete: Found 30 building blocks
[GP] Phase 2: FFT analysis DISABLED
[GP] Phase 3: Similarity analysis DISABLED
[GP] ========== GP ANALYSIS COMPLETE ==========


[GP] ========== CANDIDATE GENERATION STARTED ==========
[GP] Generating 20 new candidate solutions
[GP] Available data: 100 top solutions, 30 building blocks, 0 FFT patterns, 0 similarity patterns
[GP] Generation strategy: 6 block-based, 6 interpolated, 8 mutated
[GP] Strategy 1: Creating 6 candidates via building block combination...
[GP] Strategy 1 complete: 6 block-based candidates created
[GP] Strategy 2: Creating 6 candidates via solution interpolation...
[GP] Strategy 2 complete: 6 interpolated candidates created
[GP] Strategy 3: Creating 8 candidates via guided mutation...
[GP] Strategy 3 complete: 8 mutated candidates created
[GP] Total candidates generated: 20
[GP] Strategy breakdown: Block=42, Interp=42, Mut=56
[GP] ========== CANDIDATE GENERATION COMPLETE ==========

[GPU 0] Gen  1500 | Best: 2398587.00 | 140.4s
[GPU 0] Gene injection: 20 candidates injected at gen 1600 (total so far: 140)
  -> 20 candidates sent to 1/1 workers
[GP] gpu_0 intermediate update: 2395270.00 at gen 1600

==================================================
GP ANALYSIS - Cycle 8
  Collected 100 solutions
==================================================

[GP] ========== GENETIC PROGRAMMING ANALYSIS STARTED ==========
[GP] Cycle: 7
[GP] Input: 100 solutions received for analysis
[GP] Fitness range: best=2395270.00, worst=2397464.00
[GP] Analysis config: blocks=True, fft=False, similarity=False
[GP] Starting analysis...
[GP] Phase 1: Extracting building blocks...

*** [GPU 0] NEW GLOBAL BEST: 2395270.00 at gen 1600 ***
    Saved to best_solution.json

[GPU 0] Gen  1600 | Best: 2395270.00 | 149.7s
[GP] Phase 1 complete: Found 12 building blocks
[GP] Phase 2: FFT analysis DISABLED
[GP] Phase 3: Similarity analysis DISABLED
[GP] ========== GP ANALYSIS COMPLETE ==========


[GP] ========== CANDIDATE GENERATION STARTED ==========
[GP] Generating 20 new candidate solutions
[GP] Available data: 100 top solutions, 12 building blocks, 0 FFT patterns, 0 similarity patterns
[GP] Generation strategy: 6 block-based, 6 interpolated, 8 mutated
[GP] Strategy 1: Creating 6 candidates via building block combination...
[GP] Strategy 1 complete: 6 block-based candidates created
[GP] Strategy 2: Creating 6 candidates via solution interpolation...
[GP] Strategy 2 complete: 6 interpolated candidates created
[GP] Strategy 3: Creating 8 candidates via guided mutation...
[GP] Strategy 3 complete: 8 mutated candidates created
[GP] Total candidates generated: 20
[GP] Strategy breakdown: Block=48, Interp=48, Mut=64
[GP] ========== CANDIDATE GENERATION COMPLETE ==========


*** [GPU 0] NEW GLOBAL BEST: 2378772.00 at gen 1700 ***
    Saved to best_solution.json

[GPU 0] Gen  1700 | Best: 2378772.00 | 159.0s
  -> 20 candidates sent to 1/1 workers
[GP] gpu_0 intermediate update: 2378772.00 at gen 1700
[GPU 0] Gene injection: 20 candidates injected at gen 1800 (total so far: 160)
[GP] gpu_0 intermediate update: 2372140.00 at gen 1800

==================================================
GP ANALYSIS - Cycle 9
  Collected 100 solutions
==================================================

[GP] ========== GENETIC PROGRAMMING ANALYSIS STARTED ==========
[GP] Cycle: 8
[GP] Input: 100 solutions received for analysis
[GP] Fitness range: best=2372072.00, worst=2372140.00
[GP] Analysis config: blocks=True, fft=False, similarity=False
[GP] Starting analysis...
[GP] Phase 1: Extracting building blocks...

*** [GPU 0] NEW GLOBAL BEST: 2372072.00 at gen 1800 ***
    Saved to best_solution.json

[GPU 0] Gen  1800 | Best: 2372072.00 | 168.1s
[GP] Phase 1 complete: Found 13 building blocks
[GP] Phase 2: FFT analysis DISABLED
[GP] Phase 3: Similarity analysis DISABLED
[GP] ========== GP ANALYSIS COMPLETE ==========


[GP] ========== CANDIDATE GENERATION STARTED ==========
[GP] Generating 20 new candidate solutions
[GP] Available data: 100 top solutions, 13 building blocks, 0 FFT patterns, 0 similarity patterns
[GP] Generation strategy: 6 block-based, 6 interpolated, 8 mutated
[GP] Strategy 1: Creating 6 candidates via building block combination...
[GP] Strategy 1 complete: 6 block-based candidates created
[GP] Strategy 2: Creating 6 candidates via solution interpolation...
[GP] Strategy 2 complete: 6 interpolated candidates created
[GP] Strategy 3: Creating 8 candidates via guided mutation...
[GP] Strategy 3 complete: 8 mutated candidates created
[GP] Total candidates generated: 20
[GP] Strategy breakdown: Block=54, Interp=54, Mut=72
[GP] ========== CANDIDATE GENERATION COMPLETE ==========

  -> 20 candidates sent to 1/1 workers
[GP] gpu_0 intermediate update: 2372072.00 at gen 1800

*** [GPU 0] NEW GLOBAL BEST: 2361678.00 at gen 1900 ***
    Saved to best_solution.json

[GPU 0] Gen  1900 | Best: 2361678.00 | 177.2s
[GP] gpu_0 intermediate update: 2361678.00 at gen 1900
[GPU 0] Gene injection: 20 candidates injected at gen 2000 (total so far: 180)
[GP] gpu_0 intermediate update: 2359211.00 at gen 2000

==================================================
GP ANALYSIS - Cycle 10
  Collected 100 solutions
==================================================

[GP] ========== GENETIC PROGRAMMING ANALYSIS STARTED ==========
[GP] Cycle: 9
[GP] Input: 100 solutions received for analysis
[GP] Fitness range: best=2359211.00, worst=2359211.00
[GP] Analysis config: blocks=True, fft=False, similarity=False
[GP] Starting analysis...
[GP] Phase 1: Extracting building blocks...

*** [GPU 0] NEW GLOBAL BEST: 2359211.00 at gen 2000 ***
    Saved to best_solution.json

[GPU 0] Gen  2000 | Best: 2359211.00 | 186.3s
    [Checkpoint] Saved to ./results/cold_start/blocks_only/gr431/1R20/job_times_9_seed0_2000.json
[GP] Phase 1 complete: Found 10 building blocks
[GP] Phase 2: FFT analysis DISABLED
[GP] Phase 3: Similarity analysis DISABLED
[GP] ========== GP ANALYSIS COMPLETE ==========


[GP] ========== CANDIDATE GENERATION STARTED ==========
[GP] Generating 20 new candidate solutions
[GP] Available data: 100 top solutions, 10 building blocks, 0 FFT patterns, 0 similarity patterns
[GP] Generation strategy: 6 block-based, 6 interpolated, 8 mutated
[GP] Strategy 1: Creating 6 candidates via building block combination...
[GP] Strategy 1 complete: 6 block-based candidates created
[GP] Strategy 2: Creating 6 candidates via solution interpolation...
[GP] Strategy 2 complete: 6 interpolated candidates created
[GP] Strategy 3: Creating 8 candidates via guided mutation...
[GP] Strategy 3 complete: 8 mutated candidates created
[GP] Total candidates generated: 20
[GP] Strategy breakdown: Block=60, Interp=60, Mut=80
[GP] ========== CANDIDATE GENERATION COMPLETE ==========

  -> 20 candidates sent to 1/1 workers

[CHECKPOINT] Saved B.json at gen 2000 (makespan: 2359211.00)

*** [GPU 0] NEW GLOBAL BEST: 2352294.00 at gen 2100 ***
    Saved to best_solution.json

[GPU 0] Gen  2100 | Best: 2352294.00 | 195.6s
[GP] gpu_0 intermediate update: 2352294.00 at gen 2100
[GP] gpu_0 intermediate update: 2341731.00 at gen 2200
[GPU 0] Gene injection: 20 candidates injected at gen 2200 (total so far: 200)

==================================================
GP ANALYSIS - Cycle 11
  Collected 100 solutions
==================================================

[GP] ========== GENETIC PROGRAMMING ANALYSIS STARTED ==========
[GP] Cycle: 10
[GP] Input: 100 solutions received for analysis
[GP] Fitness range: best=2341731.00, worst=2341972.00
[GP] Analysis config: blocks=True, fft=False, similarity=False
[GP] Starting analysis...
[GP] Phase 1: Extracting building blocks...

*** [GPU 0] NEW GLOBAL BEST: 2341731.00 at gen 2200 ***
    Saved to best_solution.json

[GPU 0] Gen  2200 | Best: 2341731.00 | 204.7s
[GP] Phase 1 complete: Found 0 building blocks
[GP] Phase 2: FFT analysis DISABLED
[GP] Phase 3: Similarity analysis DISABLED
[GP] ========== GP ANALYSIS COMPLETE ==========


[GP] ========== CANDIDATE GENERATION STARTED ==========
[GP] Generating 20 new candidate solutions
[GP] Available data: 100 top solutions, 0 building blocks, 0 FFT patterns, 0 similarity patterns
[GP] Generation strategy: 6 block-based, 6 interpolated, 8 mutated
[GP] Strategy 1: Creating 6 candidates via building block combination...
[GP] Strategy 1 complete: 6 block-based candidates created
[GP] Strategy 2: Creating 6 candidates via solution interpolation...
[GP] Strategy 2 complete: 6 interpolated candidates created
[GP] Strategy 3: Creating 8 candidates via guided mutation...
[GP] Strategy 3 complete: 8 mutated candidates created
[GP] Total candidates generated: 20
[GP] Strategy breakdown: Block=66, Interp=66, Mut=88
[GP] ========== CANDIDATE GENERATION COMPLETE ==========


*** [GPU 0] NEW GLOBAL BEST: 2338530.00 at gen 2300 ***
    Saved to best_solution.json

[GPU 0] Gen  2300 | Best: 2338530.00 | 213.8s
  -> 20 candidates sent to 1/1 workers
[GP] gpu_0 intermediate update: 2338530.00 at gen 2300
[GPU 0] Gene injection: 20 candidates injected at gen 2400 (total so far: 220)
[GP] gpu_0 intermediate update: 2328287.00 at gen 2400

==================================================
GP ANALYSIS - Cycle 12
  Collected 100 solutions
==================================================

[GP] ========== GENETIC PROGRAMMING ANALYSIS STARTED ==========
[GP] Cycle: 11
[GP] Input: 100 solutions received for analysis
[GP] Fitness range: best=2328287.00, worst=2328287.00
[GP] Analysis config: blocks=True, fft=False, similarity=False
[GP] Starting analysis...
[GP] Phase 1: Extracting building blocks...

*** [GPU 0] NEW GLOBAL BEST: 2328287.00 at gen 2400 ***
    Saved to best_solution.json

[GPU 0] Gen  2400 | Best: 2328287.00 | 222.9s
[GP] Phase 1 complete: Found 18 building blocks
[GP] Phase 2: FFT analysis DISABLED
[GP] Phase 3: Similarity analysis DISABLED
[GP] ========== GP ANALYSIS COMPLETE ==========


[GP] ========== CANDIDATE GENERATION STARTED ==========
[GP] Generating 20 new candidate solutions
[GP] Available data: 100 top solutions, 18 building blocks, 0 FFT patterns, 0 similarity patterns
[GP] Generation strategy: 6 block-based, 6 interpolated, 8 mutated
[GP] Strategy 1: Creating 6 candidates via building block combination...
[GP] Strategy 1 complete: 6 block-based candidates created
[GP] Strategy 2: Creating 6 candidates via solution interpolation...
[GP] Strategy 2 complete: 6 interpolated candidates created
[GP] Strategy 3: Creating 8 candidates via guided mutation...
[GP] Strategy 3 complete: 8 mutated candidates created
[GP] Total candidates generated: 20
[GP] Strategy breakdown: Block=72, Interp=72, Mut=96
[GP] ========== CANDIDATE GENERATION COMPLETE ==========


*** [GPU 0] NEW GLOBAL BEST: 2326725.00 at gen 2500 ***
    Saved to best_solution.json

[GPU 0] Gen  2500 | Best: 2326725.00 | 232.1s
  -> 20 candidates sent to 1/1 workers
[GP] gpu_0 intermediate update: 2326725.00 at gen 2500
[GP] gpu_0 intermediate update: 2321273.00 at gen 2600
[GPU 0] Gene injection: 20 candidates injected at gen 2600 (total so far: 240)

*** [GPU 0] NEW GLOBAL BEST: 2321273.00 at gen 2600 ***
    Saved to best_solution.json

[GPU 0] Gen  2600 | Best: 2321273.00 | 241.2s

==================================================
GP ANALYSIS - Cycle 13
  Collected 100 solutions
==================================================

[GP] ========== GENETIC PROGRAMMING ANALYSIS STARTED ==========
[GP] Cycle: 12
[GP] Input: 100 solutions received for analysis
[GP] Fitness range: best=2321273.00, worst=2321273.00
[GP] Analysis config: blocks=True, fft=False, similarity=False
[GP] Starting analysis...
[GP] Phase 1: Extracting building blocks...
[GP] Phase 1 complete: Found 0 building blocks
[GP] Phase 2: FFT analysis DISABLED
[GP] Phase 3: Similarity analysis DISABLED
[GP] ========== GP ANALYSIS COMPLETE ==========


[GP] ========== CANDIDATE GENERATION STARTED ==========
[GP] Generating 20 new candidate solutions
[GP] Available data: 100 top solutions, 0 building blocks, 0 FFT patterns, 0 similarity patterns
[GP] Generation strategy: 6 block-based, 6 interpolated, 8 mutated
[GP] Strategy 1: Creating 6 candidates via building block combination...
[GP] Strategy 1 complete: 6 block-based candidates created
[GP] Strategy 2: Creating 6 candidates via solution interpolation...
[GP] Strategy 2 complete: 6 interpolated candidates created
[GP] Strategy 3: Creating 8 candidates via guided mutation...
[GP] Strategy 3 complete: 8 mutated candidates created
[GP] Total candidates generated: 20
[GP] Strategy breakdown: Block=78, Interp=78, Mut=104
[GP] ========== CANDIDATE GENERATION COMPLETE ==========


*** [GPU 0] NEW GLOBAL BEST: 2311881.00 at gen 2700 ***
    Saved to best_solution.json

[GPU 0] Gen  2700 | Best: 2311881.00 | 250.4s
  -> 20 candidates sent to 1/1 workers
[GP] gpu_0 intermediate update: 2311881.00 at gen 2700
[GPU 0] Gene injection: 20 candidates injected at gen 2800 (total so far: 260)
[GP] gpu_0 intermediate update: 2303465.00 at gen 2800

==================================================
GP ANALYSIS - Cycle 14
  Collected 100 solutions
==================================================

[GP] ========== GENETIC PROGRAMMING ANALYSIS STARTED ==========
[GP] Cycle: 13
[GP] Input: 100 solutions received for analysis
[GP] Fitness range: best=2303465.00, worst=2303465.00
[GP] Analysis config: blocks=True, fft=False, similarity=False
[GP] Starting analysis...
[GP] Phase 1: Extracting building blocks...

*** [GPU 0] NEW GLOBAL BEST: 2303465.00 at gen 2800 ***
    Saved to best_solution.json

[GPU 0] Gen  2800 | Best: 2303465.00 | 259.4s
[GP] Phase 1 complete: Found 3 building blocks
[GP] Phase 2: FFT analysis DISABLED
[GP] Phase 3: Similarity analysis DISABLED
[GP] ========== GP ANALYSIS COMPLETE ==========


[GP] ========== CANDIDATE GENERATION STARTED ==========
[GP] Generating 20 new candidate solutions
[GP] Available data: 100 top solutions, 3 building blocks, 0 FFT patterns, 0 similarity patterns
[GP] Generation strategy: 6 block-based, 6 interpolated, 8 mutated
[GP] Strategy 1: Creating 6 candidates via building block combination...
[GP] Strategy 1 complete: 6 block-based candidates created
[GP] Strategy 2: Creating 6 candidates via solution interpolation...
[GP] Strategy 2 complete: 6 interpolated candidates created
[GP] Strategy 3: Creating 8 candidates via guided mutation...
[GP] Strategy 3 complete: 8 mutated candidates created
[GP] Total candidates generated: 20
[GP] Strategy breakdown: Block=84, Interp=84, Mut=112
[GP] ========== CANDIDATE GENERATION COMPLETE ==========


*** [GPU 0] NEW GLOBAL BEST: 2298665.00 at gen 2900 ***
    Saved to best_solution.json

[GPU 0] Gen  2900 | Best: 2298665.00 | 268.5s
  -> 20 candidates sent to 1/1 workers
[GP] gpu_0 intermediate update: 2298665.00 at gen 2900
[GPU 0] Gene injection: 20 candidates injected at gen 3000 (total so far: 280)
[GP] gpu_0 intermediate update: 2284231.00 at gen 3000

==================================================
GP ANALYSIS - Cycle 15
  Collected 100 solutions
==================================================

[GP] ========== GENETIC PROGRAMMING ANALYSIS STARTED ==========
[GP] Cycle: 14
[GP] Input: 100 solutions received for analysis
[GP] Fitness range: best=2284231.00, worst=2286081.00
[GP] Analysis config: blocks=True, fft=False, similarity=False
[GP] Starting analysis...
[GP] Phase 1: Extracting building blocks...

*** [GPU 0] NEW GLOBAL BEST: 2284231.00 at gen 3000 ***
    Saved to best_solution.json

[GPU 0] Gen  3000 | Best: 2284231.00 | 277.7s
    [Checkpoint] Saved to ./results/cold_start/blocks_only/gr431/1R20/job_times_9_seed0_3000.json
[GP] Phase 1 complete: Found 0 building blocks
[GP] Phase 2: FFT analysis DISABLED
[GP] Phase 3: Similarity analysis DISABLED
[GP] ========== GP ANALYSIS COMPLETE ==========


[GP] ========== CANDIDATE GENERATION STARTED ==========
[GP] Generating 20 new candidate solutions
[GP] Available data: 100 top solutions, 0 building blocks, 0 FFT patterns, 0 similarity patterns
[GP] Generation strategy: 6 block-based, 6 interpolated, 8 mutated
[GP] Strategy 1: Creating 6 candidates via building block combination...
[GP] Strategy 1 complete: 6 block-based candidates created
[GP] Strategy 2: Creating 6 candidates via solution interpolation...
[GP] Strategy 2 complete: 6 interpolated candidates created
[GP] Strategy 3: Creating 8 candidates via guided mutation...
[GP] Strategy 3 complete: 8 mutated candidates created
[GP] Total candidates generated: 20
[GP] Strategy breakdown: Block=90, Interp=90, Mut=120
[GP] ========== CANDIDATE GENERATION COMPLETE ==========

  -> 20 candidates sent to 1/1 workers

[CHECKPOINT] Saved C.json at gen 3000 (makespan: 2284231.00)

*** [GPU 0] NEW GLOBAL BEST: 2272375.00 at gen 3100 ***
    Saved to best_solution.json

[GPU 0] Gen  3100 | Best: 2272375.00 | 286.9s
[GP] gpu_0 intermediate update: 2272375.00 at gen 3100
[GPU 0] Gene injection: 20 candidates injected at gen 3200 (total so far: 300)
[GP] gpu_0 intermediate update: 2269073.00 at gen 3200

==================================================
GP ANALYSIS - Cycle 16
  Collected 100 solutions
==================================================

[GP] ========== GENETIC PROGRAMMING ANALYSIS STARTED ==========
[GP] Cycle: 15
[GP] Input: 100 solutions received for analysis
[GP] Fitness range: best=2269073.00, worst=2272124.00
[GP] Analysis config: blocks=True, fft=False, similarity=False
[GP] Starting analysis...
[GP] Phase 1: Extracting building blocks...

*** [GPU 0] NEW GLOBAL BEST: 2269073.00 at gen 3200 ***
    Saved to best_solution.json

[GPU 0] Gen  3200 | Best: 2269073.00 | 295.9s
[GP] Phase 1 complete: Found 0 building blocks
[GP] Phase 2: FFT analysis DISABLED
[GP] Phase 3: Similarity analysis DISABLED
[GP] ========== GP ANALYSIS COMPLETE ==========


[GP] ========== CANDIDATE GENERATION STARTED ==========
[GP] Generating 20 new candidate solutions
[GP] Available data: 100 top solutions, 0 building blocks, 0 FFT patterns, 0 similarity patterns
[GP] Generation strategy: 6 block-based, 6 interpolated, 8 mutated
[GP] Strategy 1: Creating 6 candidates via building block combination...
[GP] Strategy 1 complete: 6 block-based candidates created
[GP] Strategy 2: Creating 6 candidates via solution interpolation...
[GP] Strategy 2 complete: 6 interpolated candidates created
[GP] Strategy 3: Creating 8 candidates via guided mutation...
[GP] Strategy 3 complete: 8 mutated candidates created
[GP] Total candidates generated: 20
[GP] Strategy breakdown: Block=96, Interp=96, Mut=128
[GP] ========== CANDIDATE GENERATION COMPLETE ==========


*** [GPU 0] NEW GLOBAL BEST: 2261136.00 at gen 3300 ***
    Saved to best_solution.json

[GPU 0] Gen  3300 | Best: 2261136.00 | 304.9s
  -> 20 candidates sent to 1/1 workers
[GP] gpu_0 intermediate update: 2261136.00 at gen 3300
[GPU 0] Gene injection: 20 candidates injected at gen 3400 (total so far: 320)
[GP] gpu_0 intermediate update: 2259661.00 at gen 3400

==================================================
GP ANALYSIS - Cycle 17
  Collected 100 solutions
==================================================

[GP] ========== GENETIC PROGRAMMING ANALYSIS STARTED ==========
[GP] Cycle: 16
[GP] Input: 100 solutions received for analysis
[GP] Fitness range: best=2259661.00, worst=2259661.00
[GP] Analysis config: blocks=True, fft=False, similarity=False
[GP] Starting analysis...
[GP] Phase 1: Extracting building blocks...

*** [GPU 0] NEW GLOBAL BEST: 2259661.00 at gen 3400 ***
    Saved to best_solution.json

[GPU 0] Gen  3400 | Best: 2259661.00 | 314.1s
[GP] Phase 1 complete: Found 21 building blocks
[GP] Phase 2: FFT analysis DISABLED
[GP] Phase 3: Similarity analysis DISABLED
[GP] ========== GP ANALYSIS COMPLETE ==========


[GP] ========== CANDIDATE GENERATION STARTED ==========
[GP] Generating 20 new candidate solutions
[GP] Available data: 100 top solutions, 21 building blocks, 0 FFT patterns, 0 similarity patterns
[GP] Generation strategy: 6 block-based, 6 interpolated, 8 mutated
[GP] Strategy 1: Creating 6 candidates via building block combination...
[GP] Strategy 1 complete: 6 block-based candidates created
[GP] Strategy 2: Creating 6 candidates via solution interpolation...
[GP] Strategy 2 complete: 6 interpolated candidates created
[GP] Strategy 3: Creating 8 candidates via guided mutation...
[GP] Strategy 3 complete: 8 mutated candidates created
[GP] Total candidates generated: 20
[GP] Strategy breakdown: Block=102, Interp=102, Mut=136
[GP] ========== CANDIDATE GENERATION COMPLETE ==========

[GPU 0] Gen  3500 | Best: 2259661.00 | 323.3s
[GPU 0] Gene injection: 20 candidates injected at gen 3600 (total so far: 340)
  -> 20 candidates sent to 1/1 workers

==================================================
GP ANALYSIS - Cycle 18
  Collected 100 solutions
==================================================

[GP] ========== GENETIC PROGRAMMING ANALYSIS STARTED ==========
[GP] Cycle: 17
[GP] Input: 100 solutions received for analysis
[GP] Fitness range: best=2259661.00, worst=2259661.00
[GP] Analysis config: blocks=True, fft=False, similarity=False
[GP] Starting analysis...
[GP] Phase 1: Extracting building blocks...
[GPU 0] Gen  3600 | Best: 2259661.00 | 332.4s
[GP] Phase 1 complete: Found 21 building blocks
[GP] Phase 2: FFT analysis DISABLED
[GP] Phase 3: Similarity analysis DISABLED
[GP] ========== GP ANALYSIS COMPLETE ==========


[GP] ========== CANDIDATE GENERATION STARTED ==========
[GP] Generating 20 new candidate solutions
[GP] Available data: 100 top solutions, 21 building blocks, 0 FFT patterns, 0 similarity patterns
[GP] Generation strategy: 6 block-based, 6 interpolated, 8 mutated
[GP] Strategy 1: Creating 6 candidates via building block combination...
[GP] Strategy 1 complete: 6 block-based candidates created
[GP] Strategy 2: Creating 6 candidates via solution interpolation...
[GP] Strategy 2 complete: 6 interpolated candidates created
[GP] Strategy 3: Creating 8 candidates via guided mutation...
[GP] Strategy 3 complete: 8 mutated candidates created
[GP] Total candidates generated: 20
[GP] Strategy breakdown: Block=108, Interp=108, Mut=144
[GP] ========== CANDIDATE GENERATION COMPLETE ==========

[GPU 0] Gen  3700 | Best: 2259661.00 | 341.5s
[GPU 0] Gene injection: 20 candidates injected at gen 3800 (total so far: 360)
  -> 20 candidates sent to 1/1 workers
[GP] gpu_0 intermediate update: 2253829.00 at gen 3800

==================================================
GP ANALYSIS - Cycle 19
  Collected 100 solutions
==================================================

[GP] ========== GENETIC PROGRAMMING ANALYSIS STARTED ==========
[GP] Cycle: 18
[GP] Input: 100 solutions received for analysis
[GP] Fitness range: best=2253197.00, worst=2254503.00
[GP] Analysis config: blocks=True, fft=False, similarity=False
[GP] Starting analysis...
[GP] Phase 1: Extracting building blocks...

*** [GPU 0] NEW GLOBAL BEST: 2253197.00 at gen 3800 ***
    Saved to best_solution.json

[GPU 0] Gen  3800 | Best: 2253197.00 | 350.8s
[GP] Phase 1 complete: Found 25 building blocks
[GP] Phase 2: FFT analysis DISABLED
[GP] Phase 3: Similarity analysis DISABLED
[GP] ========== GP ANALYSIS COMPLETE ==========


[GP] ========== CANDIDATE GENERATION STARTED ==========
[GP] Generating 20 new candidate solutions
[GP] Available data: 100 top solutions, 25 building blocks, 0 FFT patterns, 0 similarity patterns
[GP] Generation strategy: 6 block-based, 6 interpolated, 8 mutated
[GP] Strategy 1: Creating 6 candidates via building block combination...
[GP] Strategy 1 complete: 6 block-based candidates created
[GP] Strategy 2: Creating 6 candidates via solution interpolation...
[GP] Strategy 2 complete: 6 interpolated candidates created
[GP] Strategy 3: Creating 8 candidates via guided mutation...
[GP] Strategy 3 complete: 8 mutated candidates created
[GP] Total candidates generated: 20
[GP] Strategy breakdown: Block=114, Interp=114, Mut=152
[GP] ========== CANDIDATE GENERATION COMPLETE ==========

  -> 20 candidates sent to 1/1 workers
[GP] gpu_0 intermediate update: 2253197.00 at gen 3800

*** [GPU 0] NEW GLOBAL BEST: 2247938.00 at gen 3900 ***
    Saved to best_solution.json

[GPU 0] Gen  3900 | Best: 2247938.00 | 359.9s
[GP] gpu_0 intermediate update: 2247938.00 at gen 3900
[GPU 0] Gene injection: 20 candidates injected at gen 4000 (total so far: 380)
[GP] gpu_0 intermediate update: 2239102.00 at gen 4000

==================================================
GP ANALYSIS - Cycle 20
  Collected 100 solutions
==================================================

[GP] ========== GENETIC PROGRAMMING ANALYSIS STARTED ==========
[GP] Cycle: 19
[GP] Input: 100 solutions received for analysis
[GP] Fitness range: best=2239102.00, worst=2239102.00
[GP] Analysis config: blocks=True, fft=False, similarity=False
[GP] Starting analysis...
[GP] Phase 1: Extracting building blocks...

*** [GPU 0] NEW GLOBAL BEST: 2239102.00 at gen 4000 ***
    Saved to best_solution.json

[GPU 0] Gen  4000 | Best: 2239102.00 | 369.0s
    [Checkpoint] Saved to ./results/cold_start/blocks_only/gr431/1R20/job_times_9_seed0_4000.json
[GP] Phase 1 complete: Found 0 building blocks
[GP] Phase 2: FFT analysis DISABLED
[GP] Phase 3: Similarity analysis DISABLED
[GP] ========== GP ANALYSIS COMPLETE ==========


[GP] ========== CANDIDATE GENERATION STARTED ==========
[GP] Generating 20 new candidate solutions
[GP] Available data: 100 top solutions, 0 building blocks, 0 FFT patterns, 0 similarity patterns
[GP] Generation strategy: 6 block-based, 6 interpolated, 8 mutated
[GP] Strategy 1: Creating 6 candidates via building block combination...
[GP] Strategy 1 complete: 6 block-based candidates created
[GP] Strategy 2: Creating 6 candidates via solution interpolation...
[GP] Strategy 2 complete: 6 interpolated candidates created
[GP] Strategy 3: Creating 8 candidates via guided mutation...
[GP] Strategy 3 complete: 8 mutated candidates created
[GP] Total candidates generated: 20
[GP] Strategy breakdown: Block=120, Interp=120, Mut=160
[GP] ========== CANDIDATE GENERATION COMPLETE ==========

  -> 20 candidates sent to 1/1 workers

[CHECKPOINT] Saved D.json at gen 4000 (makespan: 2239102.00)

*** [GPU 0] NEW GLOBAL BEST: 2235318.00 at gen 4100 ***
    Saved to best_solution.json

[GPU 0] Gen  4100 | Best: 2235318.00 | 378.1s
[GP] gpu_0 intermediate update: 2235318.00 at gen 4100
[GP] gpu_0 intermediate update: 2230364.00 at gen 4200
[GPU 0] Gene injection: 20 candidates injected at gen 4200 (total so far: 400)

*** [GPU 0] NEW GLOBAL BEST: 2230364.00 at gen 4200 ***
    Saved to best_solution.json

[GPU 0] Gen  4200 | Best: 2230364.00 | 387.2s

==================================================
GP ANALYSIS - Cycle 21
  Collected 100 solutions
==================================================

[GP] ========== GENETIC PROGRAMMING ANALYSIS STARTED ==========
[GP] Cycle: 20
[GP] Input: 100 solutions received for analysis
[GP] Fitness range: best=2230364.00, worst=2230364.00
[GP] Analysis config: blocks=True, fft=False, similarity=False
[GP] Starting analysis...
[GP] Phase 1: Extracting building blocks...
[GP] Phase 1 complete: Found 0 building blocks
[GP] Phase 2: FFT analysis DISABLED
[GP] Phase 3: Similarity analysis DISABLED
[GP] ========== GP ANALYSIS COMPLETE ==========


[GP] ========== CANDIDATE GENERATION STARTED ==========
[GP] Generating 20 new candidate solutions
[GP] Available data: 100 top solutions, 0 building blocks, 0 FFT patterns, 0 similarity patterns
[GP] Generation strategy: 6 block-based, 6 interpolated, 8 mutated
[GP] Strategy 1: Creating 6 candidates via building block combination...
[GP] Strategy 1 complete: 6 block-based candidates created
[GP] Strategy 2: Creating 6 candidates via solution interpolation...
[GP] Strategy 2 complete: 6 interpolated candidates created
[GP] Strategy 3: Creating 8 candidates via guided mutation...
[GP] Strategy 3 complete: 8 mutated candidates created
[GP] Total candidates generated: 20
[GP] Strategy breakdown: Block=126, Interp=126, Mut=168
[GP] ========== CANDIDATE GENERATION COMPLETE ==========


*** [GPU 0] NEW GLOBAL BEST: 2226666.00 at gen 4300 ***
    Saved to best_solution.json

[GPU 0] Gen  4300 | Best: 2226666.00 | 396.3s
  -> 20 candidates sent to 1/1 workers
[GP] gpu_0 intermediate update: 2226666.00 at gen 4300
[GPU 0] Gene injection: 20 candidates injected at gen 4400 (total so far: 420)
[GP] gpu_0 intermediate update: 2224659.00 at gen 4400

==================================================
GP ANALYSIS - Cycle 22
  Collected 100 solutions
==================================================

[GP] ========== GENETIC PROGRAMMING ANALYSIS STARTED ==========
[GP] Cycle: 21
[GP] Input: 100 solutions received for analysis
[GP] Fitness range: best=2224659.00, worst=2224659.00
[GP] Analysis config: blocks=True, fft=False, similarity=False
[GP] Starting analysis...
[GP] Phase 1: Extracting building blocks...

*** [GPU 0] NEW GLOBAL BEST: 2224659.00 at gen 4400 ***
    Saved to best_solution.json

[GPU 0] Gen  4400 | Best: 2224659.00 | 405.6s
[GP] Phase 1 complete: Found 3 building blocks
[GP] Phase 2: FFT analysis DISABLED
[GP] Phase 3: Similarity analysis DISABLED
[GP] ========== GP ANALYSIS COMPLETE ==========


[GP] ========== CANDIDATE GENERATION STARTED ==========
[GP] Generating 20 new candidate solutions
[GP] Available data: 100 top solutions, 3 building blocks, 0 FFT patterns, 0 similarity patterns
[GP] Generation strategy: 6 block-based, 6 interpolated, 8 mutated
[GP] Strategy 1: Creating 6 candidates via building block combination...
[GP] Strategy 1 complete: 6 block-based candidates created
[GP] Strategy 2: Creating 6 candidates via solution interpolation...
[GP] Strategy 2 complete: 6 interpolated candidates created
[GP] Strategy 3: Creating 8 candidates via guided mutation...
[GP] Strategy 3 complete: 8 mutated candidates created
[GP] Total candidates generated: 20
[GP] Strategy breakdown: Block=132, Interp=132, Mut=176
[GP] ========== CANDIDATE GENERATION COMPLETE ==========


*** [GPU 0] NEW GLOBAL BEST: 2222760.00 at gen 4500 ***
    Saved to best_solution.json

[GPU 0] Gen  4500 | Best: 2222760.00 | 414.9s
  -> 20 candidates sent to 1/1 workers
[GP] gpu_0 intermediate update: 2222760.00 at gen 4500
[GP] gpu_0 intermediate update: 2221799.00 at gen 4600
[GPU 0] Gene injection: 20 candidates injected at gen 4600 (total so far: 440)

*** [GPU 0] NEW GLOBAL BEST: 2221799.00 at gen 4600 ***
    Saved to best_solution.json

[GPU 0] Gen  4600 | Best: 2221799.00 | 424.0s

==================================================
GP ANALYSIS - Cycle 23
  Collected 100 solutions
==================================================

[GP] ========== GENETIC PROGRAMMING ANALYSIS STARTED ==========
[GP] Cycle: 22
[GP] Input: 100 solutions received for analysis
[GP] Fitness range: best=2221799.00, worst=2221799.00
[GP] Analysis config: blocks=True, fft=False, similarity=False
[GP] Starting analysis...
[GP] Phase 1: Extracting building blocks...
[GP] Phase 1 complete: Found 9 building blocks
[GP] Phase 2: FFT analysis DISABLED
[GP] Phase 3: Similarity analysis DISABLED
[GP] ========== GP ANALYSIS COMPLETE ==========


[GP] ========== CANDIDATE GENERATION STARTED ==========
[GP] Generating 20 new candidate solutions
[GP] Available data: 100 top solutions, 9 building blocks, 0 FFT patterns, 0 similarity patterns
[GP] Generation strategy: 6 block-based, 6 interpolated, 8 mutated
[GP] Strategy 1: Creating 6 candidates via building block combination...
[GP] Strategy 1 complete: 6 block-based candidates created
[GP] Strategy 2: Creating 6 candidates via solution interpolation...
[GP] Strategy 2 complete: 6 interpolated candidates created
[GP] Strategy 3: Creating 8 candidates via guided mutation...
[GP] Strategy 3 complete: 8 mutated candidates created
[GP] Total candidates generated: 20
[GP] Strategy breakdown: Block=138, Interp=138, Mut=184
[GP] ========== CANDIDATE GENERATION COMPLETE ==========


*** [GPU 0] NEW GLOBAL BEST: 2220585.00 at gen 4700 ***
    Saved to best_solution.json

[GPU 0] Gen  4700 | Best: 2220585.00 | 433.2s
  -> 20 candidates sent to 1/1 workers
[GP] gpu_0 intermediate update: 2220585.00 at gen 4700
[GPU 0] Gene injection: 20 candidates injected at gen 4800 (total so far: 460)
[GP] gpu_0 intermediate update: 2217831.00 at gen 4800

==================================================
GP ANALYSIS - Cycle 24
  Collected 100 solutions
==================================================

[GP] ========== GENETIC PROGRAMMING ANALYSIS STARTED ==========
[GP] Cycle: 23
[GP] Input: 100 solutions received for analysis
[GP] Fitness range: best=2217831.00, worst=2217831.00
[GP] Analysis config: blocks=True, fft=False, similarity=False
[GP] Starting analysis...
[GP] Phase 1: Extracting building blocks...

*** [GPU 0] NEW GLOBAL BEST: 2217831.00 at gen 4800 ***
    Saved to best_solution.json

[GPU 0] Gen  4800 | Best: 2217831.00 | 442.6s
[GP] Phase 1 complete: Found 26 building blocks
[GP] Phase 2: FFT analysis DISABLED
[GP] Phase 3: Similarity analysis DISABLED
[GP] ========== GP ANALYSIS COMPLETE ==========


[GP] ========== CANDIDATE GENERATION STARTED ==========
[GP] Generating 20 new candidate solutions
[GP] Available data: 100 top solutions, 26 building blocks, 0 FFT patterns, 0 similarity patterns
[GP] Generation strategy: 6 block-based, 6 interpolated, 8 mutated
[GP] Strategy 1: Creating 6 candidates via building block combination...
[GP] Strategy 1 complete: 6 block-based candidates created
[GP] Strategy 2: Creating 6 candidates via solution interpolation...
[GP] Strategy 2 complete: 6 interpolated candidates created
[GP] Strategy 3: Creating 8 candidates via guided mutation...
[GP] Strategy 3 complete: 8 mutated candidates created
[GP] Total candidates generated: 20
[GP] Strategy breakdown: Block=144, Interp=144, Mut=192
[GP] ========== CANDIDATE GENERATION COMPLETE ==========


*** [GPU 0] NEW GLOBAL BEST: 2216220.00 at gen 4900 ***
    Saved to best_solution.json

[GPU 0] Gen  4900 | Best: 2216220.00 | 452.0s
  -> 20 candidates sent to 1/1 workers
[GP] gpu_0 intermediate update: 2216220.00 at gen 4900
[GPU 0] Gene injection: 20 candidates injected at gen 5000 (total so far: 480)
[GPU 0] Evolution complete. Sending final results...
[GP] gpu_0 intermediate update: 2214293.00 at gen 5000
[GP] Worker finished: gpu_0 (best=2214293.00)

==================================================
GP ANALYSIS - Cycle 25
  Collected 100 solutions
==================================================

[GP] ========== GENETIC PROGRAMMING ANALYSIS STARTED ==========
[GP] Cycle: 24
[GP] Input: 100 solutions received for analysis
[GP] Fitness range: best=2214293.00, worst=2214293.00
[GP] Analysis config: blocks=True, fft=False, similarity=False
[GP] Starting analysis...
[GP] Phase 1: Extracting building blocks...
[GP] Phase 1 complete: Found 13 building blocks
[GP] Phase 2: FFT analysis DISABLED
[GP] Phase 3: Similarity analysis DISABLED
[GP] ========== GP ANALYSIS COMPLETE ==========


[GP] ========== CANDIDATE GENERATION STARTED ==========
[GP] Generating 20 new candidate solutions
[GP] Available data: 100 top solutions, 13 building blocks, 0 FFT patterns, 0 similarity patterns
[GP] Generation strategy: 6 block-based, 6 interpolated, 8 mutated
[GP] Strategy 1: Creating 6 candidates via building block combination...
[GP] Strategy 1 complete: 6 block-based candidates created
[GP] Strategy 2: Creating 6 candidates via solution interpolation...
[GP] Strategy 2 complete: 6 interpolated candidates created
[GP] Strategy 3: Creating 8 candidates via guided mutation...
[GP] Strategy 3 complete: 8 mutated candidates created
[GP] Total candidates generated: 20
[GP] Strategy breakdown: Block=150, Interp=150, Mut=200
[GP] ========== CANDIDATE GENERATION COMPLETE ==========

  -> 20 candidates sent to 1/1 workers

[CHECKPOINT] Saved E.json at gen 5000 (makespan: 2214293.00)

[GP] All workers finished. Total GP cycles: 25

[Final Collection] Have 1/1 workers. Waiting up to 120s for remaining...

[Critical] Attempting final result collection before terminating workers...

[Results Summary] Collected 1 results:
  gpu_0: fitness=2214293.00, intermediate=False, gen=final

======================================================================
COMPLETE
======================================================================
Best: 2214293.00 from gpu_0
Time: 463.5s
Total candidates injected: 480

Solution JSON saved to ./results/cold_start/blocks_only/gr431/1R20/job_times_9_seed0.json
HTML Gantt chart saved to: ./results/cold_start/blocks_only/gr431/1R20/job_times_9_seed0.html
