Setting random seed to 0
DEBUG: proc shape: (783,), agents: 6, resources: 4, n: 783

======================================================================
VRP-RPD SOLVER
======================================================================
Problem: 782 customers, 6 agents, k=4
Heuristic: None
Genetic Programming: Yes
Warm Start: No
Gene Injection: Yes
Workers: 1 GPU + 0 CPU
Generations: 5000
======================================================================


[GP] Starting GP collection loop (timeout: 12975s)...

*** [GPU 0] NEW GLOBAL BEST: 256368.00 at gen 0 ***
    Saved to best_solution.json

[GPU 0] Gen     0 | Best: 256368.00 | 0.4s
[GP] gpu_0 first intermediate: 256368.00 at gen 0

*** [GPU 0] NEW GLOBAL BEST: 173784.00 at gen 100 ***
    Saved to best_solution.json

[GPU 0] Gen   100 | Best: 173784.00 | 11.2s
[GP] gpu_0 intermediate update: 173784.00 at gen 100
[GP] gpu_0 intermediate update: 157494.00 at gen 200

*** [GPU 0] NEW GLOBAL BEST: 157494.00 at gen 200 ***
    Saved to best_solution.json

[GPU 0] Gen   200 | Best: 157494.00 | 23.0s

*** [GPU 0] NEW GLOBAL BEST: 153220.00 at gen 300 ***
    Saved to best_solution.json

[GPU 0] Gen   300 | Best: 153220.00 | 34.2s
[GP] gpu_0 intermediate update: 153220.00 at gen 300
[GP] gpu_0 intermediate update: 149926.00 at gen 400

==================================================
GP ANALYSIS - Cycle 1
  Collected 40 solutions
==================================================

[GP] ========== GENETIC PROGRAMMING ANALYSIS STARTED ==========
[GP] Cycle: 0
[GP] Input: 40 solutions received for analysis
[GP] Fitness range: best=149867.00, worst=157637.00
[GP] Analysis config: blocks=True, fft=False, similarity=False
[GP] Starting analysis...
[GP] Phase 1: Extracting building blocks...

*** [GPU 0] NEW GLOBAL BEST: 149867.00 at gen 400 ***
    Saved to best_solution.json

[GPU 0] Gen   400 | Best: 149867.00 | 46.0s
[GP] Phase 1 complete: Found 30 building blocks
[GP] Phase 2: FFT analysis DISABLED
[GP] Phase 3: Similarity analysis DISABLED
[GP] ========== GP ANALYSIS COMPLETE ==========


[GP] ========== CANDIDATE GENERATION STARTED ==========
[GP] Generating 20 new candidate solutions
[GP] Available data: 40 top solutions, 30 building blocks, 0 FFT patterns, 0 similarity patterns
[GP] Generation strategy: 6 block-based, 6 interpolated, 8 mutated
[GP] Strategy 1: Creating 6 candidates via building block combination...
[GP] Strategy 1 complete: 6 block-based candidates created
[GP] Strategy 2: Creating 6 candidates via solution interpolation...
[GP] Strategy 2 complete: 6 interpolated candidates created
[GP] Strategy 3: Creating 8 candidates via guided mutation...
[GP] Strategy 3 complete: 8 mutated candidates created
[GP] Total candidates generated: 20
[GP] Strategy breakdown: Block=6, Interp=6, Mut=8
[GP] ========== CANDIDATE GENERATION COMPLETE ==========


*** [GPU 0] NEW GLOBAL BEST: 147036.00 at gen 500 ***
    Saved to best_solution.json

[GPU 0] Gen   500 | Best: 147036.00 | 57.7s
[GPU 0] Gene injection: 20 candidates injected at gen 600 (total so far: 20)

*** [GPU 0] NEW GLOBAL BEST: 144472.00 at gen 600 ***
    Saved to best_solution.json

[GPU 0] Gen   600 | Best: 144472.00 | 69.4s
  -> 20 candidates sent to 1/1 workers
[GP] gpu_0 intermediate update: 149867.00 at gen 400
[GP] gpu_0 intermediate update: 147036.00 at gen 500
[GP] gpu_0 intermediate update: 144795.00 at gen 600
[GP] gpu_0 intermediate update: 144472.00 at gen 600

*** [GPU 0] NEW GLOBAL BEST: 142245.00 at gen 700 ***
    Saved to best_solution.json

[GPU 0] Gen   700 | Best: 142245.00 | 80.7s
[GP] gpu_0 intermediate update: 142245.00 at gen 700
[GP] gpu_0 intermediate update: 141017.00 at gen 800

==================================================
GP ANALYSIS - Cycle 2
  Collected 40 solutions
==================================================

[GP] ========== GENETIC PROGRAMMING ANALYSIS STARTED ==========
[GP] Cycle: 1
[GP] Input: 40 solutions received for analysis
[GP] Fitness range: best=140998.00, worst=144805.00
[GP] Analysis config: blocks=True, fft=False, similarity=False
[GP] Starting analysis...
[GP] Phase 1: Extracting building blocks...
[GP] Phase 1 complete: Found 30 building blocks
[GP] Phase 2: FFT analysis DISABLED
[GP] Phase 3: Similarity analysis DISABLED
[GP] ========== GP ANALYSIS COMPLETE ==========


[GP] ========== CANDIDATE GENERATION STARTED ==========
[GP] Generating 20 new candidate solutions
[GP] Available data: 40 top solutions, 30 building blocks, 0 FFT patterns, 0 similarity patterns
[GP] Generation strategy: 6 block-based, 6 interpolated, 8 mutated
[GP] Strategy 1: Creating 6 candidates via building block combination...
[GP] Strategy 1 complete: 6 block-based candidates created
[GP] Strategy 2: Creating 6 candidates via solution interpolation...
[GP] Strategy 2 complete: 6 interpolated candidates created
[GP] Strategy 3: Creating 8 candidates via guided mutation...
[GP] Strategy 3 complete: 8 mutated candidates created
[GP] Total candidates generated: 20
[GP] Strategy breakdown: Block=12, Interp=12, Mut=16
[GP] ========== CANDIDATE GENERATION COMPLETE ==========


*** [GPU 0] NEW GLOBAL BEST: 140998.00 at gen 800 ***
    Saved to best_solution.json

[GPU 0] Gen   800 | Best: 140998.00 | 92.1s

*** [GPU 0] NEW GLOBAL BEST: 140138.00 at gen 900 ***
    Saved to best_solution.json

[GPU 0] Gen   900 | Best: 140138.00 | 103.6s
[GPU 0] Gene injection: 20 candidates injected at gen 1000 (total so far: 40)
  -> 20 candidates sent to 1/1 workers
[GP] gpu_0 intermediate update: 140998.00 at gen 800
[GP] gpu_0 intermediate update: 140138.00 at gen 900
[GP] gpu_0 intermediate update: 138353.00 at gen 1000

*** [GPU 0] NEW GLOBAL BEST: 138353.00 at gen 1000 ***
    Saved to best_solution.json

[GPU 0] Gen  1000 | Best: 138353.00 | 114.9s
    [Checkpoint] Saved to ./results/cold_start/blocks_only/rat783/1R20/job_times_2_seed0_1000.json

*** [GPU 0] NEW GLOBAL BEST: 137046.00 at gen 1100 ***
    Saved to best_solution.json

[GPU 0] Gen  1100 | Best: 137046.00 | 126.3s
[GP] gpu_0 intermediate update: 137046.00 at gen 1100
[GP] gpu_0 intermediate update: 136094.00 at gen 1200

==================================================
GP ANALYSIS - Cycle 3
  Collected 40 solutions
==================================================

[GP] ========== GENETIC PROGRAMMING ANALYSIS STARTED ==========
[GP] Cycle: 2
[GP] Input: 40 solutions received for analysis
[GP] Fitness range: best=136094.00, worst=138353.00
[GP] Analysis config: blocks=True, fft=False, similarity=False
[GP] Starting analysis...
[GP] Phase 1: Extracting building blocks...

*** [GPU 0] NEW GLOBAL BEST: 136094.00 at gen 1200 ***
    Saved to best_solution.json

[GPU 0] Gen  1200 | Best: 136094.00 | 137.8s
[GP] Phase 1 complete: Found 30 building blocks
[GP] Phase 2: FFT analysis DISABLED
[GP] Phase 3: Similarity analysis DISABLED
[GP] ========== GP ANALYSIS COMPLETE ==========


[GP] ========== CANDIDATE GENERATION STARTED ==========
[GP] Generating 20 new candidate solutions
[GP] Available data: 40 top solutions, 30 building blocks, 0 FFT patterns, 0 similarity patterns
[GP] Generation strategy: 6 block-based, 6 interpolated, 8 mutated
[GP] Strategy 1: Creating 6 candidates via building block combination...
[GP] Strategy 1 complete: 6 block-based candidates created
[GP] Strategy 2: Creating 6 candidates via solution interpolation...
[GP] Strategy 2 complete: 6 interpolated candidates created
[GP] Strategy 3: Creating 8 candidates via guided mutation...
[GP] Strategy 3 complete: 8 mutated candidates created
[GP] Total candidates generated: 20
[GP] Strategy breakdown: Block=18, Interp=18, Mut=24
[GP] ========== CANDIDATE GENERATION COMPLETE ==========


*** [GPU 0] NEW GLOBAL BEST: 135009.00 at gen 1300 ***
    Saved to best_solution.json

[GPU 0] Gen  1300 | Best: 135009.00 | 148.9s
[GPU 0] Gene injection: 20 candidates injected at gen 1400 (total so far: 60)

*** [GPU 0] NEW GLOBAL BEST: 134270.00 at gen 1400 ***
    Saved to best_solution.json

[GPU 0] Gen  1400 | Best: 134270.00 | 160.5s
  -> 20 candidates sent to 1/1 workers
[GP] gpu_0 intermediate update: 135009.00 at gen 1300
[GP] gpu_0 intermediate update: 134270.00 at gen 1400

*** [GPU 0] NEW GLOBAL BEST: 133335.00 at gen 1500 ***
    Saved to best_solution.json

[GPU 0] Gen  1500 | Best: 133335.00 | 171.7s
[GP] gpu_0 intermediate update: 133335.00 at gen 1500
[GP] gpu_0 intermediate update: 132978.00 at gen 1600

==================================================
GP ANALYSIS - Cycle 4
  Collected 40 solutions
==================================================

[GP] ========== GENETIC PROGRAMMING ANALYSIS STARTED ==========
[GP] Cycle: 3
[GP] Input: 40 solutions received for analysis
[GP] Fitness range: best=132858.00, worst=134275.00
[GP] Analysis config: blocks=True, fft=False, similarity=False
[GP] Starting analysis...
[GP] Phase 1: Extracting building blocks...

*** [GPU 0] NEW GLOBAL BEST: 132858.00 at gen 1600 ***
    Saved to best_solution.json

[GPU 0] Gen  1600 | Best: 132858.00 | 183.1s
[GP] Phase 1 complete: Found 30 building blocks
[GP] Phase 2: FFT analysis DISABLED
[GP] Phase 3: Similarity analysis DISABLED
[GP] ========== GP ANALYSIS COMPLETE ==========


[GP] ========== CANDIDATE GENERATION STARTED ==========
[GP] Generating 20 new candidate solutions
[GP] Available data: 40 top solutions, 30 building blocks, 0 FFT patterns, 0 similarity patterns
[GP] Generation strategy: 6 block-based, 6 interpolated, 8 mutated
[GP] Strategy 1: Creating 6 candidates via building block combination...
[GP] Strategy 1 complete: 6 block-based candidates created
[GP] Strategy 2: Creating 6 candidates via solution interpolation...
[GP] Strategy 2 complete: 6 interpolated candidates created
[GP] Strategy 3: Creating 8 candidates via guided mutation...
[GP] Strategy 3 complete: 8 mutated candidates created
[GP] Total candidates generated: 20
[GP] Strategy breakdown: Block=24, Interp=24, Mut=32
[GP] ========== CANDIDATE GENERATION COMPLETE ==========


*** [GPU 0] NEW GLOBAL BEST: 132721.00 at gen 1700 ***
    Saved to best_solution.json

[GPU 0] Gen  1700 | Best: 132721.00 | 194.4s
[GPU 0] Gene injection: 20 candidates injected at gen 1800 (total so far: 80)

*** [GPU 0] NEW GLOBAL BEST: 132334.00 at gen 1800 ***
    Saved to best_solution.json

[GPU 0] Gen  1800 | Best: 132334.00 | 205.7s
  -> 20 candidates sent to 1/1 workers
[GP] gpu_0 intermediate update: 132858.00 at gen 1600
[GP] gpu_0 intermediate update: 132721.00 at gen 1700
[GP] gpu_0 intermediate update: 132334.00 at gen 1800

*** [GPU 0] NEW GLOBAL BEST: 132032.00 at gen 1900 ***
    Saved to best_solution.json

[GPU 0] Gen  1900 | Best: 132032.00 | 217.1s
[GP] gpu_0 intermediate update: 132032.00 at gen 1900
[GP] gpu_0 intermediate update: 131369.00 at gen 2000

==================================================
GP ANALYSIS - Cycle 5
  Collected 40 solutions
==================================================

[GP] ========== GENETIC PROGRAMMING ANALYSIS STARTED ==========
[GP] Cycle: 4
[GP] Input: 40 solutions received for analysis
[GP] Fitness range: best=131369.00, worst=132334.00
[GP] Analysis config: blocks=True, fft=False, similarity=False
[GP] Starting analysis...
[GP] Phase 1: Extracting building blocks...
[GP] Phase 1 complete: Found 30 building blocks
[GP] Phase 2: FFT analysis DISABLED
[GP] Phase 3: Similarity analysis DISABLED
[GP] ========== GP ANALYSIS COMPLETE ==========


[GP] ========== CANDIDATE GENERATION STARTED ==========
[GP] Generating 20 new candidate solutions
[GP] Available data: 40 top solutions, 30 building blocks, 0 FFT patterns, 0 similarity patterns
[GP] Generation strategy: 6 block-based, 6 interpolated, 8 mutated
[GP] Strategy 1: Creating 6 candidates via building block combination...
[GP] Strategy 1 complete: 6 block-based candidates created
[GP] Strategy 2: Creating 6 candidates via solution interpolation...
[GP] Strategy 2 complete: 6 interpolated candidates created
[GP] Strategy 3: Creating 8 candidates via guided mutation...
[GP] Strategy 3 complete: 8 mutated candidates created
[GP] Total candidates generated: 20
[GP] Strategy breakdown: Block=30, Interp=30, Mut=40
[GP] ========== CANDIDATE GENERATION COMPLETE ==========


*** [GPU 0] NEW GLOBAL BEST: 131369.00 at gen 2000 ***
    Saved to best_solution.json

[GPU 0] Gen  2000 | Best: 131369.00 | 228.6s
    [Checkpoint] Saved to ./results/cold_start/blocks_only/rat783/1R20/job_times_2_seed0_2000.json

*** [GPU 0] NEW GLOBAL BEST: 130838.00 at gen 2100 ***
    Saved to best_solution.json

[GPU 0] Gen  2100 | Best: 130838.00 | 240.2s
[GPU 0] Gene injection: 20 candidates injected at gen 2200 (total so far: 100)
  -> 20 candidates sent to 1/1 workers

[CHECKPOINT] Saved A.json at gen 1000 (makespan: 131369.00)

*** [GPU 0] NEW GLOBAL BEST: 130309.00 at gen 2200 ***
    Saved to best_solution.json

[GPU 0] Gen  2200 | Best: 130309.00 | 251.6s
[GP] gpu_0 intermediate update: 130838.00 at gen 2100
[GP] gpu_0 intermediate update: 130309.00 at gen 2200

*** [GPU 0] NEW GLOBAL BEST: 129546.00 at gen 2300 ***
    Saved to best_solution.json

[GPU 0] Gen  2300 | Best: 129546.00 | 263.0s
[GP] gpu_0 intermediate update: 129546.00 at gen 2300
[GP] gpu_0 intermediate update: 129203.00 at gen 2400

==================================================
GP ANALYSIS - Cycle 6
  Collected 40 solutions
==================================================

[GP] ========== GENETIC PROGRAMMING ANALYSIS STARTED ==========
[GP] Cycle: 5
[GP] Input: 40 solutions received for analysis
[GP] Fitness range: best=129203.00, worst=130333.00
[GP] Analysis config: blocks=True, fft=False, similarity=False
[GP] Starting analysis...
[GP] Phase 1: Extracting building blocks...

*** [GPU 0] NEW GLOBAL BEST: 129203.00 at gen 2400 ***
    Saved to best_solution.json

[GPU 0] Gen  2400 | Best: 129203.00 | 274.5s
[GP] Phase 1 complete: Found 30 building blocks
[GP] Phase 2: FFT analysis DISABLED
[GP] Phase 3: Similarity analysis DISABLED
[GP] ========== GP ANALYSIS COMPLETE ==========


[GP] ========== CANDIDATE GENERATION STARTED ==========
[GP] Generating 20 new candidate solutions
[GP] Available data: 40 top solutions, 30 building blocks, 0 FFT patterns, 0 similarity patterns
[GP] Generation strategy: 6 block-based, 6 interpolated, 8 mutated
[GP] Strategy 1: Creating 6 candidates via building block combination...
[GP] Strategy 1 complete: 6 block-based candidates created
[GP] Strategy 2: Creating 6 candidates via solution interpolation...
[GP] Strategy 2 complete: 6 interpolated candidates created
[GP] Strategy 3: Creating 8 candidates via guided mutation...
[GP] Strategy 3 complete: 8 mutated candidates created
[GP] Total candidates generated: 20
[GP] Strategy breakdown: Block=36, Interp=36, Mut=48
[GP] ========== CANDIDATE GENERATION COMPLETE ==========


*** [GPU 0] NEW GLOBAL BEST: 128603.00 at gen 2500 ***
    Saved to best_solution.json

[GPU 0] Gen  2500 | Best: 128603.00 | 285.6s
[GPU 0] Gene injection: 20 candidates injected at gen 2600 (total so far: 120)

*** [GPU 0] NEW GLOBAL BEST: 128204.00 at gen 2600 ***
    Saved to best_solution.json

[GPU 0] Gen  2600 | Best: 128204.00 | 297.4s
  -> 20 candidates sent to 1/1 workers
[GP] gpu_0 intermediate update: 128603.00 at gen 2500
[GP] gpu_0 intermediate update: 128204.00 at gen 2600

*** [GPU 0] NEW GLOBAL BEST: 127840.00 at gen 2700 ***
    Saved to best_solution.json

[GPU 0] Gen  2700 | Best: 127840.00 | 308.5s
[GP] gpu_0 intermediate update: 127840.00 at gen 2700
[GP] gpu_0 intermediate update: 127350.00 at gen 2800

==================================================
GP ANALYSIS - Cycle 7
  Collected 40 solutions
==================================================

[GP] ========== GENETIC PROGRAMMING ANALYSIS STARTED ==========
[GP] Cycle: 6
[GP] Input: 40 solutions received for analysis
[GP] Fitness range: best=127350.00, worst=128224.00
[GP] Analysis config: blocks=True, fft=False, similarity=False
[GP] Starting analysis...
[GP] Phase 1: Extracting building blocks...

*** [GPU 0] NEW GLOBAL BEST: 127350.00 at gen 2800 ***
    Saved to best_solution.json

[GPU 0] Gen  2800 | Best: 127350.00 | 319.9s
[GP] Phase 1 complete: Found 30 building blocks
[GP] Phase 2: FFT analysis DISABLED
[GP] Phase 3: Similarity analysis DISABLED
[GP] ========== GP ANALYSIS COMPLETE ==========


[GP] ========== CANDIDATE GENERATION STARTED ==========
[GP] Generating 20 new candidate solutions
[GP] Available data: 40 top solutions, 30 building blocks, 0 FFT patterns, 0 similarity patterns
[GP] Generation strategy: 6 block-based, 6 interpolated, 8 mutated
[GP] Strategy 1: Creating 6 candidates via building block combination...
[GP] Strategy 1 complete: 6 block-based candidates created
[GP] Strategy 2: Creating 6 candidates via solution interpolation...
[GP] Strategy 2 complete: 6 interpolated candidates created
[GP] Strategy 3: Creating 8 candidates via guided mutation...
[GP] Strategy 3 complete: 8 mutated candidates created
[GP] Total candidates generated: 20
[GP] Strategy breakdown: Block=42, Interp=42, Mut=56
[GP] ========== CANDIDATE GENERATION COMPLETE ==========


*** [GPU 0] NEW GLOBAL BEST: 127149.00 at gen 2900 ***
    Saved to best_solution.json

[GPU 0] Gen  2900 | Best: 127149.00 | 331.1s
[GPU 0] Gene injection: 20 candidates injected at gen 3000 (total so far: 140)

*** [GPU 0] NEW GLOBAL BEST: 126920.00 at gen 3000 ***
    Saved to best_solution.json

[GPU 0] Gen  3000 | Best: 126920.00 | 342.5s
  -> 20 candidates sent to 1/1 workers
[GP] gpu_0 intermediate update: 127149.00 at gen 2900
[GP] gpu_0 intermediate update: 126931.00 at gen 3000
    [Checkpoint] Saved to ./results/cold_start/blocks_only/rat783/1R20/job_times_2_seed0_3000.json
[GP] gpu_0 intermediate update: 126920.00 at gen 3000

*** [GPU 0] NEW GLOBAL BEST: 126615.00 at gen 3100 ***
    Saved to best_solution.json

[GPU 0] Gen  3100 | Best: 126615.00 | 353.5s
[GP] gpu_0 intermediate update: 126615.00 at gen 3100
[GP] gpu_0 intermediate update: 126324.00 at gen 3200

==================================================
GP ANALYSIS - Cycle 8
  Collected 40 solutions
==================================================

[GP] ========== GENETIC PROGRAMMING ANALYSIS STARTED ==========
[GP] Cycle: 7
[GP] Input: 40 solutions received for analysis
[GP] Fitness range: best=126324.00, worst=126931.00
[GP] Analysis config: blocks=True, fft=False, similarity=False
[GP] Starting analysis...
[GP] Phase 1: Extracting building blocks...

*** [GPU 0] NEW GLOBAL BEST: 126324.00 at gen 3200 ***
    Saved to best_solution.json

[GPU 0] Gen  3200 | Best: 126324.00 | 364.7s
[GP] Phase 1 complete: Found 30 building blocks
[GP] Phase 2: FFT analysis DISABLED
[GP] Phase 3: Similarity analysis DISABLED
[GP] ========== GP ANALYSIS COMPLETE ==========


[GP] ========== CANDIDATE GENERATION STARTED ==========
[GP] Generating 20 new candidate solutions
[GP] Available data: 40 top solutions, 30 building blocks, 0 FFT patterns, 0 similarity patterns
[GP] Generation strategy: 6 block-based, 6 interpolated, 8 mutated
[GP] Strategy 1: Creating 6 candidates via building block combination...
[GP] Strategy 1 complete: 6 block-based candidates created
[GP] Strategy 2: Creating 6 candidates via solution interpolation...
[GP] Strategy 2 complete: 6 interpolated candidates created
[GP] Strategy 3: Creating 8 candidates via guided mutation...
[GP] Strategy 3 complete: 8 mutated candidates created
[GP] Total candidates generated: 20
[GP] Strategy breakdown: Block=48, Interp=48, Mut=64
[GP] ========== CANDIDATE GENERATION COMPLETE ==========


*** [GPU 0] NEW GLOBAL BEST: 126159.00 at gen 3300 ***
    Saved to best_solution.json

[GPU 0] Gen  3300 | Best: 126159.00 | 376.1s
[GPU 0] Gene injection: 20 candidates injected at gen 3400 (total so far: 160)

*** [GPU 0] NEW GLOBAL BEST: 125892.00 at gen 3400 ***
    Saved to best_solution.json

[GPU 0] Gen  3400 | Best: 125892.00 | 387.3s
  -> 20 candidates sent to 1/1 workers
[GP] gpu_0 intermediate update: 126159.00 at gen 3300
[GP] gpu_0 intermediate update: 125892.00 at gen 3400

*** [GPU 0] NEW GLOBAL BEST: 125617.00 at gen 3500 ***
    Saved to best_solution.json

[GPU 0] Gen  3500 | Best: 125617.00 | 398.6s
[GP] gpu_0 intermediate update: 125617.00 at gen 3500
[GP] gpu_0 intermediate update: 125309.00 at gen 3600

==================================================
GP ANALYSIS - Cycle 9
  Collected 40 solutions
==================================================

[GP] ========== GENETIC PROGRAMMING ANALYSIS STARTED ==========
[GP] Cycle: 8
[GP] Input: 40 solutions received for analysis
[GP] Fitness range: best=125309.00, worst=125892.00
[GP] Analysis config: blocks=True, fft=False, similarity=False
[GP] Starting analysis...
[GP] Phase 1: Extracting building blocks...

*** [GPU 0] NEW GLOBAL BEST: 125309.00 at gen 3600 ***
    Saved to best_solution.json

[GPU 0] Gen  3600 | Best: 125309.00 | 410.0s
[GP] Phase 1 complete: Found 30 building blocks
[GP] Phase 2: FFT analysis DISABLED
[GP] Phase 3: Similarity analysis DISABLED
[GP] ========== GP ANALYSIS COMPLETE ==========


[GP] ========== CANDIDATE GENERATION STARTED ==========
[GP] Generating 20 new candidate solutions
[GP] Available data: 40 top solutions, 30 building blocks, 0 FFT patterns, 0 similarity patterns
[GP] Generation strategy: 6 block-based, 6 interpolated, 8 mutated
[GP] Strategy 1: Creating 6 candidates via building block combination...
[GP] Strategy 1 complete: 6 block-based candidates created
[GP] Strategy 2: Creating 6 candidates via solution interpolation...
[GP] Strategy 2 complete: 6 interpolated candidates created
[GP] Strategy 3: Creating 8 candidates via guided mutation...
[GP] Strategy 3 complete: 8 mutated candidates created
[GP] Total candidates generated: 20
[GP] Strategy breakdown: Block=54, Interp=54, Mut=72
[GP] ========== CANDIDATE GENERATION COMPLETE ==========


*** [GPU 0] NEW GLOBAL BEST: 125109.00 at gen 3700 ***
    Saved to best_solution.json

[GPU 0] Gen  3700 | Best: 125109.00 | 421.1s
[GPU 0] Gene injection: 20 candidates injected at gen 3800 (total so far: 180)

*** [GPU 0] NEW GLOBAL BEST: 125004.00 at gen 3800 ***
    Saved to best_solution.json

[GPU 0] Gen  3800 | Best: 125004.00 | 432.3s
  -> 20 candidates sent to 1/1 workers
[GP] gpu_0 intermediate update: 125109.00 at gen 3700
[GP] gpu_0 intermediate update: 125004.00 at gen 3800

*** [GPU 0] NEW GLOBAL BEST: 124996.00 at gen 3900 ***
    Saved to best_solution.json

[GPU 0] Gen  3900 | Best: 124996.00 | 443.6s
[GP] gpu_0 intermediate update: 124996.00 at gen 3900
[GP] gpu_0 intermediate update: 124814.00 at gen 4000

==================================================
GP ANALYSIS - Cycle 10
  Collected 40 solutions
==================================================

[GP] ========== GENETIC PROGRAMMING ANALYSIS STARTED ==========
[GP] Cycle: 9
[GP] Input: 40 solutions received for analysis
[GP] Fitness range: best=124814.00, worst=125004.00
[GP] Analysis config: blocks=True, fft=False, similarity=False
[GP] Starting analysis...
[GP] Phase 1: Extracting building blocks...

*** [GPU 0] NEW GLOBAL BEST: 124814.00 at gen 4000 ***
    Saved to best_solution.json

[GPU 0] Gen  4000 | Best: 124814.00 | 455.2s
[GP] Phase 1 complete: Found 30 building blocks
[GP] Phase 2: FFT analysis DISABLED
[GP] Phase 3: Similarity analysis DISABLED
[GP] ========== GP ANALYSIS COMPLETE ==========


[GP] ========== CANDIDATE GENERATION STARTED ==========
[GP] Generating 20 new candidate solutions
[GP] Available data: 40 top solutions, 30 building blocks, 0 FFT patterns, 0 similarity patterns
[GP] Generation strategy: 6 block-based, 6 interpolated, 8 mutated
[GP] Strategy 1: Creating 6 candidates via building block combination...
[GP] Strategy 1 complete: 6 block-based candidates created
[GP] Strategy 2: Creating 6 candidates via solution interpolation...
[GP] Strategy 2 complete: 6 interpolated candidates created
[GP] Strategy 3: Creating 8 candidates via guided mutation...
[GP] Strategy 3 complete: 8 mutated candidates created
[GP] Total candidates generated: 20
[GP] Strategy breakdown: Block=60, Interp=60, Mut=80
[GP] ========== CANDIDATE GENERATION COMPLETE ==========

    [Checkpoint] Saved to ./results/cold_start/blocks_only/rat783/1R20/job_times_2_seed0_4000.json

*** [GPU 0] NEW GLOBAL BEST: 124678.00 at gen 4100 ***
    Saved to best_solution.json

[GPU 0] Gen  4100 | Best: 124678.00 | 466.6s
[GPU 0] Gene injection: 20 candidates injected at gen 4200 (total so far: 200)
  -> 20 candidates sent to 1/1 workers

[CHECKPOINT] Saved B.json at gen 2000 (makespan: 124814.00)

*** [GPU 0] NEW GLOBAL BEST: 124453.00 at gen 4200 ***
    Saved to best_solution.json

[GPU 0] Gen  4200 | Best: 124453.00 | 478.2s
[GP] gpu_0 intermediate update: 124678.00 at gen 4100
[GP] gpu_0 intermediate update: 124453.00 at gen 4200

*** [GPU 0] NEW GLOBAL BEST: 124333.00 at gen 4300 ***
    Saved to best_solution.json

[GPU 0] Gen  4300 | Best: 124333.00 | 489.4s
[GP] gpu_0 intermediate update: 124333.00 at gen 4300
[GP] gpu_0 intermediate update: 124323.00 at gen 4400

==================================================
GP ANALYSIS - Cycle 11
  Collected 40 solutions
==================================================

[GP] ========== GENETIC PROGRAMMING ANALYSIS STARTED ==========
[GP] Cycle: 10
[GP] Input: 40 solutions received for analysis
[GP] Fitness range: best=124323.00, worst=124453.00
[GP] Analysis config: blocks=True, fft=False, similarity=False
[GP] Starting analysis...
[GP] Phase 1: Extracting building blocks...

*** [GPU 0] NEW GLOBAL BEST: 124323.00 at gen 4400 ***
[GP] Phase 1 complete: Found 30 building blocks
[GP] Phase 2: FFT analysis DISABLED
[GP] Phase 3: Similarity analysis DISABLED
[GP] ========== GP ANALYSIS COMPLETE ==========


[GP] ========== CANDIDATE GENERATION STARTED ==========
[GP] Generating 20 new candidate solutions
[GP] Available data: 40 top solutions, 30 building blocks, 0 FFT patterns, 0 similarity patterns
[GP] Generation strategy: 6 block-based, 6 interpolated, 8 mutated
[GP] Strategy 1: Creating 6 candidates via building block combination...
[GP] Strategy 1 complete: 6 block-based candidates created
[GP] Strategy 2: Creating 6 candidates via solution interpolation...
[GP] Strategy 2 complete: 6 interpolated candidates created
[GP] Strategy 3: Creating 8 candidates via guided mutation...
    Saved to best_solution.json

[GPU 0] Gen  4400 | Best: 124323.00 | 500.6s
[GP] Strategy 3 complete: 8 mutated candidates created
[GP] Total candidates generated: 20
[GP] Strategy breakdown: Block=66, Interp=66, Mut=88
[GP] ========== CANDIDATE GENERATION COMPLETE ==========


*** [GPU 0] NEW GLOBAL BEST: 124294.00 at gen 4500 ***
    Saved to best_solution.json

[GPU 0] Gen  4500 | Best: 124294.00 | 511.7s
[GPU 0] Gene injection: 20 candidates injected at gen 4600 (total so far: 220)

*** [GPU 0] NEW GLOBAL BEST: 124258.00 at gen 4600 ***
    Saved to best_solution.json

[GPU 0] Gen  4600 | Best: 124258.00 | 523.2s
  -> 20 candidates sent to 1/1 workers
[GP] gpu_0 intermediate update: 124294.00 at gen 4500
[GP] gpu_0 intermediate update: 124258.00 at gen 4600

*** [GPU 0] NEW GLOBAL BEST: 124062.00 at gen 4700 ***
    Saved to best_solution.json

[GPU 0] Gen  4700 | Best: 124062.00 | 534.7s
[GP] gpu_0 intermediate update: 124062.00 at gen 4700
[GP] gpu_0 intermediate update: 123961.00 at gen 4800

==================================================
GP ANALYSIS - Cycle 12
  Collected 40 solutions
==================================================

[GP] ========== GENETIC PROGRAMMING ANALYSIS STARTED ==========
[GP] Cycle: 11
[GP] Input: 40 solutions received for analysis
[GP] Fitness range: best=123961.00, worst=124264.00
[GP] Analysis config: blocks=True, fft=False, similarity=False
[GP] Starting analysis...
[GP] Phase 1: Extracting building blocks...

*** [GPU 0] NEW GLOBAL BEST: 123961.00 at gen 4800 ***
    Saved to best_solution.json

[GPU 0] Gen  4800 | Best: 123961.00 | 546.1s
[GP] Phase 1 complete: Found 30 building blocks
[GP] Phase 2: FFT analysis DISABLED
[GP] Phase 3: Similarity analysis DISABLED
[GP] ========== GP ANALYSIS COMPLETE ==========


[GP] ========== CANDIDATE GENERATION STARTED ==========
[GP] Generating 20 new candidate solutions
[GP] Available data: 40 top solutions, 30 building blocks, 0 FFT patterns, 0 similarity patterns
[GP] Generation strategy: 6 block-based, 6 interpolated, 8 mutated
[GP] Strategy 1: Creating 6 candidates via building block combination...
[GP] Strategy 1 complete: 6 block-based candidates created
[GP] Strategy 2: Creating 6 candidates via solution interpolation...
[GP] Strategy 2 complete: 6 interpolated candidates created
[GP] Strategy 3: Creating 8 candidates via guided mutation...
[GP] Strategy 3 complete: 8 mutated candidates created
[GP] Total candidates generated: 20
[GP] Strategy breakdown: Block=72, Interp=72, Mut=96
[GP] ========== CANDIDATE GENERATION COMPLETE ==========


*** [GPU 0] NEW GLOBAL BEST: 123927.00 at gen 4900 ***
    Saved to best_solution.json

[GPU 0] Gen  4900 | Best: 123927.00 | 557.2s
[GPU 0] Gene injection: 20 candidates injected at gen 5000 (total so far: 240)
[GPU 0] Evolution complete. Sending final results...
  -> 20 candidates sent to 1/1 workers
[GP] gpu_0 intermediate update: 123927.00 at gen 4900
[GP] gpu_0 intermediate update: 123871.00 at gen 5000
[GP] Worker finished: gpu_0 (best=123871.00)

[GP] All workers finished. Total GP cycles: 12

[Final Collection] Have 1/1 workers. Waiting up to 120s for remaining...

[Critical] Attempting final result collection before terminating workers...

[Results Summary] Collected 1 results:
  gpu_0: fitness=123871.00, intermediate=False, gen=final

======================================================================
COMPLETE
======================================================================
Best: 123871.00 from gpu_0
Time: 570.7s
Total candidates injected: 240

Solution JSON saved to ./results/cold_start/blocks_only/rat783/1R20/job_times_2_seed0.json
HTML Gantt chart saved to: ./results/cold_start/blocks_only/rat783/1R20/job_times_2_seed0.html
