Setting random seed to 0
DEBUG: proc shape: (783,), agents: 6, resources: 4, n: 783

======================================================================
VRP-RPD SOLVER
======================================================================
Problem: 782 customers, 6 agents, k=4
Heuristic: None
Genetic Programming: Yes
Warm Start: No
Gene Injection: Yes
Workers: 1 GPU + 0 CPU
Generations: 5000
======================================================================


[GP] Starting GP collection loop (timeout: 750s)...

*** [GPU 0] NEW GLOBAL BEST: 153591.00 at gen 0 ***
    Saved to best_solution.json

[GPU 0] Gen     0 | Best: 153591.00 | 0.5s
[GP] gpu_0 first intermediate: 153591.00 at gen 0

*** [GPU 0] NEW GLOBAL BEST: 109228.00 at gen 100 ***
    Saved to best_solution.json

[GPU 0] Gen   100 | Best: 109228.00 | 11.5s
[GP] gpu_0 intermediate update: 109228.00 at gen 100
[GP] gpu_0 intermediate update: 100520.00 at gen 200

*** [GPU 0] NEW GLOBAL BEST: 100503.00 at gen 200 ***
    Saved to best_solution.json

[GPU 0] Gen   200 | Best: 100503.00 | 22.6s
[GP] gpu_0 intermediate update: 100503.00 at gen 200

*** [GPU 0] NEW GLOBAL BEST: 97205.00 at gen 300 ***
    Saved to best_solution.json

[GPU 0] Gen   300 | Best: 97205.00 | 33.3s
[GP] gpu_0 intermediate update: 97205.00 at gen 300
[GP] gpu_0 intermediate update: 94958.00 at gen 400

==================================================
GP ANALYSIS - Cycle 1
  Collected 40 solutions
==================================================

[GP] ========== GENETIC PROGRAMMING ANALYSIS STARTED ==========
[GP] Cycle: 0
[GP] Input: 40 solutions received for analysis
[GP] Fitness range: best=94958.00, worst=100526.00
[GP] Analysis config: blocks=True, fft=False, similarity=False
[GP] Starting analysis...
[GP] Phase 1: Extracting building blocks...

*** [GPU 0] NEW GLOBAL BEST: 94958.00 at gen 400 ***
    Saved to best_solution.json

[GPU 0] Gen   400 | Best: 94958.00 | 44.6s
[GP] Phase 1 complete: Found 30 building blocks
[GP] Phase 2: FFT analysis DISABLED
[GP] Phase 3: Similarity analysis DISABLED
[GP] ========== GP ANALYSIS COMPLETE ==========


[GP] ========== CANDIDATE GENERATION STARTED ==========
[GP] Generating 20 new candidate solutions
[GP] Available data: 40 top solutions, 30 building blocks, 0 FFT patterns, 0 similarity patterns
[GP] Generation strategy: 6 block-based, 6 interpolated, 8 mutated
[GP] Strategy 1: Creating 6 candidates via building block combination...
[GP] Strategy 1 complete: 6 block-based candidates created
[GP] Strategy 2: Creating 6 candidates via solution interpolation...
[GP] Strategy 2 complete: 6 interpolated candidates created
[GP] Strategy 3: Creating 8 candidates via guided mutation...
[GP] Strategy 3 complete: 8 mutated candidates created
[GP] Total candidates generated: 20
[GP] Strategy breakdown: Block=6, Interp=6, Mut=8
[GP] ========== CANDIDATE GENERATION COMPLETE ==========


*** [GPU 0] NEW GLOBAL BEST: 92995.00 at gen 500 ***
    Saved to best_solution.json

[GPU 0] Gen   500 | Best: 92995.00 | 55.5s
[GPU 0] Gene injection: 20 candidates injected at gen 600 (total so far: 20)

*** [GPU 0] NEW GLOBAL BEST: 91766.00 at gen 600 ***
    Saved to best_solution.json

[GPU 0] Gen   600 | Best: 91766.00 | 66.7s
  -> 20 candidates sent to 1/1 workers
[GP] gpu_0 intermediate update: 92995.00 at gen 500
[GP] gpu_0 intermediate update: 91766.00 at gen 600

*** [GPU 0] NEW GLOBAL BEST: 89941.00 at gen 700 ***
    Saved to best_solution.json

[GPU 0] Gen   700 | Best: 89941.00 | 77.5s
[GP] gpu_0 intermediate update: 89941.00 at gen 700
[GP] gpu_0 intermediate update: 88175.00 at gen 800

==================================================
GP ANALYSIS - Cycle 2
  Collected 40 solutions
==================================================

[GP] ========== GENETIC PROGRAMMING ANALYSIS STARTED ==========
[GP] Cycle: 1
[GP] Input: 40 solutions received for analysis
[GP] Fitness range: best=88175.00, worst=91785.00
[GP] Analysis config: blocks=True, fft=False, similarity=False
[GP] Starting analysis...
[GP] Phase 1: Extracting building blocks...

*** [GPU 0] NEW GLOBAL BEST: 88175.00 at gen 800 ***
    Saved to best_solution.json

[GPU 0] Gen   800 | Best: 88175.00 | 88.4s
[GP] Phase 1 complete: Found 30 building blocks
[GP] Phase 2: FFT analysis DISABLED
[GP] Phase 3: Similarity analysis DISABLED
[GP] ========== GP ANALYSIS COMPLETE ==========


[GP] ========== CANDIDATE GENERATION STARTED ==========
[GP] Generating 20 new candidate solutions
[GP] Available data: 40 top solutions, 30 building blocks, 0 FFT patterns, 0 similarity patterns
[GP] Generation strategy: 6 block-based, 6 interpolated, 8 mutated
[GP] Strategy 1: Creating 6 candidates via building block combination...
[GP] Strategy 1 complete: 6 block-based candidates created
[GP] Strategy 2: Creating 6 candidates via solution interpolation...
[GP] Strategy 2 complete: 6 interpolated candidates created
[GP] Strategy 3: Creating 8 candidates via guided mutation...
[GP] Strategy 3 complete: 8 mutated candidates created
[GP] Total candidates generated: 20
[GP] Strategy breakdown: Block=12, Interp=12, Mut=16
[GP] ========== CANDIDATE GENERATION COMPLETE ==========


*** [GPU 0] NEW GLOBAL BEST: 87233.00 at gen 900 ***
    Saved to best_solution.json

[GPU 0] Gen   900 | Best: 87233.00 | 99.1s
[GPU 0] Gene injection: 20 candidates injected at gen 1000 (total so far: 40)

*** [GPU 0] NEW GLOBAL BEST: 86359.00 at gen 1000 ***
    Saved to best_solution.json

[GPU 0] Gen  1000 | Best: 86359.00 | 110.1s
  -> 20 candidates sent to 1/1 workers
[GP] gpu_0 intermediate update: 87233.00 at gen 900
[GP] gpu_0 intermediate update: 86447.00 at gen 1000
    [Checkpoint] Saved to ./results/cold_start/blocks_only/rat783/1R10/job_times_10_seed0_1000.json
[GP] gpu_0 intermediate update: 86359.00 at gen 1000

*** [GPU 0] NEW GLOBAL BEST: 86193.00 at gen 1100 ***
    Saved to best_solution.json

[GPU 0] Gen  1100 | Best: 86193.00 | 120.9s
[GP] gpu_0 intermediate update: 86193.00 at gen 1100
[GP] gpu_0 intermediate update: 85483.00 at gen 1200

==================================================
GP ANALYSIS - Cycle 3
  Collected 40 solutions
==================================================

[GP] ========== GENETIC PROGRAMMING ANALYSIS STARTED ==========
[GP] Cycle: 2
[GP] Input: 40 solutions received for analysis
[GP] Fitness range: best=85483.00, worst=86454.00
[GP] Analysis config: blocks=True, fft=False, similarity=False
[GP] Starting analysis...
[GP] Phase 1: Extracting building blocks...

*** [GPU 0] NEW GLOBAL BEST: 85483.00 at gen 1200 ***
    Saved to best_solution.json

[GPU 0] Gen  1200 | Best: 85483.00 | 131.8s
[GP] Phase 1 complete: Found 30 building blocks
[GP] Phase 2: FFT analysis DISABLED
[GP] Phase 3: Similarity analysis DISABLED
[GP] ========== GP ANALYSIS COMPLETE ==========


[GP] ========== CANDIDATE GENERATION STARTED ==========
[GP] Generating 20 new candidate solutions
[GP] Available data: 40 top solutions, 30 building blocks, 0 FFT patterns, 0 similarity patterns
[GP] Generation strategy: 6 block-based, 6 interpolated, 8 mutated
[GP] Strategy 1: Creating 6 candidates via building block combination...
[GP] Strategy 1 complete: 6 block-based candidates created
[GP] Strategy 2: Creating 6 candidates via solution interpolation...
[GP] Strategy 2 complete: 6 interpolated candidates created
[GP] Strategy 3: Creating 8 candidates via guided mutation...
[GP] Strategy 3 complete: 8 mutated candidates created
[GP] Total candidates generated: 20
[GP] Strategy breakdown: Block=18, Interp=18, Mut=24
[GP] ========== CANDIDATE GENERATION COMPLETE ==========


*** [GPU 0] NEW GLOBAL BEST: 84799.00 at gen 1300 ***
    Saved to best_solution.json

[GPU 0] Gen  1300 | Best: 84799.00 | 142.7s
[GPU 0] Gene injection: 20 candidates injected at gen 1400 (total so far: 60)

*** [GPU 0] NEW GLOBAL BEST: 83962.00 at gen 1400 ***
    Saved to best_solution.json

[GPU 0] Gen  1400 | Best: 83962.00 | 153.7s
  -> 20 candidates sent to 1/1 workers
[GP] gpu_0 intermediate update: 84799.00 at gen 1300
[GP] gpu_0 intermediate update: 83962.00 at gen 1400

*** [GPU 0] NEW GLOBAL BEST: 83048.00 at gen 1500 ***
    Saved to best_solution.json

[GPU 0] Gen  1500 | Best: 83048.00 | 164.4s
[GP] gpu_0 intermediate update: 83048.00 at gen 1500
[GP] gpu_0 intermediate update: 82555.00 at gen 1600

==================================================
GP ANALYSIS - Cycle 4
  Collected 40 solutions
==================================================

[GP] ========== GENETIC PROGRAMMING ANALYSIS STARTED ==========
[GP] Cycle: 3
[GP] Input: 40 solutions received for analysis
[GP] Fitness range: best=82555.00, worst=83997.00
[GP] Analysis config: blocks=True, fft=False, similarity=False
[GP] Starting analysis...
[GP] Phase 1: Extracting building blocks...

*** [GPU 0] NEW GLOBAL BEST: 82555.00 at gen 1600 ***
    Saved to best_solution.json

[GPU 0] Gen  1600 | Best: 82555.00 | 175.5s
[GP] Phase 1 complete: Found 30 building blocks
[GP] Phase 2: FFT analysis DISABLED
[GP] Phase 3: Similarity analysis DISABLED
[GP] ========== GP ANALYSIS COMPLETE ==========


[GP] ========== CANDIDATE GENERATION STARTED ==========
[GP] Generating 20 new candidate solutions
[GP] Available data: 40 top solutions, 30 building blocks, 0 FFT patterns, 0 similarity patterns
[GP] Generation strategy: 6 block-based, 6 interpolated, 8 mutated
[GP] Strategy 1: Creating 6 candidates via building block combination...
[GP] Strategy 1 complete: 6 block-based candidates created
[GP] Strategy 2: Creating 6 candidates via solution interpolation...
[GP] Strategy 2 complete: 6 interpolated candidates created
[GP] Strategy 3: Creating 8 candidates via guided mutation...
[GP] Strategy 3 complete: 8 mutated candidates created
[GP] Total candidates generated: 20
[GP] Strategy breakdown: Block=24, Interp=24, Mut=32
[GP] ========== CANDIDATE GENERATION COMPLETE ==========


*** [GPU 0] NEW GLOBAL BEST: 82021.00 at gen 1700 ***
    Saved to best_solution.json

[GPU 0] Gen  1700 | Best: 82021.00 | 186.4s
[GPU 0] Gene injection: 20 candidates injected at gen 1800 (total so far: 80)

*** [GPU 0] NEW GLOBAL BEST: 81662.00 at gen 1800 ***
    Saved to best_solution.json

[GPU 0] Gen  1800 | Best: 81662.00 | 197.4s
  -> 20 candidates sent to 1/1 workers
[GP] gpu_0 intermediate update: 82021.00 at gen 1700
[GP] gpu_0 intermediate update: 81662.00 at gen 1800

*** [GPU 0] NEW GLOBAL BEST: 81312.00 at gen 1900 ***
    Saved to best_solution.json

[GPU 0] Gen  1900 | Best: 81312.00 | 208.4s
[GP] gpu_0 intermediate update: 81312.00 at gen 1900
[GP] gpu_0 intermediate update: 80941.00 at gen 2000

==================================================
GP ANALYSIS - Cycle 5
  Collected 40 solutions
==================================================

[GP] ========== GENETIC PROGRAMMING ANALYSIS STARTED ==========
[GP] Cycle: 4
[GP] Input: 40 solutions received for analysis
[GP] Fitness range: best=80941.00, worst=81662.00
[GP] Analysis config: blocks=True, fft=False, similarity=False
[GP] Starting analysis...
[GP] Phase 1: Extracting building blocks...

*** [GPU 0] NEW GLOBAL BEST: 80941.00 at gen 2000 ***
    Saved to best_solution.json

[GPU 0] Gen  2000 | Best: 80941.00 | 219.4s
    [Checkpoint] Saved to ./results/cold_start/blocks_only/rat783/1R10/job_times_10_seed0_2000.json
[GP] Phase 1 complete: Found 30 building blocks
[GP] Phase 2: FFT analysis DISABLED
[GP] Phase 3: Similarity analysis DISABLED
[GP] ========== GP ANALYSIS COMPLETE ==========


[GP] ========== CANDIDATE GENERATION STARTED ==========
[GP] Generating 20 new candidate solutions
[GP] Available data: 40 top solutions, 30 building blocks, 0 FFT patterns, 0 similarity patterns
[GP] Generation strategy: 6 block-based, 6 interpolated, 8 mutated
[GP] Strategy 1: Creating 6 candidates via building block combination...
[GP] Strategy 1 complete: 6 block-based candidates created
[GP] Strategy 2: Creating 6 candidates via solution interpolation...
[GP] Strategy 2 complete: 6 interpolated candidates created
[GP] Strategy 3: Creating 8 candidates via guided mutation...
[GP] Strategy 3 complete: 8 mutated candidates created
[GP] Total candidates generated: 20
[GP] Strategy breakdown: Block=30, Interp=30, Mut=40
[GP] ========== CANDIDATE GENERATION COMPLETE ==========


*** [GPU 0] NEW GLOBAL BEST: 80676.00 at gen 2100 ***
    Saved to best_solution.json

[GPU 0] Gen  2100 | Best: 80676.00 | 230.3s
[GPU 0] Gene injection: 20 candidates injected at gen 2200 (total so far: 100)
  -> 20 candidates sent to 1/1 workers

[CHECKPOINT] Saved A.json at gen 1000 (makespan: 80941.00)

*** [GPU 0] NEW GLOBAL BEST: 80282.00 at gen 2200 ***
    Saved to best_solution.json

[GPU 0] Gen  2200 | Best: 80282.00 | 241.2s
[GP] gpu_0 intermediate update: 80676.00 at gen 2100
[GP] gpu_0 intermediate update: 80282.00 at gen 2200

*** [GPU 0] NEW GLOBAL BEST: 79903.00 at gen 2300 ***
    Saved to best_solution.json

[GPU 0] Gen  2300 | Best: 79903.00 | 252.2s
[GP] gpu_0 intermediate update: 79903.00 at gen 2300
[GP] gpu_0 intermediate update: 79549.00 at gen 2400

==================================================
GP ANALYSIS - Cycle 6
  Collected 40 solutions
==================================================

[GP] ========== GENETIC PROGRAMMING ANALYSIS STARTED ==========
[GP] Cycle: 5
[GP] Input: 40 solutions received for analysis
[GP] Fitness range: best=79549.00, worst=80287.00
[GP] Analysis config: blocks=True, fft=False, similarity=False
[GP] Starting analysis...
[GP] Phase 1: Extracting building blocks...

*** [GPU 0] NEW GLOBAL BEST: 79549.00 at gen 2400 ***
    Saved to best_solution.json

[GPU 0] Gen  2400 | Best: 79549.00 | 263.3s
[GP] Phase 1 complete: Found 30 building blocks
[GP] Phase 2: FFT analysis DISABLED
[GP] Phase 3: Similarity analysis DISABLED
[GP] ========== GP ANALYSIS COMPLETE ==========


[GP] ========== CANDIDATE GENERATION STARTED ==========
[GP] Generating 20 new candidate solutions
[GP] Available data: 40 top solutions, 30 building blocks, 0 FFT patterns, 0 similarity patterns
[GP] Generation strategy: 6 block-based, 6 interpolated, 8 mutated
[GP] Strategy 1: Creating 6 candidates via building block combination...
[GP] Strategy 1 complete: 6 block-based candidates created
[GP] Strategy 2: Creating 6 candidates via solution interpolation...
[GP] Strategy 2 complete: 6 interpolated candidates created
[GP] Strategy 3: Creating 8 candidates via guided mutation...
[GP] Strategy 3 complete: 8 mutated candidates created
[GP] Total candidates generated: 20
[GP] Strategy breakdown: Block=36, Interp=36, Mut=48
[GP] ========== CANDIDATE GENERATION COMPLETE ==========


*** [GPU 0] NEW GLOBAL BEST: 79307.00 at gen 2500 ***
    Saved to best_solution.json

[GPU 0] Gen  2500 | Best: 79307.00 | 274.4s
[GPU 0] Gene injection: 20 candidates injected at gen 2600 (total so far: 120)

*** [GPU 0] NEW GLOBAL BEST: 79079.00 at gen 2600 ***
    Saved to best_solution.json

[GPU 0] Gen  2600 | Best: 79079.00 | 285.4s
  -> 20 candidates sent to 1/1 workers
[GP] gpu_0 intermediate update: 79307.00 at gen 2500
[GP] gpu_0 intermediate update: 79079.00 at gen 2600

*** [GPU 0] NEW GLOBAL BEST: 78798.00 at gen 2700 ***
    Saved to best_solution.json

[GPU 0] Gen  2700 | Best: 78798.00 | 296.2s
[GP] gpu_0 intermediate update: 78798.00 at gen 2700
[GP] gpu_0 intermediate update: 78672.00 at gen 2800

==================================================
GP ANALYSIS - Cycle 7
  Collected 40 solutions
==================================================

[GP] ========== GENETIC PROGRAMMING ANALYSIS STARTED ==========
[GP] Cycle: 6
[GP] Input: 40 solutions received for analysis
[GP] Fitness range: best=78672.00, worst=79079.00
[GP] Analysis config: blocks=True, fft=False, similarity=False
[GP] Starting analysis...
[GP] Phase 1: Extracting building blocks...

*** [GPU 0] NEW GLOBAL BEST: 78672.00 at gen 2800 ***
    Saved to best_solution.json

[GPU 0] Gen  2800 | Best: 78672.00 | 307.1s
[GP] Phase 1 complete: Found 30 building blocks
[GP] Phase 2: FFT analysis DISABLED
[GP] Phase 3: Similarity analysis DISABLED
[GP] ========== GP ANALYSIS COMPLETE ==========


[GP] ========== CANDIDATE GENERATION STARTED ==========
[GP] Generating 20 new candidate solutions
[GP] Available data: 40 top solutions, 30 building blocks, 0 FFT patterns, 0 similarity patterns
[GP] Generation strategy: 6 block-based, 6 interpolated, 8 mutated
[GP] Strategy 1: Creating 6 candidates via building block combination...
[GP] Strategy 1 complete: 6 block-based candidates created
[GP] Strategy 2: Creating 6 candidates via solution interpolation...
[GP] Strategy 2 complete: 6 interpolated candidates created
[GP] Strategy 3: Creating 8 candidates via guided mutation...
[GP] Strategy 3 complete: 8 mutated candidates created
[GP] Total candidates generated: 20
[GP] Strategy breakdown: Block=42, Interp=42, Mut=56
[GP] ========== CANDIDATE GENERATION COMPLETE ==========


*** [GPU 0] NEW GLOBAL BEST: 78543.00 at gen 2900 ***
    Saved to best_solution.json

[GPU 0] Gen  2900 | Best: 78543.00 | 318.0s
[GPU 0] Gene injection: 20 candidates injected at gen 3000 (total so far: 140)
  -> 20 candidates sent to 1/1 workers
[GP] gpu_0 intermediate update: 78543.00 at gen 2900
[GP] gpu_0 intermediate update: 78515.00 at gen 3000

*** [GPU 0] NEW GLOBAL BEST: 78515.00 at gen 3000 ***
    Saved to best_solution.json

[GPU 0] Gen  3000 | Best: 78515.00 | 329.0s
    [Checkpoint] Saved to ./results/cold_start/blocks_only/rat783/1R10/job_times_10_seed0_3000.json

*** [GPU 0] NEW GLOBAL BEST: 78329.00 at gen 3100 ***
    Saved to best_solution.json

[GPU 0] Gen  3100 | Best: 78329.00 | 339.8s
[GP] gpu_0 intermediate update: 78329.00 at gen 3100
[GP] gpu_0 intermediate update: 78121.00 at gen 3200

==================================================
GP ANALYSIS - Cycle 8
  Collected 40 solutions
==================================================

[GP] ========== GENETIC PROGRAMMING ANALYSIS STARTED ==========
[GP] Cycle: 7
[GP] Input: 40 solutions received for analysis
[GP] Fitness range: best=78121.00, worst=78515.00
[GP] Analysis config: blocks=True, fft=False, similarity=False
[GP] Starting analysis...
[GP] Phase 1: Extracting building blocks...

*** [GPU 0] NEW GLOBAL BEST: 78121.00 at gen 3200 ***
    Saved to best_solution.json

[GPU 0] Gen  3200 | Best: 78121.00 | 350.9s
[GP] Phase 1 complete: Found 30 building blocks
[GP] Phase 2: FFT analysis DISABLED
[GP] Phase 3: Similarity analysis DISABLED
[GP] ========== GP ANALYSIS COMPLETE ==========


[GP] ========== CANDIDATE GENERATION STARTED ==========
[GP] Generating 20 new candidate solutions
[GP] Available data: 40 top solutions, 30 building blocks, 0 FFT patterns, 0 similarity patterns
[GP] Generation strategy: 6 block-based, 6 interpolated, 8 mutated
[GP] Strategy 1: Creating 6 candidates via building block combination...
[GP] Strategy 1 complete: 6 block-based candidates created
[GP] Strategy 2: Creating 6 candidates via solution interpolation...
[GP] Strategy 2 complete: 6 interpolated candidates created
[GP] Strategy 3: Creating 8 candidates via guided mutation...
[GP] Strategy 3 complete: 8 mutated candidates created
[GP] Total candidates generated: 20
[GP] Strategy breakdown: Block=48, Interp=48, Mut=64
[GP] ========== CANDIDATE GENERATION COMPLETE ==========


*** [GPU 0] NEW GLOBAL BEST: 77876.00 at gen 3300 ***
    Saved to best_solution.json

[GPU 0] Gen  3300 | Best: 77876.00 | 361.7s
[GPU 0] Gene injection: 20 candidates injected at gen 3400 (total so far: 160)

*** [GPU 0] NEW GLOBAL BEST: 77743.00 at gen 3400 ***
    Saved to best_solution.json

[GPU 0] Gen  3400 | Best: 77743.00 | 372.3s
  -> 20 candidates sent to 1/1 workers
[GP] gpu_0 intermediate update: 77876.00 at gen 3300
[GP] gpu_0 intermediate update: 77743.00 at gen 3400

*** [GPU 0] NEW GLOBAL BEST: 77569.00 at gen 3500 ***
    Saved to best_solution.json

[GPU 0] Gen  3500 | Best: 77569.00 | 383.1s
[GP] gpu_0 intermediate update: 77569.00 at gen 3500
[GP] gpu_0 intermediate update: 77382.00 at gen 3600

==================================================
GP ANALYSIS - Cycle 9
  Collected 40 solutions
==================================================

[GP] ========== GENETIC PROGRAMMING ANALYSIS STARTED ==========
[GP] Cycle: 8
[GP] Input: 40 solutions received for analysis
[GP] Fitness range: best=77359.00, worst=77743.00
[GP] Analysis config: blocks=True, fft=False, similarity=False
[GP] Starting analysis...
[GP] Phase 1: Extracting building blocks...

*** [GPU 0] NEW GLOBAL BEST: 77359.00 at gen 3600 ***
    Saved to best_solution.json

[GPU 0] Gen  3600 | Best: 77359.00 | 394.2s
[GP] Phase 1 complete: Found 30 building blocks
[GP] Phase 2: FFT analysis DISABLED
[GP] Phase 3: Similarity analysis DISABLED
[GP] ========== GP ANALYSIS COMPLETE ==========


[GP] ========== CANDIDATE GENERATION STARTED ==========
[GP] Generating 20 new candidate solutions
[GP] Available data: 40 top solutions, 30 building blocks, 0 FFT patterns, 0 similarity patterns
[GP] Generation strategy: 6 block-based, 6 interpolated, 8 mutated
[GP] Strategy 1: Creating 6 candidates via building block combination...
[GP] Strategy 1 complete: 6 block-based candidates created
[GP] Strategy 2: Creating 6 candidates via solution interpolation...
[GP] Strategy 2 complete: 6 interpolated candidates created
[GP] Strategy 3: Creating 8 candidates via guided mutation...
[GP] Strategy 3 complete: 8 mutated candidates created
[GP] Total candidates generated: 20
[GP] Strategy breakdown: Block=54, Interp=54, Mut=72
[GP] ========== CANDIDATE GENERATION COMPLETE ==========


*** [GPU 0] NEW GLOBAL BEST: 77276.00 at gen 3700 ***
    Saved to best_solution.json

[GPU 0] Gen  3700 | Best: 77276.00 | 405.1s
[GPU 0] Gene injection: 20 candidates injected at gen 3800 (total so far: 180)

*** [GPU 0] NEW GLOBAL BEST: 77176.00 at gen 3800 ***
    Saved to best_solution.json

[GPU 0] Gen  3800 | Best: 77176.00 | 415.7s
  -> 20 candidates sent to 1/1 workers
[GP] gpu_0 intermediate update: 77359.00 at gen 3600
[GP] gpu_0 intermediate update: 77276.00 at gen 3700
[GP] gpu_0 intermediate update: 77176.00 at gen 3800

*** [GPU 0] NEW GLOBAL BEST: 76980.00 at gen 3900 ***
    Saved to best_solution.json

[GPU 0] Gen  3900 | Best: 76980.00 | 426.7s
[GP] gpu_0 intermediate update: 76980.00 at gen 3900
[GP] gpu_0 intermediate update: 76860.00 at gen 4000

==================================================
GP ANALYSIS - Cycle 10
  Collected 40 solutions
==================================================

[GP] ========== GENETIC PROGRAMMING ANALYSIS STARTED ==========
[GP] Cycle: 9
[GP] Input: 40 solutions received for analysis
[GP] Fitness range: best=76860.00, worst=77176.00
[GP] Analysis config: blocks=True, fft=False, similarity=False
[GP] Starting analysis...
[GP] Phase 1: Extracting building blocks...

*** [GPU 0] NEW GLOBAL BEST: 76860.00 at gen 4000 ***
    Saved to best_solution.json

[GPU 0] Gen  4000 | Best: 76860.00 | 437.8s
[GP] Phase 1 complete: Found 30 building blocks
[GP] Phase 2: FFT analysis DISABLED
[GP] Phase 3: Similarity analysis DISABLED
[GP] ========== GP ANALYSIS COMPLETE ==========


[GP] ========== CANDIDATE GENERATION STARTED ==========
[GP] Generating 20 new candidate solutions
[GP] Available data: 40 top solutions, 30 building blocks, 0 FFT patterns, 0 similarity patterns
[GP] Generation strategy: 6 block-based, 6 interpolated, 8 mutated
[GP] Strategy 1: Creating 6 candidates via building block combination...
[GP] Strategy 1 complete: 6 block-based candidates created
[GP] Strategy 2: Creating 6 candidates via solution interpolation...
[GP] Strategy 2 complete: 6 interpolated candidates created
[GP] Strategy 3: Creating 8 candidates via guided mutation...
[GP] Strategy 3 complete: 8 mutated candidates created
[GP] Total candidates generated: 20
[GP] Strategy breakdown: Block=60, Interp=60, Mut=80
[GP] ========== CANDIDATE GENERATION COMPLETE ==========

    [Checkpoint] Saved to ./results/cold_start/blocks_only/rat783/1R10/job_times_10_seed0_4000.json

*** [GPU 0] NEW GLOBAL BEST: 76635.00 at gen 4100 ***
    Saved to best_solution.json

[GPU 0] Gen  4100 | Best: 76635.00 | 448.7s
[GPU 0] Gene injection: 20 candidates injected at gen 4200 (total so far: 200)
  -> 20 candidates sent to 1/1 workers

[CHECKPOINT] Saved B.json at gen 2000 (makespan: 76860.00)

*** [GPU 0] NEW GLOBAL BEST: 76543.00 at gen 4200 ***
    Saved to best_solution.json

[GPU 0] Gen  4200 | Best: 76543.00 | 459.5s
[GP] gpu_0 intermediate update: 76635.00 at gen 4100
[GP] gpu_0 intermediate update: 76543.00 at gen 4200

*** [GPU 0] NEW GLOBAL BEST: 76474.00 at gen 4300 ***
    Saved to best_solution.json

[GPU 0] Gen  4300 | Best: 76474.00 | 470.3s
[GP] gpu_0 intermediate update: 76474.00 at gen 4300
[GP] gpu_0 intermediate update: 76465.00 at gen 4400

==================================================
GP ANALYSIS - Cycle 11
  Collected 40 solutions
==================================================

[GP] ========== GENETIC PROGRAMMING ANALYSIS STARTED ==========
[GP] Cycle: 10
[GP] Input: 40 solutions received for analysis
[GP] Fitness range: best=76465.00, worst=76543.00
[GP] Analysis config: blocks=True, fft=False, similarity=False
[GP] Starting analysis...
[GP] Phase 1: Extracting building blocks...

*** [GPU 0] NEW GLOBAL BEST: 76465.00 at gen 4400 ***
    Saved to best_solution.json

[GPU 0] Gen  4400 | Best: 76465.00 | 481.1s
[GP] Phase 1 complete: Found 30 building blocks
[GP] Phase 2: FFT analysis DISABLED
[GP] Phase 3: Similarity analysis DISABLED
[GP] ========== GP ANALYSIS COMPLETE ==========


[GP] ========== CANDIDATE GENERATION STARTED ==========
[GP] Generating 20 new candidate solutions
[GP] Available data: 40 top solutions, 30 building blocks, 0 FFT patterns, 0 similarity patterns
[GP] Generation strategy: 6 block-based, 6 interpolated, 8 mutated
[GP] Strategy 1: Creating 6 candidates via building block combination...
[GP] Strategy 1 complete: 6 block-based candidates created
[GP] Strategy 2: Creating 6 candidates via solution interpolation...
[GP] Strategy 2 complete: 6 interpolated candidates created
[GP] Strategy 3: Creating 8 candidates via guided mutation...
[GP] Strategy 3 complete: 8 mutated candidates created
[GP] Total candidates generated: 20
[GP] Strategy breakdown: Block=66, Interp=66, Mut=88
[GP] ========== CANDIDATE GENERATION COMPLETE ==========


*** [GPU 0] NEW GLOBAL BEST: 76350.00 at gen 4500 ***
    Saved to best_solution.json

[GPU 0] Gen  4500 | Best: 76350.00 | 491.9s
[GPU 0] Gene injection: 20 candidates injected at gen 4600 (total so far: 220)

*** [GPU 0] NEW GLOBAL BEST: 76262.00 at gen 4600 ***
    Saved to best_solution.json

[GPU 0] Gen  4600 | Best: 76262.00 | 502.8s
  -> 20 candidates sent to 1/1 workers
[GP] gpu_0 intermediate update: 76350.00 at gen 4500
[GP] gpu_0 intermediate update: 76262.00 at gen 4600

*** [GPU 0] NEW GLOBAL BEST: 76186.00 at gen 4700 ***
    Saved to best_solution.json

[GPU 0] Gen  4700 | Best: 76186.00 | 513.4s
[GP] gpu_0 intermediate update: 76186.00 at gen 4700

==================================================
GP ANALYSIS - Cycle 12
  Collected 40 solutions
==================================================

[GP] ========== GENETIC PROGRAMMING ANALYSIS STARTED ==========
[GP] Cycle: 11
[GP] Input: 40 solutions received for analysis
[GP] Fitness range: best=76186.00, worst=76262.00
[GP] Analysis config: blocks=True, fft=False, similarity=False
[GP] Starting analysis...
[GP] Phase 1: Extracting building blocks...
[GP] Phase 1 complete: Found 30 building blocks
[GP] Phase 2: FFT analysis DISABLED
[GP] Phase 3: Similarity analysis DISABLED
[GP] ========== GP ANALYSIS COMPLETE ==========


[GP] ========== CANDIDATE GENERATION STARTED ==========
[GP] Generating 20 new candidate solutions
[GP] Available data: 40 top solutions, 30 building blocks, 0 FFT patterns, 0 similarity patterns
[GP] Generation strategy: 6 block-based, 6 interpolated, 8 mutated
[GP] Strategy 1: Creating 6 candidates via building block combination...
[GP] Strategy 1 complete: 6 block-based candidates created
[GP] Strategy 2: Creating 6 candidates via solution interpolation...
[GP] Strategy 2 complete: 6 interpolated candidates created
[GP] Strategy 3: Creating 8 candidates via guided mutation...
[GP] Strategy 3 complete: 8 mutated candidates created
[GP] Total candidates generated: 20
[GP] Strategy breakdown: Block=72, Interp=72, Mut=96
[GP] ========== CANDIDATE GENERATION COMPLETE ==========

[GPU 0] Gen  4800 | Best: 76186.00 | 524.5s

*** [GPU 0] NEW GLOBAL BEST: 76078.00 at gen 4900 ***
    Saved to best_solution.json

[GPU 0] Gen  4900 | Best: 76078.00 | 535.5s
[GPU 0] Gene injection: 20 candidates injected at gen 5000 (total so far: 240)
[GPU 0] Evolution complete. Sending final results...
  -> 20 candidates sent to 1/1 workers
[GP] gpu_0 intermediate update: 76078.00 at gen 4900
[GP] gpu_0 intermediate update: 76061.00 at gen 5000
[GP] Worker finished: gpu_0 (best=76061.00)

[GP] All workers finished. Total GP cycles: 12

[Final Collection] Have 1/1 workers. Waiting up to 120s for remaining...

[Critical] Attempting final result collection before terminating workers...

[Results Summary] Collected 1 results:
  gpu_0: fitness=76061.00, intermediate=False, gen=final

======================================================================
COMPLETE
======================================================================
Best: 76061.00 from gpu_0
Time: 548.8s
Total candidates injected: 240

Solution JSON saved to ./results/cold_start/blocks_only/rat783/1R10/job_times_10_seed0.json
HTML Gantt chart saved to: ./results/cold_start/blocks_only/rat783/1R10/job_times_10_seed0.html
