Setting random seed to 0
DEBUG: proc shape: (1000,), agents: 6, resources: 4, n: 1000

======================================================================
VRP-RPD SOLVER
======================================================================
Problem: 999 customers, 6 agents, k=4
Heuristic: None
Genetic Programming: Yes
Warm Start: No
Gene Injection: Yes
Workers: 1 GPU + 0 CPU
Generations: 5000
======================================================================


[GP] Starting GP collection loop (timeout: 12975s)...

*** [GPU 0] NEW GLOBAL BEST: 767786108.00 at gen 0 ***
    Saved to best_solution.json

[GPU 0] Gen     0 | Best: 767786108.00 | 0.5s
[GP] gpu_0 first intermediate: 767786108.00 at gen 0

*** [GPU 0] NEW GLOBAL BEST: 530439100.00 at gen 100 ***
    Saved to best_solution.json

[GPU 0] Gen   100 | Best: 530439100.00 | 14.7s
[GP] gpu_0 intermediate update: 530439100.00 at gen 100
[GP] gpu_0 intermediate update: 474597690.00 at gen 200

*** [GPU 0] NEW GLOBAL BEST: 474398118.00 at gen 200 ***
    Saved to best_solution.json

[GPU 0] Gen   200 | Best: 474398118.00 | 28.9s
[GP] gpu_0 intermediate update: 474398118.00 at gen 200

*** [GPU 0] NEW GLOBAL BEST: 460079064.00 at gen 300 ***
    Saved to best_solution.json

[GPU 0] Gen   300 | Best: 460079064.00 | 42.7s
[GP] gpu_0 intermediate update: 460079064.00 at gen 300
[GP] gpu_0 intermediate update: 447123948.00 at gen 400

==================================================
GP ANALYSIS - Cycle 1
  Collected 40 solutions
==================================================

[GP] ========== GENETIC PROGRAMMING ANALYSIS STARTED ==========
[GP] Cycle: 0
[GP] Input: 40 solutions received for analysis
[GP] Fitness range: best=446610400.00, worst=474763936.00
[GP] Analysis config: blocks=True, fft=False, similarity=False
[GP] Starting analysis...
[GP] Phase 1: Extracting building blocks...

*** [GPU 0] NEW GLOBAL BEST: 446610399.00 at gen 400 ***
    Saved to best_solution.json

[GPU 0] Gen   400 | Best: 446610399.00 | 56.9s
[GP] Phase 1 complete: Found 30 building blocks
[GP] Phase 2: FFT analysis DISABLED
[GP] Phase 3: Similarity analysis DISABLED
[GP] ========== GP ANALYSIS COMPLETE ==========


[GP] ========== CANDIDATE GENERATION STARTED ==========
[GP] Generating 20 new candidate solutions
[GP] Available data: 40 top solutions, 30 building blocks, 0 FFT patterns, 0 similarity patterns
[GP] Generation strategy: 6 block-based, 6 interpolated, 8 mutated
[GP] Strategy 1: Creating 6 candidates via building block combination...
[GP] Strategy 1 complete: 6 block-based candidates created
[GP] Strategy 2: Creating 6 candidates via solution interpolation...
[GP] Strategy 2 complete: 6 interpolated candidates created
[GP] Strategy 3: Creating 8 candidates via guided mutation...
[GP] Strategy 3 complete: 8 mutated candidates created
[GP] Total candidates generated: 20
[GP] Strategy breakdown: Block=6, Interp=6, Mut=8
[GP] ========== CANDIDATE GENERATION COMPLETE ==========


*** [GPU 0] NEW GLOBAL BEST: 437929813.00 at gen 500 ***
    Saved to best_solution.json

[GPU 0] Gen   500 | Best: 437929813.00 | 70.9s
[GPU 0] Gene injection: 20 candidates injected at gen 600 (total so far: 20)
  -> 20 candidates sent to 1/1 workers
[GP] gpu_0 intermediate update: 446610399.00 at gen 400
[GP] gpu_0 intermediate update: 437929813.00 at gen 500
[GP] gpu_0 intermediate update: 432323886.00 at gen 600

*** [GPU 0] NEW GLOBAL BEST: 432323886.00 at gen 600 ***
    Saved to best_solution.json

[GPU 0] Gen   600 | Best: 432323886.00 | 85.0s

*** [GPU 0] NEW GLOBAL BEST: 427377138.00 at gen 700 ***
    Saved to best_solution.json

[GPU 0] Gen   700 | Best: 427377138.00 | 99.1s
[GP] gpu_0 intermediate update: 427377138.00 at gen 700
[GP] gpu_0 intermediate update: 422917523.00 at gen 800

==================================================
GP ANALYSIS - Cycle 2
  Collected 40 solutions
==================================================

[GP] ========== GENETIC PROGRAMMING ANALYSIS STARTED ==========
[GP] Cycle: 1
[GP] Input: 40 solutions received for analysis
[GP] Fitness range: best=422590208.00, worst=432391904.00
[GP] Analysis config: blocks=True, fft=False, similarity=False
[GP] Starting analysis...
[GP] Phase 1: Extracting building blocks...

*** [GPU 0] NEW GLOBAL BEST: 422590199.00 at gen 800 ***
    Saved to best_solution.json

[GPU 0] Gen   800 | Best: 422590199.00 | 113.3s
[GP] Phase 1 complete: Found 30 building blocks
[GP] Phase 2: FFT analysis DISABLED
[GP] Phase 3: Similarity analysis DISABLED
[GP] ========== GP ANALYSIS COMPLETE ==========


[GP] ========== CANDIDATE GENERATION STARTED ==========
[GP] Generating 20 new candidate solutions
[GP] Available data: 40 top solutions, 30 building blocks, 0 FFT patterns, 0 similarity patterns
[GP] Generation strategy: 6 block-based, 6 interpolated, 8 mutated
[GP] Strategy 1: Creating 6 candidates via building block combination...
[GP] Strategy 1 complete: 6 block-based candidates created
[GP] Strategy 2: Creating 6 candidates via solution interpolation...
[GP] Strategy 2 complete: 6 interpolated candidates created
[GP] Strategy 3: Creating 8 candidates via guided mutation...
[GP] Strategy 3 complete: 8 mutated candidates created
[GP] Total candidates generated: 20
[GP] Strategy breakdown: Block=12, Interp=12, Mut=16
[GP] ========== CANDIDATE GENERATION COMPLETE ==========


*** [GPU 0] NEW GLOBAL BEST: 418400267.00 at gen 900 ***
    Saved to best_solution.json

[GPU 0] Gen   900 | Best: 418400267.00 | 127.4s
[GPU 0] Gene injection: 20 candidates injected at gen 1000 (total so far: 40)
  -> 20 candidates sent to 1/1 workers
[GP] gpu_0 intermediate update: 422590199.00 at gen 800
[GP] gpu_0 intermediate update: 418400267.00 at gen 900
[GP] gpu_0 intermediate update: 413021313.00 at gen 1000

*** [GPU 0] NEW GLOBAL BEST: 413021313.00 at gen 1000 ***
    Saved to best_solution.json

[GPU 0] Gen  1000 | Best: 413021313.00 | 141.7s
    [Checkpoint] Saved to ./results/cold_start/blocks_only/dsj1000/1R20/job_times_1_seed0_1000.json

*** [GPU 0] NEW GLOBAL BEST: 410062395.00 at gen 1100 ***
    Saved to best_solution.json

[GPU 0] Gen  1100 | Best: 410062395.00 | 155.9s
[GP] gpu_0 intermediate update: 410062395.00 at gen 1100
[GP] gpu_0 intermediate update: 407429145.00 at gen 1200

==================================================
GP ANALYSIS - Cycle 3
  Collected 40 solutions
==================================================

[GP] ========== GENETIC PROGRAMMING ANALYSIS STARTED ==========
[GP] Cycle: 2
[GP] Input: 40 solutions received for analysis
[GP] Fitness range: best=407429152.00, worst=413046560.00
[GP] Analysis config: blocks=True, fft=False, similarity=False
[GP] Starting analysis...
[GP] Phase 1: Extracting building blocks...

*** [GPU 0] NEW GLOBAL BEST: 407429145.00 at gen 1200 ***
    Saved to best_solution.json

[GPU 0] Gen  1200 | Best: 407429145.00 | 169.7s
[GP] Phase 1 complete: Found 30 building blocks
[GP] Phase 2: FFT analysis DISABLED
[GP] Phase 3: Similarity analysis DISABLED
[GP] ========== GP ANALYSIS COMPLETE ==========


[GP] ========== CANDIDATE GENERATION STARTED ==========
[GP] Generating 20 new candidate solutions
[GP] Available data: 40 top solutions, 30 building blocks, 0 FFT patterns, 0 similarity patterns
[GP] Generation strategy: 6 block-based, 6 interpolated, 8 mutated
[GP] Strategy 1: Creating 6 candidates via building block combination...
[GP] Strategy 1 complete: 6 block-based candidates created
[GP] Strategy 2: Creating 6 candidates via solution interpolation...
[GP] Strategy 2 complete: 6 interpolated candidates created
[GP] Strategy 3: Creating 8 candidates via guided mutation...
[GP] Strategy 3 complete: 8 mutated candidates created
[GP] Total candidates generated: 20
[GP] Strategy breakdown: Block=18, Interp=18, Mut=24
[GP] ========== CANDIDATE GENERATION COMPLETE ==========


*** [GPU 0] NEW GLOBAL BEST: 404336403.00 at gen 1300 ***
    Saved to best_solution.json

[GPU 0] Gen  1300 | Best: 404336403.00 | 183.0s
[GPU 0] Gene injection: 20 candidates injected at gen 1400 (total so far: 60)
  -> 20 candidates sent to 1/1 workers
[GP] gpu_0 intermediate update: 404336403.00 at gen 1300
[GP] gpu_0 intermediate update: 401758187.00 at gen 1400

*** [GPU 0] NEW GLOBAL BEST: 401758187.00 at gen 1400 ***
    Saved to best_solution.json

[GPU 0] Gen  1400 | Best: 401758187.00 | 197.1s

*** [GPU 0] NEW GLOBAL BEST: 399242835.00 at gen 1500 ***
    Saved to best_solution.json

[GPU 0] Gen  1500 | Best: 399242835.00 | 211.0s
[GP] gpu_0 intermediate update: 399242835.00 at gen 1500
[GP] gpu_0 intermediate update: 397561174.00 at gen 1600

==================================================
GP ANALYSIS - Cycle 4
  Collected 40 solutions
==================================================

[GP] ========== GENETIC PROGRAMMING ANALYSIS STARTED ==========
[GP] Cycle: 3
[GP] Input: 40 solutions received for analysis
[GP] Fitness range: best=397561184.00, worst=401758176.00
[GP] Analysis config: blocks=True, fft=False, similarity=False
[GP] Starting analysis...
[GP] Phase 1: Extracting building blocks...

*** [GPU 0] NEW GLOBAL BEST: 397561174.00 at gen 1600 ***
    Saved to best_solution.json

[GPU 0] Gen  1600 | Best: 397561174.00 | 225.1s
[GP] Phase 1 complete: Found 30 building blocks
[GP] Phase 2: FFT analysis DISABLED
[GP] Phase 3: Similarity analysis DISABLED
[GP] ========== GP ANALYSIS COMPLETE ==========


[GP] ========== CANDIDATE GENERATION STARTED ==========
[GP] Generating 20 new candidate solutions
[GP] Available data: 40 top solutions, 30 building blocks, 0 FFT patterns, 0 similarity patterns
[GP] Generation strategy: 6 block-based, 6 interpolated, 8 mutated
[GP] Strategy 1: Creating 6 candidates via building block combination...
[GP] Strategy 1 complete: 6 block-based candidates created
[GP] Strategy 2: Creating 6 candidates via solution interpolation...
[GP] Strategy 2 complete: 6 interpolated candidates created
[GP] Strategy 3: Creating 8 candidates via guided mutation...
[GP] Strategy 3 complete: 8 mutated candidates created
[GP] Total candidates generated: 20
[GP] Strategy breakdown: Block=24, Interp=24, Mut=32
[GP] ========== CANDIDATE GENERATION COMPLETE ==========


*** [GPU 0] NEW GLOBAL BEST: 396019602.00 at gen 1700 ***
    Saved to best_solution.json

[GPU 0] Gen  1700 | Best: 396019602.00 | 239.1s
[GPU 0] Gene injection: 20 candidates injected at gen 1800 (total so far: 80)

*** [GPU 0] NEW GLOBAL BEST: 393217472.00 at gen 1800 ***
  -> 20 candidates sent to 1/1 workers
[GP] gpu_0 intermediate update: 396019602.00 at gen 1700
[GP] gpu_0 intermediate update: 393217472.00 at gen 1800
    Saved to best_solution.json

[GPU 0] Gen  1800 | Best: 393217472.00 | 252.7s

*** [GPU 0] NEW GLOBAL BEST: 390998892.00 at gen 1900 ***
    Saved to best_solution.json

[GPU 0] Gen  1900 | Best: 390998892.00 | 266.8s
[GP] gpu_0 intermediate update: 390998892.00 at gen 1900
[GP] gpu_0 intermediate update: 388463019.00 at gen 2000

==================================================
GP ANALYSIS - Cycle 5
  Collected 40 solutions
==================================================

[GP] ========== GENETIC PROGRAMMING ANALYSIS STARTED ==========
[GP] Cycle: 4
[GP] Input: 40 solutions received for analysis
[GP] Fitness range: best=388463008.00, worst=393217472.00
[GP] Analysis config: blocks=True, fft=False, similarity=False
[GP] Starting analysis...
[GP] Phase 1: Extracting building blocks...

*** [GPU 0] NEW GLOBAL BEST: 388463019.00 at gen 2000 ***
    Saved to best_solution.json

[GPU 0] Gen  2000 | Best: 388463019.00 | 280.9s
[GP] Phase 1 complete: Found 30 building blocks
[GP] Phase 2: FFT analysis DISABLED
[GP] Phase 3: Similarity analysis DISABLED
[GP] ========== GP ANALYSIS COMPLETE ==========


[GP] ========== CANDIDATE GENERATION STARTED ==========
[GP] Generating 20 new candidate solutions
[GP] Available data: 40 top solutions, 30 building blocks, 0 FFT patterns, 0 similarity patterns
[GP] Generation strategy: 6 block-based, 6 interpolated, 8 mutated
[GP] Strategy 1: Creating 6 candidates via building block combination...
[GP] Strategy 1 complete: 6 block-based candidates created
[GP] Strategy 2: Creating 6 candidates via solution interpolation...
[GP] Strategy 2 complete: 6 interpolated candidates created
[GP] Strategy 3: Creating 8 candidates via guided mutation...
[GP] Strategy 3 complete: 8 mutated candidates created
[GP] Total candidates generated: 20
[GP] Strategy breakdown: Block=30, Interp=30, Mut=40
[GP] ========== CANDIDATE GENERATION COMPLETE ==========

    [Checkpoint] Saved to ./results/cold_start/blocks_only/dsj1000/1R20/job_times_1_seed0_2000.json

*** [GPU 0] NEW GLOBAL BEST: 385829354.00 at gen 2100 ***
    Saved to best_solution.json

[GPU 0] Gen  2100 | Best: 385829354.00 | 294.7s
[GPU 0] Gene injection: 20 candidates injected at gen 2200 (total so far: 100)
  -> 20 candidates sent to 1/1 workers

[CHECKPOINT] Saved A.json at gen 1000 (makespan: 388463019.00)

*** [GPU 0] NEW GLOBAL BEST: 384756459.00 at gen 2200 ***
    Saved to best_solution.json

[GPU 0] Gen  2200 | Best: 384756459.00 | 308.7s
[GP] gpu_0 intermediate update: 385829354.00 at gen 2100
[GP] gpu_0 intermediate update: 384756459.00 at gen 2200

*** [GPU 0] NEW GLOBAL BEST: 383237790.00 at gen 2300 ***
    Saved to best_solution.json

[GPU 0] Gen  2300 | Best: 383237790.00 | 322.5s
[GP] gpu_0 intermediate update: 383237790.00 at gen 2300
[GP] gpu_0 intermediate update: 382196419.00 at gen 2400

==================================================
GP ANALYSIS - Cycle 6
  Collected 40 solutions
==================================================

[GP] ========== GENETIC PROGRAMMING ANALYSIS STARTED ==========
[GP] Cycle: 5
[GP] Input: 40 solutions received for analysis
[GP] Fitness range: best=382196416.00, worst=384756448.00
[GP] Analysis config: blocks=True, fft=False, similarity=False
[GP] Starting analysis...
[GP] Phase 1: Extracting building blocks...

*** [GPU 0] NEW GLOBAL BEST: 382196419.00 at gen 2400 ***
    Saved to best_solution.json

[GPU 0] Gen  2400 | Best: 382196419.00 | 336.2s
[GP] Phase 1 complete: Found 30 building blocks
[GP] Phase 2: FFT analysis DISABLED
[GP] Phase 3: Similarity analysis DISABLED
[GP] ========== GP ANALYSIS COMPLETE ==========


[GP] ========== CANDIDATE GENERATION STARTED ==========
[GP] Generating 20 new candidate solutions
[GP] Available data: 40 top solutions, 30 building blocks, 0 FFT patterns, 0 similarity patterns
[GP] Generation strategy: 6 block-based, 6 interpolated, 8 mutated
[GP] Strategy 1: Creating 6 candidates via building block combination...
[GP] Strategy 1 complete: 6 block-based candidates created
[GP] Strategy 2: Creating 6 candidates via solution interpolation...
[GP] Strategy 2 complete: 6 interpolated candidates created
[GP] Strategy 3: Creating 8 candidates via guided mutation...
[GP] Strategy 3 complete: 8 mutated candidates created
[GP] Total candidates generated: 20
[GP] Strategy breakdown: Block=36, Interp=36, Mut=48
[GP] ========== CANDIDATE GENERATION COMPLETE ==========


*** [GPU 0] NEW GLOBAL BEST: 381126435.00 at gen 2500 ***
    Saved to best_solution.json

[GPU 0] Gen  2500 | Best: 381126435.00 | 350.2s
[GPU 0] Gene injection: 20 candidates injected at gen 2600 (total so far: 120)
  -> 20 candidates sent to 1/1 workers
[GP] gpu_0 intermediate update: 381126435.00 at gen 2500
[GP] gpu_0 intermediate update: 380199917.00 at gen 2600

*** [GPU 0] NEW GLOBAL BEST: 380199917.00 at gen 2600 ***
    Saved to best_solution.json

[GPU 0] Gen  2600 | Best: 380199917.00 | 363.9s

*** [GPU 0] NEW GLOBAL BEST: 378897146.00 at gen 2700 ***
    Saved to best_solution.json

[GPU 0] Gen  2700 | Best: 378897146.00 | 377.9s
[GP] gpu_0 intermediate update: 378897146.00 at gen 2700
[GP] gpu_0 intermediate update: 377717766.00 at gen 2800

==================================================
GP ANALYSIS - Cycle 7
  Collected 40 solutions
==================================================

[GP] ========== GENETIC PROGRAMMING ANALYSIS STARTED ==========
[GP] Cycle: 6
[GP] Input: 40 solutions received for analysis
[GP] Fitness range: best=377717760.00, worst=380212160.00
[GP] Analysis config: blocks=True, fft=False, similarity=False
[GP] Starting analysis...
[GP] Phase 1: Extracting building blocks...

*** [GPU 0] NEW GLOBAL BEST: 377717766.00 at gen 2800 ***
    Saved to best_solution.json

[GPU 0] Gen  2800 | Best: 377717766.00 | 391.8s
[GP] Phase 1 complete: Found 30 building blocks
[GP] Phase 2: FFT analysis DISABLED
[GP] Phase 3: Similarity analysis DISABLED
[GP] ========== GP ANALYSIS COMPLETE ==========


[GP] ========== CANDIDATE GENERATION STARTED ==========
[GP] Generating 20 new candidate solutions
[GP] Available data: 40 top solutions, 30 building blocks, 0 FFT patterns, 0 similarity patterns
[GP] Generation strategy: 6 block-based, 6 interpolated, 8 mutated
[GP] Strategy 1: Creating 6 candidates via building block combination...
[GP] Strategy 1 complete: 6 block-based candidates created
[GP] Strategy 2: Creating 6 candidates via solution interpolation...
[GP] Strategy 2 complete: 6 interpolated candidates created
[GP] Strategy 3: Creating 8 candidates via guided mutation...
[GP] Strategy 3 complete: 8 mutated candidates created
[GP] Total candidates generated: 20
[GP] Strategy breakdown: Block=42, Interp=42, Mut=56
[GP] ========== CANDIDATE GENERATION COMPLETE ==========


*** [GPU 0] NEW GLOBAL BEST: 376159156.00 at gen 2900 ***
    Saved to best_solution.json

[GPU 0] Gen  2900 | Best: 376159156.00 | 405.6s
[GPU 0] Gene injection: 20 candidates injected at gen 3000 (total so far: 140)
  -> 20 candidates sent to 1/1 workers
[GP] gpu_0 intermediate update: 376159156.00 at gen 2900
[GP] gpu_0 intermediate update: 375074021.00 at gen 3000

*** [GPU 0] NEW GLOBAL BEST: 375074021.00 at gen 3000 ***
    Saved to best_solution.json

[GPU 0] Gen  3000 | Best: 375074021.00 | 418.9s
    [Checkpoint] Saved to ./results/cold_start/blocks_only/dsj1000/1R20/job_times_1_seed0_3000.json

*** [GPU 0] NEW GLOBAL BEST: 373866230.00 at gen 3100 ***
    Saved to best_solution.json

[GPU 0] Gen  3100 | Best: 373866230.00 | 432.5s
[GP] gpu_0 intermediate update: 373866230.00 at gen 3100
[GP] gpu_0 intermediate update: 372955621.00 at gen 3200

==================================================
GP ANALYSIS - Cycle 8
  Collected 40 solutions
==================================================

[GP] ========== GENETIC PROGRAMMING ANALYSIS STARTED ==========
[GP] Cycle: 7
[GP] Input: 40 solutions received for analysis
[GP] Fitness range: best=372955616.00, worst=375077920.00
[GP] Analysis config: blocks=True, fft=False, similarity=False
[GP] Starting analysis...
[GP] Phase 1: Extracting building blocks...

*** [GPU 0] NEW GLOBAL BEST: 372955621.00 at gen 3200 ***
    Saved to best_solution.json

[GPU 0] Gen  3200 | Best: 372955621.00 | 446.5s
[GP] Phase 1 complete: Found 30 building blocks
[GP] Phase 2: FFT analysis DISABLED
[GP] Phase 3: Similarity analysis DISABLED
[GP] ========== GP ANALYSIS COMPLETE ==========


[GP] ========== CANDIDATE GENERATION STARTED ==========
[GP] Generating 20 new candidate solutions
[GP] Available data: 40 top solutions, 30 building blocks, 0 FFT patterns, 0 similarity patterns
[GP] Generation strategy: 6 block-based, 6 interpolated, 8 mutated
[GP] Strategy 1: Creating 6 candidates via building block combination...
[GP] Strategy 1 complete: 6 block-based candidates created
[GP] Strategy 2: Creating 6 candidates via solution interpolation...
[GP] Strategy 2 complete: 6 interpolated candidates created
[GP] Strategy 3: Creating 8 candidates via guided mutation...
[GP] Strategy 3 complete: 8 mutated candidates created
[GP] Total candidates generated: 20
[GP] Strategy breakdown: Block=48, Interp=48, Mut=64
[GP] ========== CANDIDATE GENERATION COMPLETE ==========


*** [GPU 0] NEW GLOBAL BEST: 371822932.00 at gen 3300 ***
    Saved to best_solution.json

[GPU 0] Gen  3300 | Best: 371822932.00 | 460.5s
[GPU 0] Gene injection: 20 candidates injected at gen 3400 (total so far: 160)

*** [GPU 0] NEW GLOBAL BEST: 370655132.00 at gen 3400 ***
    Saved to best_solution.json

[GPU 0] Gen  3400 | Best: 370655132.00 | 474.6s
  -> 20 candidates sent to 1/1 workers
[GP] gpu_0 intermediate update: 371822932.00 at gen 3300
[GP] gpu_0 intermediate update: 370712608.00 at gen 3400
[GP] gpu_0 intermediate update: 370655132.00 at gen 3400

*** [GPU 0] NEW GLOBAL BEST: 369584525.00 at gen 3500 ***
    Saved to best_solution.json

[GPU 0] Gen  3500 | Best: 369584525.00 | 488.3s
[GP] gpu_0 intermediate update: 369584525.00 at gen 3500
[GP] gpu_0 intermediate update: 369052251.00 at gen 3600

==================================================
GP ANALYSIS - Cycle 9
  Collected 40 solutions
==================================================

[GP] ========== GENETIC PROGRAMMING ANALYSIS STARTED ==========
[GP] Cycle: 8
[GP] Input: 40 solutions received for analysis
[GP] Fitness range: best=369052256.00, worst=370712608.00
[GP] Analysis config: blocks=True, fft=False, similarity=False
[GP] Starting analysis...
[GP] Phase 1: Extracting building blocks...

*** [GPU 0] NEW GLOBAL BEST: 369052251.00 at gen 3600 ***
    Saved to best_solution.json

[GPU 0] Gen  3600 | Best: 369052251.00 | 502.4s
[GP] Phase 1 complete: Found 30 building blocks
[GP] Phase 2: FFT analysis DISABLED
[GP] Phase 3: Similarity analysis DISABLED
[GP] ========== GP ANALYSIS COMPLETE ==========


[GP] ========== CANDIDATE GENERATION STARTED ==========
[GP] Generating 20 new candidate solutions
[GP] Available data: 40 top solutions, 30 building blocks, 0 FFT patterns, 0 similarity patterns
[GP] Generation strategy: 6 block-based, 6 interpolated, 8 mutated
[GP] Strategy 1: Creating 6 candidates via building block combination...
[GP] Strategy 1 complete: 6 block-based candidates created
[GP] Strategy 2: Creating 6 candidates via solution interpolation...
[GP] Strategy 2 complete: 6 interpolated candidates created
[GP] Strategy 3: Creating 8 candidates via guided mutation...
[GP] Strategy 3 complete: 8 mutated candidates created
[GP] Total candidates generated: 20
[GP] Strategy breakdown: Block=54, Interp=54, Mut=72
[GP] ========== CANDIDATE GENERATION COMPLETE ==========


*** [GPU 0] NEW GLOBAL BEST: 367988674.00 at gen 3700 ***
    Saved to best_solution.json

[GPU 0] Gen  3700 | Best: 367988674.00 | 515.5s
[GPU 0] Gene injection: 20 candidates injected at gen 3800 (total so far: 180)
  -> 20 candidates sent to 1/1 workers
[GP] gpu_0 intermediate update: 367988674.00 at gen 3700
[GP] gpu_0 intermediate update: 367054174.00 at gen 3800

*** [GPU 0] NEW GLOBAL BEST: 367054174.00 at gen 3800 ***
    Saved to best_solution.json

[GPU 0] Gen  3800 | Best: 367054174.00 | 529.5s

*** [GPU 0] NEW GLOBAL BEST: 366241606.00 at gen 3900 ***
    Saved to best_solution.json

[GPU 0] Gen  3900 | Best: 366241606.00 | 543.2s
[GP] gpu_0 intermediate update: 366241606.00 at gen 3900
[GP] gpu_0 intermediate update: 365703608.00 at gen 4000

==================================================
GP ANALYSIS - Cycle 10
  Collected 40 solutions
==================================================

[GP] ========== GENETIC PROGRAMMING ANALYSIS STARTED ==========
[GP] Cycle: 9
[GP] Input: 40 solutions received for analysis
[GP] Fitness range: best=365703616.00, worst=367054176.00
[GP] Analysis config: blocks=True, fft=False, similarity=False
[GP] Starting analysis...
[GP] Phase 1: Extracting building blocks...

*** [GPU 0] NEW GLOBAL BEST: 365703608.00 at gen 4000 ***
    Saved to best_solution.json

[GPU 0] Gen  4000 | Best: 365703608.00 | 556.6s
[GP] Phase 1 complete: Found 30 building blocks
[GP] Phase 2: FFT analysis DISABLED
[GP] Phase 3: Similarity analysis DISABLED
[GP] ========== GP ANALYSIS COMPLETE ==========


[GP] ========== CANDIDATE GENERATION STARTED ==========
[GP] Generating 20 new candidate solutions
[GP] Available data: 40 top solutions, 30 building blocks, 0 FFT patterns, 0 similarity patterns
[GP] Generation strategy: 6 block-based, 6 interpolated, 8 mutated
[GP] Strategy 1: Creating 6 candidates via building block combination...
[GP] Strategy 1 complete: 6 block-based candidates created
[GP] Strategy 2: Creating 6 candidates via solution interpolation...
[GP] Strategy 2 complete: 6 interpolated candidates created
[GP] Strategy 3: Creating 8 candidates via guided mutation...
[GP] Strategy 3 complete: 8 mutated candidates created
[GP] Total candidates generated: 20
[GP] Strategy breakdown: Block=60, Interp=60, Mut=80
[GP] ========== CANDIDATE GENERATION COMPLETE ==========

    [Checkpoint] Saved to ./results/cold_start/blocks_only/dsj1000/1R20/job_times_1_seed0_4000.json

*** [GPU 0] NEW GLOBAL BEST: 365462975.00 at gen 4100 ***
    Saved to best_solution.json

[GPU 0] Gen  4100 | Best: 365462975.00 | 570.3s
[GPU 0] Gene injection: 20 candidates injected at gen 4200 (total so far: 200)
  -> 20 candidates sent to 1/1 workers

[CHECKPOINT] Saved B.json at gen 2000 (makespan: 365703608.00)

*** [GPU 0] NEW GLOBAL BEST: 365083670.00 at gen 4200 ***
    Saved to best_solution.json

[GPU 0] Gen  4200 | Best: 365083670.00 | 583.6s
[GP] gpu_0 intermediate update: 365462975.00 at gen 4100
[GP] gpu_0 intermediate update: 365083670.00 at gen 4200

*** [GPU 0] NEW GLOBAL BEST: 364680375.00 at gen 4300 ***
    Saved to best_solution.json

[GPU 0] Gen  4300 | Best: 364680375.00 | 596.9s
[GP] gpu_0 intermediate update: 364680375.00 at gen 4300
[GP] gpu_0 intermediate update: 364228544.00 at gen 4400

==================================================
GP ANALYSIS - Cycle 11
  Collected 40 solutions
==================================================

[GP] ========== GENETIC PROGRAMMING ANALYSIS STARTED ==========
[GP] Cycle: 10
[GP] Input: 40 solutions received for analysis
[GP] Fitness range: best=364228544.00, worst=365083680.00
[GP] Analysis config: blocks=True, fft=False, similarity=False
[GP] Starting analysis...
[GP] Phase 1: Extracting building blocks...

*** [GPU 0] NEW GLOBAL BEST: 364228544.00 at gen 4400 ***
    Saved to best_solution.json

[GPU 0] Gen  4400 | Best: 364228544.00 | 610.1s
[GP] Phase 1 complete: Found 30 building blocks
[GP] Phase 2: FFT analysis DISABLED
[GP] Phase 3: Similarity analysis DISABLED
[GP] ========== GP ANALYSIS COMPLETE ==========


[GP] ========== CANDIDATE GENERATION STARTED ==========
[GP] Generating 20 new candidate solutions
[GP] Available data: 40 top solutions, 30 building blocks, 0 FFT patterns, 0 similarity patterns
[GP] Generation strategy: 6 block-based, 6 interpolated, 8 mutated
[GP] Strategy 1: Creating 6 candidates via building block combination...
[GP] Strategy 1 complete: 6 block-based candidates created
[GP] Strategy 2: Creating 6 candidates via solution interpolation...
[GP] Strategy 2 complete: 6 interpolated candidates created
[GP] Strategy 3: Creating 8 candidates via guided mutation...
[GP] Strategy 3 complete: 8 mutated candidates created
[GP] Total candidates generated: 20
[GP] Strategy breakdown: Block=66, Interp=66, Mut=88
[GP] ========== CANDIDATE GENERATION COMPLETE ==========


*** [GPU 0] NEW GLOBAL BEST: 363583563.00 at gen 4500 ***
    Saved to best_solution.json

[GPU 0] Gen  4500 | Best: 363583563.00 | 622.8s
[GPU 0] Gene injection: 20 candidates injected at gen 4600 (total so far: 220)
  -> 20 candidates sent to 1/1 workers
[GP] gpu_0 intermediate update: 363583563.00 at gen 4500
[GP] gpu_0 intermediate update: 362578331.00 at gen 4600

*** [GPU 0] NEW GLOBAL BEST: 362578331.00 at gen 4600 ***
    Saved to best_solution.json

[GPU 0] Gen  4600 | Best: 362578331.00 | 636.0s

*** [GPU 0] NEW GLOBAL BEST: 361830251.00 at gen 4700 ***
    Saved to best_solution.json

[GPU 0] Gen  4700 | Best: 361830251.00 | 649.4s
[GP] gpu_0 intermediate update: 361830251.00 at gen 4700
[GP] gpu_0 intermediate update: 361452947.00 at gen 4800

==================================================
GP ANALYSIS - Cycle 12
  Collected 40 solutions
==================================================

[GP] ========== GENETIC PROGRAMMING ANALYSIS STARTED ==========
[GP] Cycle: 11
[GP] Input: 40 solutions received for analysis
[GP] Fitness range: best=361452960.00, worst=362578336.00
[GP] Analysis config: blocks=True, fft=False, similarity=False
[GP] Starting analysis...
[GP] Phase 1: Extracting building blocks...

*** [GPU 0] NEW GLOBAL BEST: 361452947.00 at gen 4800 ***
    Saved to best_solution.json

[GPU 0] Gen  4800 | Best: 361452947.00 | 662.5s
[GP] Phase 1 complete: Found 30 building blocks
[GP] Phase 2: FFT analysis DISABLED
[GP] Phase 3: Similarity analysis DISABLED
[GP] ========== GP ANALYSIS COMPLETE ==========


[GP] ========== CANDIDATE GENERATION STARTED ==========
[GP] Generating 20 new candidate solutions
[GP] Available data: 40 top solutions, 30 building blocks, 0 FFT patterns, 0 similarity patterns
[GP] Generation strategy: 6 block-based, 6 interpolated, 8 mutated
[GP] Strategy 1: Creating 6 candidates via building block combination...
[GP] Strategy 1 complete: 6 block-based candidates created
[GP] Strategy 2: Creating 6 candidates via solution interpolation...
[GP] Strategy 2 complete: 6 interpolated candidates created
[GP] Strategy 3: Creating 8 candidates via guided mutation...
[GP] Strategy 3 complete: 8 mutated candidates created
[GP] Total candidates generated: 20
[GP] Strategy breakdown: Block=72, Interp=72, Mut=96
[GP] ========== CANDIDATE GENERATION COMPLETE ==========


*** [GPU 0] NEW GLOBAL BEST: 361173643.00 at gen 4900 ***
    Saved to best_solution.json

[GPU 0] Gen  4900 | Best: 361173643.00 | 675.7s
[GPU 0] Gene injection: 20 candidates injected at gen 5000 (total so far: 240)
[GPU 0] Evolution complete. Sending final results...
  -> 20 candidates sent to 1/1 workers
[GP] gpu_0 intermediate update: 361173643.00 at gen 4900
[GP] gpu_0 intermediate update: 360300620.00 at gen 5000
[GP] Worker finished: gpu_0 (best=360300620.00)

[GP] All workers finished. Total GP cycles: 12

[Final Collection] Have 1/1 workers. Waiting up to 120s for remaining...

[Critical] Attempting final result collection before terminating workers...

[Results Summary] Collected 1 results:
  gpu_0: fitness=360300620.00, intermediate=False, gen=final

======================================================================
COMPLETE
======================================================================
Best: 360300620.00 from gpu_0
Time: 691.7s
Total candidates injected: 240

Solution JSON saved to ./results/cold_start/blocks_only/dsj1000/1R20/job_times_1_seed0.json
HTML Gantt chart saved to: ./results/cold_start/blocks_only/dsj1000/1R20/job_times_1_seed0.html
