Setting random seed to 0
DEBUG: proc shape: (1000,), agents: 6, resources: 4, n: 1000

======================================================================
VRP-RPD SOLVER
======================================================================
Problem: 999 customers, 6 agents, k=4
Heuristic: None
Genetic Programming: Yes
Warm Start: No
Gene Injection: Yes
Workers: 1 GPU + 0 CPU
Generations: 5000
======================================================================


[GP] Starting GP collection loop (timeout: 12975s)...

*** [GPU 0] NEW GLOBAL BEST: 797273428.00 at gen 0 ***
    Saved to best_solution.json

[GPU 0] Gen     0 | Best: 797273428.00 | 0.5s
[GP] gpu_0 first intermediate: 797273428.00 at gen 0

*** [GPU 0] NEW GLOBAL BEST: 616912845.00 at gen 100 ***
    Saved to best_solution.json

[GPU 0] Gen   100 | Best: 616912845.00 | 13.9s
[GP] gpu_0 intermediate update: 616912845.00 at gen 100
[GP] gpu_0 intermediate update: 585494858.00 at gen 200

*** [GPU 0] NEW GLOBAL BEST: 584877173.00 at gen 200 ***
    Saved to best_solution.json

[GPU 0] Gen   200 | Best: 584877173.00 | 27.2s
[GP] gpu_0 intermediate update: 584877173.00 at gen 200

*** [GPU 0] NEW GLOBAL BEST: 559333559.00 at gen 300 ***
    Saved to best_solution.json

[GPU 0] Gen   300 | Best: 559333559.00 | 40.1s
[GP] gpu_0 intermediate update: 559333559.00 at gen 300
[GP] gpu_0 intermediate update: 540880639.00 at gen 400

==================================================
GP ANALYSIS - Cycle 1
  Collected 40 solutions
==================================================

[GP] ========== GENETIC PROGRAMMING ANALYSIS STARTED ==========
[GP] Cycle: 0
[GP] Input: 40 solutions received for analysis
[GP] Fitness range: best=540880640.00, worst=585655296.00
[GP] Analysis config: blocks=True, fft=False, similarity=False
[GP] Starting analysis...
[GP] Phase 1: Extracting building blocks...

*** [GPU 0] NEW GLOBAL BEST: 540880639.00 at gen 400 ***
    Saved to best_solution.json

[GPU 0] Gen   400 | Best: 540880639.00 | 53.5s
[GP] Phase 1 complete: Found 30 building blocks
[GP] Phase 2: FFT analysis DISABLED
[GP] Phase 3: Similarity analysis DISABLED
[GP] ========== GP ANALYSIS COMPLETE ==========


[GP] ========== CANDIDATE GENERATION STARTED ==========
[GP] Generating 20 new candidate solutions
[GP] Available data: 40 top solutions, 30 building blocks, 0 FFT patterns, 0 similarity patterns
[GP] Generation strategy: 6 block-based, 6 interpolated, 8 mutated
[GP] Strategy 1: Creating 6 candidates via building block combination...
[GP] Strategy 1 complete: 6 block-based candidates created
[GP] Strategy 2: Creating 6 candidates via solution interpolation...
[GP] Strategy 2 complete: 6 interpolated candidates created
[GP] Strategy 3: Creating 8 candidates via guided mutation...
[GP] Strategy 3 complete: 8 mutated candidates created
[GP] Total candidates generated: 20
[GP] Strategy breakdown: Block=6, Interp=6, Mut=8
[GP] ========== CANDIDATE GENERATION COMPLETE ==========


*** [GPU 0] NEW GLOBAL BEST: 529403775.00 at gen 500 ***
    Saved to best_solution.json

[GPU 0] Gen   500 | Best: 529403775.00 | 66.6s
[GPU 0] Gene injection: 20 candidates injected at gen 600 (total so far: 20)
  -> 20 candidates sent to 1/1 workers
[GP] gpu_0 intermediate update: 529403775.00 at gen 500
[GP] gpu_0 intermediate update: 519492357.00 at gen 600

*** [GPU 0] NEW GLOBAL BEST: 519492357.00 at gen 600 ***
    Saved to best_solution.json

[GPU 0] Gen   600 | Best: 519492357.00 | 80.2s

*** [GPU 0] NEW GLOBAL BEST: 509811998.00 at gen 700 ***
    Saved to best_solution.json

[GPU 0] Gen   700 | Best: 509811998.00 | 93.9s
[GP] gpu_0 intermediate update: 509811998.00 at gen 700
[GP] gpu_0 intermediate update: 501622201.00 at gen 800

==================================================
GP ANALYSIS - Cycle 2
  Collected 40 solutions
==================================================

[GP] ========== GENETIC PROGRAMMING ANALYSIS STARTED ==========
[GP] Cycle: 1
[GP] Input: 40 solutions received for analysis
[GP] Fitness range: best=501376000.00, worst=519993664.00
[GP] Analysis config: blocks=True, fft=False, similarity=False
[GP] Starting analysis...
[GP] Phase 1: Extracting building blocks...

*** [GPU 0] NEW GLOBAL BEST: 501375984.00 at gen 800 ***
    Saved to best_solution.json

[GPU 0] Gen   800 | Best: 501375984.00 | 107.6s
[GP] Phase 1 complete: Found 30 building blocks
[GP] Phase 2: FFT analysis DISABLED
[GP] Phase 3: Similarity analysis DISABLED
[GP] ========== GP ANALYSIS COMPLETE ==========


[GP] ========== CANDIDATE GENERATION STARTED ==========
[GP] Generating 20 new candidate solutions
[GP] Available data: 40 top solutions, 30 building blocks, 0 FFT patterns, 0 similarity patterns
[GP] Generation strategy: 6 block-based, 6 interpolated, 8 mutated
[GP] Strategy 1: Creating 6 candidates via building block combination...
[GP] Strategy 1 complete: 6 block-based candidates created
[GP] Strategy 2: Creating 6 candidates via solution interpolation...
[GP] Strategy 2 complete: 6 interpolated candidates created
[GP] Strategy 3: Creating 8 candidates via guided mutation...
[GP] Strategy 3 complete: 8 mutated candidates created
[GP] Total candidates generated: 20
[GP] Strategy breakdown: Block=12, Interp=12, Mut=16
[GP] ========== CANDIDATE GENERATION COMPLETE ==========


*** [GPU 0] NEW GLOBAL BEST: 494209308.00 at gen 900 ***
    Saved to best_solution.json

[GPU 0] Gen   900 | Best: 494209308.00 | 120.8s
[GPU 0] Gene injection: 20 candidates injected at gen 1000 (total so far: 40)
  -> 20 candidates sent to 1/1 workers
[GP] gpu_0 intermediate update: 501375984.00 at gen 800
[GP] gpu_0 intermediate update: 494209308.00 at gen 900
[GP] gpu_0 intermediate update: 486436156.00 at gen 1000

*** [GPU 0] NEW GLOBAL BEST: 486230333.00 at gen 1000 ***
    Saved to best_solution.json

[GPU 0] Gen  1000 | Best: 486230333.00 | 133.8s
    [Checkpoint] Saved to ./results/cold_start/blocks_only/dsj1000/1R20/job_times_2_seed0_1000.json
[GP] gpu_0 intermediate update: 486230333.00 at gen 1000

*** [GPU 0] NEW GLOBAL BEST: 480355557.00 at gen 1100 ***
    Saved to best_solution.json

[GPU 0] Gen  1100 | Best: 480355557.00 | 147.3s
[GP] gpu_0 intermediate update: 480355557.00 at gen 1100
[GP] gpu_0 intermediate update: 475713228.00 at gen 1200

==================================================
GP ANALYSIS - Cycle 3
  Collected 40 solutions
==================================================

[GP] ========== GENETIC PROGRAMMING ANALYSIS STARTED ==========
[GP] Cycle: 2
[GP] Input: 40 solutions received for analysis
[GP] Fitness range: best=475713216.00, worst=486565536.00
[GP] Analysis config: blocks=True, fft=False, similarity=False
[GP] Starting analysis...
[GP] Phase 1: Extracting building blocks...

*** [GPU 0] NEW GLOBAL BEST: 475713228.00 at gen 1200 ***
    Saved to best_solution.json

[GPU 0] Gen  1200 | Best: 475713228.00 | 161.3s
[GP] Phase 1 complete: Found 30 building blocks
[GP] Phase 2: FFT analysis DISABLED
[GP] Phase 3: Similarity analysis DISABLED
[GP] ========== GP ANALYSIS COMPLETE ==========


[GP] ========== CANDIDATE GENERATION STARTED ==========
[GP] Generating 20 new candidate solutions
[GP] Available data: 40 top solutions, 30 building blocks, 0 FFT patterns, 0 similarity patterns
[GP] Generation strategy: 6 block-based, 6 interpolated, 8 mutated
[GP] Strategy 1: Creating 6 candidates via building block combination...
[GP] Strategy 1 complete: 6 block-based candidates created
[GP] Strategy 2: Creating 6 candidates via solution interpolation...
[GP] Strategy 2 complete: 6 interpolated candidates created
[GP] Strategy 3: Creating 8 candidates via guided mutation...
[GP] Strategy 3 complete: 8 mutated candidates created
[GP] Total candidates generated: 20
[GP] Strategy breakdown: Block=18, Interp=18, Mut=24
[GP] ========== CANDIDATE GENERATION COMPLETE ==========


*** [GPU 0] NEW GLOBAL BEST: 471304446.00 at gen 1300 ***
    Saved to best_solution.json

[GPU 0] Gen  1300 | Best: 471304446.00 | 175.0s
[GPU 0] Gene injection: 20 candidates injected at gen 1400 (total so far: 60)

*** [GPU 0] NEW GLOBAL BEST: 464732032.00 at gen 1400 ***
    Saved to best_solution.json

[GPU 0] Gen  1400 | Best: 464732032.00 | 188.7s
  -> 20 candidates sent to 1/1 workers
[GP] gpu_0 intermediate update: 471304446.00 at gen 1300
[GP] gpu_0 intermediate update: 464732032.00 at gen 1400

*** [GPU 0] NEW GLOBAL BEST: 459710138.00 at gen 1500 ***
    Saved to best_solution.json

[GPU 0] Gen  1500 | Best: 459710138.00 | 202.5s
[GP] gpu_0 intermediate update: 459710138.00 at gen 1500
[GP] gpu_0 intermediate update: 455172276.00 at gen 1600

==================================================
GP ANALYSIS - Cycle 4
  Collected 40 solutions
==================================================

[GP] ========== GENETIC PROGRAMMING ANALYSIS STARTED ==========
[GP] Cycle: 3
[GP] Input: 40 solutions received for analysis
[GP] Fitness range: best=455024800.00, worst=465290112.00
[GP] Analysis config: blocks=True, fft=False, similarity=False
[GP] Starting analysis...
[GP] Phase 1: Extracting building blocks...

*** [GPU 0] NEW GLOBAL BEST: 455024815.00 at gen 1600 ***
    Saved to best_solution.json

[GPU 0] Gen  1600 | Best: 455024815.00 | 216.1s
[GP] Phase 1 complete: Found 30 building blocks
[GP] Phase 2: FFT analysis DISABLED
[GP] Phase 3: Similarity analysis DISABLED
[GP] ========== GP ANALYSIS COMPLETE ==========


[GP] ========== CANDIDATE GENERATION STARTED ==========
[GP] Generating 20 new candidate solutions
[GP] Available data: 40 top solutions, 30 building blocks, 0 FFT patterns, 0 similarity patterns
[GP] Generation strategy: 6 block-based, 6 interpolated, 8 mutated
[GP] Strategy 1: Creating 6 candidates via building block combination...
[GP] Strategy 1 complete: 6 block-based candidates created
[GP] Strategy 2: Creating 6 candidates via solution interpolation...
[GP] Strategy 2 complete: 6 interpolated candidates created
[GP] Strategy 3: Creating 8 candidates via guided mutation...
[GP] Strategy 3 complete: 8 mutated candidates created
[GP] Total candidates generated: 20
[GP] Strategy breakdown: Block=24, Interp=24, Mut=32
[GP] ========== CANDIDATE GENERATION COMPLETE ==========


*** [GPU 0] NEW GLOBAL BEST: 449895595.00 at gen 1700 ***
    Saved to best_solution.json

[GPU 0] Gen  1700 | Best: 449895595.00 | 229.6s
[GPU 0] Gene injection: 20 candidates injected at gen 1800 (total so far: 80)
  -> 20 candidates sent to 1/1 workers
[GP] gpu_0 intermediate update: 455024815.00 at gen 1600
[GP] gpu_0 intermediate update: 449895595.00 at gen 1700
[GP] gpu_0 intermediate update: 446791551.00 at gen 1800

*** [GPU 0] NEW GLOBAL BEST: 446791551.00 at gen 1800 ***
    Saved to best_solution.json

[GPU 0] Gen  1800 | Best: 446791551.00 | 243.3s

*** [GPU 0] NEW GLOBAL BEST: 444793876.00 at gen 1900 ***
    Saved to best_solution.json

[GPU 0] Gen  1900 | Best: 444793876.00 | 256.9s
[GP] gpu_0 intermediate update: 444793876.00 at gen 1900
[GP] gpu_0 intermediate update: 441253036.00 at gen 2000

==================================================
GP ANALYSIS - Cycle 5
  Collected 40 solutions
==================================================

[GP] ========== GENETIC PROGRAMMING ANALYSIS STARTED ==========
[GP] Cycle: 4
[GP] Input: 40 solutions received for analysis
[GP] Fitness range: best=441253024.00, worst=446905344.00
[GP] Analysis config: blocks=True, fft=False, similarity=False
[GP] Starting analysis...
[GP] Phase 1: Extracting building blocks...

*** [GPU 0] NEW GLOBAL BEST: 441253036.00 at gen 2000 ***
    Saved to best_solution.json

[GPU 0] Gen  2000 | Best: 441253036.00 | 270.7s
    [Checkpoint] Saved to ./results/cold_start/blocks_only/dsj1000/1R20/job_times_2_seed0_2000.json
[GP] Phase 1 complete: Found 30 building blocks
[GP] Phase 2: FFT analysis DISABLED
[GP] Phase 3: Similarity analysis DISABLED
[GP] ========== GP ANALYSIS COMPLETE ==========


[GP] ========== CANDIDATE GENERATION STARTED ==========
[GP] Generating 20 new candidate solutions
[GP] Available data: 40 top solutions, 30 building blocks, 0 FFT patterns, 0 similarity patterns
[GP] Generation strategy: 6 block-based, 6 interpolated, 8 mutated
[GP] Strategy 1: Creating 6 candidates via building block combination...
[GP] Strategy 1 complete: 6 block-based candidates created
[GP] Strategy 2: Creating 6 candidates via solution interpolation...
[GP] Strategy 2 complete: 6 interpolated candidates created
[GP] Strategy 3: Creating 8 candidates via guided mutation...
[GP] Strategy 3 complete: 8 mutated candidates created
[GP] Total candidates generated: 20
[GP] Strategy breakdown: Block=30, Interp=30, Mut=40
[GP] ========== CANDIDATE GENERATION COMPLETE ==========


*** [GPU 0] NEW GLOBAL BEST: 438750763.00 at gen 2100 ***
    Saved to best_solution.json

[GPU 0] Gen  2100 | Best: 438750763.00 | 284.7s
[GPU 0] Gene injection: 20 candidates injected at gen 2200 (total so far: 100)

*** [GPU 0] NEW GLOBAL BEST: 436790767.00 at gen 2200 ***
    Saved to best_solution.json

[GPU 0] Gen  2200 | Best: 436790767.00 | 298.3s
  -> 20 candidates sent to 1/1 workers

[CHECKPOINT] Saved A.json at gen 1000 (makespan: 441253036.00)
[GP] gpu_0 intermediate update: 438750763.00 at gen 2100
[GP] gpu_0 intermediate update: 436812770.00 at gen 2200
[GP] gpu_0 intermediate update: 436790767.00 at gen 2200

*** [GPU 0] NEW GLOBAL BEST: 435534068.00 at gen 2300 ***
    Saved to best_solution.json

[GPU 0] Gen  2300 | Best: 435534068.00 | 312.1s
[GP] gpu_0 intermediate update: 435534068.00 at gen 2300
[GP] gpu_0 intermediate update: 434522990.00 at gen 2400

==================================================
GP ANALYSIS - Cycle 6
  Collected 40 solutions
==================================================

[GP] ========== GENETIC PROGRAMMING ANALYSIS STARTED ==========
[GP] Cycle: 5
[GP] Input: 40 solutions received for analysis
[GP] Fitness range: best=434522976.00, worst=436877760.00
[GP] Analysis config: blocks=True, fft=False, similarity=False
[GP] Starting analysis...
[GP] Phase 1: Extracting building blocks...

*** [GPU 0] NEW GLOBAL BEST: 434522990.00 at gen 2400 ***
    Saved to best_solution.json

[GPU 0] Gen  2400 | Best: 434522990.00 | 325.8s
[GP] Phase 1 complete: Found 30 building blocks
[GP] Phase 2: FFT analysis DISABLED
[GP] Phase 3: Similarity analysis DISABLED
[GP] ========== GP ANALYSIS COMPLETE ==========


[GP] ========== CANDIDATE GENERATION STARTED ==========
[GP] Generating 20 new candidate solutions
[GP] Available data: 40 top solutions, 30 building blocks, 0 FFT patterns, 0 similarity patterns
[GP] Generation strategy: 6 block-based, 6 interpolated, 8 mutated
[GP] Strategy 1: Creating 6 candidates via building block combination...
[GP] Strategy 1 complete: 6 block-based candidates created
[GP] Strategy 2: Creating 6 candidates via solution interpolation...
[GP] Strategy 2 complete: 6 interpolated candidates created
[GP] Strategy 3: Creating 8 candidates via guided mutation...
[GP] Strategy 3 complete: 8 mutated candidates created
[GP] Total candidates generated: 20
[GP] Strategy breakdown: Block=36, Interp=36, Mut=48
[GP] ========== CANDIDATE GENERATION COMPLETE ==========


*** [GPU 0] NEW GLOBAL BEST: 431996914.00 at gen 2500 ***
    Saved to best_solution.json

[GPU 0] Gen  2500 | Best: 431996914.00 | 339.5s
[GPU 0] Gene injection: 20 candidates injected at gen 2600 (total so far: 120)
  -> 20 candidates sent to 1/1 workers
[GP] gpu_0 intermediate update: 431996914.00 at gen 2500
[GP] gpu_0 intermediate update: 431038296.00 at gen 2600

*** [GPU 0] NEW GLOBAL BEST: 430943234.00 at gen 2600 ***
    Saved to best_solution.json

[GPU 0] Gen  2600 | Best: 430943234.00 | 353.0s
[GP] gpu_0 intermediate update: 430943234.00 at gen 2600

*** [GPU 0] NEW GLOBAL BEST: 429736881.00 at gen 2700 ***
    Saved to best_solution.json

[GPU 0] Gen  2700 | Best: 429736881.00 | 366.3s
[GP] gpu_0 intermediate update: 429736881.00 at gen 2700
[GP] gpu_0 intermediate update: 428292899.00 at gen 2800

==================================================
GP ANALYSIS - Cycle 7
  Collected 40 solutions
==================================================

[GP] ========== GENETIC PROGRAMMING ANALYSIS STARTED ==========
[GP] Cycle: 6
[GP] Input: 40 solutions received for analysis
[GP] Fitness range: best=428292896.00, worst=431272256.00
[GP] Analysis config: blocks=True, fft=False, similarity=False
[GP] Starting analysis...
[GP] Phase 1: Extracting building blocks...

*** [GPU 0] NEW GLOBAL BEST: 428292899.00 at gen 2800 ***
    Saved to best_solution.json

[GPU 0] Gen  2800 | Best: 428292899.00 | 380.0s
[GP] Phase 1 complete: Found 30 building blocks
[GP] Phase 2: FFT analysis DISABLED
[GP] Phase 3: Similarity analysis DISABLED
[GP] ========== GP ANALYSIS COMPLETE ==========


[GP] ========== CANDIDATE GENERATION STARTED ==========
[GP] Generating 20 new candidate solutions
[GP] Available data: 40 top solutions, 30 building blocks, 0 FFT patterns, 0 similarity patterns
[GP] Generation strategy: 6 block-based, 6 interpolated, 8 mutated
[GP] Strategy 1: Creating 6 candidates via building block combination...
[GP] Strategy 1 complete: 6 block-based candidates created
[GP] Strategy 2: Creating 6 candidates via solution interpolation...
[GP] Strategy 2 complete: 6 interpolated candidates created
[GP] Strategy 3: Creating 8 candidates via guided mutation...
[GP] Strategy 3 complete: 8 mutated candidates created
[GP] Total candidates generated: 20
[GP] Strategy breakdown: Block=42, Interp=42, Mut=56
[GP] ========== CANDIDATE GENERATION COMPLETE ==========


*** [GPU 0] NEW GLOBAL BEST: 427193450.00 at gen 2900 ***
    Saved to best_solution.json

[GPU 0] Gen  2900 | Best: 427193450.00 | 393.5s
[GPU 0] Gene injection: 20 candidates injected at gen 3000 (total so far: 140)
  -> 20 candidates sent to 1/1 workers
[GP] gpu_0 intermediate update: 427193450.00 at gen 2900
[GP] gpu_0 intermediate update: 426346820.00 at gen 3000

*** [GPU 0] NEW GLOBAL BEST: 426346820.00 at gen 3000 ***
    Saved to best_solution.json

[GPU 0] Gen  3000 | Best: 426346820.00 | 406.9s
    [Checkpoint] Saved to ./results/cold_start/blocks_only/dsj1000/1R20/job_times_2_seed0_3000.json

*** [GPU 0] NEW GLOBAL BEST: 425081672.00 at gen 3100 ***
    Saved to best_solution.json

[GPU 0] Gen  3100 | Best: 425081672.00 | 420.5s
[GP] gpu_0 intermediate update: 425081672.00 at gen 3100
[GP] gpu_0 intermediate update: 423712673.00 at gen 3200

==================================================
GP ANALYSIS - Cycle 8
  Collected 40 solutions
==================================================

[GP] ========== GENETIC PROGRAMMING ANALYSIS STARTED ==========
[GP] Cycle: 7
[GP] Input: 40 solutions received for analysis
[GP] Fitness range: best=423455296.00, worst=426346816.00
[GP] Analysis config: blocks=True, fft=False, similarity=False
[GP] Starting analysis...
[GP] Phase 1: Extracting building blocks...

*** [GPU 0] NEW GLOBAL BEST: 423455283.00 at gen 3200 ***
    Saved to best_solution.json

[GPU 0] Gen  3200 | Best: 423455283.00 | 434.3s
[GP] Phase 1 complete: Found 30 building blocks
[GP] Phase 2: FFT analysis DISABLED
[GP] Phase 3: Similarity analysis DISABLED
[GP] ========== GP ANALYSIS COMPLETE ==========


[GP] ========== CANDIDATE GENERATION STARTED ==========
[GP] Generating 20 new candidate solutions
[GP] Available data: 40 top solutions, 30 building blocks, 0 FFT patterns, 0 similarity patterns
[GP] Generation strategy: 6 block-based, 6 interpolated, 8 mutated
[GP] Strategy 1: Creating 6 candidates via building block combination...
[GP] Strategy 1 complete: 6 block-based candidates created
[GP] Strategy 2: Creating 6 candidates via solution interpolation...
[GP] Strategy 2 complete: 6 interpolated candidates created
[GP] Strategy 3: Creating 8 candidates via guided mutation...
[GP] Strategy 3 complete: 8 mutated candidates created
[GP] Total candidates generated: 20
[GP] Strategy breakdown: Block=48, Interp=48, Mut=64
[GP] ========== CANDIDATE GENERATION COMPLETE ==========


*** [GPU 0] NEW GLOBAL BEST: 421733538.00 at gen 3300 ***
    Saved to best_solution.json

[GPU 0] Gen  3300 | Best: 421733538.00 | 447.5s
[GPU 0] Gene injection: 20 candidates injected at gen 3400 (total so far: 160)
  -> 20 candidates sent to 1/1 workers
[GP] gpu_0 intermediate update: 423455283.00 at gen 3200
[GP] gpu_0 intermediate update: 421733538.00 at gen 3300
[GP] gpu_0 intermediate update: 420728611.00 at gen 3400

*** [GPU 0] NEW GLOBAL BEST: 420728611.00 at gen 3400 ***
    Saved to best_solution.json

[GPU 0] Gen  3400 | Best: 420728611.00 | 461.1s

*** [GPU 0] NEW GLOBAL BEST: 419594721.00 at gen 3500 ***
    Saved to best_solution.json

[GPU 0] Gen  3500 | Best: 419594721.00 | 474.0s
[GP] gpu_0 intermediate update: 419594721.00 at gen 3500
[GP] gpu_0 intermediate update: 417911789.00 at gen 3600

==================================================
GP ANALYSIS - Cycle 9
  Collected 40 solutions
==================================================

[GP] ========== GENETIC PROGRAMMING ANALYSIS STARTED ==========
[GP] Cycle: 8
[GP] Input: 40 solutions received for analysis
[GP] Fitness range: best=417911776.00, worst=420728608.00
[GP] Analysis config: blocks=True, fft=False, similarity=False
[GP] Starting analysis...
[GP] Phase 1: Extracting building blocks...

*** [GPU 0] NEW GLOBAL BEST: 417911789.00 at gen 3600 ***
    Saved to best_solution.json

[GPU 0] Gen  3600 | Best: 417911789.00 | 487.7s
[GP] Phase 1 complete: Found 30 building blocks
[GP] Phase 2: FFT analysis DISABLED
[GP] Phase 3: Similarity analysis DISABLED
[GP] ========== GP ANALYSIS COMPLETE ==========


[GP] ========== CANDIDATE GENERATION STARTED ==========
[GP] Generating 20 new candidate solutions
[GP] Available data: 40 top solutions, 30 building blocks, 0 FFT patterns, 0 similarity patterns
[GP] Generation strategy: 6 block-based, 6 interpolated, 8 mutated
[GP] Strategy 1: Creating 6 candidates via building block combination...
[GP] Strategy 1 complete: 6 block-based candidates created
[GP] Strategy 2: Creating 6 candidates via solution interpolation...
[GP] Strategy 2 complete: 6 interpolated candidates created
[GP] Strategy 3: Creating 8 candidates via guided mutation...
[GP] Strategy 3 complete: 8 mutated candidates created
[GP] Total candidates generated: 20
[GP] Strategy breakdown: Block=54, Interp=54, Mut=72
[GP] ========== CANDIDATE GENERATION COMPLETE ==========


*** [GPU 0] NEW GLOBAL BEST: 417055545.00 at gen 3700 ***
    Saved to best_solution.json

[GPU 0] Gen  3700 | Best: 417055545.00 | 501.2s
[GPU 0] Gene injection: 20 candidates injected at gen 3800 (total so far: 180)
  -> 20 candidates sent to 1/1 workers
[GP] gpu_0 intermediate update: 417055545.00 at gen 3700
[GP] gpu_0 intermediate update: 415137791.00 at gen 3800

*** [GPU 0] NEW GLOBAL BEST: 415102917.00 at gen 3800 ***
    Saved to best_solution.json

[GPU 0] Gen  3800 | Best: 415102917.00 | 514.7s
[GP] gpu_0 intermediate update: 415102917.00 at gen 3800

*** [GPU 0] NEW GLOBAL BEST: 413642998.00 at gen 3900 ***
    Saved to best_solution.json

[GPU 0] Gen  3900 | Best: 413642998.00 | 528.5s
[GP] gpu_0 intermediate update: 413642998.00 at gen 3900
[GP] gpu_0 intermediate update: 412715269.00 at gen 4000

==================================================
GP ANALYSIS - Cycle 10
  Collected 40 solutions
==================================================

[GP] ========== GENETIC PROGRAMMING ANALYSIS STARTED ==========
[GP] Cycle: 9
[GP] Input: 40 solutions received for analysis
[GP] Fitness range: best=412715264.00, worst=415163584.00
[GP] Analysis config: blocks=True, fft=False, similarity=False
[GP] Starting analysis...
[GP] Phase 1: Extracting building blocks...

*** [GPU 0] NEW GLOBAL BEST: 412715269.00 at gen 4000 ***
    Saved to best_solution.json

[GPU 0] Gen  4000 | Best: 412715269.00 | 542.4s
[GP] Phase 1 complete: Found 30 building blocks
[GP] Phase 2: FFT analysis DISABLED
[GP] Phase 3: Similarity analysis DISABLED
[GP] ========== GP ANALYSIS COMPLETE ==========


[GP] ========== CANDIDATE GENERATION STARTED ==========
[GP] Generating 20 new candidate solutions
[GP] Available data: 40 top solutions, 30 building blocks, 0 FFT patterns, 0 similarity patterns
[GP] Generation strategy: 6 block-based, 6 interpolated, 8 mutated
[GP] Strategy 1: Creating 6 candidates via building block combination...
[GP] Strategy 1 complete: 6 block-based candidates created
[GP] Strategy 2: Creating 6 candidates via solution interpolation...
[GP] Strategy 2 complete: 6 interpolated candidates created
[GP] Strategy 3: Creating 8 candidates via guided mutation...
[GP] Strategy 3 complete: 8 mutated candidates created
[GP] Total candidates generated: 20
[GP] Strategy breakdown: Block=60, Interp=60, Mut=80
[GP] ========== CANDIDATE GENERATION COMPLETE ==========

    [Checkpoint] Saved to ./results/cold_start/blocks_only/dsj1000/1R20/job_times_2_seed0_4000.json

*** [GPU 0] NEW GLOBAL BEST: 412190115.00 at gen 4100 ***
    Saved to best_solution.json

[GPU 0] Gen  4100 | Best: 412190115.00 | 556.2s
[GPU 0] Gene injection: 20 candidates injected at gen 4200 (total so far: 200)

*** [GPU 0] NEW GLOBAL BEST: 411224674.00 at gen 4200 ***
    Saved to best_solution.json

[GPU 0] Gen  4200 | Best: 411224674.00 | 569.9s
  -> 20 candidates sent to 1/1 workers

[CHECKPOINT] Saved B.json at gen 2000 (makespan: 412715269.00)
[GP] gpu_0 intermediate update: 412190115.00 at gen 4100
[GP] gpu_0 intermediate update: 411224674.00 at gen 4200

*** [GPU 0] NEW GLOBAL BEST: 410409638.00 at gen 4300 ***
    Saved to best_solution.json

[GPU 0] Gen  4300 | Best: 410409638.00 | 583.5s
[GP] gpu_0 intermediate update: 410409638.00 at gen 4300
[GP] gpu_0 intermediate update: 409451123.00 at gen 4400

==================================================
GP ANALYSIS - Cycle 11
  Collected 40 solutions
==================================================

[GP] ========== GENETIC PROGRAMMING ANALYSIS STARTED ==========
[GP] Cycle: 10
[GP] Input: 40 solutions received for analysis
[GP] Fitness range: best=409451136.00, worst=411224672.00
[GP] Analysis config: blocks=True, fft=False, similarity=False
[GP] Starting analysis...
[GP] Phase 1: Extracting building blocks...

*** [GPU 0] NEW GLOBAL BEST: 409451123.00 at gen 4400 ***
    Saved to best_solution.json

[GPU 0] Gen  4400 | Best: 409451123.00 | 597.1s
[GP] Phase 1 complete: Found 30 building blocks
[GP] Phase 2: FFT analysis DISABLED
[GP] Phase 3: Similarity analysis DISABLED
[GP] ========== GP ANALYSIS COMPLETE ==========


[GP] ========== CANDIDATE GENERATION STARTED ==========
[GP] Generating 20 new candidate solutions
[GP] Available data: 40 top solutions, 30 building blocks, 0 FFT patterns, 0 similarity patterns
[GP] Generation strategy: 6 block-based, 6 interpolated, 8 mutated
[GP] Strategy 1: Creating 6 candidates via building block combination...
[GP] Strategy 1 complete: 6 block-based candidates created
[GP] Strategy 2: Creating 6 candidates via solution interpolation...
[GP] Strategy 2 complete: 6 interpolated candidates created
[GP] Strategy 3: Creating 8 candidates via guided mutation...
[GP] Strategy 3 complete: 8 mutated candidates created
[GP] Total candidates generated: 20
[GP] Strategy breakdown: Block=66, Interp=66, Mut=88
[GP] ========== CANDIDATE GENERATION COMPLETE ==========


*** [GPU 0] NEW GLOBAL BEST: 408185097.00 at gen 4500 ***
    Saved to best_solution.json

[GPU 0] Gen  4500 | Best: 408185097.00 | 610.8s
[GPU 0] Gene injection: 20 candidates injected at gen 4600 (total so far: 220)

*** [GPU 0] NEW GLOBAL BEST: 407466123.00 at gen 4600 ***
    Saved to best_solution.json

[GPU 0] Gen  4600 | Best: 407466123.00 | 624.1s
  -> 20 candidates sent to 1/1 workers
[GP] gpu_0 intermediate update: 408185097.00 at gen 4500
[GP] gpu_0 intermediate update: 407466123.00 at gen 4600

*** [GPU 0] NEW GLOBAL BEST: 407076774.00 at gen 4700 ***
    Saved to best_solution.json

[GPU 0] Gen  4700 | Best: 407076774.00 | 637.7s
[GP] gpu_0 intermediate update: 407076774.00 at gen 4700
[GP] gpu_0 intermediate update: 405986938.00 at gen 4800

==================================================
GP ANALYSIS - Cycle 12
  Collected 40 solutions
==================================================

[GP] ========== GENETIC PROGRAMMING ANALYSIS STARTED ==========
[GP] Cycle: 11
[GP] Input: 40 solutions received for analysis
[GP] Fitness range: best=405986944.00, worst=407474880.00
[GP] Analysis config: blocks=True, fft=False, similarity=False
[GP] Starting analysis...
[GP] Phase 1: Extracting building blocks...

*** [GPU 0] NEW GLOBAL BEST: 405986938.00 at gen 4800 ***
    Saved to best_solution.json

[GPU 0] Gen  4800 | Best: 405986938.00 | 651.3s
[GP] Phase 1 complete: Found 30 building blocks
[GP] Phase 2: FFT analysis DISABLED
[GP] Phase 3: Similarity analysis DISABLED
[GP] ========== GP ANALYSIS COMPLETE ==========


[GP] ========== CANDIDATE GENERATION STARTED ==========
[GP] Generating 20 new candidate solutions
[GP] Available data: 40 top solutions, 30 building blocks, 0 FFT patterns, 0 similarity patterns
[GP] Generation strategy: 6 block-based, 6 interpolated, 8 mutated
[GP] Strategy 1: Creating 6 candidates via building block combination...
[GP] Strategy 1 complete: 6 block-based candidates created
[GP] Strategy 2: Creating 6 candidates via solution interpolation...
[GP] Strategy 2 complete: 6 interpolated candidates created
[GP] Strategy 3: Creating 8 candidates via guided mutation...
[GP] Strategy 3 complete: 8 mutated candidates created
[GP] Total candidates generated: 20
[GP] Strategy breakdown: Block=72, Interp=72, Mut=96
[GP] ========== CANDIDATE GENERATION COMPLETE ==========


*** [GPU 0] NEW GLOBAL BEST: 405189620.00 at gen 4900 ***
    Saved to best_solution.json

[GPU 0] Gen  4900 | Best: 405189620.00 | 664.7s
[GPU 0] Gene injection: 20 candidates injected at gen 5000 (total so far: 240)
[GPU 0] Evolution complete. Sending final results...
  -> 20 candidates sent to 1/1 workers
[GP] gpu_0 intermediate update: 405189620.00 at gen 4900
[GP] gpu_0 intermediate update: 404123322.00 at gen 5000
[GP] Worker finished: gpu_0 (best=404123322.00)

[GP] All workers finished. Total GP cycles: 12

[Final Collection] Have 1/1 workers. Waiting up to 120s for remaining...

[Critical] Attempting final result collection before terminating workers...

[Results Summary] Collected 1 results:
  gpu_0: fitness=404123322.00, intermediate=False, gen=final

======================================================================
COMPLETE
======================================================================
Best: 404123322.00 from gpu_0
Time: 680.8s
Total candidates injected: 240

Solution JSON saved to ./results/cold_start/blocks_only/dsj1000/1R20/job_times_2_seed0.json
HTML Gantt chart saved to: ./results/cold_start/blocks_only/dsj1000/1R20/job_times_2_seed0.html
