Setting random seed to 0
DEBUG: proc shape: (783,), agents: 6, resources: 4, n: 783

======================================================================
LOADING INITIAL SOLUTION FROM JSON
======================================================================
Loaded heuristic solution: Savings with makespan 187503.00
File: ./results/heuristics_only/rat783/1R10/job_times_4_heuristics.json
Makespan: 187503.00
Status: SUCCESS - Will use as warm start
======================================================================


======================================================================
VRP-RPD SOLVER
======================================================================
Problem: 782 customers, 6 agents, k=4
Heuristic: None
Genetic Programming: Yes
Warm Start: Yes
Gene Injection: Yes
Workers: 1 GPU + 0 CPU
Generations: 5000
======================================================================

Using solution from JSON file as warm start...
  JSON solution: 187503.00
Skipping heuristic re-computation (using JSON solution + perturbations)

Generated 6 warm start chromosomes from JSON

[GP] Starting GP collection loop (timeout: 12975s)...
[GPU 0] Warm start: 6 chromosomes

*** [GPU 0] NEW GLOBAL BEST: 142296.00 at gen 0 ***
    Saved to best_solution.json

[GPU 0] Gen     0 | Best: 142296.00 | 0.5s
[GP] gpu_0 first intermediate: 142296.00 at gen 0

*** [GPU 0] NEW GLOBAL BEST: 108468.00 at gen 100 ***
    Saved to best_solution.json

[GPU 0] Gen   100 | Best: 108468.00 | 12.6s
[GP] gpu_0 intermediate update: 108468.00 at gen 100
[GP] gpu_0 intermediate update: 102612.00 at gen 200

*** [GPU 0] NEW GLOBAL BEST: 102612.00 at gen 200 ***
    Saved to best_solution.json

[GPU 0] Gen   200 | Best: 102612.00 | 25.1s

*** [GPU 0] NEW GLOBAL BEST: 99506.00 at gen 300 ***
    Saved to best_solution.json

[GPU 0] Gen   300 | Best: 99506.00 | 38.0s
[GP] gpu_0 intermediate update: 99506.00 at gen 300
[GP] gpu_0 intermediate update: 96109.00 at gen 400

==================================================
GP ANALYSIS - Cycle 1
  Collected 40 solutions
==================================================

[GP] ========== GENETIC PROGRAMMING ANALYSIS STARTED ==========
[GP] Cycle: 0
[GP] Input: 40 solutions received for analysis
[GP] Fitness range: best=96109.00, worst=102957.00
[GP] Analysis config: blocks=True, fft=False, similarity=False
[GP] Starting analysis...
[GP] Phase 1: Extracting building blocks...

*** [GPU 0] NEW GLOBAL BEST: 96109.00 at gen 400 ***
    Saved to best_solution.json

[GPU 0] Gen   400 | Best: 96109.00 | 50.6s
[GP] Phase 1 complete: Found 30 building blocks
[GP] Phase 2: FFT analysis DISABLED
[GP] Phase 3: Similarity analysis DISABLED
[GP] ========== GP ANALYSIS COMPLETE ==========


[GP] ========== CANDIDATE GENERATION STARTED ==========
[GP] Generating 20 new candidate solutions
[GP] Available data: 40 top solutions, 30 building blocks, 0 FFT patterns, 0 similarity patterns
[GP] Generation strategy: 6 block-based, 6 interpolated, 8 mutated
[GP] Strategy 1: Creating 6 candidates via building block combination...
[GP] Strategy 1 complete: 6 block-based candidates created
[GP] Strategy 2: Creating 6 candidates via solution interpolation...
[GP] Strategy 2 complete: 6 interpolated candidates created
[GP] Strategy 3: Creating 8 candidates via guided mutation...
[GP] Strategy 3 complete: 8 mutated candidates created
[GP] Total candidates generated: 20
[GP] Strategy breakdown: Block=6, Interp=6, Mut=8
[GP] ========== CANDIDATE GENERATION COMPLETE ==========


*** [GPU 0] NEW GLOBAL BEST: 93600.00 at gen 500 ***
    Saved to best_solution.json

[GPU 0] Gen   500 | Best: 93600.00 | 63.3s
[GPU 0] Gene injection: 20 candidates injected at gen 600 (total so far: 20)

*** [GPU 0] NEW GLOBAL BEST: 91908.00 at gen 600 ***
    Saved to best_solution.json

[GPU 0] Gen   600 | Best: 91908.00 | 75.2s
  -> 20 candidates sent to 1/1 workers
[GP] gpu_0 intermediate update: 93600.00 at gen 500
[GP] gpu_0 intermediate update: 91908.00 at gen 600

*** [GPU 0] NEW GLOBAL BEST: 90648.00 at gen 700 ***
    Saved to best_solution.json

[GPU 0] Gen   700 | Best: 90648.00 | 88.0s
[GP] gpu_0 intermediate update: 90648.00 at gen 700
[GP] gpu_0 intermediate update: 89751.00 at gen 800

==================================================
GP ANALYSIS - Cycle 2
  Collected 40 solutions
==================================================

[GP] ========== GENETIC PROGRAMMING ANALYSIS STARTED ==========
[GP] Cycle: 1
[GP] Input: 40 solutions received for analysis
[GP] Fitness range: best=89718.00, worst=92135.00
[GP] Analysis config: blocks=True, fft=False, similarity=False
[GP] Starting analysis...
[GP] Phase 1: Extracting building blocks...
[GP] Phase 1 complete: Found 30 building blocks
[GP] Phase 2: FFT analysis DISABLED
[GP] Phase 3: Similarity analysis DISABLED
[GP] ========== GP ANALYSIS COMPLETE ==========


[GP] ========== CANDIDATE GENERATION STARTED ==========
[GP] Generating 20 new candidate solutions
[GP] Available data: 40 top solutions, 30 building blocks, 0 FFT patterns, 0 similarity patterns
[GP] Generation strategy: 6 block-based, 6 interpolated, 8 mutated
[GP] Strategy 1: Creating 6 candidates via building block combination...
[GP] Strategy 1 complete: 6 block-based candidates created
[GP] Strategy 2: Creating 6 candidates via solution interpolation...
[GP] Strategy 2 complete: 6 interpolated candidates created
[GP] Strategy 3: Creating 8 candidates via guided mutation...
[GP] Strategy 3 complete: 8 mutated candidates created
[GP] Total candidates generated: 20
[GP] Strategy breakdown: Block=12, Interp=12, Mut=16
[GP] ========== CANDIDATE GENERATION COMPLETE ==========


*** [GPU 0] NEW GLOBAL BEST: 89718.00 at gen 800 ***
    Saved to best_solution.json

[GPU 0] Gen   800 | Best: 89718.00 | 100.8s

*** [GPU 0] NEW GLOBAL BEST: 88189.00 at gen 900 ***
    Saved to best_solution.json

[GPU 0] Gen   900 | Best: 88189.00 | 113.6s
[GPU 0] Gene injection: 20 candidates injected at gen 1000 (total so far: 40)

*** [GPU 0] NEW GLOBAL BEST: 86907.00 at gen 1000 ***
  -> 20 candidates sent to 1/1 workers
[GP] gpu_0 intermediate update: 89718.00 at gen 800
[GP] gpu_0 intermediate update: 88189.00 at gen 900
[GP] gpu_0 intermediate update: 86925.00 at gen 1000
    Saved to best_solution.json

[GPU 0] Gen  1000 | Best: 86907.00 | 126.2s
    [Checkpoint] Saved to ./results/warm_start/blocks_only/rat783/1R10/job_times_4_seed0_1000.json
[GP] gpu_0 intermediate update: 86907.00 at gen 1000

*** [GPU 0] NEW GLOBAL BEST: 85887.00 at gen 1100 ***
    Saved to best_solution.json

[GPU 0] Gen  1100 | Best: 85887.00 | 139.0s
[GP] gpu_0 intermediate update: 85887.00 at gen 1100
[GP] gpu_0 intermediate update: 84950.00 at gen 1200

==================================================
GP ANALYSIS - Cycle 3
  Collected 40 solutions
==================================================

[GP] ========== GENETIC PROGRAMMING ANALYSIS STARTED ==========
[GP] Cycle: 2
[GP] Input: 40 solutions received for analysis
[GP] Fitness range: best=84950.00, worst=86935.00
[GP] Analysis config: blocks=True, fft=False, similarity=False
[GP] Starting analysis...
[GP] Phase 1: Extracting building blocks...

*** [GPU 0] NEW GLOBAL BEST: 84950.00 at gen 1200 ***
    Saved to best_solution.json

[GPU 0] Gen  1200 | Best: 84950.00 | 152.1s
[GP] Phase 1 complete: Found 30 building blocks
[GP] Phase 2: FFT analysis DISABLED
[GP] Phase 3: Similarity analysis DISABLED
[GP] ========== GP ANALYSIS COMPLETE ==========


[GP] ========== CANDIDATE GENERATION STARTED ==========
[GP] Generating 20 new candidate solutions
[GP] Available data: 40 top solutions, 30 building blocks, 0 FFT patterns, 0 similarity patterns
[GP] Generation strategy: 6 block-based, 6 interpolated, 8 mutated
[GP] Strategy 1: Creating 6 candidates via building block combination...
[GP] Strategy 1 complete: 6 block-based candidates created
[GP] Strategy 2: Creating 6 candidates via solution interpolation...
[GP] Strategy 2 complete: 6 interpolated candidates created
[GP] Strategy 3: Creating 8 candidates via guided mutation...
[GP] Strategy 3 complete: 8 mutated candidates created
[GP] Total candidates generated: 20
[GP] Strategy breakdown: Block=18, Interp=18, Mut=24
[GP] ========== CANDIDATE GENERATION COMPLETE ==========


*** [GPU 0] NEW GLOBAL BEST: 84001.00 at gen 1300 ***
    Saved to best_solution.json

[GPU 0] Gen  1300 | Best: 84001.00 | 164.8s
[GPU 0] Gene injection: 20 candidates injected at gen 1400 (total so far: 60)

*** [GPU 0] NEW GLOBAL BEST: 82916.00 at gen 1400 ***
    Saved to best_solution.json

[GPU 0] Gen  1400 | Best: 82916.00 | 177.5s
  -> 20 candidates sent to 1/1 workers
[GP] gpu_0 intermediate update: 84001.00 at gen 1300
[GP] gpu_0 intermediate update: 82916.00 at gen 1400

*** [GPU 0] NEW GLOBAL BEST: 82137.00 at gen 1500 ***
    Saved to best_solution.json

[GPU 0] Gen  1500 | Best: 82137.00 | 190.3s
[GP] gpu_0 intermediate update: 82137.00 at gen 1500
[GP] gpu_0 intermediate update: 81586.00 at gen 1600

==================================================
GP ANALYSIS - Cycle 4
  Collected 40 solutions
==================================================

[GP] ========== GENETIC PROGRAMMING ANALYSIS STARTED ==========
[GP] Cycle: 3
[GP] Input: 40 solutions received for analysis
[GP] Fitness range: best=81586.00, worst=82918.00
[GP] Analysis config: blocks=True, fft=False, similarity=False
[GP] Starting analysis...
[GP] Phase 1: Extracting building blocks...

*** [GPU 0] NEW GLOBAL BEST: 81586.00 at gen 1600 ***
    Saved to best_solution.json

[GPU 0] Gen  1600 | Best: 81586.00 | 203.4s
[GP] Phase 1 complete: Found 30 building blocks
[GP] Phase 2: FFT analysis DISABLED
[GP] Phase 3: Similarity analysis DISABLED
[GP] ========== GP ANALYSIS COMPLETE ==========


[GP] ========== CANDIDATE GENERATION STARTED ==========
[GP] Generating 20 new candidate solutions
[GP] Available data: 40 top solutions, 30 building blocks, 0 FFT patterns, 0 similarity patterns
[GP] Generation strategy: 6 block-based, 6 interpolated, 8 mutated
[GP] Strategy 1: Creating 6 candidates via building block combination...
[GP] Strategy 1 complete: 6 block-based candidates created
[GP] Strategy 2: Creating 6 candidates via solution interpolation...
[GP] Strategy 2 complete: 6 interpolated candidates created
[GP] Strategy 3: Creating 8 candidates via guided mutation...
[GP] Strategy 3 complete: 8 mutated candidates created
[GP] Total candidates generated: 20
[GP] Strategy breakdown: Block=24, Interp=24, Mut=32
[GP] ========== CANDIDATE GENERATION COMPLETE ==========


*** [GPU 0] NEW GLOBAL BEST: 81412.00 at gen 1700 ***
    Saved to best_solution.json

[GPU 0] Gen  1700 | Best: 81412.00 | 216.1s
[GPU 0] Gene injection: 20 candidates injected at gen 1800 (total so far: 80)

*** [GPU 0] NEW GLOBAL BEST: 81198.00 at gen 1800 ***
  -> 20 candidates sent to 1/1 workers
[GP] gpu_0 intermediate update: 81412.00 at gen 1700
[GP] gpu_0 intermediate update: 81198.00 at gen 1800
    Saved to best_solution.json

[GPU 0] Gen  1800 | Best: 81198.00 | 228.7s

*** [GPU 0] NEW GLOBAL BEST: 81130.00 at gen 1900 ***
    Saved to best_solution.json

[GPU 0] Gen  1900 | Best: 81130.00 | 241.5s
[GP] gpu_0 intermediate update: 81130.00 at gen 1900
[GP] gpu_0 intermediate update: 80607.00 at gen 2000

==================================================
GP ANALYSIS - Cycle 5
  Collected 40 solutions
==================================================

[GP] ========== GENETIC PROGRAMMING ANALYSIS STARTED ==========
[GP] Cycle: 4
[GP] Input: 40 solutions received for analysis
[GP] Fitness range: best=80606.00, worst=81198.00
[GP] Analysis config: blocks=True, fft=False, similarity=False
[GP] Starting analysis...
[GP] Phase 1: Extracting building blocks...

*** [GPU 0] NEW GLOBAL BEST: 80606.00 at gen 2000 ***
    Saved to best_solution.json

[GPU 0] Gen  2000 | Best: 80606.00 | 255.0s
    [Checkpoint] Saved to ./results/warm_start/blocks_only/rat783/1R10/job_times_4_seed0_2000.json
[GP] Phase 1 complete: Found 30 building blocks
[GP] Phase 2: FFT analysis DISABLED
[GP] Phase 3: Similarity analysis DISABLED
[GP] ========== GP ANALYSIS COMPLETE ==========


[GP] ========== CANDIDATE GENERATION STARTED ==========
[GP] Generating 20 new candidate solutions
[GP] Available data: 40 top solutions, 30 building blocks, 0 FFT patterns, 0 similarity patterns
[GP] Generation strategy: 6 block-based, 6 interpolated, 8 mutated
[GP] Strategy 1: Creating 6 candidates via building block combination...
[GP] Strategy 1 complete: 6 block-based candidates created
[GP] Strategy 2: Creating 6 candidates via solution interpolation...
[GP] Strategy 2 complete: 6 interpolated candidates created
[GP] Strategy 3: Creating 8 candidates via guided mutation...
[GP] Strategy 3 complete: 8 mutated candidates created
[GP] Total candidates generated: 20
[GP] Strategy breakdown: Block=30, Interp=30, Mut=40
[GP] ========== CANDIDATE GENERATION COMPLETE ==========


*** [GPU 0] NEW GLOBAL BEST: 80389.00 at gen 2100 ***
    Saved to best_solution.json

[GPU 0] Gen  2100 | Best: 80389.00 | 268.5s
[GPU 0] Gene injection: 20 candidates injected at gen 2200 (total so far: 100)
  -> 20 candidates sent to 1/1 workers

[CHECKPOINT] Saved A.json at gen 1000 (makespan: 80606.00)

*** [GPU 0] NEW GLOBAL BEST: 80119.00 at gen 2200 ***
    Saved to best_solution.json

[GPU 0] Gen  2200 | Best: 80119.00 | 281.3s
[GP] gpu_0 intermediate update: 80606.00 at gen 2000
[GP] gpu_0 intermediate update: 80389.00 at gen 2100
[GP] gpu_0 intermediate update: 80119.00 at gen 2200

*** [GPU 0] NEW GLOBAL BEST: 80009.00 at gen 2300 ***
    Saved to best_solution.json

[GPU 0] Gen  2300 | Best: 80009.00 | 294.0s
[GP] gpu_0 intermediate update: 80009.00 at gen 2300
[GP] gpu_0 intermediate update: 79827.00 at gen 2400

==================================================
GP ANALYSIS - Cycle 6
  Collected 40 solutions
==================================================

[GP] ========== GENETIC PROGRAMMING ANALYSIS STARTED ==========
[GP] Cycle: 5
[GP] Input: 40 solutions received for analysis
[GP] Fitness range: best=79827.00, worst=80138.00
[GP] Analysis config: blocks=True, fft=False, similarity=False
[GP] Starting analysis...
[GP] Phase 1: Extracting building blocks...

*** [GPU 0] NEW GLOBAL BEST: 79827.00 at gen 2400 ***
    Saved to best_solution.json

[GPU 0] Gen  2400 | Best: 79827.00 | 307.4s
[GP] Phase 1 complete: Found 30 building blocks
[GP] Phase 2: FFT analysis DISABLED
[GP] Phase 3: Similarity analysis DISABLED
[GP] ========== GP ANALYSIS COMPLETE ==========


[GP] ========== CANDIDATE GENERATION STARTED ==========
[GP] Generating 20 new candidate solutions
[GP] Available data: 40 top solutions, 30 building blocks, 0 FFT patterns, 0 similarity patterns
[GP] Generation strategy: 6 block-based, 6 interpolated, 8 mutated
[GP] Strategy 1: Creating 6 candidates via building block combination...
[GP] Strategy 1 complete: 6 block-based candidates created
[GP] Strategy 2: Creating 6 candidates via solution interpolation...
[GP] Strategy 2 complete: 6 interpolated candidates created
[GP] Strategy 3: Creating 8 candidates via guided mutation...
[GP] Strategy 3 complete: 8 mutated candidates created
[GP] Total candidates generated: 20
[GP] Strategy breakdown: Block=36, Interp=36, Mut=48
[GP] ========== CANDIDATE GENERATION COMPLETE ==========


*** [GPU 0] NEW GLOBAL BEST: 79533.00 at gen 2500 ***
    Saved to best_solution.json

[GPU 0] Gen  2500 | Best: 79533.00 | 320.3s
[GPU 0] Gene injection: 20 candidates injected at gen 2600 (total so far: 120)
  -> 20 candidates sent to 1/1 workers
[GP] gpu_0 intermediate update: 79533.00 at gen 2500
[GP] gpu_0 intermediate update: 79340.00 at gen 2600

*** [GPU 0] NEW GLOBAL BEST: 79340.00 at gen 2600 ***
    Saved to best_solution.json

[GPU 0] Gen  2600 | Best: 79340.00 | 333.6s

*** [GPU 0] NEW GLOBAL BEST: 79122.00 at gen 2700 ***
    Saved to best_solution.json

[GPU 0] Gen  2700 | Best: 79122.00 | 346.3s
[GP] gpu_0 intermediate update: 79122.00 at gen 2700
[GP] gpu_0 intermediate update: 78903.00 at gen 2800

==================================================
GP ANALYSIS - Cycle 7
  Collected 40 solutions
==================================================

[GP] ========== GENETIC PROGRAMMING ANALYSIS STARTED ==========
[GP] Cycle: 6
[GP] Input: 40 solutions received for analysis
[GP] Fitness range: best=78903.00, worst=79340.00
[GP] Analysis config: blocks=True, fft=False, similarity=False
[GP] Starting analysis...
[GP] Phase 1: Extracting building blocks...

*** [GPU 0] NEW GLOBAL BEST: 78903.00 at gen 2800 ***
    Saved to best_solution.json

[GPU 0] Gen  2800 | Best: 78903.00 | 359.5s
[GP] Phase 1 complete: Found 30 building blocks
[GP] Phase 2: FFT analysis DISABLED
[GP] Phase 3: Similarity analysis DISABLED
[GP] ========== GP ANALYSIS COMPLETE ==========


[GP] ========== CANDIDATE GENERATION STARTED ==========
[GP] Generating 20 new candidate solutions
[GP] Available data: 40 top solutions, 30 building blocks, 0 FFT patterns, 0 similarity patterns
[GP] Generation strategy: 6 block-based, 6 interpolated, 8 mutated
[GP] Strategy 1: Creating 6 candidates via building block combination...
[GP] Strategy 1 complete: 6 block-based candidates created
[GP] Strategy 2: Creating 6 candidates via solution interpolation...
[GP] Strategy 2 complete: 6 interpolated candidates created
[GP] Strategy 3: Creating 8 candidates via guided mutation...
[GP] Strategy 3 complete: 8 mutated candidates created
[GP] Total candidates generated: 20
[GP] Strategy breakdown: Block=42, Interp=42, Mut=56
[GP] ========== CANDIDATE GENERATION COMPLETE ==========


*** [GPU 0] NEW GLOBAL BEST: 78658.00 at gen 2900 ***
    Saved to best_solution.json

[GPU 0] Gen  2900 | Best: 78658.00 | 372.6s
[GPU 0] Gene injection: 20 candidates injected at gen 3000 (total so far: 140)
  -> 20 candidates sent to 1/1 workers
[GP] gpu_0 intermediate update: 78658.00 at gen 2900
[GP] gpu_0 intermediate update: 78589.00 at gen 3000

*** [GPU 0] NEW GLOBAL BEST: 78589.00 at gen 3000 ***
    Saved to best_solution.json

[GPU 0] Gen  3000 | Best: 78589.00 | 386.0s
    [Checkpoint] Saved to ./results/warm_start/blocks_only/rat783/1R10/job_times_4_seed0_3000.json

*** [GPU 0] NEW GLOBAL BEST: 78309.00 at gen 3100 ***
    Saved to best_solution.json

[GPU 0] Gen  3100 | Best: 78309.00 | 399.4s
[GP] gpu_0 intermediate update: 78309.00 at gen 3100
[GP] gpu_0 intermediate update: 78248.00 at gen 3200

==================================================
GP ANALYSIS - Cycle 8
  Collected 40 solutions
==================================================

[GP] ========== GENETIC PROGRAMMING ANALYSIS STARTED ==========
[GP] Cycle: 7
[GP] Input: 40 solutions received for analysis
[GP] Fitness range: best=78248.00, worst=78600.00
[GP] Analysis config: blocks=True, fft=False, similarity=False
[GP] Starting analysis...
[GP] Phase 1: Extracting building blocks...

*** [GPU 0] NEW GLOBAL BEST: 78248.00 at gen 3200 ***
    Saved to best_solution.json

[GPU 0] Gen  3200 | Best: 78248.00 | 412.4s
[GP] Phase 1 complete: Found 30 building blocks
[GP] Phase 2: FFT analysis DISABLED
[GP] Phase 3: Similarity analysis DISABLED
[GP] ========== GP ANALYSIS COMPLETE ==========


[GP] ========== CANDIDATE GENERATION STARTED ==========
[GP] Generating 20 new candidate solutions
[GP] Available data: 40 top solutions, 30 building blocks, 0 FFT patterns, 0 similarity patterns
[GP] Generation strategy: 6 block-based, 6 interpolated, 8 mutated
[GP] Strategy 1: Creating 6 candidates via building block combination...
[GP] Strategy 1 complete: 6 block-based candidates created
[GP] Strategy 2: Creating 6 candidates via solution interpolation...
[GP] Strategy 2 complete: 6 interpolated candidates created
[GP] Strategy 3: Creating 8 candidates via guided mutation...
[GP] Strategy 3 complete: 8 mutated candidates created
[GP] Total candidates generated: 20
[GP] Strategy breakdown: Block=48, Interp=48, Mut=64
[GP] ========== CANDIDATE GENERATION COMPLETE ==========

[GPU 0] Gen  3300 | Best: 78248.00 | 425.5s
[GPU 0] Gene injection: 20 candidates injected at gen 3400 (total so far: 160)
[GPU 0] Gen  3400 | Best: 78248.00 | 438.5s
[GPU 0] Gen  3500 | Best: 78248.00 | 451.7s
  -> 20 candidates sent to 1/1 workers

==================================================
GP ANALYSIS - Cycle 9
  Collected 40 solutions
==================================================

[GP] ========== GENETIC PROGRAMMING ANALYSIS STARTED ==========
[GP] Cycle: 8
[GP] Input: 40 solutions received for analysis
[GP] Fitness range: best=78248.00, worst=78248.00
[GP] Analysis config: blocks=True, fft=False, similarity=False
[GP] Starting analysis...
[GP] Phase 1: Extracting building blocks...
[GPU 0] Gen  3600 | Best: 78248.00 | 465.0s
[GP] Phase 1 complete: Found 0 building blocks
[GP] Phase 2: FFT analysis DISABLED
[GP] Phase 3: Similarity analysis DISABLED
[GP] ========== GP ANALYSIS COMPLETE ==========


[GP] ========== CANDIDATE GENERATION STARTED ==========
[GP] Generating 20 new candidate solutions
[GP] Available data: 40 top solutions, 0 building blocks, 0 FFT patterns, 0 similarity patterns
[GP] Generation strategy: 6 block-based, 6 interpolated, 8 mutated
[GP] Strategy 1: Creating 6 candidates via building block combination...
[GP] Strategy 1 complete: 6 block-based candidates created
[GP] Strategy 2: Creating 6 candidates via solution interpolation...
[GP] Strategy 2 complete: 6 interpolated candidates created
[GP] Strategy 3: Creating 8 candidates via guided mutation...
[GP] Strategy 3 complete: 8 mutated candidates created
[GP] Total candidates generated: 20
[GP] Strategy breakdown: Block=54, Interp=54, Mut=72
[GP] ========== CANDIDATE GENERATION COMPLETE ==========


*** [GPU 0] NEW GLOBAL BEST: 78247.00 at gen 3700 ***
    Saved to best_solution.json

[GPU 0] Gen  3700 | Best: 78247.00 | 478.1s
[GPU 0] Gene injection: 20 candidates injected at gen 3800 (total so far: 180)
[GPU 0] Gen  3800 | Best: 78247.00 | 491.0s
  -> 20 candidates sent to 1/1 workers
[GP] gpu_0 intermediate update: 78247.00 at gen 3700
[GPU 0] Gen  3900 | Best: 78247.00 | 504.0s
[GP] gpu_0 intermediate update: 78175.00 at gen 4000

==================================================
GP ANALYSIS - Cycle 10
  Collected 40 solutions
==================================================

[GP] ========== GENETIC PROGRAMMING ANALYSIS STARTED ==========
[GP] Cycle: 9
[GP] Input: 40 solutions received for analysis
[GP] Fitness range: best=78175.00, worst=78247.00
[GP] Analysis config: blocks=True, fft=False, similarity=False
[GP] Starting analysis...
[GP] Phase 1: Extracting building blocks...

*** [GPU 0] NEW GLOBAL BEST: 78175.00 at gen 4000 ***
    Saved to best_solution.json

[GPU 0] Gen  4000 | Best: 78175.00 | 517.2s
[GP] Phase 1 complete: Found 19 building blocks
[GP] Phase 2: FFT analysis DISABLED
[GP] Phase 3: Similarity analysis DISABLED
[GP] ========== GP ANALYSIS COMPLETE ==========


[GP] ========== CANDIDATE GENERATION STARTED ==========
[GP] Generating 20 new candidate solutions
[GP] Available data: 40 top solutions, 19 building blocks, 0 FFT patterns, 0 similarity patterns
[GP] Generation strategy: 6 block-based, 6 interpolated, 8 mutated
[GP] Strategy 1: Creating 6 candidates via building block combination...
[GP] Strategy 1 complete: 6 block-based candidates created
[GP] Strategy 2: Creating 6 candidates via solution interpolation...
[GP] Strategy 2 complete: 6 interpolated candidates created
[GP] Strategy 3: Creating 8 candidates via guided mutation...
[GP] Strategy 3 complete: 8 mutated candidates created
[GP] Total candidates generated: 20
[GP] Strategy breakdown: Block=60, Interp=60, Mut=80
[GP] ========== CANDIDATE GENERATION COMPLETE ==========

    [Checkpoint] Saved to ./results/warm_start/blocks_only/rat783/1R10/job_times_4_seed0_4000.json
[GPU 0] Gen  4100 | Best: 78175.00 | 529.8s
[GPU 0] Gene injection: 20 candidates injected at gen 4200 (total so far: 200)
  -> 20 candidates sent to 1/1 workers

[CHECKPOINT] Saved B.json at gen 2000 (makespan: 78175.00)

*** [GPU 0] NEW GLOBAL BEST: 77961.00 at gen 4200 ***
    Saved to best_solution.json

[GPU 0] Gen  4200 | Best: 77961.00 | 543.1s
[GP] gpu_0 intermediate update: 77961.00 at gen 4200

*** [GPU 0] NEW GLOBAL BEST: 77785.00 at gen 4300 ***
    Saved to best_solution.json

[GPU 0] Gen  4300 | Best: 77785.00 | 556.1s
[GP] gpu_0 intermediate update: 77785.00 at gen 4300

==================================================
GP ANALYSIS - Cycle 11
  Collected 40 solutions
==================================================

[GP] ========== GENETIC PROGRAMMING ANALYSIS STARTED ==========
[GP] Cycle: 10
[GP] Input: 40 solutions received for analysis
[GP] Fitness range: best=77785.00, worst=77961.00
[GP] Analysis config: blocks=True, fft=False, similarity=False
[GP] Starting analysis...
[GP] Phase 1: Extracting building blocks...
[GPU 0] Gen  4400 | Best: 77785.00 | 569.4s
[GP] Phase 1 complete: Found 30 building blocks
[GP] Phase 2: FFT analysis DISABLED
[GP] Phase 3: Similarity analysis DISABLED
[GP] ========== GP ANALYSIS COMPLETE ==========


[GP] ========== CANDIDATE GENERATION STARTED ==========
[GP] Generating 20 new candidate solutions
[GP] Available data: 40 top solutions, 30 building blocks, 0 FFT patterns, 0 similarity patterns
[GP] Generation strategy: 6 block-based, 6 interpolated, 8 mutated
[GP] Strategy 1: Creating 6 candidates via building block combination...
[GP] Strategy 1 complete: 6 block-based candidates created
[GP] Strategy 2: Creating 6 candidates via solution interpolation...
[GP] Strategy 2 complete: 6 interpolated candidates created
[GP] Strategy 3: Creating 8 candidates via guided mutation...
[GP] Strategy 3 complete: 8 mutated candidates created
[GP] Total candidates generated: 20
[GP] Strategy breakdown: Block=66, Interp=66, Mut=88
[GP] ========== CANDIDATE GENERATION COMPLETE ==========


*** [GPU 0] NEW GLOBAL BEST: 77611.00 at gen 4500 ***
    Saved to best_solution.json

[GPU 0] Gen  4500 | Best: 77611.00 | 582.5s
[GPU 0] Gene injection: 20 candidates injected at gen 4600 (total so far: 220)
  -> 20 candidates sent to 1/1 workers
[GP] gpu_0 intermediate update: 77611.00 at gen 4500
[GP] gpu_0 intermediate update: 77251.00 at gen 4600

*** [GPU 0] NEW GLOBAL BEST: 77251.00 at gen 4600 ***
    Saved to best_solution.json

[GPU 0] Gen  4600 | Best: 77251.00 | 596.2s

*** [GPU 0] NEW GLOBAL BEST: 77097.00 at gen 4700 ***
    Saved to best_solution.json

[GPU 0] Gen  4700 | Best: 77097.00 | 609.6s
[GP] gpu_0 intermediate update: 77097.00 at gen 4700
[GP] gpu_0 intermediate update: 76876.00 at gen 4800

==================================================
GP ANALYSIS - Cycle 12
  Collected 40 solutions
==================================================

[GP] ========== GENETIC PROGRAMMING ANALYSIS STARTED ==========
[GP] Cycle: 11
[GP] Input: 40 solutions received for analysis
[GP] Fitness range: best=76876.00, worst=77251.00
[GP] Analysis config: blocks=True, fft=False, similarity=False
[GP] Starting analysis...
[GP] Phase 1: Extracting building blocks...

*** [GPU 0] NEW GLOBAL BEST: 76876.00 at gen 4800 ***
    Saved to best_solution.json

[GPU 0] Gen  4800 | Best: 76876.00 | 623.1s
[GP] Phase 1 complete: Found 30 building blocks
[GP] Phase 2: FFT analysis DISABLED
[GP] Phase 3: Similarity analysis DISABLED
[GP] ========== GP ANALYSIS COMPLETE ==========


[GP] ========== CANDIDATE GENERATION STARTED ==========
[GP] Generating 20 new candidate solutions
[GP] Available data: 40 top solutions, 30 building blocks, 0 FFT patterns, 0 similarity patterns
[GP] Generation strategy: 6 block-based, 6 interpolated, 8 mutated
[GP] Strategy 1: Creating 6 candidates via building block combination...
[GP] Strategy 1 complete: 6 block-based candidates created
[GP] Strategy 2: Creating 6 candidates via solution interpolation...
[GP] Strategy 2 complete: 6 interpolated candidates created
[GP] Strategy 3: Creating 8 candidates via guided mutation...
[GP] Strategy 3 complete: 8 mutated candidates created
[GP] Total candidates generated: 20
[GP] Strategy breakdown: Block=72, Interp=72, Mut=96
[GP] ========== CANDIDATE GENERATION COMPLETE ==========


*** [GPU 0] NEW GLOBAL BEST: 76690.00 at gen 4900 ***
    Saved to best_solution.json

[GPU 0] Gen  4900 | Best: 76690.00 | 636.3s
[GPU 0] Gene injection: 20 candidates injected at gen 5000 (total so far: 240)
[GPU 0] Evolution complete. Sending final results...
  -> 20 candidates sent to 1/1 workers
[GP] gpu_0 intermediate update: 76690.00 at gen 4900
[GP] gpu_0 intermediate update: 76449.00 at gen 5000
[GP] Worker finished: gpu_0 (best=76449.00)

[GP] All workers finished. Total GP cycles: 12

[Final Collection] Have 1/1 workers. Waiting up to 120s for remaining...

[Critical] Attempting final result collection before terminating workers...

[Results Summary] Collected 1 results:
  gpu_0: fitness=76449.00, intermediate=False, gen=final

======================================================================
COMPLETE
======================================================================
Best: 76449.00 from gpu_0
  (Improved 59.2% over heuristic 187503.00)
Time: 652.1s
Total candidates injected: 240

Solution JSON saved to ./results/warm_start/blocks_only/rat783/1R10/job_times_4_seed0.json
HTML Gantt chart saved to: ./results/warm_start/blocks_only/rat783/1R10/job_times_4_seed0.html
