Setting random seed to 0
DEBUG: proc shape: (1000,), agents: 6, resources: 4, n: 1000

======================================================================
VRP-RPD SOLVER
======================================================================
Problem: 999 customers, 6 agents, k=4
Heuristic: None
Genetic Programming: Yes
Warm Start: No
Gene Injection: Yes
Workers: 1 GPU + 0 CPU
Generations: 5000
======================================================================


[GP] Starting GP collection loop (timeout: 12975s)...

*** [GPU 0] NEW GLOBAL BEST: 799221382.00 at gen 0 ***
    Saved to best_solution.json

[GPU 0] Gen     0 | Best: 799221382.00 | 0.6s
[GP] gpu_0 first intermediate: 799221382.00 at gen 0

*** [GPU 0] NEW GLOBAL BEST: 555146725.00 at gen 100 ***
    Saved to best_solution.json

[GPU 0] Gen   100 | Best: 555146725.00 | 15.1s
[GP] gpu_0 intermediate update: 555146725.00 at gen 100
[GP] gpu_0 intermediate update: 526280425.00 at gen 200

*** [GPU 0] NEW GLOBAL BEST: 526181655.00 at gen 200 ***
    Saved to best_solution.json

[GPU 0] Gen   200 | Best: 526181655.00 | 30.9s
[GP] gpu_0 intermediate update: 526181655.00 at gen 200

*** [GPU 0] NEW GLOBAL BEST: 516838909.00 at gen 300 ***
    Saved to best_solution.json

[GPU 0] Gen   300 | Best: 516838909.00 | 47.3s
[GP] gpu_0 intermediate update: 516838909.00 at gen 300
[GP] gpu_0 intermediate update: 503382634.00 at gen 400

==================================================
GP ANALYSIS - Cycle 1
  Collected 40 solutions
==================================================

[GP] ========== GENETIC PROGRAMMING ANALYSIS STARTED ==========
[GP] Cycle: 0
[GP] Input: 40 solutions received for analysis
[GP] Fitness range: best=503382624.00, worst=526410592.00
[GP] Analysis config: blocks=True, fft=False, similarity=False
[GP] Starting analysis...
[GP] Phase 1: Extracting building blocks...

*** [GPU 0] NEW GLOBAL BEST: 503382634.00 at gen 400 ***
    Saved to best_solution.json

[GPU 0] Gen   400 | Best: 503382634.00 | 63.0s
[GP] Phase 1 complete: Found 30 building blocks
[GP] Phase 2: FFT analysis DISABLED
[GP] Phase 3: Similarity analysis DISABLED
[GP] ========== GP ANALYSIS COMPLETE ==========


[GP] ========== CANDIDATE GENERATION STARTED ==========
[GP] Generating 20 new candidate solutions
[GP] Available data: 40 top solutions, 30 building blocks, 0 FFT patterns, 0 similarity patterns
[GP] Generation strategy: 6 block-based, 6 interpolated, 8 mutated
[GP] Strategy 1: Creating 6 candidates via building block combination...
[GP] Strategy 1 complete: 6 block-based candidates created
[GP] Strategy 2: Creating 6 candidates via solution interpolation...
[GP] Strategy 2 complete: 6 interpolated candidates created
[GP] Strategy 3: Creating 8 candidates via guided mutation...
[GP] Strategy 3 complete: 8 mutated candidates created
[GP] Total candidates generated: 20
[GP] Strategy breakdown: Block=6, Interp=6, Mut=8
[GP] ========== CANDIDATE GENERATION COMPLETE ==========


*** [GPU 0] NEW GLOBAL BEST: 495140956.00 at gen 500 ***
    Saved to best_solution.json

[GPU 0] Gen   500 | Best: 495140956.00 | 78.7s
[GPU 0] Gene injection: 20 candidates injected at gen 600 (total so far: 20)
  -> 20 candidates sent to 1/1 workers
[GP] gpu_0 intermediate update: 495140956.00 at gen 500
[GP] gpu_0 intermediate update: 489302605.00 at gen 600

*** [GPU 0] NEW GLOBAL BEST: 489258402.00 at gen 600 ***
    Saved to best_solution.json

[GPU 0] Gen   600 | Best: 489258402.00 | 93.3s
[GP] gpu_0 intermediate update: 489258402.00 at gen 600

*** [GPU 0] NEW GLOBAL BEST: 482354890.00 at gen 700 ***
    Saved to best_solution.json

[GPU 0] Gen   700 | Best: 482354890.00 | 108.2s
[GP] gpu_0 intermediate update: 482354890.00 at gen 700
[GP] gpu_0 intermediate update: 477141191.00 at gen 800

==================================================
GP ANALYSIS - Cycle 2
  Collected 40 solutions
==================================================

[GP] ========== GENETIC PROGRAMMING ANALYSIS STARTED ==========
[GP] Cycle: 1
[GP] Input: 40 solutions received for analysis
[GP] Fitness range: best=477141184.00, worst=489571392.00
[GP] Analysis config: blocks=True, fft=False, similarity=False
[GP] Starting analysis...
[GP] Phase 1: Extracting building blocks...

*** [GPU 0] NEW GLOBAL BEST: 477141191.00 at gen 800 ***
    Saved to best_solution.json

[GPU 0] Gen   800 | Best: 477141191.00 | 122.6s
[GP] Phase 1 complete: Found 30 building blocks
[GP] Phase 2: FFT analysis DISABLED
[GP] Phase 3: Similarity analysis DISABLED
[GP] ========== GP ANALYSIS COMPLETE ==========


[GP] ========== CANDIDATE GENERATION STARTED ==========
[GP] Generating 20 new candidate solutions
[GP] Available data: 40 top solutions, 30 building blocks, 0 FFT patterns, 0 similarity patterns
[GP] Generation strategy: 6 block-based, 6 interpolated, 8 mutated
[GP] Strategy 1: Creating 6 candidates via building block combination...
[GP] Strategy 1 complete: 6 block-based candidates created
[GP] Strategy 2: Creating 6 candidates via solution interpolation...
[GP] Strategy 2 complete: 6 interpolated candidates created
[GP] Strategy 3: Creating 8 candidates via guided mutation...
[GP] Strategy 3 complete: 8 mutated candidates created
[GP] Total candidates generated: 20
[GP] Strategy breakdown: Block=12, Interp=12, Mut=16
[GP] ========== CANDIDATE GENERATION COMPLETE ==========


*** [GPU 0] NEW GLOBAL BEST: 472275224.00 at gen 900 ***
    Saved to best_solution.json

[GPU 0] Gen   900 | Best: 472275224.00 | 137.3s
[GPU 0] Gene injection: 20 candidates injected at gen 1000 (total so far: 40)
  -> 20 candidates sent to 1/1 workers
[GP] gpu_0 intermediate update: 472275224.00 at gen 900
[GP] gpu_0 intermediate update: 467550214.00 at gen 1000

*** [GPU 0] NEW GLOBAL BEST: 467550214.00 at gen 1000 ***
    Saved to best_solution.json

[GPU 0] Gen  1000 | Best: 467550214.00 | 151.8s
    [Checkpoint] Saved to ./results/cold_start/blocks_only/dsj1000/1R20/job_times_6_seed0_1000.json

*** [GPU 0] NEW GLOBAL BEST: 462250251.00 at gen 1100 ***
    Saved to best_solution.json

[GPU 0] Gen  1100 | Best: 462250251.00 | 166.6s
[GP] gpu_0 intermediate update: 462250251.00 at gen 1100
[GP] gpu_0 intermediate update: 457956189.00 at gen 1200

==================================================
GP ANALYSIS - Cycle 3
  Collected 40 solutions
==================================================

[GP] ========== GENETIC PROGRAMMING ANALYSIS STARTED ==========
[GP] Cycle: 2
[GP] Input: 40 solutions received for analysis
[GP] Fitness range: best=457796512.00, worst=467550208.00
[GP] Analysis config: blocks=True, fft=False, similarity=False
[GP] Starting analysis...
[GP] Phase 1: Extracting building blocks...

*** [GPU 0] NEW GLOBAL BEST: 457796503.00 at gen 1200 ***
    Saved to best_solution.json

[GPU 0] Gen  1200 | Best: 457796503.00 | 181.0s
[GP] Phase 1 complete: Found 30 building blocks
[GP] Phase 2: FFT analysis DISABLED
[GP] Phase 3: Similarity analysis DISABLED
[GP] ========== GP ANALYSIS COMPLETE ==========


[GP] ========== CANDIDATE GENERATION STARTED ==========
[GP] Generating 20 new candidate solutions
[GP] Available data: 40 top solutions, 30 building blocks, 0 FFT patterns, 0 similarity patterns
[GP] Generation strategy: 6 block-based, 6 interpolated, 8 mutated
[GP] Strategy 1: Creating 6 candidates via building block combination...
[GP] Strategy 1 complete: 6 block-based candidates created
[GP] Strategy 2: Creating 6 candidates via solution interpolation...
[GP] Strategy 2 complete: 6 interpolated candidates created
[GP] Strategy 3: Creating 8 candidates via guided mutation...
[GP] Strategy 3 complete: 8 mutated candidates created
[GP] Total candidates generated: 20
[GP] Strategy breakdown: Block=18, Interp=18, Mut=24
[GP] ========== CANDIDATE GENERATION COMPLETE ==========


*** [GPU 0] NEW GLOBAL BEST: 455079095.00 at gen 1300 ***
    Saved to best_solution.json

[GPU 0] Gen  1300 | Best: 455079095.00 | 195.1s
[GPU 0] Gene injection: 20 candidates injected at gen 1400 (total so far: 60)
  -> 20 candidates sent to 1/1 workers
[GP] gpu_0 intermediate update: 457796503.00 at gen 1200
[GP] gpu_0 intermediate update: 455079095.00 at gen 1300
[GP] gpu_0 intermediate update: 451718958.00 at gen 1400

*** [GPU 0] NEW GLOBAL BEST: 451718958.00 at gen 1400 ***
    Saved to best_solution.json

[GPU 0] Gen  1400 | Best: 451718958.00 | 209.6s

*** [GPU 0] NEW GLOBAL BEST: 448005942.00 at gen 1500 ***
    Saved to best_solution.json

[GPU 0] Gen  1500 | Best: 448005942.00 | 225.2s
[GP] gpu_0 intermediate update: 448005942.00 at gen 1500
[GP] gpu_0 intermediate update: 445633764.00 at gen 1600

==================================================
GP ANALYSIS - Cycle 4
  Collected 40 solutions
==================================================

[GP] ========== GENETIC PROGRAMMING ANALYSIS STARTED ==========
[GP] Cycle: 3
[GP] Input: 40 solutions received for analysis
[GP] Fitness range: best=445633760.00, worst=451758080.00
[GP] Analysis config: blocks=True, fft=False, similarity=False
[GP] Starting analysis...
[GP] Phase 1: Extracting building blocks...

*** [GPU 0] NEW GLOBAL BEST: 445633764.00 at gen 1600 ***
    Saved to best_solution.json

[GPU 0] Gen  1600 | Best: 445633764.00 | 239.8s
[GP] Phase 1 complete: Found 30 building blocks
[GP] Phase 2: FFT analysis DISABLED
[GP] Phase 3: Similarity analysis DISABLED
[GP] ========== GP ANALYSIS COMPLETE ==========


[GP] ========== CANDIDATE GENERATION STARTED ==========
[GP] Generating 20 new candidate solutions
[GP] Available data: 40 top solutions, 30 building blocks, 0 FFT patterns, 0 similarity patterns
[GP] Generation strategy: 6 block-based, 6 interpolated, 8 mutated
[GP] Strategy 1: Creating 6 candidates via building block combination...
[GP] Strategy 1 complete: 6 block-based candidates created
[GP] Strategy 2: Creating 6 candidates via solution interpolation...
[GP] Strategy 2 complete: 6 interpolated candidates created
[GP] Strategy 3: Creating 8 candidates via guided mutation...
[GP] Strategy 3 complete: 8 mutated candidates created
[GP] Total candidates generated: 20
[GP] Strategy breakdown: Block=24, Interp=24, Mut=32
[GP] ========== CANDIDATE GENERATION COMPLETE ==========


*** [GPU 0] NEW GLOBAL BEST: 443440628.00 at gen 1700 ***
    Saved to best_solution.json

[GPU 0] Gen  1700 | Best: 443440628.00 | 254.7s
[GPU 0] Gene injection: 20 candidates injected at gen 1800 (total so far: 80)
  -> 20 candidates sent to 1/1 workers
[GP] gpu_0 intermediate update: 443440628.00 at gen 1700
[GP] gpu_0 intermediate update: 441703545.00 at gen 1800

*** [GPU 0] NEW GLOBAL BEST: 441703545.00 at gen 1800 ***
    Saved to best_solution.json

[GPU 0] Gen  1800 | Best: 441703545.00 | 270.0s

*** [GPU 0] NEW GLOBAL BEST: 438980298.00 at gen 1900 ***
    Saved to best_solution.json

[GPU 0] Gen  1900 | Best: 438980298.00 | 285.4s
[GP] gpu_0 intermediate update: 438980298.00 at gen 1900
[GP] gpu_0 intermediate update: 436916013.00 at gen 2000

==================================================
GP ANALYSIS - Cycle 5
  Collected 40 solutions
==================================================

[GP] ========== GENETIC PROGRAMMING ANALYSIS STARTED ==========
[GP] Cycle: 4
[GP] Input: 40 solutions received for analysis
[GP] Fitness range: best=436897920.00, worst=441704352.00
[GP] Analysis config: blocks=True, fft=False, similarity=False
[GP] Starting analysis...
[GP] Phase 1: Extracting building blocks...

*** [GPU 0] NEW GLOBAL BEST: 436897908.00 at gen 2000 ***
    Saved to best_solution.json

[GPU 0] Gen  2000 | Best: 436897908.00 | 299.7s
[GP] Phase 1 complete: Found 30 building blocks
[GP] Phase 2: FFT analysis DISABLED
[GP] Phase 3: Similarity analysis DISABLED
[GP] ========== GP ANALYSIS COMPLETE ==========


[GP] ========== CANDIDATE GENERATION STARTED ==========
[GP] Generating 20 new candidate solutions
[GP] Available data: 40 top solutions, 30 building blocks, 0 FFT patterns, 0 similarity patterns
[GP] Generation strategy: 6 block-based, 6 interpolated, 8 mutated
[GP] Strategy 1: Creating 6 candidates via building block combination...
[GP] Strategy 1 complete: 6 block-based candidates created
[GP] Strategy 2: Creating 6 candidates via solution interpolation...
[GP] Strategy 2 complete: 6 interpolated candidates created
[GP] Strategy 3: Creating 8 candidates via guided mutation...
[GP] Strategy 3 complete: 8 mutated candidates created
[GP] Total candidates generated: 20
[GP] Strategy breakdown: Block=30, Interp=30, Mut=40
[GP] ========== CANDIDATE GENERATION COMPLETE ==========

    [Checkpoint] Saved to ./results/cold_start/blocks_only/dsj1000/1R20/job_times_6_seed0_2000.json

*** [GPU 0] NEW GLOBAL BEST: 435320922.00 at gen 2100 ***
    Saved to best_solution.json

[GPU 0] Gen  2100 | Best: 435320922.00 | 313.3s
[GPU 0] Gene injection: 20 candidates injected at gen 2200 (total so far: 100)

*** [GPU 0] NEW GLOBAL BEST: 434065074.00 at gen 2200 ***
  -> 20 candidates sent to 1/1 workers

[CHECKPOINT] Saved A.json at gen 1000 (makespan: 436897908.00)
    Saved to best_solution.json

[GPU 0] Gen  2200 | Best: 434065074.00 | 326.2s
[GP] gpu_0 intermediate update: 436897908.00 at gen 2000
[GP] gpu_0 intermediate update: 435320922.00 at gen 2100
[GP] gpu_0 intermediate update: 434065074.00 at gen 2200

*** [GPU 0] NEW GLOBAL BEST: 432267610.00 at gen 2300 ***
    Saved to best_solution.json

[GPU 0] Gen  2300 | Best: 432267610.00 | 339.6s
[GP] gpu_0 intermediate update: 432267610.00 at gen 2300
[GP] gpu_0 intermediate update: 431357660.00 at gen 2400

==================================================
GP ANALYSIS - Cycle 6
  Collected 40 solutions
==================================================

[GP] ========== GENETIC PROGRAMMING ANALYSIS STARTED ==========
[GP] Cycle: 5
[GP] Input: 40 solutions received for analysis
[GP] Fitness range: best=431357664.00, worst=434089856.00
[GP] Analysis config: blocks=True, fft=False, similarity=False
[GP] Starting analysis...
[GP] Phase 1: Extracting building blocks...

*** [GPU 0] NEW GLOBAL BEST: 431357660.00 at gen 2400 ***
    Saved to best_solution.json

[GPU 0] Gen  2400 | Best: 431357660.00 | 352.6s
[GP] Phase 1 complete: Found 30 building blocks
[GP] Phase 2: FFT analysis DISABLED
[GP] Phase 3: Similarity analysis DISABLED
[GP] ========== GP ANALYSIS COMPLETE ==========


[GP] ========== CANDIDATE GENERATION STARTED ==========
[GP] Generating 20 new candidate solutions
[GP] Available data: 40 top solutions, 30 building blocks, 0 FFT patterns, 0 similarity patterns
[GP] Generation strategy: 6 block-based, 6 interpolated, 8 mutated
[GP] Strategy 1: Creating 6 candidates via building block combination...
[GP] Strategy 1 complete: 6 block-based candidates created
[GP] Strategy 2: Creating 6 candidates via solution interpolation...
[GP] Strategy 2 complete: 6 interpolated candidates created
[GP] Strategy 3: Creating 8 candidates via guided mutation...
[GP] Strategy 3 complete: 8 mutated candidates created
[GP] Total candidates generated: 20
[GP] Strategy breakdown: Block=36, Interp=36, Mut=48
[GP] ========== CANDIDATE GENERATION COMPLETE ==========


*** [GPU 0] NEW GLOBAL BEST: 429789417.00 at gen 2500 ***
    Saved to best_solution.json

[GPU 0] Gen  2500 | Best: 429789417.00 | 365.2s
[GPU 0] Gene injection: 20 candidates injected at gen 2600 (total so far: 120)
  -> 20 candidates sent to 1/1 workers
[GP] gpu_0 intermediate update: 429789417.00 at gen 2500
[GP] gpu_0 intermediate update: 428779752.00 at gen 2600

*** [GPU 0] NEW GLOBAL BEST: 428779752.00 at gen 2600 ***
    Saved to best_solution.json

[GPU 0] Gen  2600 | Best: 428779752.00 | 379.0s

*** [GPU 0] NEW GLOBAL BEST: 427324268.00 at gen 2700 ***
    Saved to best_solution.json

[GPU 0] Gen  2700 | Best: 427324268.00 | 393.5s
[GP] gpu_0 intermediate update: 427324268.00 at gen 2700
[GP] gpu_0 intermediate update: 424818240.00 at gen 2800

==================================================
GP ANALYSIS - Cycle 7
  Collected 40 solutions
==================================================

[GP] ========== GENETIC PROGRAMMING ANALYSIS STARTED ==========
[GP] Cycle: 6
[GP] Input: 40 solutions received for analysis
[GP] Fitness range: best=424818240.00, worst=428802176.00
[GP] Analysis config: blocks=True, fft=False, similarity=False
[GP] Starting analysis...
[GP] Phase 1: Extracting building blocks...

*** [GPU 0] NEW GLOBAL BEST: 424818240.00 at gen 2800 ***
    Saved to best_solution.json

[GPU 0] Gen  2800 | Best: 424818240.00 | 408.1s
[GP] Phase 1 complete: Found 30 building blocks
[GP] Phase 2: FFT analysis DISABLED
[GP] Phase 3: Similarity analysis DISABLED
[GP] ========== GP ANALYSIS COMPLETE ==========


[GP] ========== CANDIDATE GENERATION STARTED ==========
[GP] Generating 20 new candidate solutions
[GP] Available data: 40 top solutions, 30 building blocks, 0 FFT patterns, 0 similarity patterns
[GP] Generation strategy: 6 block-based, 6 interpolated, 8 mutated
[GP] Strategy 1: Creating 6 candidates via building block combination...
[GP] Strategy 1 complete: 6 block-based candidates created
[GP] Strategy 2: Creating 6 candidates via solution interpolation...
[GP] Strategy 2 complete: 6 interpolated candidates created
[GP] Strategy 3: Creating 8 candidates via guided mutation...
[GP] Strategy 3 complete: 8 mutated candidates created
[GP] Total candidates generated: 20
[GP] Strategy breakdown: Block=42, Interp=42, Mut=56
[GP] ========== CANDIDATE GENERATION COMPLETE ==========


*** [GPU 0] NEW GLOBAL BEST: 423275213.00 at gen 2900 ***
    Saved to best_solution.json

[GPU 0] Gen  2900 | Best: 423275213.00 | 422.1s
[GPU 0] Gene injection: 20 candidates injected at gen 3000 (total so far: 140)
  -> 20 candidates sent to 1/1 workers
[GP] gpu_0 intermediate update: 423275213.00 at gen 2900
[GP] gpu_0 intermediate update: 421144731.00 at gen 3000

*** [GPU 0] NEW GLOBAL BEST: 421144731.00 at gen 3000 ***
    Saved to best_solution.json

[GPU 0] Gen  3000 | Best: 421144731.00 | 436.2s
    [Checkpoint] Saved to ./results/cold_start/blocks_only/dsj1000/1R20/job_times_6_seed0_3000.json

*** [GPU 0] NEW GLOBAL BEST: 419693177.00 at gen 3100 ***
    Saved to best_solution.json

[GPU 0] Gen  3100 | Best: 419693177.00 | 448.9s
[GP] gpu_0 intermediate update: 419693177.00 at gen 3100
[GP] gpu_0 intermediate update: 419161876.00 at gen 3200

==================================================
GP ANALYSIS - Cycle 8
  Collected 40 solutions
==================================================

[GP] ========== GENETIC PROGRAMMING ANALYSIS STARTED ==========
[GP] Cycle: 7
[GP] Input: 40 solutions received for analysis
[GP] Fitness range: best=419097536.00, worst=421302272.00
[GP] Analysis config: blocks=True, fft=False, similarity=False
[GP] Starting analysis...
[GP] Phase 1: Extracting building blocks...

*** [GPU 0] NEW GLOBAL BEST: 419097521.00 at gen 3200 ***
    Saved to best_solution.json

[GPU 0] Gen  3200 | Best: 419097521.00 | 461.1s
[GP] Phase 1 complete: Found 30 building blocks
[GP] Phase 2: FFT analysis DISABLED
[GP] Phase 3: Similarity analysis DISABLED
[GP] ========== GP ANALYSIS COMPLETE ==========


[GP] ========== CANDIDATE GENERATION STARTED ==========
[GP] Generating 20 new candidate solutions
[GP] Available data: 40 top solutions, 30 building blocks, 0 FFT patterns, 0 similarity patterns
[GP] Generation strategy: 6 block-based, 6 interpolated, 8 mutated
[GP] Strategy 1: Creating 6 candidates via building block combination...
[GP] Strategy 1 complete: 6 block-based candidates created
[GP] Strategy 2: Creating 6 candidates via solution interpolation...
[GP] Strategy 2 complete: 6 interpolated candidates created
[GP] Strategy 3: Creating 8 candidates via guided mutation...
[GP] Strategy 3 complete: 8 mutated candidates created
[GP] Total candidates generated: 20
[GP] Strategy breakdown: Block=48, Interp=48, Mut=64
[GP] ========== CANDIDATE GENERATION COMPLETE ==========


*** [GPU 0] NEW GLOBAL BEST: 417592850.00 at gen 3300 ***
    Saved to best_solution.json

[GPU 0] Gen  3300 | Best: 417592850.00 | 473.0s
[GPU 0] Gene injection: 20 candidates injected at gen 3400 (total so far: 160)
  -> 20 candidates sent to 1/1 workers
[GP] gpu_0 intermediate update: 419097521.00 at gen 3200
[GP] gpu_0 intermediate update: 417592850.00 at gen 3300
[GP] gpu_0 intermediate update: 416551528.00 at gen 3400

*** [GPU 0] NEW GLOBAL BEST: 416551528.00 at gen 3400 ***
    Saved to best_solution.json

[GPU 0] Gen  3400 | Best: 416551528.00 | 485.8s

*** [GPU 0] NEW GLOBAL BEST: 415751884.00 at gen 3500 ***
    Saved to best_solution.json

[GPU 0] Gen  3500 | Best: 415751884.00 | 498.7s
[GP] gpu_0 intermediate update: 415751884.00 at gen 3500
[GP] gpu_0 intermediate update: 415076924.00 at gen 3600

==================================================
GP ANALYSIS - Cycle 9
  Collected 40 solutions
==================================================

[GP] ========== GENETIC PROGRAMMING ANALYSIS STARTED ==========
[GP] Cycle: 8
[GP] Input: 40 solutions received for analysis
[GP] Fitness range: best=415076928.00, worst=416551520.00
[GP] Analysis config: blocks=True, fft=False, similarity=False
[GP] Starting analysis...
[GP] Phase 1: Extracting building blocks...

*** [GPU 0] NEW GLOBAL BEST: 415076924.00 at gen 3600 ***
    Saved to best_solution.json

[GPU 0] Gen  3600 | Best: 415076924.00 | 511.5s
[GP] Phase 1 complete: Found 30 building blocks
[GP] Phase 2: FFT analysis DISABLED
[GP] Phase 3: Similarity analysis DISABLED
[GP] ========== GP ANALYSIS COMPLETE ==========


[GP] ========== CANDIDATE GENERATION STARTED ==========
[GP] Generating 20 new candidate solutions
[GP] Available data: 40 top solutions, 30 building blocks, 0 FFT patterns, 0 similarity patterns
[GP] Generation strategy: 6 block-based, 6 interpolated, 8 mutated
[GP] Strategy 1: Creating 6 candidates via building block combination...
[GP] Strategy 1 complete: 6 block-based candidates created
[GP] Strategy 2: Creating 6 candidates via solution interpolation...
[GP] Strategy 2 complete: 6 interpolated candidates created
[GP] Strategy 3: Creating 8 candidates via guided mutation...
[GP] Strategy 3 complete: 8 mutated candidates created
[GP] Total candidates generated: 20
[GP] Strategy breakdown: Block=54, Interp=54, Mut=72
[GP] ========== CANDIDATE GENERATION COMPLETE ==========


*** [GPU 0] NEW GLOBAL BEST: 414275580.00 at gen 3700 ***
    Saved to best_solution.json

[GPU 0] Gen  3700 | Best: 414275580.00 | 524.0s
[GPU 0] Gene injection: 20 candidates injected at gen 3800 (total so far: 180)

*** [GPU 0] NEW GLOBAL BEST: 413444849.00 at gen 3800 ***
    Saved to best_solution.json

[GPU 0] Gen  3800 | Best: 413444849.00 | 536.0s
  -> 20 candidates sent to 1/1 workers
[GP] gpu_0 intermediate update: 414275580.00 at gen 3700
[GP] gpu_0 intermediate update: 413444849.00 at gen 3800

*** [GPU 0] NEW GLOBAL BEST: 412441157.00 at gen 3900 ***
    Saved to best_solution.json

[GPU 0] Gen  3900 | Best: 412441157.00 | 548.2s
[GP] gpu_0 intermediate update: 412441157.00 at gen 3900
[GP] gpu_0 intermediate update: 411746329.00 at gen 4000

==================================================
GP ANALYSIS - Cycle 10
  Collected 40 solutions
==================================================

[GP] ========== GENETIC PROGRAMMING ANALYSIS STARTED ==========
[GP] Cycle: 9
[GP] Input: 40 solutions received for analysis
[GP] Fitness range: best=411746336.00, worst=413444864.00
[GP] Analysis config: blocks=True, fft=False, similarity=False
[GP] Starting analysis...
[GP] Phase 1: Extracting building blocks...

*** [GPU 0] NEW GLOBAL BEST: 411746329.00 at gen 4000 ***
    Saved to best_solution.json

[GPU 0] Gen  4000 | Best: 411746329.00 | 560.6s
[GP] Phase 1 complete: Found 30 building blocks
[GP] Phase 2: FFT analysis DISABLED
[GP] Phase 3: Similarity analysis DISABLED
[GP] ========== GP ANALYSIS COMPLETE ==========


[GP] ========== CANDIDATE GENERATION STARTED ==========
[GP] Generating 20 new candidate solutions
[GP] Available data: 40 top solutions, 30 building blocks, 0 FFT patterns, 0 similarity patterns
[GP] Generation strategy: 6 block-based, 6 interpolated, 8 mutated
[GP] Strategy 1: Creating 6 candidates via building block combination...
[GP] Strategy 1 complete: 6 block-based candidates created
[GP] Strategy 2: Creating 6 candidates via solution interpolation...
[GP] Strategy 2 complete: 6 interpolated candidates created
[GP] Strategy 3: Creating 8 candidates via guided mutation...
[GP] Strategy 3 complete: 8 mutated candidates created
[GP] Total candidates generated: 20
[GP] Strategy breakdown: Block=60, Interp=60, Mut=80
[GP] ========== CANDIDATE GENERATION COMPLETE ==========

    [Checkpoint] Saved to ./results/cold_start/blocks_only/dsj1000/1R20/job_times_6_seed0_4000.json

*** [GPU 0] NEW GLOBAL BEST: 410970111.00 at gen 4100 ***
    Saved to best_solution.json

[GPU 0] Gen  4100 | Best: 410970111.00 | 573.0s
[GPU 0] Gene injection: 20 candidates injected at gen 4200 (total so far: 200)

*** [GPU 0] NEW GLOBAL BEST: 410521982.00 at gen 4200 ***
  -> 20 candidates sent to 1/1 workers

[CHECKPOINT] Saved B.json at gen 2000 (makespan: 411746329.00)
    Saved to best_solution.json

[GPU 0] Gen  4200 | Best: 410521982.00 | 585.0s
[GP] gpu_0 intermediate update: 410970111.00 at gen 4100
[GP] gpu_0 intermediate update: 410521982.00 at gen 4200

*** [GPU 0] NEW GLOBAL BEST: 409898437.00 at gen 4300 ***
    Saved to best_solution.json

[GPU 0] Gen  4300 | Best: 409898437.00 | 597.5s
[GP] gpu_0 intermediate update: 409898437.00 at gen 4300
[GP] gpu_0 intermediate update: 409215879.00 at gen 4400

==================================================
GP ANALYSIS - Cycle 11
  Collected 40 solutions
==================================================

[GP] ========== GENETIC PROGRAMMING ANALYSIS STARTED ==========
[GP] Cycle: 10
[GP] Input: 40 solutions received for analysis
[GP] Fitness range: best=409215872.00, worst=410573728.00
[GP] Analysis config: blocks=True, fft=False, similarity=False
[GP] Starting analysis...
[GP] Phase 1: Extracting building blocks...

*** [GPU 0] NEW GLOBAL BEST: 409215879.00 at gen 4400 ***
    Saved to best_solution.json

[GPU 0] Gen  4400 | Best: 409215879.00 | 610.2s
[GP] Phase 1 complete: Found 30 building blocks
[GP] Phase 2: FFT analysis DISABLED
[GP] Phase 3: Similarity analysis DISABLED
[GP] ========== GP ANALYSIS COMPLETE ==========


[GP] ========== CANDIDATE GENERATION STARTED ==========
[GP] Generating 20 new candidate solutions
[GP] Available data: 40 top solutions, 30 building blocks, 0 FFT patterns, 0 similarity patterns
[GP] Generation strategy: 6 block-based, 6 interpolated, 8 mutated
[GP] Strategy 1: Creating 6 candidates via building block combination...
[GP] Strategy 1 complete: 6 block-based candidates created
[GP] Strategy 2: Creating 6 candidates via solution interpolation...
[GP] Strategy 2 complete: 6 interpolated candidates created
[GP] Strategy 3: Creating 8 candidates via guided mutation...
[GP] Strategy 3 complete: 8 mutated candidates created
[GP] Total candidates generated: 20
[GP] Strategy breakdown: Block=66, Interp=66, Mut=88
[GP] ========== CANDIDATE GENERATION COMPLETE ==========


*** [GPU 0] NEW GLOBAL BEST: 408351555.00 at gen 4500 ***
    Saved to best_solution.json

[GPU 0] Gen  4500 | Best: 408351555.00 | 623.1s
[GPU 0] Gene injection: 20 candidates injected at gen 4600 (total so far: 220)

*** [GPU 0] NEW GLOBAL BEST: 407755740.00 at gen 4600 ***
  -> 20 candidates sent to 1/1 workers
[GP] gpu_0 intermediate update: 408351555.00 at gen 4500
[GP] gpu_0 intermediate update: 407755740.00 at gen 4600
    Saved to best_solution.json

[GPU 0] Gen  4600 | Best: 407755740.00 | 635.6s

*** [GPU 0] NEW GLOBAL BEST: 406842118.00 at gen 4700 ***
    Saved to best_solution.json

[GPU 0] Gen  4700 | Best: 406842118.00 | 647.8s
[GP] gpu_0 intermediate update: 406842118.00 at gen 4700
[GP] gpu_0 intermediate update: 406136622.00 at gen 4800

==================================================
GP ANALYSIS - Cycle 12
  Collected 40 solutions
==================================================

[GP] ========== GENETIC PROGRAMMING ANALYSIS STARTED ==========
[GP] Cycle: 11
[GP] Input: 40 solutions received for analysis
[GP] Fitness range: best=406136608.00, worst=407755744.00
[GP] Analysis config: blocks=True, fft=False, similarity=False
[GP] Starting analysis...
[GP] Phase 1: Extracting building blocks...

*** [GPU 0] NEW GLOBAL BEST: 406136622.00 at gen 4800 ***
    Saved to best_solution.json

[GPU 0] Gen  4800 | Best: 406136622.00 | 660.3s
[GP] Phase 1 complete: Found 30 building blocks
[GP] Phase 2: FFT analysis DISABLED
[GP] Phase 3: Similarity analysis DISABLED
[GP] ========== GP ANALYSIS COMPLETE ==========


[GP] ========== CANDIDATE GENERATION STARTED ==========
[GP] Generating 20 new candidate solutions
[GP] Available data: 40 top solutions, 30 building blocks, 0 FFT patterns, 0 similarity patterns
[GP] Generation strategy: 6 block-based, 6 interpolated, 8 mutated
[GP] Strategy 1: Creating 6 candidates via building block combination...
[GP] Strategy 1 complete: 6 block-based candidates created
[GP] Strategy 2: Creating 6 candidates via solution interpolation...
[GP] Strategy 2 complete: 6 interpolated candidates created
[GP] Strategy 3: Creating 8 candidates via guided mutation...
[GP] Strategy 3 complete: 8 mutated candidates created
[GP] Total candidates generated: 20
[GP] Strategy breakdown: Block=72, Interp=72, Mut=96
[GP] ========== CANDIDATE GENERATION COMPLETE ==========


*** [GPU 0] NEW GLOBAL BEST: 405733116.00 at gen 4900 ***
    Saved to best_solution.json

[GPU 0] Gen  4900 | Best: 405733116.00 | 673.2s
[GPU 0] Gene injection: 20 candidates injected at gen 5000 (total so far: 240)
[GPU 0] Evolution complete. Sending final results...
  -> 20 candidates sent to 1/1 workers
[GP] gpu_0 intermediate update: 405733116.00 at gen 4900
[GP] gpu_0 intermediate update: 404595808.00 at gen 5000
[GP] Worker finished: gpu_0 (best=404595808.00)

[GP] All workers finished. Total GP cycles: 12

[Final Collection] Have 1/1 workers. Waiting up to 120s for remaining...

[Critical] Attempting final result collection before terminating workers...

[Results Summary] Collected 1 results:
  gpu_0: fitness=404595808.00, intermediate=False, gen=final

======================================================================
COMPLETE
======================================================================
Best: 404595808.00 from gpu_0
Time: 688.4s
Total candidates injected: 240

Solution JSON saved to ./results/cold_start/blocks_only/dsj1000/1R20/job_times_6_seed0.json
HTML Gantt chart saved to: ./results/cold_start/blocks_only/dsj1000/1R20/job_times_6_seed0.html
