Setting random seed to 0
DEBUG: proc shape: (1000,), agents: 6, resources: 4, n: 1000

======================================================================
VRP-RPD SOLVER
======================================================================
Problem: 999 customers, 6 agents, k=4
Heuristic: None
Genetic Programming: Yes
Warm Start: No
Gene Injection: Yes
Workers: 1 GPU + 0 CPU
Generations: 5000
======================================================================


[GP] Starting GP collection loop (timeout: 12975s)...

*** [GPU 0] NEW GLOBAL BEST: 806240379.00 at gen 0 ***
    Saved to best_solution.json

[GPU 0] Gen     0 | Best: 806240379.00 | 0.5s
[GP] gpu_0 first intermediate: 806240379.00 at gen 0

*** [GPU 0] NEW GLOBAL BEST: 602850430.00 at gen 100 ***
    Saved to best_solution.json

[GPU 0] Gen   100 | Best: 602850430.00 | 11.6s
[GP] gpu_0 intermediate update: 602850430.00 at gen 100
[GP] gpu_0 intermediate update: 576528184.00 at gen 200

*** [GPU 0] NEW GLOBAL BEST: 576528184.00 at gen 200 ***
    Saved to best_solution.json

[GPU 0] Gen   200 | Best: 576528184.00 | 22.7s

*** [GPU 0] NEW GLOBAL BEST: 550709992.00 at gen 300 ***
    Saved to best_solution.json

[GPU 0] Gen   300 | Best: 550709992.00 | 33.8s
[GP] gpu_0 intermediate update: 550709992.00 at gen 300
[GP] gpu_0 intermediate update: 533646960.00 at gen 400

==================================================
GP ANALYSIS - Cycle 1
  Collected 40 solutions
==================================================

[GP] ========== GENETIC PROGRAMMING ANALYSIS STARTED ==========
[GP] Cycle: 0
[GP] Input: 40 solutions received for analysis
[GP] Fitness range: best=533646976.00, worst=576696960.00
[GP] Analysis config: blocks=True, fft=False, similarity=False
[GP] Starting analysis...
[GP] Phase 1: Extracting building blocks...

*** [GPU 0] NEW GLOBAL BEST: 533646960.00 at gen 400 ***
    Saved to best_solution.json

[GPU 0] Gen   400 | Best: 533646960.00 | 45.0s
[GP] Phase 1 complete: Found 30 building blocks
[GP] Phase 2: FFT analysis DISABLED
[GP] Phase 3: Similarity analysis DISABLED
[GP] ========== GP ANALYSIS COMPLETE ==========


[GP] ========== CANDIDATE GENERATION STARTED ==========
[GP] Generating 20 new candidate solutions
[GP] Available data: 40 top solutions, 30 building blocks, 0 FFT patterns, 0 similarity patterns
[GP] Generation strategy: 6 block-based, 6 interpolated, 8 mutated
[GP] Strategy 1: Creating 6 candidates via building block combination...
[GP] Strategy 1 complete: 6 block-based candidates created
[GP] Strategy 2: Creating 6 candidates via solution interpolation...
[GP] Strategy 2 complete: 6 interpolated candidates created
[GP] Strategy 3: Creating 8 candidates via guided mutation...
[GP] Strategy 3 complete: 8 mutated candidates created
[GP] Total candidates generated: 20
[GP] Strategy breakdown: Block=6, Interp=6, Mut=8
[GP] ========== CANDIDATE GENERATION COMPLETE ==========


*** [GPU 0] NEW GLOBAL BEST: 524170584.00 at gen 500 ***
    Saved to best_solution.json

[GPU 0] Gen   500 | Best: 524170584.00 | 56.0s
[GPU 0] Gene injection: 20 candidates injected at gen 600 (total so far: 20)

*** [GPU 0] NEW GLOBAL BEST: 516356531.00 at gen 600 ***
    Saved to best_solution.json

[GPU 0] Gen   600 | Best: 516356531.00 | 67.3s
  -> 20 candidates sent to 1/1 workers
[GP] gpu_0 intermediate update: 524170584.00 at gen 500
[GP] gpu_0 intermediate update: 516356531.00 at gen 600

*** [GPU 0] NEW GLOBAL BEST: 506777197.00 at gen 700 ***
    Saved to best_solution.json

[GPU 0] Gen   700 | Best: 506777197.00 | 78.5s
[GP] gpu_0 intermediate update: 506777197.00 at gen 700
[GP] gpu_0 intermediate update: 499012574.00 at gen 800

==================================================
GP ANALYSIS - Cycle 2
  Collected 40 solutions
==================================================

[GP] ========== GENETIC PROGRAMMING ANALYSIS STARTED ==========
[GP] Cycle: 1
[GP] Input: 40 solutions received for analysis
[GP] Fitness range: best=499012576.00, worst=516405280.00
[GP] Analysis config: blocks=True, fft=False, similarity=False
[GP] Starting analysis...
[GP] Phase 1: Extracting building blocks...

*** [GPU 0] NEW GLOBAL BEST: 499012574.00 at gen 800 ***
    Saved to best_solution.json

[GPU 0] Gen   800 | Best: 499012574.00 | 89.6s
[GP] Phase 1 complete: Found 30 building blocks
[GP] Phase 2: FFT analysis DISABLED
[GP] Phase 3: Similarity analysis DISABLED
[GP] ========== GP ANALYSIS COMPLETE ==========


[GP] ========== CANDIDATE GENERATION STARTED ==========
[GP] Generating 20 new candidate solutions
[GP] Available data: 40 top solutions, 30 building blocks, 0 FFT patterns, 0 similarity patterns
[GP] Generation strategy: 6 block-based, 6 interpolated, 8 mutated
[GP] Strategy 1: Creating 6 candidates via building block combination...
[GP] Strategy 1 complete: 6 block-based candidates created
[GP] Strategy 2: Creating 6 candidates via solution interpolation...
[GP] Strategy 2 complete: 6 interpolated candidates created
[GP] Strategy 3: Creating 8 candidates via guided mutation...
[GP] Strategy 3 complete: 8 mutated candidates created
[GP] Total candidates generated: 20
[GP] Strategy breakdown: Block=12, Interp=12, Mut=16
[GP] ========== CANDIDATE GENERATION COMPLETE ==========


*** [GPU 0] NEW GLOBAL BEST: 491459109.00 at gen 900 ***
    Saved to best_solution.json

[GPU 0] Gen   900 | Best: 491459109.00 | 101.1s
[GPU 0] Gene injection: 20 candidates injected at gen 1000 (total so far: 40)

*** [GPU 0] NEW GLOBAL BEST: 482056412.00 at gen 1000 ***
    Saved to best_solution.json

[GPU 0] Gen  1000 | Best: 482056412.00 | 112.8s
  -> 20 candidates sent to 1/1 workers
[GP] gpu_0 intermediate update: 491459109.00 at gen 900
[GP] gpu_0 intermediate update: 482058237.00 at gen 1000
    [Checkpoint] Saved to ./results/cold_start/blocks_only/dsj1000/1R20/job_times_8_seed0_1000.json
[GP] gpu_0 intermediate update: 482056412.00 at gen 1000

*** [GPU 0] NEW GLOBAL BEST: 475334719.00 at gen 1100 ***
    Saved to best_solution.json

[GPU 0] Gen  1100 | Best: 475334719.00 | 124.3s
[GP] gpu_0 intermediate update: 475334719.00 at gen 1100
[GP] gpu_0 intermediate update: 466786177.00 at gen 1200

==================================================
GP ANALYSIS - Cycle 3
  Collected 40 solutions
==================================================

[GP] ========== GENETIC PROGRAMMING ANALYSIS STARTED ==========
[GP] Cycle: 2
[GP] Input: 40 solutions received for analysis
[GP] Fitness range: best=466534944.00, worst=482351936.00
[GP] Analysis config: blocks=True, fft=False, similarity=False
[GP] Starting analysis...
[GP] Phase 1: Extracting building blocks...

*** [GPU 0] NEW GLOBAL BEST: 466534946.00 at gen 1200 ***
    Saved to best_solution.json

[GPU 0] Gen  1200 | Best: 466534946.00 | 135.8s
[GP] Phase 1 complete: Found 30 building blocks
[GP] Phase 2: FFT analysis DISABLED
[GP] Phase 3: Similarity analysis DISABLED
[GP] ========== GP ANALYSIS COMPLETE ==========


[GP] ========== CANDIDATE GENERATION STARTED ==========
[GP] Generating 20 new candidate solutions
[GP] Available data: 40 top solutions, 30 building blocks, 0 FFT patterns, 0 similarity patterns
[GP] Generation strategy: 6 block-based, 6 interpolated, 8 mutated
[GP] Strategy 1: Creating 6 candidates via building block combination...
[GP] Strategy 1 complete: 6 block-based candidates created
[GP] Strategy 2: Creating 6 candidates via solution interpolation...
[GP] Strategy 2 complete: 6 interpolated candidates created
[GP] Strategy 3: Creating 8 candidates via guided mutation...
[GP] Strategy 3 complete: 8 mutated candidates created
[GP] Total candidates generated: 20
[GP] Strategy breakdown: Block=18, Interp=18, Mut=24
[GP] ========== CANDIDATE GENERATION COMPLETE ==========


*** [GPU 0] NEW GLOBAL BEST: 462650352.00 at gen 1300 ***
    Saved to best_solution.json

[GPU 0] Gen  1300 | Best: 462650352.00 | 146.9s
[GPU 0] Gene injection: 20 candidates injected at gen 1400 (total so far: 60)

*** [GPU 0] NEW GLOBAL BEST: 458748164.00 at gen 1400 ***
    Saved to best_solution.json

[GPU 0] Gen  1400 | Best: 458748164.00 | 158.0s
  -> 20 candidates sent to 1/1 workers
[GP] gpu_0 intermediate update: 466534946.00 at gen 1200
[GP] gpu_0 intermediate update: 462650352.00 at gen 1300
[GP] gpu_0 intermediate update: 458748164.00 at gen 1400

*** [GPU 0] NEW GLOBAL BEST: 453956520.00 at gen 1500 ***
    Saved to best_solution.json

[GPU 0] Gen  1500 | Best: 453956520.00 | 169.0s
[GP] gpu_0 intermediate update: 453956520.00 at gen 1500
[GP] gpu_0 intermediate update: 450089803.00 at gen 1600

==================================================
GP ANALYSIS - Cycle 4
  Collected 40 solutions
==================================================

[GP] ========== GENETIC PROGRAMMING ANALYSIS STARTED ==========
[GP] Cycle: 3
[GP] Input: 40 solutions received for analysis
[GP] Fitness range: best=449926688.00, worst=458752992.00
[GP] Analysis config: blocks=True, fft=False, similarity=False
[GP] Starting analysis...
[GP] Phase 1: Extracting building blocks...

*** [GPU 0] NEW GLOBAL BEST: 449926682.00 at gen 1600 ***
    Saved to best_solution.json

[GPU 0] Gen  1600 | Best: 449926682.00 | 180.1s
[GP] Phase 1 complete: Found 30 building blocks
[GP] Phase 2: FFT analysis DISABLED
[GP] Phase 3: Similarity analysis DISABLED
[GP] ========== GP ANALYSIS COMPLETE ==========


[GP] ========== CANDIDATE GENERATION STARTED ==========
[GP] Generating 20 new candidate solutions
[GP] Available data: 40 top solutions, 30 building blocks, 0 FFT patterns, 0 similarity patterns
[GP] Generation strategy: 6 block-based, 6 interpolated, 8 mutated
[GP] Strategy 1: Creating 6 candidates via building block combination...
[GP] Strategy 1 complete: 6 block-based candidates created
[GP] Strategy 2: Creating 6 candidates via solution interpolation...
[GP] Strategy 2 complete: 6 interpolated candidates created
[GP] Strategy 3: Creating 8 candidates via guided mutation...
[GP] Strategy 3 complete: 8 mutated candidates created
[GP] Total candidates generated: 20
[GP] Strategy breakdown: Block=24, Interp=24, Mut=32
[GP] ========== CANDIDATE GENERATION COMPLETE ==========


*** [GPU 0] NEW GLOBAL BEST: 446803288.00 at gen 1700 ***
    Saved to best_solution.json

[GPU 0] Gen  1700 | Best: 446803288.00 | 191.3s
[GPU 0] Gene injection: 20 candidates injected at gen 1800 (total so far: 80)

*** [GPU 0] NEW GLOBAL BEST: 443659803.00 at gen 1800 ***
    Saved to best_solution.json

[GPU 0] Gen  1800 | Best: 443659803.00 | 202.5s
  -> 20 candidates sent to 1/1 workers
[GP] gpu_0 intermediate update: 449926682.00 at gen 1600
[GP] gpu_0 intermediate update: 446803288.00 at gen 1700
[GP] gpu_0 intermediate update: 443659803.00 at gen 1800

*** [GPU 0] NEW GLOBAL BEST: 440355115.00 at gen 1900 ***
    Saved to best_solution.json

[GPU 0] Gen  1900 | Best: 440355115.00 | 213.4s
[GP] gpu_0 intermediate update: 440355115.00 at gen 1900
[GP] gpu_0 intermediate update: 438673085.00 at gen 2000

==================================================
GP ANALYSIS - Cycle 5
  Collected 40 solutions
==================================================

[GP] ========== GENETIC PROGRAMMING ANALYSIS STARTED ==========
[GP] Cycle: 4
[GP] Input: 40 solutions received for analysis
[GP] Fitness range: best=438673088.00, worst=443659808.00
[GP] Analysis config: blocks=True, fft=False, similarity=False
[GP] Starting analysis...
[GP] Phase 1: Extracting building blocks...

*** [GPU 0] NEW GLOBAL BEST: 438673085.00 at gen 2000 ***
    Saved to best_solution.json

[GPU 0] Gen  2000 | Best: 438673085.00 | 224.6s
    [Checkpoint] Saved to ./results/cold_start/blocks_only/dsj1000/1R20/job_times_8_seed0_2000.json
[GP] Phase 1 complete: Found 30 building blocks
[GP] Phase 2: FFT analysis DISABLED
[GP] Phase 3: Similarity analysis DISABLED
[GP] ========== GP ANALYSIS COMPLETE ==========


[GP] ========== CANDIDATE GENERATION STARTED ==========
[GP] Generating 20 new candidate solutions
[GP] Available data: 40 top solutions, 30 building blocks, 0 FFT patterns, 0 similarity patterns
[GP] Generation strategy: 6 block-based, 6 interpolated, 8 mutated
[GP] Strategy 1: Creating 6 candidates via building block combination...
[GP] Strategy 1 complete: 6 block-based candidates created
[GP] Strategy 2: Creating 6 candidates via solution interpolation...
[GP] Strategy 2 complete: 6 interpolated candidates created
[GP] Strategy 3: Creating 8 candidates via guided mutation...
[GP] Strategy 3 complete: 8 mutated candidates created
[GP] Total candidates generated: 20
[GP] Strategy breakdown: Block=30, Interp=30, Mut=40
[GP] ========== CANDIDATE GENERATION COMPLETE ==========


*** [GPU 0] NEW GLOBAL BEST: 436372596.00 at gen 2100 ***
    Saved to best_solution.json

[GPU 0] Gen  2100 | Best: 436372596.00 | 235.8s
[GPU 0] Gene injection: 20 candidates injected at gen 2200 (total so far: 100)

*** [GPU 0] NEW GLOBAL BEST: 433448287.00 at gen 2200 ***
    Saved to best_solution.json

[GPU 0] Gen  2200 | Best: 433448287.00 | 246.6s
  -> 20 candidates sent to 1/1 workers

[CHECKPOINT] Saved A.json at gen 1000 (makespan: 438673085.00)
[GP] gpu_0 intermediate update: 436372596.00 at gen 2100
[GP] gpu_0 intermediate update: 433448287.00 at gen 2200

*** [GPU 0] NEW GLOBAL BEST: 431168751.00 at gen 2300 ***
    Saved to best_solution.json

[GPU 0] Gen  2300 | Best: 431168751.00 | 257.6s
[GP] gpu_0 intermediate update: 431168751.00 at gen 2300
[GP] gpu_0 intermediate update: 429810298.00 at gen 2400

==================================================
GP ANALYSIS - Cycle 6
  Collected 40 solutions
==================================================

[GP] ========== GENETIC PROGRAMMING ANALYSIS STARTED ==========
[GP] Cycle: 5
[GP] Input: 40 solutions received for analysis
[GP] Fitness range: best=429810304.00, worst=433479040.00
[GP] Analysis config: blocks=True, fft=False, similarity=False
[GP] Starting analysis...
[GP] Phase 1: Extracting building blocks...

*** [GPU 0] NEW GLOBAL BEST: 429810298.00 at gen 2400 ***
    Saved to best_solution.json

[GPU 0] Gen  2400 | Best: 429810298.00 | 268.8s
[GP] Phase 1 complete: Found 30 building blocks
[GP] Phase 2: FFT analysis DISABLED
[GP] Phase 3: Similarity analysis DISABLED
[GP] ========== GP ANALYSIS COMPLETE ==========


[GP] ========== CANDIDATE GENERATION STARTED ==========
[GP] Generating 20 new candidate solutions
[GP] Available data: 40 top solutions, 30 building blocks, 0 FFT patterns, 0 similarity patterns
[GP] Generation strategy: 6 block-based, 6 interpolated, 8 mutated
[GP] Strategy 1: Creating 6 candidates via building block combination...
[GP] Strategy 1 complete: 6 block-based candidates created
[GP] Strategy 2: Creating 6 candidates via solution interpolation...
[GP] Strategy 2 complete: 6 interpolated candidates created
[GP] Strategy 3: Creating 8 candidates via guided mutation...
[GP] Strategy 3 complete: 8 mutated candidates created
[GP] Total candidates generated: 20
[GP] Strategy breakdown: Block=36, Interp=36, Mut=48
[GP] ========== CANDIDATE GENERATION COMPLETE ==========


*** [GPU 0] NEW GLOBAL BEST: 428168987.00 at gen 2500 ***
    Saved to best_solution.json

[GPU 0] Gen  2500 | Best: 428168987.00 | 279.9s
[GPU 0] Gene injection: 20 candidates injected at gen 2600 (total so far: 120)

*** [GPU 0] NEW GLOBAL BEST: 426141392.00 at gen 2600 ***
    Saved to best_solution.json

[GPU 0] Gen  2600 | Best: 426141392.00 | 291.5s
  -> 20 candidates sent to 1/1 workers
[GP] gpu_0 intermediate update: 428168987.00 at gen 2500
[GP] gpu_0 intermediate update: 426141392.00 at gen 2600

*** [GPU 0] NEW GLOBAL BEST: 424815302.00 at gen 2700 ***
    Saved to best_solution.json

[GPU 0] Gen  2700 | Best: 424815302.00 | 302.9s
[GP] gpu_0 intermediate update: 424815302.00 at gen 2700
[GP] gpu_0 intermediate update: 423584033.00 at gen 2800

==================================================
GP ANALYSIS - Cycle 7
  Collected 40 solutions
==================================================

[GP] ========== GENETIC PROGRAMMING ANALYSIS STARTED ==========
[GP] Cycle: 6
[GP] Input: 40 solutions received for analysis
[GP] Fitness range: best=423584032.00, worst=426141376.00
[GP] Analysis config: blocks=True, fft=False, similarity=False
[GP] Starting analysis...
[GP] Phase 1: Extracting building blocks...

*** [GPU 0] NEW GLOBAL BEST: 423584033.00 at gen 2800 ***
    Saved to best_solution.json

[GPU 0] Gen  2800 | Best: 423584033.00 | 314.4s
[GP] Phase 1 complete: Found 30 building blocks
[GP] Phase 2: FFT analysis DISABLED
[GP] Phase 3: Similarity analysis DISABLED
[GP] ========== GP ANALYSIS COMPLETE ==========


[GP] ========== CANDIDATE GENERATION STARTED ==========
[GP] Generating 20 new candidate solutions
[GP] Available data: 40 top solutions, 30 building blocks, 0 FFT patterns, 0 similarity patterns
[GP] Generation strategy: 6 block-based, 6 interpolated, 8 mutated
[GP] Strategy 1: Creating 6 candidates via building block combination...
[GP] Strategy 1 complete: 6 block-based candidates created
[GP] Strategy 2: Creating 6 candidates via solution interpolation...
[GP] Strategy 2 complete: 6 interpolated candidates created
[GP] Strategy 3: Creating 8 candidates via guided mutation...
[GP] Strategy 3 complete: 8 mutated candidates created
[GP] Total candidates generated: 20
[GP] Strategy breakdown: Block=42, Interp=42, Mut=56
[GP] ========== CANDIDATE GENERATION COMPLETE ==========


*** [GPU 0] NEW GLOBAL BEST: 422305265.00 at gen 2900 ***
    Saved to best_solution.json

[GPU 0] Gen  2900 | Best: 422305265.00 | 325.4s
[GPU 0] Gene injection: 20 candidates injected at gen 3000 (total so far: 140)

*** [GPU 0] NEW GLOBAL BEST: 421282425.00 at gen 3000 ***
    Saved to best_solution.json

[GPU 0] Gen  3000 | Best: 421282425.00 | 336.5s
  -> 20 candidates sent to 1/1 workers
[GP] gpu_0 intermediate update: 422305265.00 at gen 2900
[GP] gpu_0 intermediate update: 421355323.00 at gen 3000
    [Checkpoint] Saved to ./results/cold_start/blocks_only/dsj1000/1R20/job_times_8_seed0_3000.json
[GP] gpu_0 intermediate update: 421282425.00 at gen 3000

*** [GPU 0] NEW GLOBAL BEST: 419933429.00 at gen 3100 ***
    Saved to best_solution.json

[GPU 0] Gen  3100 | Best: 419933429.00 | 347.6s
[GP] gpu_0 intermediate update: 419933429.00 at gen 3100
[GP] gpu_0 intermediate update: 418537848.00 at gen 3200

==================================================
GP ANALYSIS - Cycle 8
  Collected 40 solutions
==================================================

[GP] ========== GENETIC PROGRAMMING ANALYSIS STARTED ==========
[GP] Cycle: 7
[GP] Input: 40 solutions received for analysis
[GP] Fitness range: best=418537856.00, worst=421364064.00
[GP] Analysis config: blocks=True, fft=False, similarity=False
[GP] Starting analysis...
[GP] Phase 1: Extracting building blocks...

*** [GPU 0] NEW GLOBAL BEST: 418537848.00 at gen 3200 ***
    Saved to best_solution.json

[GPU 0] Gen  3200 | Best: 418537848.00 | 358.8s
[GP] Phase 1 complete: Found 30 building blocks
[GP] Phase 2: FFT analysis DISABLED
[GP] Phase 3: Similarity analysis DISABLED
[GP] ========== GP ANALYSIS COMPLETE ==========


[GP] ========== CANDIDATE GENERATION STARTED ==========
[GP] Generating 20 new candidate solutions
[GP] Available data: 40 top solutions, 30 building blocks, 0 FFT patterns, 0 similarity patterns
[GP] Generation strategy: 6 block-based, 6 interpolated, 8 mutated
[GP] Strategy 1: Creating 6 candidates via building block combination...
[GP] Strategy 1 complete: 6 block-based candidates created
[GP] Strategy 2: Creating 6 candidates via solution interpolation...
[GP] Strategy 2 complete: 6 interpolated candidates created
[GP] Strategy 3: Creating 8 candidates via guided mutation...
[GP] Strategy 3 complete: 8 mutated candidates created
[GP] Total candidates generated: 20
[GP] Strategy breakdown: Block=48, Interp=48, Mut=64
[GP] ========== CANDIDATE GENERATION COMPLETE ==========


*** [GPU 0] NEW GLOBAL BEST: 417566059.00 at gen 3300 ***
    Saved to best_solution.json

[GPU 0] Gen  3300 | Best: 417566059.00 | 369.9s
[GPU 0] Gene injection: 20 candidates injected at gen 3400 (total so far: 160)

*** [GPU 0] NEW GLOBAL BEST: 416370237.00 at gen 3400 ***
    Saved to best_solution.json

[GPU 0] Gen  3400 | Best: 416370237.00 | 381.0s
  -> 20 candidates sent to 1/1 workers
[GP] gpu_0 intermediate update: 417566059.00 at gen 3300
[GP] gpu_0 intermediate update: 416370237.00 at gen 3400

*** [GPU 0] NEW GLOBAL BEST: 414937070.00 at gen 3500 ***
    Saved to best_solution.json

[GPU 0] Gen  3500 | Best: 414937070.00 | 392.0s
[GP] gpu_0 intermediate update: 414937070.00 at gen 3500
[GP] gpu_0 intermediate update: 414379886.00 at gen 3600

==================================================
GP ANALYSIS - Cycle 9
  Collected 40 solutions
==================================================

[GP] ========== GENETIC PROGRAMMING ANALYSIS STARTED ==========
[GP] Cycle: 8
[GP] Input: 40 solutions received for analysis
[GP] Fitness range: best=414379872.00, worst=416480832.00
[GP] Analysis config: blocks=True, fft=False, similarity=False
[GP] Starting analysis...
[GP] Phase 1: Extracting building blocks...

*** [GPU 0] NEW GLOBAL BEST: 414379886.00 at gen 3600 ***
    Saved to best_solution.json

[GPU 0] Gen  3600 | Best: 414379886.00 | 403.5s
[GP] Phase 1 complete: Found 30 building blocks
[GP] Phase 2: FFT analysis DISABLED
[GP] Phase 3: Similarity analysis DISABLED
[GP] ========== GP ANALYSIS COMPLETE ==========


[GP] ========== CANDIDATE GENERATION STARTED ==========
[GP] Generating 20 new candidate solutions
[GP] Available data: 40 top solutions, 30 building blocks, 0 FFT patterns, 0 similarity patterns
[GP] Generation strategy: 6 block-based, 6 interpolated, 8 mutated
[GP] Strategy 1: Creating 6 candidates via building block combination...
[GP] Strategy 1 complete: 6 block-based candidates created
[GP] Strategy 2: Creating 6 candidates via solution interpolation...
[GP] Strategy 2 complete: 6 interpolated candidates created
[GP] Strategy 3: Creating 8 candidates via guided mutation...
[GP] Strategy 3 complete: 8 mutated candidates created
[GP] Total candidates generated: 20
[GP] Strategy breakdown: Block=54, Interp=54, Mut=72
[GP] ========== CANDIDATE GENERATION COMPLETE ==========


*** [GPU 0] NEW GLOBAL BEST: 412888927.00 at gen 3700 ***
    Saved to best_solution.json

[GPU 0] Gen  3700 | Best: 412888927.00 | 415.1s
[GPU 0] Gene injection: 20 candidates injected at gen 3800 (total so far: 180)

*** [GPU 0] NEW GLOBAL BEST: 412269199.00 at gen 3800 ***
    Saved to best_solution.json

[GPU 0] Gen  3800 | Best: 412269199.00 | 426.6s
  -> 20 candidates sent to 1/1 workers
[GP] gpu_0 intermediate update: 412888927.00 at gen 3700
[GP] gpu_0 intermediate update: 412269199.00 at gen 3800

*** [GPU 0] NEW GLOBAL BEST: 411766306.00 at gen 3900 ***
    Saved to best_solution.json

[GPU 0] Gen  3900 | Best: 411766306.00 | 438.1s
[GP] gpu_0 intermediate update: 411766306.00 at gen 3900
[GP] gpu_0 intermediate update: 410717194.00 at gen 4000

==================================================
GP ANALYSIS - Cycle 10
  Collected 40 solutions
==================================================

[GP] ========== GENETIC PROGRAMMING ANALYSIS STARTED ==========
[GP] Cycle: 9
[GP] Input: 40 solutions received for analysis
[GP] Fitness range: best=410717184.00, worst=412269184.00
[GP] Analysis config: blocks=True, fft=False, similarity=False
[GP] Starting analysis...
[GP] Phase 1: Extracting building blocks...

*** [GPU 0] NEW GLOBAL BEST: 410717194.00 at gen 4000 ***
    Saved to best_solution.json

[GPU 0] Gen  4000 | Best: 410717194.00 | 449.6s
[GP] Phase 1 complete: Found 30 building blocks
[GP] Phase 2: FFT analysis DISABLED
[GP] Phase 3: Similarity analysis DISABLED
[GP] ========== GP ANALYSIS COMPLETE ==========


[GP] ========== CANDIDATE GENERATION STARTED ==========
[GP] Generating 20 new candidate solutions
[GP] Available data: 40 top solutions, 30 building blocks, 0 FFT patterns, 0 similarity patterns
[GP] Generation strategy: 6 block-based, 6 interpolated, 8 mutated
[GP] Strategy 1: Creating 6 candidates via building block combination...
[GP] Strategy 1 complete: 6 block-based candidates created
[GP] Strategy 2: Creating 6 candidates via solution interpolation...
[GP] Strategy 2 complete: 6 interpolated candidates created
[GP] Strategy 3: Creating 8 candidates via guided mutation...
[GP] Strategy 3 complete: 8 mutated candidates created
[GP] Total candidates generated: 20
[GP] Strategy breakdown: Block=60, Interp=60, Mut=80
[GP] ========== CANDIDATE GENERATION COMPLETE ==========

    [Checkpoint] Saved to ./results/cold_start/blocks_only/dsj1000/1R20/job_times_8_seed0_4000.json

*** [GPU 0] NEW GLOBAL BEST: 409136860.00 at gen 4100 ***
    Saved to best_solution.json

[GPU 0] Gen  4100 | Best: 409136860.00 | 461.2s
[GPU 0] Gene injection: 20 candidates injected at gen 4200 (total so far: 200)

*** [GPU 0] NEW GLOBAL BEST: 408018305.00 at gen 4200 ***
    Saved to best_solution.json

[GPU 0] Gen  4200 | Best: 408018305.00 | 472.6s
  -> 20 candidates sent to 1/1 workers

[CHECKPOINT] Saved B.json at gen 2000 (makespan: 410717194.00)
[GP] gpu_0 intermediate update: 409136860.00 at gen 4100
[GP] gpu_0 intermediate update: 408018305.00 at gen 4200

*** [GPU 0] NEW GLOBAL BEST: 407291100.00 at gen 4300 ***
    Saved to best_solution.json

[GPU 0] Gen  4300 | Best: 407291100.00 | 484.0s
[GP] gpu_0 intermediate update: 407291100.00 at gen 4300
[GP] gpu_0 intermediate update: 406686667.00 at gen 4400

==================================================
GP ANALYSIS - Cycle 11
  Collected 40 solutions
==================================================

[GP] ========== GENETIC PROGRAMMING ANALYSIS STARTED ==========
[GP] Cycle: 10
[GP] Input: 40 solutions received for analysis
[GP] Fitness range: best=406686656.00, worst=408018304.00
[GP] Analysis config: blocks=True, fft=False, similarity=False
[GP] Starting analysis...
[GP] Phase 1: Extracting building blocks...

*** [GPU 0] NEW GLOBAL BEST: 406686667.00 at gen 4400 ***
    Saved to best_solution.json

[GPU 0] Gen  4400 | Best: 406686667.00 | 495.6s
[GP] Phase 1 complete: Found 30 building blocks
[GP] Phase 2: FFT analysis DISABLED
[GP] Phase 3: Similarity analysis DISABLED
[GP] ========== GP ANALYSIS COMPLETE ==========


[GP] ========== CANDIDATE GENERATION STARTED ==========
[GP] Generating 20 new candidate solutions
[GP] Available data: 40 top solutions, 30 building blocks, 0 FFT patterns, 0 similarity patterns
[GP] Generation strategy: 6 block-based, 6 interpolated, 8 mutated
[GP] Strategy 1: Creating 6 candidates via building block combination...
[GP] Strategy 1 complete: 6 block-based candidates created
[GP] Strategy 2: Creating 6 candidates via solution interpolation...
[GP] Strategy 2 complete: 6 interpolated candidates created
[GP] Strategy 3: Creating 8 candidates via guided mutation...
[GP] Strategy 3 complete: 8 mutated candidates created
[GP] Total candidates generated: 20
[GP] Strategy breakdown: Block=66, Interp=66, Mut=88
[GP] ========== CANDIDATE GENERATION COMPLETE ==========


*** [GPU 0] NEW GLOBAL BEST: 406209275.00 at gen 4500 ***
    Saved to best_solution.json

[GPU 0] Gen  4500 | Best: 406209275.00 | 506.6s
[GPU 0] Gene injection: 20 candidates injected at gen 4600 (total so far: 220)

*** [GPU 0] NEW GLOBAL BEST: 405653075.00 at gen 4600 ***
    Saved to best_solution.json

[GPU 0] Gen  4600 | Best: 405653075.00 | 517.8s
  -> 20 candidates sent to 1/1 workers
[GP] gpu_0 intermediate update: 406209275.00 at gen 4500
[GP] gpu_0 intermediate update: 405653075.00 at gen 4600

*** [GPU 0] NEW GLOBAL BEST: 405178419.00 at gen 4700 ***
    Saved to best_solution.json

[GPU 0] Gen  4700 | Best: 405178419.00 | 529.0s
[GP] gpu_0 intermediate update: 405178419.00 at gen 4700
[GP] gpu_0 intermediate update: 404380838.00 at gen 4800

==================================================
GP ANALYSIS - Cycle 12
  Collected 40 solutions
==================================================

[GP] ========== GENETIC PROGRAMMING ANALYSIS STARTED ==========
[GP] Cycle: 11
[GP] Input: 40 solutions received for analysis
[GP] Fitness range: best=404380832.00, worst=405653088.00
[GP] Analysis config: blocks=True, fft=False, similarity=False
[GP] Starting analysis...
[GP] Phase 1: Extracting building blocks...

*** [GPU 0] NEW GLOBAL BEST: 404380838.00 at gen 4800 ***
    Saved to best_solution.json

[GPU 0] Gen  4800 | Best: 404380838.00 | 540.2s
[GP] Phase 1 complete: Found 30 building blocks
[GP] Phase 2: FFT analysis DISABLED
[GP] Phase 3: Similarity analysis DISABLED
[GP] ========== GP ANALYSIS COMPLETE ==========


[GP] ========== CANDIDATE GENERATION STARTED ==========
[GP] Generating 20 new candidate solutions
[GP] Available data: 40 top solutions, 30 building blocks, 0 FFT patterns, 0 similarity patterns
[GP] Generation strategy: 6 block-based, 6 interpolated, 8 mutated
[GP] Strategy 1: Creating 6 candidates via building block combination...
[GP] Strategy 1 complete: 6 block-based candidates created
[GP] Strategy 2: Creating 6 candidates via solution interpolation...
[GP] Strategy 2 complete: 6 interpolated candidates created
[GP] Strategy 3: Creating 8 candidates via guided mutation...
[GP] Strategy 3 complete: 8 mutated candidates created
[GP] Total candidates generated: 20
[GP] Strategy breakdown: Block=72, Interp=72, Mut=96
[GP] ========== CANDIDATE GENERATION COMPLETE ==========


*** [GPU 0] NEW GLOBAL BEST: 403752696.00 at gen 4900 ***
    Saved to best_solution.json

[GPU 0] Gen  4900 | Best: 403752696.00 | 551.6s
[GPU 0] Gene injection: 20 candidates injected at gen 5000 (total so far: 240)
[GPU 0] Evolution complete. Sending final results...
  -> 20 candidates sent to 1/1 workers
[GP] gpu_0 intermediate update: 403752696.00 at gen 4900
[GP] gpu_0 intermediate update: 403351636.00 at gen 5000
[GP] Worker finished: gpu_0 (best=403351636.00)

[GP] All workers finished. Total GP cycles: 12

[Final Collection] Have 1/1 workers. Waiting up to 120s for remaining...

[Critical] Attempting final result collection before terminating workers...

[Results Summary] Collected 1 results:
  gpu_0: fitness=403351636.00, intermediate=False, gen=final

======================================================================
COMPLETE
======================================================================
Best: 403351636.00 from gpu_0
Time: 565.1s
Total candidates injected: 240

Solution JSON saved to ./results/cold_start/blocks_only/dsj1000/1R20/job_times_8_seed0.json
HTML Gantt chart saved to: ./results/cold_start/blocks_only/dsj1000/1R20/job_times_8_seed0.html
