Setting random seed to 0
DEBUG: proc shape: (1000,), agents: 6, resources: 4, n: 1000

======================================================================
VRP-RPD SOLVER
======================================================================
Problem: 999 customers, 6 agents, k=4
Heuristic: None
Genetic Programming: Yes
Warm Start: No
Gene Injection: Yes
Workers: 1 GPU + 0 CPU
Generations: 5000
======================================================================


[GP] Starting GP collection loop (timeout: 12975s)...

*** [GPU 0] NEW GLOBAL BEST: 796086573.00 at gen 0 ***
    Saved to best_solution.json

[GPU 0] Gen     0 | Best: 796086573.00 | 0.4s
[GP] gpu_0 first intermediate: 796086573.00 at gen 0

*** [GPU 0] NEW GLOBAL BEST: 533480156.00 at gen 100 ***
    Saved to best_solution.json

[GPU 0] Gen   100 | Best: 533480156.00 | 11.7s
[GP] gpu_0 intermediate update: 533480156.00 at gen 100
[GP] gpu_0 intermediate update: 498908523.00 at gen 200

*** [GPU 0] NEW GLOBAL BEST: 498328312.00 at gen 200 ***
    Saved to best_solution.json

[GPU 0] Gen   200 | Best: 498328312.00 | 23.2s
[GP] gpu_0 intermediate update: 498328312.00 at gen 200

*** [GPU 0] NEW GLOBAL BEST: 479157049.00 at gen 300 ***
    Saved to best_solution.json

[GPU 0] Gen   300 | Best: 479157049.00 | 34.4s
[GP] gpu_0 intermediate update: 479157049.00 at gen 300
[GP] gpu_0 intermediate update: 468350450.00 at gen 400

==================================================
GP ANALYSIS - Cycle 1
  Collected 40 solutions
==================================================

[GP] ========== GENETIC PROGRAMMING ANALYSIS STARTED ==========
[GP] Cycle: 0
[GP] Input: 40 solutions received for analysis
[GP] Fitness range: best=468350464.00, worst=499010336.00
[GP] Analysis config: blocks=True, fft=False, similarity=False
[GP] Starting analysis...
[GP] Phase 1: Extracting building blocks...

*** [GPU 0] NEW GLOBAL BEST: 468350450.00 at gen 400 ***
    Saved to best_solution.json

[GPU 0] Gen   400 | Best: 468350450.00 | 46.0s
[GP] Phase 1 complete: Found 30 building blocks
[GP] Phase 2: FFT analysis DISABLED
[GP] Phase 3: Similarity analysis DISABLED
[GP] ========== GP ANALYSIS COMPLETE ==========


[GP] ========== CANDIDATE GENERATION STARTED ==========
[GP] Generating 20 new candidate solutions
[GP] Available data: 40 top solutions, 30 building blocks, 0 FFT patterns, 0 similarity patterns
[GP] Generation strategy: 6 block-based, 6 interpolated, 8 mutated
[GP] Strategy 1: Creating 6 candidates via building block combination...
[GP] Strategy 1 complete: 6 block-based candidates created
[GP] Strategy 2: Creating 6 candidates via solution interpolation...
[GP] Strategy 2 complete: 6 interpolated candidates created
[GP] Strategy 3: Creating 8 candidates via guided mutation...
[GP] Strategy 3 complete: 8 mutated candidates created
[GP] Total candidates generated: 20
[GP] Strategy breakdown: Block=6, Interp=6, Mut=8
[GP] ========== CANDIDATE GENERATION COMPLETE ==========


*** [GPU 0] NEW GLOBAL BEST: 461067573.00 at gen 500 ***
    Saved to best_solution.json

[GPU 0] Gen   500 | Best: 461067573.00 | 57.4s
[GPU 0] Gene injection: 20 candidates injected at gen 600 (total so far: 20)
  -> 20 candidates sent to 1/1 workers
[GP] gpu_0 intermediate update: 461067573.00 at gen 500
[GP] gpu_0 intermediate update: 452064248.00 at gen 600

*** [GPU 0] NEW GLOBAL BEST: 451992684.00 at gen 600 ***
    Saved to best_solution.json

[GPU 0] Gen   600 | Best: 451992684.00 | 68.8s
[GP] gpu_0 intermediate update: 451992684.00 at gen 600

*** [GPU 0] NEW GLOBAL BEST: 448172872.00 at gen 700 ***
    Saved to best_solution.json

[GPU 0] Gen   700 | Best: 448172872.00 | 80.2s
[GP] gpu_0 intermediate update: 448172872.00 at gen 700
[GP] gpu_0 intermediate update: 443197594.00 at gen 800

==================================================
GP ANALYSIS - Cycle 2
  Collected 40 solutions
==================================================

[GP] ========== GENETIC PROGRAMMING ANALYSIS STARTED ==========
[GP] Cycle: 1
[GP] Input: 40 solutions received for analysis
[GP] Fitness range: best=443197600.00, worst=452256032.00
[GP] Analysis config: blocks=True, fft=False, similarity=False
[GP] Starting analysis...
[GP] Phase 1: Extracting building blocks...

*** [GPU 0] NEW GLOBAL BEST: 443197594.00 at gen 800 ***
    Saved to best_solution.json

[GPU 0] Gen   800 | Best: 443197594.00 | 91.7s
[GP] Phase 1 complete: Found 30 building blocks
[GP] Phase 2: FFT analysis DISABLED
[GP] Phase 3: Similarity analysis DISABLED
[GP] ========== GP ANALYSIS COMPLETE ==========


[GP] ========== CANDIDATE GENERATION STARTED ==========
[GP] Generating 20 new candidate solutions
[GP] Available data: 40 top solutions, 30 building blocks, 0 FFT patterns, 0 similarity patterns
[GP] Generation strategy: 6 block-based, 6 interpolated, 8 mutated
[GP] Strategy 1: Creating 6 candidates via building block combination...
[GP] Strategy 1 complete: 6 block-based candidates created
[GP] Strategy 2: Creating 6 candidates via solution interpolation...
[GP] Strategy 2 complete: 6 interpolated candidates created
[GP] Strategy 3: Creating 8 candidates via guided mutation...
[GP] Strategy 3 complete: 8 mutated candidates created
[GP] Total candidates generated: 20
[GP] Strategy breakdown: Block=12, Interp=12, Mut=16
[GP] ========== CANDIDATE GENERATION COMPLETE ==========


*** [GPU 0] NEW GLOBAL BEST: 438199766.00 at gen 900 ***
    Saved to best_solution.json

[GPU 0] Gen   900 | Best: 438199766.00 | 103.1s
[GPU 0] Gene injection: 20 candidates injected at gen 1000 (total so far: 40)

*** [GPU 0] NEW GLOBAL BEST: 435553805.00 at gen 1000 ***
    Saved to best_solution.json

[GPU 0] Gen  1000 | Best: 435553805.00 | 114.4s
  -> 20 candidates sent to 1/1 workers
[GP] gpu_0 intermediate update: 438199766.00 at gen 900
[GP] gpu_0 intermediate update: 435553805.00 at gen 1000
    [Checkpoint] Saved to ./results/cold_start/blocks_only/dsj1000/1R20/job_times_9_seed0_1000.json

*** [GPU 0] NEW GLOBAL BEST: 431427749.00 at gen 1100 ***
    Saved to best_solution.json

[GPU 0] Gen  1100 | Best: 431427749.00 | 125.9s
[GP] gpu_0 intermediate update: 431427749.00 at gen 1100
[GP] gpu_0 intermediate update: 426871803.00 at gen 1200

==================================================
GP ANALYSIS - Cycle 3
  Collected 40 solutions
==================================================

[GP] ========== GENETIC PROGRAMMING ANALYSIS STARTED ==========
[GP] Cycle: 2
[GP] Input: 40 solutions received for analysis
[GP] Fitness range: best=426871808.00, worst=435556160.00
[GP] Analysis config: blocks=True, fft=False, similarity=False
[GP] Starting analysis...
[GP] Phase 1: Extracting building blocks...

*** [GPU 0] NEW GLOBAL BEST: 426871803.00 at gen 1200 ***
    Saved to best_solution.json

[GPU 0] Gen  1200 | Best: 426871803.00 | 137.2s
[GP] Phase 1 complete: Found 30 building blocks
[GP] Phase 2: FFT analysis DISABLED
[GP] Phase 3: Similarity analysis DISABLED
[GP] ========== GP ANALYSIS COMPLETE ==========


[GP] ========== CANDIDATE GENERATION STARTED ==========
[GP] Generating 20 new candidate solutions
[GP] Available data: 40 top solutions, 30 building blocks, 0 FFT patterns, 0 similarity patterns
[GP] Generation strategy: 6 block-based, 6 interpolated, 8 mutated
[GP] Strategy 1: Creating 6 candidates via building block combination...
[GP] Strategy 1 complete: 6 block-based candidates created
[GP] Strategy 2: Creating 6 candidates via solution interpolation...
[GP] Strategy 2 complete: 6 interpolated candidates created
[GP] Strategy 3: Creating 8 candidates via guided mutation...
[GP] Strategy 3 complete: 8 mutated candidates created
[GP] Total candidates generated: 20
[GP] Strategy breakdown: Block=18, Interp=18, Mut=24
[GP] ========== CANDIDATE GENERATION COMPLETE ==========


*** [GPU 0] NEW GLOBAL BEST: 424056417.00 at gen 1300 ***
    Saved to best_solution.json

[GPU 0] Gen  1300 | Best: 424056417.00 | 148.3s
[GPU 0] Gene injection: 20 candidates injected at gen 1400 (total so far: 60)

*** [GPU 0] NEW GLOBAL BEST: 422005411.00 at gen 1400 ***
    Saved to best_solution.json

[GPU 0] Gen  1400 | Best: 422005411.00 | 159.6s
  -> 20 candidates sent to 1/1 workers
[GP] gpu_0 intermediate update: 424056417.00 at gen 1300
[GP] gpu_0 intermediate update: 422005411.00 at gen 1400

*** [GPU 0] NEW GLOBAL BEST: 418242909.00 at gen 1500 ***
    Saved to best_solution.json

[GPU 0] Gen  1500 | Best: 418242909.00 | 170.7s
[GP] gpu_0 intermediate update: 418242909.00 at gen 1500
[GP] gpu_0 intermediate update: 415824440.00 at gen 1600

==================================================
GP ANALYSIS - Cycle 4
  Collected 40 solutions
==================================================

[GP] ========== GENETIC PROGRAMMING ANALYSIS STARTED ==========
[GP] Cycle: 3
[GP] Input: 40 solutions received for analysis
[GP] Fitness range: best=415748448.00, worst=422053952.00
[GP] Analysis config: blocks=True, fft=False, similarity=False
[GP] Starting analysis...
[GP] Phase 1: Extracting building blocks...

*** [GPU 0] NEW GLOBAL BEST: 415748445.00 at gen 1600 ***
    Saved to best_solution.json

[GPU 0] Gen  1600 | Best: 415748445.00 | 182.2s
[GP] Phase 1 complete: Found 30 building blocks
[GP] Phase 2: FFT analysis DISABLED
[GP] Phase 3: Similarity analysis DISABLED
[GP] ========== GP ANALYSIS COMPLETE ==========


[GP] ========== CANDIDATE GENERATION STARTED ==========
[GP] Generating 20 new candidate solutions
[GP] Available data: 40 top solutions, 30 building blocks, 0 FFT patterns, 0 similarity patterns
[GP] Generation strategy: 6 block-based, 6 interpolated, 8 mutated
[GP] Strategy 1: Creating 6 candidates via building block combination...
[GP] Strategy 1 complete: 6 block-based candidates created
[GP] Strategy 2: Creating 6 candidates via solution interpolation...
[GP] Strategy 2 complete: 6 interpolated candidates created
[GP] Strategy 3: Creating 8 candidates via guided mutation...
[GP] Strategy 3 complete: 8 mutated candidates created
[GP] Total candidates generated: 20
[GP] Strategy breakdown: Block=24, Interp=24, Mut=32
[GP] ========== CANDIDATE GENERATION COMPLETE ==========


*** [GPU 0] NEW GLOBAL BEST: 414052809.00 at gen 1700 ***
    Saved to best_solution.json

[GPU 0] Gen  1700 | Best: 414052809.00 | 193.5s
[GPU 0] Gene injection: 20 candidates injected at gen 1800 (total so far: 80)

*** [GPU 0] NEW GLOBAL BEST: 411979395.00 at gen 1800 ***
    Saved to best_solution.json

[GPU 0] Gen  1800 | Best: 411979395.00 | 204.8s
  -> 20 candidates sent to 1/1 workers
[GP] gpu_0 intermediate update: 415748445.00 at gen 1600
[GP] gpu_0 intermediate update: 414052809.00 at gen 1700
[GP] gpu_0 intermediate update: 411979395.00 at gen 1800

*** [GPU 0] NEW GLOBAL BEST: 410164996.00 at gen 1900 ***
    Saved to best_solution.json

[GPU 0] Gen  1900 | Best: 410164996.00 | 216.1s
[GP] gpu_0 intermediate update: 410164996.00 at gen 1900
[GP] gpu_0 intermediate update: 408449925.00 at gen 2000

==================================================
GP ANALYSIS - Cycle 5
  Collected 40 solutions
==================================================

[GP] ========== GENETIC PROGRAMMING ANALYSIS STARTED ==========
[GP] Cycle: 4
[GP] Input: 40 solutions received for analysis
[GP] Fitness range: best=408449920.00, worst=412081952.00
[GP] Analysis config: blocks=True, fft=False, similarity=False
[GP] Starting analysis...
[GP] Phase 1: Extracting building blocks...

*** [GPU 0] NEW GLOBAL BEST: 408449925.00 at gen 2000 ***
    Saved to best_solution.json

[GPU 0] Gen  2000 | Best: 408449925.00 | 227.4s
    [Checkpoint] Saved to ./results/cold_start/blocks_only/dsj1000/1R20/job_times_9_seed0_2000.json
[GP] Phase 1 complete: Found 30 building blocks
[GP] Phase 2: FFT analysis DISABLED
[GP] Phase 3: Similarity analysis DISABLED
[GP] ========== GP ANALYSIS COMPLETE ==========


[GP] ========== CANDIDATE GENERATION STARTED ==========
[GP] Generating 20 new candidate solutions
[GP] Available data: 40 top solutions, 30 building blocks, 0 FFT patterns, 0 similarity patterns
[GP] Generation strategy: 6 block-based, 6 interpolated, 8 mutated
[GP] Strategy 1: Creating 6 candidates via building block combination...
[GP] Strategy 1 complete: 6 block-based candidates created
[GP] Strategy 2: Creating 6 candidates via solution interpolation...
[GP] Strategy 2 complete: 6 interpolated candidates created
[GP] Strategy 3: Creating 8 candidates via guided mutation...
[GP] Strategy 3 complete: 8 mutated candidates created
[GP] Total candidates generated: 20
[GP] Strategy breakdown: Block=30, Interp=30, Mut=40
[GP] ========== CANDIDATE GENERATION COMPLETE ==========


*** [GPU 0] NEW GLOBAL BEST: 406892288.00 at gen 2100 ***
    Saved to best_solution.json

[GPU 0] Gen  2100 | Best: 406892288.00 | 238.8s
[GPU 0] Gene injection: 20 candidates injected at gen 2200 (total so far: 100)

*** [GPU 0] NEW GLOBAL BEST: 404217084.00 at gen 2200 ***
    Saved to best_solution.json

[GPU 0] Gen  2200 | Best: 404217084.00 | 250.1s
  -> 20 candidates sent to 1/1 workers

[CHECKPOINT] Saved A.json at gen 1000 (makespan: 408449925.00)
[GP] gpu_0 intermediate update: 406892288.00 at gen 2100
[GP] gpu_0 intermediate update: 404217084.00 at gen 2200

*** [GPU 0] NEW GLOBAL BEST: 403171497.00 at gen 2300 ***
    Saved to best_solution.json

[GPU 0] Gen  2300 | Best: 403171497.00 | 261.4s
[GP] gpu_0 intermediate update: 403171497.00 at gen 2300
[GP] gpu_0 intermediate update: 401115804.00 at gen 2400

==================================================
GP ANALYSIS - Cycle 6
  Collected 40 solutions
==================================================

[GP] ========== GENETIC PROGRAMMING ANALYSIS STARTED ==========
[GP] Cycle: 5
[GP] Input: 40 solutions received for analysis
[GP] Fitness range: best=401069664.00, worst=404217088.00
[GP] Analysis config: blocks=True, fft=False, similarity=False
[GP] Starting analysis...
[GP] Phase 1: Extracting building blocks...

*** [GPU 0] NEW GLOBAL BEST: 401069678.00 at gen 2400 ***
    Saved to best_solution.json

[GPU 0] Gen  2400 | Best: 401069678.00 | 272.7s
[GP] Phase 1 complete: Found 30 building blocks
[GP] Phase 2: FFT analysis DISABLED
[GP] Phase 3: Similarity analysis DISABLED
[GP] ========== GP ANALYSIS COMPLETE ==========


[GP] ========== CANDIDATE GENERATION STARTED ==========
[GP] Generating 20 new candidate solutions
[GP] Available data: 40 top solutions, 30 building blocks, 0 FFT patterns, 0 similarity patterns
[GP] Generation strategy: 6 block-based, 6 interpolated, 8 mutated
[GP] Strategy 1: Creating 6 candidates via building block combination...
[GP] Strategy 1 complete: 6 block-based candidates created
[GP] Strategy 2: Creating 6 candidates via solution interpolation...
[GP] Strategy 2 complete: 6 interpolated candidates created
[GP] Strategy 3: Creating 8 candidates via guided mutation...
[GP] Strategy 3 complete: 8 mutated candidates created
[GP] Total candidates generated: 20
[GP] Strategy breakdown: Block=36, Interp=36, Mut=48
[GP] ========== CANDIDATE GENERATION COMPLETE ==========


*** [GPU 0] NEW GLOBAL BEST: 399264490.00 at gen 2500 ***
    Saved to best_solution.json

[GPU 0] Gen  2500 | Best: 399264490.00 | 283.9s
[GPU 0] Gene injection: 20 candidates injected at gen 2600 (total so far: 120)

*** [GPU 0] NEW GLOBAL BEST: 398356349.00 at gen 2600 ***
    Saved to best_solution.json

[GPU 0] Gen  2600 | Best: 398356349.00 | 295.0s
  -> 20 candidates sent to 1/1 workers
[GP] gpu_0 intermediate update: 401069678.00 at gen 2400
[GP] gpu_0 intermediate update: 399264490.00 at gen 2500
[GP] gpu_0 intermediate update: 398378982.00 at gen 2600
[GP] gpu_0 intermediate update: 398356349.00 at gen 2600

*** [GPU 0] NEW GLOBAL BEST: 396732166.00 at gen 2700 ***
    Saved to best_solution.json

[GPU 0] Gen  2700 | Best: 396732166.00 | 306.2s
[GP] gpu_0 intermediate update: 396732166.00 at gen 2700
[GP] gpu_0 intermediate update: 395547512.00 at gen 2800

==================================================
GP ANALYSIS - Cycle 7
  Collected 40 solutions
==================================================

[GP] ========== GENETIC PROGRAMMING ANALYSIS STARTED ==========
[GP] Cycle: 6
[GP] Input: 40 solutions received for analysis
[GP] Fitness range: best=395547520.00, worst=398378976.00
[GP] Analysis config: blocks=True, fft=False, similarity=False
[GP] Starting analysis...
[GP] Phase 1: Extracting building blocks...

*** [GPU 0] NEW GLOBAL BEST: 395547512.00 at gen 2800 ***
    Saved to best_solution.json

[GPU 0] Gen  2800 | Best: 395547512.00 | 317.6s
[GP] Phase 1 complete: Found 30 building blocks
[GP] Phase 2: FFT analysis DISABLED
[GP] Phase 3: Similarity analysis DISABLED
[GP] ========== GP ANALYSIS COMPLETE ==========


[GP] ========== CANDIDATE GENERATION STARTED ==========
[GP] Generating 20 new candidate solutions
[GP] Available data: 40 top solutions, 30 building blocks, 0 FFT patterns, 0 similarity patterns
[GP] Generation strategy: 6 block-based, 6 interpolated, 8 mutated
[GP] Strategy 1: Creating 6 candidates via building block combination...
[GP] Strategy 1 complete: 6 block-based candidates created
[GP] Strategy 2: Creating 6 candidates via solution interpolation...
[GP] Strategy 2 complete: 6 interpolated candidates created
[GP] Strategy 3: Creating 8 candidates via guided mutation...
[GP] Strategy 3 complete: 8 mutated candidates created
[GP] Total candidates generated: 20
[GP] Strategy breakdown: Block=42, Interp=42, Mut=56
[GP] ========== CANDIDATE GENERATION COMPLETE ==========


*** [GPU 0] NEW GLOBAL BEST: 394796654.00 at gen 2900 ***
    Saved to best_solution.json

[GPU 0] Gen  2900 | Best: 394796654.00 | 328.9s
[GPU 0] Gene injection: 20 candidates injected at gen 3000 (total so far: 140)

*** [GPU 0] NEW GLOBAL BEST: 393877611.00 at gen 3000 ***
    Saved to best_solution.json

[GPU 0] Gen  3000 | Best: 393877611.00 | 340.2s
  -> 20 candidates sent to 1/1 workers
[GP] gpu_0 intermediate update: 394796654.00 at gen 2900
[GP] gpu_0 intermediate update: 393923275.00 at gen 3000
    [Checkpoint] Saved to ./results/cold_start/blocks_only/dsj1000/1R20/job_times_9_seed0_3000.json
[GP] gpu_0 intermediate update: 393877611.00 at gen 3000

*** [GPU 0] NEW GLOBAL BEST: 392686412.00 at gen 3100 ***
    Saved to best_solution.json

[GPU 0] Gen  3100 | Best: 392686412.00 | 351.6s
[GP] gpu_0 intermediate update: 392686412.00 at gen 3100
[GP] gpu_0 intermediate update: 391034407.00 at gen 3200

==================================================
GP ANALYSIS - Cycle 8
  Collected 40 solutions
==================================================

[GP] ========== GENETIC PROGRAMMING ANALYSIS STARTED ==========
[GP] Cycle: 7
[GP] Input: 40 solutions received for analysis
[GP] Fitness range: best=391034400.00, worst=393923264.00
[GP] Analysis config: blocks=True, fft=False, similarity=False
[GP] Starting analysis...
[GP] Phase 1: Extracting building blocks...

*** [GPU 0] NEW GLOBAL BEST: 391034407.00 at gen 3200 ***
    Saved to best_solution.json

[GPU 0] Gen  3200 | Best: 391034407.00 | 363.1s
[GP] Phase 1 complete: Found 30 building blocks
[GP] Phase 2: FFT analysis DISABLED
[GP] Phase 3: Similarity analysis DISABLED
[GP] ========== GP ANALYSIS COMPLETE ==========


[GP] ========== CANDIDATE GENERATION STARTED ==========
[GP] Generating 20 new candidate solutions
[GP] Available data: 40 top solutions, 30 building blocks, 0 FFT patterns, 0 similarity patterns
[GP] Generation strategy: 6 block-based, 6 interpolated, 8 mutated
[GP] Strategy 1: Creating 6 candidates via building block combination...
[GP] Strategy 1 complete: 6 block-based candidates created
[GP] Strategy 2: Creating 6 candidates via solution interpolation...
[GP] Strategy 2 complete: 6 interpolated candidates created
[GP] Strategy 3: Creating 8 candidates via guided mutation...
[GP] Strategy 3 complete: 8 mutated candidates created
[GP] Total candidates generated: 20
[GP] Strategy breakdown: Block=48, Interp=48, Mut=64
[GP] ========== CANDIDATE GENERATION COMPLETE ==========


*** [GPU 0] NEW GLOBAL BEST: 389442081.00 at gen 3300 ***
    Saved to best_solution.json

[GPU 0] Gen  3300 | Best: 389442081.00 | 374.3s
[GPU 0] Gene injection: 20 candidates injected at gen 3400 (total so far: 160)

*** [GPU 0] NEW GLOBAL BEST: 389003899.00 at gen 3400 ***
    Saved to best_solution.json

[GPU 0] Gen  3400 | Best: 389003899.00 | 385.6s
  -> 20 candidates sent to 1/1 workers
[GP] gpu_0 intermediate update: 389442081.00 at gen 3300
[GP] gpu_0 intermediate update: 389003899.00 at gen 3400

*** [GPU 0] NEW GLOBAL BEST: 387965160.00 at gen 3500 ***
    Saved to best_solution.json

[GPU 0] Gen  3500 | Best: 387965160.00 | 396.8s
[GP] gpu_0 intermediate update: 387965160.00 at gen 3500
[GP] gpu_0 intermediate update: 387449109.00 at gen 3600

==================================================
GP ANALYSIS - Cycle 9
  Collected 40 solutions
==================================================

[GP] ========== GENETIC PROGRAMMING ANALYSIS STARTED ==========
[GP] Cycle: 8
[GP] Input: 40 solutions received for analysis
[GP] Fitness range: best=387449120.00, worst=389003904.00
[GP] Analysis config: blocks=True, fft=False, similarity=False
[GP] Starting analysis...
[GP] Phase 1: Extracting building blocks...

*** [GPU 0] NEW GLOBAL BEST: 387449109.00 at gen 3600 ***
    Saved to best_solution.json

[GPU 0] Gen  3600 | Best: 387449109.00 | 408.0s
[GP] Phase 1 complete: Found 30 building blocks
[GP] Phase 2: FFT analysis DISABLED
[GP] Phase 3: Similarity analysis DISABLED
[GP] ========== GP ANALYSIS COMPLETE ==========


[GP] ========== CANDIDATE GENERATION STARTED ==========
[GP] Generating 20 new candidate solutions
[GP] Available data: 40 top solutions, 30 building blocks, 0 FFT patterns, 0 similarity patterns
[GP] Generation strategy: 6 block-based, 6 interpolated, 8 mutated
[GP] Strategy 1: Creating 6 candidates via building block combination...
[GP] Strategy 1 complete: 6 block-based candidates created
[GP] Strategy 2: Creating 6 candidates via solution interpolation...
[GP] Strategy 2 complete: 6 interpolated candidates created
[GP] Strategy 3: Creating 8 candidates via guided mutation...
[GP] Strategy 3 complete: 8 mutated candidates created
[GP] Total candidates generated: 20
[GP] Strategy breakdown: Block=54, Interp=54, Mut=72
[GP] ========== CANDIDATE GENERATION COMPLETE ==========


*** [GPU 0] NEW GLOBAL BEST: 386473515.00 at gen 3700 ***
    Saved to best_solution.json

[GPU 0] Gen  3700 | Best: 386473515.00 | 419.3s
[GPU 0] Gene injection: 20 candidates injected at gen 3800 (total so far: 180)
  -> 20 candidates sent to 1/1 workers
[GP] gpu_0 intermediate update: 386473515.00 at gen 3700
[GP] gpu_0 intermediate update: 386031773.00 at gen 3800

*** [GPU 0] NEW GLOBAL BEST: 385998391.00 at gen 3800 ***
    Saved to best_solution.json

[GPU 0] Gen  3800 | Best: 385998391.00 | 430.4s
[GP] gpu_0 intermediate update: 385998391.00 at gen 3800

*** [GPU 0] NEW GLOBAL BEST: 384877854.00 at gen 3900 ***
    Saved to best_solution.json

[GPU 0] Gen  3900 | Best: 384877854.00 | 441.6s
[GP] gpu_0 intermediate update: 384877854.00 at gen 3900
[GP] gpu_0 intermediate update: 384108473.00 at gen 4000

==================================================
GP ANALYSIS - Cycle 10
  Collected 40 solutions
==================================================

[GP] ========== GENETIC PROGRAMMING ANALYSIS STARTED ==========
[GP] Cycle: 9
[GP] Input: 40 solutions received for analysis
[GP] Fitness range: best=384108480.00, worst=386031776.00
[GP] Analysis config: blocks=True, fft=False, similarity=False
[GP] Starting analysis...
[GP] Phase 1: Extracting building blocks...

*** [GPU 0] NEW GLOBAL BEST: 384108473.00 at gen 4000 ***
    Saved to best_solution.json

[GPU 0] Gen  4000 | Best: 384108473.00 | 453.0s
    [Checkpoint] Saved to ./results/cold_start/blocks_only/dsj1000/1R20/job_times_9_seed0_4000.json
[GP] Phase 1 complete: Found 30 building blocks
[GP] Phase 2: FFT analysis DISABLED
[GP] Phase 3: Similarity analysis DISABLED
[GP] ========== GP ANALYSIS COMPLETE ==========


[GP] ========== CANDIDATE GENERATION STARTED ==========
[GP] Generating 20 new candidate solutions
[GP] Available data: 40 top solutions, 30 building blocks, 0 FFT patterns, 0 similarity patterns
[GP] Generation strategy: 6 block-based, 6 interpolated, 8 mutated
[GP] Strategy 1: Creating 6 candidates via building block combination...
[GP] Strategy 1 complete: 6 block-based candidates created
[GP] Strategy 2: Creating 6 candidates via solution interpolation...
[GP] Strategy 2 complete: 6 interpolated candidates created
[GP] Strategy 3: Creating 8 candidates via guided mutation...
[GP] Strategy 3 complete: 8 mutated candidates created
[GP] Total candidates generated: 20
[GP] Strategy breakdown: Block=60, Interp=60, Mut=80
[GP] ========== CANDIDATE GENERATION COMPLETE ==========


*** [GPU 0] NEW GLOBAL BEST: 383502526.00 at gen 4100 ***
    Saved to best_solution.json

[GPU 0] Gen  4100 | Best: 383502526.00 | 464.3s
[GPU 0] Gene injection: 20 candidates injected at gen 4200 (total so far: 200)

*** [GPU 0] NEW GLOBAL BEST: 382588598.00 at gen 4200 ***
  -> 20 candidates sent to 1/1 workers

[CHECKPOINT] Saved B.json at gen 2000 (makespan: 384108473.00)
    Saved to best_solution.json

[GPU 0] Gen  4200 | Best: 382588598.00 | 475.5s
[GP] gpu_0 intermediate update: 383502526.00 at gen 4100
[GP] gpu_0 intermediate update: 382588598.00 at gen 4200

*** [GPU 0] NEW GLOBAL BEST: 382075486.00 at gen 4300 ***
    Saved to best_solution.json

[GPU 0] Gen  4300 | Best: 382075486.00 | 486.7s
[GP] gpu_0 intermediate update: 382075486.00 at gen 4300
[GP] gpu_0 intermediate update: 381766051.00 at gen 4400

==================================================
GP ANALYSIS - Cycle 11
  Collected 40 solutions
==================================================

[GP] ========== GENETIC PROGRAMMING ANALYSIS STARTED ==========
[GP] Cycle: 10
[GP] Input: 40 solutions received for analysis
[GP] Fitness range: best=381766048.00, worst=382588608.00
[GP] Analysis config: blocks=True, fft=False, similarity=False
[GP] Starting analysis...
[GP] Phase 1: Extracting building blocks...

*** [GPU 0] NEW GLOBAL BEST: 381766051.00 at gen 4400 ***
    Saved to best_solution.json

[GPU 0] Gen  4400 | Best: 381766051.00 | 498.2s
[GP] Phase 1 complete: Found 30 building blocks
[GP] Phase 2: FFT analysis DISABLED
[GP] Phase 3: Similarity analysis DISABLED
[GP] ========== GP ANALYSIS COMPLETE ==========


[GP] ========== CANDIDATE GENERATION STARTED ==========
[GP] Generating 20 new candidate solutions
[GP] Available data: 40 top solutions, 30 building blocks, 0 FFT patterns, 0 similarity patterns
[GP] Generation strategy: 6 block-based, 6 interpolated, 8 mutated
[GP] Strategy 1: Creating 6 candidates via building block combination...
[GP] Strategy 1 complete: 6 block-based candidates created
[GP] Strategy 2: Creating 6 candidates via solution interpolation...
[GP] Strategy 2 complete: 6 interpolated candidates created
[GP] Strategy 3: Creating 8 candidates via guided mutation...
[GP] Strategy 3 complete: 8 mutated candidates created
[GP] Total candidates generated: 20
[GP] Strategy breakdown: Block=66, Interp=66, Mut=88
[GP] ========== CANDIDATE GENERATION COMPLETE ==========


*** [GPU 0] NEW GLOBAL BEST: 381703971.00 at gen 4500 ***
    Saved to best_solution.json

[GPU 0] Gen  4500 | Best: 381703971.00 | 509.4s
[GPU 0] Gene injection: 20 candidates injected at gen 4600 (total so far: 220)

*** [GPU 0] NEW GLOBAL BEST: 381232106.00 at gen 4600 ***
    Saved to best_solution.json

[GPU 0] Gen  4600 | Best: 381232106.00 | 520.7s
  -> 20 candidates sent to 1/1 workers
[GP] gpu_0 intermediate update: 381703971.00 at gen 4500
[GP] gpu_0 intermediate update: 381232106.00 at gen 4600

*** [GPU 0] NEW GLOBAL BEST: 381022467.00 at gen 4700 ***
    Saved to best_solution.json

[GPU 0] Gen  4700 | Best: 381022467.00 | 532.0s
[GP] gpu_0 intermediate update: 381022467.00 at gen 4700
[GP] gpu_0 intermediate update: 380645505.00 at gen 4800

==================================================
GP ANALYSIS - Cycle 12
  Collected 40 solutions
==================================================

[GP] ========== GENETIC PROGRAMMING ANALYSIS STARTED ==========
[GP] Cycle: 11
[GP] Input: 40 solutions received for analysis
[GP] Fitness range: best=380645504.00, worst=381267328.00
[GP] Analysis config: blocks=True, fft=False, similarity=False
[GP] Starting analysis...
[GP] Phase 1: Extracting building blocks...

*** [GPU 0] NEW GLOBAL BEST: 380645505.00 at gen 4800 ***
    Saved to best_solution.json

[GPU 0] Gen  4800 | Best: 380645505.00 | 543.5s
[GP] Phase 1 complete: Found 30 building blocks
[GP] Phase 2: FFT analysis DISABLED
[GP] Phase 3: Similarity analysis DISABLED
[GP] ========== GP ANALYSIS COMPLETE ==========


[GP] ========== CANDIDATE GENERATION STARTED ==========
[GP] Generating 20 new candidate solutions
[GP] Available data: 40 top solutions, 30 building blocks, 0 FFT patterns, 0 similarity patterns
[GP] Generation strategy: 6 block-based, 6 interpolated, 8 mutated
[GP] Strategy 1: Creating 6 candidates via building block combination...
[GP] Strategy 1 complete: 6 block-based candidates created
[GP] Strategy 2: Creating 6 candidates via solution interpolation...
[GP] Strategy 2 complete: 6 interpolated candidates created
[GP] Strategy 3: Creating 8 candidates via guided mutation...
[GP] Strategy 3 complete: 8 mutated candidates created
[GP] Total candidates generated: 20
[GP] Strategy breakdown: Block=72, Interp=72, Mut=96
[GP] ========== CANDIDATE GENERATION COMPLETE ==========


*** [GPU 0] NEW GLOBAL BEST: 380059931.00 at gen 4900 ***
    Saved to best_solution.json

[GPU 0] Gen  4900 | Best: 380059931.00 | 554.7s
[GPU 0] Gene injection: 20 candidates injected at gen 5000 (total so far: 240)
[GPU 0] Evolution complete. Sending final results...
  -> 20 candidates sent to 1/1 workers
[GP] gpu_0 intermediate update: 380059931.00 at gen 4900
[GP] gpu_0 intermediate update: 379862379.00 at gen 5000
[GP] Worker finished: gpu_0 (best=379862379.00)

[GP] All workers finished. Total GP cycles: 12

[Final Collection] Have 1/1 workers. Waiting up to 120s for remaining...

[Critical] Attempting final result collection before terminating workers...

[Results Summary] Collected 1 results:
  gpu_0: fitness=379862379.00, intermediate=False, gen=final

======================================================================
COMPLETE
======================================================================
Best: 379862379.00 from gpu_0
Time: 568.5s
Total candidates injected: 240

Solution JSON saved to ./results/cold_start/blocks_only/dsj1000/1R20/job_times_9_seed0.json
HTML Gantt chart saved to: ./results/cold_start/blocks_only/dsj1000/1R20/job_times_9_seed0.html
