Setting random seed to 0
DEBUG: proc shape: (431,), agents: 6, resources: 4, n: 431

======================================================================
LOADING INITIAL SOLUTION FROM JSON
======================================================================
Loaded heuristic solution: Savings with makespan 6941500.00
File: ./results/heuristics_only/gr431/1R20/job_times_9_heuristics.json
Makespan: 6941500.00
Status: SUCCESS - Will use as warm start
======================================================================


======================================================================
VRP-RPD SOLVER
======================================================================
Problem: 430 customers, 6 agents, k=4
Heuristic: None
Genetic Programming: Yes
Warm Start: Yes
Gene Injection: Yes
Workers: 1 GPU + 0 CPU
Generations: 5000
======================================================================

Using solution from JSON file as warm start...
  JSON solution: 6941500.00
Skipping heuristic re-computation (using JSON solution + perturbations)

Generated 6 warm start chromosomes from JSON

[GP] Starting GP collection loop (timeout: 12975s)...
[GPU 0] Warm start: 6 chromosomes

*** [GPU 0] NEW GLOBAL BEST: 4040730.00 at gen 0 ***
    Saved to best_solution.json

[GPU 0] Gen     0 | Best: 4040730.00 | 0.4s
[GP] gpu_0 first intermediate: 4040730.00 at gen 0

*** [GPU 0] NEW GLOBAL BEST: 2825063.00 at gen 100 ***
    Saved to best_solution.json

[GPU 0] Gen   100 | Best: 2825063.00 | 10.2s
[GP] gpu_0 intermediate update: 2825063.00 at gen 100
[GP] gpu_0 intermediate update: 2692226.00 at gen 200

==================================================
GP ANALYSIS - Cycle 1
  Collected 100 solutions
==================================================

[GP] ========== GENETIC PROGRAMMING ANALYSIS STARTED ==========
[GP] Cycle: 0
[GP] Input: 100 solutions received for analysis
[GP] Fitness range: best=2688081.00, worst=2692391.00
[GP] Analysis config: blocks=True, fft=False, similarity=False
[GP] Starting analysis...
[GP] Phase 1: Extracting building blocks...
[GP] Phase 1 complete: Found 21 building blocks
[GP] Phase 2: FFT analysis DISABLED
[GP] Phase 3: Similarity analysis DISABLED
[GP] ========== GP ANALYSIS COMPLETE ==========


[GP] ========== CANDIDATE GENERATION STARTED ==========
[GP] Generating 20 new candidate solutions
[GP] Available data: 100 top solutions, 21 building blocks, 0 FFT patterns, 0 similarity patterns
[GP] Generation strategy: 6 block-based, 6 interpolated, 8 mutated
[GP] Strategy 1: Creating 6 candidates via building block combination...
[GP] Strategy 1 complete: 6 block-based candidates created
[GP] Strategy 2: Creating 6 candidates via solution interpolation...
[GP] Strategy 2 complete: 6 interpolated candidates created
[GP] Strategy 3: Creating 8 candidates via guided mutation...
[GP] Strategy 3 complete: 8 mutated candidates created
[GP] Total candidates generated: 20
[GP] Strategy breakdown: Block=6, Interp=6, Mut=8
[GP] ========== CANDIDATE GENERATION COMPLETE ==========


*** [GPU 0] NEW GLOBAL BEST: 2688081.00 at gen 200 ***
    Saved to best_solution.json

[GPU 0] Gen   200 | Best: 2688081.00 | 20.4s
  -> 20 candidates sent to 1/1 workers
[GP] gpu_0 intermediate update: 2688081.00 at gen 200

*** [GPU 0] NEW GLOBAL BEST: 2634429.00 at gen 300 ***
    Saved to best_solution.json

[GPU 0] Gen   300 | Best: 2634429.00 | 30.3s
[GP] gpu_0 intermediate update: 2634429.00 at gen 300
[GPU 0] Gene injection: 20 candidates injected at gen 400 (total so far: 20)
[GP] gpu_0 intermediate update: 2573217.00 at gen 400

==================================================
GP ANALYSIS - Cycle 2
  Collected 100 solutions
==================================================

[GP] ========== GENETIC PROGRAMMING ANALYSIS STARTED ==========
[GP] Cycle: 1
[GP] Input: 100 solutions received for analysis
[GP] Fitness range: best=2573217.00, worst=2574851.00
[GP] Analysis config: blocks=True, fft=False, similarity=False
[GP] Starting analysis...
[GP] Phase 1: Extracting building blocks...

*** [GPU 0] NEW GLOBAL BEST: 2573217.00 at gen 400 ***
    Saved to best_solution.json

[GPU 0] Gen   400 | Best: 2573217.00 | 40.5s
[GP] Phase 1 complete: Found 22 building blocks
[GP] Phase 2: FFT analysis DISABLED
[GP] Phase 3: Similarity analysis DISABLED
[GP] ========== GP ANALYSIS COMPLETE ==========


[GP] ========== CANDIDATE GENERATION STARTED ==========
[GP] Generating 20 new candidate solutions
[GP] Available data: 100 top solutions, 22 building blocks, 0 FFT patterns, 0 similarity patterns
[GP] Generation strategy: 6 block-based, 6 interpolated, 8 mutated
[GP] Strategy 1: Creating 6 candidates via building block combination...
[GP] Strategy 1 complete: 6 block-based candidates created
[GP] Strategy 2: Creating 6 candidates via solution interpolation...
[GP] Strategy 2 complete: 6 interpolated candidates created
[GP] Strategy 3: Creating 8 candidates via guided mutation...
[GP] Strategy 3 complete: 8 mutated candidates created
[GP] Total candidates generated: 20
[GP] Strategy breakdown: Block=12, Interp=12, Mut=16
[GP] ========== CANDIDATE GENERATION COMPLETE ==========


*** [GPU 0] NEW GLOBAL BEST: 2513189.00 at gen 500 ***
    Saved to best_solution.json

[GPU 0] Gen   500 | Best: 2513189.00 | 50.4s
  -> 20 candidates sent to 1/1 workers
[GP] gpu_0 intermediate update: 2513189.00 at gen 500
[GPU 0] Gene injection: 20 candidates injected at gen 600 (total so far: 40)
[GP] gpu_0 intermediate update: 2480405.00 at gen 600

==================================================
GP ANALYSIS - Cycle 3
  Collected 100 solutions
==================================================

[GP] ========== GENETIC PROGRAMMING ANALYSIS STARTED ==========
[GP] Cycle: 2
[GP] Input: 100 solutions received for analysis
[GP] Fitness range: best=2480405.00, worst=2484179.00
[GP] Analysis config: blocks=True, fft=False, similarity=False
[GP] Starting analysis...
[GP] Phase 1: Extracting building blocks...

*** [GPU 0] NEW GLOBAL BEST: 2480405.00 at gen 600 ***
    Saved to best_solution.json

[GPU 0] Gen   600 | Best: 2480405.00 | 60.6s
[GP] Phase 1 complete: Found 10 building blocks
[GP] Phase 2: FFT analysis DISABLED
[GP] Phase 3: Similarity analysis DISABLED
[GP] ========== GP ANALYSIS COMPLETE ==========


[GP] ========== CANDIDATE GENERATION STARTED ==========
[GP] Generating 20 new candidate solutions
[GP] Available data: 100 top solutions, 10 building blocks, 0 FFT patterns, 0 similarity patterns
[GP] Generation strategy: 6 block-based, 6 interpolated, 8 mutated
[GP] Strategy 1: Creating 6 candidates via building block combination...
[GP] Strategy 1 complete: 6 block-based candidates created
[GP] Strategy 2: Creating 6 candidates via solution interpolation...
[GP] Strategy 2 complete: 6 interpolated candidates created
[GP] Strategy 3: Creating 8 candidates via guided mutation...
[GP] Strategy 3 complete: 8 mutated candidates created
[GP] Total candidates generated: 20
[GP] Strategy breakdown: Block=18, Interp=18, Mut=24
[GP] ========== CANDIDATE GENERATION COMPLETE ==========


*** [GPU 0] NEW GLOBAL BEST: 2462357.00 at gen 700 ***
    Saved to best_solution.json

[GPU 0] Gen   700 | Best: 2462357.00 | 70.8s
  -> 20 candidates sent to 1/1 workers
[GP] gpu_0 intermediate update: 2462357.00 at gen 700
[GP] gpu_0 intermediate update: 2438250.00 at gen 800
[GPU 0] Gene injection: 20 candidates injected at gen 800 (total so far: 60)

==================================================
GP ANALYSIS - Cycle 4
  Collected 100 solutions
==================================================

[GP] ========== GENETIC PROGRAMMING ANALYSIS STARTED ==========
[GP] Cycle: 3
[GP] Input: 100 solutions received for analysis
[GP] Fitness range: best=2438250.00, worst=2438250.00
[GP] Analysis config: blocks=True, fft=False, similarity=False
[GP] Starting analysis...
[GP] Phase 1: Extracting building blocks...

*** [GPU 0] NEW GLOBAL BEST: 2438250.00 at gen 800 ***
    Saved to best_solution.json

[GPU 0] Gen   800 | Best: 2438250.00 | 80.8s
[GP] Phase 1 complete: Found 16 building blocks
[GP] Phase 2: FFT analysis DISABLED
[GP] Phase 3: Similarity analysis DISABLED
[GP] ========== GP ANALYSIS COMPLETE ==========


[GP] ========== CANDIDATE GENERATION STARTED ==========
[GP] Generating 20 new candidate solutions
[GP] Available data: 100 top solutions, 16 building blocks, 0 FFT patterns, 0 similarity patterns
[GP] Generation strategy: 6 block-based, 6 interpolated, 8 mutated
[GP] Strategy 1: Creating 6 candidates via building block combination...
[GP] Strategy 1 complete: 6 block-based candidates created
[GP] Strategy 2: Creating 6 candidates via solution interpolation...
[GP] Strategy 2 complete: 6 interpolated candidates created
[GP] Strategy 3: Creating 8 candidates via guided mutation...
[GP] Strategy 3 complete: 8 mutated candidates created
[GP] Total candidates generated: 20
[GP] Strategy breakdown: Block=24, Interp=24, Mut=32
[GP] ========== CANDIDATE GENERATION COMPLETE ==========


*** [GPU 0] NEW GLOBAL BEST: 2424890.00 at gen 900 ***
    Saved to best_solution.json

[GPU 0] Gen   900 | Best: 2424890.00 | 90.9s
  -> 20 candidates sent to 1/1 workers
[GP] gpu_0 intermediate update: 2424890.00 at gen 900
[GPU 0] Gene injection: 20 candidates injected at gen 1000 (total so far: 80)
[GP] gpu_0 intermediate update: 2417921.00 at gen 1000

==================================================
GP ANALYSIS - Cycle 5
  Collected 100 solutions
==================================================

[GP] ========== GENETIC PROGRAMMING ANALYSIS STARTED ==========
[GP] Cycle: 4
[GP] Input: 100 solutions received for analysis
[GP] Fitness range: best=2417921.00, worst=2417921.00
[GP] Analysis config: blocks=True, fft=False, similarity=False
[GP] Starting analysis...
[GP] Phase 1: Extracting building blocks...

*** [GPU 0] NEW GLOBAL BEST: 2417921.00 at gen 1000 ***
    Saved to best_solution.json

[GPU 0] Gen  1000 | Best: 2417921.00 | 100.9s
    [Checkpoint] Saved to ./results/warm_start/blocks_only/gr431/1R20/job_times_9_seed0_1000.json
[GP] Phase 1 complete: Found 13 building blocks
[GP] Phase 2: FFT analysis DISABLED
[GP] Phase 3: Similarity analysis DISABLED
[GP] ========== GP ANALYSIS COMPLETE ==========


[GP] ========== CANDIDATE GENERATION STARTED ==========
[GP] Generating 20 new candidate solutions
[GP] Available data: 100 top solutions, 13 building blocks, 0 FFT patterns, 0 similarity patterns
[GP] Generation strategy: 6 block-based, 6 interpolated, 8 mutated
[GP] Strategy 1: Creating 6 candidates via building block combination...
[GP] Strategy 1 complete: 6 block-based candidates created
[GP] Strategy 2: Creating 6 candidates via solution interpolation...
[GP] Strategy 2 complete: 6 interpolated candidates created
[GP] Strategy 3: Creating 8 candidates via guided mutation...
[GP] Strategy 3 complete: 8 mutated candidates created
[GP] Total candidates generated: 20
[GP] Strategy breakdown: Block=30, Interp=30, Mut=40
[GP] ========== CANDIDATE GENERATION COMPLETE ==========

  -> 20 candidates sent to 1/1 workers

[CHECKPOINT] Saved A.json at gen 1000 (makespan: 2417921.00)

*** [GPU 0] NEW GLOBAL BEST: 2406341.00 at gen 1100 ***
    Saved to best_solution.json

[GPU 0] Gen  1100 | Best: 2406341.00 | 111.0s
[GP] gpu_0 intermediate update: 2406341.00 at gen 1100
[GPU 0] Gene injection: 20 candidates injected at gen 1200 (total so far: 100)
[GP] gpu_0 intermediate update: 2395255.00 at gen 1200

==================================================
GP ANALYSIS - Cycle 6
  Collected 100 solutions
==================================================

[GP] ========== GENETIC PROGRAMMING ANALYSIS STARTED ==========
[GP] Cycle: 5
[GP] Input: 100 solutions received for analysis
[GP] Fitness range: best=2392816.00, worst=2395820.00
[GP] Analysis config: blocks=True, fft=False, similarity=False
[GP] Starting analysis...
[GP] Phase 1: Extracting building blocks...

*** [GPU 0] NEW GLOBAL BEST: 2392816.00 at gen 1200 ***
    Saved to best_solution.json

[GPU 0] Gen  1200 | Best: 2392816.00 | 120.9s
[GP] Phase 1 complete: Found 9 building blocks
[GP] Phase 2: FFT analysis DISABLED
[GP] Phase 3: Similarity analysis DISABLED
[GP] ========== GP ANALYSIS COMPLETE ==========


[GP] ========== CANDIDATE GENERATION STARTED ==========
[GP] Generating 20 new candidate solutions
[GP] Available data: 100 top solutions, 9 building blocks, 0 FFT patterns, 0 similarity patterns
[GP] Generation strategy: 6 block-based, 6 interpolated, 8 mutated
[GP] Strategy 1: Creating 6 candidates via building block combination...
[GP] Strategy 1 complete: 6 block-based candidates created
[GP] Strategy 2: Creating 6 candidates via solution interpolation...
[GP] Strategy 2 complete: 6 interpolated candidates created
[GP] Strategy 3: Creating 8 candidates via guided mutation...
[GP] Strategy 3 complete: 8 mutated candidates created
[GP] Total candidates generated: 20
[GP] Strategy breakdown: Block=36, Interp=36, Mut=48
[GP] ========== CANDIDATE GENERATION COMPLETE ==========

  -> 20 candidates sent to 1/1 workers
[GP] gpu_0 intermediate update: 2392816.00 at gen 1200

*** [GPU 0] NEW GLOBAL BEST: 2380364.00 at gen 1300 ***
    Saved to best_solution.json

[GPU 0] Gen  1300 | Best: 2380364.00 | 130.8s
[GP] gpu_0 intermediate update: 2380364.00 at gen 1300
[GP] gpu_0 intermediate update: 2369846.00 at gen 1400
[GPU 0] Gene injection: 20 candidates injected at gen 1400 (total so far: 120)

==================================================
GP ANALYSIS - Cycle 7
  Collected 100 solutions
==================================================

[GP] ========== GENETIC PROGRAMMING ANALYSIS STARTED ==========
[GP] Cycle: 6
[GP] Input: 100 solutions received for analysis
[GP] Fitness range: best=2369846.00, worst=2370538.00
[GP] Analysis config: blocks=True, fft=False, similarity=False
[GP] Starting analysis...
[GP] Phase 1: Extracting building blocks...

*** [GPU 0] NEW GLOBAL BEST: 2369846.00 at gen 1400 ***
    Saved to best_solution.json

[GPU 0] Gen  1400 | Best: 2369846.00 | 141.3s
[GP] Phase 1 complete: Found 3 building blocks
[GP] Phase 2: FFT analysis DISABLED
[GP] Phase 3: Similarity analysis DISABLED
[GP] ========== GP ANALYSIS COMPLETE ==========


[GP] ========== CANDIDATE GENERATION STARTED ==========
[GP] Generating 20 new candidate solutions
[GP] Available data: 100 top solutions, 3 building blocks, 0 FFT patterns, 0 similarity patterns
[GP] Generation strategy: 6 block-based, 6 interpolated, 8 mutated
[GP] Strategy 1: Creating 6 candidates via building block combination...
[GP] Strategy 1 complete: 6 block-based candidates created
[GP] Strategy 2: Creating 6 candidates via solution interpolation...
[GP] Strategy 2 complete: 6 interpolated candidates created
[GP] Strategy 3: Creating 8 candidates via guided mutation...
[GP] Strategy 3 complete: 8 mutated candidates created
[GP] Total candidates generated: 20
[GP] Strategy breakdown: Block=42, Interp=42, Mut=56
[GP] ========== CANDIDATE GENERATION COMPLETE ==========


*** [GPU 0] NEW GLOBAL BEST: 2355518.00 at gen 1500 ***
    Saved to best_solution.json

[GPU 0] Gen  1500 | Best: 2355518.00 | 151.4s
  -> 20 candidates sent to 1/1 workers
[GP] gpu_0 intermediate update: 2355518.00 at gen 1500
[GP] gpu_0 intermediate update: 2342250.00 at gen 1600
[GPU 0] Gene injection: 20 candidates injected at gen 1600 (total so far: 140)

==================================================
GP ANALYSIS - Cycle 8
  Collected 100 solutions
==================================================

[GP] ========== GENETIC PROGRAMMING ANALYSIS STARTED ==========
[GP] Cycle: 7
[GP] Input: 100 solutions received for analysis
[GP] Fitness range: best=2342250.00, worst=2342250.00
[GP] Analysis config: blocks=True, fft=False, similarity=False
[GP] Starting analysis...
[GP] Phase 1: Extracting building blocks...

*** [GPU 0] NEW GLOBAL BEST: 2342250.00 at gen 1600 ***
    Saved to best_solution.json

[GPU 0] Gen  1600 | Best: 2342250.00 | 161.3s
[GP] Phase 1 complete: Found 0 building blocks
[GP] Phase 2: FFT analysis DISABLED
[GP] Phase 3: Similarity analysis DISABLED
[GP] ========== GP ANALYSIS COMPLETE ==========


[GP] ========== CANDIDATE GENERATION STARTED ==========
[GP] Generating 20 new candidate solutions
[GP] Available data: 100 top solutions, 0 building blocks, 0 FFT patterns, 0 similarity patterns
[GP] Generation strategy: 6 block-based, 6 interpolated, 8 mutated
[GP] Strategy 1: Creating 6 candidates via building block combination...
[GP] Strategy 1 complete: 6 block-based candidates created
[GP] Strategy 2: Creating 6 candidates via solution interpolation...
[GP] Strategy 2 complete: 6 interpolated candidates created
[GP] Strategy 3: Creating 8 candidates via guided mutation...
[GP] Strategy 3 complete: 8 mutated candidates created
[GP] Total candidates generated: 20
[GP] Strategy breakdown: Block=48, Interp=48, Mut=64
[GP] ========== CANDIDATE GENERATION COMPLETE ==========


*** [GPU 0] NEW GLOBAL BEST: 2335843.00 at gen 1700 ***
    Saved to best_solution.json

[GPU 0] Gen  1700 | Best: 2335843.00 | 171.4s
  -> 20 candidates sent to 1/1 workers
[GP] gpu_0 intermediate update: 2335843.00 at gen 1700
[GPU 0] Gene injection: 20 candidates injected at gen 1800 (total so far: 160)

==================================================
GP ANALYSIS - Cycle 9
  Collected 100 solutions
==================================================

[GP] ========== GENETIC PROGRAMMING ANALYSIS STARTED ==========
[GP] Cycle: 8
[GP] Input: 100 solutions received for analysis
[GP] Fitness range: best=2335843.00, worst=2335843.00
[GP] Analysis config: blocks=True, fft=False, similarity=False
[GP] Starting analysis...
[GP] Phase 1: Extracting building blocks...
[GPU 0] Gen  1800 | Best: 2335843.00 | 181.3s
[GP] Phase 1 complete: Found 10 building blocks
[GP] Phase 2: FFT analysis DISABLED
[GP] Phase 3: Similarity analysis DISABLED
[GP] ========== GP ANALYSIS COMPLETE ==========


[GP] ========== CANDIDATE GENERATION STARTED ==========
[GP] Generating 20 new candidate solutions
[GP] Available data: 100 top solutions, 10 building blocks, 0 FFT patterns, 0 similarity patterns
[GP] Generation strategy: 6 block-based, 6 interpolated, 8 mutated
[GP] Strategy 1: Creating 6 candidates via building block combination...
[GP] Strategy 1 complete: 6 block-based candidates created
[GP] Strategy 2: Creating 6 candidates via solution interpolation...
[GP] Strategy 2 complete: 6 interpolated candidates created
[GP] Strategy 3: Creating 8 candidates via guided mutation...
[GP] Strategy 3 complete: 8 mutated candidates created
[GP] Total candidates generated: 20
[GP] Strategy breakdown: Block=54, Interp=54, Mut=72
[GP] ========== CANDIDATE GENERATION COMPLETE ==========


*** [GPU 0] NEW GLOBAL BEST: 2331350.00 at gen 1900 ***
    Saved to best_solution.json

[GPU 0] Gen  1900 | Best: 2331350.00 | 191.3s
  -> 20 candidates sent to 1/1 workers
[GP] gpu_0 intermediate update: 2331350.00 at gen 1900
[GP] gpu_0 intermediate update: 2325515.00 at gen 2000
[GPU 0] Gene injection: 20 candidates injected at gen 2000 (total so far: 180)

==================================================
GP ANALYSIS - Cycle 10
  Collected 100 solutions
==================================================

[GP] ========== GENETIC PROGRAMMING ANALYSIS STARTED ==========
[GP] Cycle: 9
[GP] Input: 100 solutions received for analysis
[GP] Fitness range: best=2325515.00, worst=2326000.00
[GP] Analysis config: blocks=True, fft=False, similarity=False
[GP] Starting analysis...
[GP] Phase 1: Extracting building blocks...

*** [GPU 0] NEW GLOBAL BEST: 2325515.00 at gen 2000 ***
    Saved to best_solution.json

[GPU 0] Gen  2000 | Best: 2325515.00 | 201.5s
    [Checkpoint] Saved to ./results/warm_start/blocks_only/gr431/1R20/job_times_9_seed0_2000.json
[GP] Phase 1 complete: Found 1 building blocks
[GP] Phase 2: FFT analysis DISABLED
[GP] Phase 3: Similarity analysis DISABLED
[GP] ========== GP ANALYSIS COMPLETE ==========


[GP] ========== CANDIDATE GENERATION STARTED ==========
[GP] Generating 20 new candidate solutions
[GP] Available data: 100 top solutions, 1 building blocks, 0 FFT patterns, 0 similarity patterns
[GP] Generation strategy: 6 block-based, 6 interpolated, 8 mutated
[GP] Strategy 1: Creating 6 candidates via building block combination...
[GP] Strategy 1 complete: 6 block-based candidates created
[GP] Strategy 2: Creating 6 candidates via solution interpolation...
[GP] Strategy 2 complete: 6 interpolated candidates created
[GP] Strategy 3: Creating 8 candidates via guided mutation...
[GP] Strategy 3 complete: 8 mutated candidates created
[GP] Total candidates generated: 20
[GP] Strategy breakdown: Block=60, Interp=60, Mut=80
[GP] ========== CANDIDATE GENERATION COMPLETE ==========

  -> 20 candidates sent to 1/1 workers

[CHECKPOINT] Saved B.json at gen 2000 (makespan: 2325515.00)

*** [GPU 0] NEW GLOBAL BEST: 2320507.00 at gen 2100 ***
    Saved to best_solution.json

[GPU 0] Gen  2100 | Best: 2320507.00 | 211.9s
[GP] gpu_0 intermediate update: 2320507.00 at gen 2100
[GP] gpu_0 intermediate update: 2317417.00 at gen 2200
[GPU 0] Gene injection: 20 candidates injected at gen 2200 (total so far: 200)

*** [GPU 0] NEW GLOBAL BEST: 2317417.00 at gen 2200 ***
    Saved to best_solution.json

[GPU 0] Gen  2200 | Best: 2317417.00 | 222.0s

==================================================
GP ANALYSIS - Cycle 11
  Collected 100 solutions
==================================================

[GP] ========== GENETIC PROGRAMMING ANALYSIS STARTED ==========
[GP] Cycle: 10
[GP] Input: 100 solutions received for analysis
[GP] Fitness range: best=2317417.00, worst=2317450.00
[GP] Analysis config: blocks=True, fft=False, similarity=False
[GP] Starting analysis...
[GP] Phase 1: Extracting building blocks...
[GP] Phase 1 complete: Found 26 building blocks
[GP] Phase 2: FFT analysis DISABLED
[GP] Phase 3: Similarity analysis DISABLED
[GP] ========== GP ANALYSIS COMPLETE ==========


[GP] ========== CANDIDATE GENERATION STARTED ==========
[GP] Generating 20 new candidate solutions
[GP] Available data: 100 top solutions, 26 building blocks, 0 FFT patterns, 0 similarity patterns
[GP] Generation strategy: 6 block-based, 6 interpolated, 8 mutated
[GP] Strategy 1: Creating 6 candidates via building block combination...
[GP] Strategy 1 complete: 6 block-based candidates created
[GP] Strategy 2: Creating 6 candidates via solution interpolation...
[GP] Strategy 2 complete: 6 interpolated candidates created
[GP] Strategy 3: Creating 8 candidates via guided mutation...
[GP] Strategy 3 complete: 8 mutated candidates created
[GP] Total candidates generated: 20
[GP] Strategy breakdown: Block=66, Interp=66, Mut=88
[GP] ========== CANDIDATE GENERATION COMPLETE ==========


*** [GPU 0] NEW GLOBAL BEST: 2316595.00 at gen 2300 ***
    Saved to best_solution.json

[GPU 0] Gen  2300 | Best: 2316595.00 | 232.0s
  -> 20 candidates sent to 1/1 workers
[GP] gpu_0 intermediate update: 2316595.00 at gen 2300
[GPU 0] Gene injection: 20 candidates injected at gen 2400 (total so far: 220)
[GP] gpu_0 intermediate update: 2311584.00 at gen 2400

==================================================
GP ANALYSIS - Cycle 12
  Collected 100 solutions
==================================================

[GP] ========== GENETIC PROGRAMMING ANALYSIS STARTED ==========
[GP] Cycle: 11
[GP] Input: 100 solutions received for analysis
[GP] Fitness range: best=2311584.00, worst=2311584.00
[GP] Analysis config: blocks=True, fft=False, similarity=False
[GP] Starting analysis...
[GP] Phase 1: Extracting building blocks...

*** [GPU 0] NEW GLOBAL BEST: 2311584.00 at gen 2400 ***
    Saved to best_solution.json

[GPU 0] Gen  2400 | Best: 2311584.00 | 242.1s
[GP] Phase 1 complete: Found 17 building blocks
[GP] Phase 2: FFT analysis DISABLED
[GP] Phase 3: Similarity analysis DISABLED
[GP] ========== GP ANALYSIS COMPLETE ==========


[GP] ========== CANDIDATE GENERATION STARTED ==========
[GP] Generating 20 new candidate solutions
[GP] Available data: 100 top solutions, 17 building blocks, 0 FFT patterns, 0 similarity patterns
[GP] Generation strategy: 6 block-based, 6 interpolated, 8 mutated
[GP] Strategy 1: Creating 6 candidates via building block combination...
[GP] Strategy 1 complete: 6 block-based candidates created
[GP] Strategy 2: Creating 6 candidates via solution interpolation...
[GP] Strategy 2 complete: 6 interpolated candidates created
[GP] Strategy 3: Creating 8 candidates via guided mutation...
[GP] Strategy 3 complete: 8 mutated candidates created
[GP] Total candidates generated: 20
[GP] Strategy breakdown: Block=72, Interp=72, Mut=96
[GP] ========== CANDIDATE GENERATION COMPLETE ==========


*** [GPU 0] NEW GLOBAL BEST: 2309974.00 at gen 2500 ***
    Saved to best_solution.json

[GPU 0] Gen  2500 | Best: 2309974.00 | 252.2s
  -> 20 candidates sent to 1/1 workers
[GP] gpu_0 intermediate update: 2309974.00 at gen 2500
[GPU 0] Gene injection: 20 candidates injected at gen 2600 (total so far: 240)
[GPU 0] Gen  2600 | Best: 2309974.00 | 262.5s

==================================================
GP ANALYSIS - Cycle 13
  Collected 100 solutions
==================================================

[GP] ========== GENETIC PROGRAMMING ANALYSIS STARTED ==========
[GP] Cycle: 12
[GP] Input: 100 solutions received for analysis
[GP] Fitness range: best=2309974.00, worst=2309974.00
[GP] Analysis config: blocks=True, fft=False, similarity=False
[GP] Starting analysis...
[GP] Phase 1: Extracting building blocks...
[GP] Phase 1 complete: Found 10 building blocks
[GP] Phase 2: FFT analysis DISABLED
[GP] Phase 3: Similarity analysis DISABLED
[GP] ========== GP ANALYSIS COMPLETE ==========


[GP] ========== CANDIDATE GENERATION STARTED ==========
[GP] Generating 20 new candidate solutions
[GP] Available data: 100 top solutions, 10 building blocks, 0 FFT patterns, 0 similarity patterns
[GP] Generation strategy: 6 block-based, 6 interpolated, 8 mutated
[GP] Strategy 1: Creating 6 candidates via building block combination...
[GP] Strategy 1 complete: 6 block-based candidates created
[GP] Strategy 2: Creating 6 candidates via solution interpolation...
[GP] Strategy 2 complete: 6 interpolated candidates created
[GP] Strategy 3: Creating 8 candidates via guided mutation...
[GP] Strategy 3 complete: 8 mutated candidates created
[GP] Total candidates generated: 20
[GP] Strategy breakdown: Block=78, Interp=78, Mut=104
[GP] ========== CANDIDATE GENERATION COMPLETE ==========


*** [GPU 0] NEW GLOBAL BEST: 2304949.00 at gen 2700 ***
    Saved to best_solution.json

[GPU 0] Gen  2700 | Best: 2304949.00 | 272.8s
  -> 20 candidates sent to 1/1 workers
[GP] gpu_0 intermediate update: 2304949.00 at gen 2700
[GP] gpu_0 intermediate update: 2296526.00 at gen 2800
[GPU 0] Gene injection: 20 candidates injected at gen 2800 (total so far: 260)

==================================================
GP ANALYSIS - Cycle 14
  Collected 100 solutions
==================================================

[GP] ========== GENETIC PROGRAMMING ANALYSIS STARTED ==========
[GP] Cycle: 13
[GP] Input: 100 solutions received for analysis
[GP] Fitness range: best=2296526.00, worst=2297962.00
[GP] Analysis config: blocks=True, fft=False, similarity=False
[GP] Starting analysis...
[GP] Phase 1: Extracting building blocks...

*** [GPU 0] NEW GLOBAL BEST: 2296526.00 at gen 2800 ***
    Saved to best_solution.json

[GPU 0] Gen  2800 | Best: 2296526.00 | 283.1s
[GP] Phase 1 complete: Found 16 building blocks
[GP] Phase 2: FFT analysis DISABLED
[GP] Phase 3: Similarity analysis DISABLED
[GP] ========== GP ANALYSIS COMPLETE ==========


[GP] ========== CANDIDATE GENERATION STARTED ==========
[GP] Generating 20 new candidate solutions
[GP] Available data: 100 top solutions, 16 building blocks, 0 FFT patterns, 0 similarity patterns
[GP] Generation strategy: 6 block-based, 6 interpolated, 8 mutated
[GP] Strategy 1: Creating 6 candidates via building block combination...
[GP] Strategy 1 complete: 6 block-based candidates created
[GP] Strategy 2: Creating 6 candidates via solution interpolation...
[GP] Strategy 2 complete: 6 interpolated candidates created
[GP] Strategy 3: Creating 8 candidates via guided mutation...
[GP] Strategy 3 complete: 8 mutated candidates created
[GP] Total candidates generated: 20
[GP] Strategy breakdown: Block=84, Interp=84, Mut=112
[GP] ========== CANDIDATE GENERATION COMPLETE ==========


*** [GPU 0] NEW GLOBAL BEST: 2294124.00 at gen 2900 ***
    Saved to best_solution.json

[GPU 0] Gen  2900 | Best: 2294124.00 | 293.2s
  -> 20 candidates sent to 1/1 workers
[GP] gpu_0 intermediate update: 2294124.00 at gen 2900
[GP] gpu_0 intermediate update: 2276161.00 at gen 3000
[GPU 0] Gene injection: 20 candidates injected at gen 3000 (total so far: 280)

==================================================
GP ANALYSIS - Cycle 15
  Collected 100 solutions
==================================================

[GP] ========== GENETIC PROGRAMMING ANALYSIS STARTED ==========
[GP] Cycle: 14
[GP] Input: 100 solutions received for analysis
[GP] Fitness range: best=2276161.00, worst=2276385.00
[GP] Analysis config: blocks=True, fft=False, similarity=False
[GP] Starting analysis...
[GP] Phase 1: Extracting building blocks...

*** [GPU 0] NEW GLOBAL BEST: 2276161.00 at gen 3000 ***
    Saved to best_solution.json

[GPU 0] Gen  3000 | Best: 2276161.00 | 303.3s
    [Checkpoint] Saved to ./results/warm_start/blocks_only/gr431/1R20/job_times_9_seed0_3000.json
[GP] Phase 1 complete: Found 7 building blocks
[GP] Phase 2: FFT analysis DISABLED
[GP] Phase 3: Similarity analysis DISABLED
[GP] ========== GP ANALYSIS COMPLETE ==========


[GP] ========== CANDIDATE GENERATION STARTED ==========
[GP] Generating 20 new candidate solutions
[GP] Available data: 100 top solutions, 7 building blocks, 0 FFT patterns, 0 similarity patterns
[GP] Generation strategy: 6 block-based, 6 interpolated, 8 mutated
[GP] Strategy 1: Creating 6 candidates via building block combination...
[GP] Strategy 1 complete: 6 block-based candidates created
[GP] Strategy 2: Creating 6 candidates via solution interpolation...
[GP] Strategy 2 complete: 6 interpolated candidates created
[GP] Strategy 3: Creating 8 candidates via guided mutation...
[GP] Strategy 3 complete: 8 mutated candidates created
[GP] Total candidates generated: 20
[GP] Strategy breakdown: Block=90, Interp=90, Mut=120
[GP] ========== CANDIDATE GENERATION COMPLETE ==========

  -> 20 candidates sent to 1/1 workers

[CHECKPOINT] Saved C.json at gen 3000 (makespan: 2276161.00)

*** [GPU 0] NEW GLOBAL BEST: 2260775.00 at gen 3100 ***
    Saved to best_solution.json

[GPU 0] Gen  3100 | Best: 2260775.00 | 313.9s
[GP] gpu_0 intermediate update: 2260775.00 at gen 3100
[GP] gpu_0 intermediate update: 2255497.00 at gen 3200
[GPU 0] Gene injection: 20 candidates injected at gen 3200 (total so far: 300)

==================================================
GP ANALYSIS - Cycle 16
  Collected 100 solutions
==================================================

[GP] ========== GENETIC PROGRAMMING ANALYSIS STARTED ==========
[GP] Cycle: 15
[GP] Input: 100 solutions received for analysis
[GP] Fitness range: best=2255497.00, worst=2256144.00
[GP] Analysis config: blocks=True, fft=False, similarity=False
[GP] Starting analysis...
[GP] Phase 1: Extracting building blocks...

*** [GPU 0] NEW GLOBAL BEST: 2255497.00 at gen 3200 ***
    Saved to best_solution.json

[GPU 0] Gen  3200 | Best: 2255497.00 | 324.3s
[GP] Phase 1 complete: Found 25 building blocks
[GP] Phase 2: FFT analysis DISABLED
[GP] Phase 3: Similarity analysis DISABLED
[GP] ========== GP ANALYSIS COMPLETE ==========


[GP] ========== CANDIDATE GENERATION STARTED ==========
[GP] Generating 20 new candidate solutions
[GP] Available data: 100 top solutions, 25 building blocks, 0 FFT patterns, 0 similarity patterns
[GP] Generation strategy: 6 block-based, 6 interpolated, 8 mutated
[GP] Strategy 1: Creating 6 candidates via building block combination...
[GP] Strategy 1 complete: 6 block-based candidates created
[GP] Strategy 2: Creating 6 candidates via solution interpolation...
[GP] Strategy 2 complete: 6 interpolated candidates created
[GP] Strategy 3: Creating 8 candidates via guided mutation...
[GP] Strategy 3 complete: 8 mutated candidates created
[GP] Total candidates generated: 20
[GP] Strategy breakdown: Block=96, Interp=96, Mut=128
[GP] ========== CANDIDATE GENERATION COMPLETE ==========


*** [GPU 0] NEW GLOBAL BEST: 2253691.00 at gen 3300 ***
    Saved to best_solution.json

[GPU 0] Gen  3300 | Best: 2253691.00 | 334.6s
  -> 20 candidates sent to 1/1 workers
[GP] gpu_0 intermediate update: 2253691.00 at gen 3300
[GPU 0] Gene injection: 20 candidates injected at gen 3400 (total so far: 320)
[GP] gpu_0 intermediate update: 2248680.00 at gen 3400

==================================================
GP ANALYSIS - Cycle 17
  Collected 100 solutions
==================================================

[GP] ========== GENETIC PROGRAMMING ANALYSIS STARTED ==========
[GP] Cycle: 16
[GP] Input: 100 solutions received for analysis
[GP] Fitness range: best=2248680.00, worst=2248680.00
[GP] Analysis config: blocks=True, fft=False, similarity=False
[GP] Starting analysis...
[GP] Phase 1: Extracting building blocks...

*** [GPU 0] NEW GLOBAL BEST: 2248680.00 at gen 3400 ***
    Saved to best_solution.json

[GPU 0] Gen  3400 | Best: 2248680.00 | 344.7s
[GP] Phase 1 complete: Found 0 building blocks
[GP] Phase 2: FFT analysis DISABLED
[GP] Phase 3: Similarity analysis DISABLED
[GP] ========== GP ANALYSIS COMPLETE ==========


[GP] ========== CANDIDATE GENERATION STARTED ==========
[GP] Generating 20 new candidate solutions
[GP] Available data: 100 top solutions, 0 building blocks, 0 FFT patterns, 0 similarity patterns
[GP] Generation strategy: 6 block-based, 6 interpolated, 8 mutated
[GP] Strategy 1: Creating 6 candidates via building block combination...
[GP] Strategy 1 complete: 6 block-based candidates created
[GP] Strategy 2: Creating 6 candidates via solution interpolation...
[GP] Strategy 2 complete: 6 interpolated candidates created
[GP] Strategy 3: Creating 8 candidates via guided mutation...
[GP] Strategy 3 complete: 8 mutated candidates created
[GP] Total candidates generated: 20
[GP] Strategy breakdown: Block=102, Interp=102, Mut=136
[GP] ========== CANDIDATE GENERATION COMPLETE ==========


*** [GPU 0] NEW GLOBAL BEST: 2246224.00 at gen 3500 ***
    Saved to best_solution.json

[GPU 0] Gen  3500 | Best: 2246224.00 | 354.8s
  -> 20 candidates sent to 1/1 workers
[GP] gpu_0 intermediate update: 2246224.00 at gen 3500
[GP] gpu_0 intermediate update: 2243400.00 at gen 3600

==================================================
GP ANALYSIS - Cycle 18
  Collected 100 solutions
==================================================

[GP] ========== GENETIC PROGRAMMING ANALYSIS STARTED ==========
[GP] Cycle: 17
[GP] Input: 100 solutions received for analysis
[GP] Fitness range: best=2243400.00, worst=2243400.00
[GP] Analysis config: blocks=True, fft=False, similarity=False
[GP] Starting analysis...
[GP] Phase 1: Extracting building blocks...
[GPU 0] Gene injection: 20 candidates injected at gen 3600 (total so far: 340)

*** [GPU 0] NEW GLOBAL BEST: 2243400.00 at gen 3600 ***
    Saved to best_solution.json

[GPU 0] Gen  3600 | Best: 2243400.00 | 365.3s
[GP] Phase 1 complete: Found 0 building blocks
[GP] Phase 2: FFT analysis DISABLED
[GP] Phase 3: Similarity analysis DISABLED
[GP] ========== GP ANALYSIS COMPLETE ==========


[GP] ========== CANDIDATE GENERATION STARTED ==========
[GP] Generating 20 new candidate solutions
[GP] Available data: 100 top solutions, 0 building blocks, 0 FFT patterns, 0 similarity patterns
[GP] Generation strategy: 6 block-based, 6 interpolated, 8 mutated
[GP] Strategy 1: Creating 6 candidates via building block combination...
[GP] Strategy 1 complete: 6 block-based candidates created
[GP] Strategy 2: Creating 6 candidates via solution interpolation...
[GP] Strategy 2 complete: 6 interpolated candidates created
[GP] Strategy 3: Creating 8 candidates via guided mutation...
[GP] Strategy 3 complete: 8 mutated candidates created
[GP] Total candidates generated: 20
[GP] Strategy breakdown: Block=108, Interp=108, Mut=144
[GP] ========== CANDIDATE GENERATION COMPLETE ==========


*** [GPU 0] NEW GLOBAL BEST: 2240012.00 at gen 3700 ***
    Saved to best_solution.json

[GPU 0] Gen  3700 | Best: 2240012.00 | 375.6s
  -> 20 candidates sent to 1/1 workers
[GP] gpu_0 intermediate update: 2240012.00 at gen 3700
[GP] gpu_0 intermediate update: 2238504.00 at gen 3800
[GPU 0] Gene injection: 20 candidates injected at gen 3800 (total so far: 360)

==================================================
GP ANALYSIS - Cycle 19
  Collected 100 solutions
==================================================

[GP] ========== GENETIC PROGRAMMING ANALYSIS STARTED ==========
[GP] Cycle: 18
[GP] Input: 100 solutions received for analysis
[GP] Fitness range: best=2238504.00, worst=2239098.00
[GP] Analysis config: blocks=True, fft=False, similarity=False
[GP] Starting analysis...
[GP] Phase 1: Extracting building blocks...

*** [GPU 0] NEW GLOBAL BEST: 2238504.00 at gen 3800 ***
    Saved to best_solution.json

[GPU 0] Gen  3800 | Best: 2238504.00 | 385.7s
[GP] Phase 1 complete: Found 0 building blocks
[GP] Phase 2: FFT analysis DISABLED
[GP] Phase 3: Similarity analysis DISABLED
[GP] ========== GP ANALYSIS COMPLETE ==========


[GP] ========== CANDIDATE GENERATION STARTED ==========
[GP] Generating 20 new candidate solutions
[GP] Available data: 100 top solutions, 0 building blocks, 0 FFT patterns, 0 similarity patterns
[GP] Generation strategy: 6 block-based, 6 interpolated, 8 mutated
[GP] Strategy 1: Creating 6 candidates via building block combination...
[GP] Strategy 1 complete: 6 block-based candidates created
[GP] Strategy 2: Creating 6 candidates via solution interpolation...
[GP] Strategy 2 complete: 6 interpolated candidates created
[GP] Strategy 3: Creating 8 candidates via guided mutation...
[GP] Strategy 3 complete: 8 mutated candidates created
[GP] Total candidates generated: 20
[GP] Strategy breakdown: Block=114, Interp=114, Mut=152
[GP] ========== CANDIDATE GENERATION COMPLETE ==========


*** [GPU 0] NEW GLOBAL BEST: 2233753.00 at gen 3900 ***
    Saved to best_solution.json

[GPU 0] Gen  3900 | Best: 2233753.00 | 395.9s
  -> 20 candidates sent to 1/1 workers
[GP] gpu_0 intermediate update: 2233753.00 at gen 3900
[GP] gpu_0 intermediate update: 2229102.00 at gen 4000
[GPU 0] Gene injection: 20 candidates injected at gen 4000 (total so far: 380)

*** [GPU 0] NEW GLOBAL BEST: 2228013.00 at gen 4000 ***
    Saved to best_solution.json

[GPU 0] Gen  4000 | Best: 2228013.00 | 406.3s

==================================================
GP ANALYSIS - Cycle 20
  Collected 100 solutions
==================================================

[GP] ========== GENETIC PROGRAMMING ANALYSIS STARTED ==========
[GP] Cycle: 19
[GP] Input: 100 solutions received for analysis
[GP] Fitness range: best=2228013.00, worst=2229102.00
[GP] Analysis config: blocks=True, fft=False, similarity=False
[GP] Starting analysis...
[GP] Phase 1: Extracting building blocks...
    [Checkpoint] Saved to ./results/warm_start/blocks_only/gr431/1R20/job_times_9_seed0_4000.json
[GP] Phase 1 complete: Found 0 building blocks
[GP] Phase 2: FFT analysis DISABLED
[GP] Phase 3: Similarity analysis DISABLED
[GP] ========== GP ANALYSIS COMPLETE ==========


[GP] ========== CANDIDATE GENERATION STARTED ==========
[GP] Generating 20 new candidate solutions
[GP] Available data: 100 top solutions, 0 building blocks, 0 FFT patterns, 0 similarity patterns
[GP] Generation strategy: 6 block-based, 6 interpolated, 8 mutated
[GP] Strategy 1: Creating 6 candidates via building block combination...
[GP] Strategy 1 complete: 6 block-based candidates created
[GP] Strategy 2: Creating 6 candidates via solution interpolation...
[GP] Strategy 2 complete: 6 interpolated candidates created
[GP] Strategy 3: Creating 8 candidates via guided mutation...
[GP] Strategy 3 complete: 8 mutated candidates created
[GP] Total candidates generated: 20
[GP] Strategy breakdown: Block=120, Interp=120, Mut=160
[GP] ========== CANDIDATE GENERATION COMPLETE ==========

  -> 20 candidates sent to 1/1 workers

[CHECKPOINT] Saved D.json at gen 4000 (makespan: 2228013.00)
[GP] gpu_0 intermediate update: 2228013.00 at gen 4000

*** [GPU 0] NEW GLOBAL BEST: 2220602.00 at gen 4100 ***
    Saved to best_solution.json

[GPU 0] Gen  4100 | Best: 2220602.00 | 416.4s
[GP] gpu_0 intermediate update: 2220602.00 at gen 4100
[GP] gpu_0 intermediate update: 2216718.00 at gen 4200
[GPU 0] Gene injection: 20 candidates injected at gen 4200 (total so far: 400)

==================================================
GP ANALYSIS - Cycle 21
  Collected 100 solutions
==================================================

[GP] ========== GENETIC PROGRAMMING ANALYSIS STARTED ==========
[GP] Cycle: 20
[GP] Input: 100 solutions received for analysis
[GP] Fitness range: best=2216718.00, worst=2216718.00
[GP] Analysis config: blocks=True, fft=False, similarity=False
[GP] Starting analysis...
[GP] Phase 1: Extracting building blocks...

*** [GPU 0] NEW GLOBAL BEST: 2216718.00 at gen 4200 ***
    Saved to best_solution.json

[GPU 0] Gen  4200 | Best: 2216718.00 | 426.4s
[GP] Phase 1 complete: Found 12 building blocks
[GP] Phase 2: FFT analysis DISABLED
[GP] Phase 3: Similarity analysis DISABLED
[GP] ========== GP ANALYSIS COMPLETE ==========


[GP] ========== CANDIDATE GENERATION STARTED ==========
[GP] Generating 20 new candidate solutions
[GP] Available data: 100 top solutions, 12 building blocks, 0 FFT patterns, 0 similarity patterns
[GP] Generation strategy: 6 block-based, 6 interpolated, 8 mutated
[GP] Strategy 1: Creating 6 candidates via building block combination...
[GP] Strategy 1 complete: 6 block-based candidates created
[GP] Strategy 2: Creating 6 candidates via solution interpolation...
[GP] Strategy 2 complete: 6 interpolated candidates created
[GP] Strategy 3: Creating 8 candidates via guided mutation...
[GP] Strategy 3 complete: 8 mutated candidates created
[GP] Total candidates generated: 20
[GP] Strategy breakdown: Block=126, Interp=126, Mut=168
[GP] ========== CANDIDATE GENERATION COMPLETE ==========


*** [GPU 0] NEW GLOBAL BEST: 2214432.00 at gen 4300 ***
    Saved to best_solution.json

[GPU 0] Gen  4300 | Best: 2214432.00 | 436.8s
  -> 20 candidates sent to 1/1 workers
[GP] gpu_0 intermediate update: 2214432.00 at gen 4300
[GP] gpu_0 intermediate update: 2212976.00 at gen 4400
[GPU 0] Gene injection: 20 candidates injected at gen 4400 (total so far: 420)

==================================================
GP ANALYSIS - Cycle 22
  Collected 100 solutions
==================================================

[GP] ========== GENETIC PROGRAMMING ANALYSIS STARTED ==========
[GP] Cycle: 21
[GP] Input: 100 solutions received for analysis
[GP] Fitness range: best=2211936.00, worst=2212976.00
[GP] Analysis config: blocks=True, fft=False, similarity=False
[GP] Starting analysis...
[GP] Phase 1: Extracting building blocks...

*** [GPU 0] NEW GLOBAL BEST: 2211936.00 at gen 4400 ***
    Saved to best_solution.json

[GPU 0] Gen  4400 | Best: 2211936.00 | 447.1s
[GP] Phase 1 complete: Found 22 building blocks
[GP] Phase 2: FFT analysis DISABLED
[GP] Phase 3: Similarity analysis DISABLED
[GP] ========== GP ANALYSIS COMPLETE ==========


[GP] ========== CANDIDATE GENERATION STARTED ==========
[GP] Generating 20 new candidate solutions
[GP] Available data: 100 top solutions, 22 building blocks, 0 FFT patterns, 0 similarity patterns
[GP] Generation strategy: 6 block-based, 6 interpolated, 8 mutated
[GP] Strategy 1: Creating 6 candidates via building block combination...
[GP] Strategy 1 complete: 6 block-based candidates created
[GP] Strategy 2: Creating 6 candidates via solution interpolation...
[GP] Strategy 2 complete: 6 interpolated candidates created
[GP] Strategy 3: Creating 8 candidates via guided mutation...
[GP] Strategy 3 complete: 8 mutated candidates created
[GP] Total candidates generated: 20
[GP] Strategy breakdown: Block=132, Interp=132, Mut=176
[GP] ========== CANDIDATE GENERATION COMPLETE ==========

  -> 20 candidates sent to 1/1 workers
[GP] gpu_0 intermediate update: 2211936.00 at gen 4400

*** [GPU 0] NEW GLOBAL BEST: 2205828.00 at gen 4500 ***
    Saved to best_solution.json

[GPU 0] Gen  4500 | Best: 2205828.00 | 457.2s
[GP] gpu_0 intermediate update: 2205828.00 at gen 4500
[GPU 0] Gene injection: 20 candidates injected at gen 4600 (total so far: 440)
[GP] gpu_0 intermediate update: 2202848.00 at gen 4600

==================================================
GP ANALYSIS - Cycle 23
  Collected 100 solutions
==================================================

[GP] ========== GENETIC PROGRAMMING ANALYSIS STARTED ==========
[GP] Cycle: 22
[GP] Input: 100 solutions received for analysis
[GP] Fitness range: best=2202848.00, worst=2203076.00
[GP] Analysis config: blocks=True, fft=False, similarity=False
[GP] Starting analysis...
[GP] Phase 1: Extracting building blocks...

*** [GPU 0] NEW GLOBAL BEST: 2202848.00 at gen 4600 ***
    Saved to best_solution.json

[GPU 0] Gen  4600 | Best: 2202848.00 | 467.3s
[GP] Phase 1 complete: Found 8 building blocks
[GP] Phase 2: FFT analysis DISABLED
[GP] Phase 3: Similarity analysis DISABLED
[GP] ========== GP ANALYSIS COMPLETE ==========


[GP] ========== CANDIDATE GENERATION STARTED ==========
[GP] Generating 20 new candidate solutions
[GP] Available data: 100 top solutions, 8 building blocks, 0 FFT patterns, 0 similarity patterns
[GP] Generation strategy: 6 block-based, 6 interpolated, 8 mutated
[GP] Strategy 1: Creating 6 candidates via building block combination...
[GP] Strategy 1 complete: 6 block-based candidates created
[GP] Strategy 2: Creating 6 candidates via solution interpolation...
[GP] Strategy 2 complete: 6 interpolated candidates created
[GP] Strategy 3: Creating 8 candidates via guided mutation...
[GP] Strategy 3 complete: 8 mutated candidates created
[GP] Total candidates generated: 20
[GP] Strategy breakdown: Block=138, Interp=138, Mut=184
[GP] ========== CANDIDATE GENERATION COMPLETE ==========


*** [GPU 0] NEW GLOBAL BEST: 2194534.00 at gen 4700 ***
    Saved to best_solution.json

[GPU 0] Gen  4700 | Best: 2194534.00 | 477.3s
  -> 20 candidates sent to 1/1 workers
[GP] gpu_0 intermediate update: 2194534.00 at gen 4700
[GPU 0] Gene injection: 20 candidates injected at gen 4800 (total so far: 460)
[GP] gpu_0 intermediate update: 2194203.00 at gen 4800

==================================================
GP ANALYSIS - Cycle 24
  Collected 100 solutions
==================================================

[GP] ========== GENETIC PROGRAMMING ANALYSIS STARTED ==========
[GP] Cycle: 23
[GP] Input: 100 solutions received for analysis
[GP] Fitness range: best=2194203.00, worst=2194203.00
[GP] Analysis config: blocks=True, fft=False, similarity=False
[GP] Starting analysis...
[GP] Phase 1: Extracting building blocks...

*** [GPU 0] NEW GLOBAL BEST: 2194203.00 at gen 4800 ***
    Saved to best_solution.json

[GPU 0] Gen  4800 | Best: 2194203.00 | 487.6s
[GP] Phase 1 complete: Found 19 building blocks
[GP] Phase 2: FFT analysis DISABLED
[GP] Phase 3: Similarity analysis DISABLED
[GP] ========== GP ANALYSIS COMPLETE ==========


[GP] ========== CANDIDATE GENERATION STARTED ==========
[GP] Generating 20 new candidate solutions
[GP] Available data: 100 top solutions, 19 building blocks, 0 FFT patterns, 0 similarity patterns
[GP] Generation strategy: 6 block-based, 6 interpolated, 8 mutated
[GP] Strategy 1: Creating 6 candidates via building block combination...
[GP] Strategy 1 complete: 6 block-based candidates created
[GP] Strategy 2: Creating 6 candidates via solution interpolation...
[GP] Strategy 2 complete: 6 interpolated candidates created
[GP] Strategy 3: Creating 8 candidates via guided mutation...
[GP] Strategy 3 complete: 8 mutated candidates created
[GP] Total candidates generated: 20
[GP] Strategy breakdown: Block=144, Interp=144, Mut=192
[GP] ========== CANDIDATE GENERATION COMPLETE ==========


*** [GPU 0] NEW GLOBAL BEST: 2191048.00 at gen 4900 ***
    Saved to best_solution.json

[GPU 0] Gen  4900 | Best: 2191048.00 | 497.8s
  -> 20 candidates sent to 1/1 workers
[GP] gpu_0 intermediate update: 2191048.00 at gen 4900
[GP] gpu_0 intermediate update: 2186858.00 at gen 5000
[GPU 0] Gene injection: 20 candidates injected at gen 5000 (total so far: 480)
[GPU 0] Evolution complete. Sending final results...
[GP] Worker finished: gpu_0 (best=2186858.00)

==================================================
GP ANALYSIS - Cycle 25
  Collected 100 solutions
==================================================

[GP] ========== GENETIC PROGRAMMING ANALYSIS STARTED ==========
[GP] Cycle: 24
[GP] Input: 100 solutions received for analysis
[GP] Fitness range: best=2186858.00, worst=2186858.00
[GP] Analysis config: blocks=True, fft=False, similarity=False
[GP] Starting analysis...
[GP] Phase 1: Extracting building blocks...
[GP] Phase 1 complete: Found 0 building blocks
[GP] Phase 2: FFT analysis DISABLED
[GP] Phase 3: Similarity analysis DISABLED
[GP] ========== GP ANALYSIS COMPLETE ==========


[GP] ========== CANDIDATE GENERATION STARTED ==========
[GP] Generating 20 new candidate solutions
[GP] Available data: 100 top solutions, 0 building blocks, 0 FFT patterns, 0 similarity patterns
[GP] Generation strategy: 6 block-based, 6 interpolated, 8 mutated
[GP] Strategy 1: Creating 6 candidates via building block combination...
[GP] Strategy 1 complete: 6 block-based candidates created
[GP] Strategy 2: Creating 6 candidates via solution interpolation...
[GP] Strategy 2 complete: 6 interpolated candidates created
[GP] Strategy 3: Creating 8 candidates via guided mutation...
[GP] Strategy 3 complete: 8 mutated candidates created
[GP] Total candidates generated: 20
[GP] Strategy breakdown: Block=150, Interp=150, Mut=200
[GP] ========== CANDIDATE GENERATION COMPLETE ==========

  -> 20 candidates sent to 1/1 workers

[CHECKPOINT] Saved E.json at gen 5000 (makespan: 2186858.00)

[GP] All workers finished. Total GP cycles: 25

[Final Collection] Have 1/1 workers. Waiting up to 120s for remaining...

[Critical] Attempting final result collection before terminating workers...

[Results Summary] Collected 1 results:
  gpu_0: fitness=2186858.00, intermediate=False, gen=final

======================================================================
COMPLETE
======================================================================
Best: 2186858.00 from gpu_0
  (Improved 68.5% over heuristic 6941500.00)
Time: 510.5s
Total candidates injected: 480

Solution JSON saved to ./results/warm_start/blocks_only/gr431/1R20/job_times_9_seed0.json
HTML Gantt chart saved to: ./results/warm_start/blocks_only/gr431/1R20/job_times_9_seed0.html
