Setting random seed to 0
DEBUG: proc shape: (431,), agents: 6, resources: 4, n: 431

======================================================================
LOADING INITIAL SOLUTION FROM JSON
======================================================================
Loaded heuristic solution: Savings with makespan 5953012.00
File: ./results/heuristics_only/gr431/1R20/job_times_1_heuristics.json
Makespan: 5953012.00
Status: SUCCESS - Will use as warm start
======================================================================


======================================================================
VRP-RPD SOLVER
======================================================================
Problem: 430 customers, 6 agents, k=4
Heuristic: None
Genetic Programming: Yes
Warm Start: Yes
Gene Injection: Yes
Workers: 1 GPU + 0 CPU
Generations: 5000
======================================================================

Using solution from JSON file as warm start...
  JSON solution: 5953012.00
Skipping heuristic re-computation (using JSON solution + perturbations)

Generated 6 warm start chromosomes from JSON

[GP] Starting GP collection loop (timeout: 12975s)...
[GPU 0] Warm start: 6 chromosomes

*** [GPU 0] NEW GLOBAL BEST: 3741672.00 at gen 0 ***
    Saved to best_solution.json

[GPU 0] Gen     0 | Best: 3741672.00 | 0.5s
[GP] gpu_0 first intermediate: 3741672.00 at gen 0

*** [GPU 0] NEW GLOBAL BEST: 2729539.00 at gen 100 ***
    Saved to best_solution.json

[GPU 0] Gen   100 | Best: 2729539.00 | 14.0s
[GP] gpu_0 intermediate update: 2729539.00 at gen 100
[GP] gpu_0 intermediate update: 2606243.00 at gen 200

==================================================
GP ANALYSIS - Cycle 1
  Collected 100 solutions
==================================================

[GP] ========== GENETIC PROGRAMMING ANALYSIS STARTED ==========
[GP] Cycle: 0
[GP] Input: 100 solutions received for analysis
[GP] Fitness range: best=2606243.00, worst=2606965.00
[GP] Analysis config: blocks=True, fft=False, similarity=False
[GP] Starting analysis...
[GP] Phase 1: Extracting building blocks...
[GP] Phase 1 complete: Found 11 building blocks
[GP] Phase 2: FFT analysis DISABLED
[GP] Phase 3: Similarity analysis DISABLED
[GP] ========== GP ANALYSIS COMPLETE ==========


[GP] ========== CANDIDATE GENERATION STARTED ==========
[GP] Generating 20 new candidate solutions
[GP] Available data: 100 top solutions, 11 building blocks, 0 FFT patterns, 0 similarity patterns
[GP] Generation strategy: 6 block-based, 6 interpolated, 8 mutated
[GP] Strategy 1: Creating 6 candidates via building block combination...
[GP] Strategy 1 complete: 6 block-based candidates created
[GP] Strategy 2: Creating 6 candidates via solution interpolation...
[GP] Strategy 2 complete: 6 interpolated candidates created
[GP] Strategy 3: Creating 8 candidates via guided mutation...
[GP] Strategy 3 complete: 8 mutated candidates created
[GP] Total candidates generated: 20
[GP] Strategy breakdown: Block=6, Interp=6, Mut=8
[GP] ========== CANDIDATE GENERATION COMPLETE ==========


*** [GPU 0] NEW GLOBAL BEST: 2606243.00 at gen 200 ***
    Saved to best_solution.json

[GPU 0] Gen   200 | Best: 2606243.00 | 27.7s

*** [GPU 0] NEW GLOBAL BEST: 2521828.00 at gen 300 ***
    Saved to best_solution.json

[GPU 0] Gen   300 | Best: 2521828.00 | 41.7s
  -> 20 candidates sent to 1/1 workers
[GP] gpu_0 intermediate update: 2521828.00 at gen 300
[GP] gpu_0 intermediate update: 2479823.00 at gen 400
[GPU 0] Gene injection: 20 candidates injected at gen 400 (total so far: 20)

==================================================
GP ANALYSIS - Cycle 2
  Collected 100 solutions
==================================================

[GP] ========== GENETIC PROGRAMMING ANALYSIS STARTED ==========
[GP] Cycle: 1
[GP] Input: 100 solutions received for analysis
[GP] Fitness range: best=2479094.00, worst=2479823.00
[GP] Analysis config: blocks=True, fft=False, similarity=False
[GP] Starting analysis...
[GP] Phase 1: Extracting building blocks...

*** [GPU 0] NEW GLOBAL BEST: 2479094.00 at gen 400 ***
    Saved to best_solution.json

[GPU 0] Gen   400 | Best: 2479094.00 | 55.7s
[GP] Phase 1 complete: Found 5 building blocks
[GP] Phase 2: FFT analysis DISABLED
[GP] Phase 3: Similarity analysis DISABLED
[GP] ========== GP ANALYSIS COMPLETE ==========


[GP] ========== CANDIDATE GENERATION STARTED ==========
[GP] Generating 20 new candidate solutions
[GP] Available data: 100 top solutions, 5 building blocks, 0 FFT patterns, 0 similarity patterns
[GP] Generation strategy: 6 block-based, 6 interpolated, 8 mutated
[GP] Strategy 1: Creating 6 candidates via building block combination...
[GP] Strategy 1 complete: 6 block-based candidates created
[GP] Strategy 2: Creating 6 candidates via solution interpolation...
[GP] Strategy 2 complete: 6 interpolated candidates created
[GP] Strategy 3: Creating 8 candidates via guided mutation...
[GP] Strategy 3 complete: 8 mutated candidates created
[GP] Total candidates generated: 20
[GP] Strategy breakdown: Block=12, Interp=12, Mut=16
[GP] ========== CANDIDATE GENERATION COMPLETE ==========

  -> 20 candidates sent to 1/1 workers
[GP] gpu_0 intermediate update: 2479094.00 at gen 400

*** [GPU 0] NEW GLOBAL BEST: 2444480.00 at gen 500 ***
    Saved to best_solution.json

[GPU 0] Gen   500 | Best: 2444480.00 | 69.0s
[GP] gpu_0 intermediate update: 2444480.00 at gen 500
[GP] gpu_0 intermediate update: 2411659.00 at gen 600
[GPU 0] Gene injection: 20 candidates injected at gen 600 (total so far: 40)

==================================================
GP ANALYSIS - Cycle 3
  Collected 100 solutions
==================================================

[GP] ========== GENETIC PROGRAMMING ANALYSIS STARTED ==========
[GP] Cycle: 2
[GP] Input: 100 solutions received for analysis
[GP] Fitness range: best=2411659.00, worst=2412917.00
[GP] Analysis config: blocks=True, fft=False, similarity=False
[GP] Starting analysis...
[GP] Phase 1: Extracting building blocks...

*** [GPU 0] NEW GLOBAL BEST: 2411659.00 at gen 600 ***
    Saved to best_solution.json

[GPU 0] Gen   600 | Best: 2411659.00 | 82.9s
[GP] Phase 1 complete: Found 30 building blocks
[GP] Phase 2: FFT analysis DISABLED
[GP] Phase 3: Similarity analysis DISABLED
[GP] ========== GP ANALYSIS COMPLETE ==========


[GP] ========== CANDIDATE GENERATION STARTED ==========
[GP] Generating 20 new candidate solutions
[GP] Available data: 100 top solutions, 30 building blocks, 0 FFT patterns, 0 similarity patterns
[GP] Generation strategy: 6 block-based, 6 interpolated, 8 mutated
[GP] Strategy 1: Creating 6 candidates via building block combination...
[GP] Strategy 1 complete: 6 block-based candidates created
[GP] Strategy 2: Creating 6 candidates via solution interpolation...
[GP] Strategy 2 complete: 6 interpolated candidates created
[GP] Strategy 3: Creating 8 candidates via guided mutation...
[GP] Strategy 3 complete: 8 mutated candidates created
[GP] Total candidates generated: 20
[GP] Strategy breakdown: Block=18, Interp=18, Mut=24
[GP] ========== CANDIDATE GENERATION COMPLETE ==========


*** [GPU 0] NEW GLOBAL BEST: 2369379.00 at gen 700 ***
    Saved to best_solution.json

[GPU 0] Gen   700 | Best: 2369379.00 | 96.3s
  -> 20 candidates sent to 1/1 workers
[GP] gpu_0 intermediate update: 2369379.00 at gen 700
[GP] gpu_0 intermediate update: 2339678.00 at gen 800
[GPU 0] Gene injection: 20 candidates injected at gen 800 (total so far: 60)

==================================================
GP ANALYSIS - Cycle 4
  Collected 100 solutions
==================================================

[GP] ========== GENETIC PROGRAMMING ANALYSIS STARTED ==========
[GP] Cycle: 3
[GP] Input: 100 solutions received for analysis
[GP] Fitness range: best=2339678.00, worst=2340283.00
[GP] Analysis config: blocks=True, fft=False, similarity=False
[GP] Starting analysis...
[GP] Phase 1: Extracting building blocks...

*** [GPU 0] NEW GLOBAL BEST: 2339678.00 at gen 800 ***
    Saved to best_solution.json

[GPU 0] Gen   800 | Best: 2339678.00 | 110.2s
[GP] Phase 1 complete: Found 9 building blocks
[GP] Phase 2: FFT analysis DISABLED
[GP] Phase 3: Similarity analysis DISABLED
[GP] ========== GP ANALYSIS COMPLETE ==========


[GP] ========== CANDIDATE GENERATION STARTED ==========
[GP] Generating 20 new candidate solutions
[GP] Available data: 100 top solutions, 9 building blocks, 0 FFT patterns, 0 similarity patterns
[GP] Generation strategy: 6 block-based, 6 interpolated, 8 mutated
[GP] Strategy 1: Creating 6 candidates via building block combination...
[GP] Strategy 1 complete: 6 block-based candidates created
[GP] Strategy 2: Creating 6 candidates via solution interpolation...
[GP] Strategy 2 complete: 6 interpolated candidates created
[GP] Strategy 3: Creating 8 candidates via guided mutation...
[GP] Strategy 3 complete: 8 mutated candidates created
[GP] Total candidates generated: 20
[GP] Strategy breakdown: Block=24, Interp=24, Mut=32
[GP] ========== CANDIDATE GENERATION COMPLETE ==========


*** [GPU 0] NEW GLOBAL BEST: 2315129.00 at gen 900 ***
    Saved to best_solution.json

[GPU 0] Gen   900 | Best: 2315129.00 | 124.1s
  -> 20 candidates sent to 1/1 workers
[GP] gpu_0 intermediate update: 2315129.00 at gen 900
[GP] gpu_0 intermediate update: 2303665.00 at gen 1000
[GPU 0] Gene injection: 20 candidates injected at gen 1000 (total so far: 80)

==================================================
GP ANALYSIS - Cycle 5
  Collected 100 solutions
==================================================

[GP] ========== GENETIC PROGRAMMING ANALYSIS STARTED ==========
[GP] Cycle: 4
[GP] Input: 100 solutions received for analysis
[GP] Fitness range: best=2303665.00, worst=2303665.00
[GP] Analysis config: blocks=True, fft=False, similarity=False
[GP] Starting analysis...
[GP] Phase 1: Extracting building blocks...

*** [GPU 0] NEW GLOBAL BEST: 2303665.00 at gen 1000 ***
    Saved to best_solution.json

[GPU 0] Gen  1000 | Best: 2303665.00 | 138.3s
    [Checkpoint] Saved to ./results/warm_start/blocks_only/gr431/1R20/job_times_1_seed0_1000.json
[GP] Phase 1 complete: Found 26 building blocks
[GP] Phase 2: FFT analysis DISABLED
[GP] Phase 3: Similarity analysis DISABLED
[GP] ========== GP ANALYSIS COMPLETE ==========


[GP] ========== CANDIDATE GENERATION STARTED ==========
[GP] Generating 20 new candidate solutions
[GP] Available data: 100 top solutions, 26 building blocks, 0 FFT patterns, 0 similarity patterns
[GP] Generation strategy: 6 block-based, 6 interpolated, 8 mutated
[GP] Strategy 1: Creating 6 candidates via building block combination...
[GP] Strategy 1 complete: 6 block-based candidates created
[GP] Strategy 2: Creating 6 candidates via solution interpolation...
[GP] Strategy 2 complete: 6 interpolated candidates created
[GP] Strategy 3: Creating 8 candidates via guided mutation...
[GP] Strategy 3 complete: 8 mutated candidates created
[GP] Total candidates generated: 20
[GP] Strategy breakdown: Block=30, Interp=30, Mut=40
[GP] ========== CANDIDATE GENERATION COMPLETE ==========

  -> 20 candidates sent to 1/1 workers

[CHECKPOINT] Saved A.json at gen 1000 (makespan: 2303665.00)

*** [GPU 0] NEW GLOBAL BEST: 2286170.00 at gen 1100 ***
    Saved to best_solution.json

[GPU 0] Gen  1100 | Best: 2286170.00 | 151.7s
[GP] gpu_0 intermediate update: 2286170.00 at gen 1100
[GP] gpu_0 intermediate update: 2272223.00 at gen 1200
[GPU 0] Gene injection: 20 candidates injected at gen 1200 (total so far: 100)

==================================================
GP ANALYSIS - Cycle 6
  Collected 100 solutions
==================================================

[GP] ========== GENETIC PROGRAMMING ANALYSIS STARTED ==========
[GP] Cycle: 5
[GP] Input: 100 solutions received for analysis
[GP] Fitness range: best=2272223.00, worst=2272572.00
[GP] Analysis config: blocks=True, fft=False, similarity=False
[GP] Starting analysis...
[GP] Phase 1: Extracting building blocks...

*** [GPU 0] NEW GLOBAL BEST: 2272223.00 at gen 1200 ***
    Saved to best_solution.json

[GPU 0] Gen  1200 | Best: 2272223.00 | 165.6s
[GP] Phase 1 complete: Found 0 building blocks
[GP] Phase 2: FFT analysis DISABLED
[GP] Phase 3: Similarity analysis DISABLED
[GP] ========== GP ANALYSIS COMPLETE ==========


[GP] ========== CANDIDATE GENERATION STARTED ==========
[GP] Generating 20 new candidate solutions
[GP] Available data: 100 top solutions, 0 building blocks, 0 FFT patterns, 0 similarity patterns
[GP] Generation strategy: 6 block-based, 6 interpolated, 8 mutated
[GP] Strategy 1: Creating 6 candidates via building block combination...
[GP] Strategy 1 complete: 6 block-based candidates created
[GP] Strategy 2: Creating 6 candidates via solution interpolation...
[GP] Strategy 2 complete: 6 interpolated candidates created
[GP] Strategy 3: Creating 8 candidates via guided mutation...
[GP] Strategy 3 complete: 8 mutated candidates created
[GP] Total candidates generated: 20
[GP] Strategy breakdown: Block=36, Interp=36, Mut=48
[GP] ========== CANDIDATE GENERATION COMPLETE ==========


*** [GPU 0] NEW GLOBAL BEST: 2258037.00 at gen 1300 ***
    Saved to best_solution.json

[GPU 0] Gen  1300 | Best: 2258037.00 | 179.4s
  -> 20 candidates sent to 1/1 workers
[GP] gpu_0 intermediate update: 2258037.00 at gen 1300
[GPU 0] Gene injection: 20 candidates injected at gen 1400 (total so far: 120)
[GP] gpu_0 intermediate update: 2239570.00 at gen 1400

==================================================
GP ANALYSIS - Cycle 7
  Collected 100 solutions
==================================================

[GP] ========== GENETIC PROGRAMMING ANALYSIS STARTED ==========
[GP] Cycle: 6
[GP] Input: 100 solutions received for analysis
[GP] Fitness range: best=2239286.00, worst=2239570.00
[GP] Analysis config: blocks=True, fft=False, similarity=False
[GP] Starting analysis...
[GP] Phase 1: Extracting building blocks...

*** [GPU 0] NEW GLOBAL BEST: 2239286.00 at gen 1400 ***
    Saved to best_solution.json

[GPU 0] Gen  1400 | Best: 2239286.00 | 193.0s
[GP] Phase 1 complete: Found 0 building blocks
[GP] Phase 2: FFT analysis DISABLED
[GP] Phase 3: Similarity analysis DISABLED
[GP] ========== GP ANALYSIS COMPLETE ==========


[GP] ========== CANDIDATE GENERATION STARTED ==========
[GP] Generating 20 new candidate solutions
[GP] Available data: 100 top solutions, 0 building blocks, 0 FFT patterns, 0 similarity patterns
[GP] Generation strategy: 6 block-based, 6 interpolated, 8 mutated
[GP] Strategy 1: Creating 6 candidates via building block combination...
[GP] Strategy 1 complete: 6 block-based candidates created
[GP] Strategy 2: Creating 6 candidates via solution interpolation...
[GP] Strategy 2 complete: 6 interpolated candidates created
[GP] Strategy 3: Creating 8 candidates via guided mutation...
[GP] Strategy 3 complete: 8 mutated candidates created
[GP] Total candidates generated: 20
[GP] Strategy breakdown: Block=42, Interp=42, Mut=56
[GP] ========== CANDIDATE GENERATION COMPLETE ==========

  -> 20 candidates sent to 1/1 workers
[GP] gpu_0 intermediate update: 2239286.00 at gen 1400

*** [GPU 0] NEW GLOBAL BEST: 2231259.00 at gen 1500 ***
    Saved to best_solution.json

[GPU 0] Gen  1500 | Best: 2231259.00 | 206.8s
[GP] gpu_0 intermediate update: 2231259.00 at gen 1500
[GP] gpu_0 intermediate update: 2221992.00 at gen 1600
[GPU 0] Gene injection: 20 candidates injected at gen 1600 (total so far: 140)

==================================================
GP ANALYSIS - Cycle 8
  Collected 100 solutions
==================================================

[GP] ========== GENETIC PROGRAMMING ANALYSIS STARTED ==========
[GP] Cycle: 7
[GP] Input: 100 solutions received for analysis
[GP] Fitness range: best=2221665.00, worst=2221992.00
[GP] Analysis config: blocks=True, fft=False, similarity=False
[GP] Starting analysis...
[GP] Phase 1: Extracting building blocks...

*** [GPU 0] NEW GLOBAL BEST: 2221665.00 at gen 1600 ***
    Saved to best_solution.json

[GPU 0] Gen  1600 | Best: 2221665.00 | 220.5s
[GP] Phase 1 complete: Found 0 building blocks
[GP] Phase 2: FFT analysis DISABLED
[GP] Phase 3: Similarity analysis DISABLED
[GP] ========== GP ANALYSIS COMPLETE ==========


[GP] ========== CANDIDATE GENERATION STARTED ==========
[GP] Generating 20 new candidate solutions
[GP] Available data: 100 top solutions, 0 building blocks, 0 FFT patterns, 0 similarity patterns
[GP] Generation strategy: 6 block-based, 6 interpolated, 8 mutated
[GP] Strategy 1: Creating 6 candidates via building block combination...
[GP] Strategy 1 complete: 6 block-based candidates created
[GP] Strategy 2: Creating 6 candidates via solution interpolation...
[GP] Strategy 2 complete: 6 interpolated candidates created
[GP] Strategy 3: Creating 8 candidates via guided mutation...
[GP] Strategy 3 complete: 8 mutated candidates created
[GP] Total candidates generated: 20
[GP] Strategy breakdown: Block=48, Interp=48, Mut=64
[GP] ========== CANDIDATE GENERATION COMPLETE ==========

  -> 20 candidates sent to 1/1 workers
[GP] gpu_0 intermediate update: 2221665.00 at gen 1600

*** [GPU 0] NEW GLOBAL BEST: 2215476.00 at gen 1700 ***
    Saved to best_solution.json

[GPU 0] Gen  1700 | Best: 2215476.00 | 234.5s
[GP] gpu_0 intermediate update: 2215476.00 at gen 1700
[GP] gpu_0 intermediate update: 2207785.00 at gen 1800
[GPU 0] Gene injection: 20 candidates injected at gen 1800 (total so far: 160)

==================================================
GP ANALYSIS - Cycle 9
  Collected 100 solutions
==================================================

[GP] ========== GENETIC PROGRAMMING ANALYSIS STARTED ==========
[GP] Cycle: 8
[GP] Input: 100 solutions received for analysis
[GP] Fitness range: best=2207785.00, worst=2207785.00
[GP] Analysis config: blocks=True, fft=False, similarity=False
[GP] Starting analysis...
[GP] Phase 1: Extracting building blocks...

*** [GPU 0] NEW GLOBAL BEST: 2207785.00 at gen 1800 ***
    Saved to best_solution.json

[GPU 0] Gen  1800 | Best: 2207785.00 | 248.6s
[GP] Phase 1 complete: Found 5 building blocks
[GP] Phase 2: FFT analysis DISABLED
[GP] Phase 3: Similarity analysis DISABLED
[GP] ========== GP ANALYSIS COMPLETE ==========


[GP] ========== CANDIDATE GENERATION STARTED ==========
[GP] Generating 20 new candidate solutions
[GP] Available data: 100 top solutions, 5 building blocks, 0 FFT patterns, 0 similarity patterns
[GP] Generation strategy: 6 block-based, 6 interpolated, 8 mutated
[GP] Strategy 1: Creating 6 candidates via building block combination...
[GP] Strategy 1 complete: 6 block-based candidates created
[GP] Strategy 2: Creating 6 candidates via solution interpolation...
[GP] Strategy 2 complete: 6 interpolated candidates created
[GP] Strategy 3: Creating 8 candidates via guided mutation...
[GP] Strategy 3 complete: 8 mutated candidates created
[GP] Total candidates generated: 20
[GP] Strategy breakdown: Block=54, Interp=54, Mut=72
[GP] ========== CANDIDATE GENERATION COMPLETE ==========


*** [GPU 0] NEW GLOBAL BEST: 2196041.00 at gen 1900 ***
    Saved to best_solution.json

[GPU 0] Gen  1900 | Best: 2196041.00 | 262.1s
  -> 20 candidates sent to 1/1 workers
[GP] gpu_0 intermediate update: 2196041.00 at gen 1900
[GP] gpu_0 intermediate update: 2190212.00 at gen 2000
[GPU 0] Gene injection: 20 candidates injected at gen 2000 (total so far: 180)

==================================================
GP ANALYSIS - Cycle 10
  Collected 100 solutions
==================================================

[GP] ========== GENETIC PROGRAMMING ANALYSIS STARTED ==========
[GP] Cycle: 9
[GP] Input: 100 solutions received for analysis
[GP] Fitness range: best=2190212.00, worst=2190212.00
[GP] Analysis config: blocks=True, fft=False, similarity=False
[GP] Starting analysis...
[GP] Phase 1: Extracting building blocks...

*** [GPU 0] NEW GLOBAL BEST: 2190212.00 at gen 2000 ***
    Saved to best_solution.json

[GPU 0] Gen  2000 | Best: 2190212.00 | 276.1s
    [Checkpoint] Saved to ./results/warm_start/blocks_only/gr431/1R20/job_times_1_seed0_2000.json
[GP] Phase 1 complete: Found 10 building blocks
[GP] Phase 2: FFT analysis DISABLED
[GP] Phase 3: Similarity analysis DISABLED
[GP] ========== GP ANALYSIS COMPLETE ==========


[GP] ========== CANDIDATE GENERATION STARTED ==========
[GP] Generating 20 new candidate solutions
[GP] Available data: 100 top solutions, 10 building blocks, 0 FFT patterns, 0 similarity patterns
[GP] Generation strategy: 6 block-based, 6 interpolated, 8 mutated
[GP] Strategy 1: Creating 6 candidates via building block combination...
[GP] Strategy 1 complete: 6 block-based candidates created
[GP] Strategy 2: Creating 6 candidates via solution interpolation...
[GP] Strategy 2 complete: 6 interpolated candidates created
[GP] Strategy 3: Creating 8 candidates via guided mutation...
[GP] Strategy 3 complete: 8 mutated candidates created
[GP] Total candidates generated: 20
[GP] Strategy breakdown: Block=60, Interp=60, Mut=80
[GP] ========== CANDIDATE GENERATION COMPLETE ==========

  -> 20 candidates sent to 1/1 workers

[CHECKPOINT] Saved B.json at gen 2000 (makespan: 2190212.00)

*** [GPU 0] NEW GLOBAL BEST: 2178255.00 at gen 2100 ***
    Saved to best_solution.json

[GPU 0] Gen  2100 | Best: 2178255.00 | 289.7s
[GP] gpu_0 intermediate update: 2178255.00 at gen 2100
[GP] gpu_0 intermediate update: 2170245.00 at gen 2200
[GPU 0] Gene injection: 20 candidates injected at gen 2200 (total so far: 200)

==================================================
GP ANALYSIS - Cycle 11
  Collected 100 solutions
==================================================

[GP] ========== GENETIC PROGRAMMING ANALYSIS STARTED ==========
[GP] Cycle: 10
[GP] Input: 100 solutions received for analysis
[GP] Fitness range: best=2170245.00, worst=2170341.00
[GP] Analysis config: blocks=True, fft=False, similarity=False
[GP] Starting analysis...
[GP] Phase 1: Extracting building blocks...

*** [GPU 0] NEW GLOBAL BEST: 2170245.00 at gen 2200 ***
    Saved to best_solution.json

[GPU 0] Gen  2200 | Best: 2170245.00 | 303.7s
[GP] Phase 1 complete: Found 5 building blocks
[GP] Phase 2: FFT analysis DISABLED
[GP] Phase 3: Similarity analysis DISABLED
[GP] ========== GP ANALYSIS COMPLETE ==========


[GP] ========== CANDIDATE GENERATION STARTED ==========
[GP] Generating 20 new candidate solutions
[GP] Available data: 100 top solutions, 5 building blocks, 0 FFT patterns, 0 similarity patterns
[GP] Generation strategy: 6 block-based, 6 interpolated, 8 mutated
[GP] Strategy 1: Creating 6 candidates via building block combination...
[GP] Strategy 1 complete: 6 block-based candidates created
[GP] Strategy 2: Creating 6 candidates via solution interpolation...
[GP] Strategy 2 complete: 6 interpolated candidates created
[GP] Strategy 3: Creating 8 candidates via guided mutation...
[GP] Strategy 3 complete: 8 mutated candidates created
[GP] Total candidates generated: 20
[GP] Strategy breakdown: Block=66, Interp=66, Mut=88
[GP] ========== CANDIDATE GENERATION COMPLETE ==========


*** [GPU 0] NEW GLOBAL BEST: 2163458.00 at gen 2300 ***
    Saved to best_solution.json

[GPU 0] Gen  2300 | Best: 2163458.00 | 317.3s
  -> 20 candidates sent to 1/1 workers
[GP] gpu_0 intermediate update: 2163458.00 at gen 2300
[GP] gpu_0 intermediate update: 2159803.00 at gen 2400
[GPU 0] Gene injection: 20 candidates injected at gen 2400 (total so far: 220)

==================================================
GP ANALYSIS - Cycle 12
  Collected 100 solutions
==================================================

[GP] ========== GENETIC PROGRAMMING ANALYSIS STARTED ==========
[GP] Cycle: 11
[GP] Input: 100 solutions received for analysis
[GP] Fitness range: best=2159803.00, worst=2159803.00
[GP] Analysis config: blocks=True, fft=False, similarity=False
[GP] Starting analysis...
[GP] Phase 1: Extracting building blocks...

*** [GPU 0] NEW GLOBAL BEST: 2159803.00 at gen 2400 ***
    Saved to best_solution.json

[GPU 0] Gen  2400 | Best: 2159803.00 | 331.1s
[GP] Phase 1 complete: Found 0 building blocks
[GP] Phase 2: FFT analysis DISABLED
[GP] Phase 3: Similarity analysis DISABLED
[GP] ========== GP ANALYSIS COMPLETE ==========


[GP] ========== CANDIDATE GENERATION STARTED ==========
[GP] Generating 20 new candidate solutions
[GP] Available data: 100 top solutions, 0 building blocks, 0 FFT patterns, 0 similarity patterns
[GP] Generation strategy: 6 block-based, 6 interpolated, 8 mutated
[GP] Strategy 1: Creating 6 candidates via building block combination...
[GP] Strategy 1 complete: 6 block-based candidates created
[GP] Strategy 2: Creating 6 candidates via solution interpolation...
[GP] Strategy 2 complete: 6 interpolated candidates created
[GP] Strategy 3: Creating 8 candidates via guided mutation...
[GP] Strategy 3 complete: 8 mutated candidates created
[GP] Total candidates generated: 20
[GP] Strategy breakdown: Block=72, Interp=72, Mut=96
[GP] ========== CANDIDATE GENERATION COMPLETE ==========


*** [GPU 0] NEW GLOBAL BEST: 2153931.00 at gen 2500 ***
    Saved to best_solution.json

[GPU 0] Gen  2500 | Best: 2153931.00 | 344.5s
  -> 20 candidates sent to 1/1 workers
[GP] gpu_0 intermediate update: 2153931.00 at gen 2500
[GP] gpu_0 intermediate update: 2150893.00 at gen 2600
[GPU 0] Gene injection: 20 candidates injected at gen 2600 (total so far: 240)

==================================================
GP ANALYSIS - Cycle 13
  Collected 100 solutions
==================================================

[GP] ========== GENETIC PROGRAMMING ANALYSIS STARTED ==========
[GP] Cycle: 12
[GP] Input: 100 solutions received for analysis
[GP] Fitness range: best=2150893.00, worst=2150893.00
[GP] Analysis config: blocks=True, fft=False, similarity=False
[GP] Starting analysis...
[GP] Phase 1: Extracting building blocks...

*** [GPU 0] NEW GLOBAL BEST: 2150893.00 at gen 2600 ***
    Saved to best_solution.json

[GPU 0] Gen  2600 | Best: 2150893.00 | 357.8s
[GP] Phase 1 complete: Found 8 building blocks
[GP] Phase 2: FFT analysis DISABLED
[GP] Phase 3: Similarity analysis DISABLED
[GP] ========== GP ANALYSIS COMPLETE ==========


[GP] ========== CANDIDATE GENERATION STARTED ==========
[GP] Generating 20 new candidate solutions
[GP] Available data: 100 top solutions, 8 building blocks, 0 FFT patterns, 0 similarity patterns
[GP] Generation strategy: 6 block-based, 6 interpolated, 8 mutated
[GP] Strategy 1: Creating 6 candidates via building block combination...
[GP] Strategy 1 complete: 6 block-based candidates created
[GP] Strategy 2: Creating 6 candidates via solution interpolation...
[GP] Strategy 2 complete: 6 interpolated candidates created
[GP] Strategy 3: Creating 8 candidates via guided mutation...
[GP] Strategy 3 complete: 8 mutated candidates created
[GP] Total candidates generated: 20
[GP] Strategy breakdown: Block=78, Interp=78, Mut=104
[GP] ========== CANDIDATE GENERATION COMPLETE ==========


*** [GPU 0] NEW GLOBAL BEST: 2150827.00 at gen 2700 ***
    Saved to best_solution.json

[GPU 0] Gen  2700 | Best: 2150827.00 | 371.3s
  -> 20 candidates sent to 1/1 workers
[GP] gpu_0 intermediate update: 2150827.00 at gen 2700

==================================================
GP ANALYSIS - Cycle 14
  Collected 100 solutions
==================================================

[GP] ========== GENETIC PROGRAMMING ANALYSIS STARTED ==========
[GP] Cycle: 13
[GP] Input: 100 solutions received for analysis
[GP] Fitness range: best=2150827.00, worst=2150827.00
[GP] Analysis config: blocks=True, fft=False, similarity=False
[GP] Starting analysis...
[GP] Phase 1: Extracting building blocks...
[GPU 0] Gene injection: 20 candidates injected at gen 2800 (total so far: 260)
[GPU 0] Gen  2800 | Best: 2150827.00 | 385.0s
[GP] Phase 1 complete: Found 30 building blocks
[GP] Phase 2: FFT analysis DISABLED
[GP] Phase 3: Similarity analysis DISABLED
[GP] ========== GP ANALYSIS COMPLETE ==========


[GP] ========== CANDIDATE GENERATION STARTED ==========
[GP] Generating 20 new candidate solutions
[GP] Available data: 100 top solutions, 30 building blocks, 0 FFT patterns, 0 similarity patterns
[GP] Generation strategy: 6 block-based, 6 interpolated, 8 mutated
[GP] Strategy 1: Creating 6 candidates via building block combination...
[GP] Strategy 1 complete: 6 block-based candidates created
[GP] Strategy 2: Creating 6 candidates via solution interpolation...
[GP] Strategy 2 complete: 6 interpolated candidates created
[GP] Strategy 3: Creating 8 candidates via guided mutation...
[GP] Strategy 3 complete: 8 mutated candidates created
[GP] Total candidates generated: 20
[GP] Strategy breakdown: Block=84, Interp=84, Mut=112
[GP] ========== CANDIDATE GENERATION COMPLETE ==========

[GPU 0] Gen  2900 | Best: 2150827.00 | 398.7s
[GPU 0] Gene injection: 20 candidates injected at gen 3000 (total so far: 280)
  -> 20 candidates sent to 1/1 workers

==================================================
GP ANALYSIS - Cycle 15
  Collected 100 solutions
==================================================

[GP] ========== GENETIC PROGRAMMING ANALYSIS STARTED ==========
[GP] Cycle: 14
[GP] Input: 100 solutions received for analysis
[GP] Fitness range: best=2150827.00, worst=2150827.00
[GP] Analysis config: blocks=True, fft=False, similarity=False
[GP] Starting analysis...
[GP] Phase 1: Extracting building blocks...
[GPU 0] Gen  3000 | Best: 2150827.00 | 411.5s
    [Checkpoint] Saved to ./results/warm_start/blocks_only/gr431/1R20/job_times_1_seed0_3000.json
[GP] Phase 1 complete: Found 29 building blocks
[GP] Phase 2: FFT analysis DISABLED
[GP] Phase 3: Similarity analysis DISABLED
[GP] ========== GP ANALYSIS COMPLETE ==========


[GP] ========== CANDIDATE GENERATION STARTED ==========
[GP] Generating 20 new candidate solutions
[GP] Available data: 100 top solutions, 29 building blocks, 0 FFT patterns, 0 similarity patterns
[GP] Generation strategy: 6 block-based, 6 interpolated, 8 mutated
[GP] Strategy 1: Creating 6 candidates via building block combination...
[GP] Strategy 1 complete: 6 block-based candidates created
[GP] Strategy 2: Creating 6 candidates via solution interpolation...
[GP] Strategy 2 complete: 6 interpolated candidates created
[GP] Strategy 3: Creating 8 candidates via guided mutation...
[GP] Strategy 3 complete: 8 mutated candidates created
[GP] Total candidates generated: 20
[GP] Strategy breakdown: Block=90, Interp=90, Mut=120
[GP] ========== CANDIDATE GENERATION COMPLETE ==========

  -> 20 candidates sent to 1/1 workers

[CHECKPOINT] Saved C.json at gen 3000 (makespan: 2150827.00)

*** [GPU 0] NEW GLOBAL BEST: 2146682.00 at gen 3100 ***
    Saved to best_solution.json

[GPU 0] Gen  3100 | Best: 2146682.00 | 424.9s
[GP] gpu_0 intermediate update: 2146682.00 at gen 3100
[GP] gpu_0 intermediate update: 2140764.00 at gen 3200
[GPU 0] Gene injection: 20 candidates injected at gen 3200 (total so far: 300)

==================================================
GP ANALYSIS - Cycle 16
  Collected 100 solutions
==================================================

[GP] ========== GENETIC PROGRAMMING ANALYSIS STARTED ==========
[GP] Cycle: 15
[GP] Input: 100 solutions received for analysis
[GP] Fitness range: best=2140764.00, worst=2140764.00
[GP] Analysis config: blocks=True, fft=False, similarity=False
[GP] Starting analysis...
[GP] Phase 1: Extracting building blocks...

*** [GPU 0] NEW GLOBAL BEST: 2140764.00 at gen 3200 ***
    Saved to best_solution.json

[GPU 0] Gen  3200 | Best: 2140764.00 | 438.9s
[GP] Phase 1 complete: Found 9 building blocks
[GP] Phase 2: FFT analysis DISABLED
[GP] Phase 3: Similarity analysis DISABLED
[GP] ========== GP ANALYSIS COMPLETE ==========


[GP] ========== CANDIDATE GENERATION STARTED ==========
[GP] Generating 20 new candidate solutions
[GP] Available data: 100 top solutions, 9 building blocks, 0 FFT patterns, 0 similarity patterns
[GP] Generation strategy: 6 block-based, 6 interpolated, 8 mutated
[GP] Strategy 1: Creating 6 candidates via building block combination...
[GP] Strategy 1 complete: 6 block-based candidates created
[GP] Strategy 2: Creating 6 candidates via solution interpolation...
[GP] Strategy 2 complete: 6 interpolated candidates created
[GP] Strategy 3: Creating 8 candidates via guided mutation...
[GP] Strategy 3 complete: 8 mutated candidates created
[GP] Total candidates generated: 20
[GP] Strategy breakdown: Block=96, Interp=96, Mut=128
[GP] ========== CANDIDATE GENERATION COMPLETE ==========


*** [GPU 0] NEW GLOBAL BEST: 2139518.00 at gen 3300 ***
    Saved to best_solution.json

[GPU 0] Gen  3300 | Best: 2139518.00 | 453.0s
  -> 20 candidates sent to 1/1 workers
[GP] gpu_0 intermediate update: 2139518.00 at gen 3300
[GPU 0] Gene injection: 20 candidates injected at gen 3400 (total so far: 320)
[GP] gpu_0 intermediate update: 2136971.00 at gen 3400

==================================================
GP ANALYSIS - Cycle 17
  Collected 100 solutions
==================================================

[GP] ========== GENETIC PROGRAMMING ANALYSIS STARTED ==========
[GP] Cycle: 16
[GP] Input: 100 solutions received for analysis
[GP] Fitness range: best=2136971.00, worst=2136971.00
[GP] Analysis config: blocks=True, fft=False, similarity=False
[GP] Starting analysis...
[GP] Phase 1: Extracting building blocks...

*** [GPU 0] NEW GLOBAL BEST: 2136971.00 at gen 3400 ***
    Saved to best_solution.json

[GPU 0] Gen  3400 | Best: 2136971.00 | 467.0s
[GP] Phase 1 complete: Found 20 building blocks
[GP] Phase 2: FFT analysis DISABLED
[GP] Phase 3: Similarity analysis DISABLED
[GP] ========== GP ANALYSIS COMPLETE ==========


[GP] ========== CANDIDATE GENERATION STARTED ==========
[GP] Generating 20 new candidate solutions
[GP] Available data: 100 top solutions, 20 building blocks, 0 FFT patterns, 0 similarity patterns
[GP] Generation strategy: 6 block-based, 6 interpolated, 8 mutated
[GP] Strategy 1: Creating 6 candidates via building block combination...
[GP] Strategy 1 complete: 6 block-based candidates created
[GP] Strategy 2: Creating 6 candidates via solution interpolation...
[GP] Strategy 2 complete: 6 interpolated candidates created
[GP] Strategy 3: Creating 8 candidates via guided mutation...
[GP] Strategy 3 complete: 8 mutated candidates created
[GP] Total candidates generated: 20
[GP] Strategy breakdown: Block=102, Interp=102, Mut=136
[GP] ========== CANDIDATE GENERATION COMPLETE ==========


*** [GPU 0] NEW GLOBAL BEST: 2129521.00 at gen 3500 ***
    Saved to best_solution.json

[GPU 0] Gen  3500 | Best: 2129521.00 | 480.2s
  -> 20 candidates sent to 1/1 workers
[GP] gpu_0 intermediate update: 2129521.00 at gen 3500
[GP] gpu_0 intermediate update: 2118638.00 at gen 3600
[GPU 0] Gene injection: 20 candidates injected at gen 3600 (total so far: 340)

==================================================
GP ANALYSIS - Cycle 18
  Collected 100 solutions
==================================================

[GP] ========== GENETIC PROGRAMMING ANALYSIS STARTED ==========
[GP] Cycle: 17
[GP] Input: 100 solutions received for analysis
[GP] Fitness range: best=2118638.00, worst=2118638.00
[GP] Analysis config: blocks=True, fft=False, similarity=False
[GP] Starting analysis...
[GP] Phase 1: Extracting building blocks...

*** [GPU 0] NEW GLOBAL BEST: 2118638.00 at gen 3600 ***
    Saved to best_solution.json

[GPU 0] Gen  3600 | Best: 2118638.00 | 493.1s
[GP] Phase 1 complete: Found 8 building blocks
[GP] Phase 2: FFT analysis DISABLED
[GP] Phase 3: Similarity analysis DISABLED
[GP] ========== GP ANALYSIS COMPLETE ==========


[GP] ========== CANDIDATE GENERATION STARTED ==========
[GP] Generating 20 new candidate solutions
[GP] Available data: 100 top solutions, 8 building blocks, 0 FFT patterns, 0 similarity patterns
[GP] Generation strategy: 6 block-based, 6 interpolated, 8 mutated
[GP] Strategy 1: Creating 6 candidates via building block combination...
[GP] Strategy 1 complete: 6 block-based candidates created
[GP] Strategy 2: Creating 6 candidates via solution interpolation...
[GP] Strategy 2 complete: 6 interpolated candidates created
[GP] Strategy 3: Creating 8 candidates via guided mutation...
[GP] Strategy 3 complete: 8 mutated candidates created
[GP] Total candidates generated: 20
[GP] Strategy breakdown: Block=108, Interp=108, Mut=144
[GP] ========== CANDIDATE GENERATION COMPLETE ==========


*** [GPU 0] NEW GLOBAL BEST: 2106797.00 at gen 3700 ***
    Saved to best_solution.json

[GPU 0] Gen  3700 | Best: 2106797.00 | 506.7s
  -> 20 candidates sent to 1/1 workers
[GP] gpu_0 intermediate update: 2106797.00 at gen 3700
[GP] gpu_0 intermediate update: 2105547.00 at gen 3800
[GPU 0] Gene injection: 20 candidates injected at gen 3800 (total so far: 360)

==================================================
GP ANALYSIS - Cycle 19
  Collected 100 solutions
==================================================

[GP] ========== GENETIC PROGRAMMING ANALYSIS STARTED ==========
[GP] Cycle: 18
[GP] Input: 100 solutions received for analysis
[GP] Fitness range: best=2105547.00, worst=2105547.00
[GP] Analysis config: blocks=True, fft=False, similarity=False
[GP] Starting analysis...
[GP] Phase 1: Extracting building blocks...

*** [GPU 0] NEW GLOBAL BEST: 2105547.00 at gen 3800 ***
    Saved to best_solution.json

[GPU 0] Gen  3800 | Best: 2105547.00 | 520.5s
[GP] Phase 1 complete: Found 9 building blocks
[GP] Phase 2: FFT analysis DISABLED
[GP] Phase 3: Similarity analysis DISABLED
[GP] ========== GP ANALYSIS COMPLETE ==========


[GP] ========== CANDIDATE GENERATION STARTED ==========
[GP] Generating 20 new candidate solutions
[GP] Available data: 100 top solutions, 9 building blocks, 0 FFT patterns, 0 similarity patterns
[GP] Generation strategy: 6 block-based, 6 interpolated, 8 mutated
[GP] Strategy 1: Creating 6 candidates via building block combination...
[GP] Strategy 1 complete: 6 block-based candidates created
[GP] Strategy 2: Creating 6 candidates via solution interpolation...
[GP] Strategy 2 complete: 6 interpolated candidates created
[GP] Strategy 3: Creating 8 candidates via guided mutation...
[GP] Strategy 3 complete: 8 mutated candidates created
[GP] Total candidates generated: 20
[GP] Strategy breakdown: Block=114, Interp=114, Mut=152
[GP] ========== CANDIDATE GENERATION COMPLETE ==========


*** [GPU 0] NEW GLOBAL BEST: 2103604.00 at gen 3900 ***
    Saved to best_solution.json

[GPU 0] Gen  3900 | Best: 2103604.00 | 534.4s
  -> 20 candidates sent to 1/1 workers
[GP] gpu_0 intermediate update: 2103604.00 at gen 3900
[GPU 0] Gene injection: 20 candidates injected at gen 4000 (total so far: 380)
[GP] gpu_0 intermediate update: 2103277.00 at gen 4000

==================================================
GP ANALYSIS - Cycle 20
  Collected 100 solutions
==================================================

[GP] ========== GENETIC PROGRAMMING ANALYSIS STARTED ==========
[GP] Cycle: 19
[GP] Input: 100 solutions received for analysis
[GP] Fitness range: best=2103277.00, worst=2103277.00
[GP] Analysis config: blocks=True, fft=False, similarity=False
[GP] Starting analysis...
[GP] Phase 1: Extracting building blocks...

*** [GPU 0] NEW GLOBAL BEST: 2103277.00 at gen 4000 ***
    Saved to best_solution.json

[GPU 0] Gen  4000 | Best: 2103277.00 | 548.2s
[GP] Phase 1 complete: Found 6 building blocks
[GP] Phase 2: FFT analysis DISABLED
[GP] Phase 3: Similarity analysis DISABLED
[GP] ========== GP ANALYSIS COMPLETE ==========


[GP] ========== CANDIDATE GENERATION STARTED ==========
[GP] Generating 20 new candidate solutions
[GP] Available data: 100 top solutions, 6 building blocks, 0 FFT patterns, 0 similarity patterns
[GP] Generation strategy: 6 block-based, 6 interpolated, 8 mutated
[GP] Strategy 1: Creating 6 candidates via building block combination...
[GP] Strategy 1 complete: 6 block-based candidates created
[GP] Strategy 2: Creating 6 candidates via solution interpolation...
[GP] Strategy 2 complete: 6 interpolated candidates created
[GP] Strategy 3: Creating 8 candidates via guided mutation...
[GP] Strategy 3 complete: 8 mutated candidates created
[GP] Total candidates generated: 20
[GP] Strategy breakdown: Block=120, Interp=120, Mut=160
[GP] ========== CANDIDATE GENERATION COMPLETE ==========

    [Checkpoint] Saved to ./results/warm_start/blocks_only/gr431/1R20/job_times_1_seed0_4000.json
  -> 20 candidates sent to 1/1 workers

[CHECKPOINT] Saved D.json at gen 4000 (makespan: 2103277.00)
[GPU 0] Gen  4100 | Best: 2103277.00 | 562.0s
[GP] gpu_0 intermediate update: 2101002.00 at gen 4200
[GPU 0] Gene injection: 20 candidates injected at gen 4200 (total so far: 400)

==================================================
GP ANALYSIS - Cycle 21
  Collected 100 solutions
==================================================

[GP] ========== GENETIC PROGRAMMING ANALYSIS STARTED ==========
[GP] Cycle: 20
[GP] Input: 100 solutions received for analysis
[GP] Fitness range: best=2101002.00, worst=2101002.00
[GP] Analysis config: blocks=True, fft=False, similarity=False
[GP] Starting analysis...
[GP] Phase 1: Extracting building blocks...

*** [GPU 0] NEW GLOBAL BEST: 2101002.00 at gen 4200 ***
    Saved to best_solution.json

[GPU 0] Gen  4200 | Best: 2101002.00 | 575.6s
[GP] Phase 1 complete: Found 19 building blocks
[GP] Phase 2: FFT analysis DISABLED
[GP] Phase 3: Similarity analysis DISABLED
[GP] ========== GP ANALYSIS COMPLETE ==========


[GP] ========== CANDIDATE GENERATION STARTED ==========
[GP] Generating 20 new candidate solutions
[GP] Available data: 100 top solutions, 19 building blocks, 0 FFT patterns, 0 similarity patterns
[GP] Generation strategy: 6 block-based, 6 interpolated, 8 mutated
[GP] Strategy 1: Creating 6 candidates via building block combination...
[GP] Strategy 1 complete: 6 block-based candidates created
[GP] Strategy 2: Creating 6 candidates via solution interpolation...
[GP] Strategy 2 complete: 6 interpolated candidates created
[GP] Strategy 3: Creating 8 candidates via guided mutation...
[GP] Strategy 3 complete: 8 mutated candidates created
[GP] Total candidates generated: 20
[GP] Strategy breakdown: Block=126, Interp=126, Mut=168
[GP] ========== CANDIDATE GENERATION COMPLETE ==========


*** [GPU 0] NEW GLOBAL BEST: 2097054.00 at gen 4300 ***
    Saved to best_solution.json

[GPU 0] Gen  4300 | Best: 2097054.00 | 589.6s
  -> 20 candidates sent to 1/1 workers
[GP] gpu_0 intermediate update: 2097054.00 at gen 4300
[GP] gpu_0 intermediate update: 2093955.00 at gen 4400
[GPU 0] Gene injection: 20 candidates injected at gen 4400 (total so far: 420)

==================================================
GP ANALYSIS - Cycle 22
  Collected 100 solutions
==================================================

[GP] ========== GENETIC PROGRAMMING ANALYSIS STARTED ==========
[GP] Cycle: 21
[GP] Input: 100 solutions received for analysis
[GP] Fitness range: best=2093955.00, worst=2093955.00
[GP] Analysis config: blocks=True, fft=False, similarity=False
[GP] Starting analysis...
[GP] Phase 1: Extracting building blocks...

*** [GPU 0] NEW GLOBAL BEST: 2093955.00 at gen 4400 ***
    Saved to best_solution.json

[GPU 0] Gen  4400 | Best: 2093955.00 | 603.3s
[GP] Phase 1 complete: Found 30 building blocks
[GP] Phase 2: FFT analysis DISABLED
[GP] Phase 3: Similarity analysis DISABLED
[GP] ========== GP ANALYSIS COMPLETE ==========


[GP] ========== CANDIDATE GENERATION STARTED ==========
[GP] Generating 20 new candidate solutions
[GP] Available data: 100 top solutions, 30 building blocks, 0 FFT patterns, 0 similarity patterns
[GP] Generation strategy: 6 block-based, 6 interpolated, 8 mutated
[GP] Strategy 1: Creating 6 candidates via building block combination...
[GP] Strategy 1 complete: 6 block-based candidates created
[GP] Strategy 2: Creating 6 candidates via solution interpolation...
[GP] Strategy 2 complete: 6 interpolated candidates created
[GP] Strategy 3: Creating 8 candidates via guided mutation...
[GP] Strategy 3 complete: 8 mutated candidates created
[GP] Total candidates generated: 20
[GP] Strategy breakdown: Block=132, Interp=132, Mut=176
[GP] ========== CANDIDATE GENERATION COMPLETE ==========


*** [GPU 0] NEW GLOBAL BEST: 2093617.00 at gen 4500 ***
    Saved to best_solution.json

[GPU 0] Gen  4500 | Best: 2093617.00 | 616.6s
  -> 20 candidates sent to 1/1 workers
[GP] gpu_0 intermediate update: 2093617.00 at gen 4500
[GPU 0] Gene injection: 20 candidates injected at gen 4600 (total so far: 440)

==================================================
GP ANALYSIS - Cycle 23
  Collected 100 solutions
==================================================

[GP] ========== GENETIC PROGRAMMING ANALYSIS STARTED ==========
[GP] Cycle: 22
[GP] Input: 100 solutions received for analysis
[GP] Fitness range: best=2093617.00, worst=2093617.00
[GP] Analysis config: blocks=True, fft=False, similarity=False
[GP] Starting analysis...
[GP] Phase 1: Extracting building blocks...
[GPU 0] Gen  4600 | Best: 2093617.00 | 630.4s
[GP] Phase 1 complete: Found 2 building blocks
[GP] Phase 2: FFT analysis DISABLED
[GP] Phase 3: Similarity analysis DISABLED
[GP] ========== GP ANALYSIS COMPLETE ==========


[GP] ========== CANDIDATE GENERATION STARTED ==========
[GP] Generating 20 new candidate solutions
[GP] Available data: 100 top solutions, 2 building blocks, 0 FFT patterns, 0 similarity patterns
[GP] Generation strategy: 6 block-based, 6 interpolated, 8 mutated
[GP] Strategy 1: Creating 6 candidates via building block combination...
[GP] Strategy 1 complete: 6 block-based candidates created
[GP] Strategy 2: Creating 6 candidates via solution interpolation...
[GP] Strategy 2 complete: 6 interpolated candidates created
[GP] Strategy 3: Creating 8 candidates via guided mutation...
[GP] Strategy 3 complete: 8 mutated candidates created
[GP] Total candidates generated: 20
[GP] Strategy breakdown: Block=138, Interp=138, Mut=184
[GP] ========== CANDIDATE GENERATION COMPLETE ==========

[GPU 0] Gen  4700 | Best: 2093617.00 | 644.3s
  -> 20 candidates sent to 1/1 workers
[GP] gpu_0 intermediate update: 2093528.00 at gen 4800
[GPU 0] Gene injection: 20 candidates injected at gen 4800 (total so far: 460)

==================================================
GP ANALYSIS - Cycle 24
  Collected 100 solutions
==================================================

[GP] ========== GENETIC PROGRAMMING ANALYSIS STARTED ==========
[GP] Cycle: 23
[GP] Input: 100 solutions received for analysis
[GP] Fitness range: best=2093528.00, worst=2093576.00
[GP] Analysis config: blocks=True, fft=False, similarity=False
[GP] Starting analysis...
[GP] Phase 1: Extracting building blocks...

*** [GPU 0] NEW GLOBAL BEST: 2093528.00 at gen 4800 ***
    Saved to best_solution.json

[GPU 0] Gen  4800 | Best: 2093528.00 | 658.4s
[GP] Phase 1 complete: Found 16 building blocks
[GP] Phase 2: FFT analysis DISABLED
[GP] Phase 3: Similarity analysis DISABLED
[GP] ========== GP ANALYSIS COMPLETE ==========


[GP] ========== CANDIDATE GENERATION STARTED ==========
[GP] Generating 20 new candidate solutions
[GP] Available data: 100 top solutions, 16 building blocks, 0 FFT patterns, 0 similarity patterns
[GP] Generation strategy: 6 block-based, 6 interpolated, 8 mutated
[GP] Strategy 1: Creating 6 candidates via building block combination...
[GP] Strategy 1 complete: 6 block-based candidates created
[GP] Strategy 2: Creating 6 candidates via solution interpolation...
[GP] Strategy 2 complete: 6 interpolated candidates created
[GP] Strategy 3: Creating 8 candidates via guided mutation...
[GP] Strategy 3 complete: 8 mutated candidates created
[GP] Total candidates generated: 20
[GP] Strategy breakdown: Block=144, Interp=144, Mut=192
[GP] ========== CANDIDATE GENERATION COMPLETE ==========


*** [GPU 0] NEW GLOBAL BEST: 2093051.00 at gen 4900 ***
    Saved to best_solution.json

[GPU 0] Gen  4900 | Best: 2093051.00 | 671.5s
  -> 20 candidates sent to 1/1 workers
[GP] gpu_0 intermediate update: 2093051.00 at gen 4900
[GPU 0] Gene injection: 20 candidates injected at gen 5000 (total so far: 480)
[GPU 0] Evolution complete. Sending final results...
[GP] gpu_0 intermediate update: 2092392.00 at gen 5000
[GP] Worker finished: gpu_0 (best=2092392.00)

==================================================
GP ANALYSIS - Cycle 25
  Collected 100 solutions
==================================================

[GP] ========== GENETIC PROGRAMMING ANALYSIS STARTED ==========
[GP] Cycle: 24
[GP] Input: 100 solutions received for analysis
[GP] Fitness range: best=2092392.00, worst=2092392.00
[GP] Analysis config: blocks=True, fft=False, similarity=False
[GP] Starting analysis...
[GP] Phase 1: Extracting building blocks...
[GP] Phase 1 complete: Found 3 building blocks
[GP] Phase 2: FFT analysis DISABLED
[GP] Phase 3: Similarity analysis DISABLED
[GP] ========== GP ANALYSIS COMPLETE ==========


[GP] ========== CANDIDATE GENERATION STARTED ==========
[GP] Generating 20 new candidate solutions
[GP] Available data: 100 top solutions, 3 building blocks, 0 FFT patterns, 0 similarity patterns
[GP] Generation strategy: 6 block-based, 6 interpolated, 8 mutated
[GP] Strategy 1: Creating 6 candidates via building block combination...
[GP] Strategy 1 complete: 6 block-based candidates created
[GP] Strategy 2: Creating 6 candidates via solution interpolation...
[GP] Strategy 2 complete: 6 interpolated candidates created
[GP] Strategy 3: Creating 8 candidates via guided mutation...
[GP] Strategy 3 complete: 8 mutated candidates created
[GP] Total candidates generated: 20
[GP] Strategy breakdown: Block=150, Interp=150, Mut=200
[GP] ========== CANDIDATE GENERATION COMPLETE ==========

  -> 20 candidates sent to 1/1 workers

[CHECKPOINT] Saved E.json at gen 5000 (makespan: 2092392.00)

[GP] All workers finished. Total GP cycles: 25

[Final Collection] Have 1/1 workers. Waiting up to 120s for remaining...

[Critical] Attempting final result collection before terminating workers...

[Results Summary] Collected 1 results:
  gpu_0: fitness=2092392.00, intermediate=False, gen=final

======================================================================
COMPLETE
======================================================================
Best: 2092392.00 from gpu_0
  (Improved 64.9% over heuristic 5953012.00)
Time: 688.9s
Total candidates injected: 480

Solution JSON saved to ./results/warm_start/blocks_only/gr431/1R20/job_times_1_seed0.json
HTML Gantt chart saved to: ./results/warm_start/blocks_only/gr431/1R20/job_times_1_seed0.html
