Setting random seed to 0
DEBUG: proc shape: (783,), agents: 6, resources: 4, n: 783

======================================================================
LOADING INITIAL SOLUTION FROM JSON
======================================================================
Loaded heuristic solution: Savings with makespan 371260.00
File: ./results/heuristics_only/rat783/1R20/job_times_3_heuristics.json
Makespan: 371260.00
Status: SUCCESS - Will use as warm start
======================================================================


======================================================================
VRP-RPD SOLVER
======================================================================
Problem: 782 customers, 6 agents, k=4
Heuristic: None
Genetic Programming: Yes
Warm Start: Yes
Gene Injection: Yes
Workers: 1 GPU + 0 CPU
Generations: 5000
======================================================================

Using solution from JSON file as warm start...
  JSON solution: 371260.00
Skipping heuristic re-computation (using JSON solution + perturbations)

Generated 6 warm start chromosomes from JSON

[GP] Starting GP collection loop (timeout: 12975s)...
[GPU 0] Warm start: 6 chromosomes

*** [GPU 0] NEW GLOBAL BEST: 266116.00 at gen 0 ***
    Saved to best_solution.json

[GPU 0] Gen     0 | Best: 266116.00 | 0.5s
[GP] gpu_0 first intermediate: 266116.00 at gen 0

*** [GPU 0] NEW GLOBAL BEST: 193856.00 at gen 100 ***
    Saved to best_solution.json

[GPU 0] Gen   100 | Best: 193856.00 | 14.2s
[GP] gpu_0 intermediate update: 193856.00 at gen 100
[GP] gpu_0 intermediate update: 181178.00 at gen 200

*** [GPU 0] NEW GLOBAL BEST: 181095.00 at gen 200 ***
    Saved to best_solution.json

[GPU 0] Gen   200 | Best: 181095.00 | 28.1s
[GP] gpu_0 intermediate update: 181095.00 at gen 200

*** [GPU 0] NEW GLOBAL BEST: 175027.00 at gen 300 ***
    Saved to best_solution.json

[GPU 0] Gen   300 | Best: 175027.00 | 42.2s
[GP] gpu_0 intermediate update: 175027.00 at gen 300
[GP] gpu_0 intermediate update: 170329.00 at gen 400

==================================================
GP ANALYSIS - Cycle 1
  Collected 40 solutions
==================================================

[GP] ========== GENETIC PROGRAMMING ANALYSIS STARTED ==========
[GP] Cycle: 0
[GP] Input: 40 solutions received for analysis
[GP] Fitness range: best=170329.00, worst=181228.00
[GP] Analysis config: blocks=True, fft=False, similarity=False
[GP] Starting analysis...
[GP] Phase 1: Extracting building blocks...

*** [GPU 0] NEW GLOBAL BEST: 170329.00 at gen 400 ***
    Saved to best_solution.json

[GPU 0] Gen   400 | Best: 170329.00 | 56.3s
[GP] Phase 1 complete: Found 30 building blocks
[GP] Phase 2: FFT analysis DISABLED
[GP] Phase 3: Similarity analysis DISABLED
[GP] ========== GP ANALYSIS COMPLETE ==========


[GP] ========== CANDIDATE GENERATION STARTED ==========
[GP] Generating 20 new candidate solutions
[GP] Available data: 40 top solutions, 30 building blocks, 0 FFT patterns, 0 similarity patterns
[GP] Generation strategy: 6 block-based, 6 interpolated, 8 mutated
[GP] Strategy 1: Creating 6 candidates via building block combination...
[GP] Strategy 1 complete: 6 block-based candidates created
[GP] Strategy 2: Creating 6 candidates via solution interpolation...
[GP] Strategy 2 complete: 6 interpolated candidates created
[GP] Strategy 3: Creating 8 candidates via guided mutation...
[GP] Strategy 3 complete: 8 mutated candidates created
[GP] Total candidates generated: 20
[GP] Strategy breakdown: Block=6, Interp=6, Mut=8
[GP] ========== CANDIDATE GENERATION COMPLETE ==========


*** [GPU 0] NEW GLOBAL BEST: 165816.00 at gen 500 ***
    Saved to best_solution.json

[GPU 0] Gen   500 | Best: 165816.00 | 69.9s
[GPU 0] Gene injection: 20 candidates injected at gen 600 (total so far: 20)
  -> 20 candidates sent to 1/1 workers
[GP] gpu_0 intermediate update: 165816.00 at gen 500
[GP] gpu_0 intermediate update: 162727.00 at gen 600

*** [GPU 0] NEW GLOBAL BEST: 162636.00 at gen 600 ***
    Saved to best_solution.json

[GPU 0] Gen   600 | Best: 162636.00 | 83.7s
[GP] gpu_0 intermediate update: 162636.00 at gen 600

*** [GPU 0] NEW GLOBAL BEST: 158797.00 at gen 700 ***
    Saved to best_solution.json

[GPU 0] Gen   700 | Best: 158797.00 | 97.8s
[GP] gpu_0 intermediate update: 158797.00 at gen 700
[GP] gpu_0 intermediate update: 157366.00 at gen 800

==================================================
GP ANALYSIS - Cycle 2
  Collected 40 solutions
==================================================

[GP] ========== GENETIC PROGRAMMING ANALYSIS STARTED ==========
[GP] Cycle: 1
[GP] Input: 40 solutions received for analysis
[GP] Fitness range: best=157351.00, worst=162880.00
[GP] Analysis config: blocks=True, fft=False, similarity=False
[GP] Starting analysis...
[GP] Phase 1: Extracting building blocks...

*** [GPU 0] NEW GLOBAL BEST: 157351.00 at gen 800 ***
    Saved to best_solution.json

[GPU 0] Gen   800 | Best: 157351.00 | 112.2s
[GP] Phase 1 complete: Found 30 building blocks
[GP] Phase 2: FFT analysis DISABLED
[GP] Phase 3: Similarity analysis DISABLED
[GP] ========== GP ANALYSIS COMPLETE ==========


[GP] ========== CANDIDATE GENERATION STARTED ==========
[GP] Generating 20 new candidate solutions
[GP] Available data: 40 top solutions, 30 building blocks, 0 FFT patterns, 0 similarity patterns
[GP] Generation strategy: 6 block-based, 6 interpolated, 8 mutated
[GP] Strategy 1: Creating 6 candidates via building block combination...
[GP] Strategy 1 complete: 6 block-based candidates created
[GP] Strategy 2: Creating 6 candidates via solution interpolation...
[GP] Strategy 2 complete: 6 interpolated candidates created
[GP] Strategy 3: Creating 8 candidates via guided mutation...
[GP] Strategy 3 complete: 8 mutated candidates created
[GP] Total candidates generated: 20
[GP] Strategy breakdown: Block=12, Interp=12, Mut=16
[GP] ========== CANDIDATE GENERATION COMPLETE ==========


*** [GPU 0] NEW GLOBAL BEST: 154387.00 at gen 900 ***
    Saved to best_solution.json

[GPU 0] Gen   900 | Best: 154387.00 | 126.7s
[GPU 0] Gene injection: 20 candidates injected at gen 1000 (total so far: 40)
  -> 20 candidates sent to 1/1 workers
[GP] gpu_0 intermediate update: 157351.00 at gen 800

*** [GPU 0] NEW GLOBAL BEST: 152496.00 at gen 1000 ***
[GP] gpu_0 intermediate update: 154387.00 at gen 900
[GP] gpu_0 intermediate update: 152601.00 at gen 1000
    Saved to best_solution.json

[GPU 0] Gen  1000 | Best: 152496.00 | 140.9s
    [Checkpoint] Saved to ./results/warm_start/blocks_only/rat783/1R20/job_times_3_seed0_1000.json
[GP] gpu_0 intermediate update: 152496.00 at gen 1000

*** [GPU 0] NEW GLOBAL BEST: 150761.00 at gen 1100 ***
    Saved to best_solution.json

[GPU 0] Gen  1100 | Best: 150761.00 | 155.1s
[GP] gpu_0 intermediate update: 150761.00 at gen 1100
[GP] gpu_0 intermediate update: 148898.00 at gen 1200

==================================================
GP ANALYSIS - Cycle 3
  Collected 40 solutions
==================================================

[GP] ========== GENETIC PROGRAMMING ANALYSIS STARTED ==========
[GP] Cycle: 2
[GP] Input: 40 solutions received for analysis
[GP] Fitness range: best=148857.00, worst=152610.00
[GP] Analysis config: blocks=True, fft=False, similarity=False
[GP] Starting analysis...
[GP] Phase 1: Extracting building blocks...

*** [GPU 0] NEW GLOBAL BEST: 148857.00 at gen 1200 ***
    Saved to best_solution.json

[GPU 0] Gen  1200 | Best: 148857.00 | 169.4s
[GP] Phase 1 complete: Found 30 building blocks
[GP] Phase 2: FFT analysis DISABLED
[GP] Phase 3: Similarity analysis DISABLED
[GP] ========== GP ANALYSIS COMPLETE ==========


[GP] ========== CANDIDATE GENERATION STARTED ==========
[GP] Generating 20 new candidate solutions
[GP] Available data: 40 top solutions, 30 building blocks, 0 FFT patterns, 0 similarity patterns
[GP] Generation strategy: 6 block-based, 6 interpolated, 8 mutated
[GP] Strategy 1: Creating 6 candidates via building block combination...
[GP] Strategy 1 complete: 6 block-based candidates created
[GP] Strategy 2: Creating 6 candidates via solution interpolation...
[GP] Strategy 2 complete: 6 interpolated candidates created
[GP] Strategy 3: Creating 8 candidates via guided mutation...
[GP] Strategy 3 complete: 8 mutated candidates created
[GP] Total candidates generated: 20
[GP] Strategy breakdown: Block=18, Interp=18, Mut=24
[GP] ========== CANDIDATE GENERATION COMPLETE ==========


*** [GPU 0] NEW GLOBAL BEST: 147840.00 at gen 1300 ***
    Saved to best_solution.json

[GPU 0] Gen  1300 | Best: 147840.00 | 183.5s
[GPU 0] Gene injection: 20 candidates injected at gen 1400 (total so far: 60)
  -> 20 candidates sent to 1/1 workers
[GP] gpu_0 intermediate update: 148857.00 at gen 1200
[GP] gpu_0 intermediate update: 147840.00 at gen 1300
[GP] gpu_0 intermediate update: 147246.00 at gen 1400

*** [GPU 0] NEW GLOBAL BEST: 147246.00 at gen 1400 ***
    Saved to best_solution.json

[GPU 0] Gen  1400 | Best: 147246.00 | 197.5s

*** [GPU 0] NEW GLOBAL BEST: 146099.00 at gen 1500 ***
    Saved to best_solution.json

[GPU 0] Gen  1500 | Best: 146099.00 | 211.5s
[GP] gpu_0 intermediate update: 146099.00 at gen 1500
[GP] gpu_0 intermediate update: 144876.00 at gen 1600

==================================================
GP ANALYSIS - Cycle 4
  Collected 40 solutions
==================================================

[GP] ========== GENETIC PROGRAMMING ANALYSIS STARTED ==========
[GP] Cycle: 3
[GP] Input: 40 solutions received for analysis
[GP] Fitness range: best=144876.00, worst=147246.00
[GP] Analysis config: blocks=True, fft=False, similarity=False
[GP] Starting analysis...
[GP] Phase 1: Extracting building blocks...

*** [GPU 0] NEW GLOBAL BEST: 144876.00 at gen 1600 ***
    Saved to best_solution.json

[GPU 0] Gen  1600 | Best: 144876.00 | 225.6s
[GP] Phase 1 complete: Found 30 building blocks
[GP] Phase 2: FFT analysis DISABLED
[GP] Phase 3: Similarity analysis DISABLED
[GP] ========== GP ANALYSIS COMPLETE ==========


[GP] ========== CANDIDATE GENERATION STARTED ==========
[GP] Generating 20 new candidate solutions
[GP] Available data: 40 top solutions, 30 building blocks, 0 FFT patterns, 0 similarity patterns
[GP] Generation strategy: 6 block-based, 6 interpolated, 8 mutated
[GP] Strategy 1: Creating 6 candidates via building block combination...
[GP] Strategy 1 complete: 6 block-based candidates created
[GP] Strategy 2: Creating 6 candidates via solution interpolation...
[GP] Strategy 2 complete: 6 interpolated candidates created
[GP] Strategy 3: Creating 8 candidates via guided mutation...
[GP] Strategy 3 complete: 8 mutated candidates created
[GP] Total candidates generated: 20
[GP] Strategy breakdown: Block=24, Interp=24, Mut=32
[GP] ========== CANDIDATE GENERATION COMPLETE ==========


*** [GPU 0] NEW GLOBAL BEST: 142979.00 at gen 1700 ***
    Saved to best_solution.json

[GPU 0] Gen  1700 | Best: 142979.00 | 239.6s
[GPU 0] Gene injection: 20 candidates injected at gen 1800 (total so far: 80)
  -> 20 candidates sent to 1/1 workers
[GP] gpu_0 intermediate update: 142979.00 at gen 1700
[GP] gpu_0 intermediate update: 142454.00 at gen 1800

*** [GPU 0] NEW GLOBAL BEST: 142454.00 at gen 1800 ***
    Saved to best_solution.json

[GPU 0] Gen  1800 | Best: 142454.00 | 253.7s

*** [GPU 0] NEW GLOBAL BEST: 141428.00 at gen 1900 ***
    Saved to best_solution.json

[GPU 0] Gen  1900 | Best: 141428.00 | 267.8s
[GP] gpu_0 intermediate update: 141428.00 at gen 1900
[GP] gpu_0 intermediate update: 140670.00 at gen 2000

==================================================
GP ANALYSIS - Cycle 5
  Collected 40 solutions
==================================================

[GP] ========== GENETIC PROGRAMMING ANALYSIS STARTED ==========
[GP] Cycle: 4
[GP] Input: 40 solutions received for analysis
[GP] Fitness range: best=140670.00, worst=142483.00
[GP] Analysis config: blocks=True, fft=False, similarity=False
[GP] Starting analysis...
[GP] Phase 1: Extracting building blocks...

*** [GPU 0] NEW GLOBAL BEST: 140670.00 at gen 2000 ***
    Saved to best_solution.json

[GPU 0] Gen  2000 | Best: 140670.00 | 282.0s
[GP] Phase 1 complete: Found 30 building blocks
[GP] Phase 2: FFT analysis DISABLED
[GP] Phase 3: Similarity analysis DISABLED
[GP] ========== GP ANALYSIS COMPLETE ==========


[GP] ========== CANDIDATE GENERATION STARTED ==========
[GP] Generating 20 new candidate solutions
[GP] Available data: 40 top solutions, 30 building blocks, 0 FFT patterns, 0 similarity patterns
[GP] Generation strategy: 6 block-based, 6 interpolated, 8 mutated
[GP] Strategy 1: Creating 6 candidates via building block combination...
[GP] Strategy 1 complete: 6 block-based candidates created
[GP] Strategy 2: Creating 6 candidates via solution interpolation...
[GP] Strategy 2 complete: 6 interpolated candidates created
[GP] Strategy 3: Creating 8 candidates via guided mutation...
[GP] Strategy 3 complete: 8 mutated candidates created
[GP] Total candidates generated: 20
[GP] Strategy breakdown: Block=30, Interp=30, Mut=40
[GP] ========== CANDIDATE GENERATION COMPLETE ==========

    [Checkpoint] Saved to ./results/warm_start/blocks_only/rat783/1R20/job_times_3_seed0_2000.json

*** [GPU 0] NEW GLOBAL BEST: 139950.00 at gen 2100 ***
    Saved to best_solution.json

[GPU 0] Gen  2100 | Best: 139950.00 | 296.1s
[GPU 0] Gene injection: 20 candidates injected at gen 2200 (total so far: 100)
  -> 20 candidates sent to 1/1 workers

[CHECKPOINT] Saved A.json at gen 1000 (makespan: 140670.00)

*** [GPU 0] NEW GLOBAL BEST: 138916.00 at gen 2200 ***
    Saved to best_solution.json

[GPU 0] Gen  2200 | Best: 138916.00 | 310.3s
[GP] gpu_0 intermediate update: 139950.00 at gen 2100
[GP] gpu_0 intermediate update: 138916.00 at gen 2200

*** [GPU 0] NEW GLOBAL BEST: 138196.00 at gen 2300 ***
    Saved to best_solution.json

[GPU 0] Gen  2300 | Best: 138196.00 | 324.4s
[GP] gpu_0 intermediate update: 138196.00 at gen 2300
[GP] gpu_0 intermediate update: 137947.00 at gen 2400

==================================================
GP ANALYSIS - Cycle 6
  Collected 40 solutions
==================================================

[GP] ========== GENETIC PROGRAMMING ANALYSIS STARTED ==========
[GP] Cycle: 5
[GP] Input: 40 solutions received for analysis
[GP] Fitness range: best=137947.00, worst=138916.00
[GP] Analysis config: blocks=True, fft=False, similarity=False
[GP] Starting analysis...
[GP] Phase 1: Extracting building blocks...

*** [GPU 0] NEW GLOBAL BEST: 137947.00 at gen 2400 ***
    Saved to best_solution.json

[GPU 0] Gen  2400 | Best: 137947.00 | 338.7s
[GP] Phase 1 complete: Found 30 building blocks
[GP] Phase 2: FFT analysis DISABLED
[GP] Phase 3: Similarity analysis DISABLED
[GP] ========== GP ANALYSIS COMPLETE ==========


[GP] ========== CANDIDATE GENERATION STARTED ==========
[GP] Generating 20 new candidate solutions
[GP] Available data: 40 top solutions, 30 building blocks, 0 FFT patterns, 0 similarity patterns
[GP] Generation strategy: 6 block-based, 6 interpolated, 8 mutated
[GP] Strategy 1: Creating 6 candidates via building block combination...
[GP] Strategy 1 complete: 6 block-based candidates created
[GP] Strategy 2: Creating 6 candidates via solution interpolation...
[GP] Strategy 2 complete: 6 interpolated candidates created
[GP] Strategy 3: Creating 8 candidates via guided mutation...
[GP] Strategy 3 complete: 8 mutated candidates created
[GP] Total candidates generated: 20
[GP] Strategy breakdown: Block=36, Interp=36, Mut=48
[GP] ========== CANDIDATE GENERATION COMPLETE ==========


*** [GPU 0] NEW GLOBAL BEST: 137104.00 at gen 2500 ***
    Saved to best_solution.json

[GPU 0] Gen  2500 | Best: 137104.00 | 352.9s
[GPU 0] Gene injection: 20 candidates injected at gen 2600 (total so far: 120)
  -> 20 candidates sent to 1/1 workers
[GP] gpu_0 intermediate update: 137104.00 at gen 2500
[GP] gpu_0 intermediate update: 136684.00 at gen 2600

*** [GPU 0] NEW GLOBAL BEST: 136684.00 at gen 2600 ***
    Saved to best_solution.json

[GPU 0] Gen  2600 | Best: 136684.00 | 367.0s

*** [GPU 0] NEW GLOBAL BEST: 136214.00 at gen 2700 ***
    Saved to best_solution.json

[GPU 0] Gen  2700 | Best: 136214.00 | 381.3s
[GP] gpu_0 intermediate update: 136214.00 at gen 2700
[GP] gpu_0 intermediate update: 135636.00 at gen 2800

==================================================
GP ANALYSIS - Cycle 7
  Collected 40 solutions
==================================================

[GP] ========== GENETIC PROGRAMMING ANALYSIS STARTED ==========
[GP] Cycle: 6
[GP] Input: 40 solutions received for analysis
[GP] Fitness range: best=135636.00, worst=136684.00
[GP] Analysis config: blocks=True, fft=False, similarity=False
[GP] Starting analysis...
[GP] Phase 1: Extracting building blocks...

*** [GPU 0] NEW GLOBAL BEST: 135636.00 at gen 2800 ***
    Saved to best_solution.json

[GPU 0] Gen  2800 | Best: 135636.00 | 395.8s
[GP] Phase 1 complete: Found 30 building blocks
[GP] Phase 2: FFT analysis DISABLED
[GP] Phase 3: Similarity analysis DISABLED
[GP] ========== GP ANALYSIS COMPLETE ==========


[GP] ========== CANDIDATE GENERATION STARTED ==========
[GP] Generating 20 new candidate solutions
[GP] Available data: 40 top solutions, 30 building blocks, 0 FFT patterns, 0 similarity patterns
[GP] Generation strategy: 6 block-based, 6 interpolated, 8 mutated
[GP] Strategy 1: Creating 6 candidates via building block combination...
[GP] Strategy 1 complete: 6 block-based candidates created
[GP] Strategy 2: Creating 6 candidates via solution interpolation...
[GP] Strategy 2 complete: 6 interpolated candidates created
[GP] Strategy 3: Creating 8 candidates via guided mutation...
[GP] Strategy 3 complete: 8 mutated candidates created
[GP] Total candidates generated: 20
[GP] Strategy breakdown: Block=42, Interp=42, Mut=56
[GP] ========== CANDIDATE GENERATION COMPLETE ==========


*** [GPU 0] NEW GLOBAL BEST: 135429.00 at gen 2900 ***
    Saved to best_solution.json

[GPU 0] Gen  2900 | Best: 135429.00 | 409.7s
[GPU 0] Gene injection: 20 candidates injected at gen 3000 (total so far: 140)
  -> 20 candidates sent to 1/1 workers
[GP] gpu_0 intermediate update: 135429.00 at gen 2900
[GP] gpu_0 intermediate update: 135274.00 at gen 3000

*** [GPU 0] NEW GLOBAL BEST: 135274.00 at gen 3000 ***
    Saved to best_solution.json

[GPU 0] Gen  3000 | Best: 135274.00 | 424.0s
    [Checkpoint] Saved to ./results/warm_start/blocks_only/rat783/1R20/job_times_3_seed0_3000.json

*** [GPU 0] NEW GLOBAL BEST: 135258.00 at gen 3100 ***
    Saved to best_solution.json

[GPU 0] Gen  3100 | Best: 135258.00 | 438.4s
[GP] gpu_0 intermediate update: 135258.00 at gen 3100
[GP] gpu_0 intermediate update: 135029.00 at gen 3200

==================================================
GP ANALYSIS - Cycle 8
  Collected 40 solutions
==================================================

[GP] ========== GENETIC PROGRAMMING ANALYSIS STARTED ==========
[GP] Cycle: 7
[GP] Input: 40 solutions received for analysis
[GP] Fitness range: best=135029.00, worst=135304.00
[GP] Analysis config: blocks=True, fft=False, similarity=False
[GP] Starting analysis...
[GP] Phase 1: Extracting building blocks...

*** [GPU 0] NEW GLOBAL BEST: 135029.00 at gen 3200 ***
    Saved to best_solution.json

[GPU 0] Gen  3200 | Best: 135029.00 | 452.9s
[GP] Phase 1 complete: Found 30 building blocks
[GP] Phase 2: FFT analysis DISABLED
[GP] Phase 3: Similarity analysis DISABLED
[GP] ========== GP ANALYSIS COMPLETE ==========


[GP] ========== CANDIDATE GENERATION STARTED ==========
[GP] Generating 20 new candidate solutions
[GP] Available data: 40 top solutions, 30 building blocks, 0 FFT patterns, 0 similarity patterns
[GP] Generation strategy: 6 block-based, 6 interpolated, 8 mutated
[GP] Strategy 1: Creating 6 candidates via building block combination...
[GP] Strategy 1 complete: 6 block-based candidates created
[GP] Strategy 2: Creating 6 candidates via solution interpolation...
[GP] Strategy 2 complete: 6 interpolated candidates created
[GP] Strategy 3: Creating 8 candidates via guided mutation...
[GP] Strategy 3 complete: 8 mutated candidates created
[GP] Total candidates generated: 20
[GP] Strategy breakdown: Block=48, Interp=48, Mut=64
[GP] ========== CANDIDATE GENERATION COMPLETE ==========


*** [GPU 0] NEW GLOBAL BEST: 135028.00 at gen 3300 ***
    Saved to best_solution.json

[GPU 0] Gen  3300 | Best: 135028.00 | 467.1s
[GPU 0] Gene injection: 20 candidates injected at gen 3400 (total so far: 160)
  -> 20 candidates sent to 1/1 workers
[GP] gpu_0 intermediate update: 135028.00 at gen 3300
[GPU 0] Gen  3400 | Best: 135028.00 | 481.6s

*** [GPU 0] NEW GLOBAL BEST: 134982.00 at gen 3500 ***
    Saved to best_solution.json

[GPU 0] Gen  3500 | Best: 134982.00 | 496.2s
[GP] gpu_0 intermediate update: 134982.00 at gen 3500
[GP] gpu_0 intermediate update: 134573.00 at gen 3600

==================================================
GP ANALYSIS - Cycle 9
  Collected 40 solutions
==================================================

[GP] ========== GENETIC PROGRAMMING ANALYSIS STARTED ==========
[GP] Cycle: 8
[GP] Input: 40 solutions received for analysis
[GP] Fitness range: best=134573.00, worst=135028.00
[GP] Analysis config: blocks=True, fft=False, similarity=False
[GP] Starting analysis...
[GP] Phase 1: Extracting building blocks...

*** [GPU 0] NEW GLOBAL BEST: 134573.00 at gen 3600 ***
    Saved to best_solution.json

[GPU 0] Gen  3600 | Best: 134573.00 | 510.7s
[GP] Phase 1 complete: Found 30 building blocks
[GP] Phase 2: FFT analysis DISABLED
[GP] Phase 3: Similarity analysis DISABLED
[GP] ========== GP ANALYSIS COMPLETE ==========


[GP] ========== CANDIDATE GENERATION STARTED ==========
[GP] Generating 20 new candidate solutions
[GP] Available data: 40 top solutions, 30 building blocks, 0 FFT patterns, 0 similarity patterns
[GP] Generation strategy: 6 block-based, 6 interpolated, 8 mutated
[GP] Strategy 1: Creating 6 candidates via building block combination...
[GP] Strategy 1 complete: 6 block-based candidates created
[GP] Strategy 2: Creating 6 candidates via solution interpolation...
[GP] Strategy 2 complete: 6 interpolated candidates created
[GP] Strategy 3: Creating 8 candidates via guided mutation...
[GP] Strategy 3 complete: 8 mutated candidates created
[GP] Total candidates generated: 20
[GP] Strategy breakdown: Block=54, Interp=54, Mut=72
[GP] ========== CANDIDATE GENERATION COMPLETE ==========

[GPU 0] Gen  3700 | Best: 134573.00 | 525.1s
[GPU 0] Gene injection: 20 candidates injected at gen 3800 (total so far: 180)
  -> 20 candidates sent to 1/1 workers
[GP] gpu_0 intermediate update: 134504.00 at gen 3800

*** [GPU 0] NEW GLOBAL BEST: 134504.00 at gen 3800 ***
    Saved to best_solution.json

[GPU 0] Gen  3800 | Best: 134504.00 | 539.1s

*** [GPU 0] NEW GLOBAL BEST: 134152.00 at gen 3900 ***
    Saved to best_solution.json

[GPU 0] Gen  3900 | Best: 134152.00 | 553.7s
[GP] gpu_0 intermediate update: 134152.00 at gen 3900
[GP] gpu_0 intermediate update: 134002.00 at gen 4000

==================================================
GP ANALYSIS - Cycle 10
  Collected 40 solutions
==================================================

[GP] ========== GENETIC PROGRAMMING ANALYSIS STARTED ==========
[GP] Cycle: 9
[GP] Input: 40 solutions received for analysis
[GP] Fitness range: best=134002.00, worst=134527.00
[GP] Analysis config: blocks=True, fft=False, similarity=False
[GP] Starting analysis...
[GP] Phase 1: Extracting building blocks...

*** [GPU 0] NEW GLOBAL BEST: 134002.00 at gen 4000 ***
    Saved to best_solution.json

[GPU 0] Gen  4000 | Best: 134002.00 | 568.3s
[GP] Phase 1 complete: Found 30 building blocks
[GP] Phase 2: FFT analysis DISABLED
[GP] Phase 3: Similarity analysis DISABLED
[GP] ========== GP ANALYSIS COMPLETE ==========


[GP] ========== CANDIDATE GENERATION STARTED ==========
[GP] Generating 20 new candidate solutions
[GP] Available data: 40 top solutions, 30 building blocks, 0 FFT patterns, 0 similarity patterns
[GP] Generation strategy: 6 block-based, 6 interpolated, 8 mutated
[GP] Strategy 1: Creating 6 candidates via building block combination...
[GP] Strategy 1 complete: 6 block-based candidates created
[GP] Strategy 2: Creating 6 candidates via solution interpolation...
[GP] Strategy 2 complete: 6 interpolated candidates created
[GP] Strategy 3: Creating 8 candidates via guided mutation...
[GP] Strategy 3 complete: 8 mutated candidates created
[GP] Total candidates generated: 20
[GP] Strategy breakdown: Block=60, Interp=60, Mut=80
[GP] ========== CANDIDATE GENERATION COMPLETE ==========

    [Checkpoint] Saved to ./results/warm_start/blocks_only/rat783/1R20/job_times_3_seed0_4000.json

*** [GPU 0] NEW GLOBAL BEST: 133572.00 at gen 4100 ***
    Saved to best_solution.json

[GPU 0] Gen  4100 | Best: 133572.00 | 582.6s
[GPU 0] Gene injection: 20 candidates injected at gen 4200 (total so far: 200)
  -> 20 candidates sent to 1/1 workers

[CHECKPOINT] Saved B.json at gen 2000 (makespan: 134002.00)

*** [GPU 0] NEW GLOBAL BEST: 133207.00 at gen 4200 ***
    Saved to best_solution.json

[GPU 0] Gen  4200 | Best: 133207.00 | 596.5s
[GP] gpu_0 intermediate update: 133572.00 at gen 4100
[GP] gpu_0 intermediate update: 133207.00 at gen 4200

*** [GPU 0] NEW GLOBAL BEST: 132938.00 at gen 4300 ***
    Saved to best_solution.json

[GPU 0] Gen  4300 | Best: 132938.00 | 610.9s
[GP] gpu_0 intermediate update: 132938.00 at gen 4300
[GP] gpu_0 intermediate update: 132780.00 at gen 4400

==================================================
GP ANALYSIS - Cycle 11
  Collected 40 solutions
==================================================

[GP] ========== GENETIC PROGRAMMING ANALYSIS STARTED ==========
[GP] Cycle: 10
[GP] Input: 40 solutions received for analysis
[GP] Fitness range: best=132780.00, worst=133207.00
[GP] Analysis config: blocks=True, fft=False, similarity=False
[GP] Starting analysis...
[GP] Phase 1: Extracting building blocks...

*** [GPU 0] NEW GLOBAL BEST: 132780.00 at gen 4400 ***
    Saved to best_solution.json

[GPU 0] Gen  4400 | Best: 132780.00 | 625.3s
[GP] Phase 1 complete: Found 30 building blocks
[GP] Phase 2: FFT analysis DISABLED
[GP] Phase 3: Similarity analysis DISABLED
[GP] ========== GP ANALYSIS COMPLETE ==========


[GP] ========== CANDIDATE GENERATION STARTED ==========
[GP] Generating 20 new candidate solutions
[GP] Available data: 40 top solutions, 30 building blocks, 0 FFT patterns, 0 similarity patterns
[GP] Generation strategy: 6 block-based, 6 interpolated, 8 mutated
[GP] Strategy 1: Creating 6 candidates via building block combination...
[GP] Strategy 1 complete: 6 block-based candidates created
[GP] Strategy 2: Creating 6 candidates via solution interpolation...
[GP] Strategy 2 complete: 6 interpolated candidates created
[GP] Strategy 3: Creating 8 candidates via guided mutation...
[GP] Strategy 3 complete: 8 mutated candidates created
[GP] Total candidates generated: 20
[GP] Strategy breakdown: Block=66, Interp=66, Mut=88
[GP] ========== CANDIDATE GENERATION COMPLETE ==========


*** [GPU 0] NEW GLOBAL BEST: 132492.00 at gen 4500 ***
    Saved to best_solution.json

[GPU 0] Gen  4500 | Best: 132492.00 | 639.6s
[GPU 0] Gene injection: 20 candidates injected at gen 4600 (total so far: 220)
  -> 20 candidates sent to 1/1 workers
[GP] gpu_0 intermediate update: 132492.00 at gen 4500
[GP] gpu_0 intermediate update: 132232.00 at gen 4600

*** [GPU 0] NEW GLOBAL BEST: 132232.00 at gen 4600 ***
    Saved to best_solution.json

[GPU 0] Gen  4600 | Best: 132232.00 | 654.2s

*** [GPU 0] NEW GLOBAL BEST: 132099.00 at gen 4700 ***
    Saved to best_solution.json

[GPU 0] Gen  4700 | Best: 132099.00 | 668.6s
[GP] gpu_0 intermediate update: 132099.00 at gen 4700
[GP] gpu_0 intermediate update: 131663.00 at gen 4800

==================================================
GP ANALYSIS - Cycle 12
  Collected 40 solutions
==================================================

[GP] ========== GENETIC PROGRAMMING ANALYSIS STARTED ==========
[GP] Cycle: 11
[GP] Input: 40 solutions received for analysis
[GP] Fitness range: best=131663.00, worst=132232.00
[GP] Analysis config: blocks=True, fft=False, similarity=False
[GP] Starting analysis...
[GP] Phase 1: Extracting building blocks...

*** [GPU 0] NEW GLOBAL BEST: 131663.00 at gen 4800 ***
    Saved to best_solution.json

[GPU 0] Gen  4800 | Best: 131663.00 | 683.2s
[GP] Phase 1 complete: Found 30 building blocks
[GP] Phase 2: FFT analysis DISABLED
[GP] Phase 3: Similarity analysis DISABLED
[GP] ========== GP ANALYSIS COMPLETE ==========


[GP] ========== CANDIDATE GENERATION STARTED ==========
[GP] Generating 20 new candidate solutions
[GP] Available data: 40 top solutions, 30 building blocks, 0 FFT patterns, 0 similarity patterns
[GP] Generation strategy: 6 block-based, 6 interpolated, 8 mutated
[GP] Strategy 1: Creating 6 candidates via building block combination...
[GP] Strategy 1 complete: 6 block-based candidates created
[GP] Strategy 2: Creating 6 candidates via solution interpolation...
[GP] Strategy 2 complete: 6 interpolated candidates created
[GP] Strategy 3: Creating 8 candidates via guided mutation...
[GP] Strategy 3 complete: 8 mutated candidates created
[GP] Total candidates generated: 20
[GP] Strategy breakdown: Block=72, Interp=72, Mut=96
[GP] ========== CANDIDATE GENERATION COMPLETE ==========


*** [GPU 0] NEW GLOBAL BEST: 131566.00 at gen 4900 ***
    Saved to best_solution.json

[GPU 0] Gen  4900 | Best: 131566.00 | 697.7s
[GPU 0] Gene injection: 20 candidates injected at gen 5000 (total so far: 240)
[GPU 0] Evolution complete. Sending final results...
  -> 20 candidates sent to 1/1 workers
[GP] gpu_0 intermediate update: 131566.00 at gen 4900
[GP] gpu_0 intermediate update: 131406.00 at gen 5000
[GP] Worker finished: gpu_0 (best=131406.00)

[GP] All workers finished. Total GP cycles: 12

[Final Collection] Have 1/1 workers. Waiting up to 120s for remaining...

[Critical] Attempting final result collection before terminating workers...

[Results Summary] Collected 1 results:
  gpu_0: fitness=131406.00, intermediate=False, gen=final

======================================================================
COMPLETE
======================================================================
Best: 131406.00 from gpu_0
  (Improved 64.6% over heuristic 371260.00)
Time: 715.0s
Total candidates injected: 240

Solution JSON saved to ./results/warm_start/blocks_only/rat783/1R20/job_times_3_seed0.json
HTML Gantt chart saved to: ./results/warm_start/blocks_only/rat783/1R20/job_times_3_seed0.html
