Setting random seed to 0
DEBUG: proc shape: (1000,), agents: 6, resources: 4, n: 1000

======================================================================
VRP-RPD SOLVER
======================================================================
Problem: 999 customers, 6 agents, k=4
Heuristic: None
Genetic Programming: Yes
Warm Start: No
Gene Injection: Yes
Workers: 1 GPU + 0 CPU
Generations: 5000
======================================================================


[GP] Starting GP collection loop (timeout: 750s)...

*** [GPU 0] NEW GLOBAL BEST: 196496546.00 at gen 0 ***
    Saved to best_solution.json

[GPU 0] Gen     0 | Best: 196496546.00 | 0.4s
[GP] gpu_0 first intermediate: 196496546.00 at gen 0

*** [GPU 0] NEW GLOBAL BEST: 167168551.00 at gen 100 ***
    Saved to best_solution.json

[GPU 0] Gen   100 | Best: 167168551.00 | 10.5s
[GP] gpu_0 intermediate update: 167168551.00 at gen 100
[GP] gpu_0 intermediate update: 161497524.00 at gen 200

*** [GPU 0] NEW GLOBAL BEST: 161497524.00 at gen 200 ***
    Saved to best_solution.json

[GPU 0] Gen   200 | Best: 161497524.00 | 20.7s

*** [GPU 0] NEW GLOBAL BEST: 157107808.00 at gen 300 ***
    Saved to best_solution.json

[GPU 0] Gen   300 | Best: 157107808.00 | 30.6s
[GP] gpu_0 intermediate update: 157107808.00 at gen 300
[GP] gpu_0 intermediate update: 153323090.00 at gen 400

==================================================
GP ANALYSIS - Cycle 1
  Collected 40 solutions
==================================================

[GP] ========== GENETIC PROGRAMMING ANALYSIS STARTED ==========
[GP] Cycle: 0
[GP] Input: 40 solutions received for analysis
[GP] Fitness range: best=153323088.00, worst=161646400.00
[GP] Analysis config: blocks=True, fft=False, similarity=False
[GP] Starting analysis...
[GP] Phase 1: Extracting building blocks...

*** [GPU 0] NEW GLOBAL BEST: 153323090.00 at gen 400 ***
    Saved to best_solution.json

[GPU 0] Gen   400 | Best: 153323090.00 | 40.8s
[GP] Phase 1 complete: Found 30 building blocks
[GP] Phase 2: FFT analysis DISABLED
[GP] Phase 3: Similarity analysis DISABLED
[GP] ========== GP ANALYSIS COMPLETE ==========


[GP] ========== CANDIDATE GENERATION STARTED ==========
[GP] Generating 20 new candidate solutions
[GP] Available data: 40 top solutions, 30 building blocks, 0 FFT patterns, 0 similarity patterns
[GP] Generation strategy: 6 block-based, 6 interpolated, 8 mutated
[GP] Strategy 1: Creating 6 candidates via building block combination...
[GP] Strategy 1 complete: 6 block-based candidates created
[GP] Strategy 2: Creating 6 candidates via solution interpolation...
[GP] Strategy 2 complete: 6 interpolated candidates created
[GP] Strategy 3: Creating 8 candidates via guided mutation...
[GP] Strategy 3 complete: 8 mutated candidates created
[GP] Total candidates generated: 20
[GP] Strategy breakdown: Block=6, Interp=6, Mut=8
[GP] ========== CANDIDATE GENERATION COMPLETE ==========


*** [GPU 0] NEW GLOBAL BEST: 149939873.00 at gen 500 ***
    Saved to best_solution.json

[GPU 0] Gen   500 | Best: 149939873.00 | 50.8s
[GPU 0] Gene injection: 20 candidates injected at gen 600 (total so far: 20)

*** [GPU 0] NEW GLOBAL BEST: 147761015.00 at gen 600 ***
    Saved to best_solution.json

[GPU 0] Gen   600 | Best: 147761015.00 | 60.8s
  -> 20 candidates sent to 1/1 workers
[GP] gpu_0 intermediate update: 149939873.00 at gen 500
[GP] gpu_0 intermediate update: 147761015.00 at gen 600

*** [GPU 0] NEW GLOBAL BEST: 146117801.00 at gen 700 ***
    Saved to best_solution.json

[GPU 0] Gen   700 | Best: 146117801.00 | 70.8s
[GP] gpu_0 intermediate update: 146117801.00 at gen 700
[GP] gpu_0 intermediate update: 144296624.00 at gen 800

==================================================
GP ANALYSIS - Cycle 2
  Collected 40 solutions
==================================================

[GP] ========== GENETIC PROGRAMMING ANALYSIS STARTED ==========
[GP] Cycle: 1
[GP] Input: 40 solutions received for analysis
[GP] Fitness range: best=144296624.00, worst=147867520.00
[GP] Analysis config: blocks=True, fft=False, similarity=False
[GP] Starting analysis...
[GP] Phase 1: Extracting building blocks...

*** [GPU 0] NEW GLOBAL BEST: 144296624.00 at gen 800 ***
    Saved to best_solution.json

[GPU 0] Gen   800 | Best: 144296624.00 | 81.4s
[GP] Phase 1 complete: Found 30 building blocks
[GP] Phase 2: FFT analysis DISABLED
[GP] Phase 3: Similarity analysis DISABLED
[GP] ========== GP ANALYSIS COMPLETE ==========


[GP] ========== CANDIDATE GENERATION STARTED ==========
[GP] Generating 20 new candidate solutions
[GP] Available data: 40 top solutions, 30 building blocks, 0 FFT patterns, 0 similarity patterns
[GP] Generation strategy: 6 block-based, 6 interpolated, 8 mutated
[GP] Strategy 1: Creating 6 candidates via building block combination...
[GP] Strategy 1 complete: 6 block-based candidates created
[GP] Strategy 2: Creating 6 candidates via solution interpolation...
[GP] Strategy 2 complete: 6 interpolated candidates created
[GP] Strategy 3: Creating 8 candidates via guided mutation...
[GP] Strategy 3 complete: 8 mutated candidates created
[GP] Total candidates generated: 20
[GP] Strategy breakdown: Block=12, Interp=12, Mut=16
[GP] ========== CANDIDATE GENERATION COMPLETE ==========


*** [GPU 0] NEW GLOBAL BEST: 142652388.00 at gen 900 ***
    Saved to best_solution.json

[GPU 0] Gen   900 | Best: 142652388.00 | 91.8s
[GPU 0] Gene injection: 20 candidates injected at gen 1000 (total so far: 40)

*** [GPU 0] NEW GLOBAL BEST: 141017599.00 at gen 1000 ***
    Saved to best_solution.json

[GPU 0] Gen  1000 | Best: 141017599.00 | 102.3s
  -> 20 candidates sent to 1/1 workers
[GP] gpu_0 intermediate update: 142652388.00 at gen 900
[GP] gpu_0 intermediate update: 141035410.00 at gen 1000
    [Checkpoint] Saved to ./results/cold_start/blocks_only/dsj1000/base/dsj1000_seed0_1000.json
[GP] gpu_0 intermediate update: 141017599.00 at gen 1000

*** [GPU 0] NEW GLOBAL BEST: 139482723.00 at gen 1100 ***
    Saved to best_solution.json

[GPU 0] Gen  1100 | Best: 139482723.00 | 112.9s
[GP] gpu_0 intermediate update: 139482723.00 at gen 1100
[GP] gpu_0 intermediate update: 138165032.00 at gen 1200

==================================================
GP ANALYSIS - Cycle 3
  Collected 40 solutions
==================================================

[GP] ========== GENETIC PROGRAMMING ANALYSIS STARTED ==========
[GP] Cycle: 2
[GP] Input: 40 solutions received for analysis
[GP] Fitness range: best=138165024.00, worst=141080768.00
[GP] Analysis config: blocks=True, fft=False, similarity=False
[GP] Starting analysis...
[GP] Phase 1: Extracting building blocks...

*** [GPU 0] NEW GLOBAL BEST: 138165032.00 at gen 1200 ***
    Saved to best_solution.json

[GPU 0] Gen  1200 | Best: 138165032.00 | 123.4s
[GP] Phase 1 complete: Found 30 building blocks
[GP] Phase 2: FFT analysis DISABLED
[GP] Phase 3: Similarity analysis DISABLED
[GP] ========== GP ANALYSIS COMPLETE ==========


[GP] ========== CANDIDATE GENERATION STARTED ==========
[GP] Generating 20 new candidate solutions
[GP] Available data: 40 top solutions, 30 building blocks, 0 FFT patterns, 0 similarity patterns
[GP] Generation strategy: 6 block-based, 6 interpolated, 8 mutated
[GP] Strategy 1: Creating 6 candidates via building block combination...
[GP] Strategy 1 complete: 6 block-based candidates created
[GP] Strategy 2: Creating 6 candidates via solution interpolation...
[GP] Strategy 2 complete: 6 interpolated candidates created
[GP] Strategy 3: Creating 8 candidates via guided mutation...
[GP] Strategy 3 complete: 8 mutated candidates created
[GP] Total candidates generated: 20
[GP] Strategy breakdown: Block=18, Interp=18, Mut=24
[GP] ========== CANDIDATE GENERATION COMPLETE ==========


*** [GPU 0] NEW GLOBAL BEST: 136892063.00 at gen 1300 ***
    Saved to best_solution.json

[GPU 0] Gen  1300 | Best: 136892063.00 | 133.8s
[GPU 0] Gene injection: 20 candidates injected at gen 1400 (total so far: 60)

*** [GPU 0] NEW GLOBAL BEST: 135964028.00 at gen 1400 ***
  -> 20 candidates sent to 1/1 workers
[GP] gpu_0 intermediate update: 136892063.00 at gen 1300
[GP] gpu_0 intermediate update: 135964028.00 at gen 1400
    Saved to best_solution.json

[GPU 0] Gen  1400 | Best: 135964028.00 | 144.3s

*** [GPU 0] NEW GLOBAL BEST: 135093934.00 at gen 1500 ***
    Saved to best_solution.json

[GPU 0] Gen  1500 | Best: 135093934.00 | 154.8s
[GP] gpu_0 intermediate update: 135093934.00 at gen 1500
[GP] gpu_0 intermediate update: 134245088.00 at gen 1600

==================================================
GP ANALYSIS - Cycle 4
  Collected 40 solutions
==================================================

[GP] ========== GENETIC PROGRAMMING ANALYSIS STARTED ==========
[GP] Cycle: 3
[GP] Input: 40 solutions received for analysis
[GP] Fitness range: best=134241408.00, worst=135964032.00
[GP] Analysis config: blocks=True, fft=False, similarity=False
[GP] Starting analysis...
[GP] Phase 1: Extracting building blocks...

*** [GPU 0] NEW GLOBAL BEST: 134241412.00 at gen 1600 ***
    Saved to best_solution.json

[GPU 0] Gen  1600 | Best: 134241412.00 | 165.9s
[GP] Phase 1 complete: Found 30 building blocks
[GP] Phase 2: FFT analysis DISABLED
[GP] Phase 3: Similarity analysis DISABLED
[GP] ========== GP ANALYSIS COMPLETE ==========


[GP] ========== CANDIDATE GENERATION STARTED ==========
[GP] Generating 20 new candidate solutions
[GP] Available data: 40 top solutions, 30 building blocks, 0 FFT patterns, 0 similarity patterns
[GP] Generation strategy: 6 block-based, 6 interpolated, 8 mutated
[GP] Strategy 1: Creating 6 candidates via building block combination...
[GP] Strategy 1 complete: 6 block-based candidates created
[GP] Strategy 2: Creating 6 candidates via solution interpolation...
[GP] Strategy 2 complete: 6 interpolated candidates created
[GP] Strategy 3: Creating 8 candidates via guided mutation...
[GP] Strategy 3 complete: 8 mutated candidates created
[GP] Total candidates generated: 20
[GP] Strategy breakdown: Block=24, Interp=24, Mut=32
[GP] ========== CANDIDATE GENERATION COMPLETE ==========


*** [GPU 0] NEW GLOBAL BEST: 133635095.00 at gen 1700 ***
    Saved to best_solution.json

[GPU 0] Gen  1700 | Best: 133635095.00 | 176.4s
[GPU 0] Gene injection: 20 candidates injected at gen 1800 (total so far: 80)

*** [GPU 0] NEW GLOBAL BEST: 132638505.00 at gen 1800 ***
    Saved to best_solution.json

[GPU 0] Gen  1800 | Best: 132638505.00 | 186.9s
  -> 20 candidates sent to 1/1 workers
[GP] gpu_0 intermediate update: 134241412.00 at gen 1600
[GP] gpu_0 intermediate update: 133635095.00 at gen 1700
[GP] gpu_0 intermediate update: 132638505.00 at gen 1800

*** [GPU 0] NEW GLOBAL BEST: 132093384.00 at gen 1900 ***
    Saved to best_solution.json

[GPU 0] Gen  1900 | Best: 132093384.00 | 197.3s
[GP] gpu_0 intermediate update: 132093384.00 at gen 1900
[GP] gpu_0 intermediate update: 131419510.00 at gen 2000

==================================================
GP ANALYSIS - Cycle 5
  Collected 40 solutions
==================================================

[GP] ========== GENETIC PROGRAMMING ANALYSIS STARTED ==========
[GP] Cycle: 4
[GP] Input: 40 solutions received for analysis
[GP] Fitness range: best=131396864.00, worst=132638504.00
[GP] Analysis config: blocks=True, fft=False, similarity=False
[GP] Starting analysis...
[GP] Phase 1: Extracting building blocks...

*** [GPU 0] NEW GLOBAL BEST: 131396866.00 at gen 2000 ***
    Saved to best_solution.json

[GPU 0] Gen  2000 | Best: 131396866.00 | 207.9s
    [Checkpoint] Saved to ./results/cold_start/blocks_only/dsj1000/base/dsj1000_seed0_2000.json
[GP] Phase 1 complete: Found 30 building blocks
[GP] Phase 2: FFT analysis DISABLED
[GP] Phase 3: Similarity analysis DISABLED
[GP] ========== GP ANALYSIS COMPLETE ==========


[GP] ========== CANDIDATE GENERATION STARTED ==========
[GP] Generating 20 new candidate solutions
[GP] Available data: 40 top solutions, 30 building blocks, 0 FFT patterns, 0 similarity patterns
[GP] Generation strategy: 6 block-based, 6 interpolated, 8 mutated
[GP] Strategy 1: Creating 6 candidates via building block combination...
[GP] Strategy 1 complete: 6 block-based candidates created
[GP] Strategy 2: Creating 6 candidates via solution interpolation...
[GP] Strategy 2 complete: 6 interpolated candidates created
[GP] Strategy 3: Creating 8 candidates via guided mutation...
[GP] Strategy 3 complete: 8 mutated candidates created
[GP] Total candidates generated: 20
[GP] Strategy breakdown: Block=30, Interp=30, Mut=40
[GP] ========== CANDIDATE GENERATION COMPLETE ==========


*** [GPU 0] NEW GLOBAL BEST: 131162293.00 at gen 2100 ***
    Saved to best_solution.json

[GPU 0] Gen  2100 | Best: 131162293.00 | 218.4s
[GPU 0] Gene injection: 20 candidates injected at gen 2200 (total so far: 100)

*** [GPU 0] NEW GLOBAL BEST: 130859337.00 at gen 2200 ***
    Saved to best_solution.json

[GPU 0] Gen  2200 | Best: 130859337.00 | 229.5s
  -> 20 candidates sent to 1/1 workers

[CHECKPOINT] Saved A.json at gen 1000 (makespan: 131396866.00)
[GP] gpu_0 intermediate update: 131396866.00 at gen 2000
[GP] gpu_0 intermediate update: 131162293.00 at gen 2100
[GP] gpu_0 intermediate update: 130859337.00 at gen 2200

*** [GPU 0] NEW GLOBAL BEST: 130153128.00 at gen 2300 ***
    Saved to best_solution.json

[GPU 0] Gen  2300 | Best: 130153128.00 | 240.7s
[GP] gpu_0 intermediate update: 130153128.00 at gen 2300
[GP] gpu_0 intermediate update: 129822309.00 at gen 2400

==================================================
GP ANALYSIS - Cycle 6
  Collected 40 solutions
==================================================

[GP] ========== GENETIC PROGRAMMING ANALYSIS STARTED ==========
[GP] Cycle: 5
[GP] Input: 40 solutions received for analysis
[GP] Fitness range: best=129822312.00, worst=130871592.00
[GP] Analysis config: blocks=True, fft=False, similarity=False
[GP] Starting analysis...
[GP] Phase 1: Extracting building blocks...

*** [GPU 0] NEW GLOBAL BEST: 129822309.00 at gen 2400 ***
    Saved to best_solution.json

[GPU 0] Gen  2400 | Best: 129822309.00 | 251.9s
[GP] Phase 1 complete: Found 30 building blocks
[GP] Phase 2: FFT analysis DISABLED
[GP] Phase 3: Similarity analysis DISABLED
[GP] ========== GP ANALYSIS COMPLETE ==========


[GP] ========== CANDIDATE GENERATION STARTED ==========
[GP] Generating 20 new candidate solutions
[GP] Available data: 40 top solutions, 30 building blocks, 0 FFT patterns, 0 similarity patterns
[GP] Generation strategy: 6 block-based, 6 interpolated, 8 mutated
[GP] Strategy 1: Creating 6 candidates via building block combination...
[GP] Strategy 1 complete: 6 block-based candidates created
[GP] Strategy 2: Creating 6 candidates via solution interpolation...
[GP] Strategy 2 complete: 6 interpolated candidates created
[GP] Strategy 3: Creating 8 candidates via guided mutation...
[GP] Strategy 3 complete: 8 mutated candidates created
[GP] Total candidates generated: 20
[GP] Strategy breakdown: Block=36, Interp=36, Mut=48
[GP] ========== CANDIDATE GENERATION COMPLETE ==========


*** [GPU 0] NEW GLOBAL BEST: 129539862.00 at gen 2500 ***
    Saved to best_solution.json

[GPU 0] Gen  2500 | Best: 129539862.00 | 262.9s
[GPU 0] Gene injection: 20 candidates injected at gen 2600 (total so far: 120)

*** [GPU 0] NEW GLOBAL BEST: 129129330.00 at gen 2600 ***
    Saved to best_solution.json

[GPU 0] Gen  2600 | Best: 129129330.00 | 273.9s
  -> 20 candidates sent to 1/1 workers
[GP] gpu_0 intermediate update: 129539862.00 at gen 2500
[GP] gpu_0 intermediate update: 129129330.00 at gen 2600

*** [GPU 0] NEW GLOBAL BEST: 128829435.00 at gen 2700 ***
    Saved to best_solution.json

[GPU 0] Gen  2700 | Best: 128829435.00 | 284.9s
[GP] gpu_0 intermediate update: 128829435.00 at gen 2700
[GP] gpu_0 intermediate update: 128486476.00 at gen 2800

==================================================
GP ANALYSIS - Cycle 7
  Collected 40 solutions
==================================================

[GP] ========== GENETIC PROGRAMMING ANALYSIS STARTED ==========
[GP] Cycle: 6
[GP] Input: 40 solutions received for analysis
[GP] Fitness range: best=128486480.00, worst=129158920.00
[GP] Analysis config: blocks=True, fft=False, similarity=False
[GP] Starting analysis...
[GP] Phase 1: Extracting building blocks...

*** [GPU 0] NEW GLOBAL BEST: 128486476.00 at gen 2800 ***
    Saved to best_solution.json

[GPU 0] Gen  2800 | Best: 128486476.00 | 295.8s
[GP] Phase 1 complete: Found 30 building blocks
[GP] Phase 2: FFT analysis DISABLED
[GP] Phase 3: Similarity analysis DISABLED
[GP] ========== GP ANALYSIS COMPLETE ==========


[GP] ========== CANDIDATE GENERATION STARTED ==========
[GP] Generating 20 new candidate solutions
[GP] Available data: 40 top solutions, 30 building blocks, 0 FFT patterns, 0 similarity patterns
[GP] Generation strategy: 6 block-based, 6 interpolated, 8 mutated
[GP] Strategy 1: Creating 6 candidates via building block combination...
[GP] Strategy 1 complete: 6 block-based candidates created
[GP] Strategy 2: Creating 6 candidates via solution interpolation...
[GP] Strategy 2 complete: 6 interpolated candidates created
[GP] Strategy 3: Creating 8 candidates via guided mutation...
[GP] Strategy 3 complete: 8 mutated candidates created
[GP] Total candidates generated: 20
[GP] Strategy breakdown: Block=42, Interp=42, Mut=56
[GP] ========== CANDIDATE GENERATION COMPLETE ==========


*** [GPU 0] NEW GLOBAL BEST: 127799268.00 at gen 2900 ***
    Saved to best_solution.json

[GPU 0] Gen  2900 | Best: 127799268.00 | 306.6s
[GPU 0] Gene injection: 20 candidates injected at gen 3000 (total so far: 140)

*** [GPU 0] NEW GLOBAL BEST: 127483362.00 at gen 3000 ***
    Saved to best_solution.json

[GPU 0] Gen  3000 | Best: 127483362.00 | 317.6s
  -> 20 candidates sent to 1/1 workers
[GP] gpu_0 intermediate update: 127799268.00 at gen 2900
[GP] gpu_0 intermediate update: 127483362.00 at gen 3000
    [Checkpoint] Saved to ./results/cold_start/blocks_only/dsj1000/base/dsj1000_seed0_3000.json

*** [GPU 0] NEW GLOBAL BEST: 127197732.00 at gen 3100 ***
    Saved to best_solution.json

[GPU 0] Gen  3100 | Best: 127197732.00 | 328.4s
[GP] gpu_0 intermediate update: 127197732.00 at gen 3100
[GP] gpu_0 intermediate update: 126931919.00 at gen 3200

==================================================
GP ANALYSIS - Cycle 8
  Collected 40 solutions
==================================================

[GP] ========== GENETIC PROGRAMMING ANALYSIS STARTED ==========
[GP] Cycle: 7
[GP] Input: 40 solutions received for analysis
[GP] Fitness range: best=126931920.00, worst=127483360.00
[GP] Analysis config: blocks=True, fft=False, similarity=False
[GP] Starting analysis...
[GP] Phase 1: Extracting building blocks...

*** [GPU 0] NEW GLOBAL BEST: 126931919.00 at gen 3200 ***
    Saved to best_solution.json

[GPU 0] Gen  3200 | Best: 126931919.00 | 339.6s
[GP] Phase 1 complete: Found 30 building blocks
[GP] Phase 2: FFT analysis DISABLED
[GP] Phase 3: Similarity analysis DISABLED
[GP] ========== GP ANALYSIS COMPLETE ==========


[GP] ========== CANDIDATE GENERATION STARTED ==========
[GP] Generating 20 new candidate solutions
[GP] Available data: 40 top solutions, 30 building blocks, 0 FFT patterns, 0 similarity patterns
[GP] Generation strategy: 6 block-based, 6 interpolated, 8 mutated
[GP] Strategy 1: Creating 6 candidates via building block combination...
[GP] Strategy 1 complete: 6 block-based candidates created
[GP] Strategy 2: Creating 6 candidates via solution interpolation...
[GP] Strategy 2 complete: 6 interpolated candidates created
[GP] Strategy 3: Creating 8 candidates via guided mutation...
[GP] Strategy 3 complete: 8 mutated candidates created
[GP] Total candidates generated: 20
[GP] Strategy breakdown: Block=48, Interp=48, Mut=64
[GP] ========== CANDIDATE GENERATION COMPLETE ==========


*** [GPU 0] NEW GLOBAL BEST: 126649022.00 at gen 3300 ***
    Saved to best_solution.json

[GPU 0] Gen  3300 | Best: 126649022.00 | 350.2s
[GPU 0] Gene injection: 20 candidates injected at gen 3400 (total so far: 160)

*** [GPU 0] NEW GLOBAL BEST: 126560571.00 at gen 3400 ***
    Saved to best_solution.json

[GPU 0] Gen  3400 | Best: 126560571.00 | 360.9s
  -> 20 candidates sent to 1/1 workers
[GP] gpu_0 intermediate update: 126649022.00 at gen 3300
[GP] gpu_0 intermediate update: 126560571.00 at gen 3400

*** [GPU 0] NEW GLOBAL BEST: 126413741.00 at gen 3500 ***
    Saved to best_solution.json

[GPU 0] Gen  3500 | Best: 126413741.00 | 371.5s
[GP] gpu_0 intermediate update: 126413741.00 at gen 3500
[GP] gpu_0 intermediate update: 126099489.00 at gen 3600

==================================================
GP ANALYSIS - Cycle 9
  Collected 40 solutions
==================================================

[GP] ========== GENETIC PROGRAMMING ANALYSIS STARTED ==========
[GP] Cycle: 8
[GP] Input: 40 solutions received for analysis
[GP] Fitness range: best=126099488.00, worst=126560568.00
[GP] Analysis config: blocks=True, fft=False, similarity=False
[GP] Starting analysis...
[GP] Phase 1: Extracting building blocks...

*** [GPU 0] NEW GLOBAL BEST: 126099489.00 at gen 3600 ***
    Saved to best_solution.json

[GPU 0] Gen  3600 | Best: 126099489.00 | 382.4s
[GP] Phase 1 complete: Found 30 building blocks
[GP] Phase 2: FFT analysis DISABLED
[GP] Phase 3: Similarity analysis DISABLED
[GP] ========== GP ANALYSIS COMPLETE ==========


[GP] ========== CANDIDATE GENERATION STARTED ==========
[GP] Generating 20 new candidate solutions
[GP] Available data: 40 top solutions, 30 building blocks, 0 FFT patterns, 0 similarity patterns
[GP] Generation strategy: 6 block-based, 6 interpolated, 8 mutated
[GP] Strategy 1: Creating 6 candidates via building block combination...
[GP] Strategy 1 complete: 6 block-based candidates created
[GP] Strategy 2: Creating 6 candidates via solution interpolation...
[GP] Strategy 2 complete: 6 interpolated candidates created
[GP] Strategy 3: Creating 8 candidates via guided mutation...
[GP] Strategy 3 complete: 8 mutated candidates created
[GP] Total candidates generated: 20
[GP] Strategy breakdown: Block=54, Interp=54, Mut=72
[GP] ========== CANDIDATE GENERATION COMPLETE ==========


*** [GPU 0] NEW GLOBAL BEST: 125860432.00 at gen 3700 ***
    Saved to best_solution.json

[GPU 0] Gen  3700 | Best: 125860432.00 | 393.1s
[GPU 0] Gene injection: 20 candidates injected at gen 3800 (total so far: 180)

*** [GPU 0] NEW GLOBAL BEST: 125706657.00 at gen 3800 ***
    Saved to best_solution.json

[GPU 0] Gen  3800 | Best: 125706657.00 | 403.7s
  -> 20 candidates sent to 1/1 workers
[GP] gpu_0 intermediate update: 125860432.00 at gen 3700
[GP] gpu_0 intermediate update: 125706657.00 at gen 3800

*** [GPU 0] NEW GLOBAL BEST: 125594661.00 at gen 3900 ***
    Saved to best_solution.json

[GPU 0] Gen  3900 | Best: 125594661.00 | 414.4s
[GP] gpu_0 intermediate update: 125594661.00 at gen 3900
[GP] gpu_0 intermediate update: 125425343.00 at gen 4000

==================================================
GP ANALYSIS - Cycle 10
  Collected 40 solutions
==================================================

[GP] ========== GENETIC PROGRAMMING ANALYSIS STARTED ==========
[GP] Cycle: 9
[GP] Input: 40 solutions received for analysis
[GP] Fitness range: best=125425344.00, worst=125706656.00
[GP] Analysis config: blocks=True, fft=False, similarity=False
[GP] Starting analysis...
[GP] Phase 1: Extracting building blocks...

*** [GPU 0] NEW GLOBAL BEST: 125425343.00 at gen 4000 ***
    Saved to best_solution.json

[GPU 0] Gen  4000 | Best: 125425343.00 | 425.1s
[GP] Phase 1 complete: Found 30 building blocks
[GP] Phase 2: FFT analysis DISABLED
[GP] Phase 3: Similarity analysis DISABLED
[GP] ========== GP ANALYSIS COMPLETE ==========


[GP] ========== CANDIDATE GENERATION STARTED ==========
[GP] Generating 20 new candidate solutions
[GP] Available data: 40 top solutions, 30 building blocks, 0 FFT patterns, 0 similarity patterns
[GP] Generation strategy: 6 block-based, 6 interpolated, 8 mutated
[GP] Strategy 1: Creating 6 candidates via building block combination...
[GP] Strategy 1 complete: 6 block-based candidates created
[GP] Strategy 2: Creating 6 candidates via solution interpolation...
[GP] Strategy 2 complete: 6 interpolated candidates created
[GP] Strategy 3: Creating 8 candidates via guided mutation...
[GP] Strategy 3 complete: 8 mutated candidates created
[GP] Total candidates generated: 20
[GP] Strategy breakdown: Block=60, Interp=60, Mut=80
[GP] ========== CANDIDATE GENERATION COMPLETE ==========

    [Checkpoint] Saved to ./results/cold_start/blocks_only/dsj1000/base/dsj1000_seed0_4000.json

*** [GPU 0] NEW GLOBAL BEST: 125312810.00 at gen 4100 ***
    Saved to best_solution.json

[GPU 0] Gen  4100 | Best: 125312810.00 | 435.9s
[GPU 0] Gene injection: 20 candidates injected at gen 4200 (total so far: 200)
  -> 20 candidates sent to 1/1 workers

[CHECKPOINT] Saved B.json at gen 2000 (makespan: 125425343.00)

*** [GPU 0] NEW GLOBAL BEST: 125149757.00 at gen 4200 ***
    Saved to best_solution.json

[GPU 0] Gen  4200 | Best: 125149757.00 | 446.6s
[GP] gpu_0 intermediate update: 125312810.00 at gen 4100
[GP] gpu_0 intermediate update: 125149757.00 at gen 4200

*** [GPU 0] NEW GLOBAL BEST: 125097583.00 at gen 4300 ***
    Saved to best_solution.json

[GPU 0] Gen  4300 | Best: 125097583.00 | 457.2s
[GP] gpu_0 intermediate update: 125097583.00 at gen 4300
[GP] gpu_0 intermediate update: 124907302.00 at gen 4400

==================================================
GP ANALYSIS - Cycle 11
  Collected 40 solutions
==================================================

[GP] ========== GENETIC PROGRAMMING ANALYSIS STARTED ==========
[GP] Cycle: 10
[GP] Input: 40 solutions received for analysis
[GP] Fitness range: best=124907304.00, worst=125149760.00
[GP] Analysis config: blocks=True, fft=False, similarity=False
[GP] Starting analysis...
[GP] Phase 1: Extracting building blocks...

*** [GPU 0] NEW GLOBAL BEST: 124907302.00 at gen 4400 ***
    Saved to best_solution.json

[GPU 0] Gen  4400 | Best: 124907302.00 | 468.0s
[GP] Phase 1 complete: Found 30 building blocks
[GP] Phase 2: FFT analysis DISABLED
[GP] Phase 3: Similarity analysis DISABLED
[GP] ========== GP ANALYSIS COMPLETE ==========


[GP] ========== CANDIDATE GENERATION STARTED ==========
[GP] Generating 20 new candidate solutions
[GP] Available data: 40 top solutions, 30 building blocks, 0 FFT patterns, 0 similarity patterns
[GP] Generation strategy: 6 block-based, 6 interpolated, 8 mutated
[GP] Strategy 1: Creating 6 candidates via building block combination...
[GP] Strategy 1 complete: 6 block-based candidates created
[GP] Strategy 2: Creating 6 candidates via solution interpolation...
[GP] Strategy 2 complete: 6 interpolated candidates created
[GP] Strategy 3: Creating 8 candidates via guided mutation...
[GP] Strategy 3 complete: 8 mutated candidates created
[GP] Total candidates generated: 20
[GP] Strategy breakdown: Block=66, Interp=66, Mut=88
[GP] ========== CANDIDATE GENERATION COMPLETE ==========


*** [GPU 0] NEW GLOBAL BEST: 124691294.00 at gen 4500 ***
    Saved to best_solution.json

[GPU 0] Gen  4500 | Best: 124691294.00 | 478.6s
[GPU 0] Gene injection: 20 candidates injected at gen 4600 (total so far: 220)

*** [GPU 0] NEW GLOBAL BEST: 124643335.00 at gen 4600 ***
    Saved to best_solution.json

[GPU 0] Gen  4600 | Best: 124643335.00 | 489.2s
  -> 20 candidates sent to 1/1 workers
[GP] gpu_0 intermediate update: 124691294.00 at gen 4500
[GP] gpu_0 intermediate update: 124643335.00 at gen 4600

*** [GPU 0] NEW GLOBAL BEST: 124602729.00 at gen 4700 ***
    Saved to best_solution.json

[GPU 0] Gen  4700 | Best: 124602729.00 | 499.7s
[GP] gpu_0 intermediate update: 124602729.00 at gen 4700
[GP] gpu_0 intermediate update: 124548270.00 at gen 4800

==================================================
GP ANALYSIS - Cycle 12
  Collected 40 solutions
==================================================

[GP] ========== GENETIC PROGRAMMING ANALYSIS STARTED ==========
[GP] Cycle: 11
[GP] Input: 40 solutions received for analysis
[GP] Fitness range: best=124548272.00, worst=124643336.00
[GP] Analysis config: blocks=True, fft=False, similarity=False
[GP] Starting analysis...
[GP] Phase 1: Extracting building blocks...

*** [GPU 0] NEW GLOBAL BEST: 124548270.00 at gen 4800 ***
    Saved to best_solution.json

[GPU 0] Gen  4800 | Best: 124548270.00 | 510.3s
[GP] Phase 1 complete: Found 30 building blocks
[GP] Phase 2: FFT analysis DISABLED
[GP] Phase 3: Similarity analysis DISABLED
[GP] ========== GP ANALYSIS COMPLETE ==========


[GP] ========== CANDIDATE GENERATION STARTED ==========
[GP] Generating 20 new candidate solutions
[GP] Available data: 40 top solutions, 30 building blocks, 0 FFT patterns, 0 similarity patterns
[GP] Generation strategy: 6 block-based, 6 interpolated, 8 mutated
[GP] Strategy 1: Creating 6 candidates via building block combination...
[GP] Strategy 1 complete: 6 block-based candidates created
[GP] Strategy 2: Creating 6 candidates via solution interpolation...
[GP] Strategy 2 complete: 6 interpolated candidates created
[GP] Strategy 3: Creating 8 candidates via guided mutation...
[GP] Strategy 3 complete: 8 mutated candidates created
[GP] Total candidates generated: 20
[GP] Strategy breakdown: Block=72, Interp=72, Mut=96
[GP] ========== CANDIDATE GENERATION COMPLETE ==========


*** [GPU 0] NEW GLOBAL BEST: 124381221.00 at gen 4900 ***
    Saved to best_solution.json

[GPU 0] Gen  4900 | Best: 124381221.00 | 520.8s
[GPU 0] Gene injection: 20 candidates injected at gen 5000 (total so far: 240)
[GPU 0] Evolution complete. Sending final results...
  -> 20 candidates sent to 1/1 workers
[GP] gpu_0 intermediate update: 124381221.00 at gen 4900
[GP] gpu_0 intermediate update: 124319696.00 at gen 5000
[GP] Worker finished: gpu_0 (best=124319696.00)

[GP] All workers finished. Total GP cycles: 12

[Final Collection] Have 1/1 workers. Waiting up to 120s for remaining...

[Critical] Attempting final result collection before terminating workers...

[Results Summary] Collected 1 results:
  gpu_0: fitness=124319696.00, intermediate=False, gen=final

======================================================================
COMPLETE
======================================================================
Best: 124319696.00 from gpu_0
Time: 533.6s
Total candidates injected: 240

Solution JSON saved to ./results/cold_start/blocks_only/dsj1000/base/dsj1000_seed0.json
HTML Gantt chart saved to: ./results/cold_start/blocks_only/dsj1000/base/dsj1000_seed0.html
