Setting random seed to 0
DEBUG: proc shape: (666,), agents: 6, resources: 4, n: 666

======================================================================
LOADING INITIAL SOLUTION FROM JSON
======================================================================
Loaded heuristic solution: Savings with makespan 10853688.00
File: ./results/heuristics_only/gr666/1R20/job_times_6_heuristics.json
Makespan: 10853688.00
Status: SUCCESS - Will use as warm start
======================================================================


======================================================================
VRP-RPD SOLVER
======================================================================
Problem: 665 customers, 6 agents, k=4
Heuristic: None
Genetic Programming: Yes
Warm Start: Yes
Gene Injection: Yes
Workers: 1 GPU + 0 CPU
Generations: 5000
======================================================================

Using solution from JSON file as warm start...
  JSON solution: 10853688.00
Skipping heuristic re-computation (using JSON solution + perturbations)

Generated 6 warm start chromosomes from JSON

[GP] Starting GP collection loop (timeout: 12975s)...
[GPU 0] Warm start: 6 chromosomes

*** [GPU 0] NEW GLOBAL BEST: 7023900.00 at gen 0 ***
    Saved to best_solution.json

[GPU 0] Gen     0 | Best: 7023900.00 | 0.4s
[GP] gpu_0 first intermediate: 7023900.00 at gen 0

*** [GPU 0] NEW GLOBAL BEST: 4779357.00 at gen 100 ***
    Saved to best_solution.json

[GPU 0] Gen   100 | Best: 4779357.00 | 11.3s
[GP] gpu_0 intermediate update: 4779357.00 at gen 100
[GP] gpu_0 intermediate update: 4480584.00 at gen 200

*** [GPU 0] NEW GLOBAL BEST: 4480544.00 at gen 200 ***
    Saved to best_solution.json

[GPU 0] Gen   200 | Best: 4480544.00 | 22.1s
[GP] gpu_0 intermediate update: 4480544.00 at gen 200

*** [GPU 0] NEW GLOBAL BEST: 4309686.00 at gen 300 ***
    Saved to best_solution.json

[GPU 0] Gen   300 | Best: 4309686.00 | 32.8s
[GP] gpu_0 intermediate update: 4309686.00 at gen 300
[GP] gpu_0 intermediate update: 4224866.00 at gen 400

==================================================
GP ANALYSIS - Cycle 1
  Collected 40 solutions
==================================================

[GP] ========== GENETIC PROGRAMMING ANALYSIS STARTED ==========
[GP] Cycle: 0
[GP] Input: 40 solutions received for analysis
[GP] Fitness range: best=4224866.00, worst=4488653.00
[GP] Analysis config: blocks=True, fft=False, similarity=False
[GP] Starting analysis...
[GP] Phase 1: Extracting building blocks...

*** [GPU 0] NEW GLOBAL BEST: 4224866.00 at gen 400 ***
    Saved to best_solution.json

[GPU 0] Gen   400 | Best: 4224866.00 | 43.6s
[GP] Phase 1 complete: Found 30 building blocks
[GP] Phase 2: FFT analysis DISABLED
[GP] Phase 3: Similarity analysis DISABLED
[GP] ========== GP ANALYSIS COMPLETE ==========


[GP] ========== CANDIDATE GENERATION STARTED ==========
[GP] Generating 20 new candidate solutions
[GP] Available data: 40 top solutions, 30 building blocks, 0 FFT patterns, 0 similarity patterns
[GP] Generation strategy: 6 block-based, 6 interpolated, 8 mutated
[GP] Strategy 1: Creating 6 candidates via building block combination...
[GP] Strategy 1 complete: 6 block-based candidates created
[GP] Strategy 2: Creating 6 candidates via solution interpolation...
[GP] Strategy 2 complete: 6 interpolated candidates created
[GP] Strategy 3: Creating 8 candidates via guided mutation...
[GP] Strategy 3 complete: 8 mutated candidates created
[GP] Total candidates generated: 20
[GP] Strategy breakdown: Block=6, Interp=6, Mut=8
[GP] ========== CANDIDATE GENERATION COMPLETE ==========


*** [GPU 0] NEW GLOBAL BEST: 4161640.00 at gen 500 ***
    Saved to best_solution.json

[GPU 0] Gen   500 | Best: 4161640.00 | 54.4s
  -> 20 candidates sent to 1/1 workers
[GP] gpu_0 intermediate update: 4161640.00 at gen 500
[GPU 0] Gene injection: 20 candidates injected at gen 600 (total so far: 20)
[GP] gpu_0 intermediate update: 4096170.00 at gen 600

*** [GPU 0] NEW GLOBAL BEST: 4096170.00 at gen 600 ***
    Saved to best_solution.json

[GPU 0] Gen   600 | Best: 4096170.00 | 65.3s

*** [GPU 0] NEW GLOBAL BEST: 4034244.00 at gen 700 ***
    Saved to best_solution.json

[GPU 0] Gen   700 | Best: 4034244.00 | 76.0s
[GP] gpu_0 intermediate update: 4034244.00 at gen 700
[GP] gpu_0 intermediate update: 3967240.00 at gen 800

==================================================
GP ANALYSIS - Cycle 2
  Collected 40 solutions
==================================================

[GP] ========== GENETIC PROGRAMMING ANALYSIS STARTED ==========
[GP] Cycle: 1
[GP] Input: 40 solutions received for analysis
[GP] Fitness range: best=3967240.00, worst=4105698.00
[GP] Analysis config: blocks=True, fft=False, similarity=False
[GP] Starting analysis...
[GP] Phase 1: Extracting building blocks...

*** [GPU 0] NEW GLOBAL BEST: 3967240.00 at gen 800 ***
    Saved to best_solution.json

[GPU 0] Gen   800 | Best: 3967240.00 | 86.8s
[GP] Phase 1 complete: Found 30 building blocks
[GP] Phase 2: FFT analysis DISABLED
[GP] Phase 3: Similarity analysis DISABLED
[GP] ========== GP ANALYSIS COMPLETE ==========


[GP] ========== CANDIDATE GENERATION STARTED ==========
[GP] Generating 20 new candidate solutions
[GP] Available data: 40 top solutions, 30 building blocks, 0 FFT patterns, 0 similarity patterns
[GP] Generation strategy: 6 block-based, 6 interpolated, 8 mutated
[GP] Strategy 1: Creating 6 candidates via building block combination...
[GP] Strategy 1 complete: 6 block-based candidates created
[GP] Strategy 2: Creating 6 candidates via solution interpolation...
[GP] Strategy 2 complete: 6 interpolated candidates created
[GP] Strategy 3: Creating 8 candidates via guided mutation...
[GP] Strategy 3 complete: 8 mutated candidates created
[GP] Total candidates generated: 20
[GP] Strategy breakdown: Block=12, Interp=12, Mut=16
[GP] ========== CANDIDATE GENERATION COMPLETE ==========


*** [GPU 0] NEW GLOBAL BEST: 3933645.00 at gen 900 ***
    Saved to best_solution.json

[GPU 0] Gen   900 | Best: 3933645.00 | 97.4s
  -> 20 candidates sent to 1/1 workers
[GP] gpu_0 intermediate update: 3933645.00 at gen 900
[GPU 0] Gene injection: 20 candidates injected at gen 1000 (total so far: 40)
[GP] gpu_0 intermediate update: 3892214.00 at gen 1000

*** [GPU 0] NEW GLOBAL BEST: 3892214.00 at gen 1000 ***
    Saved to best_solution.json

[GPU 0] Gen  1000 | Best: 3892214.00 | 108.1s
    [Checkpoint] Saved to ./results/warm_start/blocks_only/gr666/1R20/job_times_6_seed0_1000.json

*** [GPU 0] NEW GLOBAL BEST: 3865881.00 at gen 1100 ***
    Saved to best_solution.json

[GPU 0] Gen  1100 | Best: 3865881.00 | 118.9s
[GP] gpu_0 intermediate update: 3865881.00 at gen 1100
[GP] gpu_0 intermediate update: 3837094.00 at gen 1200

==================================================
GP ANALYSIS - Cycle 3
  Collected 40 solutions
==================================================

[GP] ========== GENETIC PROGRAMMING ANALYSIS STARTED ==========
[GP] Cycle: 2
[GP] Input: 40 solutions received for analysis
[GP] Fitness range: best=3837094.00, worst=3892214.00
[GP] Analysis config: blocks=True, fft=False, similarity=False
[GP] Starting analysis...
[GP] Phase 1: Extracting building blocks...

*** [GPU 0] NEW GLOBAL BEST: 3837094.00 at gen 1200 ***
    Saved to best_solution.json

[GPU 0] Gen  1200 | Best: 3837094.00 | 129.7s
[GP] Phase 1 complete: Found 30 building blocks
[GP] Phase 2: FFT analysis DISABLED
[GP] Phase 3: Similarity analysis DISABLED
[GP] ========== GP ANALYSIS COMPLETE ==========


[GP] ========== CANDIDATE GENERATION STARTED ==========
[GP] Generating 20 new candidate solutions
[GP] Available data: 40 top solutions, 30 building blocks, 0 FFT patterns, 0 similarity patterns
[GP] Generation strategy: 6 block-based, 6 interpolated, 8 mutated
[GP] Strategy 1: Creating 6 candidates via building block combination...
[GP] Strategy 1 complete: 6 block-based candidates created
[GP] Strategy 2: Creating 6 candidates via solution interpolation...
[GP] Strategy 2 complete: 6 interpolated candidates created
[GP] Strategy 3: Creating 8 candidates via guided mutation...
[GP] Strategy 3 complete: 8 mutated candidates created
[GP] Total candidates generated: 20
[GP] Strategy breakdown: Block=18, Interp=18, Mut=24
[GP] ========== CANDIDATE GENERATION COMPLETE ==========


*** [GPU 0] NEW GLOBAL BEST: 3803557.00 at gen 1300 ***
    Saved to best_solution.json

[GPU 0] Gen  1300 | Best: 3803557.00 | 140.3s
  -> 20 candidates sent to 1/1 workers
[GP] gpu_0 intermediate update: 3803557.00 at gen 1300
[GPU 0] Gene injection: 20 candidates injected at gen 1400 (total so far: 60)
[GP] gpu_0 intermediate update: 3780441.00 at gen 1400

*** [GPU 0] NEW GLOBAL BEST: 3780398.00 at gen 1400 ***
    Saved to best_solution.json

[GPU 0] Gen  1400 | Best: 3780398.00 | 151.0s
[GP] gpu_0 intermediate update: 3780398.00 at gen 1400

*** [GPU 0] NEW GLOBAL BEST: 3753928.00 at gen 1500 ***
    Saved to best_solution.json

[GPU 0] Gen  1500 | Best: 3753928.00 | 161.8s
[GP] gpu_0 intermediate update: 3753928.00 at gen 1500
[GP] gpu_0 intermediate update: 3736777.00 at gen 1600

==================================================
GP ANALYSIS - Cycle 4
  Collected 40 solutions
==================================================

[GP] ========== GENETIC PROGRAMMING ANALYSIS STARTED ==========
[GP] Cycle: 3
[GP] Input: 40 solutions received for analysis
[GP] Fitness range: best=3736777.00, worst=3780441.00
[GP] Analysis config: blocks=True, fft=False, similarity=False
[GP] Starting analysis...
[GP] Phase 1: Extracting building blocks...

*** [GPU 0] NEW GLOBAL BEST: 3736777.00 at gen 1600 ***
    Saved to best_solution.json

[GPU 0] Gen  1600 | Best: 3736777.00 | 172.8s
[GP] Phase 1 complete: Found 30 building blocks
[GP] Phase 2: FFT analysis DISABLED
[GP] Phase 3: Similarity analysis DISABLED
[GP] ========== GP ANALYSIS COMPLETE ==========


[GP] ========== CANDIDATE GENERATION STARTED ==========
[GP] Generating 20 new candidate solutions
[GP] Available data: 40 top solutions, 30 building blocks, 0 FFT patterns, 0 similarity patterns
[GP] Generation strategy: 6 block-based, 6 interpolated, 8 mutated
[GP] Strategy 1: Creating 6 candidates via building block combination...
[GP] Strategy 1 complete: 6 block-based candidates created
[GP] Strategy 2: Creating 6 candidates via solution interpolation...
[GP] Strategy 2 complete: 6 interpolated candidates created
[GP] Strategy 3: Creating 8 candidates via guided mutation...
[GP] Strategy 3 complete: 8 mutated candidates created
[GP] Total candidates generated: 20
[GP] Strategy breakdown: Block=24, Interp=24, Mut=32
[GP] ========== CANDIDATE GENERATION COMPLETE ==========


*** [GPU 0] NEW GLOBAL BEST: 3723030.00 at gen 1700 ***
    Saved to best_solution.json

[GPU 0] Gen  1700 | Best: 3723030.00 | 183.4s
  -> 20 candidates sent to 1/1 workers
[GP] gpu_0 intermediate update: 3723030.00 at gen 1700
[GP] gpu_0 intermediate update: 3712758.00 at gen 1800
[GPU 0] Gene injection: 20 candidates injected at gen 1800 (total so far: 80)

*** [GPU 0] NEW GLOBAL BEST: 3712692.00 at gen 1800 ***
    Saved to best_solution.json

[GPU 0] Gen  1800 | Best: 3712692.00 | 193.9s
[GP] gpu_0 intermediate update: 3712692.00 at gen 1800

*** [GPU 0] NEW GLOBAL BEST: 3701907.00 at gen 1900 ***
    Saved to best_solution.json

[GPU 0] Gen  1900 | Best: 3701907.00 | 204.6s
[GP] gpu_0 intermediate update: 3701907.00 at gen 1900
[GP] gpu_0 intermediate update: 3694642.00 at gen 2000

==================================================
GP ANALYSIS - Cycle 5
  Collected 40 solutions
==================================================

[GP] ========== GENETIC PROGRAMMING ANALYSIS STARTED ==========
[GP] Cycle: 4
[GP] Input: 40 solutions received for analysis
[GP] Fitness range: best=3694642.00, worst=3713064.00
[GP] Analysis config: blocks=True, fft=False, similarity=False
[GP] Starting analysis...
[GP] Phase 1: Extracting building blocks...

*** [GPU 0] NEW GLOBAL BEST: 3694642.00 at gen 2000 ***
    Saved to best_solution.json

[GPU 0] Gen  2000 | Best: 3694642.00 | 215.6s
[GP] Phase 1 complete: Found 30 building blocks
[GP] Phase 2: FFT analysis DISABLED
[GP] Phase 3: Similarity analysis DISABLED
[GP] ========== GP ANALYSIS COMPLETE ==========


[GP] ========== CANDIDATE GENERATION STARTED ==========
[GP] Generating 20 new candidate solutions
[GP] Available data: 40 top solutions, 30 building blocks, 0 FFT patterns, 0 similarity patterns
[GP] Generation strategy: 6 block-based, 6 interpolated, 8 mutated
[GP] Strategy 1: Creating 6 candidates via building block combination...
[GP] Strategy 1 complete: 6 block-based candidates created
[GP] Strategy 2: Creating 6 candidates via solution interpolation...
[GP] Strategy 2 complete: 6 interpolated candidates created
[GP] Strategy 3: Creating 8 candidates via guided mutation...
[GP] Strategy 3 complete: 8 mutated candidates created
[GP] Total candidates generated: 20
[GP] Strategy breakdown: Block=30, Interp=30, Mut=40
[GP] ========== CANDIDATE GENERATION COMPLETE ==========

  -> 20 candidates sent to 1/1 workers

[CHECKPOINT] Saved A.json at gen 1000 (makespan: 3694642.00)
    [Checkpoint] Saved to ./results/warm_start/blocks_only/gr666/1R20/job_times_6_seed0_2000.json

*** [GPU 0] NEW GLOBAL BEST: 3685815.00 at gen 2100 ***
    Saved to best_solution.json

[GPU 0] Gen  2100 | Best: 3685815.00 | 226.3s
[GP] gpu_0 intermediate update: 3685815.00 at gen 2100
[GPU 0] Gene injection: 20 candidates injected at gen 2200 (total so far: 100)
[GP] gpu_0 intermediate update: 3669133.00 at gen 2200

*** [GPU 0] NEW GLOBAL BEST: 3669133.00 at gen 2200 ***
    Saved to best_solution.json

[GPU 0] Gen  2200 | Best: 3669133.00 | 237.1s

*** [GPU 0] NEW GLOBAL BEST: 3662206.00 at gen 2300 ***
    Saved to best_solution.json

[GPU 0] Gen  2300 | Best: 3662206.00 | 247.9s
[GP] gpu_0 intermediate update: 3662206.00 at gen 2300
[GP] gpu_0 intermediate update: 3649098.00 at gen 2400

==================================================
GP ANALYSIS - Cycle 6
  Collected 40 solutions
==================================================

[GP] ========== GENETIC PROGRAMMING ANALYSIS STARTED ==========
[GP] Cycle: 5
[GP] Input: 40 solutions received for analysis
[GP] Fitness range: best=3649098.00, worst=3670031.00
[GP] Analysis config: blocks=True, fft=False, similarity=False
[GP] Starting analysis...
[GP] Phase 1: Extracting building blocks...

*** [GPU 0] NEW GLOBAL BEST: 3649098.00 at gen 2400 ***
    Saved to best_solution.json

[GPU 0] Gen  2400 | Best: 3649098.00 | 258.6s
[GP] Phase 1 complete: Found 30 building blocks
[GP] Phase 2: FFT analysis DISABLED
[GP] Phase 3: Similarity analysis DISABLED
[GP] ========== GP ANALYSIS COMPLETE ==========


[GP] ========== CANDIDATE GENERATION STARTED ==========
[GP] Generating 20 new candidate solutions
[GP] Available data: 40 top solutions, 30 building blocks, 0 FFT patterns, 0 similarity patterns
[GP] Generation strategy: 6 block-based, 6 interpolated, 8 mutated
[GP] Strategy 1: Creating 6 candidates via building block combination...
[GP] Strategy 1 complete: 6 block-based candidates created
[GP] Strategy 2: Creating 6 candidates via solution interpolation...
[GP] Strategy 2 complete: 6 interpolated candidates created
[GP] Strategy 3: Creating 8 candidates via guided mutation...
[GP] Strategy 3 complete: 8 mutated candidates created
[GP] Total candidates generated: 20
[GP] Strategy breakdown: Block=36, Interp=36, Mut=48
[GP] ========== CANDIDATE GENERATION COMPLETE ==========


*** [GPU 0] NEW GLOBAL BEST: 3629237.00 at gen 2500 ***
    Saved to best_solution.json

[GPU 0] Gen  2500 | Best: 3629237.00 | 269.1s
  -> 20 candidates sent to 1/1 workers
[GP] gpu_0 intermediate update: 3629237.00 at gen 2500
[GP] gpu_0 intermediate update: 3620757.00 at gen 2600
[GPU 0] Gene injection: 20 candidates injected at gen 2600 (total so far: 120)

*** [GPU 0] NEW GLOBAL BEST: 3620559.00 at gen 2600 ***
    Saved to best_solution.json

[GPU 0] Gen  2600 | Best: 3620559.00 | 279.9s
[GP] gpu_0 intermediate update: 3620559.00 at gen 2600

*** [GPU 0] NEW GLOBAL BEST: 3619792.00 at gen 2700 ***
    Saved to best_solution.json

[GPU 0] Gen  2700 | Best: 3619792.00 | 290.9s
[GP] gpu_0 intermediate update: 3619792.00 at gen 2700
[GP] gpu_0 intermediate update: 3612414.00 at gen 2800

==================================================
GP ANALYSIS - Cycle 7
  Collected 40 solutions
==================================================

[GP] ========== GENETIC PROGRAMMING ANALYSIS STARTED ==========
[GP] Cycle: 6
[GP] Input: 40 solutions received for analysis
[GP] Fitness range: best=3612362.00, worst=3620757.00
[GP] Analysis config: blocks=True, fft=False, similarity=False
[GP] Starting analysis...
[GP] Phase 1: Extracting building blocks...

*** [GPU 0] NEW GLOBAL BEST: 3612362.00 at gen 2800 ***
    Saved to best_solution.json

[GPU 0] Gen  2800 | Best: 3612362.00 | 301.8s
[GP] Phase 1 complete: Found 30 building blocks
[GP] Phase 2: FFT analysis DISABLED
[GP] Phase 3: Similarity analysis DISABLED
[GP] ========== GP ANALYSIS COMPLETE ==========


[GP] ========== CANDIDATE GENERATION STARTED ==========
[GP] Generating 20 new candidate solutions
[GP] Available data: 40 top solutions, 30 building blocks, 0 FFT patterns, 0 similarity patterns
[GP] Generation strategy: 6 block-based, 6 interpolated, 8 mutated
[GP] Strategy 1: Creating 6 candidates via building block combination...
[GP] Strategy 1 complete: 6 block-based candidates created
[GP] Strategy 2: Creating 6 candidates via solution interpolation...
[GP] Strategy 2 complete: 6 interpolated candidates created
[GP] Strategy 3: Creating 8 candidates via guided mutation...
[GP] Strategy 3 complete: 8 mutated candidates created
[GP] Total candidates generated: 20
[GP] Strategy breakdown: Block=42, Interp=42, Mut=56
[GP] ========== CANDIDATE GENERATION COMPLETE ==========

  -> 20 candidates sent to 1/1 workers
[GP] gpu_0 intermediate update: 3612362.00 at gen 2800

*** [GPU 0] NEW GLOBAL BEST: 3606837.00 at gen 2900 ***
    Saved to best_solution.json

[GPU 0] Gen  2900 | Best: 3606837.00 | 312.6s
[GP] gpu_0 intermediate update: 3606837.00 at gen 2900
[GP] gpu_0 intermediate update: 3596900.00 at gen 3000
[GPU 0] Gene injection: 20 candidates injected at gen 3000 (total so far: 140)

*** [GPU 0] NEW GLOBAL BEST: 3596900.00 at gen 3000 ***
    Saved to best_solution.json

[GPU 0] Gen  3000 | Best: 3596900.00 | 323.1s
    [Checkpoint] Saved to ./results/warm_start/blocks_only/gr666/1R20/job_times_6_seed0_3000.json

*** [GPU 0] NEW GLOBAL BEST: 3589751.00 at gen 3100 ***
    Saved to best_solution.json

[GPU 0] Gen  3100 | Best: 3589751.00 | 334.0s
[GP] gpu_0 intermediate update: 3589751.00 at gen 3100
[GP] gpu_0 intermediate update: 3580933.00 at gen 3200

==================================================
GP ANALYSIS - Cycle 8
  Collected 40 solutions
==================================================

[GP] ========== GENETIC PROGRAMMING ANALYSIS STARTED ==========
[GP] Cycle: 7
[GP] Input: 40 solutions received for analysis
[GP] Fitness range: best=3580933.00, worst=3596900.00
[GP] Analysis config: blocks=True, fft=False, similarity=False
[GP] Starting analysis...
[GP] Phase 1: Extracting building blocks...

*** [GPU 0] NEW GLOBAL BEST: 3580933.00 at gen 3200 ***
    Saved to best_solution.json

[GPU 0] Gen  3200 | Best: 3580933.00 | 344.7s
[GP] Phase 1 complete: Found 30 building blocks
[GP] Phase 2: FFT analysis DISABLED
[GP] Phase 3: Similarity analysis DISABLED
[GP] ========== GP ANALYSIS COMPLETE ==========


[GP] ========== CANDIDATE GENERATION STARTED ==========
[GP] Generating 20 new candidate solutions
[GP] Available data: 40 top solutions, 30 building blocks, 0 FFT patterns, 0 similarity patterns
[GP] Generation strategy: 6 block-based, 6 interpolated, 8 mutated
[GP] Strategy 1: Creating 6 candidates via building block combination...
[GP] Strategy 1 complete: 6 block-based candidates created
[GP] Strategy 2: Creating 6 candidates via solution interpolation...
[GP] Strategy 2 complete: 6 interpolated candidates created
[GP] Strategy 3: Creating 8 candidates via guided mutation...
[GP] Strategy 3 complete: 8 mutated candidates created
[GP] Total candidates generated: 20
[GP] Strategy breakdown: Block=48, Interp=48, Mut=64
[GP] ========== CANDIDATE GENERATION COMPLETE ==========


*** [GPU 0] NEW GLOBAL BEST: 3566500.00 at gen 3300 ***
    Saved to best_solution.json

[GPU 0] Gen  3300 | Best: 3566500.00 | 355.2s
  -> 20 candidates sent to 1/1 workers
[GP] gpu_0 intermediate update: 3566500.00 at gen 3300
[GPU 0] Gene injection: 20 candidates injected at gen 3400 (total so far: 160)
[GP] gpu_0 intermediate update: 3559308.00 at gen 3400

*** [GPU 0] NEW GLOBAL BEST: 3559308.00 at gen 3400 ***
    Saved to best_solution.json

[GPU 0] Gen  3400 | Best: 3559308.00 | 365.8s

*** [GPU 0] NEW GLOBAL BEST: 3550038.00 at gen 3500 ***
    Saved to best_solution.json

[GPU 0] Gen  3500 | Best: 3550038.00 | 376.4s
[GP] gpu_0 intermediate update: 3550038.00 at gen 3500
[GP] gpu_0 intermediate update: 3544607.00 at gen 3600

==================================================
GP ANALYSIS - Cycle 9
  Collected 40 solutions
==================================================

[GP] ========== GENETIC PROGRAMMING ANALYSIS STARTED ==========
[GP] Cycle: 8
[GP] Input: 40 solutions received for analysis
[GP] Fitness range: best=3544607.00, worst=3559308.00
[GP] Analysis config: blocks=True, fft=False, similarity=False
[GP] Starting analysis...
[GP] Phase 1: Extracting building blocks...

*** [GPU 0] NEW GLOBAL BEST: 3544607.00 at gen 3600 ***
    Saved to best_solution.json

[GPU 0] Gen  3600 | Best: 3544607.00 | 387.2s
[GP] Phase 1 complete: Found 30 building blocks
[GP] Phase 2: FFT analysis DISABLED
[GP] Phase 3: Similarity analysis DISABLED
[GP] ========== GP ANALYSIS COMPLETE ==========


[GP] ========== CANDIDATE GENERATION STARTED ==========
[GP] Generating 20 new candidate solutions
[GP] Available data: 40 top solutions, 30 building blocks, 0 FFT patterns, 0 similarity patterns
[GP] Generation strategy: 6 block-based, 6 interpolated, 8 mutated
[GP] Strategy 1: Creating 6 candidates via building block combination...
[GP] Strategy 1 complete: 6 block-based candidates created
[GP] Strategy 2: Creating 6 candidates via solution interpolation...
[GP] Strategy 2 complete: 6 interpolated candidates created
[GP] Strategy 3: Creating 8 candidates via guided mutation...
[GP] Strategy 3 complete: 8 mutated candidates created
[GP] Total candidates generated: 20
[GP] Strategy breakdown: Block=54, Interp=54, Mut=72
[GP] ========== CANDIDATE GENERATION COMPLETE ==========


*** [GPU 0] NEW GLOBAL BEST: 3534111.00 at gen 3700 ***
    Saved to best_solution.json

[GPU 0] Gen  3700 | Best: 3534111.00 | 398.0s
  -> 20 candidates sent to 1/1 workers
[GP] gpu_0 intermediate update: 3534111.00 at gen 3700
[GP] gpu_0 intermediate update: 3520115.00 at gen 3800
[GPU 0] Gene injection: 20 candidates injected at gen 3800 (total so far: 180)

*** [GPU 0] NEW GLOBAL BEST: 3520115.00 at gen 3800 ***
    Saved to best_solution.json

[GPU 0] Gen  3800 | Best: 3520115.00 | 408.7s

*** [GPU 0] NEW GLOBAL BEST: 3503970.00 at gen 3900 ***
    Saved to best_solution.json

[GPU 0] Gen  3900 | Best: 3503970.00 | 419.4s
[GP] gpu_0 intermediate update: 3503970.00 at gen 3900
[GP] gpu_0 intermediate update: 3498719.00 at gen 4000

==================================================
GP ANALYSIS - Cycle 10
  Collected 40 solutions
==================================================

[GP] ========== GENETIC PROGRAMMING ANALYSIS STARTED ==========
[GP] Cycle: 9
[GP] Input: 40 solutions received for analysis
[GP] Fitness range: best=3498719.00, worst=3520115.00
[GP] Analysis config: blocks=True, fft=False, similarity=False
[GP] Starting analysis...
[GP] Phase 1: Extracting building blocks...

*** [GPU 0] NEW GLOBAL BEST: 3498719.00 at gen 4000 ***
    Saved to best_solution.json

[GPU 0] Gen  4000 | Best: 3498719.00 | 430.1s
[GP] Phase 1 complete: Found 30 building blocks
[GP] Phase 2: FFT analysis DISABLED
[GP] Phase 3: Similarity analysis DISABLED
[GP] ========== GP ANALYSIS COMPLETE ==========


[GP] ========== CANDIDATE GENERATION STARTED ==========
[GP] Generating 20 new candidate solutions
[GP] Available data: 40 top solutions, 30 building blocks, 0 FFT patterns, 0 similarity patterns
[GP] Generation strategy: 6 block-based, 6 interpolated, 8 mutated
[GP] Strategy 1: Creating 6 candidates via building block combination...
[GP] Strategy 1 complete: 6 block-based candidates created
[GP] Strategy 2: Creating 6 candidates via solution interpolation...
[GP] Strategy 2 complete: 6 interpolated candidates created
[GP] Strategy 3: Creating 8 candidates via guided mutation...
[GP] Strategy 3 complete: 8 mutated candidates created
[GP] Total candidates generated: 20
[GP] Strategy breakdown: Block=60, Interp=60, Mut=80
[GP] ========== CANDIDATE GENERATION COMPLETE ==========

    [Checkpoint] Saved to ./results/warm_start/blocks_only/gr666/1R20/job_times_6_seed0_4000.json
  -> 20 candidates sent to 1/1 workers

[CHECKPOINT] Saved B.json at gen 2000 (makespan: 3498719.00)

*** [GPU 0] NEW GLOBAL BEST: 3495283.00 at gen 4100 ***
    Saved to best_solution.json

[GPU 0] Gen  4100 | Best: 3495283.00 | 440.8s
[GP] gpu_0 intermediate update: 3495283.00 at gen 4100
[GP] gpu_0 intermediate update: 3491862.00 at gen 4200
[GPU 0] Gene injection: 20 candidates injected at gen 4200 (total so far: 200)

*** [GPU 0] NEW GLOBAL BEST: 3491862.00 at gen 4200 ***
    Saved to best_solution.json

[GPU 0] Gen  4200 | Best: 3491862.00 | 451.8s

*** [GPU 0] NEW GLOBAL BEST: 3489183.00 at gen 4300 ***
    Saved to best_solution.json

[GPU 0] Gen  4300 | Best: 3489183.00 | 462.8s
[GP] gpu_0 intermediate update: 3489183.00 at gen 4300
[GP] gpu_0 intermediate update: 3486900.00 at gen 4400

==================================================
GP ANALYSIS - Cycle 11
  Collected 40 solutions
==================================================

[GP] ========== GENETIC PROGRAMMING ANALYSIS STARTED ==========
[GP] Cycle: 10
[GP] Input: 40 solutions received for analysis
[GP] Fitness range: best=3486900.00, worst=3491862.00
[GP] Analysis config: blocks=True, fft=False, similarity=False
[GP] Starting analysis...
[GP] Phase 1: Extracting building blocks...

*** [GPU 0] NEW GLOBAL BEST: 3486900.00 at gen 4400 ***
    Saved to best_solution.json

[GPU 0] Gen  4400 | Best: 3486900.00 | 473.8s
[GP] Phase 1 complete: Found 30 building blocks
[GP] Phase 2: FFT analysis DISABLED
[GP] Phase 3: Similarity analysis DISABLED
[GP] ========== GP ANALYSIS COMPLETE ==========


[GP] ========== CANDIDATE GENERATION STARTED ==========
[GP] Generating 20 new candidate solutions
[GP] Available data: 40 top solutions, 30 building blocks, 0 FFT patterns, 0 similarity patterns
[GP] Generation strategy: 6 block-based, 6 interpolated, 8 mutated
[GP] Strategy 1: Creating 6 candidates via building block combination...
[GP] Strategy 1 complete: 6 block-based candidates created
[GP] Strategy 2: Creating 6 candidates via solution interpolation...
[GP] Strategy 2 complete: 6 interpolated candidates created
[GP] Strategy 3: Creating 8 candidates via guided mutation...
[GP] Strategy 3 complete: 8 mutated candidates created
[GP] Total candidates generated: 20
[GP] Strategy breakdown: Block=66, Interp=66, Mut=88
[GP] ========== CANDIDATE GENERATION COMPLETE ==========


*** [GPU 0] NEW GLOBAL BEST: 3484002.00 at gen 4500 ***
    Saved to best_solution.json

[GPU 0] Gen  4500 | Best: 3484002.00 | 484.6s
  -> 20 candidates sent to 1/1 workers
[GP] gpu_0 intermediate update: 3484002.00 at gen 4500
[GP] gpu_0 intermediate update: 3482347.00 at gen 4600
[GPU 0] Gene injection: 20 candidates injected at gen 4600 (total so far: 220)

*** [GPU 0] NEW GLOBAL BEST: 3482347.00 at gen 4600 ***
    Saved to best_solution.json

[GPU 0] Gen  4600 | Best: 3482347.00 | 495.4s

*** [GPU 0] NEW GLOBAL BEST: 3480029.00 at gen 4700 ***
    Saved to best_solution.json

[GPU 0] Gen  4700 | Best: 3480029.00 | 506.3s
[GP] gpu_0 intermediate update: 3480029.00 at gen 4700
[GP] gpu_0 intermediate update: 3478654.00 at gen 4800

==================================================
GP ANALYSIS - Cycle 12
  Collected 40 solutions
==================================================

[GP] ========== GENETIC PROGRAMMING ANALYSIS STARTED ==========
[GP] Cycle: 11
[GP] Input: 40 solutions received for analysis
[GP] Fitness range: best=3478654.00, worst=3482347.00
[GP] Analysis config: blocks=True, fft=False, similarity=False
[GP] Starting analysis...
[GP] Phase 1: Extracting building blocks...

*** [GPU 0] NEW GLOBAL BEST: 3478654.00 at gen 4800 ***
    Saved to best_solution.json

[GPU 0] Gen  4800 | Best: 3478654.00 | 517.2s
[GP] Phase 1 complete: Found 30 building blocks
[GP] Phase 2: FFT analysis DISABLED
[GP] Phase 3: Similarity analysis DISABLED
[GP] ========== GP ANALYSIS COMPLETE ==========


[GP] ========== CANDIDATE GENERATION STARTED ==========
[GP] Generating 20 new candidate solutions
[GP] Available data: 40 top solutions, 30 building blocks, 0 FFT patterns, 0 similarity patterns
[GP] Generation strategy: 6 block-based, 6 interpolated, 8 mutated
[GP] Strategy 1: Creating 6 candidates via building block combination...
[GP] Strategy 1 complete: 6 block-based candidates created
[GP] Strategy 2: Creating 6 candidates via solution interpolation...
[GP] Strategy 2 complete: 6 interpolated candidates created
[GP] Strategy 3: Creating 8 candidates via guided mutation...
[GP] Strategy 3 complete: 8 mutated candidates created
[GP] Total candidates generated: 20
[GP] Strategy breakdown: Block=72, Interp=72, Mut=96
[GP] ========== CANDIDATE GENERATION COMPLETE ==========

[GPU 0] Gen  4900 | Best: 3478654.00 | 528.0s
[GPU 0] Gene injection: 20 candidates injected at gen 5000 (total so far: 240)
[GPU 0] Evolution complete. Sending final results...
  -> 20 candidates sent to 1/1 workers
[GP] Worker finished: gpu_0 (best=3478654.00)

[GP] All workers finished. Total GP cycles: 12

[Final Collection] Have 1/1 workers. Waiting up to 120s for remaining...

[Critical] Attempting final result collection before terminating workers...

[Results Summary] Collected 1 results:
  gpu_0: fitness=3478654.00, intermediate=False, gen=final

======================================================================
COMPLETE
======================================================================
Best: 3478654.00 from gpu_0
  (Improved 67.9% over heuristic 10853688.00)
Time: 541.1s
Total candidates injected: 240

Solution JSON saved to ./results/warm_start/blocks_only/gr666/1R20/job_times_6_seed0.json
HTML Gantt chart saved to: ./results/warm_start/blocks_only/gr666/1R20/job_times_6_seed0.html
