Setting random seed to 0
DEBUG: proc shape: (783,), agents: 6, resources: 4, n: 783

======================================================================
LOADING INITIAL SOLUTION FROM JSON
======================================================================
Loaded heuristic solution: Savings with makespan 194322.00
File: ./results/heuristics_only/rat783/1R10/job_times_5_heuristics.json
Makespan: 194322.00
Status: SUCCESS - Will use as warm start
======================================================================


======================================================================
VRP-RPD SOLVER
======================================================================
Problem: 782 customers, 6 agents, k=4
Heuristic: None
Genetic Programming: Yes
Warm Start: Yes
Gene Injection: Yes
Workers: 1 GPU + 0 CPU
Generations: 5000
======================================================================

Using solution from JSON file as warm start...
  JSON solution: 194322.00
Skipping heuristic re-computation (using JSON solution + perturbations)

Generated 6 warm start chromosomes from JSON

[GP] Starting GP collection loop (timeout: 12975s)...
[GPU 0] Warm start: 6 chromosomes

*** [GPU 0] NEW GLOBAL BEST: 151445.00 at gen 0 ***
    Saved to best_solution.json

[GPU 0] Gen     0 | Best: 151445.00 | 0.7s
[GP] gpu_0 first intermediate: 151445.00 at gen 0

*** [GPU 0] NEW GLOBAL BEST: 112715.00 at gen 100 ***
    Saved to best_solution.json

[GPU 0] Gen   100 | Best: 112715.00 | 13.7s
[GP] gpu_0 intermediate update: 112715.00 at gen 100
[GP] gpu_0 intermediate update: 106552.00 at gen 200

*** [GPU 0] NEW GLOBAL BEST: 106552.00 at gen 200 ***
    Saved to best_solution.json

[GPU 0] Gen   200 | Best: 106552.00 | 26.8s

*** [GPU 0] NEW GLOBAL BEST: 102913.00 at gen 300 ***
    Saved to best_solution.json

[GPU 0] Gen   300 | Best: 102913.00 | 39.9s
[GP] gpu_0 intermediate update: 102913.00 at gen 300
[GP] gpu_0 intermediate update: 99946.00 at gen 400

==================================================
GP ANALYSIS - Cycle 1
  Collected 40 solutions
==================================================

[GP] ========== GENETIC PROGRAMMING ANALYSIS STARTED ==========
[GP] Cycle: 0
[GP] Input: 40 solutions received for analysis
[GP] Fitness range: best=99946.00, worst=106841.00
[GP] Analysis config: blocks=True, fft=False, similarity=False
[GP] Starting analysis...
[GP] Phase 1: Extracting building blocks...

*** [GPU 0] NEW GLOBAL BEST: 99946.00 at gen 400 ***
    Saved to best_solution.json

[GPU 0] Gen   400 | Best: 99946.00 | 53.3s
[GP] Phase 1 complete: Found 30 building blocks
[GP] Phase 2: FFT analysis DISABLED
[GP] Phase 3: Similarity analysis DISABLED
[GP] ========== GP ANALYSIS COMPLETE ==========


[GP] ========== CANDIDATE GENERATION STARTED ==========
[GP] Generating 20 new candidate solutions
[GP] Available data: 40 top solutions, 30 building blocks, 0 FFT patterns, 0 similarity patterns
[GP] Generation strategy: 6 block-based, 6 interpolated, 8 mutated
[GP] Strategy 1: Creating 6 candidates via building block combination...
[GP] Strategy 1 complete: 6 block-based candidates created
[GP] Strategy 2: Creating 6 candidates via solution interpolation...
[GP] Strategy 2 complete: 6 interpolated candidates created
[GP] Strategy 3: Creating 8 candidates via guided mutation...
[GP] Strategy 3 complete: 8 mutated candidates created
[GP] Total candidates generated: 20
[GP] Strategy breakdown: Block=6, Interp=6, Mut=8
[GP] ========== CANDIDATE GENERATION COMPLETE ==========


*** [GPU 0] NEW GLOBAL BEST: 97190.00 at gen 500 ***
    Saved to best_solution.json

[GPU 0] Gen   500 | Best: 97190.00 | 66.6s
[GPU 0] Gene injection: 20 candidates injected at gen 600 (total so far: 20)
  -> 20 candidates sent to 1/1 workers
[GP] gpu_0 intermediate update: 97190.00 at gen 500
[GP] gpu_0 intermediate update: 95646.00 at gen 600

*** [GPU 0] NEW GLOBAL BEST: 95646.00 at gen 600 ***
    Saved to best_solution.json

[GPU 0] Gen   600 | Best: 95646.00 | 78.8s

*** [GPU 0] NEW GLOBAL BEST: 93916.00 at gen 700 ***
    Saved to best_solution.json

[GPU 0] Gen   700 | Best: 93916.00 | 92.2s
[GP] gpu_0 intermediate update: 93916.00 at gen 700
[GP] gpu_0 intermediate update: 92353.00 at gen 800

==================================================
GP ANALYSIS - Cycle 2
  Collected 40 solutions
==================================================

[GP] ========== GENETIC PROGRAMMING ANALYSIS STARTED ==========
[GP] Cycle: 1
[GP] Input: 40 solutions received for analysis
[GP] Fitness range: best=92353.00, worst=95664.00
[GP] Analysis config: blocks=True, fft=False, similarity=False
[GP] Starting analysis...
[GP] Phase 1: Extracting building blocks...

*** [GPU 0] NEW GLOBAL BEST: 92353.00 at gen 800 ***
    Saved to best_solution.json

[GPU 0] Gen   800 | Best: 92353.00 | 105.3s
[GP] Phase 1 complete: Found 30 building blocks
[GP] Phase 2: FFT analysis DISABLED
[GP] Phase 3: Similarity analysis DISABLED
[GP] ========== GP ANALYSIS COMPLETE ==========


[GP] ========== CANDIDATE GENERATION STARTED ==========
[GP] Generating 20 new candidate solutions
[GP] Available data: 40 top solutions, 30 building blocks, 0 FFT patterns, 0 similarity patterns
[GP] Generation strategy: 6 block-based, 6 interpolated, 8 mutated
[GP] Strategy 1: Creating 6 candidates via building block combination...
[GP] Strategy 1 complete: 6 block-based candidates created
[GP] Strategy 2: Creating 6 candidates via solution interpolation...
[GP] Strategy 2 complete: 6 interpolated candidates created
[GP] Strategy 3: Creating 8 candidates via guided mutation...
[GP] Strategy 3 complete: 8 mutated candidates created
[GP] Total candidates generated: 20
[GP] Strategy breakdown: Block=12, Interp=12, Mut=16
[GP] ========== CANDIDATE GENERATION COMPLETE ==========


*** [GPU 0] NEW GLOBAL BEST: 91379.00 at gen 900 ***
    Saved to best_solution.json

[GPU 0] Gen   900 | Best: 91379.00 | 118.4s
[GPU 0] Gene injection: 20 candidates injected at gen 1000 (total so far: 40)
  -> 20 candidates sent to 1/1 workers
[GP] gpu_0 intermediate update: 91379.00 at gen 900
[GP] gpu_0 intermediate update: 90627.00 at gen 1000

*** [GPU 0] NEW GLOBAL BEST: 90627.00 at gen 1000 ***
    Saved to best_solution.json

[GPU 0] Gen  1000 | Best: 90627.00 | 131.6s
    [Checkpoint] Saved to ./results/warm_start/blocks_only/rat783/1R10/job_times_5_seed0_1000.json

*** [GPU 0] NEW GLOBAL BEST: 89626.00 at gen 1100 ***
    Saved to best_solution.json

[GPU 0] Gen  1100 | Best: 89626.00 | 145.1s
[GP] gpu_0 intermediate update: 89626.00 at gen 1100
[GP] gpu_0 intermediate update: 89178.00 at gen 1200

==================================================
GP ANALYSIS - Cycle 3
  Collected 40 solutions
==================================================

[GP] ========== GENETIC PROGRAMMING ANALYSIS STARTED ==========
[GP] Cycle: 2
[GP] Input: 40 solutions received for analysis
[GP] Fitness range: best=89159.00, worst=90652.00
[GP] Analysis config: blocks=True, fft=False, similarity=False
[GP] Starting analysis...
[GP] Phase 1: Extracting building blocks...

*** [GPU 0] NEW GLOBAL BEST: 89159.00 at gen 1200 ***
[GP] Phase 1 complete: Found 30 building blocks
[GP] Phase 2: FFT analysis DISABLED
[GP] Phase 3: Similarity analysis DISABLED
[GP] ========== GP ANALYSIS COMPLETE ==========


[GP] ========== CANDIDATE GENERATION STARTED ==========
[GP] Generating 20 new candidate solutions
[GP] Available data: 40 top solutions, 30 building blocks, 0 FFT patterns, 0 similarity patterns
[GP] Generation strategy: 6 block-based, 6 interpolated, 8 mutated
[GP] Strategy 1: Creating 6 candidates via building block combination...
    Saved to best_solution.json

[GPU 0] Gen  1200 | Best: 89159.00 | 158.1s
[GP] Strategy 1 complete: 6 block-based candidates created
[GP] Strategy 2: Creating 6 candidates via solution interpolation...
[GP] Strategy 2 complete: 6 interpolated candidates created
[GP] Strategy 3: Creating 8 candidates via guided mutation...
[GP] Strategy 3 complete: 8 mutated candidates created
[GP] Total candidates generated: 20
[GP] Strategy breakdown: Block=18, Interp=18, Mut=24
[GP] ========== CANDIDATE GENERATION COMPLETE ==========


*** [GPU 0] NEW GLOBAL BEST: 88503.00 at gen 1300 ***
    Saved to best_solution.json

[GPU 0] Gen  1300 | Best: 88503.00 | 171.0s
[GPU 0] Gene injection: 20 candidates injected at gen 1400 (total so far: 60)
  -> 20 candidates sent to 1/1 workers
[GP] gpu_0 intermediate update: 89159.00 at gen 1200
[GP] gpu_0 intermediate update: 88503.00 at gen 1300
[GP] gpu_0 intermediate update: 87385.00 at gen 1400

*** [GPU 0] NEW GLOBAL BEST: 87360.00 at gen 1400 ***
    Saved to best_solution.json

[GPU 0] Gen  1400 | Best: 87360.00 | 184.0s
[GP] gpu_0 intermediate update: 87360.00 at gen 1400

*** [GPU 0] NEW GLOBAL BEST: 86838.00 at gen 1500 ***
    Saved to best_solution.json

[GPU 0] Gen  1500 | Best: 86838.00 | 197.2s
[GP] gpu_0 intermediate update: 86838.00 at gen 1500
[GP] gpu_0 intermediate update: 86506.00 at gen 1600

==================================================
GP ANALYSIS - Cycle 4
  Collected 40 solutions
==================================================

[GP] ========== GENETIC PROGRAMMING ANALYSIS STARTED ==========
[GP] Cycle: 3
[GP] Input: 40 solutions received for analysis
[GP] Fitness range: best=86506.00, worst=87396.00
[GP] Analysis config: blocks=True, fft=False, similarity=False
[GP] Starting analysis...
[GP] Phase 1: Extracting building blocks...

*** [GPU 0] NEW GLOBAL BEST: 86506.00 at gen 1600 ***
    Saved to best_solution.json

[GPU 0] Gen  1600 | Best: 86506.00 | 210.3s
[GP] Phase 1 complete: Found 30 building blocks
[GP] Phase 2: FFT analysis DISABLED
[GP] Phase 3: Similarity analysis DISABLED
[GP] ========== GP ANALYSIS COMPLETE ==========


[GP] ========== CANDIDATE GENERATION STARTED ==========
[GP] Generating 20 new candidate solutions
[GP] Available data: 40 top solutions, 30 building blocks, 0 FFT patterns, 0 similarity patterns
[GP] Generation strategy: 6 block-based, 6 interpolated, 8 mutated
[GP] Strategy 1: Creating 6 candidates via building block combination...
[GP] Strategy 1 complete: 6 block-based candidates created
[GP] Strategy 2: Creating 6 candidates via solution interpolation...
[GP] Strategy 2 complete: 6 interpolated candidates created
[GP] Strategy 3: Creating 8 candidates via guided mutation...
[GP] Strategy 3 complete: 8 mutated candidates created
[GP] Total candidates generated: 20
[GP] Strategy breakdown: Block=24, Interp=24, Mut=32
[GP] ========== CANDIDATE GENERATION COMPLETE ==========


*** [GPU 0] NEW GLOBAL BEST: 85955.00 at gen 1700 ***
    Saved to best_solution.json

[GPU 0] Gen  1700 | Best: 85955.00 | 223.4s
[GPU 0] Gene injection: 20 candidates injected at gen 1800 (total so far: 80)
  -> 20 candidates sent to 1/1 workers
[GP] gpu_0 intermediate update: 85955.00 at gen 1700
[GP] gpu_0 intermediate update: 85630.00 at gen 1800

*** [GPU 0] NEW GLOBAL BEST: 85630.00 at gen 1800 ***
    Saved to best_solution.json

[GPU 0] Gen  1800 | Best: 85630.00 | 236.6s

*** [GPU 0] NEW GLOBAL BEST: 85243.00 at gen 1900 ***
    Saved to best_solution.json

[GPU 0] Gen  1900 | Best: 85243.00 | 250.0s
[GP] gpu_0 intermediate update: 85243.00 at gen 1900
[GP] gpu_0 intermediate update: 85035.00 at gen 2000

==================================================
GP ANALYSIS - Cycle 5
  Collected 40 solutions
==================================================

[GP] ========== GENETIC PROGRAMMING ANALYSIS STARTED ==========
[GP] Cycle: 4
[GP] Input: 40 solutions received for analysis
[GP] Fitness range: best=85035.00, worst=85630.00
[GP] Analysis config: blocks=True, fft=False, similarity=False
[GP] Starting analysis...
[GP] Phase 1: Extracting building blocks...

*** [GPU 0] NEW GLOBAL BEST: 85035.00 at gen 2000 ***
    Saved to best_solution.json

[GPU 0] Gen  2000 | Best: 85035.00 | 263.2s
    [Checkpoint] Saved to ./results/warm_start/blocks_only/rat783/1R10/job_times_5_seed0_2000.json
[GP] Phase 1 complete: Found 30 building blocks
[GP] Phase 2: FFT analysis DISABLED
[GP] Phase 3: Similarity analysis DISABLED
[GP] ========== GP ANALYSIS COMPLETE ==========


[GP] ========== CANDIDATE GENERATION STARTED ==========
[GP] Generating 20 new candidate solutions
[GP] Available data: 40 top solutions, 30 building blocks, 0 FFT patterns, 0 similarity patterns
[GP] Generation strategy: 6 block-based, 6 interpolated, 8 mutated
[GP] Strategy 1: Creating 6 candidates via building block combination...
[GP] Strategy 1 complete: 6 block-based candidates created
[GP] Strategy 2: Creating 6 candidates via solution interpolation...
[GP] Strategy 2 complete: 6 interpolated candidates created
[GP] Strategy 3: Creating 8 candidates via guided mutation...
[GP] Strategy 3 complete: 8 mutated candidates created
[GP] Total candidates generated: 20
[GP] Strategy breakdown: Block=30, Interp=30, Mut=40
[GP] ========== CANDIDATE GENERATION COMPLETE ==========


*** [GPU 0] NEW GLOBAL BEST: 84725.00 at gen 2100 ***
    Saved to best_solution.json

[GPU 0] Gen  2100 | Best: 84725.00 | 276.2s
[GPU 0] Gene injection: 20 candidates injected at gen 2200 (total so far: 100)
  -> 20 candidates sent to 1/1 workers

[CHECKPOINT] Saved A.json at gen 1000 (makespan: 85035.00)

*** [GPU 0] NEW GLOBAL BEST: 84273.00 at gen 2200 ***
    Saved to best_solution.json

[GPU 0] Gen  2200 | Best: 84273.00 | 289.1s
[GP] gpu_0 intermediate update: 84725.00 at gen 2100
[GP] gpu_0 intermediate update: 84351.00 at gen 2200
[GP] gpu_0 intermediate update: 84273.00 at gen 2200

*** [GPU 0] NEW GLOBAL BEST: 83831.00 at gen 2300 ***
    Saved to best_solution.json

[GPU 0] Gen  2300 | Best: 83831.00 | 302.0s
[GP] gpu_0 intermediate update: 83831.00 at gen 2300
[GP] gpu_0 intermediate update: 83306.00 at gen 2400

==================================================
GP ANALYSIS - Cycle 6
  Collected 40 solutions
==================================================

[GP] ========== GENETIC PROGRAMMING ANALYSIS STARTED ==========
[GP] Cycle: 5
[GP] Input: 40 solutions received for analysis
[GP] Fitness range: best=83306.00, worst=84351.00
[GP] Analysis config: blocks=True, fft=False, similarity=False
[GP] Starting analysis...
[GP] Phase 1: Extracting building blocks...

*** [GPU 0] NEW GLOBAL BEST: 83306.00 at gen 2400 ***
    Saved to best_solution.json

[GPU 0] Gen  2400 | Best: 83306.00 | 315.2s
[GP] Phase 1 complete: Found 30 building blocks
[GP] Phase 2: FFT analysis DISABLED
[GP] Phase 3: Similarity analysis DISABLED
[GP] ========== GP ANALYSIS COMPLETE ==========


[GP] ========== CANDIDATE GENERATION STARTED ==========
[GP] Generating 20 new candidate solutions
[GP] Available data: 40 top solutions, 30 building blocks, 0 FFT patterns, 0 similarity patterns
[GP] Generation strategy: 6 block-based, 6 interpolated, 8 mutated
[GP] Strategy 1: Creating 6 candidates via building block combination...
[GP] Strategy 1 complete: 6 block-based candidates created
[GP] Strategy 2: Creating 6 candidates via solution interpolation...
[GP] Strategy 2 complete: 6 interpolated candidates created
[GP] Strategy 3: Creating 8 candidates via guided mutation...
[GP] Strategy 3 complete: 8 mutated candidates created
[GP] Total candidates generated: 20
[GP] Strategy breakdown: Block=36, Interp=36, Mut=48
[GP] ========== CANDIDATE GENERATION COMPLETE ==========


*** [GPU 0] NEW GLOBAL BEST: 83100.00 at gen 2500 ***
    Saved to best_solution.json

[GPU 0] Gen  2500 | Best: 83100.00 | 328.2s
[GPU 0] Gene injection: 20 candidates injected at gen 2600 (total so far: 120)

*** [GPU 0] NEW GLOBAL BEST: 82768.00 at gen 2600 ***
    Saved to best_solution.json

[GPU 0] Gen  2600 | Best: 82768.00 | 341.5s
  -> 20 candidates sent to 1/1 workers
[GP] gpu_0 intermediate update: 83100.00 at gen 2500
[GP] gpu_0 intermediate update: 82768.00 at gen 2600

*** [GPU 0] NEW GLOBAL BEST: 82569.00 at gen 2700 ***
    Saved to best_solution.json

[GPU 0] Gen  2700 | Best: 82569.00 | 354.4s
[GP] gpu_0 intermediate update: 82569.00 at gen 2700
[GP] gpu_0 intermediate update: 82338.00 at gen 2800

==================================================
GP ANALYSIS - Cycle 7
  Collected 40 solutions
==================================================

[GP] ========== GENETIC PROGRAMMING ANALYSIS STARTED ==========
[GP] Cycle: 6
[GP] Input: 40 solutions received for analysis
[GP] Fitness range: best=82321.00, worst=82768.00
[GP] Analysis config: blocks=True, fft=False, similarity=False
[GP] Starting analysis...
[GP] Phase 1: Extracting building blocks...

*** [GPU 0] NEW GLOBAL BEST: 82321.00 at gen 2800 ***
    Saved to best_solution.json

[GPU 0] Gen  2800 | Best: 82321.00 | 367.9s
[GP] Phase 1 complete: Found 30 building blocks
[GP] Phase 2: FFT analysis DISABLED
[GP] Phase 3: Similarity analysis DISABLED
[GP] ========== GP ANALYSIS COMPLETE ==========


[GP] ========== CANDIDATE GENERATION STARTED ==========
[GP] Generating 20 new candidate solutions
[GP] Available data: 40 top solutions, 30 building blocks, 0 FFT patterns, 0 similarity patterns
[GP] Generation strategy: 6 block-based, 6 interpolated, 8 mutated
[GP] Strategy 1: Creating 6 candidates via building block combination...
[GP] Strategy 1 complete: 6 block-based candidates created
[GP] Strategy 2: Creating 6 candidates via solution interpolation...
[GP] Strategy 2 complete: 6 interpolated candidates created
[GP] Strategy 3: Creating 8 candidates via guided mutation...
[GP] Strategy 3 complete: 8 mutated candidates created
[GP] Total candidates generated: 20
[GP] Strategy breakdown: Block=42, Interp=42, Mut=56
[GP] ========== CANDIDATE GENERATION COMPLETE ==========


*** [GPU 0] NEW GLOBAL BEST: 82160.00 at gen 2900 ***
    Saved to best_solution.json

[GPU 0] Gen  2900 | Best: 82160.00 | 381.0s
[GPU 0] Gene injection: 20 candidates injected at gen 3000 (total so far: 140)

*** [GPU 0] NEW GLOBAL BEST: 81881.00 at gen 3000 ***
    Saved to best_solution.json

[GPU 0] Gen  3000 | Best: 81881.00 | 393.9s
  -> 20 candidates sent to 1/1 workers
[GP] gpu_0 intermediate update: 82321.00 at gen 2800
[GP] gpu_0 intermediate update: 82160.00 at gen 2900
[GP] gpu_0 intermediate update: 81881.00 at gen 3000
    [Checkpoint] Saved to ./results/warm_start/blocks_only/rat783/1R10/job_times_5_seed0_3000.json

*** [GPU 0] NEW GLOBAL BEST: 81657.00 at gen 3100 ***
    Saved to best_solution.json

[GPU 0] Gen  3100 | Best: 81657.00 | 406.4s
[GP] gpu_0 intermediate update: 81657.00 at gen 3100
[GP] gpu_0 intermediate update: 81453.00 at gen 3200

==================================================
GP ANALYSIS - Cycle 8
  Collected 40 solutions
==================================================

[GP] ========== GENETIC PROGRAMMING ANALYSIS STARTED ==========
[GP] Cycle: 7
[GP] Input: 40 solutions received for analysis
[GP] Fitness range: best=81453.00, worst=81881.00
[GP] Analysis config: blocks=True, fft=False, similarity=False
[GP] Starting analysis...
[GP] Phase 1: Extracting building blocks...

*** [GPU 0] NEW GLOBAL BEST: 81453.00 at gen 3200 ***
    Saved to best_solution.json

[GPU 0] Gen  3200 | Best: 81453.00 | 419.9s
[GP] Phase 1 complete: Found 30 building blocks
[GP] Phase 2: FFT analysis DISABLED
[GP] Phase 3: Similarity analysis DISABLED
[GP] ========== GP ANALYSIS COMPLETE ==========


[GP] ========== CANDIDATE GENERATION STARTED ==========
[GP] Generating 20 new candidate solutions
[GP] Available data: 40 top solutions, 30 building blocks, 0 FFT patterns, 0 similarity patterns
[GP] Generation strategy: 6 block-based, 6 interpolated, 8 mutated
[GP] Strategy 1: Creating 6 candidates via building block combination...
[GP] Strategy 1 complete: 6 block-based candidates created
[GP] Strategy 2: Creating 6 candidates via solution interpolation...
[GP] Strategy 2 complete: 6 interpolated candidates created
[GP] Strategy 3: Creating 8 candidates via guided mutation...
[GP] Strategy 3 complete: 8 mutated candidates created
[GP] Total candidates generated: 20
[GP] Strategy breakdown: Block=48, Interp=48, Mut=64
[GP] ========== CANDIDATE GENERATION COMPLETE ==========


*** [GPU 0] NEW GLOBAL BEST: 81434.00 at gen 3300 ***
    Saved to best_solution.json

[GPU 0] Gen  3300 | Best: 81434.00 | 433.2s
[GPU 0] Gene injection: 20 candidates injected at gen 3400 (total so far: 160)

*** [GPU 0] NEW GLOBAL BEST: 81170.00 at gen 3400 ***
    Saved to best_solution.json

[GPU 0] Gen  3400 | Best: 81170.00 | 445.9s
  -> 20 candidates sent to 1/1 workers
[GP] gpu_0 intermediate update: 81434.00 at gen 3300
[GP] gpu_0 intermediate update: 81170.00 at gen 3400

*** [GPU 0] NEW GLOBAL BEST: 80932.00 at gen 3500 ***
    Saved to best_solution.json

[GPU 0] Gen  3500 | Best: 80932.00 | 459.1s
[GP] gpu_0 intermediate update: 80932.00 at gen 3500
[GP] gpu_0 intermediate update: 80689.00 at gen 3600

==================================================
GP ANALYSIS - Cycle 9
  Collected 40 solutions
==================================================

[GP] ========== GENETIC PROGRAMMING ANALYSIS STARTED ==========
[GP] Cycle: 8
[GP] Input: 40 solutions received for analysis
[GP] Fitness range: best=80689.00, worst=81207.00
[GP] Analysis config: blocks=True, fft=False, similarity=False
[GP] Starting analysis...
[GP] Phase 1: Extracting building blocks...

*** [GPU 0] NEW GLOBAL BEST: 80689.00 at gen 3600 ***
    Saved to best_solution.json

[GPU 0] Gen  3600 | Best: 80689.00 | 472.3s
[GP] Phase 1 complete: Found 30 building blocks
[GP] Phase 2: FFT analysis DISABLED
[GP] Phase 3: Similarity analysis DISABLED
[GP] ========== GP ANALYSIS COMPLETE ==========


[GP] ========== CANDIDATE GENERATION STARTED ==========
[GP] Generating 20 new candidate solutions
[GP] Available data: 40 top solutions, 30 building blocks, 0 FFT patterns, 0 similarity patterns
[GP] Generation strategy: 6 block-based, 6 interpolated, 8 mutated
[GP] Strategy 1: Creating 6 candidates via building block combination...
[GP] Strategy 1 complete: 6 block-based candidates created
[GP] Strategy 2: Creating 6 candidates via solution interpolation...
[GP] Strategy 2 complete: 6 interpolated candidates created
[GP] Strategy 3: Creating 8 candidates via guided mutation...
[GP] Strategy 3 complete: 8 mutated candidates created
[GP] Total candidates generated: 20
[GP] Strategy breakdown: Block=54, Interp=54, Mut=72
[GP] ========== CANDIDATE GENERATION COMPLETE ==========


*** [GPU 0] NEW GLOBAL BEST: 80591.00 at gen 3700 ***
    Saved to best_solution.json

[GPU 0] Gen  3700 | Best: 80591.00 | 485.3s
[GPU 0] Gene injection: 20 candidates injected at gen 3800 (total so far: 180)
  -> 20 candidates sent to 1/1 workers
[GP] gpu_0 intermediate update: 80591.00 at gen 3700
[GP] gpu_0 intermediate update: 80488.00 at gen 3800

*** [GPU 0] NEW GLOBAL BEST: 80488.00 at gen 3800 ***
    Saved to best_solution.json

[GPU 0] Gen  3800 | Best: 80488.00 | 498.9s

*** [GPU 0] NEW GLOBAL BEST: 80423.00 at gen 3900 ***
    Saved to best_solution.json

[GPU 0] Gen  3900 | Best: 80423.00 | 511.8s
[GP] gpu_0 intermediate update: 80423.00 at gen 3900

==================================================
GP ANALYSIS - Cycle 10
  Collected 40 solutions
==================================================

[GP] ========== GENETIC PROGRAMMING ANALYSIS STARTED ==========
[GP] Cycle: 9
[GP] Input: 40 solutions received for analysis
[GP] Fitness range: best=80423.00, worst=80488.00
[GP] Analysis config: blocks=True, fft=False, similarity=False
[GP] Starting analysis...
[GP] Phase 1: Extracting building blocks...
[GPU 0] Gen  4000 | Best: 80423.00 | 525.1s
    [Checkpoint] Saved to ./results/warm_start/blocks_only/rat783/1R10/job_times_5_seed0_4000.json
[GP] Phase 1 complete: Found 30 building blocks
[GP] Phase 2: FFT analysis DISABLED
[GP] Phase 3: Similarity analysis DISABLED
[GP] ========== GP ANALYSIS COMPLETE ==========


[GP] ========== CANDIDATE GENERATION STARTED ==========
[GP] Generating 20 new candidate solutions
[GP] Available data: 40 top solutions, 30 building blocks, 0 FFT patterns, 0 similarity patterns
[GP] Generation strategy: 6 block-based, 6 interpolated, 8 mutated
[GP] Strategy 1: Creating 6 candidates via building block combination...
[GP] Strategy 1 complete: 6 block-based candidates created
[GP] Strategy 2: Creating 6 candidates via solution interpolation...
[GP] Strategy 2 complete: 6 interpolated candidates created
[GP] Strategy 3: Creating 8 candidates via guided mutation...
[GP] Strategy 3 complete: 8 mutated candidates created
[GP] Total candidates generated: 20
[GP] Strategy breakdown: Block=60, Interp=60, Mut=80
[GP] ========== CANDIDATE GENERATION COMPLETE ==========

[GPU 0] Gen  4100 | Best: 80423.00 | 538.4s
[GPU 0] Gene injection: 20 candidates injected at gen 4200 (total so far: 200)
  -> 20 candidates sent to 1/1 workers

[CHECKPOINT] Saved B.json at gen 2000 (makespan: 80423.00)

*** [GPU 0] NEW GLOBAL BEST: 80353.00 at gen 4200 ***
    Saved to best_solution.json

[GPU 0] Gen  4200 | Best: 80353.00 | 551.9s
[GP] gpu_0 intermediate update: 80353.00 at gen 4200

*** [GPU 0] NEW GLOBAL BEST: 80279.00 at gen 4300 ***
    Saved to best_solution.json

[GPU 0] Gen  4300 | Best: 80279.00 | 564.9s
[GP] gpu_0 intermediate update: 80279.00 at gen 4300
[GP] gpu_0 intermediate update: 80172.00 at gen 4400

==================================================
GP ANALYSIS - Cycle 11
  Collected 40 solutions
==================================================

[GP] ========== GENETIC PROGRAMMING ANALYSIS STARTED ==========
[GP] Cycle: 10
[GP] Input: 40 solutions received for analysis
[GP] Fitness range: best=80165.00, worst=80353.00
[GP] Analysis config: blocks=True, fft=False, similarity=False
[GP] Starting analysis...
[GP] Phase 1: Extracting building blocks...

*** [GPU 0] NEW GLOBAL BEST: 80165.00 at gen 4400 ***
    Saved to best_solution.json

[GPU 0] Gen  4400 | Best: 80165.00 | 578.2s
[GP] Phase 1 complete: Found 30 building blocks
[GP] Phase 2: FFT analysis DISABLED
[GP] Phase 3: Similarity analysis DISABLED
[GP] ========== GP ANALYSIS COMPLETE ==========


[GP] ========== CANDIDATE GENERATION STARTED ==========
[GP] Generating 20 new candidate solutions
[GP] Available data: 40 top solutions, 30 building blocks, 0 FFT patterns, 0 similarity patterns
[GP] Generation strategy: 6 block-based, 6 interpolated, 8 mutated
[GP] Strategy 1: Creating 6 candidates via building block combination...
[GP] Strategy 1 complete: 6 block-based candidates created
[GP] Strategy 2: Creating 6 candidates via solution interpolation...
[GP] Strategy 2 complete: 6 interpolated candidates created
[GP] Strategy 3: Creating 8 candidates via guided mutation...
[GP] Strategy 3 complete: 8 mutated candidates created
[GP] Total candidates generated: 20
[GP] Strategy breakdown: Block=66, Interp=66, Mut=88
[GP] ========== CANDIDATE GENERATION COMPLETE ==========


*** [GPU 0] NEW GLOBAL BEST: 80054.00 at gen 4500 ***
    Saved to best_solution.json

[GPU 0] Gen  4500 | Best: 80054.00 | 590.5s
[GPU 0] Gene injection: 20 candidates injected at gen 4600 (total so far: 220)
  -> 20 candidates sent to 1/1 workers
[GP] gpu_0 intermediate update: 80165.00 at gen 4400
[GP] gpu_0 intermediate update: 80054.00 at gen 4500
[GP] gpu_0 intermediate update: 79886.00 at gen 4600

*** [GPU 0] NEW GLOBAL BEST: 79886.00 at gen 4600 ***
    Saved to best_solution.json

[GPU 0] Gen  4600 | Best: 79886.00 | 602.8s

*** [GPU 0] NEW GLOBAL BEST: 79876.00 at gen 4700 ***
    Saved to best_solution.json

[GPU 0] Gen  4700 | Best: 79876.00 | 615.0s
[GP] gpu_0 intermediate update: 79876.00 at gen 4700
[GP] gpu_0 intermediate update: 79662.00 at gen 4800

==================================================
GP ANALYSIS - Cycle 12
  Collected 40 solutions
==================================================

[GP] ========== GENETIC PROGRAMMING ANALYSIS STARTED ==========
[GP] Cycle: 11
[GP] Input: 40 solutions received for analysis
[GP] Fitness range: best=79656.00, worst=79886.00
[GP] Analysis config: blocks=True, fft=False, similarity=False
[GP] Starting analysis...
[GP] Phase 1: Extracting building blocks...

*** [GPU 0] NEW GLOBAL BEST: 79656.00 at gen 4800 ***
    Saved to best_solution.json

[GPU 0] Gen  4800 | Best: 79656.00 | 627.5s
[GP] Phase 1 complete: Found 30 building blocks
[GP] Phase 2: FFT analysis DISABLED
[GP] Phase 3: Similarity analysis DISABLED
[GP] ========== GP ANALYSIS COMPLETE ==========


[GP] ========== CANDIDATE GENERATION STARTED ==========
[GP] Generating 20 new candidate solutions
[GP] Available data: 40 top solutions, 30 building blocks, 0 FFT patterns, 0 similarity patterns
[GP] Generation strategy: 6 block-based, 6 interpolated, 8 mutated
[GP] Strategy 1: Creating 6 candidates via building block combination...
[GP] Strategy 1 complete: 6 block-based candidates created
[GP] Strategy 2: Creating 6 candidates via solution interpolation...
[GP] Strategy 2 complete: 6 interpolated candidates created
[GP] Strategy 3: Creating 8 candidates via guided mutation...
[GP] Strategy 3 complete: 8 mutated candidates created
[GP] Total candidates generated: 20
[GP] Strategy breakdown: Block=72, Interp=72, Mut=96
[GP] ========== CANDIDATE GENERATION COMPLETE ==========

[GPU 0] Gen  4900 | Best: 79656.00 | 639.7s
[GPU 0] Gene injection: 20 candidates injected at gen 5000 (total so far: 240)
[GPU 0] Evolution complete. Sending final results...
  -> 20 candidates sent to 1/1 workers
[GP] gpu_0 intermediate update: 79656.00 at gen 4800
[GP] Worker finished: gpu_0 (best=79656.00)

[GP] All workers finished. Total GP cycles: 12

[Final Collection] Have 1/1 workers. Waiting up to 120s for remaining...

[Critical] Attempting final result collection before terminating workers...

[Results Summary] Collected 1 results:
  gpu_0: fitness=79656.00, intermediate=False, gen=final

======================================================================
COMPLETE
======================================================================
Best: 79656.00 from gpu_0
  (Improved 59.0% over heuristic 194322.00)
Time: 654.8s
Total candidates injected: 240

Solution JSON saved to ./results/warm_start/blocks_only/rat783/1R10/job_times_5_seed0.json
HTML Gantt chart saved to: ./results/warm_start/blocks_only/rat783/1R10/job_times_5_seed0.html
